,topic,subreddit,title,score,id,url,created,body
0,cybercrime,conspiracy,FIREFOX SEND end to end encryption taken down,14,hvx2en,https://www.reddit.com/r/conspiracy/comments/hvx2en/firefox_send_end_to_end_encryption_taken_down/,2020-07-23 02:38:02,"SS: Firefox Send has been temporarily taken down. It was a great alternative to googledrive which provided end to end encryption. I just find the reason for the takedown to be quite silly due to people receiving malware. Does Wetransfer, googledrive, dropbox provide virus scans? &gt; Over the past few months, Firefox Send has been used to store payloads for all sorts of cybercrime operations, from [ransomware](URL to [financial crime](URL and from [banking trojans](URL to [spyware used to target human rights defenders](URL source: [URL"
1,cybercrime,conspiracy,Fmr. Presidential Adviser Gets 10 Years for Holding 14yo Boy Captive as His Sex Slave The Free Thought Project,1,hiv5tv,https://www.reddit.com/r/conspiracy/comments/hiv5tv/fmr_presidential_adviser_gets_10_years_for/,2020-07-01 06:08:59,"THIS IS EXACTLY WHY WE CAN NEVER GIVE UP IN OUR FIGHT AGAINST THE NEW WORLD ORDER, this is the new world order they want, we do whatever we want, and you do whatever we say, or we switch off your accounts-if your lucky. ALEXANDRIA, Va.[ (CN)](URL  Once an informal adviser to President Donald Trump and later a witness for the Mueller probe, George Nader was sentenced to 10 years in prison Friday for possession of child pornography and transporting a minor into the United States for sex. The 61-year-old Lebanese-American businessman appeared in U.S. District Court for the Eastern District of Virginia this afternoon, donning a faded prison jumpsuit and a black mask that covered much of his face. [Nader pleaded guilty](URL in March, less than a year after federal prosecutors charged him over graphic images found on multiple devices belonging to Nader, including videos of toddler-age boys engaging in sex acts with young goats and other farm animals. Prosecutors added the sex-trafficking charge in July, saying Nader had arranged in 2000 to transport a 14-year-old boy from the Czech Republic to his home in Washington, D.C. Holding onto the minors passport, Nader had told the teen and his mother that they would go to prison if they tried to report him. Two decades later, Naders victim is married with a young son and lives in the Czech Republic. His name was not revealed in court Friday as he teleconferenced into Naders sentencing hearing to read a roughly four-minute statement. Its been a long journey, the man said in Czech, his testimony read back to the court through an interpreter. My health is bad. I have ulcers. I stopped eating. I had nightmares. I am still dealing with those now. Saying he hated himself and was ashamed, Naders victim said that, since becoming a father, he is plagued by fear that someone could do to his child what was done to him. Nader agreed to pay the victim $150,000 in restitution. U.S. District Judge Leonie Brinkema also fined Nader $25,000. Jay Prabhu, an assistant U.S. attorney and chief of his offices Cybercrime Unit, told the court Friday that Nader is a repeat offender but that the minimum sentence of 10 years was enough punishment for Nader, given his past cooperation with prosecutors and his promise to compensate the victim. Nader previously served six months in prison in 1991 after he was convicted of transporting child pornography in the United States. His skin pallid and voice quiet in court Friday, Nader recited a 2-page statement while standing behind a plastic partition that was installed as a safety measure against the novel coronavirus. Im so sorry to all involved and here today, Nader said. There is nothing else I can say. The last year has been the most difficult of my life. Naders only family are miles away. His sister lives in Lebanon, and his brother in California. Because of the pandemic, he has been unable to see them. He emphasized Friday how difficult that has been. Its been very painful for me, he said. Ive listened to whats been said about me, and I can say Im deeply sorry for the pain Ive caused. I am deeply and sincerely sorry for my actions.  I hope you are able to see my true effort to stay on the correct path. Please believe me when I say there will never be a need for me to appear before another court ever again. According to his testimony before a grand jury during former special counsel Robert Muellers probe of Russian interference in the 2016 election, Nader was tapped by Trumps first presidential campaign team to offer his diplomatic and political insights into the Middle East. Naders professional relationships with power players there, like Sheikh Mohammed bin Zayed al-Nahyan, the United Arab Emirates crown prince, was seen as a boon by the Trump transition team. Nader was eventually able to secure a Trump Tower meeting in December 2016 with the crown prince, President Trumps son-in-law Jared Kushner and the campaigns chief strategist at the time, Steve Bannon. The meetings focus was to convince Kushner and Bannon that, with Trump elected, America should cool its longtime alliance with Qatar, a longtime enemy of the U.A.E. Trumps then-finance chairman, Elliott Broidy, also promoted an anti-Qatar agenda. Broidy ended up receiving a $2.5 million check from Nader in April 2018 that, according to an investigative report first published by the Associated Press, resulted in the bankrolling of anti-Qatar initiatives in Congress and later, donations to lawmakers like California Republican Ed Royce, who as chairman of the House Foreign Affairs committee at the time, backed the shift in foreign policy. Nader awaits sentencing for separate federal charges in Washington related to his coordination of illegal foreign contributions to President Trumps inaugural fund as well as Hilary Clintons 2016 presidential campaign. Defense attorney Jonathan Jeffress told Judge Brinkema that Naders age and health merit consideration in sentencing. Nader is prediabetic and had a quadruple bypass just months before his arrest. When he was arrested at Dulles International Airport in 2018, he was coming to the U.S. to receive rehabilitative treatment for his heart, Jeffress said. Given that 20 years has elapsed since Nader transported his victim, Jeffress said the potential for Nader repeating the conduct was nonexistent. He also said that the only fundamental disagreement between prosecutors and the defense was that Nader still exhibits a pattern or proclivity for child pornography. These are things Mr. Nader has largely put behind him, Jeffress said. Brinkema was not convinced, noting during the 2018 arrest that there were more than 50 graphic images found on Naders phone  images that prosecutor Prabhu said obviously depicted children sexually or in pain. Prabhu pointed out that Naders criminality stemmed as far back as 1984 when he was investigated for receiving child pornography. That case was ultimately thrown out because the search that uncovered the porn was faulty. I raise these issues not to embarrass Mr. Nader or shock the court. I raise it because it shows he has a persistent issue with this, Prabhu said before also calling the former Trump campaign adviser a persistent and dangerous voyeur for years. Jeffress disagreed, saying that the images shared with Nader by his cohorts in the Middle East were widely regarded as dirty jokes. It meets the definition of obscenity but its not child pornography that someone would use to stimulate themselves, Jeffress said. from [URL"
2,cybercrime,conspiracy,Fmr. Presidential Adviser Gets 10 Years for Holding 14yo Boy Captive as His Sex Slave The Free Thought Project,8,hivdsw,https://www.reddit.com/r/conspiracy/comments/hivdsw/fmr_presidential_adviser_gets_10_years_for/,2020-07-01 06:19:43,"&amp;#x200B; ALEXANDRIA, Va.[ (CN)](URL  Once an informal adviser to President Donald Trump and later a witness for the Mueller probe, George Nader was sentenced to 10 years in prison Friday for possession of child pornography and transporting a minor into the United States for sex. The 61-year-old Lebanese-American businessman appeared in U.S. District Court for the Eastern District of Virginia this afternoon, donning a faded prison jumpsuit and a black mask that covered much of his face. [Nader pleaded guilty](URL in March, less than a year after federal prosecutors charged him over graphic images found on multiple devices belonging to Nader, including videos of toddler-age boys engaging in sex acts with young goats and other farm animals. Prosecutors added the sex-trafficking charge in July, saying Nader had arranged in 2000 to transport a 14-year-old boy from the Czech Republic to his home in Washington, D.C. Holding onto the minors passport, Nader had told the teen and his mother that they would go to prison if they tried to report him. Two decades later, Naders victim is married with a young son and lives in the Czech Republic. His name was not revealed in court Friday as he teleconferenced into Naders sentencing hearing to read a roughly four-minute statement. Its been a long journey, the man said in Czech, his testimony read back to the court through an interpreter. My health is bad. I have ulcers. I stopped eating. I had nightmares. I am still dealing with those now. Saying he hated himself and was ashamed, Naders victim said that, since becoming a father, he is plagued by fear that someone could do to his child what was done to him. Nader agreed to pay the victim $150,000 in restitution. U.S. District Judge Leonie Brinkema also fined Nader $25,000. Jay Prabhu, an assistant U.S. attorney and chief of his offices Cybercrime Unit, told the court Friday that Nader is a repeat offender but that the minimum sentence of 10 years was enough punishment for Nader, given his past cooperation with prosecutors and his promise to compensate the victim. Nader previously served six months in prison in 1991 after he was convicted of transporting child pornography in the United States. His skin pallid and voice quiet in court Friday, Nader recited a 2-page statement while standing behind a plastic partition that was installed as a safety measure against the novel coronavirus. Im so sorry to all involved and here today, Nader said. There is nothing else I can say. The last year has been the most difficult of my life. Naders only family are miles away. His sister lives in Lebanon, and his brother in California. Because of the pandemic, he has been unable to see them. He emphasized Friday how difficult that has been. Its been very painful for me, he said. Ive listened to whats been said about me, and I can say Im deeply sorry for the pain Ive caused. I am deeply and sincerely sorry for my actions.  I hope you are able to see my true effort to stay on the correct path. Please believe me when I say there will never be a need for me to appear before another court ever again. According to his testimony before a grand jury during former special counsel Robert Muellers probe of Russian interference in the 2016 election, Nader was tapped by Trumps first presidential campaign team to offer his diplomatic and political insights into the Middle East. Naders professional relationships with power players there, like Sheikh Mohammed bin Zayed al-Nahyan, the United Arab Emirates crown prince, was seen as a boon by the Trump transition team. Nader was eventually able to secure a Trump Tower meeting in December 2016 with the crown prince, President Trumps son-in-law Jared Kushner and the campaigns chief strategist at the time, Steve Bannon. The meetings focus was to convince Kushner and Bannon that, with Trump elected, America should cool its longtime alliance with Qatar, a longtime enemy of the U.A.E. Trumps then-finance chairman, Elliott Broidy, also promoted an anti-Qatar agenda. Broidy ended up receiving a $2.5 million check from Nader in April 2018 that, according to an investigative report first published by the Associated Press, resulted in the bankrolling of anti-Qatar initiatives in Congress and later, donations to lawmakers like California Republican Ed Royce, who as chairman of the House Foreign Affairs committee at the time, backed the shift in foreign policy. Nader awaits sentencing for separate federal charges in Washington related to his coordination of illegal foreign contributions to President Trumps inaugural fund as well as Hilary Clintons 2016 presidential campaign. Defense attorney Jonathan Jeffress told Judge Brinkema that Naders age and health merit consideration in sentencing. Nader is prediabetic and had a quadruple bypass just months before his arrest. When he was arrested at Dulles International Airport in 2018, he was coming to the U.S. to receive rehabilitative treatment for his heart, Jeffress said. Given that 20 years has elapsed since Nader transported his victim, Jeffress said the potential for Nader repeating the conduct was nonexistent. He also said that the only fundamental disagreement between prosecutors and the defense was that Nader still exhibits a pattern or proclivity for child pornography. These are things Mr. Nader has largely put behind him, Jeffress said. Brinkema was not convinced, noting during the 2018 arrest that there were more than 50 graphic images found on Naders phone  images that prosecutor Prabhu said obviously depicted children sexually or in pain. Prabhu pointed out that Naders criminality stemmed as far back as 1984 when he was investigated for receiving child pornography. That case was ultimately thrown out because the search that uncovered the porn was faulty. I raise these issues not to embarrass Mr. Nader or shock the court. I raise it because it shows he has a persistent issue with this, Prabhu said before also calling the former Trump campaign adviser a persistent and dangerous voyeur for years. Jeffress disagreed, saying that the images shared with Nader by his cohorts in the Middle East were widely regarded as dirty jokes. It meets the definition of obscenity but its not child pornography that someone would use to stimulate themselves, Jeffress said."
3,cybercrime,conspiracy,I Bring You Important News! (Part 6),1,e76g4o,https://www.reddit.com/r/conspiracy/comments/e76g4o/i_bring_you_important_news_part_6/,2019-12-07 10:31:38,"""A string of recent attacks on churches in Nicaragua, where anti-government protesters have held hunger strikes to demand the release of political prisoners, shows how President Daniel Ortega continues to violently suppress dissent, more than a year after putting down a popular uprising. Catholic churches and cathedrals have become new sites of protest for Nicaraguans still pushing for their political rights despite a government crackdown that has included outlawing public demonstrations."" URL ""Almost eleven months ago, in the first days of 2019, I was forced to go into exile with my wife to protect my physical integrity and freedom, in the face of threats and persecution of the Ortega-Murillo regime, after the illegal police occupation of the newsroom of Confidencial and the imprisonment of my 100% Noticias journalist colleagues, Miguel Mora and Lucia Pineda Ubau."" URL """"Lebanon has paid the price for permanent conflicts, as well as that of Palestinian asylum and Syrian displacement,"" Bassil added, shedding light on the fact that many Lebanese have lost their jobs to foreign workers...""The prevailing chaos in Lebanon, which some abroad have prepared for, will be the ruin of the country (..).The result will be an imbalance on the internal scene, yet Lebanon does not want any more divisions,"" Bassil maintained."""" URL ""the Department of Justice seems to be keeping just as busy tackling foreign cybersecurity threats. On Thursday, the U.S. announced sanctions against a Russian cybercrime organization with the slightly too-on-the-nose name Evil Corp and offered a record $5 million reward for assistance leading to the arrest of the organizations leaders, Igor Turashev and Maksim Yakubets. Previously, the largest reward that had been offered for a cybercriminals arrest by the FBI was $3 million for Evgeniy Bogachev, the head of another Russian cybercrime ring."" URL ""Bennetts hardline policy not to return bodily remains is intended to serve as a deterrent; potential terrorists will know that they wont be treated as heroes and their bodies will stay in Israeli hands."" URL ""Israel signed an agreement on Thursday to sell the Czech Republic eight Iron Dome air-defense systems in a contract worth $125 million, announced Israels Defense Ministry...The Israeli Aerospace Industries subsidiary ELTA will provide eight ELM-2084 Iron Dome multi-mission radars, which have air-surveillance, air-defense and artillery capabilities."" URL ""The sanctions target Qais Al Khazali, leader of the Asaib Ahl Al Haq Iran-backed militia and his brother Laith Al Khazali, another leader of the group...They also target Hussein Falih Al Lami, security chief for the Popular Mobilization Forces (PMF), Iraqs state umbrella group of paramilitary factions, which is dominated by groups backed by Iran, including Asaib."" URL "" and former California Governor Arnold Schwarzenegger said that environmental protection efforts need to be bigger than just focusing on President Donald Trump...In an appearance on Meet The Press Sunday, Schwarzenegger and former Secretary of State John Kerry spoke about their efforts to bring awareness to climate change and environmental issues through World War Zero, a climate coalition that includes both men as members."" URL ""Several major coal mines in eastern Germany were hit by protests on Saturday as activists criticized the German government's climate change plans and urged an immediate coal phase-out."" URL ""Pressure is growing on Boris Johnson to explain why the London Bridge terrorist was freed from prison to carry out the attack, a decision branded quite incredible by one terror expert...The release of Usman Khan  who killed two people, before being shot dead by police  has become a major general election controversy, with questions also being asked about the apparent failure to monitor him."" URL ""On Thursday, London's Metropolitan Police Service (MPS) released a statement reiterating that it won't be pursuing criminal charges against Jeffrey Epstein or an unnamed British woman presumed to be his alleged madam Ghislaine Maxwell."" URL ""...pressure on the summit to strengthen the implementation of the 2015 Paris Agreement on limiting the rise in temperature...""Our war against nature must stop, and we know that it is possible, Guterres said ahead of the Dec. 2-13 summit."" URL ""Although the United States is unlikely to risk angering Beijing further by sending warships on a port call to the self-ruled island, many Taiwanese internet users said the southern port city of Kaoshiung would win big if the Americans did decide to visit...The US military has never made an official port call to Taiwan, while Beijing opposes all forms of military exchanges between Washington and Taipei...Although Washington does not have official diplomatic relations with Taiwan, it has supported the island unofficially including through arms sales, joint military training programmes and high-level exchanges."" URL ""Germany is to tighten its laws against anti-Semitic hate crimes in the wake of last month's failed attack on a synagogue by a far-Right gunman."" URL ""The three-year-old son of a Ukranian politician has been shot dead during an assassination attempt on his father...Vyacheslav Sobolev, a businessman and member of the Kiev regional council, was at the wheel of his Range Rover when gunmen opened fire in the countrys capital, Kiev, on Sunday."" URL ""Chinas military is increasingly using scientific expeditions as a means of pushing into the mineral-rich Arctic, a new spy report has concluded."" URL ""Social media giants must crack down on anti-vaccination posts that are fuelling Samoa's deadly measles epidemic from afar, UNICEF's Pacific islands chief said Thursday...Sheldon Yett, the regional representative for the UN children's agency, said ""incredibly irresponsible"" online material on platforms such as Twitter, Facebook and Instagram had exacerbated the Samoa measles outbreak -- which has claimed 62 lives since mid-October -- by discouraging immunisation."" URL ""A billionaire hedge fund manager and backer of Extinction Rebellion has warned he will begin taking action against companies that do not do enough to tackle the climate emergency...Sir Christopher Hohn, founder of TCI Fund Management, which manages more than $28bn (21bn) of assets, has sent letters to big companies in which it invests, including Google and Airbus."" URL ""The parents of Harry Dunn have launched legal action against the Foreign and Commonwealth Office (FCO) over its granting of diplomatic immunity to US national Anne Sacoolas...Harry, 19, died August 27 after his motorbike collided head-on with Anne Sacoolas car, resulting in horrific injuries. Sacoolas had reportedly been driving on the wrong side of the road for up to 400 metres. The accident took place outside the Royal Air Force (RAF) base at Croughton, Northamptonshire in the East Midlands. The US Air Force runs a spy facility from the base known as the Joint Intelligence Analysis Centre where Sacoolass husband Jonathan was employed by the US National Security Agency (NSA)."" URL ""On Monday, Taiwanese political commentator Paul Lin (), an expert on China affairs and frequent Taipei Timescontributor, wrote an article in the Chinese-language Liberty Times (the Taipei Times sister newspaper) to elucidate the military intelligence context of Wangs espionage case and provide a detailed political background of Xiang and his wife...According to Lin, if the cases basic elements are real, it would be the largest espionage network to be exposed since 1986, when Yu Qiangsheng (), then-director of the Chinese Ministry of State Securitys North America Intelligence Department and Foreign Affairs Division, defected to the US. URL ""The Republicans blocked a major push for gun control after the 2007 Virginia Tech shootings, where 33 people died...They chose instead to respond to that shooting by joining Democrats to enact mental-health reforms."" URL ""Sri Lankas president has sacked his prime minister and the entire cabinet because of an alleged conspiracy to assassinate him...In a televised address to the nation, President Maithripala Sirisena said investigators had discovered the name of a cabinet minister who had allegedly plotted to have him killed...It follows several days of political turmoil in Sri Lanka."" URL ""A Mexican mayor was shot dead on his way to his first meeting just hours after being sworn in...Alejandro Aparicio Santiago was assassinated by a group of gunmen as he headed to the city hall in Tlaxiaco, Oaxaca...He was taken to hospital, where he later died."" URL ""A major blood collection is underway in Poland in an effort to help save the life of Pawe Adamowicz, the mayor of northern city Gdansk, who was stabbed on stage in front of thousands of people during a charity concert in an apparent assassination attempt...Mr Adamowicz underwent a five-hour operation after suffering stab wounds to his heart and abdomen, and is said to be in a critical condition."" URL ""A French spy has been shot dead after being implicated in the attempted assassination of an exiled Congolese opposition figure...The body of Daniel Forestier was discovered last week by police in a car park in the remote Alpine town of Ballaison, close to the French border with Switzerland."" URL ""The 28-year-old, of Corby in Northamptonshire, denied any wrongdoing but was found guilty by a jury at Birmingham Crown Court of attempted murder, possession of a firearm with intent to endanger life and having ammunition...He was handed a 28-year jail term with a five-year extended licence period...After sentencing, detective inspector Kat Sibley said: We have some hypothesis for what was behind the attack but nothing concrete  and there are no links between Okmanas and the victim, as far as we know. Our belief is this was a targeted attack on the woman. This case is not closed."" URL ""The high court judge last August found there was enough evidence to infer that Huong, Ms Aisyah and the four North Koreans were part of a well-planned conspiracy to kill Mr Kim and had called on the two women to present their defence...Lawyers for the women have said that they were pawns in a political assassination with clear links to the North Korean embassy in Kuala Lumpur, and that the prosecution failed to show the women had any intention to kill."" URL"
