,topic,subreddit,title,score,id,url,created,body
0,cybercrime,NoFilterNews,"Hushpuppi faces 20 years in US prison for $435million cybercrime, fraud as US Federal prosecutors officially charge him after Dubai extradiction",1,hkvjsj,https://www.reddit.com/r/NoFilterNews/comments/hkvjsj/hushpuppi_faces_20_years_in_us_prison_for/,2020-07-04 12:10:14,"Hushpuppi faces 20 years in US prison for $435million cybercrime, fraud as US Federal prosecutors officially charge him after Dubai extradiction URL"
1,cybercrime,NoFilterNews,"EU sanctions Russian intelligence, North Korean, Chinese firms over alleged cyberattacks",1,i0qfnj,https://www.reddit.com/r/NoFilterNews/comments/i0qfnj/eu_sanctions_russian_intelligence_north_korean/,2020-07-31 03:40:22,"EU sanctions Russian intelligence, North Korean, Chinese firms over alleged cyberattacks URL"
2,cybercrime,NoFilterNews,New Zealand seizes $90 million in assets of Russian cybercrime suspect,1,he2j16,https://www.reddit.com/r/NoFilterNews/comments/he2j16/new_zealand_seizes_90_million_in_assets_of/,2020-06-23 08:40:23,New Zealand seizes $90 million in assets of Russian cybercrime suspect URL
3,cybercrime,NoFilterNews,Russian Cybercrime Boss Burkov Gets 9 Years,1,hgzxtt,https://www.reddit.com/r/NoFilterNews/comments/hgzxtt/russian_cybercrime_boss_burkov_gets_9_years/,2020-06-28 05:37:23,Russian Cybercrime Boss Burkov Gets 9 Years URL
4,cybercrime,NoFilterNews,Russian Sergei Medvedev (not the PM) pleaded guilty to cybercrime in a US court,1,higsfi,https://www.reddit.com/r/NoFilterNews/comments/higsfi/russian_sergei_medvedev_not_the_pm_pleaded_guilty/,2020-06-30 15:07:16,Russian Sergei Medvedev (not the PM) pleaded guilty to cybercrime in a US court URL
5,cybercrime,NoFilterNews,"British Airways apologizes after 380,000 customers hit in cyber attack",1,9dtmrj,https://www.reddit.com/r/NoFilterNews/comments/9dtmrj/british_airways_apologizes_after_380000_customers/,2018-09-07 21:55:25,"British Airways apologizes after 380,000 customers hit in cyber attack URL Submitted September 06, 2018 at 11:07PM by /u/mk4rim - URL via /r/news - URL "
6,cybercrime,NoFilterNews,Three Members of Notorious International Cybercrime Group Fin7 In Custody for Role in Attacking Over 100 U.S. companies,1,93r31m,https://www.reddit.com/r/NoFilterNews/comments/93r31m/three_members_of_notorious_international/,2018-08-02 03:32:25,"Three Members of Notorious International Cybercrime Group Fin7 In Custody for Role in Attacking Over 100 U.S. companies URL Submitted August 01, 2018 at 07:24AM by /u/stupidstupidreddit - URL via /r/news - URL "
7,cybercrime,NoFilterNews,Sweeping Georgia cybercrime bill would target 'snoopers',1,80actm,https://www.reddit.com/r/NoFilterNews/comments/80actm/sweeping_georgia_cybercrime_bill_would_target/,2018-02-26 15:40:23,"Sweeping Georgia cybercrime bill would target 'snoopers' URL Submitted February 25, 2018 at 06:19PM by /u/javajen84 - URL via /r/news - URL "
8,cybercrime,NoFilterNews,Cryptocurrency exchange hack thwarted as thieves lose their own money in failed robbery,1,835ve1,https://www.reddit.com/r/NoFilterNews/comments/835ve1/cryptocurrency_exchange_hack_thwarted_as_thieves/,2018-03-09 21:56:20,"Cryptocurrency exchange hack thwarted as thieves lose their own money in failed robbery URL Submitted March 09, 2018 at 12:37AM by /u/Danyo- - URL via /r/news - URL "
9,cybercrime,NoFilterNews,Girl Scouts fight cybercrime with new cybersecurity badge,1,83s9bg,https://www.reddit.com/r/NoFilterNews/comments/83s9bg/girl_scouts_fight_cybercrime_with_new/,2018-03-12 15:09:32,"Girl Scouts fight cybercrime with new cybersecurity badge URL Submitted March 11, 2018 at 05:07PM by /u/Plainchant - URL via /r/news - URL "
10,cybercrime,NoFilterNews,Hackers Have Stolen $1.2B From Bitcoin And Ether,1,7sbx1f,https://www.reddit.com/r/NoFilterNews/comments/7sbx1f/hackers_have_stolen_12b_from_bitcoin_and_ether/,2018-01-23 15:28:14,"Hackers Have Stolen $1.2B From Bitcoin And Ether URL Submitted January 22, 2018 at 05:57PM by /u/RyanFire - URL via /r/news - URL "
11,cybercrime,NoFilterNews,Coincheck hackers attempting to sell stolen cryptocurrency - executive,1,7u2s8e,https://www.reddit.com/r/NoFilterNews/comments/7u2s8e/coincheck_hackers_attempting_to_sell_stolen/,2018-01-31 04:45:42,"Coincheck hackers attempting to sell stolen cryptocurrency - executive URL Submitted January 30, 2018 at 07:36AM by /u/pipsdontsqueak - URL via /r/news - URL "
12,cybercrime,NoFilterNews,Dozens charged over Infraud cybercrime site,1,7vyigz,https://www.reddit.com/r/NoFilterNews/comments/7vyigz/dozens_charged_over_infraud_cybercrime_site/,2018-02-08 06:07:29,"Dozens charged over Infraud cybercrime site URL Submitted February 07, 2018 at 08:09AM by /u/blumberg49 - URL via /r/news - URL "
13,cybercrime,NoFilterNews,"U.S. Arrests 13, Charges 36 in Infraud Cybercrime Forum Bust  Krebs on Security",1,7w9hgm,https://www.reddit.com/r/NoFilterNews/comments/7w9hgm/us_arrests_13_charges_36_in_infraud_cybercrime/,2018-02-09 11:17:18,"U.S. Arrests 13, Charges 36 in Infraud Cybercrime Forum Bust  Krebs on Security URL Submitted February 08, 2018 at 02:05PM by /u/onebigant - URL via /r/news - URL "
14,cybercrime,NoFilterNews,North Korea hackers stole South Korea-U.S. military plans,1,75hor1,https://www.reddit.com/r/NoFilterNews/comments/75hor1/north_korea_hackers_stole_south_koreaus_military/,2017-10-11 02:14:19,"North Korea hackers stole South Korea-U.S. military plans URL Submitted October 10, 2017 at 04:25AM by /u/chefranden - URL via /r/news - URL "
15,cybercrime,NoFilterNews,Russian cybercrime suspect in Greek court for second extradition request,1,75ob0d,https://www.reddit.com/r/NoFilterNews/comments/75ob0d/russian_cybercrime_suspect_in_greek_court_for/,2017-10-11 21:59:27,"Russian cybercrime suspect in Greek court for second extradition request URL Submitted October 11, 2017 at 12:34AM by /u/Jerry\_A\_Tillery - URL via /r/news - URL "
16,cybercrime,NoFilterNews,"Al Jazeera TV says it is combating hack, all entities operational: source",1,6g41rh,https://www.reddit.com/r/NoFilterNews/comments/6g41rh/al_jazeera_tv_says_it_is_combating_hack_all/,2017-06-09 07:37:25,"Al Jazeera TV says it is combating hack, all entities operational: source URL Submitted June 08, 2017 at 11:19AM by /u/arandomnewyorker - URL via /r/news - URL "
17,cybercrime,NoFilterNews,Expect Cybercrime from North Korea with Chinese Coal Ban,1,5v4292,https://www.reddit.com/r/NoFilterNews/comments/5v4292/expect_cybercrime_from_north_korea_with_chinese/,2017-02-20 22:32:06,"Expect Cybercrime from North Korea with Chinese Coal Ban URL Submitted February 20, 2017 at 01:16AM by /u/thisispawprint - URL via /r/news - URL "
18,cybercrime,NoFilterNews,Putin dismisses U.S. hacking allegations as campaign rhetoric,1,5g9bit,https://www.reddit.com/r/NoFilterNews/comments/5g9bit/putin_dismisses_us_hacking_allegations_as/,2016-12-03 23:18:27,"Putin dismisses U.S. hacking allegations as campaign rhetoric URL Submitted December 03, 2016 at 01:43AM by /u/krocker321 - URL via /r/news - URL "
19,cybercrime,NoFilterNews,Venezuela warns about cybercrime,1,5i59gc,https://www.reddit.com/r/NoFilterNews/comments/5i59gc/venezuela_warns_about_cybercrime/,2016-12-14 05:34:23,"Venezuela warns about cybercrime URL Submitted December 13, 2016 at 07:33AM by /u/dcismia - URL via /r/news - URL "
20,cybercrime,NoFilterNews,LinkedIn says arrest of Russian hacker tied to 2012 breach at social networking firm,1,58bwn8,https://www.reddit.com/r/NoFilterNews/comments/58bwn8/linkedin_says_arrest_of_russian_hacker_tied_to/,2016-10-20 05:29:09,"LinkedIn says arrest of Russian hacker tied to 2012 breach at social networking firm URL Submitted October 19, 2016 at 07:36AM by /u/elitebook840 - URL via /r/news - URL "
21,cybercrime,NoFilterNews,Czech police arrest Russian tied to 2012 LinkedIn hack,1,58ddsb,https://www.reddit.com/r/NoFilterNews/comments/58ddsb/czech_police_arrest_russian_tied_to_2012_linkedin/,2016-10-20 09:53:31,"Czech police arrest Russian tied to 2012 LinkedIn hack URL Submitted October 19, 2016 at 12:30PM by /u/Myfeelzarespecial - URL via /r/news - URL "
22,cybercrime,NoFilterNews,A Nigerian accused of scamming $60 million from companies around the world through fraudulent emails has been arrested after months of investigation,1,4vmv5a,https://www.reddit.com/r/NoFilterNews/comments/4vmv5a/a_nigerian_accused_of_scamming_60_million_from/,2016-08-02 00:51:53,"A Nigerian accused of scamming $60 million from companies around the world through fraudulent emails has been arrested after months of investigation URL Submitted August 01, 2016 at 04:32AM by /u/hoosakiwi - URL via /r/news - URL "
23,cybercrime,NoFilterNews,Cybercrime Overtakes Traditional Crime in UK,1,4t030f,https://www.reddit.com/r/NoFilterNews/comments/4t030f/cybercrime_overtakes_traditional_crime_in_uk/,2016-07-16 02:54:04,"Cybercrime Overtakes Traditional Crime in UK URL Submitted July 15, 2016 at 06:21AM by speckz - URL via /r/news - URL "
