,topic,subreddit,title,score,id,url,created,body
0,cyber-crime,pakistan,Need someone with heavy scary voice to scare the shit out of someone! Willing to pay,1,hczj29,https://www.reddit.com/r/pakistan/comments/hczj29/need_someone_with_heavy_scary_voice_to_scare_the/,2020-06-21 13:01:29,"Hi, Need someone who could act good and pretend to be from cyber crime investigation. I have been fooled and scammed by someone. Normally i wouldn't give a shit but this particular guy, i felt bad and helped him just to find out he has been lying this whole time. What pissed me is the fact he told lies about his sister and parents death to gain sympathy. I'll give the whole details and provide with ss in pm to whoever decided to help me out. I also have his national identity card and could potentially ruin his life but i don't want to do that. Would rather scare the shit out of him to make sure he doesn't do this again in the future. Note: only reason i helped him without hesitation is because we went to same school when i was in Pakistan"
1,cyber-crime,pakistan,"I saw target killers, terrorists and dacoits on streets but PTA thinks pubg will make me violent and self harm.",1,hjqbgo,https://www.reddit.com/r/pakistan/comments/hjqbgo/i_saw_target_killers_terrorists_and_dacoits_on/,2020-07-02 14:28:14,"It's the laziest solution if you think about it, just ban it. Ban and cancel culture in Pakistani bureaucracy and judiciary is going on since I can remember. Our parents and elders always blame video games and movies for violence in society. They forget we are the same generation that has lived through terrorism and war against terrorism. We have seen blood shed on the streets, bombings and dacoits firing on the streets. I remember I was on Karachi streets on 12 May 2007, just a school kid when I saw people firing on Rashid Minhas road. I was running with my friends as teenagers away from where the firing was coming from. We hid inside a gaming zone near Nipa Chowrangi for 6 to 8 hours. In the gaming area the owner locked us in and left so that we will be safe that way. We called police and our parents were worried sick but we had no help and no where to go. We were just kids scared for our lives and at that time of utter chaos. At that moment we realized that we are in a gaming arena. We started to play games, we played to get away from what was going on outside. We played every game we can. Gaming was our escape route from literal violence on our doorsteps. And yes, we were playing counter strike, ironically. I looked out of the window that day I saw the target killers firing from top of the bridge on innocent people with another guy carrying an MQM flag cheering ""jiye mutahida"" . I haven't been so scared at that moment. After maghrib police came and the owner came and opened the door. Then we took a ride with police to a safer place. From there I walked home, I just told my father what happened and not my mother because I thought she will be too scared. This is the environment we were raised in and I am sure everyone in the country has similar experiences. But pubg and gaming is not the problem, the society is the problem that blames gaming for shortcomings in the parenting and growth of children. I had PTSD from the incident but never knew what it was. It took me long time to recover from it. Typical Pakistani solution is ban the games because it's the only source of violence for kids. See the society outside kids can see violence everywhere. PTA is a lazy organization from attacking VPNs to games, it doesn't do anything good. Literally everyday I get fraud calls and texts on my phone that I report but these people are never banned. One son of our maid was defrauded few thousand rupees because the guy on phone told him he is from govt and he has won a plot and this stupid guy sent him money. These fraud, cyber crime and illegal activities should be banned and not gaming. I once got a call from a guy saying I have won lottery that I never played. He wanted money. I reported his number on PTA helpline and with my Telco. 3 days later same guy called again with same number, he wasn't banned because according to PTA that was OK. Stay blessed everyone."
2,cyber-crime,pakistan,What are the Cyber crime laws in Pakistan for victims of revenge porn (ex partners making the intimate photos of their partners public)? Is there a way the perpetrators can be apprehended with as little involvement from family members as possible?,1,f4ewnt,https://www.reddit.com/r/pakistan/comments/f4ewnt/what_are_the_cyber_crime_laws_in_pakistan_for/,2020-02-16 07:10:15,A couple of people around me have fallen victim to this shitty practice and they can't come forward because of their _izzats_ I was just wondering if there laws allow you to handle this matter on your own without any involvement from parents or other family members?
3,cyber-crime,pakistan,Some news you may have missed out on part 107.,23,bf60ut,https://www.reddit.com/r/pakistan/comments/bf60ut/some_news_you_may_have_missed_out_on_part_107/,2019-04-20 09:49:05," -[Pakistan gets duty relief from China like ASEAN states](URL Pakistan now has a level playing field with member states of the Association of Southeast Asian Nations (Asean) in exports to China, which has waived duty on more Pakistani products under second phase of the Pakistan-China Free Trade Agreement (FTA), said Adviser to Prime Minister on Commerce and Textile Abdul Razak Dawood. Speaking at an awareness seminar on the second phase of Pakistan-China FTA, the minister stressed that now it was up to the business community to take advantage of the China duty relief and tap the export potential. Pakistan will be entering the second phase of the FTA soon under which it will be able to export hundreds of more products to China at zero duty. -[Pakistan's current account deficit contracts 29.5% to $9.6B](URL Pakistans current account deficit (CAD) narrowed considerably by 29.5% to $9.6 billion in first nine months (July-March) of the current fiscal year mainly due to much-needed drop in imports and a significant rise in worker remittances. The current account deficit stood at $13.6 billion in the same period of previous year, the State Bank of Pakistan (SBP) reported on Thursday. On average, the deficit has dropped to $1.06 billion a month so far in the current fiscal year compared to $1.5 billion a month in the corresponding period of last year. -[Market reacts positively as Hafeez Sheikh takes charge of finance ministry](URL Unlike the expectations that the sudden change of finance minister and reshuffling of other ministers will jolt the economy and create uncertainty in the market, the Pakistan Stock Exchange on Friday witnessed an unprecedented jump in volumes as KSE-100 gained 800 points in intraday trading. According to stockbrokers, the investors are expressing confidence in the market following Prime Minister Imran Khans massive decision to reshuffle the federal cabinet on Thursday. Economists said after the bold decision of PM Imran Khan, the investors have gained confidence that the economic policies would no longer remain uncertain. They hoped that the market would recover with expected improvement in the macroeconomic indicators, as the biggest challenge to the economy  the current account deficit  has started narrowing down. As Hafeez Sheikh, the newly-appointed Advisor to PM on Finance and Revenue, would be heading the bailout deal with International Monetary Fund (IMF), the agreement is now expected to be signed even before the next budget, said sources at the finance ministry. The daf before: -[PSX manages positive close after volatile trading](URL -[Al Jazeera Documentary: Safety returning to Karachi](URL -[Govt starts the implementation of Quetta safe city project](URL Quetta Safe city project has started on ground, sources told NNI that practical implementation of the Quetta safe city project has begun by laying underground fiber optic cable on airport road Quetta. Sources told that Secure Communications Singapore has also chalked out the design of the project that has been submitted to the Provincial government, the project shall be completed in 2020, which will help in reducing the threats of crime and terrorism in the provincial capital. -[200 million investment expected in IT, tourism &amp; other sectors in Pakistan](URL Chairman Punjab Information Technology Board (PITB) Azfar Manzoor has signed an MoU with a delegation from UK Pakistan Chambers of Commerce and Industry for collaboration in ICT projects and other technology ventures in Pakistan. The country is expecting an investment worth 200 million pounds from UKPCCI in IT, tourism and other sectors, as mentioned by PITB in a tweet. The leader of the delegation during the meeting with PITB chairman disclosed the fact that PITB is determined to make Punjab the top IT-enabled, e-governed province in the country. He also said that the technology board is making developments to make Punjab an attractive destination for global IT businesses, and a supplier of the skilled human resource of IT in Pakistan as well. -[This new submarine cable system will increase Pakistans internet capacity to 96 Tb/s](URL A landing party agreement has been signed between Cyber Internet Services (Cybernet) Pakistan and PEACE (Pakistan and East Africa Connecting Europe) Cable International Network Company Ltd, to add the very first carrier-neutral, an open-access new submarine cable system in Pakistan. With this cable system, the countrys internet capacity is set to increase by 96 terabits per second. The PEACE cable system and Cybernet Pakistan signed the agreement on April 16 at Capacity North Africa in Cairo. The PEACE cable system with landings in Pakistan, Egypt, France, and Kenya will provide critical inter-connectivity to the economic corridors of Asia, Europe, and Africa. -[Pakistan to play Cambodia as Asia holds first round draw for World Cup](URL The draw for the first phase of Asias qualifying round for the 2022 World Cup finals featuring the continents lowest-ranked nations was made on Wednesday, even though FIFA has yet to decide how many teams will participate in the tournament. Pakistan is slated to meet Cambodia. -[PPL becomes Pakistans first company to drill well abroad](URL State-owned Pakistan Petroleum Limited (PPL) has emerged as the first Pakistan-based oil and gas exploration firm to have gone global as it has started drilling a well in Iraq, where gas deposits of 200-300 million cubic feet per day (mmcfd) are expected to be found. PPL, the operator of Block 8 in Iraq, drilled the exploration well named Madain-1 on April 14, 2019. The block is located in the Mesopotamian basin and it is surrounded by areas that have several large oil and gas fields, the exploration firm stated in a notification sent to the Pakistan Stock Exchange (PSX) on Tuesday. The well, which was being drilled on an integrated project management basis by a Chinese drilling contractor, Zepec, marked a significant milestone in the companys history as its first international exploration well, the company said. -[China/Pakistan to boost 2-way trade to $20 billion](URL Chinese scholar Dr Zhang Yifeng on Friday said that China has entered into an era of geo-economic relationship with Pakistan and it plans to boost two-way trade from $12 billion to $20 billion. China aims at investing $1.3 trillion in Belt and Road Initiative (BRI) member states by the year 2027 which would become the single-largest investment by any state to help boost regional and trans-regional connectivity and trade. -[New oil reserves discovered in Pakistan](URL Mari Petroleum Company Limited (MPCL) has made an oil discovery near Gujar Khan in Rawalpindi District, Radio Pakistan reported. According to the spokesperson of the company, it is the second consecutive discovery in Ghauri Block, which is expected to provide 372 barrels of crude oil on a daily basis. -['Direct to Home' Boxes launch date announced by PEMRA](URL Pakistan Electronic Media Regulatory Authority (PEMRA) chairman Mirza Saleem Baig Thursday said Direct to Home (DTH) boxes would be introduced by November this year. Addressing to All Pakistan Satellite Goods Association and Traders Union while destroying illegal Indian DTH &amp; C-line equipment at Imperial Market (Al -Faisal Market) Raja Bazaar, he urged the satellite news and current affairs channels, to highlight positive developments in the country and promote optimism to build healthy society, instead of portraying a bad image. -[Iran wants strong trade ties with Pakistan](URL Irans Industry, Mines and Trade Minister Reza Rahmani has stressed the need to raise the volume of trade with Pakistan to $5 billion by 2021. Addressing a ceremony marking Pakistan Day in Tehran, he hoped that the goal will be materialized by establishing banking ties and finalisation of free trade agreements. He said that Iran and Pakistan boast of numerous commonalities in various spheres, including religion, culture and history. Iran-Pakistan ties are as old as the laterss independence and both countries have always enjoyed friendly relations, he said. -[Pakistan to Make a Major Multi-Billion Dollar Arms Deal With Russia: Report](URL Russia is looking forward to making inroads into Pakistans arms market. According to a Russian news agency, Pakistan has shown interest in purchasing Russian military hardware. The deal is expected to amount $9 billion under which Islamabad would purchase heavy and medium fighter jets, medium and short-range air defense systems, tanks, combat helicopters, and warships. -[Mobile Phone Imports Decline by 7.6% in First 9 Months of FY2019](URL Mobile phone imports witnessed a decline of 7.60 percent in the first nine months (July-March) of 2018-19 as they remained at $557.187 million compared to $603.046 million during the same period last year. Mobile phone imports, in March 2019, stood at $79.049 million, registering a 2.64 percent growth as compared to $77.013 million in March 2018. -[Car Imports to Pakistan Decrease by a Massive 42%](URL According to analysts, due to the restriction on car imports and the depreciating value of rupee, car imports in the first ninth months of the current fiscal year plummeted by 42% to $209 million. The latest Pakistan Bureau of Statistics (PBS) data shows that in the same period last year, car imports totaled $359.5 million. Last month, on a year-on-year basis, car imports had dropped by 80% to $6.1 million. -[Selling overpriced uniform, stationery in Sindh private schools banned](URL The Sindh government has barred private schools from selling uniform and stationery to students, accusing the institutes of charging four times more than the market price. Taking notice of the longstanding practice, the provincial education department n Friday declared it unlawful and formed teams for inspection in this connection.The move is aimed at giving parents freedom to purchase books and copies from anywhere in the market. -[Pakistan offers Tunisia investment opportunities in diverse fields](URL Tunisia Ambassador to Pakistan Adel Elarbi her on Friday called on National Assembly (NA) Speaker Asad Qaiser in Islamabad. Talking to the ambassador, NA Speaker Asad Qaiser urged the Tunisian business community to take benefit from investment friendly policies presented by the current government in diverse fields. Asad Qaiser said that Pakistan attached great importance to its relations with Tunisia and added that Pakistan and Tunisia enjoyed longstanding fraternal relations. He further said that there were great opportunities of trade and economic relations between the two countries. Qaiser also emphasized the need for greater people to people contacts between the two brotherly countries."
4,cyber-crime,pakistan,Advice on divorce?,7,aztokj,https://www.reddit.com/r/pakistan/comments/aztokj/advice_on_divorce/,2019-03-12 00:51:09,My wife insists she is divorced. It has been a year. But legally and islamically she is still my wife because I retracted the divorce on time. There is no divorce letter issued by Union council. And muftis on both her and my side have writted she is still the wife. She makes some lame excuses that just saying Ruju by words is not necessary but intercourse is also necessary. Other times she say Ruju is right of woman also which all muftis deny. She has filed custody and maintainance cases in court. I am trying to tell the judge that she is still my wife so I can take baby custody anytime. This case is not valid. But judge is also confused whether I am married or not. He should just see there is no divorce certificate. Now is is saying she will put cyber crime case against me because I am messaging her. Can a wife put cyber crime case against her husband? Judge is saying if I have messaged her then he will issue verdict in her favor. What should I do? I have told my wife. I am outta all this. I am done. Now go take khulla yourself. Dimagh ki dahi kar do he is ne. Any opinions?
