,topic,subreddit,title,score,id,url,created,body
11,CVE,PFSENSE,Antenna or consumer AP?,0,c8v6ot,https://www.reddit.com/r/PFSENSE/comments/c8v6ot/antenna_or_consumer_ap/,2019-07-04 09:19:19,"Hello all, Google seems to think this question hasn't been asked here since 2015, but if you've heard it recently, let me apologize in advance. BLUF: Should I buy a consumer AP or spend the money to add AP capability to a pfsense box I built? The box has a quad core AMD CPU and 8 GB RAM, and I haven't added any bells and whistles other than pfblocker. Background: I used to use a Netgear R6100. That model has a checkbox for WPS that doesn't actually allow you to turn off WPS. My neighbor brute forced the pin (reaver?) and then with a special GET request (I'm not even looking up the CVE) escalated on the Netgear. From there he compromised my entire network, putting backdoors in everything. My response was to build a pfsense box which is the firewall and router for my home, and then I put that same R6100 (now running openwrt) in its own subnet, dropping everything not bound for the internet. That R6100 is now giving up on me. I figure if I want reliable, fast wifi throughout my 2000 square foot ranch I can either spend over $100 dollars on a nice consumer AP, or put a PCIE WiFi card into the pfsense box for about the same price. Comments, concerns, suggestions?"
12,CVE,PFSENSE,"Update pfSense packages to protect against NGINX, libzmq4, and curl vulnerabilities",1,ar1lpo,https://www.reddit.com/r/PFSENSE/comments/ar1lpo/update_pfsense_packages_to_protect_against_nginx/,2019-02-16 08:37:43,"We have incorporated fixes for some recently identified vulnerabilities, specifically: NGINX: [CVE-2018-16843](URL [CVE-2018-16844](URL and [CVE-2018-16845](URL libzmq4: [CVE-2019-6250](URL curl: [CVE-2018-16890](URL [CVE-2019-3822](URL and [CVE-2019-3823](URL As always, [take a backup of the firewall configuration](URL prior to any major change to the firewall. To incorporate these security fixes you will need access to the operating system shell. You can do that by using either SSH or a local console. This procedure may NOT be performed via the pfSense web interface. From the pfSense command line interface (CLI). Choose **option 8** Shell. From the /root: prompt, type pkg update; pkg upgrade as shown in the screenshot below. &amp;#x200B; URL When prompted, choose y to proceed. (A reboot is not required.) &gt;**Warning:** If you are running a version of pfSense prior to 2.4.4-p2 simply update to that version to benefit from these changes. Be sure to review the [blog post](URL and [Release Notes](URL prior to upgrading. Updating the packages from the command line of an earlier version will update your firewall to 2.4.4-p2. We do not recommend that option. If you have chosen to install a version later than 2.4.4-p2 by following the Latest development snapshots (Experimental 2.4.x DEVEL) update channel, this procedure will NOT install the updated packages. We encourage you to update your pfSense packages immediately. This is a small upgrade, but a major security update!"
13,CVE,PFSENSE,SSH Exploit CVE-2018-14665,1,9rqz2s,https://www.reddit.com/r/PFSENSE/comments/9rqz2s/ssh_exploit_cve201814665/,2018-10-27 13:40:27," An [advisory X.org developers published Thursday](URL disclosed the 23-month-old bug that, depending on how OS developers configure it, lets hackers or untrusted users elevate very limited system rights to unfettered root. The vulnerability, which is active when OSes run X.org in privileged (setuid) mode, allows files to be overwritten using the -logfile and -modulepath parameters. It also makes it trivial for low-privilege users to escalate system rights. A variety of nuances are leading to widely divergent assessments of the bug's severity. URL"
14,CVE,PFSENSE,"Core protocol-level flaw in WPA2. Possible impact: wi-fi decrypt, connection hijacking, content injection. Looks bad.",125,76ksdi,https://www.reddit.com/r/PFSENSE/comments/76ksdi/core_protocollevel_flaw_in_wpa2_possible_impact/,2017-10-16 05:42:54,"Public disclosure is tomorrow, but most or all correct implementations of WPA2 are affected. Flaw in the 4-way handshake due to problems in the RNG. Quoting from the USENIX paper Section 3.1): *The security enhancements amendment to 802.11, called 802.11i, includes a software-based RNG [22, H.5.2]. It extracts randomness from clock jitter and frame arrival times. While the standard states the proposed algorithm is only expository, and real implementations should extend it with other sources of entropy, we found that several platforms directly implement it and even simplify it.* Look for CVE-2017-13077, 13078, 13079, 13080, 13081, 13082, 13084, 13086, 13087, 13088 when details become available. Obviously does and does not affect pfSense. We dont do a lot of WiFi, but its possible. Details will be published to: URL tomorrow. The attack is based upon problems with the RNG (the example RNG, which apparently everyone used, is trivial to break and the protocol is also kind enough to provide you with a huge chunk of the entropy used in seeding the RNG.) If you'd rather watch the GitHub for that domain: URL (Thanks to /u/R00TRadiCal for this.) Probably a good time to review abuse resistance, particularly nonce-disrespecting attacks: eprint.iacr.org/2016/475.pdf Background reading: URL URL Here's the CCC talk with the author of that USENIX paper: URL Mathy Vanhoef has the following publications listed on [his website](URL *M. Vanhoef and F. Piessens. Key Reinstallation Attacks: Forcing Nonce Reuse in WPA2. To appear in Proceedings of the 24th ACM Conference on Computer and Communication Security (CCS 2017), Dallas, USA, 30 October - 3 November 2017* *M. Vanhoef and F. Piessens. Denial-of-Service Attacks Against the 4-way Wi-Fi Handshake. To appear in 9th International Conference on Network and Communications Security (NCS 2017), Dubai, United Arab Emirates, 25-26 November 2017.* Edit: the official site is up: URL Official response from hostap developers: URL commits to fix the issues: URL pfSense bug tracker: URL "
15,CVE,PFSENSE,do i need to bother with Pkg Vulnerabilities?,5,5q5kwl,https://www.reddit.com/r/PFSENSE/comments/5q5kwl/do_i_need_to_bother_with_pkg_vulnerabilities/,2017-01-26 07:15:42,"Hi did a pkg audit -f &amp; it spit out a few vulnerabilities i tried to update p7zip but it says its the latest version but i guess there's a 16.x version that patches these do i need to bother about these &amp; if yes, what do i do to update them? OR do these get patched when pfsense releases a build? thanks vulnxml file up-to-date php56-5.6.26 is vulnerable: PHP -- undisclosed vulnerabilities WWW: URL php56-5.6.26 is vulnerable: PHP -- Multiple vulnerabilities WWW: URL curl-7.50.3 is vulnerable: cURL -- buffer overflow CVE: CVE-2016-9586 WWW: URL curl-7.50.3 is vulnerable: cURL -- multiple vulnerabilities CVE: CVE-2016-8625 CVE: CVE-2016-8624 CVE: CVE-2016-8623 CVE: CVE-2016-8622 CVE: CVE-2016-8621 CVE: CVE-2016-8620 CVE: CVE-2016-8619 CVE: CVE-2016-8618 CVE: CVE-2016-8617 CVE: CVE-2016-8616 CVE: CVE-2016-8615 WWW: URL squid-3.5.19_1 is vulnerable: squid -- multiple vulnerabilities CVE: CVE-2016-10003 CVE: CVE-2016-10002 WWW: URL ntp-4.2.8p8 is vulnerable: ntp -- multiple vulnerabilities CVE: CVE-2016-9312 CVE: CVE-2016-9311 CVE: CVE-2016-9310 CVE: CVE-2016-7434 CVE: CVE-2016-7433 CVE: CVE-2016-7431 CVE: CVE-2016-7429 CVE: CVE-2016-7428 CVE: CVE-2016-7427 CVE: CVE-2016-7426 WWW: URL lighttpd-1.4.39_1 is vulnerable: lighttpd - multiple vulnerabilities WWW: URL p7zip-15.14_1 is vulnerable: p7zip -- Null pointer dereference CVE: CVE-2016-9296 WWW: URL "
16,CVE,PFSENSE,Ist pfSense affected by CVE-2015-1793 and when will the update come out?,15,3cp8bf,http://www.reddit.com/r/PFSENSE/comments/3cp8bf/ist_pfsense_affected_by_cve20151793_and_when_will/,2015-07-10 03:46:19,URL This sounds like something that might be a problem when using cert based authentication for OpenVPN. Is that correct?
17,CVE,PFSENSE,OpenSSH does not pass vulnerability scan,5,38salu,http://www.reddit.com/r/PFSENSE/comments/38salu/openssh_does_not_pass_vulnerability_scan/,2015-06-06 21:13:31,pfSense 2.2.2 does not pass our PCI vulnerability scan because OpenSSH is reported as version 6.6 which would be vulnerable to CVE-2014-2653. I haven't been able to determine whether this is an actual vulnerability or if it's the all too familiar problem that the fix has been backported without a version number bump. Does anyone know? I have solved the problem for now by turning off SSH access because I can get by without it. 
