,topic,subreddit,title,score,id,url,created,body
6,cyber crime,teenagers,Fuck this shit,4,dpyfcs,https://www.reddit.com/r/teenagers/comments/dpyfcs/fuck_this_shit/,2019-11-01 13:48:30,"My brother is autistic and he was good friends with a kid named Anton (Anton if you see this you know who you are fuck you I'm using your real name) who everyone liked at my house (except my dad after one interaction) he would stay over and we were all cool with him we were also friends with a kid named Tristan who is great friends with Anton and after one day Anton went to Tristan's house but he wasn't there so he came to our house and Anton said to us ""well Tristan wasn't at his house so you guys were my 2nd choice"" (this is what made my dad not like Anton) and when my brother and Anton were in 6th grade he started fucking with my brother who mind you is autistic and they would fuck with him endlessly and and I messaged Anton basically saying yo what the fuck dude and he said pretty much that he was still friends with me and I told him to fuck off and so he yelled at my brother about how he would never be friends with him again and it died down until my 6th grade year and my brothers 8th grade year and Anton tried to be friends with my brother again which we gave him a chance turns out he just wanted an excuse for a ride home and the next day he started fucking with my brother again now we are skipping to when my brother is in 10th grade this year now he is just gitting bullied so fucking much but it got so much worse this year about 3 weeks ago he sent my brother a friend request on discord which after a lot of family discussions we decided he should except and see what happens and you want to know what he did HE FUCKING RAIDED MY BROTHER'S SERVER now we learned that they have a whole server dedicated to planning on how to fuck with my brother and how to raid his server again which my mom joined literally with her real first name and last initial but since these fuckers are so unbelievably fucking stupid they didn't even realize she joined so now my parents are so fucking pissed that they made a police report (note: it's a serious crime to cyber bully) now Tommorow my brother has a a meeting with the police and the principal and Anton has no idea and even if that turbo virgin somehow sees this he can't do shit about it we have screenshots and the police has already seen the server also something I forgot to mention is they have a thing called the daily pic where they post a picture each day of a picture they took of my brother in class Also I don't fucking care about formatting or my grammar or my punctuation Also I'm so pissed I forgot to mention one kid who sat with my brother at lunch is on the server and Tristan is also on there even tho he pretended that he was friends with my brother"
7,cyber crime,teenagers,"So, my mom used to think that violent games make violent people, so I tried proved my point",2,cv4n7p,https://www.reddit.com/r/teenagers/comments/cv4n7p/so_my_mom_used_to_think_that_violent_games_make/,2019-08-25 15:27:48,"English is my second language, if i repeat words or have grammar errors, please, correct me. A little bit of Context: In my country, Venezuela, a long time ago the C.S. 1.6 Half-Life mod was trending, every cyber cafe and basically, everybody that played games, had that game. So, an organization that idk the name right now made a study that showed that kids that were criminals actually played C.S 1.6 for ""training"", something that is actually trying to shadow the real problem, the growing crime rate. When I was a kiddo, I used to play that videogame with my sisters and her friends from a cyber cafe, and I actually liked that kinda of videogames, but by that time, a new law was being applied to the cyber and entertainment centers, that war videogames and gun videogames were prohibited, so I didn't played FPS and other games since that, but I started playing again in 2013 with Minecraft. Okey, so I can start now. I started playing TF2 and actually playing that everyday since November 2018 to April or May from this year. So, everyday I was getting more upset about the electricity thing (there were a season that they actually cut all services for like 4 hours everyday), since I was tired of school and when I get home I can't even eat in peace because my neighbors were moving furniture and making sounds (EVERYDAY THEY DO THAT, EVEN IF THERE'S NO ELECTRICITY AND IT'S 12 AM), and basically, problems with my mom. My mom one day said to me something like ""what fucking games are playing you?"" and I was confused, and telled me something like my cousin was getting violent because of playing games, something that I don't believe to this day. So, to the point, if the media in USA is exaggerated, in South America is the triple of that, so she tells me that Trump and other crap like that, I actually tried to prove my point, but she says me that the studies and that, but they're from Facebook, so most of them are fake tbh. So I actually did research about articles that prove that this is fake, and I actually found a lot of them, so I send them to my mom, and read them for she. She stills believes that violent games make people violent and kill people and that other crap that the media says, but, she stills trying to change my mind about it, so, should i kill her? thanks"
8,cyber crime,teenagers,"So my mom thinks that violent videogames make violent people, so I tried to prove my point",3,cv4pgs,https://www.reddit.com/r/teenagers/comments/cv4pgs/so_my_mom_thinks_that_violent_videogames_make/,2019-08-25 15:35:11,"English is my second language, if i repeat words or have grammar errors, please, correct me. A little bit of Context: In my country, Venezuela, a long time ago the C.S. 1.6 Half-Life mod was trending, every cyber cafe and basically, everybody that played games, had that game. So, an organization that idk the name right now made a study that showed that kids that were criminals actually played C.S 1.6 for ""training"", something that is actually trying to shadow the real problem, the growing crime rate. When I was a kiddo, I used to play that videogame with my sisters and her friends from a cyber cafe, and I actually liked that kinda of videogames, but by that time, a new law was being applied to the cyber and entertainment centers, that war videogames and gun videogames were prohibited, so I didn't played FPS and other games since that, but I started playing again in 2013 with Minecraft. Okey, so I can start now. I started playing TF2 and actually playing that everyday since November 2018 to April or May from this year. So, everyday I was getting more upset about the electricity thing (there were a season that they actually cut all services for like 4 hours everyday), since I was tired of school and when I get home I can't even eat in peace because my neighbors were moving furniture and making sounds (EVERYDAY THEY DO THAT, EVEN IF THERE'S NO ELECTRICITY AND IT'S 12 AM), and basically, problems with my mom. My mom one day said to me something like ""what fucking games are playing you?"" and I was confused, and telled me something like my cousin was getting violent because of playing games, something that I don't believe to this day. So, to the point, if the media in USA is exaggerated, in South America is the triple of that, so she tells me that Trump and other crap like that, I actually tried to prove my point, but she says me that the studies and that, but they're from Facebook, so most of them are fake tbh. So I actually did research about articles that prove that this is fake, and I actually found a lot of them, so I send them to my mom, and read them for she. She stills believes that violent games make people violent and kill people and that other crap that the media says, but, she stills trying to change my mind about it, so, should i kill her? thanks"
9,cyber crime,teenagers,I want to shed some light on the instagram meme account community.,2,cw3g39,https://www.reddit.com/r/teenagers/comments/cw3g39/i_want_to_shed_some_light_on_the_instagram_meme/,2019-08-27 22:01:21,"Hi, i recently sold a 600k follower account for a hefty sum. So i want to answer some questions or just all around talk about how alot of it has links with cyber crime and credit card fraud. Plus how it actually worked. Proof: [URL"
10,cyber crime,teenagers,Teacher threatens to call the police on me for getting cyber bullied (as in I was cyber bullied),9,c48ioe,https://www.reddit.com/r/teenagers/comments/c48ioe/teacher_threatens_to_call_the_police_on_me_for/,2019-06-24 03:53:02,"Ok so, it was after school and i wasn't allowed on any computers (including consoles, hand heads, phones, computers, etc) when i got a notification on my phone (it was on my desk) saying i had just gotten kicked out of my classes whatsapp group by someone we'll call Derick. Now Derick was the kind of guy who would steal something off someone then say ''I had the right to take it, they weren't using it'' (yes that actually happened to me) and get away with it. I knew i wasn't supposed to go on my phone but i decided to go on it anyways and was angry and upset. when i went onto the group i check and what do you know but all of the other people kicked out of the group just so happened to be my friends. After finding out about this, i decided to make a group chat and message about the fact that we got kicked out. i messaged one of my friends on this group, we said stuff like 'oh i dislike Derick' and i'm sick of Derick being mean to us' and other stuff. The next day one of my friends (one who got kicked out of the group) asked him why he kicked us out of the group and he said 'because you guys aren't my friends and this is MY group and i'm the leader around here' (he wasn't, everyone in the group was an admin and he didn't even create the group, he was just being egotistical). Around a week later, my teacher found out, one on my friend's friends found out about the group and told the teacher, and was angry at us for making the group and said 'he had reasons to kick us out of the group and i'm going to get you banned off of whatsapp' (yeah.. your going to prevent me from talking to people online.. oh no) and, as the title suggests 'IM GOING TO CALL THE POLICE AND UNLESS THE PERSON WHO DID IT ADMITS TO THE CRIME THEY'VE DONE, IS GOING TO GET ARRESTED' (i don't know how they would arrest me if they didn't know who did it.) And as the stupid 9 year old i was i decided to tell them (I say stupid because i believed them, that i would go to jail.) After school that day, i heard Derick saying 'why would anyone dislike me? Im a great guy. Im P E R F E C T ' (which i found stupid and egotistical. I D O N ' T K N O W I F A T E A C H E R T H R E A T E N I N G T O C A L L T H E P O L I C E O N A S T U D E N T I S I L L E G A L ."
11,cyber crime,teenagers,My classmate is receiving 8 felonies for something he sort of didn't do,1893,boj6q3,https://www.reddit.com/r/teenagers/comments/boj6q3/my_classmate_is_receiving_8_felonies_for/,2019-05-14 23:51:19,"My high school classmate, Ajay Bhattacharya, was arrested for ""hacking"" into our superintendent's email. There are a lot of things wrong with this, because he found the info in the general share of the high school network. He found the login info of the superintendent, in the general share, without hacking to find it. The school says he ""hacked"" into the school when it was mostly their fault for not maintaining security. Many other students have started the #FreeAjay movement to support him, but many believe he did nothing wrong. He did login to the superintendent's account, but he did not change any info or grades or anything like that. The school is trying its best to make Ajay sound like a cyber criminal when in reality he just found some info and used it not causing harm. The school's security should have prevented this somehow, as there are many things in the general share that should he obvious but simply are overlooked like the info Ajay found. I'm not sure what to do as far as helping, but I wanted to make more than just our school's students aware. We need more than just Ajay's friends to support him and help with his case. If the school gets what they want out of him it will be extremely hard for Ajay to go to college, get a job, and have a successful career. Ajay is one of the smartest kids I know and should not have his life jeopardized because of a security mishap. Granted he should not have logged in to the account and things, but 8 felonies is a little much for logging into an account. Before these events, there was more computer shenanigans where Ajay and some of his friends used old admin accounts for questionable things, like downloading vpns and using school laptops for things other than their intended use, like downloading steam and such. The school was already mad at the group and pinned Ajay as the leader when all were responsible. They were suspended for some amounts of time, from a few weeks to a month or two. I think the current events show how they want to get back at him and make his punishment the worst it can be and exaggerate the crime. Some links to news articles if there is more info on them: URL URL URL Any more info you need can be found by googling Ajay Bhattacharyya Gates Chili. I don't know what the right thing to do is, but hopefully we can get help somehow. The school is blowing his case way out of proportion, and they need to stop before they ruin his entire life ahead of him."
12,cyber crime,teenagers,Illegal Bee Movie scripts,1,a4zbrv,https://www.reddit.com/r/teenagers/comments/a4zbrv/illegal_bee_movie_scripts/,2018-12-11 07:17:45,"A while ago I decided to copy and paste the Bee Movie script a bunch of times on a school computer. Apparently, this was not just for my account, but for the whole school boards servers. I legit got pulled into the principal's office, where he told me that it counts as a cyber crime. So it seems we are at an end, 1 post, 3 days, and 2 terabytes later."
