,topic,subreddit,title,score,id,url,created,body
7,cybercrime,u_webimprints09,Tips to avoid computer fraud,1,9uqb0t,https://www.reddit.com/r/u_webimprints09/comments/9uqb0t/tips_to_avoid_computer_fraud/,2018-11-07 04:23:35," **Different ways to anticipate possible fraud scenarios** Several types of fraud are inevitable for most business; this is a reality that many organizations have refused to admit. The truth is those malicious actors, whether extern or members of the organization are always lurking around the critical systems of a company, and whenever they have the slightest chance to exploit any vulnerability or bypass security systems, they will do so. The various types of fraud persist, and frankly, it is not realistic to believe that companies can take measures that eradicate it definitively. But combating fraud does not have to be an unproductive task. Cybersecurity and digital forensics specialists from the International Institute of Cyber Security bring you three useful tips to help companies fight fraud, specifically cyber fraud: **Think like a malicious actor** Antifraud systems may be effective, but they will not stop a criminal. The main challenge is to anticipate the opponents next move. To be able to get into an adversarys head, cybersecurity and digital forensics professionals should consider what motivates malicious hackers and what their goals might be in the organization. Threat actors are always looking for similar things: payment card data, personal identifying information, log in credentials, and other types of data and sensitive personal information. It is also necessary to consider the methods that scammers use to hinder existing controls to access an organizations systems. Two-factor authentication (2FA) can protect payment card data but what about other forms of electronic payment such as gift cards? Generally, this type of electronic assets does not have antifraud protection such as bank cards, which makes them an easy target for the cybercriminals. Research by specialists in [digital forensics](URL conclude that, in recent years, the number of illicit transactions related to electronic assets and gift cards has been increasing. Thinking like a fraud actor means considering all the options available to an attacker and admitting that certain systems or processes may have deficiencies. Identifying any weakness in existing antifraud programs can help companies to be better prepared for the worst of scenarios. **Monitor criminal forums in deep and dark web** Thinking like a criminal is just a part of the strategy. To anticipate a possible cyber fraud accurately, it is important to have an idea of the issues that are trendy among the [cybercrime](URL community. Not every organization considers this scenario, but it is important to have trusted people who are aware of todays deep and dark web. Some forums of deep and dark web focus on fraud, and in these forums, certain trends arise. For example, discussions related to the weak antifraud controls of online payment systems eventually manifested themselves empirically in more payment card frauds. The monitoring of deep and dark web can be one of the main sources of information on the new tactics and schemes of fraud used. But since access to these challenging and risky online communities, it is necessary for organizations to work with experts on the subject, avoiding security risks due to the nature of the information and the content that is handled in deep and dark web. **Determine possible links** Many experts in digital forensics have linked different types of fraud with certain geographic regions, forcing companies to make a great effort to better understand new schemes and tactics of fraud. This helps to establish causal relationships between the linguistic or cultural characteristics of a particular region with a certain type of specific fraud. But in recent years, new communities of cybercriminals have emerged rapidly in many more regions. Latin America is one of those examples. While scammers in Latin America were considered unsophisticated, disorganized, and unlikely to represent a real threat, these communities have evolved substantially. Many companies that previously had no reason to monitor the cybercriminals in this region of the world now strive to understand and combat the threats caused by scammers in Latin America. As threats and indicators can vary substantially in different regions and communities, monitoring these variations and new developments is a necessity for companies and anti-fraud teams."
8,cybercrime,u_webimprints09,Bitcoin gets 15% down in just a day,1,9fjqt8,https://www.reddit.com/r/u_webimprints09/comments/9fjqt8/bitcoin_gets_15_down_in_just_a_day/,2018-09-14 02:59:07,"The cryptocurrency value shows its lowest level in months Digital currency prices fell considerably for the second consecutive day due to the impact produced by Goldman Sachs and its decision to stop its plans to launch a persistent cryptocurrency desk. Ethical hacking specialists report that the price of a unit of Bitcoin, the most widely known digital currency in the world, fell by more than $1.1k USD in a period of 24 hours, representing a decrease of 15%, reaching a minimum of $6.279k USD, its lowest level in two weeks. Despite the apparent seriousness of the matter, a sector of the cryptocurrency community remains optimistic, saying that the virtual currency goes well beyond Goldman Sachs decisions. Then the question is, if Goldman Sachs abandons the idea of exploring the option of a cryptocurrency desk, can that single variable collapse everything? commented Naeem Aslam, exchange market analyst. The reality is that the future of Bitcoin is already being negotiated in the main stock exchanges. However, the volume has been scarce since day one, Im not saying it hasnt improved, it certainly has. But if you compare the volume of the Bitcoin to other major products, only then can you see the difference; so for me its more important to watch this part of the equation, the analyst mentions. Investors must have one thing in mind. Banks have a common goal: to make money for their customers. So investment banks can play an old trick: create a panic in the market in order to trigger a major sales wave. A perfect set to buy something when the bad news spreads. And then, when the market gets a little stable, we get news that Goldman Sachs is back to business. Who could be the biggest beneficiary of that scenario? For various experts in the cryptocurrency market, there are other probable causes of the decline in the value of the Bitcoin. A recent investigation by ethical hacking specialists found that an online wallet linked to the black market containing 111 114 Bitcoin recently began moving its assets for the first time since 2014. Of the total Bitcoin units, nearly 11k Bitcoin moved to Bitfinex and 4.4k moved to Binance, indicating an attempt to sell these assets on the market. Allegedly, operations with these assets were sufficiently substantial to reduce the price of the Bitcoin. On the other hand, a sector of virtual asset market analysts attributes depreciation to a technical collapse, which seems to be the most probable cause. Either way, this depreciation was not caused by a single motive and, according to specialists in ethical hacking from the International Institute of Cyber Security it is likely that these types of assets continue to attract attention, either by the volatility in their values or by cybercrime events related to cryptocurrency holders and exchanges."
9,cybercrime,u_webimprints09,"Mobile apps, the most used fraud method",1,9hgpsj,https://www.reddit.com/r/u_webimprints09/comments/9hgpsj/mobile_apps_the_most_used_fraud_method/,2018-09-21 02:29:05,"A security report warns on increasing criminal activity through fraudulent mobile apps An undercover security unit infiltrated into cybercriminals groups has revealed an alarming increase in fraudulent transactions carried out through mobile apps. The operation findings, published in the report of an ethical hacking firm, found that between April 1 and June 30, 2018, the fraudulent activity carried out through mobile browsers and applications constituted 71% of overall cybercrime operations, representing a 16% increase over the same length of time as the previous year. The report also highlights the increase in fraudulent mobile apps, identifying 9.1k of these developments, which have become the most common vehicle for cybercrime, involving also the use of burner devices and fake accounts by the hackers. Specialists in ethical hacking estimate that fraudulent transactions made through false accounts and burner devices contributed 27% of the total value of the profits generated by these criminals. A burner device is the name given to a very low cost mobile phone that can be used temporarily until it is considered burned, which means it is too risky to use. These devices can be purchased with prepaid minutes and without any contract, allowing those who use them to easily hide their identity. This method of theft is particularly lucrative as seen in the report, indicating that, the value of a fraudulent operation ranges at an average of $335 USD. During this operation, the undercover unit also recovered nearly 5.1 million of payment cards and previews of compromised cards hosted on fraudulent websites and other sources, representing an increase of 60% of information in front of that from last year. The report also warns about variants of fraud that do not involve the intervention of more than one person (human-not-present fraud), highlighting how purchases on autonomous machines will lead to new authentication challenges for consumers, banking institutions and traders, who will have to change their security protocols to better manage emerging risks. Specialists in ethical hacking from the International Institute of Cyber Security consider in the same way that in the short term there will be an increase in the type of cybercrime that does not necessarily require the act of a hacker, and organizations must behave at the level of the challenge."
10,cybercrime,u_webimprints09,Mirai botnet developers collaborate with the FBI,2,9ijgzs,https://www.reddit.com/r/u_webimprints09/comments/9ijgzs/mirai_botnet_developers_collaborate_with_the_fbi/,2018-09-25 02:36:06,"In exchange for less severe penalties, the three hackers are collaborating with the federal authorities Three young hackers, who had been sentenced last year to help create and spread the well-known Mirai botnet, are now helping the FBI to investigate other complex cybercrime cases in exchange for less severe penalties, as reported by specialists in ethical hacking. Paras Jha, (21 years old) from New Jersey, Josiah White, (20 years old) from Washington and Dalton Norman, (21 years old) from Louisiana, pleaded guilty in late December 2017 of multiple charges for their role in the creation and hijacking of hundreds of thousands of Internet of Things (IoT) devices to make them part of a notorious botnet known as Mirai. The Mirai malware performed scans for routers, cameras, digital video recorders and other unsecured IoT devices that used their default passwords (or had no password) and then made them part of a botnet. The three young men developed the Mirai botnet to attack the Minecraft video game servers, but after realizing that their invention was powerful enough to launch denial-of-service (DoS) attacks in record time, they decided to publish Mirais source code. The publication of the source code generated more cyber attacks by several criminal gangs against websites and Internet infrastructure, one of which was the popular DNS provider Dyn, an incident that unused much of the Internet on the east coast in October 2016. After an investigation into the attacks of the botnet Mirai, the hackers were identified and sentenced in December 2017. Serving part of the sentence After US prosecutors recently announced that the three hackers had provided extensive and exceptional assistance in more than a dozen cases, a federal judge in Alaska sentenced each of the hackers to a five years parole, instead of going to prison. The trio was also sentenced to pay $127k USD in damage repair, comply with 2.5k hours of community service and voluntarily deliver significant cryptocurrency amounts derived from their illicit activities. According to recently filed judicial documents, Jha, White and Norman have been working with ethical hacking teams from government agencies for over a year, and will continue to cooperate. For example, prosecutors asked for the advice of the trio to disrupt the activities of the botnet Kelihos, a global network of more than 100k infected computers that were used to send spam, steal access passwords and infect other computers with ransomware and other types of malware. According to specialists in ethical hacking from the International Institute of Cyber Security, the three hackers also helped law enforcement agencies to stop the DoS attack based on Memcached, a tool that helped its operators launch attacks thousands of times more efficient than a common attack."
11,cybercrime,u_webimprints09,US Secret Service warns of new ATM attacks,1,9mgxkw,https://www.reddit.com/r/u_webimprints09/comments/9mgxkw/us_secret_service_warns_of_new_atm_attacks/,2018-10-09 04:26:25,"**A new way to steal payment cards data has triggered alerts on banks** &amp;#x200B; Specialists in [ethical hacking](URL from the International Institute of Cyber Security report that the US Secret Service is warning financial institutions about a new way to force ATMs that involves cutting several holes in these devices and then use a combination of magnets and medical devices to extract data from customer accounts directly from the card reader inside the cashier. &amp;#x200B; According to a security alert distributed to banking institutions privately, the Secret Service has received multiple reports on a complex form of skimming in which malicious agents invest several days to perform. &amp;#x200B; This type of attack, known as [ATM Wiretapping](URL begins when thieves use a drill to make a relatively large hole in the front of an ATM. Then the hole is hidden with a metal plate. The thieves will then fish the card skimming device through the hole and connect it to the internal card reader using a magnet. &amp;#x200B; According to ethical hacking experts reports, robbers often perform this installation with an endoscope, a thin, flexible instrument used in medicine to give doctors a look within the human body. By connecting a USB endoscope to their smartphone, intruders can look inside the ATM to make sure their skimmer has been connected to the reader correctly. &amp;#x200B; The Secret Service says that once the skimmer is in place and the hole has been patched, thieves will often wait a day or so to place a camera. Thieves are believed to take this time to ensure that the drilling vibrations do not trigger an alarm from the non-slip ATM technology, mentions the security alert. When thieves are convinced that they have not activated any internal alarms when drilling and searching within the ATM, they return to finish the job by adapting a hidden camera inside the cashier. &amp;#x200B; It is difficult to cite all the Secret Service reports without giving the thieves a detailed plan on how to carry out these attacks. However, there is knowledge about several sources that spend a lot of time monitoring cybercrime and ethical hacking forums that have shared several documents with instructions, apparently providing details about how to execute these attacks. This type of knowledge circulates more fluently than ever in the cybercrime community. &amp;#x200B; Specialists in the topic consider that it is becoming increasingly difficult to detect skimming devices in ATMs, as many are designed to integrate within several components of the device. They also recommend that users focus on protecting their own physical integrity while at the ATM. If you visit an ATM that seems strange, altered or out of place, try to find another machine. Use only ATMs in public and well-lit areas, and avoid those in isolated locations. &amp;#x200B; The most important thing is to cover the cashiers keyboard with your hand when you enter your PIN, that way, even if the thieves get access to your card, there is less chance that they can also get your PIN. You would be surprised to find out how many people omit this basic precaution."
12,cybercrime,u_webimprints09,Unlimited money withdrawal from ATM: new hacking attack,1,98uvuh,https://www.reddit.com/r/u_webimprints09/comments/98uvuh/unlimited_money_withdrawal_from_atm_new_hacking/,2018-08-21 02:05:48,"Financial institutions have already been prevented The Federal Bureau of Investigation (FBI) warns cyber security organization teams of banking institutions that hacker groups are preparing to carry out a highly coordinated global fraud scheme identified as ATM cash out, in which a bank or payment cards processor is intervened and cloned cards are used in ATMs around the world to fraudulently withdraw millions of dollars in just a few hours. The FBI has collected reports indicating that hacker groups plan to carry out an ATM cash withdrawal scheme in the next few days, probably associated with a security breach against a card issuer, mentions a statement from the investigation agency. The FBI mentions that, in order to carry out the cash out operation, the attackers would compromise a financial institution with malware to access the banks client card information and exploit the access to the network, which would allow the ATM large scale theft. Organized cybercrime groups that coordinate attacks usually do so through phishing campaigns against banks to inject malware. Just before executing ATM withdrawals, intruders eliminate anti fraud security measures in the financial institution, such as maximum amounts of ATM withdrawals and any limit on the number of ATM transactions a user can perform in a single day. Attackers also alter account balances and security measures to make an unlimited amount of money available at the time of transactions, allowing a quickly cash out. Hackers often create fraudulent copies of legitimate cards by collecting data, warn FBI cyber security organization specialists. Later, other members of the criminal network withdraw funds from ATMs. Nearly all ATMs cash out operations are held on weekends. Last month, apparent cash out operations were disclosed, used to extract a total amount of $2.4M USD from Blacksburg National Bank accounts, made in two separate withdrawals from ATMs between May 2016 and January 2017. In both cases, the hackers managed to deceive a worker from the small bank based in Blacksburg, Virginia. From there, the attackers endangered the systems that the bank used to manage the credits and debits in the clients accounts. The FBI is urging banks to review their cyber security organization measures, such as implementing solid password requirements and two factor authentication using a physical or digital token when possible. According to reports of cyber security organization experts from the International Institute of Cyber Security, the FBI estimates that the attack would begin to be implemented in the coming days."
13,cybercrime,u_webimprints09,$1M USD per minute is lost due to cybercrime,1,9baxjv,https://www.reddit.com/r/u_webimprints09/comments/9baxjv/1m_usd_per_minute_is_lost_due_to_cybercrime/,2018-08-30 02:42:13,"More than 5K cases of publicly reported security incidents per minute are registered too Every 60 seconds $1.1M USD is lost because of cybercrime. This alarming figure has been calculated by cyber security organization specialists who compiled their own and third-source researches to analyze the malicious behavior of hackers. The resulting report, called Evil Internet Minute, bluntly describes the costs of cybercrime. Likewise, every minute there are 5518 records of cyber security organization incidents publicly disclosed. Around the world, when a large organization is affected by a cyberattack, the average cost is $11.7M USD per year and $222 per minute. All this despite the fact companies are spending about $171K per minute in system defenses. The investigation also concluded that an average of 1861 people are victims of online scams every minute, and on average 1.5 organizations are victims of ransomware attacks in the same time span (with an average cost for companies of $16K USD). In general, 2.7 million people are victims of cybercrime every 60 seconds. The report also states that phishing sites have lagged behind in the practice of cybercrime, as only one of these appears every five minutes. In addition, new sites running the CoinHive virtual currency mining script appear only once every 10 minutes. The vulnerable third-party code, which many organizations dont even know they are running, has become a central theme in recent cyber security organization events. Every minute, four potentially vulnerable web components are discovered, according to the research. This has different applications: for example, the Magecart group hacked third-party Javascript that allowed them to access hundreds of e-commerce sites at once and inject them with credit card skimming scripts. When users entered the details of their credit card to buy anything, they were sent directly to the attacking server, so there was no way for them to discover that they were being attacked, the cyber security organization experts in charge of the investigation claimed. User consciousness will always be a problem because hackers continually adjust their tactics to stay ahead and deploy their attacks; social engineering has been a problem since before the Internet existed, and it will remain a problem as long as we use any digital platform for our daily activities. For cyber security organization specialists from the International Institute of Cyber Security, the most troubling part of the deployment of a cyberattack is that usually no one realizes at the time, so there is not much that users can do to protect themselves."
14,cybercrime,u_webimprints09,Data of 200 million Japanese for sale in a hacker forum,1,8mu6c2,https://www.reddit.com/r/u_webimprints09/comments/8mu6c2/data_of_200_million_japanese_for_sale_in_a_hacker/,2018-05-29 08:59:01,"A malicious actor was found operating outside of China, selling the data of approximately 200 million Japanese users in a clandestine cybercrime forum, according to a FireEye iSIGHT Intelligence report. According to [information security](URL experts, the data seems to have been gathered by hacking about 50 small Japanese sites and put up for sale as a large file in December 2017. After an analysis of a sample of data, professionals identified the hacked targets as small Japanese websites are activated in the retail, food and beverage, financial, entertainment and transportation sectors. FireEyes information security experts say the data is authentic, as it contains data about users whose personal information has been leaked in other infractions, but also contains data from new users. The mix of new and old data is confirmed by other clues that suggest that some data come from leaks that took place in 2016. The filtered data varies depending on the website from which they were stolen, but includes real names, email addresses, birth dates, phone numbers and private addresses, experts said. The price for the file is  1,000 CNY, about $ 150.96 USD. In the forum in which the hacker was selling the data, several actors commented that they bought the PII cache but did not receive the files. It is not clear if these comments are true. While the data sold does not contain very confidential information, the stolen information may facilitate identity theft, spam, malware propagation and fraud. Some inconsistencies remain about the origin of some of the data. The professionals managed to trace the online identity of the malicious actor to social network identification QQ, which is also linked to the online personality of another hacker. The QQ address is connected to a person in the Chinese province of Zhejiang, the researchers said. This person seems to have been active since 2013. FireEye [information security](URL professionals commented that the malicious actor has been linked to the sale of data in multiple forums: data from companies in other countries, such as China, Taiwan, Hong Kong, Australia, New Zealand and countries of America."
