,topic,subreddit,title,score,id,url,created,body
0,cybercrime,u_webimprints09,DO YOU HAVE THE REQUIRED SKILLS TO WORK FOR CYBERCRIMINALS?,1,agngwx,https://www.reddit.com/r/u_webimprints09/comments/agngwx/do_you_have_the_required_skills_to_work_for/,2019-01-17 04:29:25,"**Criminal gangs seek to recruit people with advanced computer skills** According to network security specialists from the International Institute of Cyber Security, cybercriminals gangs are always looking for people capable for deploying intimidation, threat, harassment, and extortion and cyberattack campaigns against various services, platforms and users. Last November, for example, a group of hackers known as [**The Dark Overlord**](URL began circulating an ad through various hacking forums; Do you want to get rich? Join us, the ad mentioned. The Dark Overlord is a renowned cybercriminals group focused primarily on data theft and extortion of thousands of victims. This gang is just one of countless criminal hacker groups that keep using multiple darknet forums to recruit new members and continue selling stolen data, extortion and attack on websites. **Network management and programming skills** According to [**network security**](URL experts, The Dark Overlord is recruiting hackers with at least 10 years of experience in specific areas, such as application design and network management on Windows and Linux systems, as well as programming in the most used languages. You must have at least 10 years of experience in network management or programming, this requirement is not negotiable, mentions the announcement of the group of hackers. We do not accept freelancers; you must prove at least 5 years of experience working in a cooperative environment. In addition, you should be able to provide innovative approaches to our regular activities, concludes the announcement. The criminal group offers its new full-time employees a monthly salary close to $65k USD, with the possibility of increasing to $90k USD after two years of work, as reported by the network security experts. **Higher salaries for multilingual hackers** Malicious hackers with multilingual communication and programming skills could get better payments. According to the announcement, The Dark Overlord would pay an extra 5% to the salaries or commissions of hackers with additional language domain, especially German, Arabic and Chinese. **Diversifying dissemination methods** Criminal organizations like The Dark Overlord are not only looking for individuals with advanced computer skills and knowledge. Such groups also need to recruit staff to cover positions that do not require the least knowledge of hacking; some people, for example, are recruited to deploy propaganda outside the darknet (using graffiti, for example) to disseminate information about Telegram groups, key names for drug and weapon sales forums, among other activities. Other non-specialized works for which cybercriminals require personnel is data entering and manual CAPTCHA solution. Although to a lesser extent than a job as a hacker, these jobs can be very lucrative, especially for students or young people without occupation. In countries like Ukraine, for example, a job as a CAPTCHA solver is close to $150 USD a month, much higher than the scholarship of an average of $60 USD per month that Ukrainian students can apply for. Despite the risks of enrolling in this kind of activity, there are many people willing to collaborate with cybercrime. According to a report by cybersecurity specialists, three of the four hacker vacancies that the Dark Overlord announced were covered only a few days after the ad was published. "
1,cybercrime,u_webimprints09,MASSIVE ARREST OF CURRENCY COUNTERFEITERS OPERATING IN DARK WEB,1,a5vxj1,https://www.reddit.com/r/u_webimprints09/comments/a5vxj1/massive_arrest_of_currency_counterfeiters/,2018-12-14 05:05:13,"**Over 200 members of a fraudulent scheme were arrested by European agencies** The [**dark web**](URL has become a space of proliferation for all kinds of illicit activities; criminal associations engaged in drugs sale, malicious software distribution and children exploitation act freely over this platform. To counter the activities of these groups, law enforcement agencies across Europe, led by **Europol**, implemented a coordinated operation through 13 countries to combat this kind of crimes. According to specialists in digital forensics from the International Institute of Cyber Security, this operation was launched last November, with agencies across Europe chasing multiple members of gangs dedicated to money laundering and other crimes throughout dark web. Europol stated through a press release that 235 people were arrested during this operation, mostly for crimes related to money counterfeiting. In addition, the agency reported that 300 houses were raided. A key factor for the success of this operation was the carelessness of one of the suspects, as their limited security measures allowed a data leaking that the agencies used to track an illegal transaction. Thanks to unencrypted information, it was easier for agencies to identify gang members involved in money counterfeit. According to experts in digital forensics, the operators of this scam received payments in cryptocurrency, but they managed a record of their clients email addresses. In addition to the arrests performed, the authorities seized almost two thousand euro banknotes of various denominations, as well as multiple weapons, drugs, hardware for cryptojacking, computers, smartphones and virtual assets (Bitcoin). On the other hand, the French police discovered two facilities dedicated to the cultivation of marijuana and an illegal print shop. 2018 has been a prominent year in the fight against dark web crimes. Last June, the Austrian authorities shut down a dark web portal and succeeded in arresting its operators in an operation run by the Austrian Federal Police Office and Europol. During this operation, a counterfeit euro printing press was also shut in Leoben, Austria. This installation had the necessary resources to print banknotes of 10, 20 and 50 euro; according to the authorities estimates, before shut down, the criminals had printed about 10k. However, cybersecurity and [**digital forensics**](URL specialists believe that the fight against counterfeiting in dark web has just begun, as similar services can still be found available in multiple forums dedicated to cybercrime around the world. This joint operation is the sign that there is no such thing as absolute anonymity on the Internet. If you carry out illicit activities online, sooner or later police agents will be knocking at your door, says Wil van Gemert, operation officer from Europol. The agency will continue to work with the Member States to combat this kind of crime, said the official."
2,cybercrime,u_webimprints09,Pakistani banks suffer data breach,1,9x2lt4,https://www.reddit.com/r/u_webimprints09/comments/9x2lt4/pakistani_banks_suffer_data_breach/,2018-11-15 05:18:59," **According to an official of the Pakistani Federal Investigation Agency, almost all the banks of the country were affected by a recent security breach** Almost all Pakistani banks were affected by a recent security breach, a fact that has been revealed by researchers of a cybersecurity and digital forensics firm, and subsequently confirmed by the head of the cyber crimes area of the Federal Investigation Agency (FIA) of Pakistan. According to a recent report we have received, data of almost all Pakistani banks have been hacked, said retired Captain Mohammad Shoaib, director of Cybercrime area at the FIA last Tuesday. The comment made by Captain Mohammad Shoaib came after the discovery made by the information security firm about a new deposit of Pakistani credit and debit cards in [dark web](URL forums. The agency is investigating more than 100 cases related to this security breach. Over 100 cases have been registered in the FIA and are under investigation. We have made several related arrests, including an international gang of hackers, said Captain Shoaib. The data found in dark web forums include 20k debit card details from Pakistani citizens. The data belongs to clients of most of the banks operating in the country, according to reports of specialists in digital forensics from the International Institute of Cyber Security. Captain Shoaib mentioned that hackers behind the security breach are operating outside Pakistani territory and attacking multiple banking institutions. Large sums of money have been stolen from peoples accounts, he added. This recent attack has made it quite clear that it is necessary to improve the security system of our banks. The FIA notified its findings to all the banks of the country and convened a meeting with its representatives with the intention of responding to the incident, mitigating the damage and improving the security of the banks in general. Banks are responsible for protecting the money that people choose to store in them, Shoaib said. They are also responsible if their security measures are so weak that they facilitate access to malicious agents. It is still unclear when the security breach occurred and how the attackers gained access to banking systems. Pakistani banks face a serious security emergency, last week a cyber attack on Bank Islami allowed attackers to steal at least 2.6 million of Pakistani rupees from their accounts (about $20k USD). Last weekend, some Pakistani banks suspended the use of their debit cards out of the country, and blocked all international transactions made with their cards. One of Pakistans most important financial institutions informed its customers that its online mobile banking services would be temporarily suspended from November 3 until a new notice. The Pakistan governments information security and [digital forensics](URL team published a report detailing the extent of data leaking, as well as a possible timeline. The government experts believe that the data was obtained through the technique of cloning payment cards known as card skimming. According to the report, the first card database was put on sale on the site JokerStash. These databases, identified as PAKISTANWORLD-EU-MIX-01, contain over 11k records, of which more than 8k are related to at least nine Pakistani banks. These cards were offered for sale in various cybercrime forums for prices of between $100 and $160 USD. "
3,cybercrime,u_webimprints09,Pwn2Own Tokyo 2018 ethical hacking event,1,9z5ce3,https://www.reddit.com/r/u_webimprints09/comments/9z5ce3/pwn2own_tokyo_2018_ethical_hacking_event/,2018-11-22 04:35:53," **Sponsors paid over $100k USD for iPhone X exploits** The ethical hacking event Pwn2Own 2018, conducted in Tokyo, organized by Zero Day Initiative was a success, as reported by specialists in digital forensics from the International Institute of Cyber Security. During the event, participating cybersecurity specialists earned more than $300k USD for disclosing flaws that affected various smartphone models from several manufacturers. During the first day of the event Pwn2Own Tokyo 2018, the participants, experts on cybersecurity and digital forensics, hacked Apples [iPhone X](URL devices, Samsungs Galaxy S9 and Xiaomis Mi 6, generating revenues of more than $225k USD. The novelty of this edition of Pwn2Own was the implementation of a specific hacking session for Internet of Things (IoT) devices. The second day, the organizers delivered rewards of $100k USD for one iPhone and two Xiaomi hacks. The day began with the triumph of the team Fluoroacetato composed by experts in information security and [digital forensics](URL Amat Cama and Richard Zhu, who hacked an iPhone X exploiting a Just-In-Time (JIT) vulnerability and an out of bonds flaw. Specialists received $50k USD for leaking device information, successfully extracting a previously deleted photo from the hacked device. In another test, the Fluoroacetate team failed in their attempt to demonstrate a base-band exploit directed against iPhone X devices in time, but the experts successfully exploited an overflow of integers in the web browsers JavaScript engine Xiaomi to leak an image stored in the phone, earning $25k USD. Researchers Georgi Geshev, Fabi Beterke and Rob Miller of the LaterMWR Labs team also failed in their attempt to hack an iPhone X in the browser category, as they were unable to use their exploit chain within the time the test allowed them. Later, this team hacked the Xiaomi Mi6 in the browser category using a download error along with a stealth app installation to load their custom application and leak the images of the device, thanks to this the team won $25k USD. The organizers reported the vulnerabilities found to the respective vendors, who paid a total of $325k USD for 18 zero-day vulnerabilities, of which $110k USD were paid for vulnerability reports on iPhone X. These security bugs could have been exploited by a persistent attacker or a surveillance company to compromise a device through the browser or Wi-Fi feature. This type of vulnerability can reach much higher prices in the cybercrime community. Overall, we grant a total of $325k USD during the two days of the event, buying 18 zero-day exploits. Manufacturers and developers received reports of these errors and now have 90 days to launch security patches to address these vulnerabilities. Once the updates are published, the user must remain attentive to their implementation, is mentioned on the official website of Pwn2Own Tokyo 2018."
4,cybercrime,u_webimprints09,US approves bill for creation of new cybersecurity agency,1,9zfwg6,https://www.reddit.com/r/u_webimprints09/comments/9zfwg6/us_approves_bill_for_creation_of_new/,2018-11-23 04:12:17," **The Cybersecurity and Infrastructure Security Agency Act addresses the White House for President Trumps approval** A recently approved bill seeks to restructure the US [Department of Homeland Security](URL National Directorate of Protection and Programs (NPPD) to become a new cybersecurity agency. According to reports of specialists in digital forensics and information security, only the approval of President Trump is needed to make this concrete. The Cybersecurity and Infrastructure Security Agency Act, which was passed in the Senate in October and in the House of Representatives this week, essentially reconverts NPPD as the Cybersecurity and Infrastructure Security Agency (CISA). According to specialists in digital forensics from the International Institute of Cyber Security, CISA will be responsible for leading the programs to protect critical infrastructure and cyber security, develop associated policies and coordinate security matters with private sector and federal entities. The new agency will have a cyber security division, an infrastructure security division and an emergency communications division. Christopher Krebs, the current undersecretary of the NPPD, will lead CISA. The reorganization will optimize cybersecurity within DHS, while improving its ability to engage with government and some industry sectors, Krebs said in a statement this week. Giving the NPPD a name that reflects what it really does will help to better protect the nations critical infrastructure and cybernetic platforms, he added. This law arises in a context of growing threats to the critical infrastructure and the US industry by rival nations and increasingly sophisticated cybercriminals groups. The concerns of the American government have been increasing over the past few months. Geopolitical tensions between the US and countries like China, Russia, North Korea, and Iran have only exacerbated those concerns. However, the big question posed by experts in [digital forensics](URL is whether rearranging NPPD in a new agency really is a significant change in the interests of cybersecurity. Im concerned that the only name change does not elevate performance levels to what the nation needs, says Alan Paller, a specialist in information security issues. Paller points out that there has been some sort of internal battle between NPPD and the DHS Science and Technology Group, which is responsible for researching, developing, testing and evaluating technologies in support of the DHS mission. On the other hand, Colin Bastable, an expert in cybersecurity, says that the feds need a cybersecurity division for businesses, non-federal assets and consumers, in a similar way to the FBI. DHS will never address the problems that citizens and private companies face because of cybercrime because the main focus of DHS is the federal government, says Bastable. A federal cybersecurity office would focus on protecting Americans as consumers and employees, and the companies that employ them. It would be responsible for investigating and attacking the cyber criminal gangs and anticipating possible attacks. From the perspective of cybersecurity, DHS will always focus on federal infrastructure and critical systems, says Bastable. Despite how great the DHS structure is, it will never be enough to fight the cyber threats we face."
5,cybercrime,u_webimprints09,How to become an expert in digital forensics,1,9oe91p,https://www.reddit.com/r/u_webimprints09/comments/9oe91p/how_to_become_an_expert_in_digital_forensics/,2018-10-16 03:32:24,"&amp;#x200B; **A review of the interesting work of the experts in digital forensics** What exactly does a professional in digital forensics do? In general, experts in [digital forensics](URL are computer detectives that collect and analyze evidences of computers, networks and any other type of device with data storage capacities. In their role as Sherlock Holmes, the digital forensics experts will investigate the footprints of the most complex cybercrime to find those responsible, whether they are white collar criminals, cyber terrorists or [malware](URL **What are the responsibilities of a digital forensics expert?** * Investigate data thefts and other security incidents * Dismantle and rebuild damaged systems to recover lost information * Identify additional systems or compromised networks in cyberattacks * Collect useful evidence for legal processes * Draft technical reports on the investigated cases Digital forensics specialists work for large corporations, law enforcement agencies, legal firms and private consultants. Larger companies even have their own digital forensic areas. The Government is a considerable working field for these professionals, an example of which is the FBI-owned Computer Analysis and Response Team (CART), which employs more than 500 digital forensic professionals. **Forensic Professional trajectory** Regularly the specialization of the digital forensics begins early. An example of career progression in a company or consultancy would be: * Digital forensics analyst junior * Digital forensics analyst senior * Digital forensics manager senior **Similar jobs** Other ways to refer to digital forensics experts include: * Computer crimes investigator * Forensics in computing * Specialist in digital crimes * Forensics analyst * Forensic computing technician **Salary of a digital forensics expert** According to a recent investigation, the average salary of a digital forensics is $77.2k USD. Overall, the annual salaries of digital forensics range from $55.7k USD to $119k USD. This includes the annual base salary, bonuses, commissions, overtime and other incomes. **Labor requirements** Usually newbies have a bachelors degree in computer science or engineering with a focus on cyber security, digital forensics or a related field. It is not enough to know about computer systems; cybercrime techniques must be understood as well. To increase your employment prospects, you can choose to seek specialized training in digital forensics. It may be possible to become a digital forensic expert without a bachelors degree, but it is complicated. Employers will want to check for academic background and professional experience. **Work experience** The requirements will vary according to the needs of the employer. An analyst with an initial level of work may need only 1 or 2 years of experience in digital forensics, although 3 years are a more acceptable standard. A higher work will require a minimum of 5 years experience. **Skills and competencies** * Network knowledge, including network communications based on TCP/IP * Domain of Windows, UNIX and Linux operating systems * Domain of hardware and software systems * Cloud computing * Digital forensics software Remember, to catch a criminal, you must think like a criminal. A digital forensics analyst has to be incredibly curious about how computers work and how people behave as well. In addition to curiosity and knowledge, the digital forensics is expected to have oral and above-average communication skills. A considerable part of an experts work is devoted to writing reports and explaining evidence. Organizations such as the International Institute of Cyber Security have the most competent professionals in the training of experts in [digital forensics](URL which represents a great support for those who want to raise their work expectations in this demanding field."
6,cybercrime,u_webimprints09,"Russian and Chinese hackers, two different approaches to cybercrime",1,9op720,https://www.reddit.com/r/u_webimprints09/comments/9op720/russian_and_chinese_hackers_two_different/,2018-10-17 03:25:16," **Each hacker community looks for different things** An analysis of professionals in [digital forensics](URL about the criminal activity of Russian and Chinese hackers reveals several differences between the two communities in terms of interests and ways of doing business. In the past, researchers monitored the activity of several markets used to deal with illegal content or tools used to carry out illicit activities. they focused on hacker communities in China and [Russia](URL discovering that members of the communities rarely mingle in clandestine forums, and they find different motivations. **Illegal market for Russian hacking** Contrary to popular belief, most Russian cybercrime communities are still accessible through the conventional network, with forums that configure servers on the Tor network as a backup in case of deletion and for users who navigate without VPN services. Administrators resort to other methods to keep their forums running, and the blockchain-based DNS is one of them. In closed forums (completely private communities) access is possible through the endorsement of an active member of the community. Infiltrators are expelled from the community quickly and exposed to avoid them. According to specialists in digital forensics, the forums where Russian cybercriminals meet are well organized and members are only interested in doing business; they carefully guard their resources and adopt a business strategy to make as much money as possible. Malicious programs, such as banking trojans, are sold in a similar way to products such as antivirus, a purchase is valid for a user license, researchers add. A common practice is that the malware author has full control of the source code. This not only guarantees the maximum monetization, but also protects the property against the creation of similar malware. The type of content and illegal services offered in these forums is the same as always, but adapted to the current demands: ransomware, trojans, exploits, spambots, are the type of developments most commonly found in these forums. **Chinese hacking forums** Chinese malware and illegal services vendors dont keep many similarities with their Russian counterparts. First, they do not enjoy the same level of access to tools and information because of the limitations that the Asian country has imposed on Internet browsing. Along with the language barrier, this leaves China in a certain way isolated, creating a local market for hackers with less skills. Access to more advanced tools is possible, but access to them requires jump  the great Chinese wall of the Internet, something that not any hacker gets. In China, hackers are mainly dedicated to offering VPN services, as the government maintains restrictions on navigation on the conventional web. One of the major differences between Russian and Chinese hackers is the fact that Chinese hackers encourage joint work. They help each other and share the source code of the tools they use, report specialists in digital forensics from the International Institute of Cyber Security. Both Russian and Chinese hackers share an appetite for illegal activity, but using different methods. The firsts ones are more interested in making money, while in China they worry more about transcending the barriers their government has imposed on the use of the Internet."
