,topic,subreddit,title,score,id,url,created,body
14,CVE,windows,"Windows 7, Windows 8.1, Windows Server 2008 R2 and Windows Server 2012 R2 updates for 4/9/19",7,bbb29l,https://www.reddit.com/r/windows/comments/bbb29l/windows_7_windows_81_windows_server_2008_r2_and/,2019-04-10 03:54:57,"Via the Microsoft Support website ([8.1/2012 R2](URL [7/2008 R2](URL ### For Windows 8.1 and Windows Server 2012 R2: * Provides protections against Spectre Variant 2 (CVE-2017-5715) and Meltdown (CVE-2017-5754) for VIA-based computers. These protections are enabled by default for the Windows Client, but disabled by default for Windows Server. For Windows Client (IT Pro) guidance, follow the instructions in [KB4073119](URL For Windows Server guidance, follow the instructions in [KB4072698](URL Use these guidance documents to enable or disable these mitigations for VIA-based computers. * Addresses an issue that may cause applications that use MSXML6 to stop responding if an exception was thrown during node operations. * Addresses an issue that causes the Group Policy editor to stop responding when editing a Group Policy Object (GPO) that contains Group Policy Preferences (GPP) for Internet Explorer 10 Internet settings. * Addresses an issue with Custom URI Schemes for Application Protocol handlers, which may not start the corresponding application for local intranet and trusted sites on Internet Explorer. * Addresses an issue that may cause authentication issues for Internet Explorer 11 and other applications that use **WININET.DLL**. This occurs when two or more people use the same user account for multiple, concurrent login sessions on the same Windows Server machine, including Remote Desktop Protocol (RDP) and Terminal Server logons. * Security updates to Windows Storage and Filesystems, Windows Server, Microsoft Graphics Component, Windows Input and Composition, Windows Datacenter Networking, Windows Kernel, Windows MSXML, Windows SQL components, and the Microsoft JET Database Engine. ### For Windows 7 and Windows Server 2008 R2: &gt;Starting with KB 4493472 Monthly Rollup updates will no longer include PciClearStaleCache.exe. This installation utility addressees inconsistencies in the internal PCI cache. This can cause the symptoms listed below when installing monthly updates that do NOT include PciClearStaleCache: &gt;* Existing NIC definitions in control panel networks may be replaced with a new Ethernet Network Interface Card (NIC) but with default settings. Any custom settings on the previously NIC persist in the registry but were unused. * Static IP address settings were lost on network interfaces. * Wi-Fi profile settings were not displayed in the network flyout. * WIFI network adapters were disabled &gt;These symptoms are especially common on guest virtual machines and on machines which have not been updated since March, 2018. &gt;Administrators should ensure that any one or more of the Monthly rollups released between April 10, 2018 (KB 4093118 and March 12, 2019 (KB 4489878) have been installed prior to installing April 2019 and later updates. Each of these rollup updates includes PciClearStaleCache.exe. * Provides protections against Spectre Variant 2 (CVE-2017-5715) and Meltdown (CVE-2017-5754) for VIA-based computers. These protections are enabled by default for the Windows Client, but disabled by default for Windows Server. For Windows Client (IT Pro) guidance, follow the instructions in [KB4073119](URL For Windows Server guidance, follow the instructions in [KB4072698](URL Use these guidance documents to enable or disable these mitigations for VIA-based computers. * Addresses an issue that causes the error ""0x3B_c0000005_win32k!vSetPointer"" when the kernel mode driver, **win32k.sys**, accesses an invalid memory location. * Addresses an issue in which netdom.exe fails to run, and the error, The command failed to complete successfully appears. * Addresses an issue that may prevent Custom URI Schemes for Application Protocol handlers from starting the corresponding application for local intranet and trusted sites on Internet Explorer. * Addresses an issue that may cause authentication issues for Internet Explorer 11 and other applications that use **WININET.DLL**. This occurs when two or more people use the same user account for multiple, concurrent login sessions on the same Windows Server machine, including Remote Desktop Protocol (RDP) and Terminal Server logons. * Security updates to Windows Kernel, Windows Server, Graphics Component, Windows Input and Composition, Windows Datacenter Networking, Windows MSXML, and the Microsoft JET Database Engine."
15,CVE,windows,"Windows 7, Windows 8.1, Windows Server 2008 R2 and Windows Server 2012 R2 updates for 1/8/19",1,ae4bm7,https://www.reddit.com/r/windows/comments/ae4bm7/windows_7_windows_81_windows_server_2008_r2_and/,2019-01-09 17:58:28,"Via the Microsoft Support website ([8.1/2012 R2](URL [7/2008 R2](URL ### For Windows 8.1 and Windows Server 2012 R2: * Provides protections against an additional subclass of speculative execution side-channel vulnerability known as [Speculative Store Bypass](URL (CVE-2018-3639) for AMD-based computers. These protections aren't enabled by default. For Windows client (IT pro) guidance, follow the instructions in [KB4073119](URL For Windows Server guidance, follow the instructions in [KB4072698](URL Use these guidance documents to enable mitigations for Speculative Store Bypass (CVE-2018-3639). Additionally, use the mitigations that have already been released for Spectre Variant 2 (CVE-2017-5715) and Meltdown (CVE-2017-5754). * Addresses a security vulnerability in session isolation that affects PowerShell remote endpoints. By default, PowerShell remoting only works with administrator accounts, but can be configured to work with non-administrator accounts. Starting with this release, you cannot configure PowerShell remote endpoints to work with non-administrator accounts. When attempting to use a non-administrator account, the following error will appear: * New-PSSession: [computerName] Connecting to remote server localhost failed with the following error message: The WSMan service could not launch a host process to process the given request. Make sure the WSMan provider host server and proxy are properly registered. For more information, see the about_Remote_Troubleshooting Help topic. * Security updates to Windows App Platform and Frameworks, Windows MSXML, Windows Kernel, Windows Storage and Filesystems, Windows Wireless Networking, and the Microsoft JET Database Engine. For more information about the resolved security vulnerabilities, please refer to the [Security Update Guide](URL ### For Windows 7 and Windows Server 2008 R2: * Provides protections against an additional subclass of speculative execution side-channel vulnerability known as [Speculative Store Bypass](URL (CVE-2018-3639) for AMD-based computers. These protections aren't enabled by default. For Windows client (IT pro) guidance, follow the instructions in [KB4073119](URL For Windows Server guidance, follow the instructions in [KB4072698](URL Use these guidance documents to enable mitigations for Speculative Store Bypass (CVE-2018-3639). Additionally, use the mitigations that have already been released for Spectre Variant 2 (CVE-2017-5715) and Meltdown (CVE-2017-5754). * Addresses a security vulnerability in session isolation that affects PowerShell remote endpoints. By default, PowerShell remoting only works with administrator accounts, but can be configured to work with non-administrator accounts. Starting with this release, you cannot configure PowerShell remote endpoints to work with non-administrator accounts. When attempting to use a non-administrator account, the following error will appear: * New-PSSession: [computerName] Connecting to remote server localhost failed with the following error message: The WSMan service could not launch a host process to process the given request. Make sure the WSMan provider host server and proxy are properly registered. For more information, see the about_Remote_Troubleshooting Help topic. * Security updates to Windows Kernel, Windows Storage and Filesystems, Windows Wireless Networking, and the Microsoft JET Database Engine. For more information about the resolved security vulnerabilities, please refer to the [Security Update Guide](URL"
16,CVE,windows,"Windows 7, Windows 8.1, Windows Server 2008 R2 and Windows Server 2012 R2 updates for 8/14/18",6,97chah,https://www.reddit.com/r/windows/comments/97chah/windows_7_windows_81_windows_server_2008_r2_and/,2018-08-15 07:42:03,"Via the Microsoft Support website ([8.1/2012 R2](URL [7/2008 R2](URL ### For Windows 8.1 and Windows Server 2012 R2: * Provides protections against a new speculative execution side-channel vulnerability known as L1 Terminal Fault (L1TF) that affects Intel Core processors and Intel Xeon processors (CVE-2018-3620 and CVE-2018-3646). Make sure previous OS protections against Spectre Variant 2 and Meltdown vulnerabilities are enabled using the registry settings outlined in the Windows Client and Windows Server guidance KB articles. (These registry settings are enabled by default for Windows Client OS editions, but disabled by default for Windows Server OS Editions.) * Ensures that Internet Explorer and Microsoft Edge support the preload=""none"" tag. * Addresses an issue that may prevent your device from starting up properly if you install KB3033055 (released September 2015) after installing any Monthly Rollup dated November 2017 or later. ### For Windows 7 and Windows Server 2008 R2: * Provides protections against a new speculative execution side-channel vulnerability known as L1 Terminal Fault (L1TF) that affects Intel Core processors and Intel Xeon processors (CVE-2018-3620 and CVE-2018-3646). Make sure previous OS protections against Spectre Variant 2 and Meltdown vulnerabilities are enabled using the registry settings outlined in the Windows Client and Windows Server guidance KB articles. (These registry settings are enabled by default for Windows Client OS editions, but disabled by default for Windows Server OS editions.) * Addresses an issue that causes high CPU usage that results in performance degradation on some systems with Family 15h and 16h AMD processors. This issue occurs after installing the June 2018 or July 2018 Windows updates from Microsoft and the AMD microcode updates that address Spectre Variant 2 (CVE-2017-5715  Branch Target Injection). * Provides protections against an additional vulnerability involving side-channel speculative execution known as Lazy Floating Point (FP) State Restore (CVE-2018-3665) for 32-Bit (x86) versions of Windows."
17,CVE,windows,"Powershell Spectre/Meltdown check says ""BTIHardwarePresent: true"" and ""BTIWindowsSupportPresent: true"" but BTIWindowsSupportEnabled is still false? What to do next?",3,7pfc6d,https://www.reddit.com/r/windows/comments/7pfc6d/powershell_spectremeltdown_check_says/,2018-01-10 23:44:02,"Hello there, I installed the latest microcode update to my Intel CPU as well as the Windows 10 1709 Update KB4056892. After this I followed the instructions to check via Powershell (via: URL and I get the following results: &gt; Hardware support for branch target injection mitigation is present: True &gt; Windows OS support for branch target injection mitigation is present: True &gt; Windows OS support for branch target injection mitigation is enabled: False &gt; Windows OS support for branch target injection mitigation is disabled by system policy: False &gt; Windows OS support for branch target injection mitigation is disabled by absence of hardware support: False &gt; Speculation control settings for CVE-2017-5754 [rogue data cache load] &gt; Hardware requires kernel VA shadowing: True &gt; Windows OS support for kernel VA shadow is present: True &gt; Windows OS support for kernel VA shadow is enabled: True &gt; Windows OS support for PCID performance optimization is enabled: True [not required for security] &gt; BTIHardwarePresent : True &gt; BTIWindowsSupportPresent : True &gt; BTIWindowsSupportEnabled : False &gt; BTIDisabledBySystemPolicy : False &gt; BTIDisabledByNoHardwareSupport : False &gt; KVAShadowRequired : True &gt; KVAShadowWindowsSupportPresent : True &gt; KVAShadowWindowsSupportEnabled : True &gt; KVAShadowPcidEnabled : True The last lines are especially frustrating **BTIHardwarePresent : True** **BTIWindowsSupportPresent : True** **BTIWindowsSupportEnabled : False** **BTIDisabledBySystemPolicy : False** **BTIDisabledByNoHardwareSupport : False** Does anyone know how to enable Windows BTI Support in this case? Thanks!"
18,CVE,windows,LDAP Broke on our DC's after July 11th Security Updates CVE-2017-8563,47,6n4kv2,https://www.reddit.com/r/windows/comments/6n4kv2/ldap_broke_on_our_dcs_after_july_11th_security/,2017-07-14 07:10:54,"So I found this somewhat annoying but I see it documented in the release notes which were overlooked approving [an update this week.](URL &gt;FAQ &gt;In addition to installing the updates for CVE-2017-8563 are there any further steps I need to carry out to be protected from this CVE? Yes. To make LDAP authentication over SSL/TLS more secure, administrators need to create a LdapEnforceChannelBinding registry setting on a Domain Controller. For more information about setting this registry key, see Microsoft Knowledge Base article 4034879. For any other techs out there I'd like to point this out so they don't get the panic we had 10 minutes after updates installed [ Here's the article explaining the fix](URL Edit: I don't know any more than that reg key was missing from our DC's, we set it to 1 but read the article to find out more for your environment. Half the reason I posted it here was to find out if anyone had some more insight"
