,topic,subreddit,title,score,id,url,created,body
0,vulnerability,CERTCybSec,Apache Tomcat Patches Important Security Vulnerabilities,2,91h0b7,https://www.reddit.com/r/CERTCybSec/comments/91h0b7/apache_tomcat_patches_important_security/,2018-07-24 22:37:23,"The Apache Software Foundation (ASF) has released security updates to address several vulnerabilities in its Tomcat application server, one of which could allow a remote attacker to obtain sensitive information. URL __ #infosec #cybersecurity #vulnerability "
1,vulnerability,CERTCybSec,The Aurora Power Grid Vulnerability and the BlackEnergy Trojan,1,8ya6r1,https://www.reddit.com/r/CERTCybSec/comments/8ya6r1/the_aurora_power_grid_vulnerability_and_the/,2018-07-13 00:21:31," At recent Industrial IoT security briefings, the #Aurora #vulnerability has come up repeatedly. Attendees ask, Is our countrys power grid safe? How can we protect the grid? What is Aurora? This post provides a look at Aurora, and the BlackEnergy attack that can exploit Aurora. \_\_ #infosec #cybersecurity [URL"
2,vulnerability,CERTCybSec,Medium-Risk Windows 0Day: RCE in JScript Component,2,8ng1re,https://www.reddit.com/r/CERTCybSec/comments/8ng1re/mediumrisk_windows_0day_rce_in_jscript_component/,2018-05-31 16:00:34,"Vulnerability exploitation is to trick the victims into accessing a malicious web page, or download and open a malicious JS file on the system. The vulnerability does not allow a full system compromise because attackers can execute malicious code only within a sandboxed environment. Still, an attacker can bypass and execute its own code on the target system. Microsoft works on a security update. [Source](URL [Vulnerability Report](URL"
3,vulnerability,CERTCybSec,Zip Slip Vulnerability Affects Thousands of Projects Across Multiple Ecosystems,2,8ot7gp,https://www.reddit.com/r/CERTCybSec/comments/8ot7gp/zip_slip_vulnerability_affects_thousands_of/,2018-06-06 04:24:43,Security researchers have disclosed today details about a critical vulnerability impacting open source coding libraries that handle archived files. URL __ #infosec #cybersecurity #vulnerability 
4,vulnerability,CERTCybSec,Update Google Chrome Immediately to Patch a High Severity Vulnerability | #infosec #cybersecurity #vulnerability,2,8p45cy,https://www.reddit.com/r/CERTCybSec/comments/8p45cy/update_google_chrome_immediately_to_patch_a_high/,2018-06-07 06:36:41,"Security researcher Micha Bentkowski discovered and reported a high severity vulnerability in Google Chrome in late May, affecting the web browsing software for all major operating systems including Windows, Mac, and Linux. URL "
5,vulnerability,CERTCybSec,BranchScope Attack: A New Intel processor Vulnerability,1,87uhmx,https://www.reddit.com/r/CERTCybSec/comments/87uhmx/branchscope_attack_a_new_intel_processor/,2018-03-29 05:52:11,"A new vulnerability similar to Meltdown and Spectre, BranchScope can be exploited by an attacker to obtain potentially sensitive information they normally would not be able to access directly. The attacker needs to have access to the targeted system and they must be able to execute arbitrary code. Researchers believe the requirements for such an attack are realistic, making it a serious threat to modern computers, on par with other side-channel attacks. URL"
6,vulnerability,CERTCybSec,"Boeing hit with ransomware attack , Boeing says it detected a limited intrusion of malware",1,87yimi,https://www.reddit.com/r/CERTCybSec/comments/87yimi/boeing_hit_with_ransomware_attack_boeing_says_it/,2018-03-29 15:34:57,"A Boeing production plant in Charleston, South Carolina was hit by the Ransomware suspected as Wannacry. Boeing Says Suspected wannacry Attack Only Hit 'Small Number of Systems,Nevertheless, the attack triggered widespread alarm within the company. ======================================== Linda Mills, VP of Boeing commercial airplanes communications: A number of reported statements on this are overstated and inaccurate. Our cybersecurity operations center detected a limited intrusion of malware that affected a small number of systems. Remediations were applied and this is not a production or delivery issue. ========================================= Microsoft have previously patched the vulnerability exploited by Wannacry. More URL URL This story is developing. "
7,vulnerability,CERTCybSec,Microsoft Disseminated Excessive Number Of Security Advisories,1,7xm8gs,https://www.reddit.com/r/CERTCybSec/comments/7xm8gs/microsoft_disseminated_excessive_number_of/,2018-02-15 10:15:54,"Over the last days, Microsoft released over 50 security bulletins to update vulnerabilities on several products, where some of them are critical. Microsoft called them as February 2018 Security Updates: URL Microsoft declared that Exploitation of the Outlook (CVE-2018-0852) vulnerability requires that a user open a specially crafted file with an affected version of Microsoft Outlook software. In an email attack scenario, an attacker could exploit the vulnerability by sending the specially crafted file to the user and convincing the user to open the file. In a web-based attack scenario, an attacker could host a website (or leverage a compromised website that accepts or hosts user-provided content) that contains a specially crafted file designed to exploit the vulnerability. An attacker would have no way to force users to visit the website. Instead, an attacker would have to convince users to click a link, typically by way of an enticement in an email or instant message, and then convince them to open the specially crafted file. Please find more on: URL"
8,vulnerability,CERTCybSec,A New Variant of the AndroRAT Malware Appears in Threat Landscape,1,7xp9f8,https://www.reddit.com/r/CERTCybSec/comments/7xp9f8/a_new_variant_of_the_androrat_malware_appears_in/,2018-02-15 20:21:52,"Researchers from Trend Micro have observed a new variant of AndroRAT (remote access Trojan) disguised as a utility app called TrashCleaner. This latest variant includes code that triggers a very old vulnerability (CVE-2015-1805) that can allow for local elevation of privilege in the Android OS of certain devices. All unpatched Android devices running an OS based on kernel versions 3.4, 3.10 and 3.14, including all Nexus devices, are vulnerable. According to researchers at Trend, the RAT can inject root exploits to perform malicious tasks, such as silent installation, shell command execution, Wi-Fi password collection, and screen capture. ____ #infosec #CERTCybSec"
9,vulnerability,CERTCybSec,Dozen Vulnerabilities in Trend Micro Email Encryption Gateway,2,805f4b,https://www.reddit.com/r/CERTCybSec/comments/805f4b/dozen_vulnerabilities_in_trend_micro_email/,2018-02-26 03:19:27,"Security researchers at Core Security have discovered a dozen flaws in Trend Micro Linux-based Email Encryption Gateway, some of them have been rated as critical and high severity. The flaws received the CVE identification numbers CVE-2018-6219 through CVE-2018-6230. The most severe flaw could be exploited by a local or remote attacker with access to the targeted system to execute arbitrary commands with root privileges. URL URL #vulnerability #infosec #cybersecurity"
10,vulnerability,CERTCybSec,SAML Vulnerability May Allow Improper Authentication,1,80rltx,https://www.reddit.com/r/CERTCybSec/comments/80rltx/saml_vulnerability_may_allow_improper/,2018-02-28 11:19:31,Duo Finds SAML Vulnerabilities Affecting Multiple Implementations. This new vulnerability affects SAML-based single sign-on (SSO) systems. It can allow an attacker with authenticated access to trick SAML systems into authenticating as a different user without knowledge of the victim users password. Read the report: URL CERT/CC Bulletin: URL
11,vulnerability,CERTCybSec,A critical vulnerability has been discovered in Exim software a widely deployed MTA,1,82wkh8,https://www.reddit.com/r/CERTCybSec/comments/82wkh8/a_critical_vulnerability_has_been_discovered_in/,2018-03-08 21:35:27,"A critical vulnerability has been discovered in Exim, a widely deployed mail transfer agent. With a specifically crafted mail message, an attacker can exploit an off-by-one buffer overflow due to mishandling of base64 authentication. URL URL"
12,vulnerability,CERTCybSec,Critical flaw in Secure Access Control System: Cisco provides software to fix it,2,8346r2,https://www.reddit.com/r/CERTCybSec/comments/8346r2/critical_flaw_in_secure_access_control_system/,2018-03-09 16:00:57,"Cisco fixes security vulnerabilities in a wide variety of its products, including two critical flaws in its Secure Access Control System (ACS) and its Prime Collaboration Provisioning (PCP) software. CVE-2018-0147 in the ACS can be exploited remotely by an unauthenticated attacker and can be used to achieve remote code execution with root privileges. URL The vulnerability is due to insecure deserialization of user-supplied content by the affected software. An attacker could exploit this vulnerability by sending a crafted serialized Java object, Cisco explained. URL"
13,vulnerability,CERTCybSec,Triton Malware Exploited Zero-Day Flaw in Schneider Electric Safety Controllers,1,7s5gua,https://www.reddit.com/r/CERTCybSec/comments/7s5gua/triton_malware_exploited_zeroday_flaw_in/,2018-01-22 23:36:49,"Triton Malware Exploited Zero-Day Flaw in Schneider Electric Safety Controllers Schneider Electric has confirmed that a recently uncovered malware program that was used to attack industrial infrastructure exploited a vulnerability in its Triconex safety controllers. The malware, dubbed Triton, was uncovered in December by researchers from security firm FireEye after it triggered an emergency shutdown event at a critical infrastructure organization. It was the first case of malware designed to specifically infect industrial controllers after Stuxnet, which was used to destroy uranium enrichment centrifuges at Irans Natanz nuclear plant in 2010. URL _ #infosec"
14,vulnerability,CERTCybSec,Cisco Fixes Remote Code Execution Bug Rated 10 Out of 10 on Severity Scale - CVE-2018-0101,2,7u1727,https://www.reddit.com/r/CERTCybSec/comments/7u1727/cisco_fixes_remote_code_execution_bug_rated_10/,2018-01-31 01:02:30,"The vulnerability tracked using the CVE-2018-0101 identifier affects the following Cisco ASA devices but only if they have the ""webvpn"" feature is enabled in the OS settings. It is in the Secure Sockets Layer (SSL) VPN functionality of the Cisco Adaptive Security Appliance (ASA) Software. It could allow an unauthenticated, remote attacker to cause a reload of the affected system or to remotely execute code. Futher Information: Bleepingcomputer: URL Cisco: URL Zdnet: URL Exploit-AnyConnect, NCC Group security researcher Cedric Halbronn: URL "
15,vulnerability,CERTCybSec,Unpatched Adobe Flash Player Zero-Day Exploit Spotted in the Wild,1,7upgq0,https://www.reddit.com/r/CERTCybSec/comments/7upgq0/unpatched_adobe_flash_player_zeroday_exploit/,2018-02-02 17:29:49,"A critical vulnerability (CVE-2018-4878) exists in Adobe Flash Player 28.0.0.137 and earlier versions. Successful exploitation could potentially allow an attacker to take control of the affected system. Adobe is aware of a report that an exploit for CVE-2018-4878 exists in the wild, and is being used in limited, targeted attacks against Windows users. These attacks leverage Office documents with embedded malicious Flash content distributed via email. Adobe will address this vulnerability in a release planned for the week of February 5. For the latest information, users may monitor the Adobe Product Security Incident Response Team blog. URL __ #infosec #cybersecurity #0day"
16,vulnerability,CERTCybSec,"Oracle MICROS POS Vulnerability Puts 300,000 Systems at Risk",1,7ve3cq,https://www.reddit.com/r/CERTCybSec/comments/7ve3cq/oracle_micros_pos_vulnerability_puts_300000/,2018-02-05 22:09:17,"Point-of-sale systems are rich targets for attackers, given their status as a gateway to credit card information, customer and back-office data and other goodies. A recently patched vulnerability in Oracles MICROS POS system software can lead to attackers gaining full access to the systems, say researchers. URL Vulnerability in the Oracle Hospitality Simphony component of Oracle Hospitality Applications (subcomponent: Security). Supported versions that are affected are 2.7, 2.8 and 2.9. Difficult to exploit vulnerability allows unauthenticated attacker with network access via HTTP to compromise Oracle Hospitality Simphony. Successful attacks of this vulnerability can result in takeover of Oracle Hospitality Simphony. URL"
17,vulnerability,CERTCybSec,Adobe Confirms: Unpatched Zero-Day Flash Player Used in Attacks,1,7ve3w7,https://www.reddit.com/r/CERTCybSec/comments/7ve3w7/adobe_confirms_unpatched_zeroday_flash_player/,2018-02-05 22:13:04,"A critical vulnerability (CVE-2018-4878) exists in Adobe Flash Player 28.0.0.137 and earlier versions. Successful exploitation could potentially allow an attacker to take control of the affected system. URL Adobe Systems has confirmed that attackers are in possession of an exploit for a critical zero-day vulnerability in Flash Player that will be patched over the coming days. URL FireEye and Cisco have analyzed the attacks involving a recently disclosed Flash Player zero-day vulnerability and linked them to a group known for targeting South Korean entities. URL FireEye began investigating the vulnerability following the release of the initial advisory from KISA. URL The current known attack vector, CVE-2018-4878, is a malicious Microsoft Excel document containing a malware Flash object which, when opened, triggers the installation of ROKRAT, (Remote Administration Tool), capable of taking over the infected computer. At this time, the infection vector is assumed to have originated in North Korea and is primarily targeting South Korea. URL South Korea identifies Flash 0-day in the wild. Excel spreadsheet, Active X, Adobe Flash -- this exploit is a blast from the past with one of everything. URL "
18,vulnerability,CERTCybSec,Abusing Patched Vulnerability using Windows Installer: A New Technique,1,7wc234,https://www.reddit.com/r/CERTCybSec/comments/7wc234/abusing_patched_vulnerability_using_windows/,2018-02-09 19:14:13,"A Patched remote code execution Microsoft Office Vulnerability ( CVE-2017-11882) abusing again and using it for spreading a variety of Malware such as FAREIT, Ursnif and a Keylogger Loki info stealer that is used for stealing Crypto wallet password. In this case, some of the uncommon methods has been reused by helping of Windows Installer service Windows. URL Why the use of this specific installation type? Trend Micro believes it might represent a new evasion mechanism for malware creators to skirt around security software that usually focuses on traditional installation methods URL"
19,vulnerability,CERTCybSec,Multiple Vulnerabilities in NETGEAR Routers: patch now !!!!,1,7wd21w,https://www.reddit.com/r/CERTCybSec/comments/7wd21w/multiple_vulnerabilities_in_netgear_routers_patch/,2018-02-09 23:18:16,"TWSL2018-002: Password Recovery and File Access on Some Routers and Modem Routers TWSL2018-003: Finding 1: Post-Authentication Command Injection on Some Routers and ModemRouters TWSL2018-003: Finding 2: Authentication Bypass on Some Routers or Modem Routers TWSL2018-003: Chained Attack: Command Injection on Some Routers and Modem Routers TWSL2018-004: Command Injection Vulnerability on D7000, EX6200v2, and Some Routers Popopopopopopo....... Soooooo dirty ! URL __ #infosec #cybersecurity "
20,vulnerability,CERTCybSec,REMOTE LD_PRELOAD EXPLOITATION,1,7m33h8,https://www.reddit.com/r/CERTCybSec/comments/7m33h8/remote_ld_preload_exploitation/,2017-12-26 06:31:46,"This blog post details CVE-2017-17562, a vulnerability which can be exploited to gain reliable remote code execution in all versions of the GoAhead web server &lt; 3.6.5. The vulnerability is a result of Initialising the environment of forked CGI scripts using untrusted HTTP request parameters, and will affect all users who have CGI support enabled with dynamically linked executables (CGI scripts). This behavior, when combined with the glibc dynamic linker, can be abused for remote code execution using special variables such as LD_PRELOAD (commonly used to perform function hooking, see preeny). URL __ #infosec #cybersecurity "
21,vulnerability,CERTCybSec,Huawei Routers Exploited to Create New Botnet,0,7mgxfj,https://www.reddit.com/r/CERTCybSec/comments/7mgxfj/huawei_routers_exploited_to_create_new_botnet/,2017-12-28 05:51:50,Zero-Day vulnerability in the Huawei home router HG532 has been discovered and hundreds of thousands of attempts to exploit it have already been found in the wild. The delivered payload has been identified as OKIRU/SATORI which is an updated variant of Mirai. The suspected threat actor behind the attack is an amateur nicknamed Nexus Zeta. URL __ #infosec #cybersecurity 
22,vulnerability,CERTCybSec,Fortinet FortiClient Windows privilege escalation at logon,1,7mm1sp,https://www.reddit.com/r/CERTCybSec/comments/7mm1sp/fortinet_forticlient_windows_privilege_escalation/,2017-12-28 22:19:15,"This vulnerability affects the Fortinet FortiClient program. FortiClient is a client program used to connect to SSL/IPsec VPN endpoints. A setting, disabled by default, enables FortiClient on the logon screen to allow users to connect to a VPN profile before logon. An attacker, with physical, or remote (e.g. through TSE, VNC), access to a machine with FortiClient and this feature enabled, can obtain SYSTEM level privileges from the lock screen. No account or prior knowledge is required. The vulnerability lies in the confirmation dialog shown when the server certificate is not valid (e.g. default auto-signed certificate, or Man-In-The-Middle with SSL/TLS interception situation). URL __ #infosec #cybersecurity #intrinsec"
23,vulnerability,CERTCybSec,No boundaries for user identities: Web trackers exploit browser login managers,1,7mq197,https://www.reddit.com/r/CERTCybSec/comments/7mq197/no_boundaries_for_user_identities_web_trackers/,2017-12-29 09:39:25,"We show how third-party scripts exploit browsers built-in login managers (also called password managers) to retrieve and exfiltrate user identifiers without user awareness. To the best of our knowledge, our research is the first to show that login managers are being abused by third-party scripts for the purposes of web tracking. The underlying vulnerability of login managers to credential theft has been known for years. Much of the past discussion has focused on password exfiltration by malicious scripts through cross-site scripting (XSS) attacks. Fortunately, we havent found password theft on the 50,000 sites that we analyzed. Instead, we found tracking scripts embedded by the first party abusing the same technique to extract emails addresses for building tracking identifiers. URL __ #infosec #cybersecurity "
24,vulnerability,CERTCybSec,Western Digital My Cloud drives have a built-in backdoor,1,7ozmbb,https://www.reddit.com/r/CERTCybSec/comments/7ozmbb/western_digital_my_cloud_drives_have_a_builtin/,2018-01-09 03:27:12,"Western Digital's network attached storage solutions have a newfound vulnerability allowing for unrestricted root access. James Bercegay disclosed the vulnerability to Western Digital in mid-2017. After allowing six months to pass, the full details and proof-of-concept exploit have been published. No fix has been issued to date. URL __ #infosec #cybersecurity "
25,vulnerability,CERTCybSec,IoT Malware Evolves to Harvest Bots by Exploiting a Zero-day Home Router Vulnerability,1,7ps5tb,https://www.reddit.com/r/CERTCybSec/comments/7ps5tb/iot_malware_evolves_to_harvest_bots_by_exploiting/,2018-01-12 10:06:21,"In early December 2017, 360 Netlab discovered a new malware family which they named Satori. Satori is a derivative of Mirai and exploits two vulnerabilities: CVE-2014-8361 a code execution vulnerability in the miniigd SOAP service in Realtek SDK, and CVE 2017-17215 a newly discovered vulnerability in Huaweis HG532e home gateway patched in early December 2017. Palo Alto Networks Unit 42 investigated Satori, and from our intelligence data, we have found there are three Satori variants. The first of these variants appeared in April 2017, eight months before these most recent attacks. We also found evidence indicating that the version of Satori exploiting CVE 2017-17215 was active in late November 2017, before Huawei patched the vulnerability. This means that this version of Satori was a classic zero-day attack: an attack against a previously unknown vulnerability for which no patch was then available. URL __ #infosec #cybersecurity "
26,vulnerability,CERTCybSec,New Intel AMT Vulnerability Discovered,2,7pwghs,https://www.reddit.com/r/CERTCybSec/comments/7pwghs/new_intel_amt_vulnerability_discovered/,2018-01-13 00:08:54,"This time, the security bug exists in Intels Active Management Technology (AMT) and can be exploited by hackers to take complete control of a vulnerable device in a matter of seconds, as the researcher explains. Whats important to note from the very beginning is that unlike Meltdown and Spectre, a successful exploit of this vulnerability (which doesnt yet have a name) requires physical access to the device. But this is still a critical flaw, Sintonen points out, as a hacker can compromise a system in less than a minute and then remotely control it by connecting to the same network. The vulnerability can be exploited even if other security measures are in place, including here a BIOS password, BitLocker, TPM Pin, or a traditional antivirus. URL _#CERTCybSec #Infosec"
27,vulnerability,CERTCybSec,StorageCrypt Ransomware Infecting NAS Devices Using SambaCry,1,7i1mnu,https://www.reddit.com/r/CERTCybSec/comments/7i1mnu/storagecrypt_ransomware_infecting_nas_devices/,2017-12-07 09:13:07,"SambaCry is a Linux Samba vulnerability that when exploited, allows an attacker to open a command shell that can be used to download files and execute commands on the affected device. The current method that it is infecting the NAS devices with StorageCrypt appears to be the same as the Elf_Shellbind variant that was previously used to distribute miners. URL __ #infosec #cybersecurity "
28,vulnerability,CERTCybSec,Some vulnerability on SAP PoS Server,1,6wdhxp,https://www.reddit.com/r/CERTCybSec/comments/6wdhxp/some_vulnerability_on_sap_pos_server/,2017-08-28 03:35:22,It could be afraid to some real resellers. Patch it now as those are available. 
29,vulnerability,CERTCybSec,WINDOWS SMB ZERO DAY TO BE DISCLOSED DURING DEF CON,1,6qhncl,https://www.reddit.com/r/CERTCybSec/comments/6qhncl/windows_smb_zero_day_to_be_disclosed_during_def/,2017-07-31 00:34:40,"A 20-year-old Windows SMB vulnerability is expected to be disclosed Saturday during a talk at DEF CON. Microsoft has said it will not patch the vulnerability, which allows an attacker to remotely crash a Windows server with relative ease using only 20 lines of Python code and a Raspberry Pi. URL __ #infosec #cybersecurity "
30,vulnerability,CERTCybSec,Massive Skype Zero-Day Enables Remote Crashes,1,6jweam,https://www.reddit.com/r/CERTCybSec/comments/6jweam/massive_skype_zeroday_enables_remote_crashes/,2017-06-28 08:45:05,"A security researcher uncovered a Skype vulnerability that could allow hackers to remotely execute code and crash software if exploited. A critical vulnerability in Skype for Web could allow attackers to remotely execute code and crash systems. Microsoft has fixed the flaw, which remains a threat to anyone who has not updated their software. URL"
31,vulnerability,CERTCybSec,Azure blues: Active Directory Connect has password reset vuln,1,6k8h3l,https://www.reddit.com/r/CERTCybSec/comments/6k8h3l/azure_blues_active_directory_connect_has_password/,2017-06-29 23:53:57,"Attackers can dive out of the cloud to pwn admin passwords. Microsoft is warning sysadmins to check their Azure Active Directory Connect configurations and implement a patch against a credential-handling vulnerability. The bug's in an Active Directory (AD) feature called password writeback. Azure AD can be configured to copy user passwords back to a local AD environment. A convenience feature, password writeback is designed to simplify password resets, letting users change their local and cloud passwords simultaneously. It supports resets from Office365 and allows admins to push a reset from the Azure portal back to on-premises AD. URL __ #infosec #cybersecurity"
32,cybersecurity,CERTCybSec,"PCs still infected with Andromeda botnet malware, despite takedown",1,97t03g,https://www.reddit.com/r/CERTCybSec/comments/97t03g/pcs_still_infected_with_andromeda_botnet_malware/,2018-08-17 00:58:13,"Despite being the subject of an international takedown operation last year, traces of the #Andromeda #botnet can still be found on many PCs. The Andromeda botnet was associated with 80 different #malware families and grew so large that it was at one point infecting a million new machines a month, distributing itself via social media, instant messaging, spam emails, exploit kits, and more. [URL \_\_ #infosec #cybersecurity"
33,cybersecurity,CERTCybSec,Apple gets cored: 90GB of secure files stolen by high schooler,1,98234k,https://www.reddit.com/r/CERTCybSec/comments/98234k/apple_gets_cored_90gb_of_secure_files_stolen_by/,2018-08-17 23:03:39,"90GB of secure files stolen! A high school student in Australia hacked Apple servers multiple times, got his hands on 90GB worth of secure files, and stuck the loot in a folder titled hacky hack hack. \#infosec #CyberSecurity #databreach [URL"
