,topic,subreddit,title,score,id,url,created,body
34,cybersecurity,CERTCybSec,Ryuk Ransomware: A Targeted Campaign Break-Down,0,99bt67,https://www.reddit.com/r/CERTCybSec/comments/99bt67/ryuk_ransomware_a_targeted_campaign_breakdown/,2018-08-22 19:15:32,"Over the past two weeks, Ryuk, a targeted and well-planned Ransomware, has attacked various organizations worldwide. So far the campaign has targeted several enterprises, while encrypting hundreds of PC, storage and data centers in each infected company. While the ransomwares technical capabilities are relatively low, at least three organizations in the US and worldwide were severely hit by the malware. Furthermore, some organizations paid an exceptionally large ransom in order to retrieve their files. Although the ransom amount itself varies among the victims (ranging between 15 BTC to 50 BTC) it has already netted the attackers over $640,000. [URL \_\_ #infosec #cybersecurity #ransomware"
35,cybersecurity,CERTCybSec,Operation Red Signature  South Korean Firms victims of a supply chain attack,1,99mtg8,https://www.reddit.com/r/CERTCybSec/comments/99mtg8/operation_red_signature_south_korean_firms/,2018-08-23 22:07:02,"Security researchers from Trend Micro have uncovered a supply chain attack, tracked as Operation Red Signature, against organizations in South Korea. The Operation Red Signature aimed at delivering a remote access Trojan (RAT) used by attackers to steal sensitive information from the victims. Threat actors compromised update server of a remote support solutions provider, using this attack scheme hackers infected the victims with the 9002 RAT backdoor. [URL \_\_ #infosec #cybersecurity &amp;#x200B;"
36,cybersecurity,CERTCybSec,Passwords for Tens of Thousands of Dahua Devices Cached in IoT Search Engine,2,8z0d5c,https://www.reddit.com/r/CERTCybSec/comments/8z0d5c/passwords_for_tens_of_thousands_of_dahua_devices/,2018-07-15 18:38:52,"Login passwords for tens of thousands of Dahua devices have been cached inside search results returned by ZoomEye, a search engine for discovering Internet-connected devices (also called an IoT search engine). URL __ #infosec #cybersecurity "
37,cybersecurity,CERTCybSec,Apache Tomcat Patches Important Security Vulnerabilities,2,91h0b7,https://www.reddit.com/r/CERTCybSec/comments/91h0b7/apache_tomcat_patches_important_security/,2018-07-24 22:37:23,"The Apache Software Foundation (ASF) has released security updates to address several vulnerabilities in its Tomcat application server, one of which could allow a remote attacker to obtain sensitive information. URL __ #infosec #cybersecurity #vulnerability "
38,cybersecurity,CERTCybSec,"Malware Author Building ""Death"" Botnet Using Old AVTech Flaw",1,91q60x,https://www.reddit.com/r/CERTCybSec/comments/91q60x/malware_author_building_death_botnet_using_old/,2018-07-25 18:55:39,"A #malware author by the name of EliteLands is currently building a botnet named ""Death"" by targeting unpatched AVTech devices. The hacker is using an [exploit](URL for these devices that was published back in late 2016. The exploit targets 14 well-known vulnerabilities in the firmware shared by several AVTech device types, such as DVRs, NVRs, IP cameras, and more. [URL \_\_ #infosec #cybersecurity"
39,cybersecurity,CERTCybSec,Ransomware as a Service Princess Evolution Looking for Affiliates,1,95yvus,https://www.reddit.com/r/CERTCybSec/comments/95yvus/ransomware_as_a_service_princess_evolution/,2018-08-10 04:10:01,"We have been observing a malvertising campaign via Rig exploit kit delivering a #cryptocurrency-mining #malware and the #GandCrab #ransomware since July 25. On August 1, we found Rigs traffic stream dropping a then-unknown ransomware. [URL \_\_ #infosec #cybersecurity"
40,cybersecurity,CERTCybSec,Wifi password hacking: Easily Hack WiFi Password Using New WPA/WPA2 flaw,1,95yxar,https://www.reddit.com/r/CERTCybSec/comments/95yxar/wifi_password_hacking_easily_hack_wifi_password/,2018-08-10 04:14:23,"\#Wifi #password #hacking has become popular as people are always in search of the free internet. But due to the advancement of technology, cracking passwords have become a difficult task to do. The reason is due to the implementation of WPA/WPA2 (wifi protected access) protocols. They made modern routers more secure and less prone to hacking. [URL \_\_ #infosec #cybersecurity"
41,cybersecurity,CERTCybSec,"Iranian Hackers Turn to Ransomware, Bitcoin as Economy Stalls",1,95yyt3,https://www.reddit.com/r/CERTCybSec/comments/95yyt3/iranian_hackers_turn_to_ransomware_bitcoin_as/,2018-08-10 04:19:14," Iranian hackers are developing software attacks that render computer systems inoperable until a digital ransom is paid, a new report says, a threat that comes as the U.S. moves to reimpose tough economic sanctions on the country. [URL \_\_ #infosec #cybersecurity"
42,cybersecurity,CERTCybSec,"IoT Malware Discovered Trying to Attack Satellite Systems of Airplanes, Ships",2,9647z3,https://www.reddit.com/r/CERTCybSec/comments/9647z3/iot_malware_discovered_trying_to_attack_satellite/,2018-08-10 15:36:21,Researcher Ruben Santamarta shared the details of his successful hack of an in-flight airplane Wi-Fi network - and other findings - at Black Hat USA today. URL __ #infosec #cybersecurity #BHUSA2018 
43,cybersecurity,CERTCybSec,New Cmb Dharma Ransomware Variant Released,1,96jm1e,https://www.reddit.com/r/CERTCybSec/comments/96jm1e/new_cmb_dharma_ransomware_variant_released/,2018-08-12 06:29:45, On Thursday a new variant of the Dharma Ransomware was discovered that appends the .cmb extension to encrypted files. URL __ #infosec #cybersecurity #malware #ransomware 
44,cybersecurity,CERTCybSec,THE WIRETAP ROOMS,1,8ttgd1,https://www.reddit.com/r/CERTCybSec/comments/8ttgd1/the_wiretap_rooms/,2018-06-26 05:38:01,"The NSA considers AT&amp;T to be one of its most trusted partners and has lauded the companys extreme willingness to help. It is a collaboration that dates back decades. Little known, however, is that its scope is not restricted to AT&amp;Ts customers. According to the NSAs documents, it values AT&amp;T not only because it has access to information that transits the nation, but also because it maintains unique relationships with other phone and internet providers. URL __ #infosec #cybersecurity"
45,cybersecurity,CERTCybSec,RAMpage Attack ExplainedExploiting RowHammer On Android Again!,1,8uvqla,https://www.reddit.com/r/CERTCybSec/comments/8uvqla/rampage_attack_explainedexploiting_rowhammer_on/,2018-06-30 05:04:56,A team of security researchers has discovered a new set of techniques that could allow hackers to bypass all kind of present mitigations put in place to prevent DMA-based Rowhammer attacks against Android devices. URL #infosec #cybersecurity #malware #Android
46,cybersecurity,CERTCybSec,"FBI warns of increasing ransomware, firmware attacks",0,8uvrle,https://www.reddit.com/r/CERTCybSec/comments/8uvrle/fbi_warns_of_increasing_ransomware_firmware/,2018-06-30 05:08:23,"Its not just your IT shop. Ransomware, insider threats, and attacks on firmware and hardware are growing cyberthreats, reports an FBI spokesperson. URL _ #infosec #cybersecurity #malware "
47,cybersecurity,CERTCybSec,Breaking LTE on Layer two,1,8v9ioz,https://www.reddit.com/r/CERTCybSec/comments/8v9ioz/breaking_lte_on_layer_two/,2018-07-01 22:18:52,"A security analysis of the mobile communication standard LTE ( Long-Term Evolution, also know as 4G) on the data link layer (so called layer two) has uncovered three novel attack vectors that enable different attacks against the protocol. URL _ #infosec #cybersecurity "
48,cybersecurity,CERTCybSec,LastPass Does Not Encrypt Everything In Your Vault,3,8vcp0b,https://www.reddit.com/r/CERTCybSec/comments/8vcp0b/lastpass_does_not_encrypt_everything_in_your_vault/,2018-07-02 06:11:19,"Last year LastPass introduced a new redesign of their vault in which they added nice pretty logos of all the sites in your vault. LastPass claims that they are a zero knowledge platform and that no unencrypted, readable site data is ever sent to their servers. This is obviously not true. Hex strings are basically the same as plaintext in this case. LastPass could use this information to track what sites are in your vault, how often you visit them, how often you log into them, etc. URL _ #infosec #cybersecurity "
49,cybersecurity,CERTCybSec,New Spectre 1.1 and Spectre 1.2 CPU Flaws Disclosed,3,8y92yt,https://www.reddit.com/r/CERTCybSec/comments/8y92yt/new_spectre_11_and_spectre_12_cpu_flaws_disclosed/,2018-07-12 21:51:00,"Two security researchers have revealed details about two new Spectre-class vulnerabilities, which they've named #Spectre 1.1 and Spectre 1.2. Just like all the previous #Meltdown and Spectre CPU bugs variations, these two take advantage of the process of speculative execution a feature found in all modern CPUs that has the role of improving performance by computing operations in advance and later discarding unneeded data. \#infosec #cybersecurity [URL"
50,cybersecurity,CERTCybSec,The Aurora Power Grid Vulnerability and the BlackEnergy Trojan,1,8ya6r1,https://www.reddit.com/r/CERTCybSec/comments/8ya6r1/the_aurora_power_grid_vulnerability_and_the/,2018-07-13 00:21:31," At recent Industrial IoT security briefings, the #Aurora #vulnerability has come up repeatedly. Attendees ask, Is our countrys power grid safe? How can we protect the grid? What is Aurora? This post provides a look at Aurora, and the BlackEnergy attack that can exploit Aurora. \_\_ #infosec #cybersecurity [URL"
51,cybersecurity,CERTCybSec,Access to airports security system sold on dark web,1,8ya8et,https://www.reddit.com/r/CERTCybSec/comments/8ya8et/access_to_airports_security_system_sold_on_dark/,2018-07-13 00:27:13,"Leveraging compromised RDP credentials is one of the easiest ways attackers can break into company networks and systems. Unfortunately for all of us, there are a lot of vendors on underground hacker markets that sell those credentials for a laughably small amount of money. Some of these computers are part of critical systems. Case in point: McAfee researchers have recently discovered that access linked to security and building automation systems of a major international airport could be bought from these sellers for as little as $10! \_\_ #infosec #cybersecurity [URL"
52,cybersecurity,CERTCybSec,MyHeritage Says Over 92 Million User Accounts Have Been Compromised,1,8ot611,https://www.reddit.com/r/CERTCybSec/comments/8ot611/myheritage_says_over_92_million_user_accounts/,2018-06-06 04:20:06,"MyHeritage, the Israel-based DNA testing service designed to investigate family history, has disclosed that the company website was breached last year by unknown attackers, who stole login credentials of its more than 92 million customers. URL __#infosec #cybersecurity #privacy #databreach #leak "
53,cybersecurity,CERTCybSec,Zip Slip Vulnerability Affects Thousands of Projects Across Multiple Ecosystems,2,8ot7gp,https://www.reddit.com/r/CERTCybSec/comments/8ot7gp/zip_slip_vulnerability_affects_thousands_of/,2018-06-06 04:24:43,Security researchers have disclosed today details about a critical vulnerability impacting open source coding libraries that handle archived files. URL __ #infosec #cybersecurity #vulnerability 
54,cybersecurity,CERTCybSec,Cybercriminals Steal the Show! 26 Million Ticketfly Customers Data Compromised in Massive Breach,1,8ouqpp,https://www.reddit.com/r/CERTCybSec/comments/8ouqpp/cybercriminals_steal_the_show_26_million/,2018-06-06 07:27:46,"Cybercriminals Steal the Show! 26 Million Ticketfly Customers Data Compromised in Massive Breach When we find out our favorite artist is coming to town, we immediately head to the web to snatch up a ticket to their show. This where ticket distribution services, such as Ticketmaster and TicketFly, become handy, as they allow us to easily input our information to claim a spot for the show. But as of this week, users of the latter company are unfortunately now dealing with that very information being compromised by a massive data breach. In fact, Troy Hunt, founder of Have I Been Pwned, discovered that a hacker posted several Ticketfly database files to a public server online. URL __ #infosec #cybersecurity #leak #databreach "
55,cybersecurity,CERTCybSec,Update Google Chrome Immediately to Patch a High Severity Vulnerability | #infosec #cybersecurity #vulnerability,2,8p45cy,https://www.reddit.com/r/CERTCybSec/comments/8p45cy/update_google_chrome_immediately_to_patch_a_high/,2018-06-07 06:36:41,"Security researcher Micha Bentkowski discovered and reported a high severity vulnerability in Google Chrome in late May, affecting the web browsing software for all major operating systems including Windows, Mac, and Linux. URL "
56,cybersecurity,CERTCybSec,"Operation #Prowli Hits 40K with Traffic Monetization, Cryptomining | #infosec #cybersecurity #malware",2,8p46ne,https://www.reddit.com/r/CERTCybSec/comments/8p46ne/operation_prowli_hits_40k_with_traffic/,2018-06-07 06:41:04,"The campaign targets services including Drupal CMS sites, DSL modems, vulnerable IoT devices, and servers with an open SSH port. A new attack campaign dubbed Operation Prowli has so far hit 40,000 victim machines in 9,000 businesses across industries including finance, education, and government. Prowli is a global threat, spreading malware and malicious code to vulnerable servers and websites. URL"
57,cybersecurity,CERTCybSec,Google to add extra Gmail security  by building a walled garden,2,8cumvz,https://www.reddit.com/r/CERTCybSec/comments/8cumvz/google_to_add_extra_gmail_security_by_building_a/,2018-04-17 16:59:59,"Google is planning to add several new security features to its ubiquitous email service, Gmail, but they will come with a cost  literally and figuratively. Among the new features reportedly under consideration are self-deleting emails and a new ""confidentiality mode"" that would prevent emails from being printed or forwarded. URL __ #infosec #cybersecurity #privacy "
58,cybersecurity,CERTCybSec,"US, UK warn of Russian hackers targeting millions of routers",3,8cunax,https://www.reddit.com/r/CERTCybSec/comments/8cunax/us_uk_warn_of_russian_hackers_targeting_millions/,2018-04-17 17:02:19,"US, UK warn of Russian hackers targeting millions of routers Russian spies are looking for vulnerabilities in routers for future attacks. Officials are urging people, and device makers, to take security measures. Russian hackers are targeting millions of routers around the world, including devices in homes and offices, according to US and UK officials. In a joint announcement Monday from the US Department of Homeland Security, the FBI and the UK's National Cyber Security Center, officials warned that Russian spies have been looking for vulnerabilities on millions of routers as a tool for future attacks. URL __ #infosec #cybersecurity "
59,cybersecurity,CERTCybSec,"Boeing hit with ransomware attack , Boeing says it detected a limited intrusion of malware",1,87yimi,https://www.reddit.com/r/CERTCybSec/comments/87yimi/boeing_hit_with_ransomware_attack_boeing_says_it/,2018-03-29 15:34:57,"A Boeing production plant in Charleston, South Carolina was hit by the Ransomware suspected as Wannacry. Boeing Says Suspected wannacry Attack Only Hit 'Small Number of Systems,Nevertheless, the attack triggered widespread alarm within the company. ======================================== Linda Mills, VP of Boeing commercial airplanes communications: A number of reported statements on this are overstated and inaccurate. Our cybersecurity operations center detected a limited intrusion of malware that affected a small number of systems. Remediations were applied and this is not a production or delivery issue. ========================================= Microsoft have previously patched the vulnerability exploited by Wannacry. More URL URL This story is developing. "
60,cybersecurity,CERTCybSec,New Saturn Ransomware Actively Infecting Victims,1,7y0of0,https://www.reddit.com/r/CERTCybSec/comments/7y0of0/new_saturn_ransomware_actively_infecting_victims/,2018-02-17 05:14:21,"A new ransomware was discovered this week by MalwareHunterTeam called Saturn. This ransomware will encrypt the files on a computer and then append the .saturn extension to the file's name. The Saturn Ransomware is being actively distributed, but at this time it is unknown what distribution methods are being used. Unfortunately, this ransomware is not decryptable at this time, but it is currently being researched for weaknesses. In the mean time, if you wish to discuss or receive help, you can use our dedicated Saturn Ransomware Help &amp; Support topic. URL __ #infosec #cybersecurity #ransomware"
61,cybersecurity,CERTCybSec,DoubleDoor  An IoT Botnet Bypasses Firewall Using Backdoor Exploits,1,7yd6ki,https://www.reddit.com/r/CERTCybSec/comments/7yd6ki/doubledoor_an_iot_botnet_bypasses_firewall_using/,2018-02-18 19:47:15,"IoT Backdoor exploits called Doubledoor have been discovered which allows bypassing an IoT layered security that leads to taking complete control of the targeting network systems. IoT based cyber Attacks are blooming since the number IoT devices are increasing rapidly and attackers always find the many ways to bypass it. In this case, Doubledoor Botnet has an ability to bypass both authentication security with IoT and an Extra layer of security firewall that associated with it. URL __#infosec #cybersecurity #botnet "
62,cybersecurity,CERTCybSec,Dozen Vulnerabilities in Trend Micro Email Encryption Gateway,2,805f4b,https://www.reddit.com/r/CERTCybSec/comments/805f4b/dozen_vulnerabilities_in_trend_micro_email/,2018-02-26 03:19:27,"Security researchers at Core Security have discovered a dozen flaws in Trend Micro Linux-based Email Encryption Gateway, some of them have been rated as critical and high severity. The flaws received the CVE identification numbers CVE-2018-6219 through CVE-2018-6230. The most severe flaw could be exploited by a local or remote attacker with access to the targeted system to execute arbitrary commands with root privileges. URL URL #vulnerability #infosec #cybersecurity"
63,cybersecurity,CERTCybSec,New Mirai Okiru Botnet targets devices running widely-used ARC Processors,1,7qj5gg,https://www.reddit.com/r/CERTCybSec/comments/7qj5gg/new_mirai_okiru_botnet_targets_devices_running/,2018-01-15 22:35:12," Although the original creators of Mirai DDoS botnet have already been arrested and jailed, the variants of the infamous IoT malware are still in the game due to the availability of its source code on the Internet. Security researchers have spotted a new variant of infamous Mirai IoT malware designed to hijack insecure devices that run on ARC embedded processors. URL __ #infosec #cybersecurity #botnet #mirai"
64,cybersecurity,CERTCybSec,RubyMiner Cryptominer Affects 30% of WW Networks,2,7qnwip,https://www.reddit.com/r/CERTCybSec/comments/7qnwip/rubyminer_cryptominer_affects_30_of_ww_networks/,2018-01-16 10:16:52,"In the last 24 hours, 30% of networks worldwide have experienced compromise attempts by a crypto-miner targeting web servers. During that period, the lone attacker attempted to exploit 30% of all networks worldwide to find vulnerable web servers in order to mobilize them to his mining pool. Among the top countries targeted are the United States, Germany, United Kingdom, Norway and Sweden, though no country has gone unscathed. With the growing popularity of virtual currency and its increasing value, the methods for mining these coins has grown as well. URL __ #infosec #cybersecurity #cryptominer #rubyminer"
65,cybersecurity,CERTCybSec,ONEPLUS CHECKOUT HACKED? THE DANGERS OF ON-SITE PAYMENT PROCESSING,0,7qqjfq,https://www.reddit.com/r/CERTCybSec/comments/7qqjfq/oneplus_checkout_hacked_the_dangers_of_onsite/,2018-01-16 17:49:31,"Recently members of the Fidus team noticed an interesting blog post on the OnePlus forum by an individual discussing recent fraudulent attempts made on two of their credit cards. The forum user states that the only place both cards were used was on the OnePlus website in November 2017, they go on to ask whether other members of the community have had the same issue (spoiler:they had). OnePlus are currently using the Magento eCommerce platform, which is a common platform in which credit card hacking takes place. These findings do not confirm OnePlus have suffered a breach. Instead, they look into the current structure of the payment flow and how it could have been achieved. URL __ #infosec #cybersecurity "
66,cybersecurity,CERTCybSec,"SamSam Ransomware Hits Hospitals, City Councils, ICS Firms",2,7rohla,https://www.reddit.com/r/CERTCybSec/comments/7rohla/samsam_ransomware_hits_hospitals_city_councils/,2018-01-20 16:25:46,"The SamSam ransomware group seems to have gotten to a ""great"" start in 2018, hitting several high-profile targets such as hospitals, a city council, and an ICS firm. Reported attacks include the one against the Hancock Health Hospital in of Greenfield, Indiana; Adams Memorial Hospital in Decatur, Indiana; the municipality of Farmington, New Mexico; cloud-based EHR (electronic health records) provider Allscripts; and an unnamed ICS (Industrial Control Systems) company in the US, based on intel Bleeping Computer has received. URL __ #infosec #cybersecurity #samsam #ransomware"
67,cybersecurity,CERTCybSec,Rapid Ransomware Continues Encrypting New Files as they Are Created,1,7sj0eb,https://www.reddit.com/r/CERTCybSec/comments/7sj0eb/rapid_ransomware_continues_encrypting_new_files/,2018-01-24 11:04:56,"A new ransomware is being spread called Rapid Ransomware that stays active after initially encrypting a computer and encrypts any new files that are created. While this behavior is not unique to Rapid, it is not a common behavior we see too often. While it is not known how the Rapid Ransomware is being distributed, it has been infecting numerous people starting in January. According to statistics from ID-Ransomware, the first submitted case was on January 3rd and since then there have been over 300 submissions. This is probably a small portion of the total victims, are there many who most likely did not utilize ID-Ransomware to identify the infection. URL __ #infosec #cybersecurity #ransomware "
68,cybersecurity,CERTCybSec,"Keylogger Campaign Hits Over 2,000 WordPress Sites",0,7t3r7c,https://www.reddit.com/r/CERTCybSec/comments/7t3r7c/keylogger_campaign_hits_over_2000_wordpress_sites/,2018-01-26 21:43:21,"Security researchers have discovered over 2,000 WordPress sites possibly more infected with a keylogger that's being loaded on the WordPress backend login page and a cryptojacking script (in-browser cryptocurrency miner) on their frontends. Researchers have tied these newly discovered infected sites to a similar operation that took place in early December 2017. URL __ #infosec #cybersecurity"
69,cybersecurity,CERTCybSec,"cross-platform implant, utilized in a global cyber-espionage campaign",0,7t3rkg,https://www.reddit.com/r/CERTCybSec/comments/7t3rkg/crossplatform_implant_utilized_in_a_global/,2018-01-26 21:46:16,"I'm on a plane again...this time flying home from one of my favorite hacker cons: ShmooCon! I was stoked to give a talk about auditing on macOS. Yah, I know that doesn't seem like the sexiest of topics -but if you're interested in incidence response, malware analysis, or writing security tools for macOS, it's a very relevant topic! Plus, the talk covered some neat ring-0 bugs that affected the audit subsystem including a kernel panic, a kernel information leak, and a exploitable kernel heap overFlow. Besides being able to speak, the highlight of ShmooCon was meeting tons of new awesome people - some who are in a way directly responsible for this blog. I personally have to thank Kate from Gizmodo (@kateconger), who introduced me to Eva (@evacide) and Cooper (@cooperq) from the Electronic Frontier Foundation (EFF). We geeked out about a variety of stuff, including their latest reported (produced in conjunction with Lookout): ""Dark Caracal Cyber-espionage at a Global Scale"". Their findings about this global nationstate cyber-espionage campaign are rather ominous. URL __ #infosec #cybersecurity "
70,cybersecurity,CERTCybSec,FriedEx: BitPaymer ransomware the work of Dridex authors,1,7tc940,https://www.reddit.com/r/CERTCybSec/comments/7tc940/friedex_bitpaymer_ransomware_the_work_of_dridex/,2018-01-27 22:38:34,"Dridex has been a nightmare for computer users, companies and financial institutions for several years now, so much so that for many, it has become the first thing that comes to mind when talking about banking trojans. Recent ESET research shows that the authors of the infamous Dridex banking trojan are also behind another high-profile malware family  a sophisticated ransomware detected by ESET products as Win32/Filecoder.FriedEx and Win64/ Filecoder.FriedEx, and also known as BitPaymer. URL __ #infosec #cybersecurity #ransomware #dridex"
71,cybersecurity,CERTCybSec,ATM Jackpotting Attacks Hit the US for the First Time,1,7trizt,https://www.reddit.com/r/CERTCybSec/comments/7trizt/atm_jackpotting_attacks_hit_the_us_for_the_first/,2018-01-29 21:51:58,"Two of the world's largest ATM manufacturers have issued security alerts regarding ATM jackpotting attacks being detected in the US for the first time. In alerts sent out to US banks by Diebold Nixdorf and NCR Corp, the two organizations say they've been alerted by the US Secret Service that cyber-criminals are using various techniques to make ATMs ""spit out"" cash, in an attack commonly referred to in the criminal underground as ATM jackpotting. URL __ #infosec #cybersecurity #atm"
