,topic,subreddit,title,score,id,url,created,body
100,cybersecurity,CERTCybSec,NEW PYTHON-BASED CRYPTO-MINER BOTNET FLYING UNDER THE RADAR,1,7oucgo,https://www.reddit.com/r/CERTCybSec/comments/7oucgo/new_pythonbased_cryptominer_botnet_flying_under/,2018-01-08 10:38:32,"F5 threat researchers have discovered a new Linux crypto-miner botnet that is spreading over the SSH protocol. The botnet, which weve named PyCryptoMiner: -Is based on the Python scripting language making it hard to detect -Leverages Pastebin.com (under the username WHATHAPPEN) to receive new command and control server (C&amp;C) assignments if the original server becomes unreachable -The registrant is associated with more than 36,000 domains, some of which have been known for scams, gambling, and adult services since 2012 -Is mining Monero, a highly anonymous crypto-currency favored by cyber-criminals. As of late December 2017, this botnet has made approximately US $46,000 mining Monero -New scanner functionality hunting for vulnerable JBoss servers was introduced mid-December exploiting CVE-2017-12149. URL __ #infosec #cybersecurity #botnet"
101,cybersecurity,CERTCybSec,Western Digital My Cloud drives have a built-in backdoor,1,7ozmbb,https://www.reddit.com/r/CERTCybSec/comments/7ozmbb/western_digital_my_cloud_drives_have_a_builtin/,2018-01-09 03:27:12,"Western Digital's network attached storage solutions have a newfound vulnerability allowing for unrestricted root access. James Bercegay disclosed the vulnerability to Western Digital in mid-2017. After allowing six months to pass, the full details and proof-of-concept exploit have been published. No fix has been issued to date. URL __ #infosec #cybersecurity "
102,cybersecurity,CERTCybSec,Wi-Fi Alliance Launches WPA2 Enhancements and Debuts WPA3,1,7p1chi,https://www.reddit.com/r/CERTCybSec/comments/7p1chi/wifi_alliance_launches_wpa2_enhancements_and/,2018-01-09 07:18:03,"WPA2 protocol enhancements bring stronger security protection and best practices, while new WPA3 protocol offers new security capabilities. In a one-two punch, the Wi-Fi Alliance today introduced several key enhancements to its Wi-Fi Protected Access II (WPA2) security protocol and unveiled its next security protocol WPA3. ""WPA2 has been around since 2003 and the Wi-Fi Alliance has constantly updated and enhanced it. WPA3 will build on the core components of WPA2 and add additional capabilities,"" says Kevin Robinson, vice president of marketing for the Wi-Fi Alliance. URL __ #infosec #cybersecurity "
103,cybersecurity,CERTCybSec,Not So Crystal Clear - Zeus Variant Spoils Ukrainian Holiday,1,7p4x6z,https://www.reddit.com/r/CERTCybSec/comments/7p4x6z/not_so_crystal_clear_zeus_variant_spoils/,2018-01-09 16:19:44,"Talos has observed a cyber attack which was launched using the official website of Ukraine-based accounting software developer Crystal Finance Millennium (CFM). This vector is similar to the attack outlined by Talos in the Nyetya and companion MeDoc blog post. Ukrainian authorities and businesses were alerted by local security firm (ISSP) that another accounting software maker had been compromised. However, the attackers did not compromise the firm's update servers and did not have the level of access noted in the Nyetya compromise. CFM's website was being used to distribute malware that was retrieved by malware downloaders attached to messages associated with a concurrent spam campaign. Websites being compromised to serve malicious content is common and it appears that CFM's website was leveraged in the same way. This can be achieved through exploitation of existing vulnerabilities in server-side software or brute-forcing weak credentials, allowing attackers to gain remote administrative access. The fact that it is an accounting software company in Ukraine and the timing of the attack increased visibility. URL __ #infosec #cybersecurity #zeus"
104,cybersecurity,CERTCybSec,Sneaky malware disguises itself as an Adobe Flash Player installer,1,7p8umu,https://www.reddit.com/r/CERTCybSec/comments/7p8umu/sneaky_malware_disguises_itself_as_an_adobe_flash/,2018-01-10 04:57:59,"A state-sponsored hacking operation is targeting diplomats, using a new attack that bundles malware with a legitimate software update. Uncovered by researchers at ESET, the attacks are targeting embassies and consulates in eastern European post-Soviet states and have been attributed to Turla, a well-known advanced persistent threat group. The hacking operation has a history of targeting government and diplomatic bodies using watering-hole attacks and spear-phishing campaigns, which often involve the use of false Flash downloads, to infiltrate victim's systems. Researchers note that some private companies have been infected, but that they're not the main targets of the campaign. URL ___#CERTCybSec #Infosec #CyberSecurity #CyberEspionage #TurlaGroup "
105,cybersecurity,CERTCybSec,IoT Malware Evolves to Harvest Bots by Exploiting a Zero-day Home Router Vulnerability,1,7ps5tb,https://www.reddit.com/r/CERTCybSec/comments/7ps5tb/iot_malware_evolves_to_harvest_bots_by_exploiting/,2018-01-12 10:06:21,"In early December 2017, 360 Netlab discovered a new malware family which they named Satori. Satori is a derivative of Mirai and exploits two vulnerabilities: CVE-2014-8361 a code execution vulnerability in the miniigd SOAP service in Realtek SDK, and CVE 2017-17215 a newly discovered vulnerability in Huaweis HG532e home gateway patched in early December 2017. Palo Alto Networks Unit 42 investigated Satori, and from our intelligence data, we have found there are three Satori variants. The first of these variants appeared in April 2017, eight months before these most recent attacks. We also found evidence indicating that the version of Satori exploiting CVE 2017-17215 was active in late November 2017, before Huawei patched the vulnerability. This means that this version of Satori was a classic zero-day attack: an attack against a previously unknown vulnerability for which no patch was then available. URL __ #infosec #cybersecurity "
106,cybersecurity,CERTCybSec,Lenovo Discovers and Removes Backdoor in Networking Switches,1,7q4bn1,https://www.reddit.com/r/CERTCybSec/comments/7q4bn1/lenovo_discovers_and_removes_backdoor_in/,2018-01-13 23:59:52,Lenovo engineers have discovered a backdoor in the firmware of RackSwitch and BladeCenter networking switches. The company released firmware updates earlier this week. The Chinese company said it found the backdoor after an internal security audit of firmware for products added to its portfolio following the acquisitions of other companies. URL __ #infosec #cybersecurity 
107,cybersecurity,CERTCybSec,Ay MaMi  Analyzing a New macOS DNS Hijacker: OSX/MaMi,1,7q8iz0,https://www.reddit.com/r/CERTCybSec/comments/7q8iz0/ay_mami_analyzing_a_new_macos_dns_hijacker_osxmami/,2018-01-14 11:34:14,"The cyber security expert and former NSA hacker Patrick Wardle made the headline once again, this time the researcher has spotted a new strain of malware dubbed MaMi designed to hijack DNS settings on macOS devices. Wardle first obtained a sample of the MaMi malware after a user reported on the Malwarebytes forums that the Mac of its teacher was infected by a malware that set DNS servers to 82.163.143.135 and 82.163.142.137. URL __ #infosec #cybersecurity #Hijacker #MaMi"
108,cybersecurity,CERTCybSec,Microsoft Appears to Have Lost the Source Code of an Office Component,1,7dwbcg,https://www.reddit.com/r/CERTCybSec/comments/7dwbcg/microsoft_appears_to_have_lost_the_source_code_of/,2017-11-19 09:35:14,The way Microsoft patched a recent security bug has made several security and software experts believe the company might have lost the source code to one of its Office components. URL __ #infosec #cybersecurity 
109,cybersecurity,CERTCybSec,"Mobile banking Trojan sneaks into Google Play targeting Wells Fargo, Chase and Citibank customers",1,7g1qnl,https://www.reddit.com/r/CERTCybSec/comments/7g1qnl/mobile_banking_trojan_sneaks_into_google_play/,2017-11-28 16:12:02,"Recently, the mobile threat intelligence team at Avast collaborated with researchers at ESET and SfyLabs to examine a new version of BankBot, a piece of mobile banking malwarethat has snuck into Google Play on numerous occasions this year, targeting apps of large banks including WellsFargo, Chase, DiBa and Citibank and their users in the U.S., Australia, Germany, Netherlands, France, Poland, Spain, Portugal, Turkey, Greece, Russia, Dominican Republic, Singapore and Philippines. URL __ #infosec #cybersecurity "
110,cybersecurity,CERTCybSec,Keybase Bug Might Have Backed up Your Private Encryption Key on Google's Servers,1,7g1va5,https://www.reddit.com/r/CERTCybSec/comments/7g1va5/keybase_bug_might_have_backed_up_your_private/,2017-11-28 16:34:45,Keybase is notifying Android users of a bug in its mobile app that might have unintentionally included the users' private key used to encrypt conversations and other private data into the automatic backups created by the Android OS and uploaded on Google's servers. URL __ #infosec #cybersecurity 
111,cybersecurity,CERTCybSec,Tizi backdoor rooted Android devices by exploiting old vulnerabilities,1,7g6680,https://www.reddit.com/r/CERTCybSec/comments/7g6680/tizi_backdoor_rooted_android_devices_by/,2017-11-29 05:19:28,"Google has discovered and removed from Google Play a number of apps that contained the Tizi backdoor, which installs spyware to steal sensitive data from popular social media applications. URL __ #infosec #cybersecurity "
112,cybersecurity,CERTCybSec,"Black Box, Red Disk: How Top Secret NSA and Army Data Leaked Online",0,7g7rls,https://www.reddit.com/r/CERTCybSec/comments/7g7rls/black_box_red_disk_how_top_secret_nsa_and_army/,2017-11-29 08:44:15,"In the wake of a string of data exposures originating from Pentagon intelligence-gathering agencies, the most recent of which revealed the workings of a massive, worldwide social media surveillance program, the UpGuard Cyber Risk Team can now disclose another. Critical data belonging to the United States Army Intelligence and Security Command (INSCOM), a joint US Army and National Security Agency (NSA) Defense Department command tasked with gathering intelligence for US military and political leaders, leaked onto the public internet, exposing internal data and virtual systems used for classified communications to anyone with an internet connection. With a middling CSTAR cyber risk score of 589 out of a maximum of 950, INSCOMs web presence provides troubling indications of gaps in their cybersecurity - exemplified by the presence of classified data within this publicly accessible data repository. URL __ #infosec #cybersecurity "
113,cybersecurity,CERTCybSec,Fake Windows Troubleshooting Support Scam Uploads Screenshots &amp; Uses Paypal,1,7ghku2,https://www.reddit.com/r/CERTCybSec/comments/7ghku2/fake_windows_troubleshooting_support_scam_uploads/,2017-11-30 10:04:58,"A new tech support scam has been discovered that shows a fake BSOD, or Blue Screen of Death, on the infected computer and then displays an application that pretends to be a Troubleshooter for Windows. This Troubleshooter will then state that your computer cannot be fixed, blocks you from using Windows, and prompts you to purchase a program using PayPal to fix the ""detected problems"" and unlock the screen. URL __ #infosec #cybersecurity "
114,cybersecurity,CERTCybSec,Halloware Ransomware on Sale on the Dark Web for Only $40,1,7h8pxh,https://www.reddit.com/r/CERTCybSec/comments/7h8pxh/halloware_ransomware_on_sale_on_the_dark_web_for/,2017-12-03 19:55:25,"A malware author by the name of Luc1F3R is peddling a new ransomware strain called Halloware for the lowly price of $40. Based on evidence gathered by Bleeping Computer, Luc1F3R started selling his ransomware this week, beginning Thursday. Currently, the malware dev is selling and/or advertising his ransomware on a dedicated Dark Web portal, on Dark Web forums, two sites hosted on the public Internet, and via videos hosted on YouTube. URL __ #infosec #cybersecurity "
115,cybersecurity,CERTCybSec,HC7 GOTYA Ransomware Installed via Remote Desktop Services. Spread with PsExec,1,7i1kh4,https://www.reddit.com/r/CERTCybSec/comments/7i1kh4/hc7_gotya_ransomware_installed_via_remote_desktop/,2017-12-07 09:04:35,"A new ransomware called HC7 is infecting victims by hacking into Windows computers that are running publicly accessible Remote Desktop services. Once the developers gain access to the hacked computer, the HC7 ransomware is then installed on all accessible computers on the network. URL __ #infosec #cybersecurity "
116,cybersecurity,CERTCybSec,Apple Updates Everything. Again.,1,7i1lfq,https://www.reddit.com/r/CERTCybSec/comments/7i1lfq/apple_updates_everything_again/,2017-12-07 09:08:23,"After a rushed release of iOS 11.2 over the weekend to fix a ""December 2nd Crash"" bug, and last weeks special update to fix the passwordless root authentication bypass in macOS, Apple today released its official set of security updates. With this, we also received details about the security issues patched in iOS this weekend. Apple's different operating systems share a lot of code with each other, and as a result, they also share some vulnerabilities. URL __ #infosec #cybersecurity "
117,cybersecurity,CERTCybSec,StorageCrypt Ransomware Infecting NAS Devices Using SambaCry,1,7i1mnu,https://www.reddit.com/r/CERTCybSec/comments/7i1mnu/storagecrypt_ransomware_infecting_nas_devices/,2017-12-07 09:13:07,"SambaCry is a Linux Samba vulnerability that when exploited, allows an attacker to open a command shell that can be used to download files and execute commands on the affected device. The current method that it is infecting the NAS devices with StorageCrypt appears to be the same as the Elf_Shellbind variant that was previously used to distribute miners. URL __ #infosec #cybersecurity "
118,cybersecurity,CERTCybSec,Second Draft of the NIST Cybersecurity Framework is available,1,7itcsr,https://www.reddit.com/r/CERTCybSec/comments/7itcsr/second_draft_of_the_nist_cybersecurity_framework/,2017-12-10 21:59:06,"After four years since its first release, NIST is now working on an updated version and now the second draft is available since December 5. URL __ #infosec #cybersecurity #nist"
119,cybersecurity,CERTCybSec,A Trove of 1.4 Billion Clear Text Credentials File Found on Dark Web,1,7ixg0w,https://www.reddit.com/r/CERTCybSec/comments/7ixg0w/a_trove_of_14_billion_clear_text_credentials_file/,2017-12-11 09:35:37,"Recently, a dark web monitoring firm 4iQ discovered a massive trove of 41GB data file containing 1.4 billion billion login credentials including emails and passwords in clear-text format. URL __ #infosec #cybersecurity "
120,cybersecurity,CERTCybSec,"ProxyM Botnet Used as Relay Point for SQLi, XSS, LFI Attacks",1,7j4qs0,https://www.reddit.com/r/CERTCybSec/comments/7j4qs0/proxym_botnet_used_as_relay_point_for_sqli_xss/,2017-12-12 06:52:40,"A botnet made up of IoT devices is helping hackers mask attacks on web applications, acting as a relay point for SQL injection (SQLi), cross-site scripting (XSS), and local file inclusion (LFI) attempts. URL __ #infosec #cybersecurity "
121,cybersecurity,CERTCybSec,Microsoft leaks TLS private key for cloud ERP product,1,7j4vmt,https://www.reddit.com/r/CERTCybSec/comments/7j4vmt/microsoft_leaks_tls_private_key_for_cloud_erp/,2017-12-12 07:11:01," and it was still in use for more than 100 days after the initial report Another day, another credential found wandering without a leash: Microsoft accidentally left a Dynamics 365 TLS certificate and private key where they could leak, and according to the discoverer, took 100 days to fix the bungle. Matthias Gliwka, a Stuttgart-based software developer, discovered the slip while working with the cloud version of Redmond's ERP system. URL __ #infosec #cybersecurity "
122,cybersecurity,CERTCybSec,File Spider Ransomware Targeting the Balkans With Malspam,1,7j8unj,https://www.reddit.com/r/CERTCybSec/comments/7j8unj/file_spider_ransomware_targeting_the_balkans_with/,2017-12-12 17:26:18,"A new ransomware called File Spider is being distributed through spam that targets victims in Bosnia and Herzegovina, Serbia, and Croatia. These spam emails contains malicious Word documents that will download and install the File Spider ransomware onto a victims computer. URL __ #infosec #cybersecurity "
123,cybersecurity,CERTCybSec,Necurs attackers now want to see your desktop,1,771ypx,https://www.reddit.com/r/CERTCybSec/comments/771ypx/necurs_attackers_now_want_to_see_your_desktop/,2017-10-18 08:52:12,"The Necurs botnet is back again, this time spreading a downloader that takes screen grabs of victims desktops and reports encountered errors back to the attackers. URL __ #infosec #cybersecurity "
124,cybersecurity,CERTCybSec,"Chinese Hacking Efforts More Strategic, Less Noisy",1,7aefz8,https://www.reddit.com/r/CERTCybSec/comments/7aefz8/chinese_hacking_efforts_more_strategic_less_noisy/,2017-11-03 07:44:42,"Chinese hackers, once some of the most careless and noisy hackers around, have become very careful and much more strategic at choosing the targets they go after. The prototype of the Chinese hacker is well documented in the cyber-security industry. Chinese actors hack whatever they can, grab whatever they can, and sift through the data after the fact. URL __ #infosec #cybersecurity "
125,cybersecurity,CERTCybSec,Hackers used Avast's CCleaner breach to attack technology companies,1,71gxwf,https://www.reddit.com/r/CERTCybSec/comments/71gxwf/hackers_used_avasts_ccleaner_breach_to_attack/,2017-09-21 14:58:15,"SAN FRANCISCO (Reuters) - The hackers who broke into widely used computer utility software in August also tried to infect machines at Microsoft(MSFT.O), Intel(INTC.O) and other top technology companies, according to research by Cisco Systems (CSCO.O) released late on Wednesday. URL __ #infosec #cybersecurity "
126,cybersecurity,CERTCybSec,Verizon Wireless Employee Accidentally Exposed Companys Internal System Details and Confidential Data Online,1,71xbbw,https://www.reddit.com/r/CERTCybSec/comments/71xbbw/verizon_wireless_employee_accidentally_exposed/,2017-09-23 19:18:34,"On September 20th, Kromtech Security researchers discovered publicly accessible Amazon AWS S3 bucket containing around 100MB of data attributing to internal Verizon Wireless system called DVS (Distributed Vision Services). URL __ #infosec #cybersecurity "
127,cybersecurity,CERTCybSec,ORACLE RELEASES BIGGEST UPDATE EVER,2,6o6d5n,https://www.reddit.com/r/CERTCybSec/comments/6o6d5n/oracle_releases_biggest_update_ever/,2017-07-19 15:07:15,"Oracle admins are today staring down the barrel of the biggest quarterly Critical Patch Update ever. The numbers are gory: 308 vulnerabilities patched, 165 of which are remotely exploitable, across more than 90 products. So far in 2017, Oracle has patched 878 vulnerabilities through three CPUs. URL URL __ #infosec #cybersecurity "
128,cybersecurity,CERTCybSec,Worst known governmental leak ever is slowly coming to light: Agency moved nations secret data to The Cloud,0,6p0k14,https://www.reddit.com/r/CERTCybSec/comments/6p0k14/worst_known_governmental_leak_ever_is_slowly/,2017-07-23 19:55:50,"Swedens Transport Agency moved all of its data to the cloud, apparently unaware that there is no cloud, only somebody elses computer. In doing so, it exposed and leaked every conceivable top secret database: fighter pilots, SEAL team operators, police suspects, people under witness relocation. Names, photos, and home addresses: the list is just getting started. URL __ #infosec #cybersecurity "
129,cybersecurity,CERTCybSec,"Apple Users, Beware! A Nearly-Undetectable Malware Targeting Mac Computers",2,6pfiis,https://www.reddit.com/r/CERTCybSec/comments/6pfiis/apple_users_beware_a_nearlyundetectable_malware/,2017-07-25 21:26:50,"Apple Mac malware outbreaks are rare. So when they happen, people pay attention. URL __ #infosec #cybersecurity "
130,cybersecurity,CERTCybSec,WINDOWS SMB ZERO DAY TO BE DISCLOSED DURING DEF CON,1,6qhncl,https://www.reddit.com/r/CERTCybSec/comments/6qhncl/windows_smb_zero_day_to_be_disclosed_during_def/,2017-07-31 00:34:40,"A 20-year-old Windows SMB vulnerability is expected to be disclosed Saturday during a talk at DEF CON. Microsoft has said it will not patch the vulnerability, which allows an attacker to remotely crash a Windows server with relative ease using only 20 lines of Python code and a Raspberry Pi. URL __ #infosec #cybersecurity "
131,cybersecurity,CERTCybSec,A new era in mobile banking Trojans,1,6qv3ek,https://www.reddit.com/r/CERTCybSec/comments/6qv3ek/a_new_era_in_mobile_banking_trojans/,2017-08-01 19:20:48,"In mid-July 2017, we found a new modification of the well-known mobile banking malware family Svpeng  Trojan-Banker.AndroidOS.Svpeng.ae. In this modification, the cybercriminals have added new functionality: it now also works as a keylogger, stealing entered text through the use of accessibility services. URL __ #infosec #cybersecurity "
132,cybersecurity,CERTCybSec,Cerber ransomware delivered in format of a different order of Magnitude,1,6smx8d,https://www.reddit.com/r/CERTCybSec/comments/6smx8d/cerber_ransomware_delivered_in_format_of_a/,2017-08-10 03:12:01,The Magnitude exploit kit has been using an XML configuration file critical to retrieving the malware payload (Cerber) for several months already URL __ #infosec #cybersecurity 
133,cybersecurity,CERTCybSec,ShadowPad in corporate networks,1,6u0zyq,https://www.reddit.com/r/CERTCybSec/comments/6u0zyq/shadowpad_in_corporate_networks/,2017-08-16 19:52:34,"In July 2017, during an investigation, suspicious DNS requests were identified in a partners network. The partner, which is a financial institution, discovered the requests originating on systems involved in the processing of financial transactions. URL __ #infosec #cybersecurity "
134,cybersecurity,CERTCybSec,Dem rep demands info on ransomware attack from NSA,1,6k69ju,https://www.reddit.com/r/CERTCybSec/comments/6k69ju/dem_rep_demands_info_on_ransomware_attack_from_nsa/,2017-06-29 15:14:23,"In a letter to NSA Director Adm. Michael Rogers, Lieu urged the agency to deploy a ""kill switch"" to shut down the ransomware  if one exists  and warned that the infection could open up the floodgates for a series of cyberattacks based on leaked NSA hacking tools. URL"
135,cybersecurity,CERTCybSec,Petya.2017 is a wiper not a ransomware,1,6k6e1k,https://www.reddit.com/r/CERTCybSec/comments/6k6e1k/petya2017_is_a_wiper_not_a_ransomware/,2017-06-29 15:43:28,"The ransomware was a lure for the media, this version of Petya actually wipes the first sectors of the disk like we have seen with malwares such as Shamoon. URL #infosec #cybersecurity "
136,cybersecurity,CERTCybSec,Linux Machine Can Be Hacked Remotely With Just A Malicious DNS Response,1,6k7354,https://www.reddit.com/r/CERTCybSec/comments/6k7354/linux_machine_can_be_hacked_remotely_with_just_a/,2017-06-29 18:47:08,"A malicious DNS server can exploit this by responding with a specially crafted TCP payload to trick systemd-resolved in to allocating a buffer that's too small, and subsequently write arbitrary data beyond the end of it. URL #infosec #cybersecurity "
137,cybersecurity,CERTCybSec,Azure blues: Active Directory Connect has password reset vuln,1,6k8h3l,https://www.reddit.com/r/CERTCybSec/comments/6k8h3l/azure_blues_active_directory_connect_has_password/,2017-06-29 23:53:57,"Attackers can dive out of the cloud to pwn admin passwords. Microsoft is warning sysadmins to check their Azure Active Directory Connect configurations and implement a patch against a credential-handling vulnerability. The bug's in an Active Directory (AD) feature called password writeback. Azure AD can be configured to copy user passwords back to a local AD environment. A convenience feature, password writeback is designed to simplify password resets, letting users change their local and cloud passwords simultaneously. It supports resets from Office365 and allows admins to push a reset from the Azure portal back to on-premises AD. URL __ #infosec #cybersecurity"
138,cybersecurity,CERTCybSec,Decrypting the Motivations Behind NotPetya/ExPetr/GoldenEye,1,6kduy1,https://www.reddit.com/r/CERTCybSec/comments/6kduy1/decrypting_the_motivations_behind/,2017-06-30 14:56:28,"This week's massive ransomware outbreak has left security experts grappling to understand the ""who"" and ""why"" behind the attack, which mostly affected organizations in Ukraine and also reached businesses in an estimated 60 countries. URL __ #infosec #cybersecurity "
139,cybersecurity,CERTCybSec,NATO says a 'state actor' was behind the massive ransomware attack,1,6kpsws,https://www.reddit.com/r/CERTCybSec/comments/6kpsws/nato_says_a_state_actor_was_behind_the_massive/,2017-07-02 08:10:26,"A ""state actor"" was behind the cyberattack that hit over 12,000 devices in around 65 countries on Tuesday hitting major industries from advertising to oil, according to NATO. URL __ #infosec #cybersecurity "
140,cybersecurity,CERTCybSec,FBI hacked a US Darknet shopper who tried to purchase Mail Bomb,1,6ksom0,https://www.reddit.com/r/CERTCybSec/comments/6ksom0/fbi_hacked_a_us_darknet_shopper_who_tried_to/,2017-07-02 20:52:36,The FBI hacked the system of a dark web user who tried to purchase a mail bomb from an undercover investigator in the US. URL __ #infosec #cybersecurity 
