,topic,subreddit,title,score,id,url,created,body
72,cybersecurity,CERTCybSec,Microsoft Issues Windows Out-of-Band Update That Disables Spectre Mitigations,1,7trof0,https://www.reddit.com/r/CERTCybSec/comments/7trof0/microsoft_issues_windows_outofband_update_that/,2018-01-29 22:27:05,"Microsoft has issued on Saturday an emergency out-of-band Windows update that disables patches for the Spectre Variant 2 bug (CVE-2017-5715). The update KB4078130 targets Windows 7 (SP1), Windows 8.1, all versions of Windows 10, and all supported Windows Server distributions. Microsoft shipped mitigations for the Meltdown and Spectre bugs on January 3. URL __ #infosec #cybersecurity #spectre "
73,cybersecurity,CERTCybSec,"GandCrab Ransomware Distributed by Exploit Kits, Appends GDCB Extension",1,7tyncf,https://www.reddit.com/r/CERTCybSec/comments/7tyncf/gandcrab_ransomware_distributed_by_exploit_kits/,2018-01-30 16:00:29,"A new ransomware called GandCrab was released towards the end of last week that is currently being distributed via exploit kits. GandCrab has some interesting features not seen before in a ransomware, such as being the first to accept the DASH currency and the first to utilize the Namecoin powered .BIT tld. First discovered by security researcher David Montenegro, researchers quickly jumped in to analyze the ransomware and post their results on Twitter. This article will dive into what has been discovered by myself and other researchers. URL __ #infosec #cybersecurity #ransomware "
74,cybersecurity,CERTCybSec,Fake Swift Copy malspam via compromised sites delivering Java Adwind/ QRAT /JRAT Trojan,1,7ugtlq,https://www.reddit.com/r/CERTCybSec/comments/7ugtlq/fake_swift_copy_malspam_via_compromised_sites/,2018-02-01 17:25:29,"We continue to be plagued daily by fake financial themed emails containing java adwind / Java Jacksbot /QRAT /JRAT attachments. I have previously mentioned many of these HERE. We have been seeing these sort of emails almost every day and there was nothing much to update. Todays has a slightly different subject and email content to previous ones. Many Antiviruses on Virus Total detect these heuristically. There is currently a major malware campaign malspamming Java Adwind /Qrat /Jrat using generic, non specific email subjects based around invoices or payment queries. URL __ #infosec #cybersecurity #qrat #jrat #malware "
75,cybersecurity,CERTCybSec,Unpatched Adobe Flash Player Zero-Day Exploit Spotted in the Wild,1,7upgq0,https://www.reddit.com/r/CERTCybSec/comments/7upgq0/unpatched_adobe_flash_player_zeroday_exploit/,2018-02-02 17:29:49,"A critical vulnerability (CVE-2018-4878) exists in Adobe Flash Player 28.0.0.137 and earlier versions. Successful exploitation could potentially allow an attacker to take control of the affected system. Adobe is aware of a report that an exploit for CVE-2018-4878 exists in the wild, and is being used in limited, targeted attacks against Windows users. These attacks leverage Office documents with embedded malicious Flash content distributed via email. Adobe will address this vulnerability in a release planned for the week of February 5. For the latest information, users may monitor the Adobe Product Security Incident Response Team blog. URL __ #infosec #cybersecurity #0day"
76,cybersecurity,CERTCybSec,Operation PZChao: a possible return of the Iron Tiger APT,1,7uxojx,https://www.reddit.com/r/CERTCybSec/comments/7uxojx/operation_pzchao_a_possible_return_of_the_iron/,2018-02-03 17:09:03,"Our threat intelligence systems picked up the first indicators of compromise in July last year, and we have kept an eye on the threat ever since. An interesting feature of this threat, which drew our team to the challenge of analyzing it, is that it features a network of malicious subdomains, each one used for a specific task (download, upload, RAT related actions, malware DLL delivery). The payloads are diversified and include capabilities to download and execute additional binary files, collect private information and remotely execute commands on the system. In the analysis process, we managed to retrieve the malware payloads hosted on one of the command and control servers along with some statistics, such as the total number of downloads and logs containing the targeted victims. Among the most-downloaded malicious files, we found variants of Gh0st RAT used in Iron Tiger APT operation. Interestingly enough, these new samples now connect to the new attack infrastructure. URL __ #infosec #cybersecurity #apt"
77,cybersecurity,CERTCybSec,"Newly Detected Malware Uses NSA Exploit To Mine Monero, Over 500K PCs Infected",1,7uxp36,https://www.reddit.com/r/CERTCybSec/comments/7uxp36/newly_detected_malware_uses_nsa_exploit_to_mine/,2018-02-03 17:12:25,"Cryptocurrency mining botnet malware Smominru has infected more than 526,000 computers using a leaked NSA exploit, The Hacker News reported yesterday, Jan. 31. Software security researchers from cybersecurity company Proofpoint have detected a new global botnet called Smominru, also known as Ismo, that uses a National Security Agency (NSA) exploit EternalBlue to spread Monero mining malware. The EternalBlue exploit was leaked by the so-called Shadow Brokers hackers who were reportedly also behind the 2017 widespread WannaCry ransomware threat, according to The Hacker News. URL __ #infosec #cybersecurity #malware "
78,cybersecurity,CERTCybSec,Malvertising Campaign Abuses Googles DoubleClick to Deliver Cryptocurrency Miners,1,7vq3fl,https://www.reddit.com/r/CERTCybSec/comments/7vq3fl/malvertising_campaign_abuses_googles_doubleclick/,2018-02-07 06:59:41,"On January 24, 2018, we observed that the number of Coinhive web miner detections tripled due to a malvertising campaign. We discovered that advertisements found on high-traffic sites not only used Coinhive (detected by Trend Micro as JS_COINHIVE.GN), but also a separate web miner that connects to a private pool. Attackers abused Googles DoubleClick, which develops and provides internet ad serving services, for traffic distribution. Data from the Trend Micro Smart Protection Network shows affected countries include Japan, France, Taiwan, Italy, and Spain. We have already disclosed our findings to Google. We detected an almost 285% increase in the number of Coinhive miners on January 24. We started seeing an increase in traffic to five malicious domains on January 18. After closely examining the network traffic, we discovered that the traffic came from DoubleClick advertisements. URL __ #infosec #cybersecurity "
79,cybersecurity,CERTCybSec,Scammers Use Download Bombs to Freeze Chrome Browsers on Shady Sites,1,7vt1g2,https://www.reddit.com/r/CERTCybSec/comments/7vt1g2/scammers_use_download_bombs_to_freeze_chrome/,2018-02-07 13:58:23,"The operators of some tech support scam websites have found a new trick to block visitors on their shady sites and scare non-technical users into paying for unneeded software or servicing fees. The trick relies on using JavaScript code loaded on these malicious pages to initiate thousands of file download operations that quickly take up the user's memory resources, freezing Chrome on the scammer's site. URL __ #infosec #cybersecurity "
80,cybersecurity,CERTCybSec,ReelPhish: A Real-Time Two-Factor Phishing Tool,1,7vy3uu,https://www.reddit.com/r/CERTCybSec/comments/7vy3uu/reelphish_a_realtime_twofactor_phishing_tool/,2018-02-08 05:15:54,"Social Engineering and Two-Factor Authentication Social engineering campaigns are a constant threat to businesses because they target the weakest chain in security: people. A typical attack would capture a victims username and password and store it for an attacker to reuse later. Two-Factor Authentication (2FA) or Multi-Factor Authentication (MFA) is commonly seen as a solution to these threats. 2FA adds an extra layer of authentication on top of the typical username and password. Two common 2FA implementations are one-time passwords and push notifications. One-time passwords are generated by a secondary device, such as a hard token, and tied to a specific user. These passwords typically expire within 30 to 60 seconds and cannot be reused. Push notifications involve sending a prompt to a users mobile device and requiring the user to confirm their login attempt. Both of these implementations protect users from traditional phishing campaigns that only capture username and password combinations. Real-Time Phishing While 2FA has been strongly recommended by security professionals for both personal and commercial applications, it is not an infallible solution. 2FA implementations have been successfully defeated using real-time phishing techniques. These phishing attacks involve interaction between the attacker and victims in real time. URL #infosec #cybersecurity"
81,cybersecurity,CERTCybSec,"Bitglass Report: Microsoft SharePoint, Google Drive, and Majority of AV Engines Fail to Detect New Ransomware Variant",1,7vyywp,https://www.reddit.com/r/CERTCybSec/comments/7vyywp/bitglass_report_microsoft_sharepoint_google_drive/,2018-02-08 07:06:50,"Together, Bitglass and Cylance identified a new strain of Gojdue ransomware on the dark web, dubbed ShurL0ckr. Two well-known cloud platforms with built-in malware protection, Google Drive and Microsoft Office 365, failed to identify the ransomware. In addition, Bitglass tested VirusTotal, a service that scans malware against 67 of the leading malware engines, to scrutinize a file containing the ShurL0ckr ransomware. Only seven percent of tested AV engines successfully detected the new malware. To analyze the proliferation of malware in the cloud, the Bitglass Threat Research Team also scanned tens of millions of files, discovering a high rate of infection in cloud applications and a low efficacy rate for apps with built-in malware protection like Microsoft Office 365 and Google Drive. URL __ #infosec #cybersecurity #ransomware "
82,cybersecurity,CERTCybSec,Apple's iBoot Source Code for iPhone Leaked on Github,1,7w3qqh,https://www.reddit.com/r/CERTCybSec/comments/7w3qqh/apples_iboot_source_code_for_iphone_leaked_on/,2018-02-08 20:46:41,"Apple source code for a core component of iPhone's operating system has purportedly been leaked on GitHub, that could allow hackers and researchers to discover currently unknown zero-day vulnerabilities to develop persistent malware and iPhone jailbreaks. The source code appears to be for iBootthe critical part of the iOS operating system that's responsible for all security checks and ensures a trusted version of iOS is loaded. URL __ #infosec #cybersecurity "
83,cybersecurity,CERTCybSec,Multiple Vulnerabilities in NETGEAR Routers: patch now !!!!,1,7wd21w,https://www.reddit.com/r/CERTCybSec/comments/7wd21w/multiple_vulnerabilities_in_netgear_routers_patch/,2018-02-09 23:18:16,"TWSL2018-002: Password Recovery and File Access on Some Routers and Modem Routers TWSL2018-003: Finding 1: Post-Authentication Command Injection on Some Routers and ModemRouters TWSL2018-003: Finding 2: Authentication Bypass on Some Routers or Modem Routers TWSL2018-003: Chained Attack: Command Injection on Some Routers and Modem Routers TWSL2018-004: Command Injection Vulnerability on D7000, EX6200v2, and Some Routers Popopopopopopo....... Soooooo dirty ! URL __ #infosec #cybersecurity "
84,cybersecurity,CERTCybSec,UK Government website offline after hack infects thousands more worldwide,1,7wuvgk,https://www.reddit.com/r/CERTCybSec/comments/7wuvgk/uk_government_website_offline_after_hack_infects/,2018-02-12 06:22:05,"More than 5,000 websites have been hacked to force visitors' computers to run software that mines a cryptocurrency similar to Bitcoin. Users loading the websites of the Information Commissioner's Office, the Student Loans Company, as well as the council websites for Manchester City, Camden, and Croydon - and even the homepage of the United States Courts - would have had their computers' processing power hijacked by hackers. Malicious code for software known as ""Coinhive"", a program advertising itself as ""A Crypto Miner for your Website"" would start running in the background until the webpage is closed. Security researcher Scott Helme was alerted to the hack by a friend who sent him antivirus software warnings received after visiting a UK Government website. URL __ #infosec #cybersecurity "
85,cybersecurity,CERTCybSec,Dissecting PRILEX and CUTLET MAKER ATM Malware Families,1,7kdbb0,https://www.reddit.com/r/CERTCybSec/comments/7kdbb0/dissecting_prilex_and_cutlet_maker_atm_malware/,2017-12-17 22:19:57,"PRILEX  A highly targeted malware that hijacks a banking application How would a targeted attack against an automated teller machine (ATM) go if the attackers knew everything about that machine? Prilex malware steals the information of the infected ATMs users. In this case, it was a Brazilian bank, but consider the implications of such an attack in your region, whether youre a customer or the bank. The malware family called Prilex was first reported by Kaspersky in October 2017. We dissected this malware and found something very atypical: It works by hooking certain dynamic-link libraries (DLLs), replacing it with its own application screens on top of others. URL __ #infosec #cybersecurity #Prilex"
86,cybersecurity,CERTCybSec,North Korea Bitten by Bitcoin Bug: Financially motivated campaigns reveal new dimension of the Lazarus Group,1,7l1g7r,https://www.reddit.com/r/CERTCybSec/comments/7l1g7r/north_korea_bitten_by_bitcoin_bug_financially/,2017-12-21 00:42:19,"Proofpoint researchers have uncovered a number of multistage attacks that use cryptocurrency-related lures to infect victims with sophisticated backdoors and reconnaissance malware that we attribute to the Lazarus Group. Victims of interest are then infected with additional malware including Gh0st RAT to steal credentials for cryptocurrency wallets and exchanges, enabling the Lazarus Group to conduct lucrative operations stealing Bitcoin and other cryptocurrencies. We also discovered what appears to be the first publicly documented instance of a nation-state targeting a point-of-sale related framework for the theft of credit card data in a related set of attacks. Moreover, the timing of the point-of-sale related attacks near the holiday shopping season makes the potential financial losses considerable. URL __ #infosec #cybersecurity #malware #lazarus"
87,cybersecurity,CERTCybSec,Travle aka PYLOT backdoor hits Russian-speaking targets,1,7l2d98,https://www.reddit.com/r/CERTCybSec/comments/7l2d98/travle_aka_pylot_backdoor_hits_russianspeaking/,2017-12-21 03:14:44,"At the end of September, Palo Alto released a report on Unit42 activity where they  among other things  talked about PYLOT malware. We have been detecting attacks that have employed the use of this backdoor since at least 2015 and refer to it as Travle. Coincidentally, KL was recently involved in an investigation of a successful attack where Travle was detected, during which we conducted a deep analysis of this malware. So, with this intelligence ready we are sharing our findings in this blog to supplement Palo Altos research with additional details. URL __ #infosec #cybersecurity #PYLOT"
88,cybersecurity,CERTCybSec,New version of mobile malware Catelites possibly linked to Cron cyber gang,1,7l2i1y,https://www.reddit.com/r/CERTCybSec/comments/7l2i1y/new_version_of_mobile_malware_catelites_possibly/,2017-12-21 03:34:18,"In May 2017, Russian authorities arrested twenty members of a cybercriminal gang who had been using a banking Trojan called CronBot to steal over $900,000. The gang hid the Trojan within a host of phony apps, some designed to look like authentic online banking apps, some designed to look like pornography apps. These thieves knew their target demographic: over one million unsuspecting users installed the malware onto their Android mobile devices. The good news is that the villainous gang has been apprehended. The bad news is that the villainous malware is still at large. URL __ #infosec #cybersecurity #malware"
89,cybersecurity,CERTCybSec,Fully patched Windows 10 PC isn't enough,2,7l3ti6,https://www.reddit.com/r/CERTCybSec/comments/7l3ti6/fully_patched_windows_10_pc_isnt_enough/,2017-12-21 06:41:58,"Googles Project Zero released details of a local proof-of-concept attack against a fully patched Windows 10 PC that allows an adversary to execute untrusted JavaScript outside a sandboxed environment on targeted systems. The attack is a variation of a WPAD/PAC attack. In Project Zeros case, the WPAD/PAC attack focuses on chaining several vulnerabilities together relating to the PAC and a Microsoft JScript.dll file in order to gain remote command execution on a victims machine. URL __ #infosec #cybersecurity "
90,cybersecurity,CERTCybSec,Digmine Cryptocurrency Miner Spreading via Facebook Messenger,1,7lgj3v,https://www.reddit.com/r/CERTCybSec/comments/7lgj3v/digmine_cryptocurrency_miner_spreading_via/,2017-12-22 20:58:08,"We found a new cryptocurrency-mining bot spreading through Facebook Messenger, which we first observed in South Korea. We named this Digmine based on the moniker (  bot) it was referred to in a report of recent related incidents in South Korea. Weve also seen Digmine spreading in other regions such as Vietnam, Azerbaijan, Ukraine, Vietnam, Philippines, Thailand, and Venezuela. Its not far-off for Digmine to reach other countries given the way it propagates. Facebook Messenger works across different platforms, but Digmine only affects Facebook Messengers desktop/web browser (Chrome) version. If the file is opened on other platforms (e.g., mobile), the malware will not work as intended. Digmine is coded in AutoIt, and sent to would-be victims posing as a video file but is actually an AutoIt executable script. If the users Facebook account is set to log in automatically, Digmine will manipulate Facebook Messenger in order to send a link to the file to the accounts friends. The abuse of Facebook is limited to propagation for now, but it wouldnt be implausible for attackers to hijack the Facebook account itself down the line. This functionalitys code is pushed from the command-and-control (C&amp;C) server, which means it can be updated. A known modus operandi of cryptocurrency-mining botnets, and particularly for Digmine (which mines Monero), is to stay in the victims system for as long as possible. It also wants to infect as many machines as possible, as this translates to an increased hashrate and potentially more cybercriminal income. URL __ #infosec #cybersecurity #digmine"
91,cybersecurity,CERTCybSec,REMOTE LD_PRELOAD EXPLOITATION,1,7m33h8,https://www.reddit.com/r/CERTCybSec/comments/7m33h8/remote_ld_preload_exploitation/,2017-12-26 06:31:46,"This blog post details CVE-2017-17562, a vulnerability which can be exploited to gain reliable remote code execution in all versions of the GoAhead web server &lt; 3.6.5. The vulnerability is a result of Initialising the environment of forked CGI scripts using untrusted HTTP request parameters, and will affect all users who have CGI support enabled with dynamically linked executables (CGI scripts). This behavior, when combined with the glibc dynamic linker, can be abused for remote code execution using special variables such as LD_PRELOAD (commonly used to perform function hooking, see preeny). URL __ #infosec #cybersecurity "
92,cybersecurity,CERTCybSec,Huawei Routers Exploited to Create New Botnet,0,7mgxfj,https://www.reddit.com/r/CERTCybSec/comments/7mgxfj/huawei_routers_exploited_to_create_new_botnet/,2017-12-28 05:51:50,Zero-Day vulnerability in the Huawei home router HG532 has been discovered and hundreds of thousands of attempts to exploit it have already been found in the wild. The delivered payload has been identified as OKIRU/SATORI which is an updated variant of Mirai. The suspected threat actor behind the attack is an amateur nicknamed Nexus Zeta. URL __ #infosec #cybersecurity 
93,cybersecurity,CERTCybSec,Fortinet FortiClient Windows privilege escalation at logon,1,7mm1sp,https://www.reddit.com/r/CERTCybSec/comments/7mm1sp/fortinet_forticlient_windows_privilege_escalation/,2017-12-28 22:19:15,"This vulnerability affects the Fortinet FortiClient program. FortiClient is a client program used to connect to SSL/IPsec VPN endpoints. A setting, disabled by default, enables FortiClient on the logon screen to allow users to connect to a VPN profile before logon. An attacker, with physical, or remote (e.g. through TSE, VNC), access to a machine with FortiClient and this feature enabled, can obtain SYSTEM level privileges from the lock screen. No account or prior knowledge is required. The vulnerability lies in the confirmation dialog shown when the server certificate is not valid (e.g. default auto-signed certificate, or Man-In-The-Middle with SSL/TLS interception situation). URL __ #infosec #cybersecurity #intrinsec"
94,cybersecurity,CERTCybSec,"New Ruski hacker clan exposed: They're called MoneyTaker, and they're gonna take your money",1,7mmocx,https://www.reddit.com/r/CERTCybSec/comments/7mmocx/new_ruski_hacker_clan_exposed_theyre_called/,2017-12-29 00:47:31,"Hacker group dubbed MoneyTaker have allegedly stolen nearly 7.5million from companies in Russia, the United Kingdom and United states. Utilising a network operator portal, they were able to remove overdraft limits on debit cards and withdraw money from cash machines. The cyber thieves stole documentation for technology used by 200 banks in the US and Latin America and according to a report from Group-IB, could be used in future attacks. URL __ #infosec #cybersecurity #banking"
95,cybersecurity,CERTCybSec,No boundaries for user identities: Web trackers exploit browser login managers,1,7mq197,https://www.reddit.com/r/CERTCybSec/comments/7mq197/no_boundaries_for_user_identities_web_trackers/,2017-12-29 09:39:25,"We show how third-party scripts exploit browsers built-in login managers (also called password managers) to retrieve and exfiltrate user identifiers without user awareness. To the best of our knowledge, our research is the first to show that login managers are being abused by third-party scripts for the purposes of web tracking. The underlying vulnerability of login managers to credential theft has been known for years. Much of the past discussion has focused on password exfiltration by malicious scripts through cross-site scripting (XSS) attacks. Fortunately, we havent found password theft on the 50,000 sites that we analyzed. Instead, we found tracking scripts embedded by the first party abusing the same technique to extract emails addresses for building tracking identifiers. URL __ #infosec #cybersecurity "
96,cybersecurity,CERTCybSec,Malicious Website Cryptominers from GitHub. Part 2.,1,7ny2o4,https://www.reddit.com/r/CERTCybSec/comments/7ny2o4/malicious_website_cryptominers_from_github_part_2/,2018-01-04 08:56:52,"Recently we wrote about how GitHub/GitHub.io was used in attacks that injected cryptocurrency miners into compromised websites. Around the same time, we noticed another attack that also used GitHub for serving malicious code. Encrypted CoinHive Miner in Header.php URL __ #infosec #cybersecurity "
97,cybersecurity,CERTCybSec,Meltdown and Spectre,2,7o24qn,https://www.reddit.com/r/CERTCybSec/comments/7o24qn/meltdown_and_spectre/,2018-01-04 21:24:35,"Bugs in modern computers leak passwords and sensitive data. Meltdown and Spectre exploit critical vulnerabilities in modern processors. These hardware bugs allow programs to steal data which is currently processed on the computer. While programs are typically not permitted to read data from other programs, a malicious program can exploit Meltdown and Spectre to get hold of secrets stored in the memory of other running programs. This might include your passwords stored in a password manager or browser, your personal photos, emails, instant messages and even business-critical documents. URL __ #infosec #cybersecurity "
98,cybersecurity,CERTCybSec,New Android Malware Disguised as Uber App,1,7o361x,https://www.reddit.com/r/CERTCybSec/comments/7o361x/new_android_malware_disguised_as_uber_app/,2018-01-05 01:07:57,"New Android Malware Disguised as Uber App How would a targeted attack against an automated teller machine (ATM) go if the attackers knew everything about that machine? Prilex malware steals the information of the infected ATMs users. In this case, it was a Brazilian bank, but consider the implications of such an attack in your region, whether youre a customer or the bank. The malware family called Prilex was first reported by Kaspersky in October 2017. We dissected this malware and found something very atypical: It works by hooking certain dynamic-link libraries (DLLs), replacing it with its own application screens on top of others. URL __ #infosec #cybersecurity"
99,cybersecurity,CERTCybSec,"Qualcomm joins Intel, Apple, Arm, AMD in confirming its CPUs suffer hack bugs, too",1,7omcmj,https://www.reddit.com/r/CERTCybSec/comments/7omcmj/qualcomm_joins_intel_apple_arm_amd_in_confirming/,2018-01-07 09:08:23,"Qualcomm has confirmed its processors have the same security vulnerabilities disclosed this week in Intel, Arm, AMD and IBM CPU cores. The California tech giant picked the favored Friday US West Coast afternoon ""news dump"" slot to admit at least some of its billions of Arm-compatible Snapdragon system-on-chips and newly released Centriq server-grade processors are subject to the Meltdown and/or Spectre data-theft bugs. URL __ #infosec #cybersecurity #Meltdown #Spectre"
