,topic,subreddit,title,score,id,url,created,body
100,cybersecurity,computerscience,Dedicating a year to computer technology.,1,9nzrd2,https://www.reddit.com/r/computerscience/comments/9nzrd2/dedicating_a_year_to_computer_technology/,2018-10-14 14:20:50,"My current degree is Computer Information Systems Programming, but the deeper I get into it (graduating with an Associates in May 2019), the more I realize I'm not going to be able to work with computer programming which is what I really want to do. I'm too deep into it now to just deal with the chemistry and physics classes that were required for a Computer Science degree so I am waiting for my transfer to a 4 year college to see if I want to switch majors or if I could pull of getting a computer programming job with a CIS degree. Anyways, because I am scared for my future and that I truly made the wrong decision, I want to advance my skills on my own time. I want to dive into cybersecurity working with Kali Linux while also developing software applications and/or video games. I have Kali Linux installed on my desktop and Unity3D along with Python installed on my laptop. Does anyone have any advice for me on where to start, what I should truly focus on and if I should switch my degree?"
101,cybersecurity,computerscience,Choosing the right specialisation,1,9q8ven,https://www.reddit.com/r/computerscience/comments/9q8ven/choosing_the_right_specialisation/,2018-10-22 11:51:21,"I've studied under several domains(beginner level) such as mobile app dev, web app dev, game dev, AI, Desktop app dev, Quantum computing, cloud computing, cybersecurity and few more.. but I'd like to dive deeper in any one of the these. (I'd like to study all of them but being a 3rd year undergrad student, i also need to prepare for job, as such I'll have to start with one) problem is i can't choose one of these, since i like all of them...so can someone suggest a good domain to specialise in, and also state minimum requirements to succeed in that domain. I did shortlist two of them, game dev , cyber security and researcher in the field of Quantum computing, but I'd still like to get some advice on this topic. P.S., No IOT recommendations please."
102,cybersecurity,computerscience,Is a university degree in computer science really worth 3 more years at school ?,1,9urqwu,https://www.reddit.com/r/computerscience/comments/9urqwu/is_a_university_degree_in_computer_science_really/,2018-11-07 06:55:49,"Hi, I am currently studying in computer science at the University of Quebec in Montreal in the province of Quebec in Canada. I just finished a DEC in computer science which took me 3 years to accomplish. Now I'm at my first semester in university and I'm beginning to wonder if its all even worth it. The reason I decided to go for a university degree in computer science is mainly because I taught that in the end it would pay off more than just going to work straight after my technical degree and also I wanted to learn more about cybersecurity, which is my main interest . But since the beginning of this degree, I'm starting to question if the experience I would acquire by working now would be more useful than finishing my university degree, which means three more years at school. Will there be a difference concerning the salary, opportunities and advancements ?"
103,cybersecurity,computerscience,Does a second master's degree make sense?,4,9gfs06,https://www.reddit.com/r/computerscience/comments/9gfs06/does_a_second_masters_degree_make_sense/,2018-09-17 10:43:59,"I feel like an idiot. I wasted $30,000 on a master's in cybersecurity, since I hoped to get in that field. What I didn't know, being the most dumbest man in the world, was that it's useless without some background in computer science and I should've done that instead. Now, I have gotten accepted to FAU's computer science program, taking five prerequisites before I go into the master's degree program. At the age of 28, is it too late to make a change into technology? I can pay as I go, taking one class per semester to avoid loans, and use what I learned to make projects. My first class is Intro to Programming in C. I wish I had known about this when I was younger, but being bullied heavily made me withdraw too much and not know much about the world. I wish I was never created."
104,cybersecurity,computerscience,Network Enginner or Cybersecurity engineer?,1,9gw8kx,https://www.reddit.com/r/computerscience/comments/9gw8kx/network_enginner_or_cybersecurity_engineer/,2018-09-19 02:16:13,Im stuck on which program I should do. The network engineer will prep me for CCNA R&amp;S and the Cybersecurity will prep me for CCNA and CCENT. Both are about the same price and same amount of time. Which do you think is more valuable for putting in my resume to go work in IT? 
105,cybersecurity,computerscience,Aspiring IT,1,9hmn77,https://www.reddit.com/r/computerscience/comments/9hmn77/aspiring_it/,2018-09-21 15:54:32,Hey everyone. I am going to be doing a non-credit Cybersecurity and Networking Engineering program to get my CCNA and CCENT at my local community college. This is all very new to me and Id like to try to teach myself as much information as possible before entering the course so that I dont feel like a total noob. What are some books I can read/websites to go to that I can teach myself some basics before getting into this? I have a decent aptitude for technology and I have always been able to troubleshoot issues with computers but Im definitely not an expert. 
106,cybersecurity,computerscience,Need advice on getting an education in computer science with no prior experience in the field whatsoever,1,9j8wzo,https://www.reddit.com/r/computerscience/comments/9j8wzo/need_advice_on_getting_an_education_in_computer/,2018-09-27 12:18:57,"I have recently become interested in learning about computer science - mainly cyber security. It seems like a nice field to get in to especially since the job outlook is very good. I dont have much knowledge of computer systems/programs/terminology, though, so I would basically be starting from scratch (I was getting overwhelmed just reading some of the things other people posted here because of all the words I didnt understand lol). Would getting an associates degree in this field be relatively difficult for someone in my position? Or, from your experience, would this program be doable? From reading some of the posts on here, it seems that getting an associates degree in computer science would be best because I can learn the basics and go on to further my education specifically in Cybersecurity; however, I am no good at math and it appears that quite a few math courses are required for the computer science degree (the Cybersecurity program Im looking at requires less math classes than the Computer Science program). Im torn on what I should do - do I go for the CS associates degree? Do I go straight for the cyber security associates degree? Or do I need to brush up on my knowledge of computer science as a whole before spending money for a program I would not do well in since I am not already that educated in the subject? I wouldnt mind obtaining the degree in Computer Science, but again it is the math that worries me. I do already have a BA in sociology so Im hoping that for any program I do enroll in much of my general education requirements could transfer over, leaving me space for other lower-level computer science courses that are not already required by either program. Sorry if my wording is a bit confusing/repetitive. Any help would be greatly appreciated! tldr: newbie to computer science looking to get in to the field. Looking more towards Cybersecurity, and not very good at math. Unsure if Ill do well in the classes if I dont have any sort of background in computer science"
107,cybersecurity,computerscience,What are some common problems to tackle in the field of cybersecurity using machine learning outcomes?,2,9k8vx7,https://www.reddit.com/r/computerscience/comments/9k8vx7/what_are_some_common_problems_to_tackle_in_the/,2018-10-01 04:52:35,"The goal of the my machine learning based cybersecurity project is to get hands-on experience in independently defining, analyzing a cyber security problem with machine learning approaches. Although I am very familiar with machine learning, I am not so familiar with common problems to tackle in the realm of cybersecurity. Doe anybody have any good resources or project ideas I should look into?"
108,cybersecurity,computerscience,Major Comp Sci but Minor ?,1,9l3iak,https://www.reddit.com/r/computerscience/comments/9l3iak/major_comp_sci_but_minor/,2018-10-04 03:51:40,"Hello everyone. Need some advice here: Im currently going for BS Comp Sci with minor of Cybersecurity. However, I have a lot of comp sci friends who are doing mathematics as their minor. Made me worry a bit actually. Should I change my minor to Mathematics instead? Because i fear that in the future that I end up not enjoying Cybersecurity and want to do something else, would having a minor of mathematics would help me easily transition and create a good foundation for me rather than having a specific minor like Cybersecurity?"
109,cybersecurity,computerscience,Best Way to Learn About EECS Fields?,1,9mm3u4,https://www.reddit.com/r/computerscience/comments/9mm3u4/best_way_to_learn_about_eecs_fields/,2018-10-09 15:25:00,"For example, if I was interested in what embedded systems were or what tensorflow does or types of attacks in cybersecurity etc. &amp;#x200B; I would really appreciate links/ online resources. thank you sm!"
110,cybersecurity,computerscience,How bad is a computer engineering degree for software/data science/cybersecurity jobs?,1,9mo42r,https://www.reddit.com/r/computerscience/comments/9mo42r/how_bad_is_a_computer_engineering_degree_for/,2018-10-09 21:51:15,"Hi all, I'm at the last year of my bachelor in CE. Long story short, I'm here even if I always loved computer science. I started coding when I was 13, now I'm 21. During my few programming classes I noticed how bad my profs were at teaching, and how little they taught us. Even the math classes are not made for ""thinking"" but just for applying concepts without really understand them. Now I'm worrying whether I can apply for jobs related to CS. I taught myself programming, and in my free time I keep doing that, I'm also watching some MIT lessons on YouTube and playing on hackerrank. After this bachelor, do you suggest me to pursue another bachelor in CS or a master in CE? Are my dreams still possible? Sorry for the complaint and for my bad English. "
111,cybersecurity,computerscience,Does two bachelor's degrees and a master's look weird?,0,99vcs0,https://www.reddit.com/r/computerscience/comments/99vcs0/does_two_bachelors_degrees_and_a_masters_look/,2018-08-24 17:20:58,"Because I have a bachelor's in health science and a master's in cybersecurity. I want to learn more about computer science, so I'm getting a second bachelor's in it. Does it look funny?"
112,cybersecurity,computerscience,Casual CS Books?,23,9azj0e,https://www.reddit.com/r/computerscience/comments/9azj0e/casual_cs_books/,2018-08-29 00:46:35,"Hey everyone! I enjoy reading on the field of computer science on my free time. However, a lot of them get really technical in terms of mathematical proofs, script analysis, etc., and its a little hard to follow if Im just reading a few pages at a time in between classes. Do you guys know of any interesting books that are meant to be read casually? Such as a book on the history of cybersecurity or something along those lines. Thank you!"
113,cybersecurity,computerscience,Looking to advance my Cybersecurity career,2,9brc8f,https://www.reddit.com/r/computerscience/comments/9brc8f/looking_to_advance_my_cybersecurity_career/,2018-08-31 16:45:55,"Hello, I am a Graduate Apprentice for a Cybersecurity company. We specialise in setting up proxies in the DMZ zone (BIG-IP etc). Very transparent company, and very small, there are only 9 of us. In order to advance my career, I want to be as useful to the company as possible. Our bosses were talking about having a pen tester to pen test potential customers for free to show them how vulnerable they are. My bosses were very keen on this. I want this to be me in the future. How can I go about this. Other than suggesting setting up a virtual hacking environment, articles in the Internet haven't been too useful. Can someone help me out and maybe direct me to good books or sources of knowledge? Even better, tell me how to get started? What should I atleast learn first? My graduate degree will teach me a lot about networks, but that's it. "
114,cybersecurity,computerscience,When will the Rat Race stop in India ?,0,9crr6t,https://www.reddit.com/r/computerscience/comments/9crr6t/when_will_the_rat_race_stop_in_india/,2018-09-04 12:47:30,"I am pursuing my bachelors in technology from a renowned Institute in India . I am in the CSE branch and I am more into the field of Cybersecurity and A.I but I really dont find anyone to be intersted in Cybersecurity and am literally alone with my ideas with no support .I am mostly alone as i can't find people with same interests . What am i supposed to do to excel my career in Computer Science and Cybersecurity .Do i really need to be freinds with theory experts and bookworms that are just good in mugging up and then puking it on the question paper ? Please give me advice and does this shit is ever going to end where you are supposed to get good grades and get placed as a junior developer (sorry not being mean )? Ps - my first post on reddit , so spare me from trolling !"
115,cybersecurity,computerscience,"Switching to computer science because of a useless cybersecurity degree, is this normal?",2,8yxe9k,https://www.reddit.com/r/computerscience/comments/8yxe9k/switching_to_computer_science_because_of_a/,2018-07-15 09:25:36,"So here's the deal. I have a master's in cybersecurity, due to wanting to work within the field. But in my experience, nobody was hiring me. After 10 months of searching, I gave up. I still want to work withing technology, but nobody will hire me. So I'm taking the liberty of doing an online computer science second bachelor's degree because I don't want to leave my job and be forced to take out student loans. I'm tired of being rejected for jobs. I want to work within technology, but cybersecurity degrees are like the story with the no clothes emperor; highly hyped with no job prospects. The truth is, I have majored in computer science in the past, but failed discrete mathematics (badly)."
116,cybersecurity,computerscience,"University doesn't offer bachelour in CS, only masters, what to do?",1,9001m5,https://www.reddit.com/r/computerscience/comments/9001m5/university_doesnt_offer_bachelour_in_cs_only/,2018-07-19 08:21:43,"Hi, uhh Im from Norway and going my last year in highschool, I want to get in into infosec and cybersecurity, but everyone told me that you be better with BS in CS, but the problem is there is only 1 university in Norway that offers CS and its not like bad, but it doesnt offer that much in curriculum, another option is to go to prestige UNI near me taking BS in Computer Eng, and than MS in CS TL;DR: Best university in norway doesnt offer Bachelours in computer science, only masters, but I want to get into infosec/cybersec and everyone says that cyber/infosec degree sucks ehat to do"
117,cybersecurity,computerscience,Computer Science or Physics for undergrad?,6,93fq3f,https://www.reddit.com/r/computerscience/comments/93fq3f/computer_science_or_physics_for_undergrad/,2018-08-01 02:01:01,"I've always been intrigued by computers and have always wanted to work to improve cybersecurity one day. Recently however, I've become more interested in the physics involved in computers such as quantum computing and whatnot. Physics has always been one of my stronger subjects and I thoroughly enjoy it; is there a way I could study computer science yet be somewhat involved in physics? Maybe for example, utilising quantum entanglement to improve cybersecurity or sth of the kind? Or should I just go for pure physics courses? I know for a fact that there is a basic computer science module covered in the physics courses, could it be vice versa for com sci?"
118,cybersecurity,computerscience,"Planning on getting a third degree in computer science, should I do bachelor's or master's?",1,8tkcq5,https://www.reddit.com/r/computerscience/comments/8tkcq5/planning_on_getting_a_third_degree_in_computer/,2018-06-25 05:49:57,"So here's the deal. I have a bachelor's in health science because I majored in that when I was young and stupid and didn't know what to do. Later, I decided that I wanted to transition into technology and got a master's degree in cybersecurity. But after many failed attempts to get a job in that field and being told at one point that it's for those with a good computer science background, I concluded that it's not for me. I'm 28 years old and in the process of going back to school again for a third degree in computer science, meaning I'll be older than most of the people on campus, being unfortunate to not have been exposed to this stuff at a young age. What do you think about my decision to go back to school? And I am not taking out any more student loans (I already owe $15,000) and am opting for one class per semester, since I have no intention of leaving my job."
119,cybersecurity,computerscience,What is the difference between cybersecurity and computer science?,1,8v86ic,https://www.reddit.com/r/computerscience/comments/8v86ic/what_is_the_difference_between_cybersecurity_and/,2018-07-01 16:42:55,In about a year I am going to start college and I don't know which one to take. What are the similarities and differences?
120,cybersecurity,computerscience,Is it possible to master in Computer Science with a undergraduate Biology degree?,1,8wggt6,https://www.reddit.com/r/computerscience/comments/8wggt6/is_it_possible_to_master_in_computer_science_with/,2018-07-06 12:37:38," Well, I'm close to graduating college with a Biology degree. I focus in Virology and Genetics as a Bio major and also a pre-med. I do like Virology and Genetics a lot but now I discovered I didn't like medicine at all and would like to pursue my interest in computer science. I liked both Cybersecurity and Microbiology but I know I gotta choose one. And apparently, I'm one of those people who are pressured by their parents to be a doctor. So Microbiology is my closest bet to reach medicine due to that their requirements is basically pre-med (Biology, Physics, and Chemistry with the Psychology, Sociology, Statistics,Math etc.). But as a senior in college, I opt out the pre-med requirements and just pursue a bio major. So I was thinking to just take Comp Sci. as a master's deg. Is it still possible? Note: I have a partial background in programming as a hobby that I study every summer. But I'm not sure if a background as a hobby is enough. "
121,cybersecurity,computerscience,Best OS for security??,1,8jw07v,https://www.reddit.com/r/computerscience/comments/8jw07v/best_os_for_security/,2018-05-17 01:53:09,"I'm a current CS undergraduate student and I am interested in turning my spare MacBook into a tool that I can use to further toy around with side projects I'm wanting to do, possibly boot camp and toy around with other OS, etc.. I'm wanting to go to grad school for security \(cybersecurity or Info. Sec.\) and I was wondering if becoming well\-versed in possibly Linux will help me out?? I'm want to gain hands\-on experience and wanted to know what your thoughts were. pls help a boi out :\~\)"
122,cybersecurity,computerscience,"Are there any ""noble"" professions within computer science?",3,8jwu21,https://www.reddit.com/r/computerscience/comments/8jwu21/are_there_any_noble_professions_within_computer/,2018-05-17 03:33:38,"I am entering my junior year in college to complete my B.S. in computer science and I realized I want to be able to have a positive impact on lives. Something in the line of cybersecurity to ensure people don't get hacked, or maybe maintaining a website for a charitable/beneficial organization or something else. I don't want to be wrapped up in a company who is only interested in profits and making their product addicting to people. Any ideas and advice would be appreciated"
123,cybersecurity,computerscience,What's a good checklist of things to know before pursuing a career in cybersecurity?,40,8lahtu,https://www.reddit.com/r/computerscience/comments/8lahtu/whats_a_good_checklist_of_things_to_know_before/,2018-05-23 00:42:20,"Current CS student, just want to know what I should try and master before entering the workforce. "
124,cybersecurity,computerscience,Should I get CompTIA A+ and Security+ Certifications for a career in cybersecurity?,4,8mkdky,https://www.reddit.com/r/computerscience/comments/8mkdky/should_i_get_comptia_a_and_security/,2018-05-28 06:11:00,"Hi, Im in college for com sci bachelors. I just finished my second java intro class so I'm mostly a beginner. In school, we got up to understanding abstract classes and interfaces in java. Outside of school, i have learned a little bit of c and used structs from a online harvard intro class. Also, Ive learned a little bit of web development by building a pizza ordering web application that included a menu and a online shopping cart using Django python framwork. Im interested in cybersecurity and I'm trying to figure out how to progress in that. Ive learned from some reddits posts that I should learn assembly language so I've learned a bit of that. A classmate from college recommend to get a comp tia certification. Please tell me if I'm on the right path. How do I become successful in Cybersecurity?"
125,cybersecurity,computerscience,Reading/Videos on Cybersecurity basics?,3,8nnr1p,https://www.reddit.com/r/computerscience/comments/8nnr1p/readingvideos_on_cybersecurity_basics/,2018-06-01 10:59:25,"Hey guys, I have an internship interview coming up for a cybersecurity position. They don't require any previous knowledge of it, but I think it'd be best to at least know the basics. Does anyone have some recommendations for online reading, courses, or videos? Unfortunately, I don't have time to order a book, just need something so I don't feel totally ignorant. Thanks!"
126,cybersecurity,computerscience,Should i study cybersecurity or software engineering?,2,8pyhq7,https://www.reddit.com/r/computerscience/comments/8pyhq7/should_i_study_cybersecurity_or_software/,2018-06-10 14:19:11,"Hello everyone, here's the entire history, before finishing school, i had my mind set to study Software Engineering, but when i applied to study that, the university rejected me because of my Math results on the admission test. In that moment, they proposed to enter no another carrier, get better at math then switch to Software engineering. After 2 trimesters i decided to stay studying that other carrier (International bussiness), but then it hit me again, should i swith?. So at the begening the main idea was to study software engineering, but then i realised that hacking and testing the security of networks was a thing, i thoug that was something just for harming, but i never stoped to ask myself how do people prevent getting attacked my hackers and stuff like that. Then i set my mind that i'd switcht to cybersecurity, but when i checked the pensum some people told me that i was really bad. so, i'd love you to tell me some adiveses and ask for questions that you know might help me to find my way. You think i could study Software engineering and with that knockledge learn cybersecurity (I already have some knockledge of Software, but almost nothing about Cybersecurity, i was doing a course, but stopped when i was about to penetrate my first WPA/WPA2 network) If it was for me, i'd box, or do something completly related to martial arts (I LOVE MARTIAL ARTS) I'm 17yo"
127,cybersecurity,computerscience,Anyone specializing in Cybersecurity?,8,8hawgp,https://www.reddit.com/r/computerscience/comments/8hawgp/anyone_specializing_in_cybersecurity/,2018-05-06 08:25:23,Im looking to learn more about it during the summer and was wondering if anyone could recommend any books on this topic. Any help is appreciated! 
128,cybersecurity,computerscience,Recommended Resources for Cyber and Networking?,7,8iy01y,https://www.reddit.com/r/computerscience/comments/8iy01y/recommended_resources_for_cyber_and_networking/,2018-05-13 04:40:02,"I'm another one of the thousands of students going to university for CS in the fall. I've recently started learning C++ over the last couple months, and have made it through to the last two or three chapters of one of the textbooks with a pretty fair understanding of the language. Nonetheless, I am minoring in cybersecurity which is where I hope to eventually end up with my career; however, I don't know very much about it. I find the concepts between servers, networking, and ethical hacking very interesting and would like to start experimenting around with these concepts; but, it seems like there are so many resources out there I don't really know where to find a starting point like I did with programming. I usually liked to be the most prepared coming into anything, especially classes and I'd really like to learn more than just pass a course. (Okay, here's the question part) Can you recommend any resources/courses/textbooks/etc that have hands-on learning practice for things like servers, networking, and ethical hacking? And where would be a good spot to start at? Thanks in advance!"
