,topic,subreddit,title,score,id,url,created,body
24,cybersecurity,computerscience,WGU for BS and Masters?,1,goqnd4,https://www.reddit.com/r/computerscience/comments/goqnd4/wgu_for_bs_and_masters/,2020-05-23 06:01:35,"Hi everyone, I have two questions that maybe you guys could shine light too: Backstory: I am currently completing my AAS degree at my local community college online. I have the option to get it in Cyber Security, Information Technology, or Programming. I am enjoying programming alot, as well as Cybersecurity. As of now, all my credits taken can transfer nicely into either or; which would you recommend I get? Second Q: My college only offers two BS degrees: Information Technology and Cybersecurity. I was also looking at WGU(as the title states) due to a co-worker recommending them. Said co-worker is an RN, so she is not working in anything near close to what I want; that is why (again) I ask you guys to give me feedback or advice on what my next step will be like. They do have a BS in Software Development and others. My question(s) :  Is WGU a good place for these degrees? (Like are they reputable and will I learn up to date material etc)  For you who already work in similar or those fields, what route would you recommend someone who likes both fields the same? I hope I can get some answers to help me make an informed decision. I know ultimately it is up to me, but I am fairly new to all this and just need some feedback. AND FINALLY (I promise), SORRY FOR THE GRAMMAR/FORMATTING OF MY WRITING, I AM AT WORK AND ON MOBILE TRYING TO TYPE THIS UP TRYING TO BE FAST AND NOT GET CAUGHT(I will better my work ethics, I promise)"
25,cybersecurity,computerscience,FinTech and Cybersecurity thesis,1,gp5f9k,https://www.reddit.com/r/computerscience/comments/gp5f9k/fintech_and_cybersecurity_thesis/,2020-05-24 00:02:47,"Apologies if this is the wrong sub. I am a masters student who is pursuing cyber security. I am looking to do my thesis on Fintech and Cybersecurity. However, I am stuck on what gaps there is to research. So my question is do you guys have any knowledge of gaps in previous research that would be great to explore? Also due to covid 19 I can not do field research so it has to be desk based research. Thanks so much!"
26,cybersecurity,computerscience,Getting a Masters degree?,1,fuu1ru,https://www.reddit.com/r/computerscience/comments/fuu1ru/getting_a_masters_degree/,2020-04-05 00:51:44,"Ok so Im currently active duty military and I will be finishing up my Bachelors in CS next year. However, Ill still have about a year and a half left after that until I get out of the service. Im looking into starting a Masters degree since the military would pretty much be paying for it. Ive looked into Data Science &amp; Analytics, Cybersecurity, Masters in IT, Masters is CS, and and MBA(only because I heard they look good on paper). Are any of these worth it? Ive read a lot of people saying its not worth it until you are actually in the field already working. Is this true? Are there any hiring managers out there that can attest to this? If you see someone with a masters but has no work experience would you consider hiring them? Any advice and comments are more than welcome! Please let me hear your opinions!!!"
27,cybersecurity,computerscience,Help choose a school,1,fuzwzl,https://www.reddit.com/r/computerscience/comments/fuzwzl/help_choose_a_school/,2020-04-05 05:41:17,"Hi, I have been accepted to 2 programs for Cybersecurity in Canada GTA area and I need help choosing one. I have been accepted to the Sheridan Honours Bachelor of Applied Information Sciences (Information Systems Security) and Seneca Honours Bachelor of Technology - Informatics and Security which one is better by looking at the courses linked below. I feel Sheridan might be better but it would be a 2-hour commute for me and expensive Seneca is closer to my home. Sheridan course sequence-[URL Seneca course sequence-[URL Thank you for your help"
28,cybersecurity,computerscience,Cybersecurity Minor?,1,fvpns2,https://www.reddit.com/r/computerscience/comments/fvpns2/cybersecurity_minor/,2020-04-06 11:31:47,Should I add that onto my CS major?
29,cybersecurity,computerscience,Going into P tech,0,fzrttq,https://www.reddit.com/r/computerscience/comments/fzrttq/going_into_p_tech/,2020-04-12 16:47:15,P tech is a cs thing where I'm from that works for cybersecurity and other computer stuff. I already am in and got into my classes so if there's any tips you have I would gladly appreciate it.
30,cybersecurity,computerscience,Lost psychology grad,0,g2ke8u,https://www.reddit.com/r/computerscience/comments/g2ke8u/lost_psychology_grad/,2020-04-17 04:19:22,"Hello! I hope everyone is staying safe and well. I have a question, I graduated last May with my BA in Psychology but I feel as if I made a mistake. I live in a very small rural town and the only program offered (in state) online that remotely interested me was psychology, but Im starting to get really interested in computer science, mainly cybersecurity. I have zero experience in this field, but I am taking some classes through coursera and study to gain some certifications. I am wondering if I should go back for my BS in CS or continue and gain my masters in CS? I want my resume to look desirable, but Im not sure which will be the right avenue for me. Thank you so much for your help"
31,cybersecurity,computerscience,"Which major worth more, Cybersecurity or Computer Science?",1,g3o5wx,https://www.reddit.com/r/computerscience/comments/g3o5wx/which_major_worth_more_cybersecurity_or_computer/,2020-04-19 00:14:49,"So guys, i got an offer from Purdue for a cybersecurity major, software engineering major from ANU and Computer Science major from University of Sydney..i am desperate for opinions, idk wht to choose..cybersecurity is in high demand, same goes to comp sc n software engineering..but i do think a cybersecurity is a too specific major..i just dont know :( ..wht do you guys think? Which major will worth spending 4 years studying?"
32,cybersecurity,computerscience,Problem understanding the SSH protocol,1,g5yy56,https://www.reddit.com/r/computerscience/comments/g5yy56/problem_understanding_the_ssh_protocol/,2020-04-22 20:48:08,I'm taking a course in cybersecurity and I'm struggling to understand how the SSH protocol is able to securely start an encrypted session. I watched a short explanation by Tinkernut on YouTube and tried to sum it up for myself in a nutshell: &amp;#x200B; 1. Client encrypts message (id\_rsa public key) with his public key 2. Client sends it to Server 3. Server can't read it since he doesn't have Client's private key 4. Server proceeds to encrypt it as well with his own public key 5. Server sends it back to Client 6. Client decrypts it with his own private key --------- QUESTION 7. Client sends it back to Server 8. Server decrypts it with his own private key 9. Server can now read Client's message &amp;#x200B; Server now has Client's public key &amp;#x200B; server encrypts his own message (id\_rsa public key) with client's public key Server sends it to Client Client decrypts it with his own private key Client reads Server's message &amp;#x200B; Client now has Server's public key &amp;#x200B; My question is for stage 6: QUESTION: How can the client decrypt it? Isn't there another layer of encryption created by the Server on top of the Client's first encryption that has to be peeled off first? My logic is for example: compressing/encrypting (add to archive) a file with a password using 7zip (file.7z) and then proceeding to do the same to that file but with a different password. So in order to decrypt the original .7z file we have to first go through the first decryption/password and only after that can we decrypt the second one. Your help would be greatly appreciated!
33,cybersecurity,computerscience,SSH Encryption Process,1,g8znas,https://www.reddit.com/r/computerscience/comments/g8znas/ssh_encryption_process/,2020-04-27 22:19:54,"Hi. Follow-up to my previous post. I'm a cybersecurity student and I'm eager to understand the basic processes of an SSH session. I wrote down the stages to the best of my ability but need help understanding what happens right after the TCP handshake and right before the Diffie-Hellman key exchange. Please help: *Session Start/TCP Handshake* 1.Client begins a session with Server by initiating a TCP handshake. *Assymetric Encryption for TCP Session* 2.Server and Client negotiate back-and-forth and agree upon a mutually supported encryption protocol for the TCP session. **At this point, post-protocol-negotiation, it is unclear to me how their session is initially being encrypted. I used Wireshark to try and capture the Client or Server sending over their public key or something but couldn't see anything. Regardless, please explain this stage if you can.** *Client and Server negotiate a shared secret key for this session using the Diffie-Hellman algorithm in order to establish a symmetric-key encrypted session.* 3.Client and Server begin process of producing temporary key pairs, using 1. Shared prime number 2. Encryption generator (typically AES) 3. Private prime number (as private key). 4.Client and Server use these three to each generate their own public key that can be derived from their own private key. 5.Client and Server each share their generated public key with each other. 6.Client and Server each use their own private key, the other's public key and their original shared prime number to generate the same secret key. 7.Client and Server use this key as their shared secret key to encrypt and decrypt all future communication on this session. *At this stage, Client and Server have successfully established a symmetric-key-encrypted session without having needed to send the secret key over insecure channels.* **If I got anything else wrong I'd really appreciate any clarification. Thanks!**"
34,cybersecurity,computerscience,Cybersecurity Engineering (George Mason) vs Computer Science concentration in Cyber (VCU),1,gbdlez,https://www.reddit.com/r/computerscience/comments/gbdlez/cybersecurity_engineering_george_mason_vs/,2020-05-01 17:17:49,"Hey guys, currently Im in George Mason as a freshman studying cybersecurity engineering. I recently got a acceptance letter from Vcu accepting me into school of engineering. If I was to transfer I would mostly likely major in computer science with cyber concentration there. However I am unsure if I should transfer or not. My main reason would be that I am not feeling the college vibe and the experience I thought I would get. Mason doesnt feel as lively to me maybe because I dont know many people since I started from spring instead of next fall. I just wanted thoughts on what you guys think I should major in. Many people agree Mason has a good cyber program and where its located its networks are pretty good as well. Still its very difficult for me to decide, I feel like if I stay I may lose the opportunity to actually enjoy college while working hard or if I transfer I let go of a good program I am in although (quick fact) Mason is giving less aid compared to VCU. Im in a big dilemma please honest thoughts. Thanks!!"
35,cybersecurity,computerscience,News Flash: You By No Means Need A Degree In CS,1,fg5z2a,https://www.reddit.com/r/computerscience/comments/fg5z2a/news_flash_you_by_no_means_need_a_degree_in_cs/,2020-03-10 12:34:53," *So this whole rant is triggered by a guy I saw asking why all the good cybersecurity technicians that the government wants are junkies, and I needed somewhere to post this. This is not to say all the people who do CS as a pastime are junkies (obviously), but it's just what triggered this particular post. I really want to educate younger folks who may be considering the field and want to know their options:* With my experience in Comp Sci, I've realized the reason that the bureau can't find people with decent cybersecurity skills is that all the straitlaced ones who go the degree route are in general not as good. Most of my friends smoke weed, I'm not gonna lie. I've never touched it myself since addiction runs in my family and I don't wanna risk putting my family through what I've gone through. But at the end of the day, these people who I know are also the most skilled people I know. This is most likely because Comp Sci degrees are advertised as teaching you all you need to know about the field, which is sooo wrong. Most comp sci majors graduate knowing like 2 languages, maybe a bit more if they're lucky and get in a tech college like MIT, with zero experience in the practical use of them. They may learn more than just Java and a C, but from what I've heard just the basics of them. Even if you argue that you can transfer skills from one language to another (which I agree with), someone with heavy practical use in a few languages/areas as a long-term hobby is more likely to beat out someone with a basic CS degree, in my opinion. The one thing that a degree is good for is connections, which honestly won't get you far for very long in the tech field if there are many people who can outperform you. At the end of the day, people who start young and devote time to coding, CTFs, ARGs, and such as a pastime are going to be much more skilled to practically defend/attack technology. Unfortunately, in my experience with people that start cybersecurity in their free time, these tend to be people with authority issues. They also have a tendency to question almost everything, which is a common trait with these, and so some of the good ones end up turning to drugs. Besides this, the amount that government agencies pay their technicians is absolutely appalling. I know a lot of people are hypnotized by the ""secret agent"" glamor, but I could never imagine working for an agency paying that low rather than a private company for significantly more + travel. Don't get me wrong, a comp sci degree can help someone out. If you, for example, start out as a hobby and then continue that education in college, you will be an actual *god*. Still though, out of my friend group and myself, I've never gotten a degree in Comp Sci. But all of my jobs have been programming/tech-related. When I was very young I got my start from making video games (cliche I know), moved onto cybersecurity and got very familiar with Linux, then got a job at a small startup in my hometown, and I have remained in the field since graduating hs. A friend of mine actually got employed as an *officer in the army* without a degree cause he solved some sort of cybersecurity puzzle (I'm sure you can read up on it somewhere, look up Army Cyber Command Puzzle or something of the like, there were a few different ones, most commercial). Another dude I knew ended up getting a software engineer job at E-Bay with a Political Science degree. My brother (who introduced me to the tech field) and other friends all managed to do pretty decently in the tech community as well without any degrees just freelancing and finding other jobs. Anyways, sorry for this long-ass rant, had to get it off my chest since I think it's incredibly fucked that college advertises to highschool students as if they need to spend thousands of dollars to get a programming job when that couldn't be farther from the truth. Don't get me wrong, if you can afford it and it won't put you into 10+ years of debt, go for the degree. I'm not saying it'll hurt you. As I said, those who are already skilled programmers and advance their education with a degree are practically unstoppable in my experiences. But if you can't afford it, or if you feel college isn't right for you. Don't sweat it. Just bust your ass, find a passion for something in the tech field, and keep working on it and looking for jobs. Quick tip: You can still try applying for jobs even if they have a degree requirement in their application post! This means get working on your portfolio since if you don't have a degree this and the weight of your name/previous workplaces are the only things that an employer can use to validate you. The worst thing they can do is turn you down, but if they see your portfolio is very impressive, you may have a decent shot even at these workplaces."
36,cybersecurity,computerscience,Cybersecurity vs Quantum Computing,1,ft7gm4,https://www.reddit.com/r/computerscience/comments/ft7gm4/cybersecurity_vs_quantum_computing/,2020-04-02 07:03:36,"I will br graduating this summer and have done my B. E. in Computer Engineering. I want to go for higher studies but am confused between the two fields - Cyber security and Quantum Computing. I have tried almost all the fields related to Computer Engineering but am intrigued by these two only. I read that for Quantum Computing you need to be a PhD and I am not sure about doing a PhD. So which field would be better?? (Based on future scope, job prospects, feel free to add anything else)"
37,cybersecurity,computerscience,Bachelors cyber security,1,f3h0j4,https://www.reddit.com/r/computerscience/comments/f3h0j4/bachelors_cyber_security/,2020-02-14 08:14:55,"Hey guys just had a quick question. I'm doing my bachelor's in cybersecurity. I've taken classes that prep me for comptia A+, Security + etc and was wondering if I'm pursuing my bachelor's is it worth it to be certified in those courses or should I just write on my resume that I took these classes and they've gave me knowledge is security +, A+ etc. I'm asking because my friend told me that these certifications don't matter because we're pursuing a bachelor's and were taking classes related to the certifications and the bachelor's holds more value than them and it's not worth it. He says that a teacher told him that it's not really worth it. I'd appreciate some advice thank you."
38,cybersecurity,computerscience,Interesting Cybersecurity topics to research:,1,f3kuae,https://www.reddit.com/r/computerscience/comments/f3kuae/interesting_cybersecurity_topics_to_research/,2020-02-14 12:46:53,"Heyo, Im a high school senior who is going into Cybersecurity to get a bachelor degree (which I consider to be a subfield if compsci). Im interested in doing some in depth research about the field while I study for my Comptia exams. Is there something other than cryptography that I could put some research into? Cryptography is cool, but that and encryption is all I hear about when it comes to cyber). I feel like Im overlooking something in cybersecurity that would be cool...Thanks!"
39,cybersecurity,computerscience,Masters in Cybersecurity Engineering?,1,f4jl13,https://www.reddit.com/r/computerscience/comments/f4jl13/masters_in_cybersecurity_engineering/,2020-02-16 12:49:48,"[Cybersecurity Engineering UCSD](URL Does anyone know if these programs are legitimately engineering programs? I'm pretty interested in continuing my education after my Bachelor's, but I really only care about being able to legally call myself an engineer as part of my job title and in resumes to be honest. Lol. Do these types of degrees qualify you for the exams you need to do so?"
40,cybersecurity,computerscience,"i would like to pursue computer science, but i have a vague interest in cybersecurity",1,elf16l,https://www.reddit.com/r/computerscience/comments/elf16l/i_would_like_to_pursue_computer_science_but_i/,2020-01-08 04:59:09,"im not entirely sure which route id like to go with computer science. if i major in computer science, will i still be able to find a job in cybersecurity if i decide to pursue that route? or must i major in cybersecurity to be able to have a job in cybersecurity in the future? (please let me know if this isnt the right subreddit)"
41,cybersecurity,computerscience,"Which do you think will make for a better career in 10 years time, Cybersecurity or Artificial Intelligence? Why?",1,eliutt,https://www.reddit.com/r/computerscience/comments/eliutt/which_do_you_think_will_make_for_a_better_career/,2020-01-08 09:22:10,"Mostly wondering about employability, salaries and work culture."
42,cybersecurity,computerscience,How many internships do you need for college?,1,eo0axf,https://www.reddit.com/r/computerscience/comments/eo0axf/how_many_internships_do_you_need_for_college/,2020-01-13 17:18:17,"Hello, &amp;#x200B; I live in GA, and I'm going to college for CS, but before I go to college I was wondering how many internships would you say is enough in college? I know quality over quantity - but I'm not going to GA Tech. I know having internships helps with getting a job. I've been looking at websites like [indeed.com](URL for web dev paid Internships during summer. At my community college, they offer IT Career &amp; Internship Days where we can speak with IT companies recruiting for internships ( I don't know what companies. ), part-time and full-time opportunities in cybersecurity, gaming, networking, and programming. What should my goal be for internships?"
43,cybersecurity,computerscience,Looking for online classes to fortify math skills for comp sci degree,1,etbkjf,https://www.reddit.com/r/computerscience/comments/etbkjf/looking_for_online_classes_to_fortify_math_skills/,2020-01-25 02:06:05,"Hey everyone, I am interested in studying computer science to start a real career, possibly eventually in cybersecurity but my bachelors degree was in History. I have not taken math courses in many years, and it was never my strongest subject, but I think that was more a priorities issue. What areas of mathematics should I work on to build a foundation that will help me succeed in a comp sci degree as well as help me with my career in general. Do you know of any good classes, possibly on Udemy or Coursera that will be a good starting point? Thanks everyone!"
44,cybersecurity,computerscience,Second thoughts on Data Science Degree,1,etd5h2,https://www.reddit.com/r/computerscience/comments/etd5h2/second_thoughts_on_data_science_degree/,2020-01-25 04:03:06,"School is (National College of Ireland) I didn't move here for the degree, i live here. The course i was accepted and have completed Semester 1 with Grades 70%+ is no other than controversial Data Science degrees, i have been trying to transfer into the college's other degree program which is BSc in Computing (Both are Bachelor of Science) and have not been able to transfer as i needed 17 more points (CAO Leaving Certificate points) I would also have had to repeat the modules of Computing semester 1 if i had transffered. Now it seems i am stuck with 4 years of doing this degree. Although it's a bit math intensive i believe i will be able to scrape a pass in both Statistics class and Linear Algebra class. Everything else im ok with. The other thing is this is a new course that was being offered for 2019 and there's about 7-10 students, and i know 1 who will drop out (We already had 12 students which 2 dropped for financial reasons). I am wondering if it's too late to do anything about rather be doing the Computing course with my friends than this 7 class data science. I am 18 years and by 22 my current degree will be finsihed. I would much rather not have to start all over again for another degree. Any advice if i should stay what would my prospects be? So far i can think of 3 other jobs that aren't related to Data Science so much that i could still get into which are SQL Administrator, Python Developer and Security Analyst? My end goal is to build my career in cybersecurity."
45,cybersecurity,computerscience,"Want to do masters but not sure, which field to choose.. Please help.",1,e7suu1,https://www.reddit.com/r/computerscience/comments/e7suu1/want_to_do_masters_but_not_sure_which_field_to/,2019-12-08 22:47:26,I have done bachelors in computer science and now I want to do masters. Which field I should choose?? Should I do a specialised masters like in cybersecurity or data science or do a generic ms in computer science or do a mis. I am planning of doing my masters from the uk I don't really enjoy coding but I can do it if I have to.. I have been doing so much research about which specialization to choose but I am still unable to fix one.. Please help me out.. Also does cybersecurity pays well??.. If not then which field does.. I have heard that data science is the sexiest job of the century as quoted by harvard.. Is it true??.. I am sure that I don't want to go into software development... Please share your views.. Thanks.
46,cybersecurity,computerscience,Theory of Computation - I need online resources,1,e8be8c,https://www.reddit.com/r/computerscience/comments/e8be8c/theory_of_computation_i_need_online_resources/,2019-12-10 02:30:38,"As the title explains I'm in search of online resources that people found useful, I'm currently studying cybersecurity at uni and the lecture material for this module and especially the teaching standards i feel have not been very good. I'm sure someone has a decent online resource that can explain some of the topics within computation theory"
