,topic,subreddit,title,score,id,url,created,body
47,cybersecurity,computerscience,Choosing direction,1,e8kvx9,https://www.reddit.com/r/computerscience/comments/e8kvx9/choosing_direction/,2019-12-10 14:18:47,"Hey guys! I'm undergraduated L2 computer science student. I'm still stuck in choosing in which direction should i go in the future. I know that coding, engineering, developer stuffs is not my thing. But when it comes to the theory, i love it! And i have interest to plenty of fields like cryptography, cybersecurity, graphics, ai, machine learning, deeplearning, computer animation, visualization. But i can't decide which one should i return to in order to be busy with a high passion even along with my crazy university. And if i choose one, i'll definitaly take the several other ones in following years of my career or futher. The proble is choosing that 'one'. Before, I would like to do something intersection between programming and art itself. Then i found myself in computer visualization and communication and i felt like its the best one. Then, figure out that the thing i want to do stands to the AI too. After all the confusion has started lol. If i going to learn AI, then i would i have opportunities to implement it into the different areas despite the art itself. However, cryptography also attact my interest, thus, my relevance to the Cyber Security born in here. Also i'm overthinking that am i capable enough to deal with them as some of their hardness is obvious, tho!?. But, nevertheless, i think, if i will take any of them, their hardness won't be an obstacle while learning if i want to keep on it as hell. Don't know, i'm concerning about my future a lot. And also have an anxienty to the keeping pace with modern tech that the progress of it is speeding up every single day. So, can you help me, advice me which path should i take right now before it's late. I really need that or i'm gonna get crazy while thinking about it."
48,cybersecurity,computerscience,Topic Ideas for a high school Extended Essay,1,ec6txd,https://www.reddit.com/r/computerscience/comments/ec6txd/topic_ideas_for_a_high_school_extended_essay/,2019-12-18 14:13:55,"Hello, I am an IB student in high school and have recently started taking Computer Science. One of the tasks for the IB program is an Extended Essay on a topic that we love. With my amateur level of understanding with Computer Science, I have found that I like Cybersecurity, however I dont know where to even start researching on topics related to Cybersecurity. One of the requirements for the Computer Science Extended Essay is that I have an experiment and report my findings, so I need to have more than just online research. Any help would be greatly appreciated even if it is very small. Thank you."
49,cybersecurity,computerscience,CS degree specialization?,1,ee03oq,https://www.reddit.com/r/computerscience/comments/ee03oq/cs_degree_specialization/,2019-12-22 14:55:12,"Hi, I'm a second year CS student. I'm at the point where I've done the pre reqs and can pick my degree specialization. The full list is: * [Cybersecurity](URL * [Data Science](URL * [Artificial Intelligence](URL * [Robot Intelligence](URL * [Bioinformatics](URL * [Business and Entrepreneurship](URL * [Human-Computer Interaction](URL * [Simulation and Game Programming](URL * [Web and Mobile Application Development](URL * [Build Your Own](URL * [Computer Systems](URL But I'm mostly interested in Systems, Cybersecurity, and AI. Computer Systems is a generalized ""software engineering"" degree. **Assuming I'm equally as passionate in each one, what are the job outlooks for these three different degrees?** Whenever I say I'm considering getting a CS degree with a degree track to AI, the person who I'm speaking to tells me that I'll be very employable in the future. I think this is partially true, but mostly over hyped considering that AI is just kind of a meme right now. Let me know what you think. I know that cybersecurity is highly in demand right now, but are degrees respected as much in that field? Just let me know what you think. Thanks."
50,cybersecurity,computerscience,Where can I connect with other CS people?,1,dtorhg,https://www.reddit.com/r/computerscience/comments/dtorhg/where_can_i_connect_with_other_cs_people/,2019-11-09 11:44:26,"Hi everyone, I have been working on solo CS projects for the past 5 years. I did machine learning, web dev, mobile dev, and game dev. I think I know a good amount of CS, but I want to learn to work with other people. Unfortunately, I'm having a difficult time finding someone as enthusiastic as me about CS. I tried Meetup, but I only find cybersecurity seminars. I can't get any internships either. Can someone tell me where can I meet like-minded CS enthusiasts or maybe point me to an internship. Thank You"
51,cybersecurity,computerscience,Should I take these Math Courses as electives as a Computer Science Minor?,1,dv367k,https://www.reddit.com/r/computerscience/comments/dv367k/should_i_take_these_math_courses_as_electives_as/,2019-11-12 13:07:57,"Hey guys. Im an IT Major with a focus in Cybersecurity and Minoring in Computer Science. The Computer Science Minor at my School doesnt require any Math Courses or a Math Pre Requisite, so I was wondering if I should take some additional Math Courses as Electives. The Math Courses I am considering taking as Electives are:  Introduction to Discrete Mathematics  Introduction to Probability and Statistics  Calculus I Which of these courses do you think I should take? Or should I take all of them? The Math Courses required for my IT Major are just Finite Math and Elementary Statistics, but if I took those above I wouldnt have to take those. And Id much rather take Math courses which actually help with what Im doing"
52,cybersecurity,computerscience,What certification should I get?,0,df855j,https://www.reddit.com/r/computerscience/comments/df855j/what_certification_should_i_get/,2019-10-09 10:14:38,"Im currently an undergrad student studying IST, Cybersecurity, and Data science. Last summer I worked as a Cybersecurity intern and really want to go that direction in the future. My question is what certification do you recommend getting and how difficult is it? Im looking at the CISSP, CompTIA Security +, or the CCNA Cyber Ops"
53,cybersecurity,computerscience,Question about MSCS,1,dfjoh4,https://www.reddit.com/r/computerscience/comments/dfjoh4/question_about_mscs/,2019-10-10 03:41:52,"Hi. I have 18+ in IT (hw, support, admin, network side) and MA. I'm looking for an institution to complete an online MSCS that meets the following requirements: a) Will easily admit someone who doesn't have STEM Bachelor's (I completed MOOCs like 6.00.1x and CS50 but I don't develop or use programming languages. Current role in cybersecurity-information assurance but for my own reason I prefer to have a MSCS). b) No GRE-GMAT requirement c) If possible, CAE (Center of Academic Excellence designated) d) Tuition cost less than $400 per credit hour (I'm aware of GTECH, very difficult to get in, I'm looking for other options). Which ones do you recommend? Thank you."
54,cybersecurity,computerscience,"As a to be CS major, is it a good idea to start a carreer in Big Data?",2,dghnrk,https://www.reddit.com/r/computerscience/comments/dghnrk/as_a_to_be_cs_major_is_it_a_good_idea_to_start_a/,2019-10-12 03:33:34,"So basically I'm a student with no professional experience at all, and as I am writing my masters thesis (related to cybersecurity), I find myself with a lot of time in my hands. So I decided to start looking for oportunities to start my professional carreer. Although I ideally prefer cybersecurity to do as a full time thing, or something Back-end related, recently I was given an oportunity to start in a company in their Big Data sector. Since I've got little to none experience in Big Data, I'm a little scared about that, because I don't know if I'm gonna like it or not, if I'm gonna be any good or not, and my major was focused mainly in Cybersecurity. They are interested because they need juniors in that particular sector, and they offer some education + training in Big Data, so the lack of experience wouldnt be any that bad. My question here is: since I'm still finishing my university course, would it be a good idea to start gaining experience in a area which i'm not particullarly experienced at (and even my thesis is not even closelly related to it), just as a way to start my professional carreer?"
55,cybersecurity,computerscience,"I have an Associate in IT and will be getting my bachelor's in computer systems management (basically IT+business) soon. I want to go to grad school. What's theoretically better for a masters degree, another computer field (IE cybersecurity) or something business related?",0,djuoat,https://www.reddit.com/r/computerscience/comments/djuoat/i_have_an_associate_in_it_and_will_be_getting_my/,2019-10-19 09:08:46,"I'm just looking to do a little research, gather information and opinions from those in the field, etc. I don't know much about cybersecurity/have exposure other than having taken Intro to Cybersecurity (was required for my major) and getting the CompTIA Security+ certificate for passing their exam."
56,cybersecurity,computerscience,Feeling a bit lost,2,dkb3z4,https://www.reddit.com/r/computerscience/comments/dkb3z4/feeling_a_bit_lost/,2019-10-20 09:55:50,"I am not really stressed out since I know in the end ill be fine. But I am greatly concerned about my options about the future with my computer science degree and much more about my intellectual capacity. I am currently a senior at my university pursuing a bachelors degree in computer science, but I am taking junior-level classes (graduating 2 years late). I feel like computer science isn't for me. I like and enjoy learning the material, but the problem for me is that every single little thing is a huge learning curve, I am constantly always doing homework/studying and always attending all of my professors' office hours since I can never for the life of me do any assignment on my own, and this greatly concerns me. What I more precisely mean is that I can never solve things on my own, and I don't really like the idea of building apps and websites for people's validation. (Save me the discussion about major decision, it's already too late for me to switch majors, the school wont let me.) I chose computer science because I was very introverted my freshman year and had no problem with never interacting with people. Well that all changed now, and I love associating myself with people in general and I feel that in computer science all I ever do is sit behind a computer all day and struggle for hours. (I don't mind it too much because I actually do enjoy the material and concepts, I dont hate it). I have zero outside experience since I never have time for myself due to my assignments and I refuse to deprive myself of sleep and putting my health at risk (did that for 3 years and was constantly depressed, now I have a strict routine for working out, eating healthy, and sleeping). The only good thing I've got going for me is a part time security analyst job that I just started working at. I am worried if I'll ever be able to get a decent job with little to no outside experience and a terrible GPA of 2.5. &amp;#x200B; I have tried joining clubs (currently part of cybersecurity which seems to be my major interest at the moment) and doing hackathons (when I realized I dont like software development), I do have a huge network seems I would like to consider myself pretty charismatic. &amp;#x200B; I've applied to at least 80+ internships from software dev and cybersecurity and only three interviews with no luck. If I have terrible problem solving skills but am willing to put in the work, will my work be rewarded? I feel like no matter how much work I put in even more than my peers, my limitation to problem solving is always gonna be the death of me and no company will want to hire me."
57,cybersecurity,computerscience,"In VirtualBox, can someone explain the difference between a ""NAT Network"" and a ""Host-only"" network each comprising of let's say 3 VMs?",0,d63x4y,https://www.reddit.com/r/computerscience/comments/d63x4y/in_virtualbox_can_someone_explain_the_difference/,2019-09-19 06:57:14,Hi. I'm taking a cybersecurity course and I watched a video about this and I'm trying to understand how they're structurally or even practically different considering all VMs can have an internet connection and can also communicate with each other?
58,cybersecurity,computerscience,What's the difference between an anti-virus and a next-gen layer 7 host-based firewall?,3,d6hu1k,https://www.reddit.com/r/computerscience/comments/d6hu1k/whats_the_difference_between_an_antivirus_and_a/,2019-09-20 04:05:10,"I'm taking a cybersecurity course and I'm trying to understand: How do they work differently? More specifically, how do they detect and identify malware?"
59,cybersecurity,computerscience,Is a masters IT-Cybersecurity worth it?,0,d7uh92,https://www.reddit.com/r/computerscience/comments/d7uh92/is_a_masters_itcybersecurity_worth_it/,2019-09-23 04:34:16,"- I am considering a career change. My local uni offer an online masters of IT with Cybersecurity concentration. - Is IT still a viable career? From what I remember in undergrad, it was the little brother to a pure computer science degree - Is cybersecurity in IT a smart choice? I feel like the usual route is CompSci with a concentration in cybersecurity - What is pay like? I cant find anything concrete through BLS outlook"
60,cybersecurity,computerscience,"Looking for people who got a master in Computer Sciences : What kind of job do you do? Is it ""easy""? How much do you earn?",47,de4r4s,https://www.reddit.com/r/computerscience/comments/de4r4s/looking_for_people_who_got_a_master_in_computer/,2019-10-07 02:33:20,"I'm currently in my 3rd year of bachelor in computer science at the ULB in Brussels. Once I finish that year i'll have to chose between two Masters : Cybersecurity or Computer Sciences. So I was wondering what kind of job that realistically leads to? I'd love to be a high school math teacher where I could earn 2900 gross per month but I know IT jobs are paid well beyond that. My goal would be able to buy myself a really nice house somewhere not so far from the capital city (I live in Belgium, I speak French English and Dutch, French being my mothertongue) and I know that with a teacher's salary I won't be able to get a loan for more than a 200.000 house alone. I kinda rather do a master in Computer Science (instead of the high demand high paying Cybersecurity) because i've never been really interested in being a ""Hackerman"" and I know that doing that you can end up being an IT consultant but I have no idea what does an IT consultant do at his work. I also heard you can start your own company but I don't know how that would work since I have no idea what I could be ""selling"" TL;DR : 3rd year of bachelor in CS, planning on doing a master in CS, looking for people with the same academic path as me : what kind of job do you get, is it paying well (i'd like numbers tbh i'm not really into that salary taboo) and if it requires lots of post-study knowledge (From what I study I know that I know almost nothing at CS, even after 2 full years)"
61,cybersecurity,computerscience,Some questions from a highschool junior:,1,craud2,https://www.reddit.com/r/computerscience/comments/craud2/some_questions_from_a_highschool_junior/,2019-08-17 05:00:10,"I posted this in r/security and r/cybersecurity, but Ive gotten no responses there so I figured it wouldnt hurt to ask here. (Also this should fit with Rule 1 but if not, sorry for breaking the rules) TL:DR is **bolded** Sorry in advance for the long post. As the title says, I am a junior in highschool and will start looking for colleges. I was wondering if you could answer some of my questions. I am in the New England area, and a honor roll student and on varsity track, which is relevant information later. A couple years ago, I was into the idea of cybersecurity a lot, and so I learned Java. For some reason, I lost interest until recently. All that being said, **what is something you wished you knew as a junior about cybersecurity?** Do you know of great BS or Masters courses in cybersecurity in my area? Can I do anything to prepare? Is there something I can do to make myself stand out as a computer science student other than grades or sports? Thank you so much for the help and have a great day!"
62,cybersecurity,computerscience,Would I be better off majoring in computer science or computer engineering?,23,csxheo,https://www.reddit.com/r/computerscience/comments/csxheo/would_i_be_better_off_majoring_in_computer/,2019-08-20 21:56:06,"Over the past couple of months, Ive developed an interest in cybersecurity. Im considering doing it as a job one day. I have little experience with programming, as I have very recently gotten into it. However, I dont know whether or not I should major in computer science or computer engineering to better prepare me for getting a job in cybersecurity later on. So, which option may be better for me to take?"
63,cybersecurity,computerscience,This Tuesday I begin my journey...,12,cwgzp7,https://www.reddit.com/r/computerscience/comments/cwgzp7/this_tuesday_i_begin_my_journey/,2019-08-28 16:35:39,"A journey I have been looking forward to since I can remember. On Tuesday I begin my classes at Boston University, pursuing my degree in computer science, and hopefully, specializing in cybersecurity. Why does this matter? It absolutely doesnt, most people could give a f-, you know what I mean. The reason I am writing this is just to thank all you incredible, helpful, and knowledgeable people for providing every bit of information I could possibly need. Albeit not being the most active user on this sub, every day I am able to scroll through and learn something completely new, further exciting me for the future to come. So thats what this is, a thank you... oh, and expect to see many many questions on my long road ahead. Thanks again r/computerscience !"
64,cybersecurity,computerscience,Computer Science concerns the science behind computing?,3,cyicbp,https://www.reddit.com/r/computerscience/comments/cyicbp/computer_science_concerns_the_science_behind/,2019-09-02 11:16:22,"Like every science field, Computer Science is very broad as it attempts to answer the scientific inquiries about computation and technological capabilities. What my question entails, is CS mainly about optimizing algorithmic properties to give us the upper hand in more efficient processing units? Or is it anything within the technology field like engineering and IT? I get that when people try to emphasize the word ""science"" in ""computer science"", they provoke other means technological related fields like cybersecurity, networks, information systems, game development, etc. as non-computer science related. So is computer science just another science that deals with computational power for better engineered products, AI, and algorithm efficiency?"
65,cybersecurity,computerscience,I wish to become a master at manipulating operating systems and computer security. Where do I start?,1,cztqqi,https://www.reddit.com/r/computerscience/comments/cztqqi/i_wish_to_become_a_master_at_manipulating/,2019-09-05 11:00:39,Ive always had a hunger to bend software to my will and master cybersecurity. Would I start learning a specific set of programming languages? Reading books? Screwing around with my laptop? All advice and direction is appreciated!
66,cybersecurity,computerscience,"Do I have to change my major, if I want to work on artificial intelligence?",62,cbqjjx,https://www.reddit.com/r/computerscience/comments/cbqjjx/do_i_have_to_change_my_major_if_i_want_to_work_on/,2019-07-11 13:14:01,"I'm currently a student studying Computer Information Systems in college. I'm entering my 3rd year and am on track to graduate on time. When I started college, I wanted to get into cybersecurity, but I've always had AI in the back of my head. I think I want to work with Artificial Intelligence in my future now. I feel a certain way when discussing or learning more about artificial intelligence, which I do not feel when discussing cybersecurity. I was planning on finishing my degree in Computer Information Systems, and consider going for my Master's in Computer Science or if there are any artificial intelligence programs. I really want to work on researching AGI. Any advice or suggestions? Is the current path I'm on okay for my future goals?"
67,cybersecurity,computerscience,CS Question in Escape Room,61,celo73,https://www.reddit.com/r/computerscience/comments/celo73/cs_question_in_escape_room/,2019-07-18 11:05:19,"I'm creating a surprise escape room for my husband's birthday. He just completed a degree in computer science, so that's kind of the theme, and I need help making sure one of the clues makes sense without being too obvious. One of the questions has him call his grandmother. Right now in my notes, here's what I have her saying: Oh, husbandsname, Im so glad to hear from you. Im working on some end-to-end encryption, but Ive got it all backwards. When Im sending, do I encrypt the message using the public ones or the private ones? Is this obvious or too difficult or completely wackadoo because I'm not understanding it? I will put the answer in comments. I can't change the answer itself because it opens a word lock, and word locks are pretty limited with what they can spell (also it has to do with the next clue) so I'm looking for help in framing the question in a way that's challenging but not obvious for someone who just got their degree. He also has an interest in cybersecurity. Thanks!"
68,cybersecurity,computerscience,How do people become experts in cybersecurity?,54,cm42kl,https://www.reddit.com/r/computerscience/comments/cm42kl/how_do_people_become_experts_in_cybersecurity/,2019-08-05 10:48:44,"The kids in my high school are really smart, and are doing stuff like accessing my school accounts even though I change my password all the time. The kids being the very selfless and open people they are never tell reveal how they actually get that kind of knowledge. Are kids like that gifted, or am I just stupid? If it is the former, how do I learn to do the things that they can do?"
69,cybersecurity,computerscience,"Studying CS at uni, undecided to specialize in AI or Cybersecurity, which has better job prospective?",3,cma0ri,https://www.reddit.com/r/computerscience/comments/cma0ri/studying_cs_at_uni_undecided_to_specialize_in_ai/,2019-08-05 21:54:01,"Im currently a year 2 CS student, in my university we can specialize in one stream. I'm undecided between AI or cybersecurity. In general, the math and statistics for AI don't really scare me but i find both of them equally interesting, though i'm not sure which is better for future work possibilities (although im going to pursue further studies regardless). Also, could someone outline the general nature of these subjects? For example what type of topics i'd be expecting and the general premise of these specializations."
70,cybersecurity,computerscience,Undergrad CS student looking for some different bits of advice about career routes.,1,c3cfna,https://www.reddit.com/r/computerscience/comments/c3cfna/undergrad_cs_student_looking_for_some_different/,2019-06-22 02:02:00,"I completed two years at university before transferring out. I was just taking introductory courses (C++, Java). In high school, the programming classes I took geared more towards engineering. Im currently just teaching myself how to code more at the moment and would just like some outside input on some different approaches to take. I had to start over due to majority of my credits not transferring. Im interested in Cybersecurity. What would be some better companies to look at, for entry level?"
71,cybersecurity,computerscience,Cybersecurity vs Data Science. Which are the pros and cons of cybersecurity and data science? Which one should I prefer?,2,bqh3m2,https://www.reddit.com/r/computerscience/comments/bqh3m2/cybersecurity_vs_data_science_which_are_the_pros/,2019-05-19 23:44:50,"I am currently in my bachelor program. I am thinking of specializing in either data science or cybersecurity. I have current experience with backend and ios development. I have done some amount of cybersecurity as well as data science. I do not plan on getting higher education (masters program or phd). What can be a better option for me? I have heard most of cybersecurity work is writing reports, is it true? It can be a dealbreaker for me but apart from that I like cybersecurity. One of my main dilemma is in cybersec there is report and paperwork and in data science most of it is populated by people with masters and higher degrees. ps: Please don't give me that ""whatever you like"" bs. I wouldn't have asked if I would have been considering it."
