,topic,subreddit,title,score,id,url,created,body
0,vulnerability,computerscience,Intentionally introducing vulnerabilities in open-source code,0,djsrc4,https://www.reddit.com/r/computerscience/comments/djsrc4/intentionally_introducing_vulnerabilities_in/,2019-10-19 06:46:21,"Suppose a genius thinks of a brilliant way to code a vulnerability or backdoor and pushes it into some open-source code, and that this backdoor code is very non-obvious and cleverly disguised such that no reviewer suspects it. Is this possible, likely, and has it been done?"
1,vulnerability,computerscience,Is there such thing as a safe way to do speculative execution?,2,btgbbk,https://www.reddit.com/r/computerscience/comments/btgbbk/is_there_such_thing_as_a_safe_way_to_do/,2019-05-27 12:02:38,"I wasn't sure whether to put this here or in in r/ElectricalEngineering since its sort-of hardware based but also involves software. &amp;#x200B; i've been doing a little research into the latest intel speculative execution vulnerabilities (Collectively known as MDS i think) and read [this](URL &gt;As it is, the current generation of Intel CPUs, with their older speculative execution process approach, improves data processing speeds and performance, but at the price of built-in security vulnerabilities. &amp;#x200B; This got me thinking, is there a way to (theoretically maybe) implement speculative execution without the vulnerabilities, or is it always going to be a hard trade off between performance and vulnerability?"
2,vulnerability,computerscience,Is there away to retrieve results (including found vulnerabilities) of a specific scan from one API call?,2,bmhtje,https://www.reddit.com/r/computerscience/comments/bmhtje/is_there_away_to_retrieve_results_including_found/,2019-05-09 19:57:51,"Is there away to retrieve results (including found vulnerabilities) of a specific scan from one API call? from InsightVm documentation GET scan API call returns only scan info with statistic of found vulnerability. without information of found vulnerabilities. from what I understood I have to do another call GET vulnerability API call to retrieve found vulnerability by passing the identifier of the vulnerability which is not return by scan results API call. From my experience with Nessus, was possible to retrieve scan results with found vulnerabilities of a specific scan or for all scans from one API call."
3,vulnerability,computerscience,Cyber Security Professor Wants Us to do Online Journals,1,apkc0r,https://www.reddit.com/r/computerscience/comments/apkc0r/cyber_security_professor_wants_us_to_do_online/,2019-02-12 07:05:09,"Journal 1: Is Security Perfect? (Tl; Dr at the bottom) Obviously, cyber security involves knowing about security. The only problem with this is that the concept of security is the amount of theatrics. People with a security mindset see the world differently. They cant walk into a store without noticing how they might shoplift (Schneier, The Security Mindset). They have to think like an attacker, or an adversary. Using this mindset, security engineers can build a support system, which basically means that if an attacker takes down one system, there would be other systems to go through. Sounds simple right? Wrong. The security theater provides stories for the people to feed off of. Take terrorism for example. Terrorist attacks are few and far in between, and yet, people fear those over actual risks like road accidents (Parker-Pope). The culprit for this is your brain. As Parker-Pope stated in Wrong About Risk? Blame Your Brain, fear is a great way to remember something, so people are more inclined to remember plane crashes and terrorists over car crashes, resulting in roughly 1000 additional vehicular deaths because people believed it would be safer to drive to their long distance locations rather than fly (Parker-Pope). It also doesnt help that people view security like some sort of movie plot: we may know an attack is coming, but unless the attacker specifically says how, when, and where they are attacking, we cant prepare for it as people seem to think we can by evacuating people or sending in law enforcement. Bruce Schneier said movie plot security only works if we guess right, but since we cannot guess accurately, the best thing we can do is prepare a defense against all threats, no matter how important or unimportant the people perceive them to be (Schneier, Terrorists Dont Do Movie Plots). That brings us around to the third and final problem. There is an imbalance between attackers and defenders. The defender has to defend against all attacks while the attacker just needs to exploit one vulnerability to achieve their goal, resulting in an asymmetric relationship that favors the attacker. In conclusion, there is no such thing as a perfect security. People perceive larger, flashier threats as more important than actual threats, leaving the us open to all sorts of attacks. As Schneier says in regard to the theatrics in security, stories are what we fear (Schneier,Beyond Security Theater). We will not be able to defend ourselves properly if the people continue to hold onto this mindset. SOURCES: URL URL URL URL URL URL I rushed this as I was supposed to read 10 articles and didn't start till yesterday so this isn't my best work. Tl;Dr : Perfect security doesn't exist thanks to the dramatic imagination of the people. "
4,vulnerability,computerscience,Air-gap Machine Vulnerability,1,3ge2y5,http://www.reddit.com/r/computerscience/comments/3ge2y5/airgap_machine_vulnerability/,2015-08-10 07:36:56,How can malicious code spread to a machine even if said machine is not networked? 
5,cybersecurity,computerscience,Research Ideas?,1,i3wgbd,https://www.reddit.com/r/computerscience/comments/i3wgbd/research_ideas/,2020-08-05 11:46:40,"Hey guys! I wanted to know some places where I, as an undergraduate student can research. My main focus of interest in Cybersecurity. What are the few things I can research or write a paper on? For example, malware analysis of specific malware, etc. Thank you!"
6,cybersecurity,computerscience,Minecraft and hacking/exploits,1,i588zl,https://www.reddit.com/r/computerscience/comments/i588zl/minecraft_and_hackingexploits/,2020-08-07 15:40:51,So I recently got interested in servers and multiplayer in Minecraft (Java edition) I was wondering if there is any information on Java Realms and related exploits or LAN server exploits? I am looking into the API and all that but I'm not sure that will give me much information on getting into the game and gaining 'admin' access on a server or realm I don't own it will be fun to play with the Java of Minecraft but really I want to hack it (if that's even possible) so I can start to annoy my friends and also learn/teach myself about security I know this is a bit odd but I thought it would be a fun quarantine project to work on :) (Also posting in r/cybersecurity in case this is deamed unworthy here)
7,cybersecurity,computerscience,Discussion on alternative ways of teaching Computer Science,1,i8fnwv,https://www.reddit.com/r/computerscience/comments/i8fnwv/discussion_on_alternative_ways_of_teaching/,2020-08-13 01:22:48,"Hey all! I recently posted that I would be teaching Python basics for Cybersecurity on a stream and one of the comments was that what I was doing is ""not CS, it's coding"". Of course I agree that CS is not simply coding, but rather the study of computers, how they are built, programmed and how we interact with them. However coding is still a subsection of CS just like math is or physics is. They are all tools used to accomplish goals within CS. This response has caused a broader discussion where that same user suggested that lectures and assignments are not CS. I again disagreed with him saying that although, granted, Computer Science is not only about lectures and assignments, they very often, and traditionally serve as stepping stones to learn more about the field. Of course some people refrain from traditional education methods and are very successful without them, but it is not right to discredit the current and traditional way of teaching CS. So this is where this post originated from. Now I would like to start a discussion. 1. If you teach or got into CS through a non-traditional (lecture/assignment) format, I'd love to hear more about it and I bet the rest of this subreddit would too. 2. If you have any ideas on how to deviate from a traditional way of teaching/learning CS, post them below! 3. This is a longer one: Most classes enforce a plagiarism policy (which all courses should), however many of them consider working with someone in that class plagiarism, even if you were the author and the code was original. Computer Science and its subset of programming are both VERY collaborative areas, so discouraging students from working together and creating a collaborative network seems wrong to me. Granted there will always be people who will just copy, not learn a single thing and slack off if collaboration is allowed. So my question is: how to we encourage collaboration in lectures while also keeping people accountable for learning? Do you have any other alternative ways of structuring classes to make learning more collaborative?"
8,cybersecurity,computerscience,Cybersecurity Professional,1,i9f2uo,https://www.reddit.com/r/computerscience/comments/i9f2uo/cybersecurity_professional/,2020-08-14 14:05:09,"I want to dedicate my life to this profession, what advice can you give me to start from scratch and be an excellent professional in this field. Excuse my English, I used a translator."
9,cybersecurity,computerscience,What are Numerical Methods used for?,1,idmlxc,https://www.reddit.com/r/computerscience/comments/idmlxc/what_are_numerical_methods_used_for/,2020-08-21 10:39:58,"My school offers a Numerical Methods course that looks interesting, but I am confused which areas I will use the information it teaches. Do Numerical Methods come up in SWE, Cybersecurity or Big Data? The main topics seem to be based around Curve Fitting, Error Analysis, Crank-Nicolson Method and Lattice Boltzmann Equations."
10,cybersecurity,computerscience,A student who needs help,1,hn3apg,https://www.reddit.com/r/computerscience/comments/hn3apg/a_student_who_needs_help/,2020-07-08 07:16:24,"Hello, I'm looking for advice on my situation. I was recently offered a paid-for Cybersecurity associate degree from a college I wasn't expecting. At the moment I am in turmoil. I was planning on going to college to get a computer science degree. I took coding classes in high school and was planning on working in the cybersecurity field with a CS degree. I am pretty clueless about how things really work but I know there is plenty of things that can be done with just a CS degree. I just do not want to get this associate's degree and regret it. I was always interested in system architecture and firewalls but my decision is very difficult considering that I am not sure if it would be worth it. Also, I really don't know the differences between cybersecurity and CS, If someone could explain that for me."
11,cybersecurity,computerscience,Dont know what CS career I want,1,howmnn,https://www.reddit.com/r/computerscience/comments/howmnn/dont_know_what_cs_career_i_want/,2020-07-11 06:33:44,"Dont know what CS career I want I (F16) am currently a high school and i honestly dont know what cs career I want in the future! I know that I want to major in CS because it will help me go into careers such as software engineering, cybersecurity, etc, but i just dont know what exactly I want to do specifically in CS. Is this bad? Should I figure it out soon?"
12,cybersecurity,computerscience,"What are the basic of cybersecurity every developer needs to know, understand and implement in their day-to-day life?",1,i03t7z,https://www.reddit.com/r/computerscience/comments/i03t7z/what_are_the_basic_of_cybersecurity_every/,2020-07-30 02:39:34,"I will be helping to write cybersecurity materials in our company, and I was wondering what is your take on the question in the headline? I had intentions on writing about: &amp;#x200B; * strong passwords * passwords managers * the need to change passwords in regular intervals and how easy it is if one uses a password manager * backups - I plan to really stress this hard * use of MFA where it's needed and where it makes sense to use * phishing &amp;#x200B; Also, other stuff, but I wanted to hear your view on the subject? What are those basics you think people need in our line of work?"
13,cybersecurity,computerscience,"AI, CyberSecurity, and Data Structures",1,gwklii,https://www.reddit.com/r/computerscience/comments/gwklii/ai_cybersecurity_and_data_structures/,2020-06-05 02:19:54,I am a rising sophomore in college majoring in Computer Engineering. I was wondering what the following fields looked liked. How difficult are they relative to each other? Which ones have more potential in the future? And just overall comments or opinions. I would really like to know what other more experienced people think about it.
14,cybersecurity,computerscience,An In-Depth Analysis To Computer Virus: Everything You Need To Know.,0,h08fj4,https://www.reddit.com/r/computerscience/comments/h08fj4/an_indepth_analysis_to_computer_virus_everything/,2020-06-10 20:46:54,&amp;#x200B; URL Read the full article on our website for the answers to the questions covered in the post - [URL Join us on YouTube - [URL \#CyberSecurity \#ComputerVirus \#Virus \#CyberAttack \#TypesOfCyberAttacks \#ListOfCyberAttacks \#YourCyberGuru
15,cybersecurity,computerscience,is it worth getting a Masters degree in cybersecurity if I want to become an ethical hacker? (Australia),1,h8rj76,https://www.reddit.com/r/computerscience/comments/h8rj76/is_it_worth_getting_a_masters_degree_in/,2020-06-14 20:39:26,"I am currently in highschool I am finishing year 12 next year and I want to make up my mind before going into university, my interest is in computers and programming and I have an obsession with hacking, I was looking online and almost every website I visited says that I need a bachelors degree but I want to go higher and get a masters degree or even possibly a phD, so I am asking if a Masters degree would make any difference than getting a bachelors for a good paying ethical hacking career."
16,cybersecurity,computerscience,Cybersecurity club for high school students!,1,h8vwwu,https://www.reddit.com/r/computerscience/comments/h8vwwu/cybersecurity_club_for_high_school_students/,2020-06-15 01:33:06,"Hello! I'm starting an online cybersecurity club called CyberCyborg. This club is on google classroom and the code is: nnfunlo. Here is the post I made recently about the club: ""First, I want to mention the goal of this club, which is to encourage students to pursue the growing field of cybersecurity. To achieve this goal, I don't intend for this to be like a class. I am a firm believer in the idea of ownership: you get out what you put in. That said, I won't be putting any deadlines on any of the assignments. Moreover, the meetings are only for those who want wholeheartedly want to participate. I will NOT be holding anyone accountable for handing in work late or not handing in work at all. This club is for you, not me. Second, this club is COMPLETELY virtual. We will online be contacting each other via this classroom page, email, and possibly Reddit. Our meetings will consist of coursework that you can work on and discussing cybersecurity topics. I also want to complete a collaborative project (that will also be virtual and optional) by the end of next year. Third, I want to talk more about what we'll be doing in this club. I will be making and assigning strict coursework EVERY week (on Mondays). The coursework will consist of videos, articles, independent activities, etc. that either I or someone else has made. Completing the weekly assignment will only take a few hours (three hours max). There will also be occasional virtual hackathons that you may participate in. These hackathons will be cybersecurity-related games that I have found online. I did have to pay for some of the material that I am assigning so please do not take any of this lightly. Lastly, thank you for taking the time out of your day to read this. I truly believe that if you have read this message in full, you are on your way to becoming a great student not just in cybersecurity but in general. I can't wait to get started and I hope you feel the same way. I've always loved the concept behind cybersecurity. It's an interesting and incredibly fulfilling field. That said, let's have some fun! If you have any questions please shoot me an email. I would love to hear from you!"" Please message me if you have questions!"
17,cybersecurity,computerscience,Does anyone have experience bringing CS skills to law? (Cybersecurity lawyer),1,hemf2p,https://www.reddit.com/r/computerscience/comments/hemf2p/does_anyone_have_experience_bringing_cs_skills_to/,2020-06-24 06:32:37,"Hi! I am a current Computer Science and Business major in undergrad going into my second year. I love what Im learning and definitely want to continue studying CS. While I would love to work for a successful startup in the future, Im also thinking about how cool it would be use my CS background to become a cybersecurity lawyer. With this said, life is short, and I dont really know if I should be chasing a law degree if I would make the same amount of money afterwards. But also, maybe the work would be extremely beneficial to people I could serve. Does anyone have experience bringing CS skills to law?"
18,cybersecurity,computerscience,What is the difference between the various William Stallings books regarding security?,1,hhxs67,https://www.reddit.com/r/computerscience/comments/hhxs67/what_is_the_difference_between_the_various/,2020-06-29 20:57:42,"I've heard W. Stallings is one of the best books to get an in-depth explanation regarding security (algorithms, types of attacks, defences, best practices, ...). When I go to [URL I see he has written the following books regarding security: * [Information Privacy Engineering and Privacy by Design](URL * [Cryptography and Network Security, Eighth Edition](URL * [Effective Cybersecurity: Understanding and Using Standards and Best Practices](URL * [Computer Security, Fourth Edition](URL * [Network Security Essentials, Sixth Edition](URL * [Cryptography and Network Security, Seventh Edition](URL I am unable to buy all of these books (also calculating the time necessary to read them). What is the difference between these books? Do they overlap? Which is the ""best""?"
19,cybersecurity,computerscience,"I am a 19 year old, and I want to build a career in Cyber Security",1,hjqamv,https://www.reddit.com/r/computerscience/comments/hjqamv/i_am_a_19_year_old_and_i_want_to_build_a_career/,2020-07-02 14:26:33,"Hello Everyone, you have probably heard a call for advice a million times, I'm sorry, I'm here for more. A little Background on me. I am 19, and I graduate with a bachelor's degree in Computer Science in '24. Right now, I'm learning how to code proficiently in Java, and Python. I have always been confused on what I wanted to do next (Web Development, Video game engineering, Cloud Computing etc), but I'm convinced I want a career in CyberSecurity. Could you please tell me stuff that will really nudge me in the right direction? Specifically, maybe how well do I need to be able to code, what other skills should I build upon, how do I intern, and maybe how do I get myself Industry-ready. Other bits of advice would certainly be really helpful. \*Excuse if I've made errors, English isn't my native language\* Thanks In Advance!"
20,cybersecurity,computerscience,Help with grad school decision??,1,gjgnrs,https://www.reddit.com/r/computerscience/comments/gjgnrs/help_with_grad_school_decision/,2020-05-14 16:15:04," Im a recent college grad and hope to begin grad school this fall. Im torn whether to go for MS in data science or MS cybersecurity. Im equally interested in both fields and would be excited to pursue either one. I also have a solid understanding of what each path entails, as far as study and potential job roles are concerned, but I want to go for the MS thats going to bring me the most value down the line in my career (hopefully!). I appreciate any advice!!"
21,cybersecurity,computerscience,Masters in CS worth it after a BA in IT?,1,glhvje,https://www.reddit.com/r/computerscience/comments/glhvje/masters_in_cs_worth_it_after_a_ba_in_it/,2020-05-18 02:03:02,"As the title suggests, does anyone here think it would be idle for someone who has completed an undergraduate degree in information technology with a concentration in cybersecurity to pursue a MS CS? I'm two semesters short of graduating from undergrad and trying to decide whether or not a master's in CS would be more beneficial for employment marketability. Let it be known that the area I would specialize in for the master's degree is still in the security arena. Now, my main concern is it worth pursuing or should I just rely on certifications to carry me into my career without having to go back for 3 years of schooling? I say three years because I would also have to take prerequired undergraduate CS and math courses to make up. I'm not sure if having an IT bachelor's would put me at an advantage in terms of applying for an MSCS compared to someone applying from something non-technical. Surely someone here has gone down this road from a non-technical background, care to shed some light on your journey? Thanks again."
22,cybersecurity,computerscience,"(Question) Phones, mobile data, and MAC address duplicates",1,gmgd1c,https://www.reddit.com/r/computerscience/comments/gmgd1c/question_phones_mobile_data_and_mac_address/,2020-05-19 13:00:23,"Hello! So I'm a student, it's lockdown, and I found a free online course in cybersecurity which I'm doing to keep my sanity. ([SANS Cyber Aces](URL if anyone's curious.) I've just gotten into the unit on networking, and am learning about the [OSI model](URL of network communications. I got through with layer 2, and there's something I still don't get. So now I understand that every device has something called a MAC address baked into the hardware. I also see that a WIFI router would use this address to differentiate between different devices that are connected to the local network. After a [bit of googling](URL I also learned that duplicate MAC addresses ending up on the same network happens every so often. It seems the only solution to this problem is to spoof that device's MAC address so it shows up as something unique to the router. A bit more googling showed that modern smartphones and mobile devices also have a MAC address so they can connect to the internet. So here's the question: what about mobile data? To my knowledge, the way mobile data works is basically to send WIFI signals through the cell towers/cell network. But each cell tower serves a **crap ton** of people, and there's no way to make sure that each phone connected to a mobile data network has a unique MAC address. And while I have no experience with the subject, spoofing a MAC address looks like a task that would require a human operator somewhere. So in short, how do mobile data networks handle having so many devices connected to them while still getting over the issue of ensuring each device has a unique MAC address? (Or, really, any unique identifier?) &amp;#x200B; ^(Disclaimer: this is) **^(not homework help)**^(. The course is just a series of videos and activities, with no grade and nobody keeping track but me. It's just something I'm doing to gain experience and pass the time.)"
23,cybersecurity,computerscience,Cybersecurity or computer science ?,3,gom2j9,https://www.reddit.com/r/computerscience/comments/gom2j9/cybersecurity_or_computer_science/,2020-05-23 02:04:13,"Currently Im an undergraduate ( 19 yo) doing my first year of diploma and by the next year ( advanced dip) I get to choose between following a course leading to a computer science or cyber security bachelors at my uni, so I was wondering which should I follow through with cause theres so many videos and articles online saying how its best to have a normal computer science degree and later doing a major in cyber security as cyber security requires experience in coding but Im afraid I might regret not choosing Cybersecurity as my bachelors as it seems like a more lucrative side of computer science, I would very much appreciate any advice on this matter P.S I really love coding even though Im a rookie at it right now."
