,title,score,id,url,comms_num,created,body,timestamp
0,"Few weeks ago: ""Zoom has increased its security"". Yes, but actually not:",2841,gl60d8,https://i.redd.it/3ymyt58w28z41.jpg,75,1589705304.0,,2020-05-17 18:48:24
1,Bill Gates twitter was hacked😱,2196,hrvyx7,https://i.redd.it/xe5vt56m43b51.jpg,320,1594875524.0,,2020-07-16 14:58:44
2,Are you sure it is?,1990,fc0ctr,https://i.redd.it/vqrbripii4k41.jpg,23,1583124410.0,,2020-03-02 15:46:50
3,via Balbix,1873,ftviwn,https://i.redd.it/wg7aed9n8hq41.jpg,58,1585893594.0,,2020-04-03 16:59:54
4,Wireshark Cheat Sheet,1739,hgntb2,https://i.redd.it/xna1fs2q1e751.jpg,41,1593264338.0,,2020-06-27 23:25:38
5,Malware packed in DNA.,1728,f7cpcn,https://i.redd.it/osgfjewxpai41.png,92,1582327852.0,,2020-02-22 10:30:52
6,“Selling my own damn data”,1714,dl1dnz,https://i.redd.it/ztj230u6nwt31.jpg,41,1571697076.0,,2019-10-22 09:31:16
7,Security Certification Progression Chart 2020,1583,e23ffz,https://i.redd.it/yo33xlys53141.png,269,1574826921.0,,2019-11-27 14:55:21
8,This hits me right in the feels,1569,ei4jan,https://i.redd.it/qccshy54qz741.jpg,49,1577836270.0,,2020-01-01 10:51:10
9,Hacking Tools Cheat Sheet,1547,hkst90,https://i.redd.it/fviaw8s43q851.jpg,50,1593845945.0,,2020-07-04 16:59:05
10,US Congress is currently aiming at getting rid of proper encryption. Please spread the word!,1406,fj8z53,https://www.theverge.com/interface/2020/3/12/21174815/earn-it-act-encryption-killer-lindsay-graham-match-group,48,1584336701.0,,2020-03-16 16:31:41
11,I will leave it here,1369,dluteo,https://i.redd.it/dzjpwy6ra8u31.jpg,22,1571838177.0,,2019-10-24 00:42:57
