,title,score,id,url,comms_num,created,body,timestamp
438,Widespread Incompetence in the Cybersecurity Field?,218,cx65la,https://www.reddit.com/r/cybersecurity/comments/cx65la/widespread_incompetence_in_the_cybersecurity_field/,114,1567138155.0,"First, this post is not intended as that run-of-the-mill elitist ""why isn't everyone as smart as me?"" kinda post, but I do want a gut check.

I keep meeting ""security professionals"" who'd struggle to match the technical expertise of a help desk admin.

Cases:

**1:** My company just brought on someone with a Master's in Cybersecurity from an online school, and had 10 years of experience working risk compliance for a prestigious government contractor. I got to talking with him and he didn't know what a VM was. No, I am not joking. There is plenty more to say about this person, but let's move on.

**2:** I keep hearing security professionals bring up absurd concerns during meetings with management meant to determine how our budget is spent. Concerns like ""if we allow speakers, they can be turned into microphones and steal keystrokes from our air-gapped devices."" Yes, we've all read that article talking about that theoretical attack, but when actual pressing issues like {insert pretty serious vulns here} exist. They can't prioritize hypothetically NAC or MFA over expensive countermeasures for the latest scary Wired article.

**3:** I meet otherwise highly credentialed people who struggle with basic IT concepts. What I will list here is more forgivable than the previous two, but still worth mentioning. Issues like not knowing theoretically how a DMZ is set up, not knowing the difference between a subnet and a VLAN, failing to understand the difference between giving someone limited admin rights vs giving every sysadmin domain admin, etc etc.

Let me make this clear: I am NOT talking about folks with less than 5 years experience. We should embrace our up and coming security professionals. But I feel like I am surrounded by people who have no business being in security who are there simply because organizations can't fill those roles with anyone else.

Thanks for reading my thing.",2019-08-30 14:09:15
439,A curated list of free Cyber Security Training Courses,220,ghvn7w,https://teamciso.com/2020/04/free-training.html,17,1589257198.0,,2020-05-12 14:19:58
440,"US to Block Certain Foreign-Made Electrical Grid Equipment, Citing Hacking Threat",219,gbqw3m,https://www.pcmag.com/news/us-to-block-certain-foreign-made-electrical-grid-equipment-citing-hacking,19,1588397544.0,,2020-05-02 15:32:24
441,A teenager from Montreal is facing four criminal charges in connection with a $50m SIM-swapping scam that targeted two renowned Canadian Blockchain experts.,219,erkq1x,https://www.infosecurity-magazine.com/news/teen-charged-over-50m-simswapping/,7,1579587478.0,,2020-01-21 17:17:58
442,Cyber Security was the category on last nights Jeopardy,211,engqyk,https://www.reddit.com/r/cybersecurity/comments/engqyk/cyber_security_was_the_category_on_last_nights/,21,1578821146.0,"I hope you all aced this category. Probably the only full category I’ve gotten right in my life. 

https://www.pivotpointsecurity.com/blog/even-the-greatest-jeopardy-contestants-of-all-time-struggle-with-cybersecurity/",2020-01-12 20:25:46
443,Hacker or thief? Someone stole data of 29000 Facebook employees from hard drives,215,eaisft,https://www.ibtimes.sg/hacker-thief-someone-stole-data-29000-facebook-employees-hard-drives-35965,25,1576352557.0,,2019-12-15 06:42:37
444,This is why you invest in Data Loss Prevention,215,cc39vt,https://www.theverge.com/2019/7/10/20689468/tesla-autopilot-trade-secret-theft-guangzhi-cao-xpeng-xiaopeng-motors-lawsuit-filing,52,1562917782.0,,2019-07-12 17:49:42
445,"Group sex app leaks locations, pics and personal details. Identifies users in White House and Supreme Court",214,co0n78,https://www.pentestpartners.com/security-blog/group-sex-app-leaks-locations-pictures-and-other-personal-details-identifies-users-in-white-house-and-supreme-court/,21,1565376231.0,,2019-08-10 04:43:51
446,Imagine such an existence,213,bch66v,https://i.redd.it/ik3ymcpoovr21.png,11,1555123246.0,,2019-04-13 12:40:46
447,Free amazing training this weekend!,209,he8j2i,https://www.reddit.com/r/cybersecurity/comments/he8j2i/free_amazing_training_this_weekend/,45,1592918003.0,"The DEF CON Red Team Village and Texas Cyber are hosting a 2 day (non-stop/30-hour mini conference this weekend. There are two training tracks and a track for briefings. The briefings will be streamed to Twitch, YouTube, Periscope, Facebook, etc. However, you do need to register for the training (free) because of limited availability for some of them. It's amazing that what used to cost thousands of $$$ is now free and available to the community.  Enjoy and hope to see you/chat with you there!

* Red Team Village site: [https://redteamvillage.io/](https://redteamvillage.io/)
* Discord: [https://redteamvillage.io/discord](https://redteamvillage.io/discord)
* Event site: [https://junegle.io/](https://junegle.io/)

https://preview.redd.it/ukkcjevq17751.png?width=4796&format=png&auto=webp&s=abcc0bd26768acfe0cde7ee60c02277230e1d75a",2020-06-23 23:13:23
448,Learn Ethical Hacking From Scratch,217,ebvg25,https://www.youtube.com/watch?v=QyQuXmPq7as&utm_source=reddit&utm_medium=social&utm_campaign=reddit_youtube,17,1576616008.0,,2019-12-18 07:53:28
449,Researcher banned from Valve's bug bounty program publishes 2nd Steam Local Privilege Escalation 0-day [x-post r/netsec],216,cu384i,https://amonitoring.ru/article/steamclient-0day/,6,1566534853.0,,2019-08-23 14:34:13
450,Honda Accidentally Exposed 40GB of Corporate Secrets,209,cn6pw6,https://beincrypto.com/honda-accidentally-exposed-40gb-of-corporate-secrets/?utm_source=reddit&utm_medium=social&utm_campaign=honda&utm_content=JM,21,1565218028.0,,2019-08-08 08:47:08
451,"U.K. Government Proposes IoT Security Rules, Non-compliance May Lead to Fine",212,hv4n0t,https://cisomag.eccouncil.org/insecure-iot-devices/,12,1595354019.0,,2020-07-22 03:53:39
452,SOC Analyst Skills - Wireshark Malicious Traffic Analysis,210,gunf8x,https://youtu.be/M8yoYmiL7rA,19,1591056839.0,,2020-06-02 10:13:59
453,So i'm pretty sure I caught a Bitcoin Miner.,211,gn3af3,https://www.reddit.com/r/cybersecurity/comments/gn3af3/so_im_pretty_sure_i_caught_a_bitcoin_miner/,76,1589972006.0,"So the past couple of weeks I've noticed that my computer refuses to go into sleep mode. Instead it turn off my monitors but wouldn't fully sleep as I could hear the fans still running loudly and when I return to my PC it would wake up straight to the desktop without prompting the Password. So I was sure it wasn't actually going into sleep mode. I put I kept pushing back the diagnosing and fixing this issue every day.

Then earlier today I opened up a program called ""Fiddler"" which is used to monitor HTTP/HTTPS connections on the machine for a completely unrelated reason. However I notice a connection to a web address that was very unusual. It linked to a config file which contained a Cryptocurrency address, some options such as stopping and starting the Miner as well as the mining pool. It even has the title ""\[Miner\]"".

I noticed a option that was toggled on called ""keepalive"" which I can now only assume is the reason why my PC wouldn't go into sleep mode. I tried to recreate this connection by opening different applications while monitoring the connections but I couldn't recreate it. So I decided to leave my PC unattended with Fiddler running for a little while. And when I came back, sure enough my PC didn't sleep and was still awake with the same connection showing up on Fiddler again.

As crazy as this sounds, this got me excited as I'm really into cyber security but I can't find the source of the issue and It started to get frustrating. Soon I'll be reinstalling windows and accepting defeat.

The url of the config is [http://jonathanhardwick.me/config.txt](http://jonathanhardwick.me/config.txt) . I believe this address is only used to tell what the Miner should do. So I don't believe it's dangerous at all. Posting the url is only to educate people and to make people aware of this method and to watch out in the future if anyone believes they might have a Miner running, or their PC refusing to sleep then the same might have happened to you and you can prevent it from doing anymore harm.

&#x200B;

EDIT: Fixed the link (I miss typed it.)

[screenshot of the config file](https://preview.redd.it/cztg5znd1uz41.png?width=869&format=png&auto=webp&s=f3f16de731c07f9eaac67b85d60c27f63dd61af5)",2020-05-20 20:53:26
454,"Throwback to ILOVEYOU - One of the most virulent computer virus ever, created by Onel de Guzman",213,gh0jg0,https://vpnoverview.com/news/the-iloveyou-computer-virus-20-years-on-what-happened-to-onel-de-guzman/,24,1589142086.0,,2020-05-11 06:21:26
455,Cybercriminals raking in $1.5 trillion every year,209,fr49g1,https://www.techrepublic.com/article/cybercriminals-raking-in-1-5-trillion-every-year/,43,1585508781.0,,2020-03-30 06:06:21
456,A bug in Avast Anti-Track privacy software allowed MITM attack on HTTPS traffic,212,fgw503,http://quickcyber.news/2020/03/11/a-bug-in-avast-anti-track-privacy-software-allowed-mitm-attack-on-https-traffic/,11,1583957438.0,,2020-03-12 07:10:38
457,New rules about career posts and advice,208,c7ftoh,https://www.reddit.com/r/cybersecurity/comments/c7ftoh/new_rules_about_career_posts_and_advice/,32,1561937538.0,"It's so wonderful to see people here looking to break into cybersecurity as a career. Even more wonderful is seeing established professionals giving advice and mentorship to others. It's what I love about this community. 

The individual posts tend to get lost in the shuffle, so people may not get the advice they need- especially given the time zone differences. So, new rule. Every Monday, we'll be opening up a ""Mentorship Monday"" thread, which will be stickied for the duration of that week. It's a free space for asking anything about cybersecurity as a career, from what certs are recommended to advice on handling common issues. 

If you're new to the field, or if you're established and need some advice, post your questions there! If you're an experienced cybersecurity professional, please check it out and share your wisdom. 

All other career-related posts will be removed and referred to the weekly thread.",2019-07-01 09:32:18
458,Alarm in Texas as 23 towns hit by 'coordinated' ransomware attack,210,cswitp,https://www.cnbc.com/2019/08/19/alarm-in-texas-as-23-towns-hit-by-coordinated-ransomware-attack.html,58,1566326603.0,,2019-08-21 04:43:23
459,Researchers prove it's possible to infect a DSLR camera with ransomware.,209,cpglpv,https://secalerts.co/article/researchers-infect-canon-dslr-camera-with-ransomware/e1e627b9,16,1565664094.0,,2019-08-13 12:41:34
460,What are some good entry-level security certifications to obtain during COVID-19?,211,if1o4k,https://www.reddit.com/r/cybersecurity/comments/if1o4k/what_are_some_good_entrylevel_security/,64,1598211268.0,"Hi,

Given that more and more people are working from home within the UK, I was wondering what some good cybersecurity certifications would be to get. I work as an Information Security Analyst, but I am put on furlough at the moment due to my company's financial position at the moment.

I have only six months experience and a degree in Computer Science.

Thanks",2020-08-24 05:34:28
461,Oh for the love of God (Equifax breach),208,f2fyx8,https://twitter.com/RayRedacted/status/1226932518634577920,46,1581487462.0,,2020-02-12 17:04:22
462,Hackers Could Steal Your Home WI-Fi Password Through Amazon Ring Doorbell Flaw,212,dtyg7m,https://news.beincrypto.com/2019/11/08/hackers-could-steal-your-home-wi-fi-password-through-amazon-ring-doorbell-flaw/?utm_source=reddit&utm_medium=social&utm_campaign=cybersec&utm_content=ff,40,1573347221.0,,2019-11-10 11:53:41
463,Disney+ fans without answers after thousands hacked,207,dyd5wd,https://www.bbc.com/news/amp/technology-50461171,44,1574155559.0,,2019-11-19 20:25:59
464,German regulator bans Google from listening to Google Home recordings for three months across Europe,211,ckrwt5,https://techerati.com/news-hub/german-regulator-bans-google-from-listening-to-google-home-recordings-for-three-months-across-europe/,23,1564711408.0,,2019-08-02 12:03:28
465,Louisiana Declares Cybersecurity State of Emergency,211,cixphm,https://www.darkreading.com/attacks-breaches/louisiana-declares-cybersecurity-state-of-emergency/d/d-id/1335350,13,1564359186.0,,2019-07-29 10:13:06
466,Serious Chrome zero-day – Google says update “right this minute”,209,aycpbi,https://nakedsecurity.sophos.com/2019/03/06/serious-chrome-zero-day-google-says-update-right-this-minute/,4,1551994712.0,,2019-03-08 08:38:32
467,Existential cyber threats,206,9t9ooa,https://i.redd.it/5dxodd4j2qv11.png,7,1541109808.0,,2018-11-02 09:03:28
468,North Korean Hackers Spotted Using New Multi-Platform Malware Framework,208,hwdxrv,https://thehackernews.com/2020/07/lazarus-north-korean-hackers.html,16,1595532199.0,,2020-07-24 05:23:19
469,LPL:[1052] Hacking a RFID System With The ESPKey,209,fb5ojx,https://youtu.be/0SEHUqkbIjU,12,1582971391.0,,2020-02-29 21:16:31
470,$100K Paid Out for Google Cloud Shell Root Compromise,205,fhhnh9,https://threatpost.com/100k-google-cloud-shell-root-compromise/153665/,7,1584054062.0,,2020-03-13 10:01:02
471,Mozilla to Block Fingerprinters by Default in Firefox 72,209,e1v9p3,https://www.bleepingcomputer.com/news/security/mozilla-to-block-fingerprinters-by-default-in-firefox-72/,31,1574786842.0,,2019-11-27 03:47:22
472,Organizations globally take 162 hours on average to detect and respond to breaches: Report,205,e18tty,https://www.cybersecasia.net/features/organizations-globally-take-162-hours-on-average-to-detect-and-respond-to-breaches-report,10,1574675728.0,,2019-11-25 20:55:28
473,A 17-year-old teen and two other 19 and 22-year-old individuals have reportedly been arrested for being the alleged mastermind behind the recent Twitter hack that simultaneously targeted several high-profile accounts within minutes as part of a massive bitcoin scam.,205,i4nbrm,https://thehackernews.com/2020/07/twitter-hacker-arrested.html?m=1,32,1596727802.0,,2020-08-07 01:30:02
474,Amazon’s Echo wants you to get rid of privacy for good,202,fectvi,https://medium.com/@ollieramirez333/amazons-echo-wants-you-to-get-rid-of-privacy-for-good-561891e408d5,25,1583526789.0,,2020-03-07 07:33:09
475,"French Police Remotely Removed RETADUP Malware from 850,000 Infected PCs",207,cwsi5p,https://mrhacker.co/cyber-attack/french-police-remotely-removed-retadup-malware-from-850000-infected-pcs?feed_id=12,8,1567062764.0,,2019-08-29 17:12:44
476,"How realistic is learning python and pentesting or ethical hacking from Udemy, then getting certifications, to enter the cyber security field?",204,gqxt44,https://www.reddit.com/r/cybersecurity/comments/gqxt44/how_realistic_is_learning_python_and_pentesting/,40,1590531234.0,"I'm a computer science grad, and I studied it mainly to build sites and apps, but I've lost interest in that, and I'm thinking of entering the infosec/cyber security field, as I enjoyed practical networks classes while getting my degree. From going through posts and research, there are some needed certifications, but before trying to get them, is a Udemy course going to be helpful? 

- What resources and/or path advice can you give to a newbie? 

- What's ""A day in the life of"" someone in cyber security? 

- Is it more theoretical or practical? 

- Also, how realistic is it to freelance in this field?",2020-05-27 08:13:54
477,Hundreds arrested after encrypted phone network takeover,205,hk0czz,https://www.bleepingcomputer.com/news/security/hundreds-arrested-after-encrypted-phone-network-takeover/,19,1593736684.0,,2020-07-03 10:38:04
478,This scam made me giggle.,199,e6z08b,https://i.redd.it/98selspxp0341.png,37,1575669059.0,,2019-12-07 08:50:59
479,"""But 2-factor authentication is annoying"" - ""More annoying than losing over $1m?""",198,gdyz5g,https://blog.knowbe4.com/florentine-baker-group-use-microsoft-365-functionality-to-scam-private-equity-firm-out-of-1.2-million,18,1588718557.0,,2020-05-06 08:42:37
480,"Obscurity is a medium difficulty machine running Linux. It tests your knowledge in OSINT, Python script exploitation and basic privilege escalation.",199,ggiux1,https://sabebarker.com/writeups/hackthebox/machines/obscurity/,4,1589071709.0,,2020-05-10 10:48:29
481,One step closer 😬 (1st year of college completed),198,ht0ipa,https://i.redd.it/yomz8rxqigb51.jpg,28,1595037667.0,,2020-07-18 12:01:07
482,Australia's data retention scheme is being abused exactly as critics predicted.,195,fblapr,https://www.crikey.com.au/2020/02/25/data-retention-scheme-abuse/,13,1583048640.0,,2020-03-01 18:44:00
483,"DHS terrorism bulletin includes warning, ""Iran is capable, at a minimum, of carrying out attacks with temporary disruptive effects against critical infrastructure in the United States.""",195,eklrc3,https://www.dhs.gov/ntas/advisory/national-terrorism-advisory-system-bulletin-january-4-2020,34,1578299260.0,,2020-01-06 19:27:40
484,oh the humanity... i love my day job (https://twitter.com/BowSecRSR),196,cgayqj,https://i.redd.it/tuy9qz7kotb31.jpg,50,1563816234.0,,2019-07-23 03:23:54
485,UK National Cyber Security Centre launches Cyber Security Body of Knowledge (CyBOK),196,en6c0w,https://www.reddit.com/r/cybersecurity/comments/en6c0w/uk_national_cyber_security_centre_launches_cyber/,15,1578770707.0,More information can be found here - https://www.ncsc.gov.uk/news/cyber-security-world-first-unique-guide-launched,2020-01-12 06:25:07
486,Do they even try anymore?,196,fedct2,https://i.redd.it/hbmhx0s8z1l41.jpg,36,1583529561.0,,2020-03-07 08:19:21
487,"Facebook Loses Data for 267 Million Users, Calls Libra Security Into Question",199,eekh7n,https://beincrypto.com/facebook-loses-data-for-267-million-users-calls-libra-security-into-question/?utm_source=reddit&utm_medium=social&utm_campaign=btc&utm_content=tay,22,1577135710.0,,2019-12-24 08:15:10
488,Amazon's Ring Gave Police Stats About Users Who Said No to Law Enforcement Requests,191,cxmpux,https://gizmodo.com/ring-gave-police-stats-about-users-who-said-no-to-law-e-1837713840,35,1567227015.0,,2019-08-31 14:50:15
489,DARPA's $10 million voting machine couldn't be hacked at Defcon (for the wrong reasons),194,cp6hg2,https://www.cnet.com/news/darpas-10-million-voting-machine-couldnt-be-hacked-at-defcon-for-the-wrong-reasons/,23,1565607471.0,,2019-08-12 20:57:51
490,Here we are with a initiative of digitally secured tomorrow. We are going to update regular #techtips making the people around us Cyber safe and help them stay ahead from the potential Cyber threats.,193,bxpjnt,https://i.redd.it/0fmzrjjlmu231.png,26,1559904773.0,,2019-06-07 20:52:53
491,Best Solution,197,a26hp6,https://i.redd.it/lm7vh1fn7q121.jpg,11,1543724939.0,,2018-12-02 15:28:59
492,Gereral Forensic Analysis Checklist,190,hie7nb,https://i.redd.it/myi6b7ediy751.jpg,10,1593512074.0,,2020-06-30 20:14:34
493,Getting started in cybersecurity and bug bounty Awesome blog :),193,dkj6o6,https://whoami.securitybreached.org/2019/06/03/guide-getting-started-in-bug-bounty-hunting/,7,1571604512.0,,2019-10-21 07:48:32
494,60% of small companies that suffer a cyber attack are out of business within six months.,193,b9tsp6,https://www.denverpost.com/2016/10/23/small-companies-cyber-attack-out-of-business/,16,1554512730.0,,2019-04-06 12:05:30
495,Intel Owl – OSINT tool automates the intel gathering process using a single API,190,icanbg,https://portswigger.net/daily-swig/amp/intel-owl-osint-tool-automates-the-intel-gathering-process-using-a-single-api,18,1597816473.0,,2020-08-19 15:54:33
496,CYBOK - The Cyber Security Body Of Knowledge,196,ega2la,https://www.cybok.org/,17,1577474708.0,,2019-12-28 06:25:08
497,Cybersecurity Workforce Demand,192,a3nwik,https://i.redd.it/afn8m8edtn221.jpg,40,1544131783.0,,2018-12-07 08:29:43
498,Intel will soon bake anti-malware defenses directly into its CPUs,191,hby9sd,https://arstechnica.com/information-technology/2020/06/intel-will-soon-bake-anti-malware-defenses-directly-into-its-cpus/,38,1592591160.0,,2020-06-20 04:26:00
499,A massive database of more than 5 Billion “leaked records” was exposed online,194,fm2j3b,http://quickcyber.news/2020/03/21/a-massive-database-of-more-than-5-billion-leaked-records-was-exposed-online/,13,1584766359.0,,2020-03-21 15:52:39
500,"77% of orgs don't have a cybersecurity incident response plan - aka, there's limited understanding of security risk among non-technical individuals",193,bdun2r,https://www.helpnetsecurity.com/2019/04/12/cybersecurity-incident-response-plan/,23,1555454101.0,,2019-04-17 08:35:01
501,"When the ""IT"" in you kicks in... Business has Wi-Fi password on the wall, visible even from the outside when walking down the sidewalk... Discussion on ethics and self control.",188,ek9pf2,/r/msp/comments/ek2fc0/when_the_it_in_you_kicks_in_business_has_wifi/,22,1578237112.0,,2020-01-06 02:11:52
502,"Capital One data breach hits about 6 million people in Canada, 100 million in U.S",188,cjk1ja,https://www.reddit.com/r/cybersecurity/comments/cjk1ja/capital_one_data_breach_hits_about_6_million/,46,1564475626.0,"Global News: Capital One data breach hits about 6 million people in Canada, 100 million in U.S..
https://globalnews.ca/news/5700226/capital-one-data-breach-canada/",2019-07-30 18:33:46
503,Breaking and Pwning Apps and Servers on AWS and Azure - Free Training Courseware and Labs,191,fzrvpd,https://github.com/appsecco/breaking-and-pwning-apps-and-servers-aws-azure-training,2,1586703082.0,,2020-04-13 00:51:22
504,Reddit security uncovers Russian operation to spread leaked UK documents,193,e78x09,https://www.cnet.com/news/reddit-uncovers-russian-campaign-to-spread-leaked-uk-documents/,17,1575716657.0,,2019-12-07 22:04:17
505,"Authorities self-destruct cryptomining worm after 850,000 infections.",187,cx28x7,https://secalerts.co/article/authorities-self-destruct-cryptomining-worm-after-850000-infections/70a87332,13,1567120428.0,,2019-08-30 09:13:48
506,"US Senate Passes Bill in Response to Rampant Ransomware, CyberAttacks",187,dajxcm,https://www.bleepingcomputer.com/news/security/us-senate-passes-bill-in-response-to-rampant-ransomware-cyberattacks/,30,1569724657.0,,2019-09-29 12:37:37
507,Day-1 Skills That Cybersecurity Hiring Managers Are Looking For | Daniel Miessler,187,cy4zcv,https://danielmiessler.com/blog/day-1-skills-required-to-land-an-entry-level-cybersecurity-job/,12,1567336536.0,,2019-09-01 21:15:36
508,Germany's data chief tells ministries WhatsApp is a no-go,186,glzcqe,https://www.dw.com/en/germanys-data-chief-tells-ministries-whatsapp-is-a-no-go/a-53474413,27,1589828374.0,,2020-05-19 04:59:34
509,California turns to vote-by-mail to keep residents safe come November,186,gg4mid,https://techcrunch.com/2020/05/08/california-vote-by-mail/,35,1589010769.0,,2020-05-09 17:52:49
510,Certs are only one piece of the equation....experience matters,182,dyley6,https://www.reddit.com/r/cybersecurity/comments/dyley6/certs_are_only_one_piece_of_the/,120,1574203996.0,"It seems like daily there are questions about what certifications to get  and I don't see many questions on what EXPERIENCE you should have.

Certifications are great, but certifications without any practical experience are not going to get you in the door, or if they do you won't be there long when you can't actually do the job

certifications are not a substitute for actual experience, you need to treat them as professional development and you get the on the way while you're actually working in different roles

just taking several SANs courses and cert exams, won't actually make you a pen-tester",2019-11-20 09:53:16
511,Zendesk Finds Out About Data Breach Three Years After it Occurred.,187,dcq104,https://secalerts.co/article/zendesk-finds-out-about-data-breach-three-years-after-it-occurred/4cf87c82,5,1570133647.0,,2019-10-04 06:14:07
512,"Israeli tech company says it can break into all iPhones ever made, some Androids",187,c1nwas,https://www.timesofisrael.com/israeli-tech-company-says-it-can-break-into-all-iphones-ever-made-some-androids/,43,1560809052.0,,2019-06-18 08:04:12
513,Remote Code Execution in Slack,188,ij5ir6,https://hackerone.com/reports/783877,12,1598784893.0,,2020-08-30 20:54:53
514,Can anyone recommend a GOOD Cybersecurity blog/news channel,180,h0arme,https://www.reddit.com/r/cybersecurity/comments/h0arme/can_anyone_recommend_a_good_cybersecurity/,79,1591823901.0,"The more technical, the better :0",2020-06-11 07:18:21
515,"Shade (Troldesh) ransomware shuts down and releases decryption keys. The Shade ransomware gang have published more than 750,000 decryption keys on GitHub. Kaspersky is working on a decryption app.",183,g9r2zy,https://www.zdnet.com/article/shade-troldesh-ransomware-shuts-down-and-releases-all-decryption-keys/,14,1588122326.0,,2020-04-29 11:05:26
516,Microsoft Buys Corp.com So Bad Guys Can’t,186,fwnolx,https://krebsonsecurity.com/2020/04/microsoft-buys-corp-com-so-bad-guys-cant/,5,1586306240.0,,2020-04-08 10:37:20
517,4 years of Malwarebytes for only $5,184,gansaw,https://www.reddit.com/r/cybersecurity/comments/gansaw/4_years_of_malwarebytes_for_only_5/,59,1588244813.0,"Came upon this offer that may interest many of you. You can get 4 years worth of Malwarebytes Premium for only $5 (money goes for a good cause) if you have a student email.

Link is https://malwarebytes.com/student-discount/

Enjoy and stay safe!

Edit: You DO NOT need to be in school. You only need access to a student email.",2020-04-30 21:06:53
518,SSH Pentesting Guide,182,ejuumh,https://community.turgensec.com/ssh-hacking-guide/,13,1578160754.0,,2020-01-05 04:59:14
