,title,score,id,url,comms_num,created,body,timestamp
669,Oof...,136,e50zqt,https://www.reddit.com/r/eagles/comments/e504x7/psa_if_you_use_the_same_password_for_your_eagles/,7,1575331102.0,,2019-12-03 10:58:22
670,Survey finds Amazon-recommended home security cameras riddled with vulnerabilities,136,dbqpeh,https://techerati.com/news-hub/home-security-iot-amazon-cybersecurity-flaw/,7,1569950043.0,,2019-10-02 03:14:03
671,LunarPages apparently stores account passwords in the clear...,135,cztegl,https://i.redd.it/m7jfsx9f7ok31.jpg,32,1567672290.0,,2019-09-05 18:31:30
672,Cybersecurity interviews and difficulty?,133,ek2dtk,https://www.reddit.com/r/cybersecurity/comments/ek2dtk/cybersecurity_interviews_and_difficulty/,80,1578200342.0,"Hi everyone,

I apologize if this subject matter has been brought up a million times, but I'm having issues landing my first level 1 type Infosec Analyst role.

Very short career synopsis, have around 8 years helpdesk, management, and sysadmin experience. Some experience also learning things like C and programming simple firmware for a startup I worked at. One of my natural abilities is being able to understand what's going on quickly, solve tricky technical challenges, and even come up with some custom solutions.

Fell in love with Information Security a few years ago, strangely didn't discover it was its own field until 2016 or so. Sent out resumes immediately and was landing interviews, but passed none of them. Was told I was close, two hiring managers even contacted me after and said there was an internal debate between hiring me or someone else, and if I would have just had a cert or something like Security+ that would have been a tipping point. I took that advice to heart.

Last 3 years take current ""everyman"" IT job and spent all free time self-learning and credentialing up, got Security+ and 3 other certs, sat for my Associate of ISC2 some months ago, in reality just to test where I was in the spectrum. Felt like I was failing the whole time, but surprisingly passed, turned in my work history highlighting the areas where I touched security and they made me full CISSP.

I'm enrolled in PWK for OSCP now to round out more technical knowledge and keep my terminal skills sharp. I also practice on HackTheBox when I can (working through retired boxes).

Here's the issue, I've been now trying to interview for my first level 1 Information Security Analyst type position, and I'm getting rejection after rejection after the interviews - 7 rejections in the past 6 months (2 of which said they'd make an offer, but switched at the last minute).

I guess this is the reason I'm posting this now - I had one yesterday that was so brutal that I'm still kinda rattled from it. I basically walked into a firing zone of 6 vs 1, for over an hour and a half, very complex scenarios involving memory forensic analysis, specific artifacts, shellcode/malware/debugging/assembly analysis, legal implications, surrounded by a ton of ""gotcha"" and ""IT bingo"" type questions (""name all the Regional Internet Registries"" being one that stood out). I was able to wiggle through quite a few of the scenarios with deductive reasoning, but one of the interviewers even said ""I think you'd have a tough time in this field."" As I was walking out, I was questioning everything.

And this is for only a level 1 position.

I almost felt like apologizing for wasting these people's time.

Prior to trying to push into this industry, my callback rate for regular IT / sysadmin was typically around 90% - very rarely did I not get the position I interviewed for.

Has this been typical for anyone else?",2020-01-05 15:59:02
673,Google Places Hold on Facial Recognition Expansion Due to Dubious Tactics,135,de27zf,https://news.beincrypto.com/2019/10/05/google-places-hold-on-facial-recognition-expansion-due-to-dubious-tactics/?utm_campaign=google&utm_medium=social&utm_source=reddit&utm_content=JM,3,1570391387.0,,2019-10-07 06:49:47
674,"I've found a web vulnerability that exposes currently hundreds, if not fixed thousands of Lenovo owners Names, Partial physical addresses, Full email addresses, serial numbers of devices, etc..",133,d3lz6j,https://www.reddit.com/r/sysadmin/comments/d3e5u3/ive_found_a_web_vulnerability_that_exposes/,10,1568390223.0,,2019-09-14 01:57:03
675,NIST.....WOW...,132,act91k,https://i.imgur.com/kwcFVMK.jpg,26,1546714944.0,,2019-01-06 06:02:24
676,Web Attack Survival Guide - Infographic via Imperva,137,a3e74i,https://i.redd.it/5c7rkggqqh221.jpg,4,1544058240.0,,2018-12-06 12:04:00
677,Cybercrime: Ransomware attacks have more than doubled this year | ZDNet,133,cz5lni,https://www.zdnet.com/article/cyber-crime-ransomware-attacks-have-more-than-doubled-this-year/,4,1567549702.0,,2019-09-04 08:28:22
678,TIL A hacker has created a rogue lightning cable that lets bad guys taking control over your devices,133,f8b1rh,https://www.fastcompany.com/90413945/theres-a-scary-new-reason-not-to-borrow-a-strangers-iphone-cable,17,1582501373.0,,2020-02-24 10:42:53
679,Google removes malicious apps from Play Store; uninstall them from your android phone,131,dszjkp,https://www.ibtimes.sg/google-removes-malicious-apps-play-store-uninstall-them-your-android-phone-34061,10,1573170444.0,,2019-11-08 10:47:24
680,"Ransomware attack hits UK's biggest private forensic firm, police suspend work",132,c3omn9,https://www.ibtimes.sg/ransomware-attack-hits-uks-biggest-private-forensic-firm-police-suspend-work-31427,5,1561231748.0,,2019-06-23 05:29:08
681,Is EU’s much-anticipated data protection law (GDPR) a toothless tiger? New 4-year undercover study finds that most Android and iOS apps (n=225) still violate basic privacy rights. GDPR brought no improvement but an “unexpected decline”.,131,igdj9p,https://doi.org/10.1145/3407023.3407057,13,1598395481.0,,2020-08-26 08:44:41
682,"I needed to create a zoom account unwillingly. Tried a 40 character password, got denied. I understand the issues with short passwords, but why is there a maximum limit in length? As I understand, if they keep only the hashes, no matter what the length, the hash size is constant.",132,hkdgk6,https://i.redd.it/q7j6z6sovk851.png,42,1593783164.0,,2020-07-03 23:32:44
683,"It wasn't just a few credit cards: Entire travel itineraries were stolen by hackers, Easyjet now tells victims",132,gtor19,https://www.theregister.com/2020/05/22/easyjet_hack_victim_notification/,6,1590911798.0,,2020-05-31 17:56:38
684,How does a keylogger work? A simple example made with powershell.,131,bsdtvb,https://www.andreafortuna.org/2019/05/22/how-a-keylogger-works-a-simple-powershell-example/,10,1558710683.0,,2019-05-25 01:11:23
685,"Two years after WannaCry, a million computers remain at risk",132,bo5q4x,https://techcrunch.com/2019/05/12/wannacry-two-years-on/,11,1557793894.0,,2019-05-14 10:31:34
686,Socks Rocked,136,axogvy,https://i.redd.it/m5y1s49mgck21.jpg,7,1551839567.0,,2019-03-06 13:32:47
687,U.S. Cyber Command operation disrupted Internet access of Russian troll factory on day of 2018 midterms,131,av1zzr,https://www.washingtonpost.com/world/national-security/us-cyber-command-operation-disrupted-internet-access-of-russian-troll-factory-on-day-of-2018-midterms/2019/02/26/1827fc9e-36d6-11e9-af5b-b51b7ff322e9_story.html,7,1551230737.0,,2019-02-27 12:25:37
688,Google email domains spoofed by SMTP exploit in G Suite,128,h9zy70,https://portswigger-net.cdn.ampproject.org/c/s/portswigger.net/daily-swig/amp/google-email-domains-spoofed-by-smtp-exploit-in-g-suite,14,1592325231.0,,2020-06-17 02:33:51
689,Beware! Online DNA tests can be vulnerable to genetic hacking,135,em7ays,https://www.ibtimes.sg/beware-online-dna-tests-can-be-vulnerable-genetic-hacking-37358,12,1578590566.0,,2020-01-10 04:22:46
690,"Hackers breach FSB contractor, expose Tor deanonymization project and more",131,cg6rao,https://www.zdnet.com/article/hackers-breach-fsb-contractor-expose-tor-deanonymization-project/,3,1563787091.0,,2019-07-22 19:18:11
691,A botnet named GoldBrute has been discovered attempting to bruteforce its way into over 1.5 million Remote Desktop Protocol (RDP) servers exposed to the Internet.,133,by6a4x,https://secalerts.co/article/botnet-bruteforces-over-15-million-rdp-servers-globally,3,1560015239.0,,2019-06-09 03:33:59
692,"British cybersecurity researcher who helped to stop WannaCry attack pleads guilty in hacking case, faces two counts of 5 years.",131,bf6uqv,https://www.nbcnews.com/news/amp/ncna996561,20,1555751914.0,,2019-04-20 19:18:34
693,Career Transition into Cybersecurity,134,hxwkm4,https://www.reddit.com/r/cybersecurity/comments/hxwkm4/career_transition_into_cybersecurity/,102,1595748829.0,"Back in May 2019, I decided I needed a changeup, challenge, and to boost my career/earnings ceiling. I was making $35K in my previous job with no room for advancement. I have a BA in Music. I decided to completely flip the script and pursue an IT degree in Information Assurance/Cybersecurity. I was able to get into the program by completing my A+ certification in August. Here I am, now with basic certs (ITIL Foundation, A+, Net+, CIW Site Development Assoc., CIW Web Security Assoc., and working on Sec+).

I am still struggling to find a Help Desk job. All postings that I see require 2-3 years experience on Help Desk...for Help Desk. I know that the pandemic has made it difficult to get an interview, but my understanding is that even without a BS degree in IT, you pretty much just need to be able to breathe for Help Desk. I could be wrong. My university program mentor says I need to be shooting higher than Help Desk, but I can't even grab an interview for that. I know it's hard to get into the industry initially, and the only tangible experience I have is my own pentest lab (Kali, Ubuntu, mostly dabbling in Wireshark and Zenmap) and school experience. I am US-based, but I am really scratching my head as to what I need to do to stand out to potential employers. Do they need to see the BS degree? Any pointers will be much appreciated!

EDIT: syntax",2020-07-26 17:33:49
694,Why does Instagram have Amazon device broadcast receivers?,133,g02q52,https://i.redd.it/w3x479inrfs41.png,30,1586747442.0,,2020-04-13 13:10:42
695,"If it sounds too good to be true, it most likely is: Nobody can decrypt the Dharma ransomware",129,dux8t7,https://www.theregister.co.uk/2019/11/11/dharma_decryption_promises_data_recovery/,5,1573528458.0,,2019-11-12 14:14:18
696,Anyone else feel that 'entry' level IT jobs are anything but entry level?,132,hmceny,https://www.reddit.com/r/cybersecurity/comments/hmceny/anyone_else_feel_that_entry_level_it_jobs_are/,80,1594086569.0,"Being someone who is relatively new to the cyberscurity field (I transitioned from the nursing field several years ago) I have found that 'entry' level IT jobs are anything but entry level. Anyone else feel this way? For example, I often see entry level jobs requiring 5 years of experience with some of the experience being in specialized areas or with specialized software that could only be gained with on the job experience. In addition to the years of experience, they often require degrees and/or certifications. In comparison, nursing entry level jobs are exactly that, entry level, meaning they require nothing more than being licensed. In other words, they don't ask for years of experience. Considering there are more than 3 million unfilled IT positions in the US alone, I find it counterproductive to demand some much from people who are trying to get into the IT field.",2020-07-07 11:49:29
697,"T-Mobile, Fortnite, Instagram, Comcast, And Chase Bank Have All Experienced Outages. Some Believe The U.S. Has Been Hit By Large-Scale DDoS Attack—Others Are Skeptical.",132,h9ytdh,https://www.forbes.com/sites/jessedamiani/2020/06/15/t-mobile-fortnite-instagram-comcast-and-chase-bank-have-all-experienced-outages-some-believe-the-us-has-been-hit-by-large-scale-ddos-attack-others-are-skeptical/#3d629074b2a6,22,1592320207.0,,2020-06-17 01:10:07
698,McAffee Endpoint security is using AES in ECB-mode and a hardcoded key,127,fr4iu3,https://twitter.com/donnymaasland/status/1244047237757521920?s=21,14,1585510256.0,,2020-03-30 06:30:56
699,"I am an expert with 14 years of experience in IT, Information Security and Cybersecurity. AMA about how to break into Cybersecurity, different roles, certifications and learning resources.",129,8evdks,https://www.reddit.com/r/cybersecurity/comments/8evdks/i_am_an_expert_with_14_years_of_experience_in_it/,55,1524706021.0,"Greetings r/cybersecurity!

Brief background on myself: I originally transitioned into this field from an IT role, and have extensive experience in both Information Security and Cybersecurity. Over the years, I have worked across the industry spectrum (Banking and Finance, Industrial, Education, Healthcare, Automobiles, Tech and Social Media). My certifications include: [CISSP](https://www.isc2.org/Certifications/CISSP#), [MCITP](https://www.microsoft.com/en-us/learning/mcitp-certification.aspx), [CCNA](https://www.cisco.com/c/en/us/training-events/training-certifications/certifications/associate/ccna-routing-switching.html).

I enjoy teaching and giving back to the community - I volunteer for at-risk youth organizations teaching CISSP certifications, and contribute regularly to industry newsletters like [SANS](https://www.sans.org/newsletters/).

Currently I'm helping develop the curriculum for Springboard's [Introduction to Cybersecurity](https://www.springboard.com/workshops/cybersecurity) course - which is geared towards professionals who are looking to transition into the field and get certified.

If you are exploring a career in this field, here is a list that will help you get started:

1) Familiarize yourself with web application security resources like [OWASP](https://www.owasp.org/index.php/Main_Page): this will give you a good understanding of the top software security risks to internet applications.

2) Start exploring tools that are utilized in app security: like this vendor - https://www.qualys.com/.

3) Participate in online application security projects and forums: [Github](https://github.com/) has a collection of code and project collaboration you could get involved in now. Type “security” in the search box and a list of projects will appear.


Happy to answer any questions you have!

Edit: Thanks for the love y'all - these are all great questions! I'm in Germany currently, and will hit the sack right now. Keep the questions coming, I'll check back first thing in the morning and answer all the open queries.",2018-04-26 11:27:01
700,Maze Ransomware Releases Files Stolen from City of Pensacola,126,efa83m,https://www.bleepingcomputer.com/news/security/maze-ransomware-releases-files-stolen-from-city-of-pensacola/,16,1577266678.0,,2019-12-25 20:37:58
701,Hacker Exposes Data of 24 Million Lumin PDF Users on Hacking Forum.,130,d5719n,https://secalerts.co/article/hacker-exposes-data-of-24-million-lumin-pdf-users/bca12d67,17,1568698388.0,,2019-09-17 15:33:08
702,High school election hacked by candidate who exploited weak passwords,127,be40ae,https://www.grahamcluley.com/high-school-election-hacked-by-candidate-who-exploited-weak-passwords/,15,1555506850.0,,2019-04-17 23:14:10
703,The Cybersecurity Hiring Gap is Due to The Lack of Entry-level Positions | Daniel Miessler,126,ahghgs,https://danielmiessler.com/blog/the-problem-with-cybersecurity-hiring/,59,1547883659.0,,2019-01-19 18:40:59
704,Regedit change to stop local searches going to Microsoft,122,f14kmn,https://www.forbes.com/sites/gordonkelly/2020/02/06/windows-10-warning-serious-failure-provokes-questions-and-anger/,10,1581256846.0,,2020-02-10 01:00:46
705,TikTok hit with record fine for illegally collecting data,127,ax885u,https://www.pandasecurity.com/mediacenter/social-media/tiktok-record-fine/?utm_source=reddit&utm_medium=social&utm_content=SM_EN_MC_tiktok_fine&track=180715,18,1551741566.0,,2019-03-05 10:19:26
706,Here's what that Capital One court decision means for corporate cybersecurity,127,h9f2cs,https://www.cyberscoop.com/capital-one-incident-response-mandiant-decision/,29,1592251724.0,,2020-06-16 06:08:44
707,'Pwnagotchi' Is the Open Source Handheld That Eats Wi-Fi Handshakes,120,dn3ws2,https://www.vice.com/en_us/article/xwekw4/pwnagotchi-is-the-open-source-handheld-that-eats-wi-fi-handshakes,2,1572066754.0,,2019-10-26 16:12:34
708,An observation: Lots of posts on career advice,124,c72zih,https://www.reddit.com/r/cybersecurity/comments/c72zih/an_observation_lots_of_posts_on_career_advice/,20,1561862723.0,"Scanning through this sub, I have been noticing an increasing percentage of posts from people asking for training and career advice.  It's typically something like, ""I have no experience in cybersecurity, but I want to pursue that career.  Where should I get training?  What certs do I need?  How do I get a job?""   I don't mind people asking these things, and I've tried to help answer where I can, but I wonder if there is a need for a permanent ""read this first"" post on training and certs.  Should it be a separate subreddit?  I come here to find articles on new attacks and trends in the cybersecurity space.  These posts are diluting the value for me.  Thoughts?",2019-06-30 12:45:23
709,Microsoft admits Outlook.com hackers were able to access emails,126,bdgg0s,https://www.theverge.com/2019/4/15/18311112/microsoft-outlook-web-email-hack-response-comment,10,1555366386.0,,2019-04-16 08:13:06
710,Nothing suspicious here,122,bcd6o6,https://i.redd.it/a34sobvx7tr21.png,5,1555102206.0,,2019-04-13 06:50:06
711,"MITRE just released MITRE Shield, a knowledge base for active defense and adversary engagement. It also maps to ATT&CK.",123,ia687d,https://twitter.com/mitreattack/status/1294298715197444096?s=21,25,1597522173.0,,2020-08-16 06:09:33
712,What even??,122,apm4yd,https://i.redd.it/n95xjp48q0g21.jpg,11,1549954123.0,,2019-02-12 17:48:43
713,This is the second time I had a cop come to my house for the same thing.. (maybe a targeted spoof call),124,f4ly08,https://www.reddit.com/r/cybersecurity/comments/f4ly08/this_is_the_second_time_i_had_a_cop_come_to_my/,28,1581858318.0,"My OP:

I was just woken up around 3am by my mom knocking on my door, since she travels so often I thought she came to say bye, but I was sadly wrong. I woke up to a real cop asking about the call. Everybody at this residency was asleep and we didn’t know what was even going on. They said that the call was from my family members number and was under their name, but nobody called. My family remember received at call shortly before the cops came from a  random looking local number, but didn’t answer. My family member tried calling back but the phone was out of service. The phone number that the call was from was a number that was a home phone number that is now a fax number that goes directly to the fax machine and it gets forwarded to my family members phone. How could anything like this occur? I know spoofing numbers exist but calling the cops is another thing. Please help. I am very scared.

UPDATE:
So, the same thing has happened again, I had a cop come knocking on my door saying they received a call from this resident and again nothing happened and no one has called. This is the second time this has happened and I’m starting to feel targeted and really scared now...",2020-02-17 00:05:18
714,A Day In The Life Of A Cyber Security Contractor,122,e1ozfz,https://youtu.be/yuyVElFHjy8,31,1574753844.0,,2019-11-26 18:37:24
715,Android apps are being ‘legally’ sold for hundreds of dollars on the Google Play store.,122,d9iohg,https://secalerts.co/article/android-apps-are-being-legally-sold-for-hundreds-of-dollars-on-google-play-store/8690bdea,20,1569528233.0,,2019-09-27 06:03:53
716,"Iranian hackers ransack Citrix, make off with 6TB of emails, biz docs, internal secrets",122,azcty3,https://www.theregister.co.uk/2019/03/08/citrix_hacked_data_stolen/,14,1552226441.0,,2019-03-11 01:00:41
717,Hacker gains access to a small number of Microsoft's private GitHub repos,121,gfo36v,https://www.zdnet.com/article/hacker-gains-access-to-a-small-number-of-microsofts-private-github-repos/,10,1588949448.0,,2020-05-09 00:50:48
718,A Critical Internet Safeguard Is Running Out of Time,123,fjysbc,https://www.wired.com/story/shadowserver-cisco-internet-cybersecurity/,2,1584446677.0,,2020-03-17 23:04:37
719,I'm going to join my first CTF at Barcelona Cybersecurity Congress! Any tips?,119,dnqyve,https://i.redd.it/u9blh1q0v1v31.png,51,1572196207.0,,2019-10-28 04:10:07
720,"Turkey fines Facebook $280,000 for failing to protect users' personal data",121,bn9lcb,https://www.ibtimes.sg/turkey-fines-facebook-280000-failing-protect-users-personal-data-30760,13,1557589692.0,,2019-05-12 01:48:12
721,The Cybersecurity Hiring Gap is Due to The Lack of Entry-level Positions - (Great Read!),122,9r2x9m,https://danielmiessler.com/blog/the-problem-with-cybersecurity-hiring/,35,1540438637.0,,2018-10-25 14:37:17
722,The U.S. Needs a Cyber Force More Than a Space Force,121,983jxz,https://www.bloomberg.com/view/articles/2018-08-14/u-s-needs-a-space-force-and-a-cyber-force,29,1534551022.0,,2018-08-18 10:10:22
723,Stolen credit card data website ironically hacked - Software Testing News,120,dj7lhf,https://www.softwaretestingnews.co.uk/stolen-credit-card-data-website-ironically-hacked/,6,1571353259.0,,2019-10-18 10:00:59
724,Cybersecurity firm finds more spyware hidden in Chinese tax software,118,hrnlb7,https://www.nbcnews.com/politics/national-security/cybersecurity-firm-finds-more-spyware-hidden-chinese-tax-software-n1233662,10,1594848682.0,,2020-07-16 07:31:22
725,Free cram guide to CompTIA CySA+ until July 12th in kindle store,118,hnubda,https://www.amazon.com/dp/B08CGNSJT5/ref=cm_sw_r_cp_awdb_t1_bENbFb4WT0ZBT,11,1594288217.0,,2020-07-09 19:50:17
726,The Ransomware of Things,123,ex8y7a,https://i.redd.it/vwvnvojlece41.jpg,8,1580604879.0,,2020-02-02 11:54:39
727,How Account Takeover Botnets Outsmart Traditional Security Controls,117,g4nyat,https://www.imperva.com/blog/how-account-takeover-botnets-outsmart-traditional-security-controls/,4,1587394565.0,,2020-04-21 00:56:05
728,"Free Comptia Security+, Linux fundamentals Training",120,g09tfm,https://www.reddit.com/r/cybersecurity/comments/g09tfm/free_comptia_security_linux_fundamentals_training/,19,1586772972.0,"Came across this info on free Comptia Security+ traininig by Sari Greene, Linux fundamentals. Provided by Pearsonadvance. Looks they are having other paid/ free courses also. Thought it is helpful to someone.

https://pearsonadvance.com/courses/comptia-security-sy0-501/

https://pearsonadvance.com/courses/linux-fundamentals/",2020-04-13 20:16:12
729,Self education,117,eueukh,https://www.reddit.com/r/cybersecurity/comments/eueukh/self_education/,42,1580109332.0,"I’m looking to further educate myself in this area. I have my basic knowledge from school but I had to stop cause of personal reasons. For now going back to school is not possible but I do want to keep learning. I was wondering if there where any suggestions for online platforms to learn on.


[edited]
I have decided to go with a course on Udemy by the cyber mentor. There was a 60% deal on the course and many other courses. 
Thank you all for the advice !",2020-01-27 18:15:32
730,"New Wannacry-like vulnerability found; Microsoft releases patches for WinXP, 7, and 2003",120,bomo92,https://krebsonsecurity.com/2019/05/microsoft-patches-wormable-flaw-in-windows-xp-7-and-windows-2003/,20,1557887586.0,,2019-05-15 12:33:06
731,Cybersecurity for Beginners Books,119,b2wsfq,https://www.reddit.com/r/cybersecurity/comments/b2wsfq/cybersecurity_for_beginners_books/,14,1553027216.0,"Hey All,

I wanted to create a kind of book guide for new or current people looking to get into the field or expand their horizon with some books you’ve found extremely useful or relevant. My question to you all is what are some great starter books that open the door to cybersecurity and/or what are some great books that expanded your understanding of cybersecurity? Thank you all in advance for your assistance.",2019-03-20 07:26:56
732,"Hello, I'm creating a cyber security fundamentals course for people who are looking to get into the industry. Please check out the first video on blue teams!",117,9ww6dz,https://www.youtube.com/watch?v=kHLbmmPBBCg,9,1542193846.0,,2018-11-14 22:10:46
733,Exploit code for wormable flaw on unpatched Windows devices published online,119,gyaasu,https://arstechnica.com/information-technology/2020/06/exploiting-wormable-flaw-on-unpatched-windows-devices-is-about-to-get-easier/,2,1591556529.0,,2020-06-08 05:02:09
734,Intro to Cybersecurity (x-post r/funny),117,eq1js2,https://i.redd.it/xwr0mphjlbb41.jpg,0,1579302515.0,,2020-01-18 10:08:35
735,"ToTok, a popular Emirati messaging app that has been downloaded to millions of phones, is actually a spying tool used by the government of the United Arab Emirates to try to track every conversation, movement, relationship, appointment, sound and image of those who install it.",119,eedorm,https://www.nytimes.com/2019/12/22/us/politics/totok-app-uae.html?searchResultPosition=1,3,1577094312.0,,2019-12-23 20:45:12
736,"Monroe College Hit With Ransomware, $2 Million Demanded",117,ccdx7n,https://www.bleepingcomputer.com/news/security/monroe-college-hit-with-ransomware-2-million-demanded/,12,1562981559.0,,2019-07-13 11:32:39
