,topic,subreddit,title,score,id,url,created,body
297,cybersecurity,CybSecTIA,Hackers Deliver Banking Malware Through Password Protected ZIP File URL #infosec #cybersecurity,2,b6tvtk,https://www.reddit.com/r/CybSecTIA/comments/b6tvtk/hackers_deliver_banking_malware_through_password/,2019-03-29 17:33:07,"Hackers Deliver Banking Malware Through Password Protected ZIP File [URL    (@AHCybSec) [March 29, 2019](URL from Twitter @AHCybSec"
298,cybersecurity,CybSecTIA,Can a VPN keep you safe from 36 new 4G LTE security vulnerabilities? URL #infosec #cybersecurity,2,b6tvtn,https://www.reddit.com/r/CybSecTIA/comments/b6tvtn/can_a_vpn_keep_you_safe_from_36_new_4g_lte/,2019-03-29 17:33:08,"Can a VPN keep you safe from 36 new 4G LTE security vulnerabilities? [URL    (@AHCybSec) [March 29, 2019](URL from Twitter @AHCybSec"
299,cybersecurity,CybSecTIA,How @Microsoft found a @Huawei driver that opened systems to attack. Monitoring systems were looking for attacks using technique popularized by the NSA. #infosec #cybersecurity URL,2,b6w3oq,https://www.reddit.com/r/CybSecTIA/comments/b6w3oq/how_microsoft_found_a_huawei_driver_that_opened/,2019-03-29 22:28:11,"How [@Microsoft](URL found a [@Huawei](URL driver that opened systems to attack. Monitoring systems were looking for attacks using technique popularized by the NSA.[#infosec](URL    (@AHCybSec) [March 29, 2019](URL from Twitter @AHCybSec"
300,cybersecurity,CybSecTIA,IoT Attacks Escalating with a 217.5% Increase in Volume URL #infosec #cybersecurity,2,b6yo9e,https://www.reddit.com/r/CybSecTIA/comments/b6yo9e/iot_attacks_escalating_with_a_2175_increase_in/,2019-03-30 02:28:33,"IoT Attacks Escalating with a 217.5% Increase in Volume [URL    (@AHCybSec) [March 29, 2019](URL from Twitter @AHCybSec"
301,cybersecurity,CybSecTIA,Medical Weed Dispensary Exposes Health Data for Thousands URL #infosec #cybersecurity,2,b7bmaq,https://www.reddit.com/r/CybSecTIA/comments/b7bmaq/medical_weed_dispensary_exposes_health_data_for/,2019-03-31 01:03:58,"Medical Weed Dispensary Exposes Health Data for Thousands [URL    (@AHCybSec) [March 30, 2019](URL from Twitter @AHCybSec"
302,cybersecurity,CybSecTIA,Women are increasingly climbing the cybersecurity leadership ladder. #infosec #cybersecurity @WoSECtweets @NathCybSec URL,1,b8ugxj,https://www.reddit.com/r/CybSecTIA/comments/b8ugxj/women_are_increasingly_climbing_the_cybersecurity/,2019-04-03 17:34:18,"Women are increasingly climbing the cybersecurity leadership ladder.[#infosec](URL    (@AHCybSec) [April 3, 2019](URL from Twitter @AHCybSec"
303,cybersecurity,CybSecTIA,Over 540 million Facebook records found on exposed AWS servers URL #infosec #cybersecurity,1,b94aai,https://www.reddit.com/r/CybSecTIA/comments/b94aai/over_540_million_facebook_records_found_on/,2019-04-04 08:54:40,"Over 540 million Facebook records found on exposed AWS servers [URL    (@AHCybSec) [April 3, 2019](URL from Twitter @AHCybSec"
304,cybersecurity,CybSecTIA,Les sondes qualifies @ANSSI_FR sont arrives ! #infosec #PDIS #cybersecurity @GATEW4TCHER @thalesgroup URL,1,b9c0nn,https://www.reddit.com/r/CybSecTIA/comments/b9c0nn/les_sondes_qualifiées_anssi_fr_sont_arrivées/,2019-04-04 23:21:34,"Les sondes qualifies [@ANSSI\_FR](URL sont arrives ![#infosec](URL    (@AHCybSec) [April 4, 2019](URL from Twitter @AHCybSec"
305,cybersecurity,CybSecTIA,"Pharmaceutical giant Bayer targeted by cyberattack, threat 'contained' (ZDNet) URL #infosec #cybersecurity",1,b9c7oj,https://www.reddit.com/r/CybSecTIA/comments/b9c7oj/pharmaceutical_giant_bayer_targeted_by/,2019-04-04 23:41:19,"Pharmaceutical giant Bayer targeted by cyberattack, threat 'contained' (ZDNet) [URL    (@AHCybSec) [April 4, 2019](URL from Twitter @AHCybSec"
306,cybersecurity,CybSecTIA,Attackers Shift to Malware-Based Cryptominers URL #infosec #cybersecurity,1,barg85,https://www.reddit.com/r/CybSecTIA/comments/barg85/attackers_shift_to_malwarebased_cryptominers/,2019-04-08 18:54:19,"Attackers Shift to Malware-Based Cryptominers [URL    (@AHCybSec) [April 8, 2019](URL from Twitter @AHCybSec"
307,cybersecurity,CybSecTIA,Payment Card Data Stolen From AeroGrow Website URL #infosec #cybersecurity,1,barg8e,https://www.reddit.com/r/CybSecTIA/comments/barg8e/payment_card_data_stolen_from_aerogrow_website/,2019-04-08 18:54:20,"Payment Card Data Stolen From AeroGrow Website [URL    (@AHCybSec) [April 8, 2019](URL from Twitter @AHCybSec"
308,cybersecurity,CybSecTIA,Most OT Organizations Hit by Damaging Cyberattacks: Survey (SecurityWeek) URL #infosec #cybersecurity,1,bau3h9,https://www.reddit.com/r/CybSecTIA/comments/bau3h9/most_ot_organizations_hit_by_damaging/,2019-04-08 23:55:36,"Most OT Organizations Hit by Damaging Cyberattacks: Survey (SecurityWeek) [URL    (@AHCybSec) [April 8, 2019](URL from Twitter @AHCybSec"
309,cybersecurity,CybSecTIA,Thousands of Temperature Control Systems in Hospitals and Supermarket Affected with a Serious Security Flaw URL #infosec #cybersecurity,1,ap1u69,https://www.reddit.com/r/CybSecTIA/comments/ap1u69/thousands_of_temperature_control_systems_in/,2019-02-10 18:24:04,"Thousands of Temperature Control Systems in Hospitals and Supermarket Affected with a Serious Security Flaw [URL    (@AHCybSec) [February 10, 2019](URL from Twitter @AHCybSec"
310,cybersecurity,CybSecTIA,Mumsnet data #leak: Moaning parents could see other users' privates after cloud migration. #infosec #cybersecurity URL,1,ap76k4,https://www.reddit.com/r/CybSecTIA/comments/ap76k4/mumsnet_data_leak_moaning_parents_could_see_other/,2019-02-11 06:14:08,"Mumsnet data [#leak](URL Moaning parents could see other users' privates after cloud migration.[#infosec](URL    (@AHCybSec) [February 10, 2019](URL from Twitter @AHCybSec"
311,cybersecurity,CybSecTIA,Hackers Launching #Gandcrab #Ransomware via Super Mario Image Using Weaponized Excel Document #infosec #cybersecurity URL,1,apdatf,https://www.reddit.com/r/CybSecTIA/comments/apdatf/hackers_launching_gandcrab_ransomware_via_super/,2019-02-11 17:06:10,"Hackers Launching [#Gandcrab](URL via Super Mario Image Using Weaponized Excel Document[#infosec](URL    (@AHCybSec) [February 11, 2019](URL from Twitter @AHCybSec"
312,cybersecurity,CybSecTIA,Bezos Case Exposes Billionaires' Vulnerability to Hackers URL #infosec #cybersecurity,1,apdd08,https://www.reddit.com/r/CybSecTIA/comments/apdd08/bezos_case_exposes_billionaires_vulnerability_to/,2019-02-11 17:14:11,"Bezos Case Exposes Billionaires' Vulnerability to Hackers [URL    (@AHCybSec) [February 11, 2019](URL from Twitter @AHCybSec"
313,cybersecurity,CybSecTIA,Russia to disconnect from the internet as part of a planned test URL #infosec #cybersecurity,1,apdd0c,https://www.reddit.com/r/CybSecTIA/comments/apdd0c/russia_to_disconnect_from_the_internet_as_part_of/,2019-02-11 17:14:11,"Russia to disconnect from the internet as part of a planned test [URL    (@AHCybSec) [February 11, 2019](URL from Twitter @AHCybSec"
314,cybersecurity,CybSecTIA,Zero trust browsing: Protect your organization from its own users URL #infosec #cybersecurity,1,apdd0p,https://www.reddit.com/r/CybSecTIA/comments/apdd0p/zero_trust_browsing_protect_your_organization/,2019-02-11 17:14:12,"Zero trust browsing: Protect your organization from its own users [URL    (@AHCybSec) [February 11, 2019](URL from Twitter @AHCybSec"
315,cybersecurity,CybSecTIA,SOC First Defense phase  Breaking the Attack Chain URL #infosec #cybersecurity,1,apde7n,https://www.reddit.com/r/CybSecTIA/comments/apde7n/soc_first_defense_phase_breaking_the_attack_chain/,2019-02-11 17:18:24,"SOC First Defense phase  Breaking the Attack Chain [URL    (@AHCybSec) [February 11, 2019](URL from Twitter @AHCybSec"
316,cybersecurity,CybSecTIA,Undercover Spy Exposed in NYC Was 1 of Many (SecurityWeek) URL #infosec #cybersecurity,1,ape3dr,https://www.reddit.com/r/CybSecTIA/comments/ape3dr/undercover_spy_exposed_in_nyc_was_1_of_many/,2019-02-11 19:05:10,"Undercover Spy Exposed in NYC Was 1 of Many (SecurityWeek) [URL    (@AHCybSec) [February 11, 2019](URL from Twitter @AHCybSec"
317,cybersecurity,CybSecTIA,Brave Privacy Browser has a backdoor to remotely inject headers in HTTP requests: HackerNews URL #infosec #cybersecurity,1,apewtw,https://www.reddit.com/r/CybSecTIA/comments/apewtw/brave_privacy_browser_has_a_backdoor_to_remotely/,2019-02-11 21:24:29,"Brave Privacy Browser has a backdoor to remotely inject headers in HTTP requests: HackerNews [URL    (@AHCybSec) [February 11, 2019](URL from Twitter @AHCybSec"
318,cybersecurity,CybSecTIA,Switzerland Launches Bug Bounty Program for E-Voting Systems (SecurityWeek) URL #infosec #cybersecurity,1,apewty,https://www.reddit.com/r/CybSecTIA/comments/apewty/switzerland_launches_bug_bounty_program_for/,2019-02-11 21:24:30,"Switzerland Launches Bug Bounty Program for E-Voting Systems (SecurityWeek) [URL    (@AHCybSec) [February 11, 2019](URL from Twitter @AHCybSec"
319,cybersecurity,CybSecTIA,Ericsson lance une offre pour les rseaux de communications haut dbit critiques URL #infosec #cybersecurity,1,apewu0,https://www.reddit.com/r/CybSecTIA/comments/apewu0/ericsson_lance_une_offre_pour_les_réseaux_de/,2019-02-11 21:24:31,"Ericsson lance une offre pour les rseaux de communications haut dbit critiques [URL    (@AHCybSec) [February 11, 2019](URL from Twitter @AHCybSec"
320,cybersecurity,CybSecTIA,First clipper #malware discovered on Google Play. Cryptocurrency stealers that replace a wallet address in the clipboard are no longer limited to Windows or shady Android app stores #infosec #cybersecurity URL,1,apexx6,https://www.reddit.com/r/CybSecTIA/comments/apexx6/first_clipper_malware_discovered_on_google_play/,2019-02-11 21:29:30,"First clipper [#malware](URL discovered on Google Play. Cryptocurrency stealers that replace a wallet address in the clipboard are no longer limited to Windows or shady Android app stores[#infosec](URL    (@AHCybSec) [February 11, 2019](URL from Twitter @AHCybSec"
321,cybersecurity,CybSecTIA,RGPD : Microsoft contraint de mettre  jour Office Pro Plus aux Pays-Bas URL #infosec #cybersecurity,1,apexxc,https://www.reddit.com/r/CybSecTIA/comments/apexxc/rgpd_microsoft_contraint_de_mettre_à_jour_office/,2019-02-11 21:29:30,"RGPD : Microsoft contraint de mettre  jour Office Pro Plus aux Pays-Bas [URL    (@AHCybSec) [February 11, 2019](URL from Twitter @AHCybSec"
322,cybersecurity,CybSecTIA,McDonalds app users hatin it after being hacked by hungry hamburglars URL #infosec #cybersecurity,1,apfn2z,https://www.reddit.com/r/CybSecTIA/comments/apfn2z/mcdonalds_app_users_hatin_it_after_being_hacked/,2019-02-11 23:09:57,"McDonalds app users hatin it after being hacked by hungry hamburglars [URL    (@AHCybSec) [February 11, 2019](URL from Twitter @AHCybSec"
323,cybersecurity,CybSecTIA,New TLS encryption-busting attack also impacts the newer TLS 1.3! Researchers discover yet another Bleichenbacher attack variation. #infosec #cybersecurity URL,1,apftp5,https://www.reddit.com/r/CybSecTIA/comments/apftp5/new_tls_encryptionbusting_attack_also_impacts_the/,2019-02-11 23:34:18,"New TLS encryption-busting attack also impacts the newer TLS 1.3! Researchers discover yet another Bleichenbacher attack variation.[#infosec](URL    (@AHCybSec) [February 11, 2019](URL from Twitter @AHCybSec"
324,cybersecurity,CybSecTIA,Mumsnet Privacy Snafu Exposes User Info URL #infosec #cybersecurity,1,apfv4z,https://www.reddit.com/r/CybSecTIA/comments/apfv4z/mumsnet_privacy_snafu_exposes_user_info/,2019-02-11 23:39:24,"Mumsnet Privacy Snafu Exposes User Info [URL    (@AHCybSec) [February 11, 2019](URL from Twitter @AHCybSec"
325,cybersecurity,CybSecTIA,ENISA meets OSCE and the National Cyber Security Authority of Greece URL #infosec #cybersecurity,1,api0uz,https://www.reddit.com/r/CybSecTIA/comments/api0uz/enisa_meets_osce_and_the_national_cyber_security/,2019-02-12 03:36:39,"ENISA meets OSCE and the National Cyber Security Authority of Greece [URL    (@AHCybSec) [February 11, 2019](URL from Twitter @AHCybSec"
326,cybersecurity,CybSecTIA,Microsoft: 70 percent of all security bugs are memory safety issues (ZDNet) URL #infosec #cybersecurity,1,api0v4,https://www.reddit.com/r/CybSecTIA/comments/api0v4/microsoft_70_percent_of_all_security_bugs_are/,2019-02-12 03:36:40,"Microsoft: 70 percent of all security bugs are memory safety issues (ZDNet) [URL    (@AHCybSec) [February 11, 2019](URL from Twitter @AHCybSec"
327,cybersecurity,CybSecTIA,"#Doomsday Docker security hole uncovered A security #vulnerability has been disclosed for a flaw in runc, Docker and Kubernetes' container runtime, which can be used to attack any host system running containers #infosec #cybersecurity URL",1,apknvx,https://www.reddit.com/r/CybSecTIA/comments/apknvx/doomsday_docker_security_hole_uncovered_a/,2019-02-12 07:34:23,"[#Doomsday](URL Docker security hole uncovered A security [#vulnerability](URL has been disclosed for a flaw in runc, Docker and Kubernetes' container runtime, which can be used to attack any host system running containers[#infosec](URL    (@AHCybSec) [February 11, 2019](URL from Twitter @AHCybSec"
328,cybersecurity,CybSecTIA,Adobe Reader Zero-Day Micropatch Stops Malicious PDFs from Calling Home URL #infosec #cybersecurity,1,apknw2,https://www.reddit.com/r/CybSecTIA/comments/apknw2/adobe_reader_zeroday_micropatch_stops_malicious/,2019-02-12 07:34:23,"Adobe Reader Zero-Day Micropatch Stops Malicious PDFs from Calling Home [URL    (@AHCybSec) [February 11, 2019](URL from Twitter @AHCybSec"
329,cybersecurity,CybSecTIA,Security Pros Agree Military Should Conduct Offensive Hacking URL #infosec #cybersecurity,1,apkpt6,https://www.reddit.com/r/CybSecTIA/comments/apkpt6/security_pros_agree_military_should_conduct/,2019-02-12 07:39:14,"Security Pros Agree Military Should Conduct Offensive Hacking [URL    (@AHCybSec) [February 11, 2019](URL from Twitter @AHCybSec"
330,cybersecurity,CybSecTIA,OkCupid Users Victims of Credential Stuffing URL #infosec #cybersecurity,1,apkptc,https://www.reddit.com/r/CybSecTIA/comments/apkptc/okcupid_users_victims_of_credential_stuffing/,2019-02-12 07:39:14,"OkCupid Users Victims of Credential Stuffing [URL    (@AHCybSec) [February 11, 2019](URL from Twitter @AHCybSec"
331,cybersecurity,CybSecTIA,AWS Issues Alert for Multiple Container Systems URL #infosec #cybersecurity,1,apkptq,https://www.reddit.com/r/CybSecTIA/comments/apkptq/aws_issues_alert_for_multiple_container_systems/,2019-02-12 07:39:15,"AWS Issues Alert for Multiple Container Systems [URL    (@AHCybSec) [February 11, 2019](URL from Twitter @AHCybSec"
332,cybersecurity,CybSecTIA,Wall Street Journal Columnist Challenges Ethical Hacker to Test the Security of Their Laptops URL #infosec #cybersecurity,1,apl3zm,https://www.reddit.com/r/CybSecTIA/comments/apl3zm/wall_street_journal_columnist_challenges_ethical/,2019-02-12 08:14:22,"Wall Street Journal Columnist Challenges Ethical Hacker to Test the Security of Their Laptops [URL    (@AHCybSec) [February 11, 2019](URL from Twitter @AHCybSec"
333,cybersecurity,CybSecTIA,"Blue Monday in infosec: 620 million accounts across 16 hacked websites now for sale on dark web, seller boasts URL #infosec #cybersecurity",1,apqupp,https://www.reddit.com/r/CybSecTIA/comments/apqupp/blue_monday_in_infosec_620_million_accounts/,2019-02-12 18:33:11,"Blue Monday in infosec: 620 million accounts across 16 hacked websites now for sale on dark web, seller boasts [URL    (@AHCybSec) [February 12, 2019](URL from Twitter @AHCybSec"
334,cybersecurity,CybSecTIA,Cyberattacks can cost APAC healthcare firms $23.3M URL #infosec #cybersecurity,1,apqups,https://www.reddit.com/r/CybSecTIA/comments/apqups/cyberattacks_can_cost_apac_healthcare_firms_233m/,2019-02-12 18:33:11,"Cyberattacks can cost APAC healthcare firms $23.3M [URL    (@AHCybSec) [February 12, 2019](URL from Twitter @AHCybSec"
335,cybersecurity,CybSecTIA,"2019s Hottest, and Most Bankable, Security Certs URL #infosec #cybersecurity",1,apqw1z,https://www.reddit.com/r/CybSecTIA/comments/apqw1z/2019s_hottest_and_most_bankable_security_certs/,2019-02-12 18:38:42,"2019s Hottest, and Most Bankable, Security Certs [URL    (@AHCybSec) [February 12, 2019](URL from Twitter @AHCybSec"
336,cybersecurity,CybSecTIA,88% of UK businesses breached during the last 12 months URL #infosec #cybersecurity,1,apqx5o,https://www.reddit.com/r/CybSecTIA/comments/apqx5o/88_of_uk_businesses_breached_during_the_last_12/,2019-02-12 18:43:17,"88% of UK businesses breached during the last 12 months [URL    (@AHCybSec) [February 12, 2019](URL from Twitter @AHCybSec"
337,cybersecurity,CybSecTIA,RT NathCybSec: URL #cybersecurity #infosecurity,1,apsq6d,https://www.reddit.com/r/CybSecTIA/comments/apsq6d/rt_nathcybsec_httpstcovdalzqrvni_cybersecurity/,2019-02-12 23:13:27,"RT NathCybSec: [URL    (@AHCybSec) [February 12, 2019](URL from Twitter @AHCybSec"
338,cybersecurity,CybSecTIA, Email provider @VFEmail has suffered what the company is calling catastrophic destruction at the hands of an as-yet unknown intruder who trashed all of the companys primary and backup data in the United States. #infosec #cybersecurity URL,1,apw0g0,https://www.reddit.com/r/CybSecTIA/comments/apw0g0/email_provider_vfemail_has_suffered_what_the/,2019-02-13 04:48:18," Email provider [@VFEmail](URL has suffered what the company is calling catastrophic destruction at the hands of an as-yet unknown intruder who trashed all of the companys primary and backup data in the United States.[#infosec](URL    (@AHCybSec) [February 12, 2019](URL from Twitter @AHCybSec"
339,cybersecurity,CybSecTIA,"Symantec acquires Luminate Security, makers of software-defined perimeter technology URL #infosec #cybersecurity",1,apw74w,https://www.reddit.com/r/CybSecTIA/comments/apw74w/symantec_acquires_luminate_security_makers_of/,2019-02-13 05:04:01,"Symantec acquires Luminate Security, makers of software-defined perimeter technology [URL    (@AHCybSec) [February 12, 2019](URL from Twitter @AHCybSec"
340,cybersecurity,CybSecTIA,"A fundamental component of container technologies like #Docker, cri-o, containerd and #Kubernetes contains an important vulnerability that could cause cascading attacks. #infosec #cybersecurity URL",1,apwtj9,https://www.reddit.com/r/CybSecTIA/comments/apwtj9/a_fundamental_component_of_container_technologies/,2019-02-13 05:58:53,"A fundamental component of container technologies like [#Docker](URL cri-o, containerd and [#Kubernetes](URL contains an important vulnerability that could cause cascading attacks.[#infosec](URL    (@AHCybSec) [February 12, 2019](URL from Twitter @AHCybSec"
341,cybersecurity,CybSecTIA,OPM Awards $416M Contract for Protection Services to Hack Victims URL #infosec #cybersecurity,1,apwtji,https://www.reddit.com/r/CybSecTIA/comments/apwtji/opm_awards_416m_contract_for_protection_services/,2019-02-13 05:58:53,"OPM Awards $416M Contract for Protection Services to Hack Victims [URL    (@AHCybSec) [February 12, 2019](URL from Twitter @AHCybSec"
342,cybersecurity,CybSecTIA,"Introducing PAN-OS 9.0: Stop Threats Hiding in DNS, Close Security Gaps URL #infosec #cybersecurity",1,apx1us,https://www.reddit.com/r/CybSecTIA/comments/apx1us/introducing_panos_90_stop_threats_hiding_in_dns/,2019-02-13 06:18:50,"Introducing PAN-OS 9.0: Stop Threats Hiding in DNS, Close Security Gaps [URL    (@AHCybSec) [February 12, 2019](URL from Twitter @AHCybSec"
343,cybersecurity,CybSecTIA,Cyber criminals increasingly used 'formjacking' to carry out attacks in 2018: study URL #infosec #cybersecurity,1,aq3i1u,https://www.reddit.com/r/CybSecTIA/comments/aq3i1u/cyber_criminals_increasingly_used_formjacking_to/,2019-02-13 17:13:28,"Cyber criminals increasingly used 'formjacking' to carry out attacks in 2018: study [URL    (@AHCybSec) [February 13, 2019](URL from Twitter @AHCybSec"
344,cybersecurity,CybSecTIA,NeuVector adds critical network layer of security to the Istio and Linkerd2 service meshes URL #infosec #cybersecurity,1,aq3i1x,https://www.reddit.com/r/CybSecTIA/comments/aq3i1x/neuvector_adds_critical_network_layer_of_security/,2019-02-13 17:13:29,"NeuVector adds critical network layer of security to the Istio and Linkerd2 service meshes [URL    (@AHCybSec) [February 13, 2019](URL from Twitter @AHCybSec"
345,cybersecurity,CybSecTIA,Symantec Mobile Threat Defense: Leveraging MTD to Protect Against Hacked Routers URL #infosec #cybersecurity,1,aq3i20,https://www.reddit.com/r/CybSecTIA/comments/aq3i20/symantec_mobile_threat_defense_leveraging_mtd_to/,2019-02-13 17:13:29,"Symantec Mobile Threat Defense: Leveraging MTD to Protect Against Hacked Routers [URL    (@AHCybSec) [February 13, 2019](URL from Twitter @AHCybSec"
346,cybersecurity,CybSecTIA,"Users of the photography site #500px will need to reset their passwords, following a breach where an attacker was able to take ""partial user data"" from July 5 last year. #infosec #cybersecurity #databreach URL",1,aq3i24,https://www.reddit.com/r/CybSecTIA/comments/aq3i24/users_of_the_photography_site_500px_will_need_to/,2019-02-13 17:13:30,"Users of the photography site [#500px](URL will need to reset their passwords, following a breach where an attacker was able to take ""partial user data"" from July 5 last year.[#infosec](URL    (@AHCybSec) [February 13, 2019](URL from Twitter @AHCybSec"
347,cybersecurity,CybSecTIA,Googlebot or a DDoS Attack? URL #infosec #cybersecurity,1,aq3jfd,https://www.reddit.com/r/CybSecTIA/comments/aq3jfd/googlebot_or_a_ddos_attack_httpstcosx4x6hefjk/,2019-02-13 17:18:16,"Googlebot or a DDoS Attack? [URL    (@AHCybSec) [February 13, 2019](URL from Twitter @AHCybSec"
348,cybersecurity,CybSecTIA,Dirty Sock vulnerability lets attackers gain root access on Linux systems URL #infosec #cybersecurity,1,aq3jff,https://www.reddit.com/r/CybSecTIA/comments/aq3jff/dirty_sock_vulnerability_lets_attackers_gain_root/,2019-02-13 17:18:16,"Dirty Sock vulnerability lets attackers gain root access on Linux systems [URL    (@AHCybSec) [February 13, 2019](URL from Twitter @AHCybSec"
349,cybersecurity,CybSecTIA,"Up to 100,000 Reported Affected in Landmark White Data Breach URL #infosec #cybersecurity",1,aq3jfm,https://www.reddit.com/r/CybSecTIA/comments/aq3jfm/up_to_100000_reported_affected_in_landmark_white/,2019-02-13 17:18:17,"Up to 100,000 Reported Affected in Landmark White Data Breach [URL    (@AHCybSec) [February 13, 2019](URL from Twitter @AHCybSec"
350,cybersecurity,CybSecTIA,Healthcare email fraud: Attack attempts jump 473% over two years URL #infosec #cybersecurity,1,aq40yg,https://www.reddit.com/r/CybSecTIA/comments/aq40yg/healthcare_email_fraud_attack_attempts_jump_473/,2019-02-13 18:23:20,"Healthcare email fraud: Attack attempts jump 473% over two years [URL    (@AHCybSec) [February 13, 2019](URL from Twitter @AHCybSec"
351,cybersecurity,CybSecTIA,"#COMCYBER  Nous ne pouvons pas aujourdhui anticiper une attaque sur Internet si nous ne travaillons pas efficacement avec nos partenaires , rappelait rcemment le gnral Olivier Bonnet de Paillerets. #infosec #cybersecurity URL",1,aq41zt,https://www.reddit.com/r/CybSecTIA/comments/aq41zt/comcyber_nous_ne_pouvons_pas_aujourdhui_anticiper/,2019-02-13 18:27:36,"[#COMCYBER](URL  Nous ne pouvons pas aujourdhui anticiper une attaque sur Internet si nous ne travaillons pas efficacement avec nos partenaires , rappelait rcemment le gnral Olivier Bonnet de Paillerets.[#infosec](URL    (@AHCybSec) [February 13, 2019](URL from Twitter @AHCybSec"
352,cybersecurity,CybSecTIA,Fake Blockchain authentication update delivers Dark Comet RAT URL #infosec #cybersecurity,1,aq9ji4,https://www.reddit.com/r/CybSecTIA/comments/aq9ji4/fake_blockchain_authentication_update_delivers/,2019-02-14 05:13:32,"Fake Blockchain authentication update delivers Dark Comet RAT [URL    (@AHCybSec) [February 13, 2019](URL from Twitter @AHCybSec"
353,cybersecurity,CybSecTIA,The Costs of Cyberattacks Are Real URL #infosec #cybersecurity,1,aq9ji9,https://www.reddit.com/r/CybSecTIA/comments/aq9ji9/the_costs_of_cyberattacks_are_real/,2019-02-14 05:13:33,"The Costs of Cyberattacks Are Real [URL    (@AHCybSec) [February 13, 2019](URL from Twitter @AHCybSec"
354,cybersecurity,CybSecTIA,Qualys s'associe  IBM X-Force Red pour automatiser la hirarchisation et la correction des vulnrabilits URL #infosec #cybersecurity,1,aq9jii,https://www.reddit.com/r/CybSecTIA/comments/aq9jii/qualys_sassocie_à_ibm_xforce_red_pour_automatiser/,2019-02-14 05:13:34,"Qualys s'associe  IBM X-Force Red pour automatiser la hirarchisation et la correction des vulnrabilits [URL    (@AHCybSec) [February 13, 2019](URL from Twitter @AHCybSec"
355,cybersecurity,CybSecTIA,"Bank of Valletta which accounts for almost half of Maltas banking transactions, had to shut down all of its operations on Wednesday after hackers broke into its systems and shifted funds overseas. #infosec #cybersecurity URL",1,aq9jim,https://www.reddit.com/r/CybSecTIA/comments/aq9jim/bank_of_valletta_which_accounts_for_almost_half/,2019-02-14 05:13:34,"Bank of Valletta which accounts for almost half of Maltas banking transactions, had to shut down all of its operations on Wednesday after hackers broke into its systems and shifted funds overseas.[#infosec](URL    (@AHCybSec) [February 13, 2019](URL from Twitter @AHCybSec"
356,cybersecurity,CybSecTIA,A critical #vulnerability in popular #WordPress plugin Simple Social Buttons enables non-admin users to modify WordPress installation options  and ultimately take over websites. #infosec #cybersecurity URL,1,aq9ndy,https://www.reddit.com/r/CybSecTIA/comments/aq9ndy/a_critical_vulnerability_in_popular_wordpress/,2019-02-14 05:23:15,"A critical [#vulnerability](URL in popular [#WordPress](URL plugin Simple Social Buttons enables non-admin users to modify WordPress installation options  and ultimately take over websites.[#infosec](URL    (@AHCybSec) [February 13, 2019](URL from Twitter @AHCybSec"
