,topic,subreddit,title,score,id,url,created,body
96,cybersecurity,CybSecTIA, @CheckPointSW Security researchers find that DSLR cameras are vulnerable to #ransomware attacks. Canon has already issued a security advisory and firmware patch for the vulnerability! #infosec #cybersecurity URL,1,cp9asu,https://www.reddit.com/r/CybSecTIA/comments/cp9asu/checkpointsw_security_researchers_find_that_dslr/,2019-08-12 17:58:36,"[@CheckPointSW](URL Security researchers find that DSLR cameras are vulnerable to [#ransomware](URL attacks. Canon has already issued a security advisory and firmware patch for the vulnerability![#infosec](URL    (@AHCybSec) [August 12, 2019](URL URL from Twitter @AHCybSec"
97,cybersecurity,CybSecTIA,"A database reportedly containing 6,840,339 unique user accounts from the recent StockX data breach is being sold and distributed online. #infosec #cybersecurity #databreach URL",1,cp9at2,https://www.reddit.com/r/CybSecTIA/comments/cp9at2/a_database_reportedly_containing_6840339_unique/,2019-08-12 17:58:36,"A database reportedly containing 6,840,339 unique user accounts from the recent StockX data breach is being sold and distributed online.[#infosec](URL    (@AHCybSec) [August 12, 2019](URL URL from Twitter @AHCybSec"
98,cybersecurity,CybSecTIA,"AT&amp;T, T-Mobile, Sprint, Verizon Blasted For Data Privacy Policies. A U.S. senator is giving the four telecommunications companies until Sept. 4 to outline how they plan to better protect customer data privacy. #infosec #cybersecurity #privacy URL",1,cpk1nb,https://www.reddit.com/r/CybSecTIA/comments/cpk1nb/att_tmobile_sprint_verizon_blasted_for_data/,2019-08-13 08:53:08,"AT&amp;T, T-Mobile, Sprint, Verizon Blasted For Data Privacy Policies. A U.S. senator is giving the four telecommunications companies until Sept. 4 to outline how they plan to better protect customer data privacy.[#infosec](URL    (@AHCybSec) [August 12, 2019](URL URL from Twitter @AHCybSec"
99,cybersecurity,CybSecTIA,"On Tuesday, Netflix, working in conjunction with Google and CERT/CC, published a security advisory covering a series of vulnerabilities that enable denial of service attacks against servers running HTTP/2 services. #infosec #cybersecurity URL",1,cq7uq5,https://www.reddit.com/r/CybSecTIA/comments/cq7uq5/on_tuesday_netflix_working_in_conjunction_with/,2019-08-14 20:33:34,"On Tuesday, Netflix, working in conjunction with Google and CERT/CC, published a security advisory covering a series of vulnerabilities that enable denial of service attacks against servers running HTTP/2 services.[#infosec](URL    (@AHCybSec) [August 14, 2019](URL URL from Twitter @AHCybSec"
100,cybersecurity,CybSecTIA," Led by internet privacy researchers Noam Rotem and Ran Locar, vpnMentors team recently discovered a huge data breach in security platform BioStar 2. #infosec #cybersecurity #databreach #privacy URL",1,cr5q53,https://www.reddit.com/r/CybSecTIA/comments/cr5q53/led_by_internet_privacy_researchers_noam_rotem/,2019-08-16 22:33:05," Led by internet privacy researchers Noam Rotem and Ran Locar, vpnMentors team recently discovered a huge data breach in security platform BioStar 2.[#infosec](URL    (@AHCybSec) [August 16, 2019](URL URL from Twitter @AHCybSec"
101,cybersecurity,CybSecTIA,Microsoft security researchers discovered an unusual phishing campaign which employs custom 404 error pages to trick potential victims into handing out their Microsoft credentials. #infosec #cybersecurity URL,1,cr8rqa,https://www.reddit.com/r/CybSecTIA/comments/cr8rqa/microsoft_security_researchers_discovered_an/,2019-08-17 02:28:43,"Microsoft security researchers discovered an unusual phishing campaign which employs custom 404 error pages to trick potential victims into handing out their Microsoft credentials.[#infosec](URL    (@AHCybSec) [August 16, 2019](URL URL from Twitter @AHCybSec"
102,cybersecurity,CybSecTIA,#Facebook delivers clear history tool that doesnt clear anything.  Via @SophosFrance #infosec #cybersecurity #privacy URL,1,ctw4bc,https://www.reddit.com/r/CybSecTIA/comments/ctw4bc/facebook_delivers_clear_history_tool_that_doesnt/,2019-08-22 21:32:37,"[#Facebook](URL delivers clear history tool that doesnt clear anything.  Via [@SophosFrance](URL    (@AHCybSec) [August 22, 2019](URL URL from Twitter @AHCybSec"
103,cybersecurity,CybSecTIA,Movie ticket subscription service #MoviePass has exposed tens of thousands of customer card numbers and personal credit cards because a critical server was not protected with a password. #infosec #cybersecurity #privacy #databreach URL,1,ctw66y,https://www.reddit.com/r/CybSecTIA/comments/ctw66y/movie_ticket_subscription_service_moviepass_has/,2019-08-22 21:37:36,"Movie ticket subscription service [#MoviePass](URL has exposed tens of thousands of customer card numbers and personal credit cards because a critical server was not protected with a password.[#infosec](URL    (@AHCybSec) [August 22, 2019](URL URL from Twitter @AHCybSec"
104,cybersecurity,CybSecTIA,"#Fortnite Hack Warning!  Researchers at cloud security specialists Cyren have uncovered a Fortnite gaming hack, supposedly an aimbot cheat tool, that is really #ransomware in disguise. #Syrk #infosec #cybersecurity #databreach URL",1,ctw83v,https://www.reddit.com/r/CybSecTIA/comments/ctw83v/fortnite_hack_warning_researchers_at_cloud/,2019-08-22 21:42:41,"[#Fortnite](URL Hack Warning!  Researchers at cloud security specialists Cyren have uncovered a Fortnite gaming hack, supposedly an aimbot cheat tool, that is really [#ransomware](URL in disguise.[#Syrk](URL    (@AHCybSec) [August 22, 2019](URL URL from Twitter @AHCybSec"
105,cybersecurity,CybSecTIA,RT @NathCybSec: 1 in 4 employees would steal company information to secure their next job #cybersecurite #CyberSecurity #infosec #infosecurity #cyberattacks URL,1,cwhcn0,https://www.reddit.com/r/CybSecTIA/comments/cwhcn0/rt_nathcybsec_1_in_4_employees_would_steal/,2019-08-28 17:19:12,"1 in 4 employees would steal company information to secure their next job[#cybersecurite](URL  NathCybSec (@NathCybSec) [August 28, 2019](URL URL from Twitter @AHCybSec"
106,cybersecurity,CybSecTIA, @Mastercard has officially notified German and Belgian Data Protection Authorities (DPA) of a data breach involving customer data from the company`s Priceless Specials loyalty program. #infosec #cybersecurity #databreach URL,1,cwq4vq,https://www.reddit.com/r/CybSecTIA/comments/cwq4vq/mastercard_has_officially_notified_german_and/,2019-08-29 06:11:20,"[@Mastercard](URL has officially notified German and Belgian Data Protection Authorities (DPA) of a data breach involving customer data from the company`s Priceless Specials loyalty program.[#infosec](URL    (@AHCybSec) [August 28, 2019](URL URL from Twitter @AHCybSec"
107,cybersecurity,CybSecTIA," @Imperva has revealed a security incident which exposed sensitive data, including API keys and SSL certificates. #infosec #databreach #cybersecurity URL",2,cx0bfl,https://www.reddit.com/r/CybSecTIA/comments/cx0bfl/imperva_has_revealed_a_security_incident_which/,2019-08-29 22:36:32,"[@Imperva](URL has revealed a security incident which exposed sensitive data, including API keys and SSL certificates.[#infosec](URL    (@AHCybSec) [August 29, 2019](URL URL from Twitter @AHCybSec"
108,cybersecurity,CybSecTIA, A Russian security researcher has found that hardware equipment meant to be used by Russian authorities to intercept internet traffic had been leaving data exposed on the internet. #infosec #cybersecurity #privacy #databreach URL,2,cydgtv,https://www.reddit.com/r/CybSecTIA/comments/cydgtv/a_russian_security_researcher_has_found_that/,2019-09-02 04:19:15," A Russian security researcher has found that hardware equipment meant to be used by Russian authorities to intercept internet traffic had been leaving data exposed on the internet.[#infosec](URL    (@AHCybSec) [September 1, 2019](URL URL from Twitter @AHCybSec"
109,cybersecurity,CybSecTIA," Unknown third-parties gained unauthorized access to #Foxit data systems and accessed ""My Account"" registered users' data, including email addresses, passwords, users' names, phone numbers, company names... #infosec #cybersecurity #privacy #databreach URL",1,cyet5b,https://www.reddit.com/r/CybSecTIA/comments/cyet5b/unknown_thirdparties_gained_unauthorized_access/,2019-09-02 06:03:51," Unknown third-parties gained unauthorized access to [#Foxit](URL data systems and accessed ""My Account"" registered users' data, including email addresses, passwords, users' names, phone numbers, company names...[#infosec](URL    (@AHCybSec) [September 1, 2019](URL URL from Twitter @AHCybSec"
110,cybersecurity,CybSecTIA, Anubis Android banking malware returns with extensive financial app hit list. Thousands of new samples are targeting 188 banking and finance-related apps. #infosec #cybersecurity URL,1,caz4g2,https://www.reddit.com/r/CybSecTIA/comments/caz4g2/anubis_android_banking_malware_returns_with/,2019-07-09 20:31:36," Anubis Android banking malware returns with extensive financial app hit list. Thousands of new samples are targeting 188 banking and finance-related apps.[#infosec](URL    (@AHCybSec) [July 9, 2019](URL URL from Twitter @AHCybSec"
111,cybersecurity,CybSecTIA,"Boooom  The ICO has announced an intention to fine Marriott International 99m for infringements of the #GDPR, relating to an incident which saw approximately 339 million guest records exposed globally. #infosec #cybersecurity #privacy URL",1,cb3ube,https://www.reddit.com/r/CybSecTIA/comments/cb3ube/boooom_the_ico_has_announced_an_intention_to_fine/,2019-07-10 03:21:19,"Boooom  The ICO has announced an intention to fine Marriott International 99m for infringements of the [#GDPR](URL relating to an incident which saw approximately 339 million guest records exposed globally.[#infosec](URL    (@AHCybSec) [July 9, 2019](URL URL from Twitter @AHCybSec"
112,cybersecurity,CybSecTIA, GE Aviation exposed internal configs via open Jenkins instance! #infosec #cybersecurity #databreach URL,1,cb3ubm,https://www.reddit.com/r/CybSecTIA/comments/cb3ubm/ge_aviation_exposed_internal_configs_via_open/,2019-07-10 03:21:20," GE Aviation exposed internal configs via open Jenkins instance![#infosec](URL    (@AHCybSec) [July 9, 2019](URL URL from Twitter @AHCybSec"
113,cybersecurity,CybSecTIA,"   The United States Coast Guard has sent out two security alerts over the course of the last three months, highlighting a problem with the cybersecurity practices aboard commercial sea vessels. #infosec #cybersecurity URL",1,cb3z5u,https://www.reddit.com/r/CybSecTIA/comments/cb3z5u/the_united_states_coast_guard_has_sent_out_two/,2019-07-10 03:31:30,"   The United States Coast Guard has sent out two security alerts over the course of the last three months, highlighting a problem with the cybersecurity practices aboard commercial sea vessels.[#infosec](URL    (@AHCybSec) [July 9, 2019](URL URL from Twitter @AHCybSec"
114,cybersecurity,CybSecTIA," Two SAMBA vulnerabilities can be leveraged separately to crash the LDAP and the RPC server processes in Samba Active Directory Domain Controller, supported since version 4.0 of the software. #infosec #cybersecurity URL",1,cbd1nf,https://www.reddit.com/r/CybSecTIA/comments/cbd1nf/two_samba_vulnerabilities_can_be_leveraged/,2019-07-10 16:21:18," Two SAMBA vulnerabilities can be leveraged separately to crash the LDAP and the RPC server processes in Samba Active Directory Domain Controller, supported since version 4.0 of the software.[#infosec](URL    (@AHCybSec) [July 10, 2019](URL URL from Twitter @AHCybSec"
115,cybersecurity,CybSecTIA, Security researchers have discovered vulnerabilities in two models of hospital anesthesia machines manufactured by General Electric (GE). GE recommends not connecting vulnerable anesthesia machines to hospital networks. #infosec #cybersecurity URL,1,cbd1nn,https://www.reddit.com/r/CybSecTIA/comments/cbd1nn/security_researchers_have_discovered/,2019-07-10 16:21:18," Security researchers have discovered vulnerabilities in two models of hospital anesthesia machines manufactured by General Electric (GE). GE recommends not connecting vulnerable anesthesia machines to hospital networks.[#infosec](URL    (@AHCybSec) [July 10, 2019](URL URL from Twitter @AHCybSec"
116,cybersecurity,CybSecTIA, #LooCipher is a new #ransomware being distributed in the wild. This article will focus on LooCiphers file encryption mechanism and take a look at the possibility of decrypting affected files without paying the ransom. #infosec #cybersecurity URL,1,cbrupm,https://www.reddit.com/r/CybSecTIA/comments/cbrupm/loocipher_is_a_new_ransomware_being_distributed/,2019-07-11 15:36:17," [#LooCipher](URL is a new [#ransomware](URL being distributed in the wild. This article will focus on LooCiphers file encryption mechanism and take a look at the possibility of decrypting affected files without paying the ransom.[#infosec](URL    (@AHCybSec) [July 11, 2019](URL URL from Twitter @AHCybSec"
117,cybersecurity,CybSecTIA,More than 2 million cyber incidents in 2018 created $45 billion in losses URL #infosec #cybersecurity,1,cbss1o,https://www.reddit.com/r/CybSecTIA/comments/cbss1o/more_than_2_million_cyber_incidents_in_2018/,2019-07-11 17:26:34,"More than 2 million cyber incidents in 2018 created $45 billion in losses [URL    (@AHCybSec) [July 11, 2019](URL URL from Twitter @AHCybSec"
118,cybersecurity,CybSecTIA,#Buhtrap group uses zeroday in latest espionage campaigns. @ESET research reveals notorious crime group also conducting espionage campaigns for the past five years. #infosec #cybersecurity URL,2,cbu9hr,https://www.reddit.com/r/CybSecTIA/comments/cbu9hr/buhtrap_group_uses_zeroday_in_latest_espionage/,2019-07-11 20:46:30,"[#Buhtrap](URL group uses zeroday in latest espionage campaigns. [@ESET](URL research reveals notorious crime group also conducting espionage campaigns for the past five years.[#infosec](URL    (@AHCybSec) [July 11, 2019](URL URL from Twitter @AHCybSec"
119,cybersecurity,CybSecTIA,"Genius!  CTRL-ALT-LED technique can exfiltrate data from air-gapped systems using Caps Lock, Num Lock, and Scroll Lock keyboard's LEDs. #infosec #cybersecurity URL",1,cc87cv,https://www.reddit.com/r/CybSecTIA/comments/cc87cv/genius_ctrlaltled_technique_can_exfiltrate_data/,2019-07-12 18:34:23,"Genius!  CTRL-ALT-LED technique can exfiltrate data from air-gapped systems using Caps Lock, Num Lock, and Scroll Lock keyboard's LEDs.[#infosec](URL    (@AHCybSec) [July 12, 2019](URL URL from Twitter @AHCybSec"
120,cybersecurity,CybSecTIA,"@Securonix, the leader in next-gen SIEM, today announced that it has achieved SOC2 + HITRUST Type 2 certification for the Securonix SaaS. #infosec #cybersecurity URL",1,cdv84w,https://www.reddit.com/r/CybSecTIA/comments/cdv84w/securonix_the_leader_in_nextgen_siem_today/,2019-07-16 20:26:18,"[@Securonix](URL the leader in next-gen SIEM, today announced that it has achieved SOC2 + HITRUST Type 2 certification for the Securonix SaaS.[#infosec](URL    (@AHCybSec) [July 16, 2019](URL URL from Twitter @AHCybSec"
121,cybersecurity,CybSecTIA,OpenNIC has voted to drop support for .bit domains after rampant abuse from #malware operators. #infosec #cybersecurity URL,1,ce8t8n,https://www.reddit.com/r/CybSecTIA/comments/ce8t8n/opennic_has_voted_to_drop_support_for_bit_domains/,2019-07-17 15:56:21,"OpenNIC has voted to drop support for .bit domains after rampant abuse from [#malware](URL operators.[#infosec](URL    (@AHCybSec) [July 17, 2019](URL URL from Twitter @AHCybSec"
122,cybersecurity,CybSecTIA,@symantec intros CloudSOC Mirror Gateway for enterprise cloud access security. The platform uses Symantec Web Isolation technology to deliver Cloud Access Security Broker (CASB) controls for unmanaged devices. #infosec #cybersecurity URL,1,ce8t8r,https://www.reddit.com/r/CybSecTIA/comments/ce8t8r/symantec_intros_cloudsoc_mirror_gateway_for/,2019-07-17 15:56:21,"[@symantec](URL intros CloudSOC Mirror Gateway for enterprise cloud access security. The platform uses Symantec Web Isolation technology to deliver Cloud Access Security Broker (CASB) controls for unmanaged devices.[#infosec](URL    (@AHCybSec) [July 17, 2019](URL URL from Twitter @AHCybSec"
123,cybersecurity,CybSecTIA,"Sprint Customers Account Hacked Through Samsung Website. Hackers have accessed the personal associated with the Sprint accounts, that includes phone number, device ID, monthly charges, first and last name, billing address... #infosec #cybersecurity URL",1,ce8v1l,https://www.reddit.com/r/CybSecTIA/comments/ce8v1l/sprint_customers_account_hacked_through_samsung/,2019-07-17 16:01:50,"Sprint Customers Account Hacked Through Samsung Website. Hackers have accessed the personal associated with the Sprint accounts, that includes phone number, device ID, monthly charges, first and last name, billing address...[#infosec](URL    (@AHCybSec) [July 17, 2019](URL URL from Twitter @AHCybSec"
124,cybersecurity,CybSecTIA,A vulnerability in legacy @Iomega and @LenovoEMC network-attached storage (NAS) devices has led to many terabytes of potentially sensitive data being accessible to anyone via the Internet. #infosec #cybersecurity #databreach URL,1,ceat1q,https://www.reddit.com/r/CybSecTIA/comments/ceat1q/a_vulnerability_in_legacy_iomega_and_lenovoemc/,2019-07-17 20:01:57,"A vulnerability in legacy [@Iomega](URL and [@LenovoEMC](URL network-attached storage (NAS) devices has led to many terabytes of potentially sensitive data being accessible to anyone via the Internet.[#infosec](URL    (@AHCybSec) [July 17, 2019](URL URL from Twitter @AHCybSec"
125,cybersecurity,CybSecTIA," 2 years after the #WannaCry #ransomware outbreak shone a light on the computer security of the UKs NHS, and 5 years after MS said it would no longer release patches for WinXP, the NHS still has 2300 PCs running the outdated OS #infosec #cybersecurity URL",1,cev7k8,https://www.reddit.com/r/CybSecTIA/comments/cev7k8/2_years_after_the_wannacry_ransomware_outbreak/,2019-07-19 03:06:24," 2 years after the [#WannaCry](URL outbreak shone a light on the computer security of the UKs NHS, and 5 years after MS said it would no longer release patches for WinXP, the NHS still has 2300 PCs running the outdated OS[#infosec](URL    (@AHCybSec) [July 18, 2019](URL URL from Twitter @AHCybSec"
126,cybersecurity,CybSecTIA," Over 800,000 Systems Still Vulnerable to BlueKeep Attacks! Users and organizations continue to patch the Windows vulnerability tracked as BlueKeep and CVE-2019-0708, but over 800,000 systems are still exposed to attacks. #infosec #cybersecurity URL",1,cewqrw,https://www.reddit.com/r/CybSecTIA/comments/cewqrw/over_800000_systems_still_vulnerable_to_bluekeep/,2019-07-19 05:06:08," Over 800,000 Systems Still Vulnerable to BlueKeep Attacks! Users and organizations continue to patch the Windows vulnerability tracked as BlueKeep and CVE-2019-0708, but over 800,000 systems are still exposed to attacks.[#infosec](URL    (@AHCybSec) [July 18, 2019](URL URL from Twitter @AHCybSec"
127,cybersecurity,CybSecTIA, Half Bulgaria's hacked database is now available on hacking forums and released to local reporters over the last weekend. #infosec #cybersecurity #databreach URL,1,cewqs8,https://www.reddit.com/r/CybSecTIA/comments/cewqs8/half_bulgarias_hacked_database_is_now_available/,2019-07-19 05:06:08," Half Bulgaria's hacked database is now available on hacking forums and released to local reporters over the last weekend.[#infosec](URL    (@AHCybSec) [July 18, 2019](URL URL from Twitter @AHCybSec"
128,cybersecurity,CybSecTIA,Attackers have created a fake Office 365 site that is distributing the #TrickBot password-stealing #Trojan disguised as Chrome and Firefox browser updates. #infosec #cybersecurity URL,1,cez7n9,https://www.reddit.com/r/CybSecTIA/comments/cez7n9/attackers_have_created_a_fake_office_365_site/,2019-07-19 08:23:51,"Attackers have created a fake Office 365 site that is distributing the [#TrickBot](URL password-stealing [#Trojan](URL disguised as Chrome and Firefox browser updates.[#infosec](URL    (@AHCybSec) [July 18, 2019](URL URL from Twitter @AHCybSec"
129,cybersecurity,CybSecTIA,"Vendors too often approach the security problem with a one punch solution. Hackers are not wooden dummies, they fight back, and you have to be ready for the counter-punch, constantly innovating and increasing the cost of attack. #infosec #cybersecurity URL",1,cez7nd,https://www.reddit.com/r/CybSecTIA/comments/cez7nd/vendors_too_often_approach_the_security_problem/,2019-07-19 08:23:51,"Vendors too often approach the security problem with a one punch solution. Hackers are not wooden dummies, they fight back, and you have to be ready for the counter-punch, constantly innovating and increasing the cost of attack.[#infosec](URL    (@AHCybSec) [July 18, 2019](URL URL from Twitter @AHCybSec"
130,cybersecurity,CybSecTIA,"New open source solution reduces the risks associated with cloud deployments. An open source user computer environment (UCE) for the Amazon Cloud, called Galahad, has been launched by the University of Texas at San Antonio (UTSA). #infosec #cybersecurity URL",1,cf3jb3,https://www.reddit.com/r/CybSecTIA/comments/cf3jb3/new_open_source_solution_reduces_the_risks/,2019-07-19 15:26:36,"New open source solution reduces the risks associated with cloud deployments. An open source user computer environment (UCE) for the Amazon Cloud, called Galahad, has been launched by the University of Texas at San Antonio (UTSA).[#infosec](URL    (@AHCybSec) [July 19, 2019](URL URL from Twitter @AHCybSec"
131,cybersecurity,CybSecTIA,RT @CybsecTIA: Infographie  partager ! #infosec #cybersecurity #ThreatIntel URL,1,cgqmvu,https://www.reddit.com/r/CybSecTIA/comments/cgqmvu/rt_cybsectia_infographie_à_partager_infosec/,2019-07-23 20:01:28,"Infographie  partager ![#infosec](URL  CybSec TIA (@CybsecTIA) [July 23, 2019](URL URL from Twitter @AHCybSec"
132,cybersecurity,CybSecTIA,"Tech firms can and must put backdoors in encryption, AG Barr says. He's tired of ""dogmatic announcements that lawful access simply cannot be done."" #infosec #cybersecurity URL",2,cgxyzq,https://www.reddit.com/r/CybSecTIA/comments/cgxyzq/tech_firms_can_and_must_put_backdoors_in/,2019-07-24 06:26:21,"Tech firms can and must put backdoors in encryption, AG Barr says. He's tired of ""dogmatic announcements that lawful access simply cannot be done.""[#infosec](URL    (@AHCybSec) [July 23, 2019](URL URL from Twitter @AHCybSec"
133,cybersecurity,CybSecTIA,New one... Another one...  An ongoing malvertising campaign is exploiting WordPress plugin vulnerabilities to redirect website visitors to malicious pages. #infosec #cybersecurity URL,1,cgy8cd,https://www.reddit.com/r/CybSecTIA/comments/cgy8cd/new_one_another_one_an_ongoing_malvertising/,2019-07-24 06:46:30,"New one... Another one...  An ongoing malvertising campaign is exploiting WordPress plugin vulnerabilities to redirect website visitors to malicious pages.[#infosec](URL    (@AHCybSec) [July 23, 2019](URL URL from Twitter @AHCybSec"
134,cybersecurity,CybSecTIA,"A critical #vulnerability has been found in @PaloAltoNtwks GlobalProtect SSL VPN software used by enterprise companies across the globe, including ride-hailing platform Uber. #infosec #cybersecurity URL",1,ch7jab,https://www.reddit.com/r/CybSecTIA/comments/ch7jab/a_critical_vulnerability_has_been_found_in/,2019-07-24 22:26:40,"A critical [#vulnerability](URL has been found in [@PaloAltoNtwks](URL GlobalProtect SSL VPN software used by enterprise companies across the globe, including ride-hailing platform Uber. [#infosec](URL    (@AHCybSec) [July 24, 2019](URL URL from Twitter @AHCybSec"
135,cybersecurity,CybSecTIA,  #Ransomware incident leaves some Johannesburg residents without electricity Some residents of South Africa's biggest city left without electricity after ransomware hits city power provider. #infosec #cybersecurity URL,1,chnywm,https://www.reddit.com/r/CybSecTIA/comments/chnywm/ransomware_incident_leaves_some_johannesburg/,2019-07-25 23:56:10," [#Ransomware](URL incident leaves some Johannesburg residents without electricity Some residents of South Africa's biggest city left without electricity after ransomware hits city power provider.[#infosec](URL    (@AHCybSec) [July 25, 2019](URL URL from Twitter @AHCybSec"
136,cybersecurity,CybSecTIA,Happy Birthday!  No More Ransom project has prevented ransomware profits of at least $108 million. No More Ransom project is celebrating its three-year birthday today. #infosec #cybersecurity URL,1,ci1g2h,https://www.reddit.com/r/CybSecTIA/comments/ci1g2h/happy_birthday_no_more_ransom_project_has/,2019-07-26 21:02:29,"Happy Birthday!  No More Ransom project has prevented ransomware profits of at least $108 million. No More Ransom project is celebrating its three-year birthday today.[#infosec](URL    (@AHCybSec) [July 26, 2019](URL URL from Twitter @AHCybSec"
137,cybersecurity,CybSecTIA, Maybe the first time I hear that! Louisiana governor declares the state's first cybersecurity state of emergency after a series of attacks against school district systems! #infosec #cybersecurity URL,1,ci3qis,https://www.reddit.com/r/CybSecTIA/comments/ci3qis/maybe_the_first_time_i_hear_that_louisiana/,2019-07-27 00:44:36," Maybe the first time I hear that! Louisiana governor declares the state's first cybersecurity state of emergency after a series of attacks against school district systems! [#infosec](URL    (@AHCybSec) [July 26, 2019](URL URL from Twitter @AHCybSec"
