,topic,subreddit,title,score,id,url,created,body
185,cybersecurity,CybSecTIA," #Backdoor found in Ruby library for checking for strong passwords... Cookie-accepting, eval-running backdoor found in popular Ruby library. #infosec #cybersecurity URL",1,caiba0,https://www.reddit.com/r/CybSecTIA/comments/caiba0/backdoor_found_in_ruby_library_for_checking_for/,2019-07-08 18:15:34,"[#Backdoor](URL found in Ruby library for checking for strong passwords... Cookie-accepting, eval-running backdoor found in popular Ruby library.[#infosec](URL    (@AHCybSec) [July 8, 2019](URL URL from Twitter @AHCybSec"
186,cybersecurity,CybSecTIA," @ESET researchers have discovered a malicious campaign distributing a backdoor via torrents, with Korean TV content used as a lure. #infosec #cybersecurity URL",1,caj5k5,https://www.reddit.com/r/CybSecTIA/comments/caj5k5/eset_researchers_have_discovered_a_malicious/,2019-07-08 20:05:42,"[@ESET](URL researchers have discovered a malicious campaign distributing a backdoor via torrents, with Korean TV content used as a lure.[#infosec](URL    (@AHCybSec) [July 8, 2019](URL URL from Twitter @AHCybSec"
187,cybersecurity,CybSecTIA, Impressive... Docker: more than 20% of the files contained at least one high-risk vulnerability. More than 60% of the top Docker files held a vulnerability that had a Kenna Risk Score above 330. #infosec #cybersecurity URL,1,caoa8r,https://www.reddit.com/r/CybSecTIA/comments/caoa8r/impressive_docker_more_than_20_of_the_files/,2019-07-09 03:46:36," Impressive... Docker: more than 20% of the files contained at least one high-risk vulnerability. More than 60% of the top Docker files held a vulnerability that had a Kenna Risk Score above 330.[#infosec](URL    (@AHCybSec) [July 8, 2019](URL URL from Twitter @AHCybSec"
188,cybersecurity,CybSecTIA,FBI and the U.S. Department of Homeland Security have issued a joint malware analysis report on a new malware strain dubbed ELECTRICFISH and used by the North-Korean APT group Lazarus to exfiltrate data from victims. #infosec #cybersecurity #malware URL,2,bmpbq3,https://www.reddit.com/r/CybSecTIA/comments/bmpbq3/fbi_and_the_us_department_of_homeland_security/,2019-05-10 07:08:44,"FBI and the U.S. Department of Homeland Security have issued a joint malware analysis report on a new malware strain dubbed ELECTRICFISH and used by the North-Korean APT group Lazarus to exfiltrate data from victims.[#infosec](URL    (@AHCybSec) [May 9, 2019](URL from Twitter @AHCybSec"
189,cybersecurity,CybSecTIA,@FidusInfoSec security team identified a huge vulnerability with an extremely common Alarm &amp; GPS device used by vulnerable people around the world. #infosec #cybersecurity #vulnerability URL,1,bmxtwk,https://www.reddit.com/r/CybSecTIA/comments/bmxtwk/fidusinfosec_security_team_identified_a_huge/,2019-05-10 22:44:37,"[@FidusInfoSec](URL security team identified a huge vulnerability with an extremely common Alarm &amp; GPS device used by vulnerable people around the world.[#infosec](URL    (@AHCybSec) [May 10, 2019](URL from Twitter @AHCybSec"
190,cybersecurity,CybSecTIA,SHA-1 collision attacks are now actually practical and a looming danger URL #infosec #cybersecurity,1,bnzo3j,https://www.reddit.com/r/CybSecTIA/comments/bnzo3j/sha1_collision_attacks_are_now_actually_practical/,2019-05-13 15:59:07,"SHA-1 collision attacks are now actually practical and a looming danger [URL    (@AHCybSec) [May 13, 2019](URL from Twitter @AHCybSec"
191,cybersecurity,CybSecTIA," Researchers have found a way to break @Cisco's secure boot process, which could affect millions of devices around the world. #infosec #cybersecurity #vulnerability URL",1,bo8fx4,https://www.reddit.com/r/CybSecTIA/comments/bo8fx4/researchers_have_found_a_way_to_break_ciscos/,2019-05-14 06:04:09," Researchers have found a way to break [@Cisco](URL secure boot process, which could affect millions of devices around the world.[#infosec](URL    (@AHCybSec) [May 13, 2019](URL from Twitter @AHCybSec"
192,cybersecurity,CybSecTIA,It's 2019 and a WhatsApp call can hack a phone: Zero-day exploit infects mobes with Spyware. Ban #whatsapp! Install @telegram or @signalapp #infosec #cybersecurity #privacy #databreach #0day URL,2,bodvay,https://www.reddit.com/r/CybSecTIA/comments/bodvay/its_2019_and_a_whatsapp_call_can_hack_a_phone/,2019-05-14 14:02:34,"It's 2019 and a WhatsApp call can hack a phone: Zero-day exploit infects mobes with Spyware. Ban [#whatsapp](URL Install [@telegram](URL or [@signalapp](URL    (@AHCybSec) [May 14, 2019](URL from Twitter @AHCybSec"
193,cybersecurity,CybSecTIA,@Bitdefender researchers uncovered a new severe vulnerability on several @intel CPU microarchitectures. #infosec #cybersecurity #vulnerability URL,1,bovspe,https://www.reddit.com/r/CybSecTIA/comments/bovspe/bitdefender_researchers_uncovered_a_new_severe/,2019-05-15 19:34:25,"[@Bitdefender](URL researchers uncovered a new severe vulnerability on several [@intel](URL CPU microarchitectures.[#infosec](URL    (@AHCybSec) [May 15, 2019](URL from Twitter @AHCybSec"
194,cybersecurity,CybSecTIA,Leak reveals Ubers $9.99 unlimited delivery Eats Pass URL #infosec #cybersecurity,1,brm4cv,https://www.reddit.com/r/CybSecTIA/comments/brm4cv/leak_reveals_ubers_999_unlimited_delivery_eats/,2019-05-22 18:26:19,"Leak reveals Ubers $9.99 unlimited delivery Eats Pass [URL    (@AHCybSec) [May 22, 2019](URL from Twitter @AHCybSec"
195,cybersecurity,CybSecTIA,Bug-hunter reveals another 'make me admin' Windows 10 zero-day and vows: 'There's more where that came from' (The Register) URL #infosec #cybersecurity,2,brm4cx,https://www.reddit.com/r/CybSecTIA/comments/brm4cx/bughunter_reveals_another_make_me_admin_windows/,2019-05-22 18:26:19,"Bug-hunter reveals another 'make me admin' Windows 10 zero-day and vows: 'There's more where that came from' (The Register) [URL    (@AHCybSec) [May 22, 2019](URL from Twitter @AHCybSec"
196,cybersecurity,CybSecTIA,Google Stored G Suite Users' Passwords in Plain-Text for 14 Years URL #infosec #cybersecurity,2,brm6h2,https://www.reddit.com/r/CybSecTIA/comments/brm6h2/google_stored_g_suite_users_passwords_in/,2019-05-22 18:34:50,"Google Stored G Suite Users' Passwords in Plain-Text for 14 Years [URL    (@AHCybSec) [May 22, 2019](URL from Twitter @AHCybSec"
197,cybersecurity,CybSecTIA,"@ANSSI_FR dvoile, dans le cadre la confrence Ready for IT, un disque dur chiffrant les donnes. Baptis #WooKey ce projet tait en dveloppement dans les laboratoires de lAnssi depuis 2014. #Infosec #cybersecurity URL",2,brm6h4,https://www.reddit.com/r/CybSecTIA/comments/brm6h4/anssi_fr_dévoile_dans_le_cadre_la_conférence/,2019-05-22 18:34:50,"[@ANSSI\_FR](URL dvoile, dans le cadre la confrence Ready for IT, un disque dur chiffrant les donnes. Baptis [#WooKey](URL ce projet tait en dveloppement dans les laboratoires de lAnssi depuis 2014.[#Infosec](URL    (@AHCybSec) [May 22, 2019](URL from Twitter @AHCybSec"
198,cybersecurity,CybSecTIA,"Denis Kessler (Scor) :  Le risque cyber, aussi important que le risque de catastrophes naturelles  #infosec #cybersecurity #risk URL",2,brn2ag,https://www.reddit.com/r/CybSecTIA/comments/brn2ag/denis_kessler_scor_le_risque_cyber_aussi/,2019-05-22 20:31:13,"Denis Kessler (Scor) :  Le risque cyber, aussi important que le risque de catastrophes naturelles [#infosec](URL    (@AHCybSec) [May 22, 2019](URL from Twitter @AHCybSec"
199,cybersecurity,CybSecTIA,"Less than 24h after publicly disclosing an unpatched 0day vulnerability in Windows 10, the anonymous hacker has now dropped new exploits for two more unpatched Microsoft zero-day vulnerabilities. #infosec #cybersecurity URL",2,bs0dhf,https://www.reddit.com/r/CybSecTIA/comments/bs0dhf/less_than_24h_after_publicly_disclosing_an/,2019-05-23 18:26:04,"Less than 24h after publicly disclosing an unpatched 0day vulnerability in Windows 10, the anonymous hacker has now dropped new exploits for two more unpatched Microsoft zero-day vulnerabilities.[#infosec](URL    (@AHCybSec) [May 23, 2019](URL from Twitter @AHCybSec"
200,cybersecurity,CybSecTIA,"Cybercriminals continue to evolve the sophistication of their attack methods, from tailored ransomware to living-off-the-land (LoTL) or sharing infrastructure to maximize their opportunities. Via @Fortinet and @helpnetsecurity #infosec #cybersecurity URL",2,bs0kbu,https://www.reddit.com/r/CybSecTIA/comments/bs0kbu/cybercriminals_continue_to_evolve_the/,2019-05-23 18:56:02,"Cybercriminals continue to evolve the sophistication of their attack methods, from tailored ransomware to living-off-the-land (LoTL) or sharing infrastructure to maximize their opportunities. Via [@Fortinet](URL and [@helpnetsecurity](URL    (@AHCybSec) [May 23, 2019](URL from Twitter @AHCybSec"
201,cybersecurity,CybSecTIA,WannaCry Still Causing Tears 2 Years On URL #infosec #cybersecurity,2,bseuqx,https://www.reddit.com/r/CybSecTIA/comments/bseuqx/wannacry_still_causing_tears_2_years_on/,2019-05-24 19:41:10,"WannaCry Still Causing Tears 2 Years On [URL    (@AHCybSec) [May 24, 2019](URL from Twitter @AHCybSec"
202,cybersecurity,CybSecTIA,Really interesting to read... Why Zero Trust is an Unrealistic Security Model. @MoreyHaber @Beyondtrust_FR @BeyondTrust #infosec #cyberrisk #CyberSecurity URL,2,bsexlb,https://www.reddit.com/r/CybSecTIA/comments/bsexlb/really_interesting_to_read_why_zero_trust_is_an/,2019-05-24 19:51:26,"Really interesting to read... Why Zero Trust is an Unrealistic Security Model.[@MoreyHaber](URL    (@AHCybSec) [May 24, 2019](URL from Twitter @AHCybSec"
203,cybersecurity,CybSecTIA,Hackers target MySQL Servers on MS windows and try to Deliver #GandCrab #Ransomware! #infosec #cybersecurity #malware URL,2,bss26j,https://www.reddit.com/r/CybSecTIA/comments/bss26j/hackers_target_mysql_servers_on_ms_windows_and/,2019-05-25 17:54:14,"Hackers target MySQL Servers on MS windows and try to Deliver [#GandCrab](URL    (@AHCybSec) [May 25, 2019](URL from Twitter @AHCybSec"
204,cybersecurity,CybSecTIA,The Web site for Fortune 500 real estate title insurance giant First American Financial Corp. leaked hundreds of millions of documents. Via @briankrebs #infosec #cybersecurity #databreach URL,2,bss3ah,https://www.reddit.com/r/CybSecTIA/comments/bss3ah/the_web_site_for_fortune_500_real_estate_title/,2019-05-25 17:59:18,"The Web site for Fortune 500 real estate title insurance giant First American Financial Corp. leaked hundreds of millions of documents. Via [@briankrebs](URL    (@AHCybSec) [May 25, 2019](URL from Twitter @AHCybSec"
205,cybersecurity,CybSecTIA,"In Baltimore and Beyond, EternalBlue wreaks havoc. Since 2017, when the NSA lost control of EternalBlue, it has been picked up by state hackers in North Korea, Russia and China, to cut a path of destruction around the world. #infosec #cybersecurity URL",2,bsz11w,https://www.reddit.com/r/CybSecTIA/comments/bsz11w/in_baltimore_and_beyond_eternalblue_wreaks_havoc/,2019-05-26 06:14:13,"In Baltimore and Beyond, EternalBlue wreaks havoc. Since 2017, when the NSA lost control of EternalBlue, it has been picked up by state hackers in North Korea, Russia and China, to cut a path of destruction around the world.[#infosec](URL    (@AHCybSec) [May 25, 2019](URL from Twitter @AHCybSec"
206,cybersecurity,CybSecTIA,"New Variant of Mirai Malware Using 13 Different Exploits to Hack Routers Including D-Link, Linksys, GPON, Netgear, Huawei URL #infosec #cybersecurity",2,bubcx1,https://www.reddit.com/r/CybSecTIA/comments/bubcx1/new_variant_of_mirai_malware_using_13_different/,2019-05-29 16:48:20,"New Variant of Mirai Malware Using 13 Different Exploits to Hack Routers Including D-Link, Linksys, GPON, Netgear, Huawei [URL    (@AHCybSec) [May 29, 2019](URL from Twitter @AHCybSec"
207,cybersecurity,CybSecTIA,RT @NathCybSec: Emissary Panda Attacks Middle East Government Sharepoint Servers #cybersecurity #InfoSecurity #CyberAttack #infosec #ThreatIntel #EmissaryPanda URL,2,bud3j1,https://www.reddit.com/r/CybSecTIA/comments/bud3j1/rt_nathcybsec_emissary_panda_attacks_middle_east/,2019-05-29 20:48:13,"Emissary Panda Attacks Middle East Government Sharepoint Servers[#cybersecurity](URL  NathCybSec (@NathCybSec) [May 29, 2019](URL from Twitter @AHCybSec"
208,cybersecurity,CybSecTIA, A simple internet scan shows that Nearly One Million Systems being Vulnerable to Wormable BlueKeep Remote Desktop Protocol RCE Vulnerability.... Patch your systems. Now. Always! #infosec #cybersecurity #vulnerability URL,2,budpd9,https://www.reddit.com/r/CybSecTIA/comments/budpd9/a_simple_internet_scan_shows_that_nearly_one/,2019-05-29 21:53:20," A simple internet scan shows that Nearly One Million Systems being Vulnerable to Wormable BlueKeep Remote Desktop Protocol RCE Vulnerability.... Patch your systems. Now. Always![#infosec](URL    (@AHCybSec) [May 29, 2019](URL from Twitter @AHCybSec"
209,cybersecurity,CybSecTIA,"Eurofins Scientific perd environ 4% en Bourse lundi. Le laboratoire d'analyses pharmaceutiques, alimentaires et environnementales a annonc avoir t victime ranongiciel. #infosec #cybersecurity URL",1,bwhjhv,https://www.reddit.com/r/CybSecTIA/comments/bwhjhv/eurofins_scientific_perd_environ_4_en_bourse/,2019-06-04 09:20:44,"Eurofins Scientific perd environ 4% en Bourse lundi. Le laboratoire d'analyses pharmaceutiques, alimentaires et environnementales a annonc avoir t victime ranongiciel.[#infosec](URL    (@AHCybSec) [June 3, 2019](URL from Twitter @AHCybSec"
210,cybersecurity,CybSecTIA,BlackSquid Uses 7 Exploits to Infect Web Servers with Miners URL #infosec #cybersecurity,1,bwkyej,https://www.reddit.com/r/CybSecTIA/comments/bwkyej/blacksquid_uses_7_exploits_to_infect_web_servers/,2019-06-04 15:15:51,"BlackSquid Uses 7 Exploits to Infect Web Servers with Miners [URL    (@AHCybSec) [June 4, 2019](URL from Twitter @AHCybSec"
211,cybersecurity,CybSecTIA,Devs slam Microsoft for injecting tech-support scam ads into their Windows Store apps URL #infosec #cybersecurity,1,bwkyeu,https://www.reddit.com/r/CybSecTIA/comments/bwkyeu/devs_slam_microsoft_for_injecting_techsupport/,2019-06-04 15:15:53,"Devs slam Microsoft for injecting tech-support scam ads into their Windows Store apps [URL    (@AHCybSec) [June 4, 2019](URL from Twitter @AHCybSec"
212,cybersecurity,CybSecTIA,"A lesson in risk: Your business is a ship not an aircraft. Cyber risk may not be anywhere near your organisation's most critical business risk, if it's even a business risk at all. Do the numbers. Via @ZDNet #infosec #cybersecurity URL",1,bwkzid,https://www.reddit.com/r/CybSecTIA/comments/bwkzid/a_lesson_in_risk_your_business_is_a_ship_not_an/,2019-06-04 15:19:51,"A lesson in risk: Your business is a ship not an aircraft. Cyber risk may not be anywhere near your organisation's most critical business risk, if it's even a business risk at all. Do the numbers. Via [@ZDNet](URL    (@AHCybSec) [June 4, 2019](URL from Twitter @AHCybSec"
213,cybersecurity,CybSecTIA,"One in three breaches are caused by unpatched vulnerabilities. Flaws are left open for weeks or longer even when fixes exist, security experts admit, leaving organisations at risk. #infosec #cybersecurity #databreach URL",1,bxkd9z,https://www.reddit.com/r/CybSecTIA/comments/bxkd9z/one_in_three_breaches_are_caused_by_unpatched/,2019-06-07 04:46:50,"One in three breaches are caused by unpatched vulnerabilities. Flaws are left open for weeks or longer even when fixes exist, security experts admit, leaving organisations at risk.[#infosec](URL    (@AHCybSec) [June 6, 2019](URL from Twitter @AHCybSec"
214,cybersecurity,CybSecTIA, #GoldBrute #Botnet Brute Forcing 1.5 Million RDP Servers through Microsoft critical remote code execution vulnerability (CVE-20190708)! Patch ASAP! #infosec #Cybersecurity URL,1,bxsstu,https://www.reddit.com/r/CybSecTIA/comments/bxsstu/goldbrute_botnet_brute_forcing_15_million_rdp/,2019-06-07 20:04:12,"[#GoldBrute](URL Brute Forcing 1.5 Million RDP Servers through Microsoft critical remote code execution vulnerability (CVE-20190708)! Patch ASAP![#infosec](URL    (@AHCybSec) [June 7, 2019](URL from Twitter @AHCybSec"
215,cybersecurity,CybSecTIA,Excellente infographie qui retrace la chronologie complte dune attaque du groupe de cybercriminels financiers #Carbanak! via @Bitdefender #Infosec #cybersecurity URL,1,bxtrz0,https://www.reddit.com/r/CybSecTIA/comments/bxtrz0/excellente_infographie_qui_retrace_la_chronologie/,2019-06-07 22:01:35,"Excellente infographie qui retrace la chronologie complte dune attaque du groupe de cybercriminels financiers [#Carbanak](URL via [@Bitdefender](URL    (@AHCybSec) [June 7, 2019](URL from Twitter @AHCybSec"
216,cybersecurity,CybSecTIA,Hacker Who Compromised Hundreds of Millions of Computers Sentenced to More than Six Years URL #infosec #cybersecurity,1,bbjezr,https://www.reddit.com/r/CybSecTIA/comments/bbjezr/hacker_who_compromised_hundreds_of_millions_of/,2019-04-10 18:03:22,"Hacker Who Compromised Hundreds of Millions of Computers Sentenced to More than Six Years [URL    (@AHCybSec) [April 10, 2019](URL from Twitter @AHCybSec"
217,cybersecurity,CybSecTIA,SAS 2019: Gaza Cybergang Blends Sophistication Levels in Highly Effective Spy Effort URL #infosec #cybersecurity,1,bbjheb,https://www.reddit.com/r/CybSecTIA/comments/bbjheb/sas_2019_gaza_cybergang_blends_sophistication/,2019-04-10 18:13:10,"SAS 2019: Gaza Cybergang Blends Sophistication Levels in Highly Effective Spy Effort [URL    (@AHCybSec) [April 10, 2019](URL from Twitter @AHCybSec"
218,cybersecurity,CybSecTIA,TajMahal cyber espionage campaign uses previously unseen malicious tools (ZDNet) URL #infosec #cybersecurity,1,bbju7p,https://www.reddit.com/r/CybSecTIA/comments/bbju7p/tajmahal_cyber_espionage_campaign_uses_previously/,2019-04-10 19:08:22,"TajMahal cyber espionage campaign uses previously unseen malicious tools (ZDNet) [URL    (@AHCybSec) [April 10, 2019](URL from Twitter @AHCybSec"
219,cybersecurity,CybSecTIA,"#Mirai Compiled for New Processors Surfaces in the Wild. In late February 2019, @Unit42_Intel discovered Mirai samples compiled for new processors/architectures not previously seen before. #infosec #cybersecurity @PaloAltoNtwks URL",1,bbju7w,https://www.reddit.com/r/CybSecTIA/comments/bbju7w/mirai_compiled_for_new_processors_surfaces_in_the/,2019-04-10 19:08:22,"[#Mirai](URL Compiled for New Processors Surfaces in the Wild. In late February 2019, [@Unit42\_Intel](URL discovered Mirai samples compiled for new processors/architectures not previously seen before.[#infosec](URL    (@AHCybSec) [April 10, 2019](URL from Twitter @AHCybSec"
220,cybersecurity,CybSecTIA,The Muddy Waters of APT Attacks URL #infosec #cybersecurity,1,bbmygi,https://www.reddit.com/r/CybSecTIA/comments/bbmygi/the_muddy_waters_of_apt_attacks/,2019-04-11 00:54:29,"The Muddy Waters of APT Attacks [URL    (@AHCybSec) [April 10, 2019](URL from Twitter @AHCybSec"
221,cybersecurity,CybSecTIA,"This is an initiative to encourage! Step inside the offices of Bluescreen and you'll find some of the UK's most talented young hackers, dragged from a world of crime to fight for the other side. #infosec #cybersecurity URL",1,bcay1w,https://www.reddit.com/r/CybSecTIA/comments/bcay1w/this_is_an_initiative_to_encourage_step_inside/,2019-04-12 17:53:06,"This is an initiative to encourage! Step inside the offices of Bluescreen and you'll find some of the UK's most talented young hackers, dragged from a world of crime to fight for the other side.[#infosec](URL    (@AHCybSec) [April 12, 2019](URL from Twitter @AHCybSec"
222,cybersecurity,CybSecTIA,A quarter of phishing emails bypass Office 365 security URL #infosec #cybersecurity,1,bccbca,https://www.reddit.com/r/CybSecTIA/comments/bccbca/a_quarter_of_phishing_emails_bypass_office_365/,2019-04-12 21:13:19,"A quarter of phishing emails bypass Office 365 security [URL    (@AHCybSec) [April 12, 2019](URL from Twitter @AHCybSec"
223,cybersecurity,CybSecTIA,"Building a data pipeline to defend New York from cyber #threats. Responsible for protecting a large, complex and federated network of city systems, NYC Cyber Command built its own, open-source data pipeline. #infosec #cybersecurity URL",1,bde4ct,https://www.reddit.com/r/CybSecTIA/comments/bde4ct/building_a_data_pipeline_to_defend_new_york_from/,2019-04-15 19:50:07,"Building a data pipeline to defend New York from cyber [#threats](URL Responsible for protecting a large, complex and federated network of city systems, NYC Cyber Command built its own, open-source data pipeline.[#infosec](URL    (@AHCybSec) [April 15, 2019](URL from Twitter @AHCybSec"
224,cybersecurity,CybSecTIA,Microsoft loses control over Windows Tiles subdomain (ZDNet) URL #infosec #cybersecurity,2,be6jnb,https://www.reddit.com/r/CybSecTIA/comments/be6jnb/microsoft_loses_control_over_windows_tiles/,2019-04-17 21:16:10,"Microsoft loses control over Windows Tiles subdomain (ZDNet) [URL    (@AHCybSec) [April 17, 2019](URL from Twitter @AHCybSec"
225,cybersecurity,CybSecTIA,"Bad bots are evolving and are more sophisticated than ever. While the goal of each bot operator might be different, bots are the tool of choice and are vital to their success. No organization is immune. #infosec #cybersecurity URL",1,behzxg,https://www.reddit.com/r/CybSecTIA/comments/behzxg/bad_bots_are_evolving_and_are_more_sophisticated/,2019-04-18 15:46:08,"Bad bots are evolving and are more sophisticated than ever. While the goal of each bot operator might be different, bots are the tool of choice and are vital to their success. No organization is immune.[#infosec](URL    (@AHCybSec) [April 18, 2019](URL from Twitter @AHCybSec"
226,cybersecurity,CybSecTIA,Network DoS Attack on PLCs Can Disrupt Physical Processes! A team of researchers has demonstrated an interesting type of denial-of-service (DoS) attack on programmable logic controllers (PLCs). #infosec #OT #CyberSecurity URL,1,beixnh,https://www.reddit.com/r/CybSecTIA/comments/beixnh/network_dos_attack_on_plcs_can_disrupt_physical/,2019-04-18 18:01:44,"Network DoS Attack on PLCs Can Disrupt Physical Processes! A team of researchers has demonstrated an interesting type of denial-of-service (DoS) attack on programmable logic controllers (PLCs).[#infosec](URL    (@AHCybSec) [April 18, 2019](URL from Twitter @AHCybSec"
227,cybersecurity,CybSecTIA,"One hundred percent of endpoint security tools eventually fail.  Endpoint security tools and agents fail, reliably and predictably, according to the 2019 Global Endpoint Security Trends Report from Absolute. #infosec #CyberSecurity URL",1,beiyqs,https://www.reddit.com/r/CybSecTIA/comments/beiyqs/one_hundred_percent_of_endpoint_security_tools/,2019-04-18 18:06:22,"One hundred percent of endpoint security tools eventually fail.  Endpoint security tools and agents fail, reliably and predictably, according to the 2019 Global Endpoint Security Trends Report from Absolute.[#infosec](URL    (@AHCybSec) [April 18, 2019](URL from Twitter @AHCybSec"
228,cybersecurity,CybSecTIA,Threat actors advertised a new version of the information stealer malware kit #Hawkeyes Reborn v9 that exfiltrates various information from the infected systems. #infosec #CyberSecurity URL,1,beizvd,https://www.reddit.com/r/CybSecTIA/comments/beizvd/threat_actors_advertised_a_new_version_of_the/,2019-04-18 18:11:19,"Threat actors advertised a new version of the information stealer malware kit [#Hawkeyes](URL Reborn v9 that exfiltrates various information from the infected systems.[#infosec](URL    (@AHCybSec) [April 18, 2019](URL from Twitter @AHCybSec"
229,cybersecurity,CybSecTIA,The Israel offices of US cyber-security firm #Verint have been hit by #ransomware according to a screenshot taken by a Verint employee that started circulating online earlier today. #infosec #cybersecurity URL,1,bej25u,https://www.reddit.com/r/CybSecTIA/comments/bej25u/the_israel_offices_of_us_cybersecurity_firm/,2019-04-18 18:21:08,"The Israel offices of US cyber-security firm [#Verint](URL have been hit by [#ransomware](URL according to a screenshot taken by a Verint employee that started circulating online earlier today.[#infosec](URL    (@AHCybSec) [April 18, 2019](URL from Twitter @AHCybSec"
230,cybersecurity,CybSecTIA,Some Internet outages predicted for the coming month as '768k Day' approaches (ZDNet) URL #infosec #cybersecurity,2,ber2i1,https://www.reddit.com/r/CybSecTIA/comments/ber2i1/some_internet_outages_predicted_for_the_coming/,2019-04-19 07:36:10,"Some Internet outages predicted for the coming month as '768k Day' approaches (ZDNet) [URL    (@AHCybSec) [April 18, 2019](URL from Twitter @AHCybSec"
231,cybersecurity,CybSecTIA,6 Takeaways from Ransomware Attacks in Q1 URL #infosec #cybersecurity,2,ber2i5,https://www.reddit.com/r/CybSecTIA/comments/ber2i5/6_takeaways_from_ransomware_attacks_in_q1/,2019-04-19 07:36:11,"6 Takeaways from Ransomware Attacks in Q1 [URL    (@AHCybSec) [April 18, 2019](URL from Twitter @AHCybSec"
232,cybersecurity,CybSecTIA,Major DDoS attacks increased 967% this year (TechRepublic) URL #infosec #cybersecurity,1,bgunb6,https://www.reddit.com/r/CybSecTIA/comments/bgunb6/major_ddos_attacks_increased_967_this_year/,2019-04-24 23:31:21,"Major DDoS attacks increased 967% this year (TechRepublic) [URL    (@AHCybSec) [April 24, 2019](URL from Twitter @AHCybSec"
233,cybersecurity,CybSecTIA,Hacker could locate thousands of cars and kill their engines remotely via poorly-secured GPS tracking apps URL #infosec #cybersecurity,1,bh9hxr,https://www.reddit.com/r/CybSecTIA/comments/bh9hxr/hacker_could_locate_thousands_of_cars_and_kill/,2019-04-26 00:47:33,"Hacker could locate thousands of cars and kill their engines remotely via poorly-secured GPS tracking apps [URL    (@AHCybSec) [April 25, 2019](URL from Twitter @AHCybSec"
