,topic,subreddit,title,score,id,url,created,body
0,vulnerability,CybSecTIA,PoC Exploit Code Released for Citrix ACD and Gateway Remote Code Execution Vulnerability URL #infosec #cybersecurity,1,ennrti,https://www.reddit.com/r/CybSecTIA/comments/ennrti/poc_exploit_code_released_for_citrix_acd_and/,2020-01-13 01:01:10,"PoC Exploit Code Released for Citrix ACD and Gateway Remote Code Execution Vulnerability [URL    (@AHCybSec) [January 12, 2020](URL URL from Twitter @AHCybSec"
1,vulnerability,CybSecTIA, @CheckPointSW Security researchers find that DSLR cameras are vulnerable to #ransomware attacks. Canon has already issued a security advisory and firmware patch for the vulnerability! #infosec #cybersecurity URL,1,cp9asu,https://www.reddit.com/r/CybSecTIA/comments/cp9asu/checkpointsw_security_researchers_find_that_dslr/,2019-08-12 17:58:36,"[@CheckPointSW](URL Security researchers find that DSLR cameras are vulnerable to [#ransomware](URL attacks. Canon has already issued a security advisory and firmware patch for the vulnerability![#infosec](URL    (@AHCybSec) [August 12, 2019](URL URL from Twitter @AHCybSec"
2,vulnerability,CybSecTIA,A vulnerability in legacy @Iomega and @LenovoEMC network-attached storage (NAS) devices has led to many terabytes of potentially sensitive data being accessible to anyone via the Internet. #infosec #cybersecurity #databreach URL,1,ceat1q,https://www.reddit.com/r/CybSecTIA/comments/ceat1q/a_vulnerability_in_legacy_iomega_and_lenovoemc/,2019-07-17 20:01:57,"A vulnerability in legacy [@Iomega](URL and [@LenovoEMC](URL network-attached storage (NAS) devices has led to many terabytes of potentially sensitive data being accessible to anyone via the Internet.[#infosec](URL    (@AHCybSec) [July 17, 2019](URL URL from Twitter @AHCybSec"
3,vulnerability,CybSecTIA," Over 800,000 Systems Still Vulnerable to BlueKeep Attacks! Users and organizations continue to patch the Windows vulnerability tracked as BlueKeep and CVE-2019-0708, but over 800,000 systems are still exposed to attacks. #infosec #cybersecurity URL",1,cewqrw,https://www.reddit.com/r/CybSecTIA/comments/cewqrw/over_800000_systems_still_vulnerable_to_bluekeep/,2019-07-19 05:06:08," Over 800,000 Systems Still Vulnerable to BlueKeep Attacks! Users and organizations continue to patch the Windows vulnerability tracked as BlueKeep and CVE-2019-0708, but over 800,000 systems are still exposed to attacks.[#infosec](URL    (@AHCybSec) [July 18, 2019](URL URL from Twitter @AHCybSec"
4,vulnerability,CybSecTIA,"A critical #vulnerability has been found in @PaloAltoNtwks GlobalProtect SSL VPN software used by enterprise companies across the globe, including ride-hailing platform Uber. #infosec #cybersecurity URL",1,ch7jab,https://www.reddit.com/r/CybSecTIA/comments/ch7jab/a_critical_vulnerability_has_been_found_in/,2019-07-24 22:26:40,"A critical [#vulnerability](URL has been found in [@PaloAltoNtwks](URL GlobalProtect SSL VPN software used by enterprise companies across the globe, including ride-hailing platform Uber. [#infosec](URL    (@AHCybSec) [July 24, 2019](URL URL from Twitter @AHCybSec"
5,vulnerability,CybSecTIA,Spoofing Vulnerability in Outlook for Android Let Hackers Perform Cross-site Scripting Attacks  Update Now URL #infosec #cybersecurity,1,c37789,https://www.reddit.com/r/CybSecTIA/comments/c37789/spoofing_vulnerability_in_outlook_for_android_let/,2019-06-21 16:39:21,"Spoofing Vulnerability in Outlook for Android Let Hackers Perform Cross-site Scripting Attacks  Update Now [URL    (@AHCybSec) [June 21, 2019](URL URL from Twitter @AHCybSec"
6,vulnerability,CybSecTIA, Impressive... Docker: more than 20% of the files contained at least one high-risk vulnerability. More than 60% of the top Docker files held a vulnerability that had a Kenna Risk Score above 330. #infosec #cybersecurity URL,1,caoa8r,https://www.reddit.com/r/CybSecTIA/comments/caoa8r/impressive_docker_more_than_20_of_the_files/,2019-07-09 03:46:36," Impressive... Docker: more than 20% of the files contained at least one high-risk vulnerability. More than 60% of the top Docker files held a vulnerability that had a Kenna Risk Score above 330.[#infosec](URL    (@AHCybSec) [July 8, 2019](URL URL from Twitter @AHCybSec"
7,vulnerability,CybSecTIA,@FidusInfoSec security team identified a huge vulnerability with an extremely common Alarm &amp; GPS device used by vulnerable people around the world. #infosec #cybersecurity #vulnerability URL,1,bmxtwk,https://www.reddit.com/r/CybSecTIA/comments/bmxtwk/fidusinfosec_security_team_identified_a_huge/,2019-05-10 22:44:37,"[@FidusInfoSec](URL security team identified a huge vulnerability with an extremely common Alarm &amp; GPS device used by vulnerable people around the world.[#infosec](URL    (@AHCybSec) [May 10, 2019](URL from Twitter @AHCybSec"
8,vulnerability,CybSecTIA," Researchers have found a way to break @Cisco's secure boot process, which could affect millions of devices around the world. #infosec #cybersecurity #vulnerability URL",1,bo8fx4,https://www.reddit.com/r/CybSecTIA/comments/bo8fx4/researchers_have_found_a_way_to_break_ciscos/,2019-05-14 06:04:09," Researchers have found a way to break [@Cisco](URL secure boot process, which could affect millions of devices around the world.[#infosec](URL    (@AHCybSec) [May 13, 2019](URL from Twitter @AHCybSec"
9,vulnerability,CybSecTIA,@Bitdefender researchers uncovered a new severe vulnerability on several @intel CPU microarchitectures. #infosec #cybersecurity #vulnerability URL,1,bovspe,https://www.reddit.com/r/CybSecTIA/comments/bovspe/bitdefender_researchers_uncovered_a_new_severe/,2019-05-15 19:34:25,"[@Bitdefender](URL researchers uncovered a new severe vulnerability on several [@intel](URL CPU microarchitectures.[#infosec](URL    (@AHCybSec) [May 15, 2019](URL from Twitter @AHCybSec"
10,vulnerability,CybSecTIA,"Less than 24h after publicly disclosing an unpatched 0day vulnerability in Windows 10, the anonymous hacker has now dropped new exploits for two more unpatched Microsoft zero-day vulnerabilities. #infosec #cybersecurity URL",2,bs0dhf,https://www.reddit.com/r/CybSecTIA/comments/bs0dhf/less_than_24h_after_publicly_disclosing_an/,2019-05-23 18:26:04,"Less than 24h after publicly disclosing an unpatched 0day vulnerability in Windows 10, the anonymous hacker has now dropped new exploits for two more unpatched Microsoft zero-day vulnerabilities.[#infosec](URL    (@AHCybSec) [May 23, 2019](URL from Twitter @AHCybSec"
11,vulnerability,CybSecTIA, A simple internet scan shows that Nearly One Million Systems being Vulnerable to Wormable BlueKeep Remote Desktop Protocol RCE Vulnerability.... Patch your systems. Now. Always! #infosec #cybersecurity #vulnerability URL,2,budpd9,https://www.reddit.com/r/CybSecTIA/comments/budpd9/a_simple_internet_scan_shows_that_nearly_one/,2019-05-29 21:53:20," A simple internet scan shows that Nearly One Million Systems being Vulnerable to Wormable BlueKeep Remote Desktop Protocol RCE Vulnerability.... Patch your systems. Now. Always![#infosec](URL    (@AHCybSec) [May 29, 2019](URL from Twitter @AHCybSec"
12,vulnerability,CybSecTIA," Unpatched Flaw Affects All #Docker Versions, Exploits Ready! All versions of Docker are currently vulnerable to a race condition that could give an attacker both read and write access to any file on the host system. #infosec #vulnerability URL",2,bufens,https://www.reddit.com/r/CybSecTIA/comments/bufens/unpatched_flaw_affects_all_docker_versions/,2019-05-30 00:33:29," Unpatched Flaw Affects All [#Docker](URL Versions, Exploits Ready! All versions of Docker are currently vulnerable to a race condition that could give an attacker both read and write access to any file on the host system.[#infosec](URL    (@AHCybSec) [May 29, 2019](URL from Twitter @AHCybSec"
13,vulnerability,CybSecTIA, #GoldBrute #Botnet Brute Forcing 1.5 Million RDP Servers through Microsoft critical remote code execution vulnerability (CVE-20190708)! Patch ASAP! #infosec #Cybersecurity URL,1,bxsstu,https://www.reddit.com/r/CybSecTIA/comments/bxsstu/goldbrute_botnet_brute_forcing_15_million_rdp/,2019-06-07 20:04:12,"[#GoldBrute](URL Brute Forcing 1.5 Million RDP Servers through Microsoft critical remote code execution vulnerability (CVE-20190708)! Patch ASAP![#infosec](URL    (@AHCybSec) [June 7, 2019](URL from Twitter @AHCybSec"
14,vulnerability,CybSecTIA,Zero-Day TP-Link SR20 Router Vulnerability Disclosed by Google Dev URL #infosec #cybersecurity,2,b6pg02,https://www.reddit.com/r/CybSecTIA/comments/b6pg02/zeroday_tplink_sr20_router_vulnerability/,2019-03-29 09:40:08,"Zero-Day TP-Link SR20 Router Vulnerability Disclosed by Google Dev [URL    (@AHCybSec) [March 28, 2019](URL from Twitter @AHCybSec"
15,vulnerability,CybSecTIA,Bezos Case Exposes Billionaires' Vulnerability to Hackers URL #infosec #cybersecurity,1,apdd08,https://www.reddit.com/r/CybSecTIA/comments/apdd08/bezos_case_exposes_billionaires_vulnerability_to/,2019-02-11 17:14:11,"Bezos Case Exposes Billionaires' Vulnerability to Hackers [URL    (@AHCybSec) [February 11, 2019](URL from Twitter @AHCybSec"
16,vulnerability,CybSecTIA,"#Doomsday Docker security hole uncovered A security #vulnerability has been disclosed for a flaw in runc, Docker and Kubernetes' container runtime, which can be used to attack any host system running containers #infosec #cybersecurity URL",1,apknvx,https://www.reddit.com/r/CybSecTIA/comments/apknvx/doomsday_docker_security_hole_uncovered_a/,2019-02-12 07:34:23,"[#Doomsday](URL Docker security hole uncovered A security [#vulnerability](URL has been disclosed for a flaw in runc, Docker and Kubernetes' container runtime, which can be used to attack any host system running containers[#infosec](URL    (@AHCybSec) [February 11, 2019](URL from Twitter @AHCybSec"
17,vulnerability,CybSecTIA,"A fundamental component of container technologies like #Docker, cri-o, containerd and #Kubernetes contains an important vulnerability that could cause cascading attacks. #infosec #cybersecurity URL",1,apwtj9,https://www.reddit.com/r/CybSecTIA/comments/apwtj9/a_fundamental_component_of_container_technologies/,2019-02-13 05:58:53,"A fundamental component of container technologies like [#Docker](URL cri-o, containerd and [#Kubernetes](URL contains an important vulnerability that could cause cascading attacks.[#infosec](URL    (@AHCybSec) [February 12, 2019](URL from Twitter @AHCybSec"
18,vulnerability,CybSecTIA,Dirty Sock vulnerability lets attackers gain root access on Linux systems URL #infosec #cybersecurity,1,aq3jff,https://www.reddit.com/r/CybSecTIA/comments/aq3jff/dirty_sock_vulnerability_lets_attackers_gain_root/,2019-02-13 17:18:16,"Dirty Sock vulnerability lets attackers gain root access on Linux systems [URL    (@AHCybSec) [February 13, 2019](URL from Twitter @AHCybSec"
19,vulnerability,CybSecTIA,A critical #vulnerability in popular #WordPress plugin Simple Social Buttons enables non-admin users to modify WordPress installation options  and ultimately take over websites. #infosec #cybersecurity URL,1,aq9ndy,https://www.reddit.com/r/CybSecTIA/comments/aq9ndy/a_critical_vulnerability_in_popular_wordpress/,2019-02-14 05:23:15,"A critical [#vulnerability](URL in popular [#WordPress](URL plugin Simple Social Buttons enables non-admin users to modify WordPress installation options  and ultimately take over websites.[#infosec](URL    (@AHCybSec) [February 13, 2019](URL from Twitter @AHCybSec"
20,vulnerability,CybSecTIA,"Monero Miner-Malware Uses RADMIN, MIMIKATZ to Infect, Propagate via Vulnerability URL #infosec #cybersecurity",1,asofcy,https://www.reddit.com/r/CybSecTIA/comments/asofcy/monero_minermalware_uses_radmin_mimikatz_to/,2019-02-21 00:39:15,"Monero Miner-Malware Uses RADMIN, MIMIKATZ to Infect, Propagate via Vulnerability [URL    (@AHCybSec) [February 20, 2019](URL from Twitter @AHCybSec"
21,vulnerability,CybSecTIA,New Hacking Tools launching Crypto-Malware by Exploit a Windows SMB Server Vulnerability URL #infosec #cybersecurity,1,atft84,https://www.reddit.com/r/CybSecTIA/comments/atft84/new_hacking_tools_launching_cryptomalware_by/,2019-02-22 21:08:27,"New Hacking Tools launching Crypto-Malware by Exploit a Windows SMB Server Vulnerability [URL    (@AHCybSec) [February 22, 2019](URL from Twitter @AHCybSec"
22,vulnerability,CybSecTIA,Vulnerability exposes location of thousands of malware C&amp;C servers. An extra whitespace in a server response allowed a security firm to track a hackers' favorite tool for years. #infosec #cybersecurity #0day URL,2,aw1roi,https://www.reddit.com/r/CybSecTIA/comments/aw1roi/vulnerability_exposes_location_of_thousands_of/,2019-03-01 17:48:14,"Vulnerability exposes location of thousands of malware C&amp;C servers. An extra whitespace in a server response allowed a security firm to track a hackers' favorite tool for years.[#infosec](URL    (@AHCybSec) [March 1, 2019](URL from Twitter @AHCybSec"
23,vulnerability,CybSecTIA,PXE Dust: Finding a Vulnerability in Windows Servers Deployment Services URL #infosec #cybersecurity,2,ay0ru8,https://www.reddit.com/r/CybSecTIA/comments/ay0ru8/pxe_dust_finding_a_vulnerability_in_windows/,2019-03-07 03:34:22,"PXE Dust: Finding a Vulnerability in Windows Servers Deployment Services [URL    (@AHCybSec) [March 6, 2019](URL from Twitter @AHCybSec"
24,vulnerability,CybSecTIA,DuckDuck D'oh! Drama in search engine land this week as Google-alternative @DuckDuckGo disclosed a potentially nasty flaw in its server-side software. Michele Romano took credit for spotting and reporting #vulnerability in backend servers #infosec URL,1,amec3q,https://www.reddit.com/r/CybSecTIA/comments/amec3q/duckduck_doh_drama_in_search_engine_land_this/,2019-02-03 01:06:12,"DuckDuck D'oh! Drama in search engine land this week as Google-alternative [@DuckDuckGo](URL disclosed a potentially nasty flaw in its server-side software. Michele Romano took credit for spotting and reporting [#vulnerability](URL in backend servers[#infosec](URL    (@AHCybSec) [February 2, 2019](URL from Twitter @AHCybSec"
25,vulnerability,CybSecTIA,"Following a serious vulnerability disclosure affecting casinos globally, an executive of casino technology vendor Atrient has assaulted the security researcher who disclosed the vulnerability at the ICE conference in London. Stupid idiot. #infosec URL",1,ano686,https://www.reddit.com/r/CybSecTIA/comments/ano686/following_a_serious_vulnerability_disclosure/,2019-02-06 17:59:33,"Following a serious vulnerability disclosure affecting casinos globally, an executive of casino technology vendor Atrient has assaulted the security researcher who disclosed the vulnerability at the ICE conference in London. Stupid idiot.[#infosec](URL    (@AHCybSec) [February 6, 2019](URL from Twitter @AHCybSec"
26,vulnerability,CybSecTIA,ThinkPHP Remote Code Execution Vulnerability Used To Deploy Variety of Malware (CVE-2018-20062) URL #infosec #cybersecurity,1,ao5r5x,https://www.reddit.com/r/CybSecTIA/comments/ao5r5x/thinkphp_remote_code_execution_vulnerability_used/,2019-02-08 03:53:51,"ThinkPHP Remote Code Execution Vulnerability Used To Deploy Variety of Malware (CVE-2018-20062) [URL    (@AHCybSec) [February 7, 2019](URL from Twitter @AHCybSec"
27,vulnerability,CybSecTIA,Zero-day Vulnerability Highlights the Responsible Disclosure Dilemma (SecurityWeek) URL #infosec #cybersecurity,1,ao6uu9,https://www.reddit.com/r/CybSecTIA/comments/ao6uu9/zeroday_vulnerability_highlights_the_responsible/,2019-02-08 05:33:29,"Zero-day Vulnerability Highlights the Responsible Disclosure Dilemma (SecurityWeek) [URL    (@AHCybSec) [February 7, 2019](URL from Twitter @AHCybSec"
28,cybersecurity,CybSecTIA,"Les oprateurs du #DopplePaymer #ransomware ont flicit #SpaceX et la #NASA pour leur premier lancement de fuse, puis ont immdiatement annonc qu'ils avaient infect le rseau d'un des sous-traitants informatiques de la NASA. #infosec #cybersecurity URL",1,gvonep,https://www.reddit.com/r/CybSecTIA/comments/gvonep/les_opérateurs_du_dopplepaymer_ransomware_ont/,2020-06-03 16:36:15,"Les oprateurs du [#DopplePaymer](URL ont flicit [#SpaceX](URL et la [#NASA](URL pour leur premier lancement de fuse, puis ont immdiatement annonc qu'ils avaient infect le rseau d'un des sous-traitants informatiques de la NASA.[#infosec](URL    (@AHCybSec) [June 3, 2020](URL URL from Twitter @AHCybSec"
29,cybersecurity,CybSecTIA,Le groupe criminel oprant le #ransomware #REvil a commenc  vendre aux enchres les donnes sensibles voles aux entreprises touches par ses logiciels malveillants. via @briankrebs #infosec #CyberSecurity URL,1,gvoneu,https://www.reddit.com/r/CybSecTIA/comments/gvoneu/le_groupe_criminel_opérant_le_ransomware_revil_a/,2020-06-03 16:36:16,"Le groupe criminel oprant le [#ransomware](URL a commenc  vendre aux enchres les donnes sensibles voles aux entreprises touches par ses logiciels malveillants. via [@briankrebs](URL    (@AHCybSec) [June 3, 2020](URL URL from Twitter @AHCybSec"
30,cybersecurity,CybSecTIA,"Mme aprs avoir t informs que leurs donnes personnelles ont t compromises, seul 1/3 environ des utilisateurs changent leurs mots de passe et la plupart de ces derniers sont loin d'tre robustes. via Carnegie Mellon University #infosec #cybersecurity URL",1,gvpehd,https://www.reddit.com/r/CybSecTIA/comments/gvpehd/même_après_avoir_été_informés_que_leurs_données/,2020-06-03 17:36:24,"Mme aprs avoir t informs que leurs donnes personnelles ont t compromises, seul 1/3 environ des utilisateurs changent leurs mots de passe et la plupart de ces derniers sont loin d'tre robustes. via Carnegie Mellon University[#infosec](URL    (@AHCybSec) [June 3, 2020](URL URL from Twitter @AHCybSec"
31,cybersecurity,CybSecTIA,Confidential doc have been swiped from a US military nuclear missile contractor in a cyber-attack. Cyber-criminals were able to gain unauthorized access to the computer network of Westech International. #infosec #cybersecurity #databreach URL,1,gwkx0f,https://www.reddit.com/r/CybSecTIA/comments/gwkx0f/confidential_doc_have_been_swiped_from_a_us/,2020-06-05 02:36:18,"Confidential doc have been swiped from a US military nuclear missile contractor in a cyber-attack. Cyber-criminals were able to gain unauthorized access to the computer network of Westech International.[#infosec](URL    (@AHCybSec) [June 4, 2020](URL URL from Twitter @AHCybSec"
32,cybersecurity,CybSecTIA,"Identifying a Person Based on a Photo, LinkedIn and Etsy Profiles, and Other Internet Bread Crumbs #infosec #cybersecurity URL",1,hf0947,https://www.reddit.com/r/CybSecTIA/comments/hf0947/identifying_a_person_based_on_a_photo_linkedin/,2020-06-24 22:36:23,"Identifying a Person Based on a Photo, LinkedIn and Etsy Profiles, and Other Internet Bread Crumbs[#infosec](URL    (@AHCybSec) [June 24, 2020](URL URL from Twitter @AHCybSec"
33,cybersecurity,CybSecTIA,Maze ransomware gang threatens to publish sensitive stolen data after US aerospace biz sensibly refuses to pay #infosec #cybersecurity #ransomware URL,1,hf14u8,https://www.reddit.com/r/CybSecTIA/comments/hf14u8/maze_ransomware_gang_threatens_to_publish/,2020-06-24 23:36:16,"Maze ransomware gang threatens to publish sensitive stolen data after US aerospace biz sensibly refuses to pay[#infosec](URL    (@AHCybSec) [June 24, 2020](URL URL from Twitter @AHCybSec"
34,cybersecurity,CybSecTIA,Exposed Frost &amp; Sullivan databases for sale on hacking forum #infosec #cybersecurity #databreach URL,1,hf23n5,https://www.reddit.com/r/CybSecTIA/comments/hf23n5/exposed_frost_sullivan_databases_for_sale_on/,2020-06-25 00:36:10,"Exposed Frost &amp; Sullivan databases for sale on hacking forum[#infosec](URL    (@AHCybSec) [June 24, 2020](URL URL from Twitter @AHCybSec"
35,cybersecurity,CybSecTIA,Data Breach: Hacker Sells Over 1.3 Million User Records of Popular Stalker Online MMO Game on Dark Web Marketplace #infosec #cybersecurity #databreach URL,1,hf35e0,https://www.reddit.com/r/CybSecTIA/comments/hf35e0/data_breach_hacker_sells_over_13_million_user/,2020-06-25 01:36:17,"Data Breach: Hacker Sells Over 1.3 Million User Records of Popular Stalker Online MMO Game on Dark Web Marketplace[#infosec](URL    (@AHCybSec) [June 24, 2020](URL URL from Twitter @AHCybSec"
36,cybersecurity,CybSecTIA,Data Breach: Hacker Sells Over 1.3 Million User Records of Popular Stalker Online MMO Game on Dark Web Marketplace #infosec #cybersecurity #databreach URL,1,hf35ea,https://www.reddit.com/r/CybSecTIA/comments/hf35ea/data_breach_hacker_sells_over_13_million_user/,2020-06-25 01:36:18,"Data Breach: Hacker Sells Over 1.3 Million User Records of Popular Stalker Online MMO Game on Dark Web Marketplace[#infosec](URL    (@AHCybSec) [June 24, 2020](URL URL from Twitter @AHCybSec"
37,cybersecurity,CybSecTIA,Exposed Frost &amp; Sullivan databases for sale on hacking forum #infosec #cybersecurity #databreach URL,1,hf4a6n,https://www.reddit.com/r/CybSecTIA/comments/hf4a6n/exposed_frost_sullivan_databases_for_sale_on/,2020-06-25 02:36:20,"Exposed Frost &amp; Sullivan databases for sale on hacking forum[#infosec](URL    (@AHCybSec) [June 24, 2020](URL URL from Twitter @AHCybSec"
38,cybersecurity,CybSecTIA,Two-Year Data Breach at Florida Senior Care Provider #infosec #cybersecurity #databreach URL,1,hf5eog,https://www.reddit.com/r/CybSecTIA/comments/hf5eog/twoyear_data_breach_at_florida_senior_care/,2020-06-25 03:36:20,"Two-Year Data Breach at Florida Senior Care Provider[#infosec](URL    (@AHCybSec) [June 24, 2020](URL URL from Twitter @AHCybSec"
39,cybersecurity,CybSecTIA,Average Cost of a Data Breach: $116M #infosec #cybersecurity #databreach URL,1,hf6l09,https://www.reddit.com/r/CybSecTIA/comments/hf6l09/average_cost_of_a_data_breach_116m_infosec/,2020-06-25 04:36:09,"Average Cost of a Data Breach: $116M[#infosec](URL    (@AHCybSec) [June 24, 2020](URL URL from Twitter @AHCybSec"
40,cybersecurity,CybSecTIA,ESB-2020.2193 - [FreeBSD] curl: Multiple vulnerabilities #infosec #cybersecurity #databreach URL,1,hfbzgl,https://www.reddit.com/r/CybSecTIA/comments/hfbzgl/esb20202193_freebsd_curl_multiple_vulnerabilities/,2020-06-25 09:36:19,"ESB-2020.2193 - [FreeBSD] curl: Multiple vulnerabilities[#infosec](URL    (@AHCybSec) [June 24, 2020](URL URL from Twitter @AHCybSec"
41,cybersecurity,CybSecTIA,DDoSecrets thrown off Twitter after distributing 269GB BlueLeaks data dump #infosec #cybersecurity #databreach URL,1,hfbzgw,https://www.reddit.com/r/CybSecTIA/comments/hfbzgw/ddosecrets_thrown_off_twitter_after_distributing/,2020-06-25 09:36:19,"DDoSecrets thrown off Twitter after distributing 269GB BlueLeaks data dump[#infosec](URL    (@AHCybSec) [June 24, 2020](URL URL from Twitter @AHCybSec"
42,cybersecurity,CybSecTIA,Justice Department charges Assange with recruiting and conspiring with hackers #infosec #cybersecurity #databreach URL,1,hfcozu,https://www.reddit.com/r/CybSecTIA/comments/hfcozu/justice_department_charges_assange_with/,2020-06-25 10:36:11,"Justice Department charges Assange with recruiting and conspiring with hackers[#infosec](URL    (@AHCybSec) [June 24, 2020](URL URL from Twitter @AHCybSec"
43,cybersecurity,CybSecTIA,Attackers Scanning for PoS Software in New Sodinokibi Ransomware Campaign - URL #infosec #cybersecurity #databreach URL,1,hfcozy,https://www.reddit.com/r/CybSecTIA/comments/hfcozy/attackers_scanning_for_pos_software_in_new/,2020-06-25 10:36:11,"Attackers Scanning for PoS Software in New Sodinokibi Ransomware Campaign - [URL    (@AHCybSec) [June 24, 2020](URL URL from Twitter @AHCybSec"
44,cybersecurity,CybSecTIA,Attackers Scanning for PoS Software in New Sodinokibi Ransomware Campaign - URL #infosec #cybersecurity #databreach URL #infosec #cybersecurity #databreach URL,1,hfcp08,https://www.reddit.com/r/CybSecTIA/comments/hfcp08/attackers_scanning_for_pos_software_in_new/,2020-06-25 10:36:12,"Attackers Scanning for PoS Software in New Sodinokibi Ransomware Campaign - [URL    (@AHCybSec) [June 24, 2020](URL URL from Twitter @AHCybSec"
45,cybersecurity,CybSecTIA,WikiLeaks founder charged with conspiring with Anonymous and LulzSec hackers #infosec #cybersecurity #databreach URL,1,hfcp0j,https://www.reddit.com/r/CybSecTIA/comments/hfcp0j/wikileaks_founder_charged_with_conspiring_with/,2020-06-25 10:36:12,"WikiLeaks founder charged with conspiring with Anonymous and LulzSec hackers[#infosec](URL    (@AHCybSec) [June 24, 2020](URL URL from Twitter @AHCybSec"
46,cybersecurity,CybSecTIA,Attackers Scanning for PoS Software in New Sodinokibi Ransomware Campaign - URL #infosec #cybersecurity #databreach URL #infosec #cybersecurity #databreach URL #infosec #cybersecurity #databr URL,1,hfcp0q,https://www.reddit.com/r/CybSecTIA/comments/hfcp0q/attackers_scanning_for_pos_software_in_new/,2020-06-25 10:36:13,"Attackers Scanning for PoS Software in New Sodinokibi Ransomware Campaign - [URL [URL    (@AHCybSec) [June 24, 2020](URL URL from Twitter @AHCybSec"
47,cybersecurity,CybSecTIA,Attackers Scanning for PoS Software in New Sodinokibi Ransomware Campaign - URL #infosec #cybersecurity #databreach URL #infosec #cybersecurity #databreach URL #infosec #cybersecurity #databr URL,1,hfcp0y,https://www.reddit.com/r/CybSecTIA/comments/hfcp0y/attackers_scanning_for_pos_software_in_new/,2020-06-25 10:36:13,"Attackers Scanning for PoS Software in New Sodinokibi Ransomware Campaign - [URL [URL    (@AHCybSec) [June 25, 2020](URL URL from Twitter @AHCybSec"
48,cybersecurity,CybSecTIA,Attackers Scanning for PoS Software in New Sodinokibi Ransomware Campaign - URL #infosec #cybersecurity #databreach URL #infosec #cybersecurity #databreach URL #infosec #cybersecurity #databr URL,1,hfcp15,https://www.reddit.com/r/CybSecTIA/comments/hfcp15/attackers_scanning_for_pos_software_in_new/,2020-06-25 10:36:14,"Attackers Scanning for PoS Software in New Sodinokibi Ransomware Campaign - [URL [URL    (@AHCybSec) [June 25, 2020](URL URL from Twitter @AHCybSec"
