,topic,subreddit,title,score,id,url,created,body
0,vulnerability,DeadBedrooms,Need help with my direction.,1,i3715r,https://www.reddit.com/r/DeadBedrooms/comments/i3715r/need_help_with_my_direction/,2020-08-04 08:22:39,"Hey fellow solo players, bit of a xpost but looking for some advice. TLDR: I have a growing toy collection and along with a growing desire to be filled. How do I break this to my wife as she barely allows anything in her ass, let alone has any desire to spread me open. Heres where im at: Both in our early-mid thirties. Ive been with my wife for 12 years, married 5. Have a pretty vanilla and moderate to inactive sex life. We had one year of active sex, probably 4 times a week. That distanced to maybe twice a month, and over the past 5 years has been once a month at most. Continued regressing to maybe once every 2 months and really only happens as a result of me offering to do all the housework, childcare and be the giver sexually, with little to no reciprocation. Not ideal but not the point of the post. Due to the lack of sexual encounters/ exploration, I have come to discover my prostate on my own, first by adding the sex toys Ive bought her to my own solo sessions, and later buying my own prostate toys, and a ton, almost endless reading, research and experimenting based on information from this group. I have progressed substantially from a finger in the bum to enjoying the fullness of large toys. Went from a slim vibe, to a prostate plug, a 8 x 1.5 dildo (just to try it on for size) and the Njoy wand. I have enjoyed all these toys and they all have/had their place in my progression. I recently ordered the Tantus P Spot. The dimensions sounded right, but I recall reading from other posters that this thing is huge. Well I guess you dont know till you see it. And its BIG, but not crazy huge. Knowing that the P Spot is specifically designed to hit the prostate gave me some needed encouragement to get that thing inside me. With some warm up I gladly accepted the tip. A nice feeling of a gentle stretch. Then I lowered myself down almost all the way. A sober feeling of fullness washed over me. I allowed my ass to adjust, and with some light bouncing began to enjoy the feeling. Add poppers mix and I was fucking this thing like a man whore. I cant imagine anything hotter than my wife strapping that thing on, and taking me for a wild ride. I have opened up about my past play and desires (to an extent) and although receptive, I doubt she will ever engage on her own. Anything sexual that I have brought up has (often to my surpise) been well received, but then not to my surprise has been dismissed. I don't have much desire to open up and make myself more vulnerable. As I'm sure most of you can attest I don't love the feeling of vulnerability, but it is a necessary step in reaching an end goal. That being said I pretty much have to beg for pussy at home. I can do all the right things, and she'll fall asleep before we engage, whether or not we have prearranged to have some intimate time. I hate this feeling. I'm in peak physical shape while she is not even close. I would say I desire my wife now more than ever before. But she doesn't seem to have that desire or drive. My 2 questions are: A) how should I approach this? Let my wife believe whatever roll she takes is the best Ive ever had, and encourage progression through that channel of praise. Or just tell her that Ive progressed on my own due to our minimal sex life. Say this is where Im at and this is what I like? Can't say I have a ton of confidence in either of these playing out well. B) How to encourage my wife to take a more involved role in ours sex lives. \[The kind and caring side of me has been patient, understands what she likes/dislikes, has endured 4+ month dry streaks, done counselling and have remained supportive through this whole time. So the considerate part of me has been there to support. The primal and maybe (selfish?) side of me wants to say fuck me or someone else will! I get hit on while working regularly, and have had several older women (late 30's to late 50's) make a pass at me. I love the idea and the feeling of being wanted. Wish it was from my wife. (And to be clear I have never cheated on my wife. Dont really have any desire to either). Would just love to be desired for as well. To be wanted, loved and thoroughly fucked."
1,vulnerability,DeadBedrooms,Another to add to the collection,1,i40qyc,https://www.reddit.com/r/DeadBedrooms/comments/i40qyc/another_to_add_to_the_collection/,2020-08-05 17:14:22,"It's another of those nights where the weight of my thoughts are making me sleepless. As with most introductions on this thread and much of my own hesitation I figured why not give reddit a shot. Im 29(F) and SO 31(M) and we've been together for 8 years. Some background: Our first two years together were through long distance across a few state lines and we only saw each other 3 times within those 2 years because I was caught up in school. We had sex for the first time after his 2nd trip to see me and then not again until i finally moved up with him a year later. Now take into account that I was a virgin prior to him. Stupid me was so scared of the very vulnerability that sex brings and i also wanted to wait for someone special because I wanted it to be meaningful. Anyway, my first time having sex with him was more of a quickie that ended up interrupted. Not that big of deal I thought then because I figured I'd have all the sex I want soon when I move in with him. Once I moved in the sex was still pretty meh. We'd struggle with finding a good position or he'd so soft because he'd either get so tired, cramp up, or would lose feeling after so much friction. Still wasnt that big of a deal because I was still so new to sex and oh so in love. Well as the years went by there was less and less sex. Largest gap being 6 months, but frequency basically dwindled down to maybe every other 3 weeks. I started finding myself getting more and more rejected when I'd initiate because of x, y, z reasons. Reasons ranged between it was late in the night or he felt stinky from not having showered. Sex was still lousy and even after a few years I could count how many times we'd had great sex in one hand. I put up with the reasons and ate them up until I started noticing how down it made me feel. I began to question why our sex life was the way that it was and he said it was because he had a low sex drive. Okay...so me being a very understanding girlfriend accepted it and respected his low libido. Present time: I've found out in the last 6 months that he is addicted to porn and actually masturbates just about everyday, and sometimes multiple times a day. I found out one day after he linked his google account to our computer. His entire mobile browser history was viewable on real time through the computer. I confronted him with ""So you do have a sex drive, but not for me"" and i told him about the linked browser history. He began to cry and said that he just feels really insecure about his poor sexual performance and that he didnt know how to talk about it. And i explained to him that I want to be there for him and do whatever I can to help him feel comfortable or even explore new things together. It was a good talk and things were looking good for a hot minute. About 3 months after that I brought it up again because everything seemed to have reverted back to normal and once again caught him with his porn. At this point I told him that I was tired of having to bring this up, that I want a normal sexual relationship, that this porn addiction is a problem to our relationship, and that he needs to stop because it is the stem to all of his underperformance problems. I also told him that I just dont know how to approach him with sex anymore...i dont know how to initiate with him anymore. That im so scared of rejection. And that i dont even know how to feel when he touches me because 90% of the time it doesnt even lead to sex. Once again things were looking good for a bit...now back to sex every other 3 weeks. I havent even pushed it again...I've thought to myself that theres no way hes not masturbating and going this long without getting off, but gave him the benefit of the doubt. Confirmed it today that he still is getting himself off because his bottle of lube has been moved around multiple places in the last 2 days. I just dont know how to go about this anymore or how to better approach this. I very much love him, but this just isn't fair."
2,vulnerability,DeadBedrooms,NRE advice in a new relationship,1,i6tuxc,https://www.reddit.com/r/DeadBedrooms/comments/i6tuxc/nre_advice_in_a_new_relationship/,2020-08-10 09:43:00,"What to do with all that NRE So this sub literally saved my life. Separated 2 years ago, finalized in March. Started dating last month and OMG. Couple nice dates, nice time but no strong chemistry. Good conversations and feeling better and better about my new found freedom (13 of 15 year DB survivor). Then I met her. I cannot put into words how crazy we are matching. Its as if I have known this girl my whole life. Skipped all the goo-goo and Gaa-gaa shit and got real right off the bat. Deep conversations, instant vulnerability, just really, really intense connection. 1st night was something out of this world. 1 week. I know, I know ....friends are like whoa man. NRE just relax...but I just cant help this intense feeling that I have known this girl my whole life. We finish each others sentences, feel the same feeling and can be upfront without fear of wondering how the other person is feeling. I am almost always a rational, level headed thinking person but thats all out the window. I dont know if Im looking for advice or just someone who as been here and can relate."
3,vulnerability,DeadBedrooms,Told him he needed therapy,1,i752dw,https://www.reddit.com/r/DeadBedrooms/comments/i752dw/told_him_he_needed_therapy/,2020-08-10 23:43:32,"I (25F) and my husband (26M) have been together for 4.5 years, married for 6 months. A little background, he struggles with porn addiction, and we have talked about it, always says hes gong to do better, sometimes I can tell he is! In general, he still has the problem.. this has led me to not trust him very much. I used to tell him I do, but lately Ive come clean and said I dont, because hes gone back on his word of not looking at other women so much. In the beginning before I found out about his porn addiction, our sex life was GREAT. After I announced that I had found out about how much porn he watches and how hurt I was, our sex life declined for a while. He said hes had problems with vulnerability in the past, and girls have broken up with him over it. After a while it ramped back up. Over the years I have caught him watching porn/looking at other girls online, I beg him to stop, to go to therapy. I tell him its going to damage him in the long run, if it hasnt already. Ive told him its going to damage us, but I know he has to make the change for him and nobody else. He agrees to change.. and then just slips back into his secretive ways. This past year our sex life has take a HUGE dive. I have to initiate constantly, and 90% of the time I get rejected, or he acts like its a huge chore. He has sexual energy, as Ive caught him so much looking at other girls on Instagram and jacking off to them etc. It hurts me that its not energy for me. Im 15 weeks pregnant btw, not showing at all, just big boobs and big ass, I feel Ive become WAY more attractive, or at least I look more like all the girls hes googling. Ive asked if maybe hes afraid to do it because Im pregnant, and he said thats not it. Im slowly resenting him because Im never getting sex, maaaybe once every 2 weeks, if I initiate. Ive tried dressing sexier, I suggest changing positions, but he never wants to. I try to nag less, and love him even more, thinking maybe Im just being a bitch and he needs more love from me. Yesterday was the last, last straw. Ive been begging him the past couple months to go to therapy, and that I would go too, because I have things I need to work on as well. Ive told him I dont want whatever energy weve got going on to be here when the baby gets here. He says he will and that its a good idea, but never ends up going. I beg him to exercise (I ask him to exercise with me, and sometimes he does)and spend less time on his phone, maybe hes depressed is my thought. Says he will, never does. After a week of trying to initiate sex and constantly getting rejected, he tells me again that he has problems with vulnerability and that this isnt new. I told him that he needs to sign up for therapy tomorrow, otherwise our relationship will fall apart. It just will. I told him this problem isnt magically going to go away. You cant do this alone. Sex is important to me. Obviously he can get off to other women on a daily basis, so thats not the issue (did not say this to him). I told him Im tired of feeling rejected and not wanted, of feeling ugly. He just got far away and kind of pissy, rolled over and went to bed. Didnt say anything, just ok in a monotone voice. I love him SO much, and it broke my heart to even mention to him that our relationship will fall apart if he doesnt get help. My feelings towards him have been so much resentment lately, I just want to be loved. I want him to look up from his phone, to put it down for 2 hours and just be with me. I want to be together forever.. but his actions (or lack there of) are slowly eating away at my very core. I will do everything in my power before I leave him to make it work.. I just need him to try too.. is this asking too much?"
4,vulnerability,DeadBedrooms,The Nature or Marriage? - a non-scientific poll,1,i78yuw,https://www.reddit.com/r/DeadBedrooms/comments/i78yuw/the_nature_or_marriage_a_nonscientific_poll/,2020-08-11 03:13:25,"Does the DB mainly happen in marriage or does this occur as frequently in other relationship arrangements? Just curious if it is the nature of marriage that puts the lights out on sex. Im the woman, by the way, and am stuck in a loveless marriage (for now). IMO married people should be able to have hot intimacy, as that arrangement allows for the greatest vulnerability with each other and enforces tremendous growth. Unfortunately it seems for many it devolves into roommates and career and kids and then one person decides that its just too much work/ uncomfortable to live life with someone AND have physical intimacy with them. Laziness? Complacency? Wanting to trade up? Such a sad story for many."
5,vulnerability,DeadBedrooms,The Nature of Marriage? A non-scientific poll,1,i790iw,https://www.reddit.com/r/DeadBedrooms/comments/i790iw/the_nature_of_marriage_a_nonscientific_poll/,2020-08-11 03:15:46,"Does the DB mainly happen in marriage or does this occur as frequently in other relationship arrangements? Just curious if it is the nature of marriage that puts the lights out on sex. Im the woman, by the way, and am stuck in a loveless marriage (for now). IMO married people should be able to have hot intimacy, as that arrangement allows for the greatest vulnerability with each other and enforces tremendous growth. Unfortunately it seems for many it devolves into roommates and career and kids and then one person decides that its just too much work/ uncomfortable to live life with someone AND have physical intimacy with them. Laziness? Complacency? Wanting to trade up? Such a sad story for many."
6,vulnerability,DeadBedrooms,Ladies please help a younger sister out,1,iamlm3,https://www.reddit.com/r/DeadBedrooms/comments/iamlm3/ladies_please_help_a_younger_sister_out/,2020-08-16 14:57:29,Hello! I am 24f with a low libido because of the following: - I was sexually abused as a child - intimacy is very hard for me because it requires vulnerability - grew up strict Christian so zero exploration or teenage hijinks. And being shamed for even thinking about sex - depression medication Since about 20 years old I've become increasingly frustrated with my libido. I want to plow and be plowed. The mental desire is there but I can't get my body to want it. Any other girls like this? What did you do? How can I find what I like and what turns me on?
7,vulnerability,DeadBedrooms,"""Your emotional needs not being met in relationships."" How to properly set up a healthy environment to have ""the talk,"" and what to do if that doesn't work by looking into ourselves.",1,ic63hw,https://www.reddit.com/r/DeadBedrooms/comments/ic63hw/your_emotional_needs_not_being_met_in/,2020-08-19 04:00:25," [URL The following are bullet points pulled from the video for conversation, but it is well worth the watch (or five.) &amp;#x200B; When people mention repeatedly having ""the talk,"" I imagine they went through a process similar to that in the video. They may have started off with a gentle bid for vulnerability, and eventually, with repeated rejections, ended up demanding their partner acknowledge what they are doing wrong. This creates an environment where our partners don't want to engage, because despite their ""aloof"" appearance, they are just as stressed as we are underneath the surface. This is where you get false promises (to stop the discomfort,) emotional gridlock, or stonewalling. &amp;#x200B; &gt;""Our partner is repeatedly not hearing us, because the very nature of this dynamic is they are not picking up on the request for emotional connection."" This right here is where the resentment begins. I think many end up posting here when they have reached this stage. That is when I reached out. It is incredibly painful to not have reciprocity when being vulnerable in a relationship. It activates the nervous system and makes us feel like something is wrong. I remember feeling a buzzing in my body for vast amounts of time. It sent me into a frenzy trying to resolve the problem. I still get unwanted zaps here and there or feel my heart drop. Meanwhile, my partner was retracting further into his shell because all of that emotional charge was overwhelming. &amp;#x200B; &gt;""I'm blurting out my truth."" When people post here about TELLING their partners how the lack of intimacy is affecting them (as I tried after repeated failure being subtle,) this is exactly what is happening. They finally-often with encouragement from others-explain righteously to their partner how they have failed them. We have a narrative in our head, ""If only they were more vulnerable. If only they went to therapy. If only they would acknowledge my feelings and give me what I want."" This makes the partner being ""told"" feel inadequate. &amp;#x200B; &gt;""Instead of taking care of ourselves, we usually feel compelled to focus on the other person, and to let him or her know they are lacking."" And the truth shall set you free! Now, this is not true for every poster here. In fact, I believe most people are trying to do whatever they can to help the situation. But as Alan suggests in the video, this commentary on our partner's personality rarely comes from a place of altruism. It is incredibly easy to slip into that state of mind, and punish our partners because we are unable to comfort ourselves. ""We're still manipulating the conversation to get our needs met."" &amp;#x200B; &gt;""You picked a partner who withholds vulnerable presence; who withholds emotional availability. That's who you picked!"" All of this makes the other person feel guarded instead of vulnerable. This creates shame, fear, and avoidance. Thus, the pursuer-distancer dynamic. I'm sure many people here are more aware than I was on that, but it is worth mentioning. I truly thought it was not the dynamic in my relationship as I have a long history of stifling my needs for my relationship. Eventually I fell prey and got caught up in my righteous ""blurting my truth."" It took me a while to see how I contributed. Alan's first piece of the puzzle to get out of this mess-focus on our own distress. If you panic and don't trust your partner, that is about YOU. ""This is my lack of being able to manage my own discomfort when my needs for emotional attunement are not met."" My partner often NEEDS me to tell him that I love him and will never leave him. That level of insecurity makes me feel trapped and I emotionally zone out because it is too heavy. I don't feel like I can authentically say that when it's demanded of me. Those are probably the exact feelings he had when I told him I wanted to be able to connect emotionally during sex, or when I tried to show him what I wanted from foreplay. &amp;#x200B; &gt;Do I stay or do I leave? Many of us are looping through this process much longer than we should because of our attachment injuries. ""I will stay stuck in this dynamic forever to avoid facing my inability to soothe myself."" We are not thinking that, but it is lingering constantly beneath the surface. Thus comes the fork in the road for each person willing to focus on themselves. It begins with what Alan refers to as a ""softened startup."" We ask our partner for vulnerability leading with ourselves. The hope is that we realize this BEFORE approaching our partners, as otherwise the damage is done and we have to settle the atmosphere before we can approach again safely. I imagine most here will have to start over, which is a long hard process, but doable. This has been my approach. I've been working on self-soothing for months now, and even as someone who grew up rejecting the need for human comfort it is incredibly hard. In my situation there is a disconnect that is keeping me in this state. I am stuffing down my emotional needs to keep the peace. I understand the need to look inwards instead of focusing on my partner. It is my job to decide if this is a result from the previous attempts at forced vulnerability, or if my partner is simply incapable of achieving the level of vulnerability I ""think"" I need in a relationship. Either way, it was imperative that I stop trying to get him to understand me. I stopped talking about it and I politely excused myself to do something distracting if I felt that buzzing urge to connect acting up. &amp;#x200B; &gt;The way you are asking for it is shutting the person down. At this point, the hope is that when you are able to come from a place of vulnerability your partner will respond accordingly. If they feel safe to open up to you, you might be able to get a lot more out of the conversation. It could become a ""us"" vs the problem instead of ""you're the problem."" When we ask our partners if they find us attractive, if they still love us, what we've done wrong, etc. we are subconsciously blaming them for how we feel, and this makes them feel shame, and subsequently shut down emotionally. For those this doesn't work for, the person might not have the skill to hear any feedback or be able to engage in conversation. This is where you need to have a heart-to-heart with yourself in a practical (unemotional) way. &amp;#x200B; &gt;""Is this the best choice for me at this time in my life to be in this relationship?"" There are probably a decent percentage of us in this camp. I have the ""forever relationship"" programmed into my brain. Sometimes, I wonder if I am gas-lighting myself about my emotional needs. Asking for vulnerability from someone else seems needy to me because I am afraid of providing that vulnerability myself. I feel this is part childhood attachment issues and part training from my partner over years to have weak boundaries. I've been working on reducing the stress in our environment, but I do not believe my person has the ability to be intimately available in the way I wish he was. I have no intention of trying to connect with him again on that level because of how upsetting it was to him (and me!) before. At this point, the problem is really figuring out why I feel the need to stay in a relationship with someone who is unable to be vulnerable to my needs, and doesn't have the emotional capacity to build desire in our relationship. WE need to change. I hope this helps someone understand why our partners shut down, and how we contribute to that dynamic. It may be obvious to some, but I grew up in an environment of endured suffering in silence, so I had no practical knowledge on how to express that my needs aren't being met. I'm trying to build those skills. I know it's not a solution, but it's a start. &amp;#x200B; I think this is my longest one yet."
