,topic,subreddit,title,score,id,url,created,body
120,vulnerability,DeadBedrooms,"HLs - do any of you feel that youre primarily responsible for the DB, whether you admit it to your partner or not? In what ways does fault matter?",7,7v4ceb,https://www.reddit.com/r/DeadBedrooms/comments/7v4ceb/hls_do_any_of_you_feel_that_youre_primarily/,2018-02-04 14:30:25,"Hi guys. Ive been pouring through this subreddit for hours at a time since last week - nearly unable to set my phone down. It includes some of the most eye-opening, insightful, and gut-wrenching reading material that Ive ever had the honor of laying eyes on, so thank you all. Im a 38 year old LLF and my HL husband is the same age. Weve been married for almost 4 years and living together in a committed relationship for over a decade . We also share a 3 year old daughter. Id estimate that weve had a DB situation going on for the past 7 years or so, but within the last 2-3 years our marital issues have expanded and worsened in their severity to the point that Ive visited a divorce attorney for a consultation. Although logically I realize that its not at all constructive I continually feel this overwhelming need to understand whos fault the whole thing is. Now, please realize that by fault I dont mean malice- I dont believe that my husband is intentionally trying to hurt me, and I would certainly never do that to him. Im aware that it takes two to tango, and I readily admit to being a shitty partner in this respect for a loooooong time. He deserved to feel wanted and to enjoy the physical pleasure and release of an orgasm on a far more frequent basis. I take responsibility for not doing nearly enough to try and solve the problem when It began. I understand that I failed him in many ways, but please.....hear me out. My husband has been sporadically cheating on me for many years, probably since the start of our relationship. (though he denies it began that early on. ) For the first 3 or 4 years of our relationship we had what I felt was a very mutually satisfying sex life, and if he didnt share that sentiment he certainly never said so. We had sex nearly every time the opportunity arose, we were even active in the lifestyle (swinging), and we had FUN together in bed. We were very much in love, too. He scored his dream job across the country, and I didnt hesitate to go with him. Then - about a year later - I discovered that almost every night while I was away at work he would go online and peruse the casual encounters section of Craigs list, often corresponding with potential hook-ups via email or text, and occasionally meeting them in person. Hed kept all of that from me for a year or more, and Id had no idea. NONE. Id had no reason to believe he wasnt satisfied and my trust in him was shattered. At that time he was profusely apologetic - expressing remorse, shame, and a commitment to change. He cried and told me he thought there was something wrong with him...that he wanted to be better for me. I think I loved him more because of those moments of vulnerability. We promised to figure it out together, whatever it was. It didnt go away. But you know what did? Yep. Slowly....insidiously, my libido all but slipped away. I stopped feeling excited when we were alone together. It got to the point where Id need to get drunk and really psych myself up for the event. He could sense the change, he later told me. It just got progressively worse- less and less frequent - but oddly other areas of our relationship seemed to be thriving. I began to feel safe with him again. I thought (I prayed) that those animalistic urges that I used to have to devour every aspect of him would follow suit, and it was around that time we decided to have a child together and get married. We were not prepared for parenthood-it hit us both extremely hard and I especially did not adjust particularly well to the demands. Around the time Id returned to work following maternity leave I was hit with traumatic infidelity discovery #2 - that hed never really stopped at all. That was about 3 years ago. The only thing about his behavior thats changed since then is that he doesnt apologize for his behavior anymore - not the lies, not the disregard for my feelings or boundaries. None of it. I dont trust him because hes proven to me over and over again that I shouldnt. When confronted about his secrets I get some version of, yeah, well I need to get laid sometimes.. I even educated myself on open relationships, came to terms with my own hang ups about it, and offered that arrangement as a potential solution. I felt guilty and sad that I didnt want to have sex with him- I wanted us to be happy again. It never worked out because he refused to agree on or adhere to any sort of guidelines, and the lies continued. The fact that he cant admit when hes screwed up, take responsibility, and offer a genuine apology for anything anymore has all but turned me off completely when it comes to him. I felt as though hes afraid to be vulnerable around me anymore. He blames everything on me, and continues to this day to insist that everything hes ever done in secret and lied to me about is a result of some deficit of mine. I need to feel like Im not crazy....because I feel like Im being gaslighted in the most f-ed up way imaginable. Im starting to doubt my own instincts. Also, I may have a LL , but - I HATE THIS DEAD BEDROOM. I want nothing more than a sexual experience that leaves me feeling pursued, lusted after, treasured, LOVED. Cared about. Fawned over. Is this my fault??"
121,vulnerability,DeadBedrooms,I am ready... but worried about delivery.,9,7w0srl,https://www.reddit.com/r/DeadBedrooms/comments/7w0srl/i_am_ready_but_worried_about_delivery/,2018-02-08 11:21:54,"Male 40-HL (me)/ Male 51 LL . 10 year gay LTR. 5 year DB . After many years of surviving all the classic BS excuses and zero effort on working on our DB I am finally ready to pull the plug. I asked him to meet up and when he asked what for I linked him to this wonderful group. Seen but no response yet. So, I am finally ready to GTFO but worried about delivery. Part of me wants it to be brutally honest with possible crippling consequences (bottled up anger, resentment and feelings of revenge). But then I channel the inner Mother Teresa and she suggests a more merciful approach with lots of vaseline and organic Coconut Oil to soothe any emotional boo boos that might result. Then there's just leaving and not saying much except my own personalized version of ""Bye Felicia"". Whichever I end up deciding will get the job done but I feel the nice approach might be the riskiest, exposing me to vulnerability, pity or whatever manipulative tactic he will come up with. At this point it'd be great if we remained friends (we run a non-profit together) but I am ok with whatever. Any advice is greatly appreciated."
122,vulnerability,DeadBedrooms,Geeks Need Loving Too!!!,0,7weuv8,https://www.reddit.com/r/DeadBedrooms/comments/7weuv8/geeks_need_loving_too/,2018-02-10 04:05:41,"**If you were the ""smart kid in your class who never got lucky"", then this post is for you! I suspect that we're more than a little overrepresented on this forum.** tl;dr: Avoiding sex is a form of emotional cutoff, and can be mediated by raising or lowering LLs anxiety level. In a relationship, both partners are balancing the need to feel close with the need for self protection (limiting vulnerability). If you've already left your SO, please just leave and don't down-vote. This may not apply to you because your narcissist crazy lazy hazy douchbag of a former partner could not be changed no matter what you did, but there are plenty of geeks who need to get laid and can use this info to get there. They have been made fun of, and ridiculed, and made to feel unworthy of love and sex their whole life. Don't make it worse by taking away their only chance at getting some action in the near future. --- This is a collection of links to help you understand the science behind your DB, and what you can do about it. The basic idea is that cutting off sex is a form of *emotional cutoff* or *distancing* behaviour that is undertaken by LL as they attempt to balance their need for closeness with their need for self-protection from feeling vulnerable and getting hurt. LL unconsciously blocks their own natural desire when they are feeling too close, and when they perceive that they would be too hurtful if they were to lose you. --- There are two situations in which LL is likely to abandon their self-protective distancing strategy and get back to seeking closeness (sex): * **Raise Anxiety: Increase their perceived risk of you leaving** * Breakup, or create the impression that a breakup is imminent * Improve yourself and your attractiveness to the point that they feel inferior and fear that you will ""trade up"" to a new partner * Lower LLs self-esteem using negative feedback, insults, and ""putting them in their place"" * Stop pursuing sex. Note that it is not the lack of pursuit that is important, but LLs impression that you no longer desire sex. If LL thinks that you have stopped initiating for the purpose of trying to get LL to start chasing, then this can last forever. LL will only start chasing when they fully believe that you no longer desire sex with them. This is a terrible strategy since in most cases, LL implicitly knows that HL always wants sex, so this just leads to a long dry spell. * Using emotional cutoff (anger, resentment, and withdrawal of affection) to decrease closeness and remove the need for self-protective behavious * **Lower Anxiety: Decrease LLs perceived risk that you will leave** * Provide consistent and reliable reassurance that you love them and they are desirable * Provide reassurance that you view them as an adequate and capable partner; that they are doing a good job of giving you what you need in a relationship * Increase non-sexual affection and displays of love * Reassure them that you are consistently available to them to meet their needs for affection, both sexual and non-sexual * Raise their self esteem by providing external validation of their self worth (telling them they are beautiful, loveable, and competent in all aspects of their life) while also introducing them to the concept of self-validation and encouraging them to adopt self-validation as their primary source of self worth. --- Note that the first option, while somewhat effective, is abusive in nature, and should be avoided. It will eventually raise anxiety on both sides to intolerable levels and facilitate an explosive end to the relationship. The second strategy, while more difficult, is the preferred way to escape your DB. But it requires developing your own self-validated sense of self-worth and self-esteem so you can stop letting sensitivity to rejection push you toward your own self-protective distancing actions (emotional withdrawal rather than sexual withdrawal). It requires first understanding the concept of differentiation of self, and working toward raising your level of differentiation (aka emotional maturity). ""The Happiness Trap"" by Russ Harris introduces the core concepts of [Acceptance and Commitment Therapy -- ACT](URL that can help you actually implement some of the core concepts of differentiation and self-esteem maintenance. --- The core idea behind this post can be found in this paper: [Balancing Connectedness and Self-Protections Goals in Close Relationships](URL --- The following links can help you evaluate where you are, and where you should be heading if you want to get back to having sex: These self-surveys can provide good insight into what a healthy (and sex filled) relationship looks like. Take the surveys, and work on areas where you are not being as effective as you could be. Bowen Theory says that your SO is at roughly the same level as you, and as you raise your level of emotional maturity, they will follow suit. [Assessment of Family Interaction](URL [Resilience - Hardness - Differentiation Self Evaluation](URL [Mental Health Items to Consider](URL [Family Systems and Murray Bowen Theory](URL In Bowen Theory withdrawal of sex is considered a form of emotional cutoff, and the key to eliminating it is for one or both partners to achieve a higher level of [*differentiation of self*](URL If you're a geek, and you've always felt like you didn't understand why folks far less attractive than yourself seemed to be much more successful getting laid, this theory is your friend! In the words of Homer Simpson: ""Who'd have thought that reading and writing would pay off?"" If this is too much info all at once, ""Passionate Marriage"" by David Schnarch is basically the ""for Sexually Frustrated Dummies"" version of Bowen Theory."
123,vulnerability,DeadBedrooms,"6 I'm(30F) finally in a stable, emotionally secure relationship(34M) and sex feels boring - help!",8,7lb6ss,https://www.reddit.com/r/DeadBedrooms/comments/7lb6ss/6_im30f_finally_in_a_stable_emotionally_secure/,2017-12-22 05:04:52,"Hey Redditors, Posting this from r/sex because someone suggested this might be a better venue for my issue. So, for most of my life I've been single. Dated around a bit but mostly just hooked up with people or had FWB's. I definitely had issues with vulnerability and intimacy so stayed away from it. I also put sex on a pedestal and was sort of sex crazy, though I wouldn't call myself an addict. My libido has always been very high, I regularly would masturbate multiple times a day, have crazy sex, most guys couldn't keep up with me, and I was told my many men how I was the best they'd ever had, etc. Though I wasn't aware of it at the time of course, I'm pretty sure I derived much of the pleasure from sex from making the other person feel good because it validated my self-worth and made me feel powerful. I definitely have spent a lot of my life trying to please other people as a way to gain validation because I couldn't give it to myself. I used sex as a tool to feel powerful, though ironically all I was doing was giving away my own power. Anyway, fast forward to years of therapy and a lot of work on myself and I'm in a relationship with an amazing human who is caring and sensitive. And I feel bored, have a hard time getting aroused or feeling in the mood for sex ever. We haven't been together very long (6-8 months ish) so I don't think it's just that we've gotten into a rut. His penis is on the smaller side for what I'm used to and I've previously always been a size queen. I would automatically lose my attraction if I was hooking up with a guy who had a penis on the smaller size. He's definitely not small small, like 5"" with a decent girth but I usually prefer 6.5-8inches with a solid girth. In my head, I blamed his penis size for awhile for my disinterest but I don't think that's it. He's able to use it well and it does feel good for the most part when we have sex. I am pretty sure the reason I'm not getting turned on is because this feels safe and secure and that feels boring in my head. I feel so bad for both him and myself and desperately want to fix this! How do I get myself to believe that safe, emotionally connective sex can and is hot?? TL;DR: Used to have a lot of sex, got into a solid relationship for the first time in my life and all of a sudden have zero libido. How do I convince my brain that safe, emotionally connective sex is hot??"
124,vulnerability,DeadBedrooms,LL Male: some more stuff,7,7m12i7,https://www.reddit.com/r/DeadBedrooms/comments/7m12i7/ll_male_some_more_stuff/,2017-12-25 23:03:13,"A couple of days ago I posted my thoughts about my experience as an LL M. Quick TLDR: turned on easily, but finding sex itself offputting , and disliking what for me is the aimless nature of the act. Got comments saying: thanks, this is new; also saying: you're probably autistic; you may need another partner or another kink; and you can't be both horny and LL. All fair and good. I appreciate the time you took. Two replies, in ascending order of significance. 1) Autism, 'wrong partner', 'wrong kink', and the mystery of being a horny LL. I may indeed be borderline PDD. Or not. The neuro background makes very little difference: my personality is what it is, whether there is a DSM name for it or not. Partner: she's doing her best. My guess is if she was a better 'toucher' (and idem if I would find a better turn-on), that would make the whole thing totally unbearable. It's the vulnerability aspect and lack of clear body borders that make it stressful and causes the grossing out - not the sounds or scents or textures. So yes, one can look at women and have pants-piercing erections while being absolutely averse to actual sex because one doesn't want to have someone that physically close while playing a pointless game. People's motivations are often contradictory. Life is complex. 2) More serious stuff. This is largely an HL forum and much of the volume is about cracking the LL code. After subtracting illness and dysfunction, cheating, control issues, passive aggression, tacit anger and maybe just confusion, you're left with a certain constituency of LLs who fit none of the above. They may be otherwise good partners. They may even be good lovers. But they're not into it. I tried to describe one variant from the inside. If you think with me instead of trying to explain me away, perhaps you get some LL behavior. You don't need to endorse or legitimize. E.g., there's a recurring theme in some stories here. An HL, typically female, would say: he's a good partner, and when we have sex it's great, but it's too rare for me. Replies usually try to console or advise. Nowhere have I seen anyone raising this question: if the experience was good, why isn't the partner interested in repeating it? If it was me, I'd reply: precisely because it was good. It replenished the sexual credit balance. Now I can rest for longer. Sex is an obligation: it means putting on a mask for a while and pretending to be where I'm not. I can never be there because being that close would kill me as a person. You get this, perhaps you get some apparent LLs you run into."
125,vulnerability,DeadBedrooms,How to adjust your partners libido,8,7pqgju,https://www.reddit.com/r/DeadBedrooms/comments/7pqgju/how_to_adjust_your_partners_libido/,2018-01-12 06:12:56,"There are times in every relationship when there is a desire discrepancy, and by virtue of the fact that you are on this sub, this has certainly been a problem in your relationship(s). This is a guide for LLs and HLs who want to find a way to adjust their partner's libido up or down, but aren't sure how to do that. The bad news is that you only have indirect control over your partner's libido. The good news is, tht still gives you some control! The LL always controls the frequency of sex and the HL always controls the frequency of the initiations. The HL initiates, and the LL decides which initiations to accept. But the HLs actions, especially when they are rejected, can have a great influence over how likely the LL is to say yes. You can't negotiate desire, but you can and do influence your partner's willingness to accpet the vulnerability that comes with desiring you. At any given time, they are in full control of whether they allow themselves to be receptive to their own desire or not, and they can choose to completely shut down openness to desiring if they choose. They are much more likely to do that if doing so gets them the validation and reassurance they need to feel good about themselves. If you want them to want more sex, then you must find a way to make desiring sex the least anxiety and insecurity inducing option for them. If you want them to want less sex, then you must find a way to make having sex the most anxiety and insecurity inducing option for them. The following will show you how to do either of those things from the HL or the LL side of the equation. - **As an LL, the best thing you can do to lower HL's libido is have sex with them regularly.** This gives them the reassurance and validation they need and will reduce their libido over time from very high, to high over time. - **As the LL, the best thing you can do to increase HLs libido is to reject them regularly.** This will remove the reassurance and validation that they crave and probably lead to them desperately pursuing sex with you. If you do this enough, and they don't learn to deal with it well, then you can probably whip them up to a feverously high libido over time. - **As an HL, the best thing you can to do lower LL's libido is to work on getting more angry, resentful, and distant when you're rejected.** Your anger, and resentfulness, passive aggressive withdrawal of affection, and desperate pursuit are strong reassurance that LL is desirable and important to you. Use them as a reward when LL rejects you so they can get the reassurance and validation they need without resorting to sex. Pursue SO ever more desperately as they reject you more, and get as upset and passive aggressive as possible to provide maximum reassurance that you love them. Be consistent in acting that way when LL rejects you so that LL can learn that the way to get maximum affection and reassurance from you is to reduce the frequency of sex, even if it means forgoing the awesomeness of having orgasms themselves. If you do this enough, you can completely override their natural libido over time, and completely eliminate their desire for sex altogether. - **As the HL, the best thing you can do to increase LLs libido is to treat LL with love and respect whether you're having sex or not.** Give LL the reassurance they need all the time by showing LL consistent love regardless of what's happening in the bedroom. This requires learning to self soothe your hurt feelings when you get rejected and be capable of showing love even when you're not feeling the best. If you've spent years trying to lower their libido with anger and resentment, then it will take time for them to start to interpret this as anything other than a desperate attempt to get laid (thus still providing the reassurance and validation they need to fee loved), but once that passes and they start to see that you are not willing to give more reassurance the longer it's been since you've had sex, LL will be far less willing to forgo orgasms because the reward for doing so has been removed. Their libido will slowly increase. You may think that it's a bad idea to treat LL well when they reject you. You might think that they won't know that you want sex. Trust me, they already know this. Treating them well is a way better idea than rewarding LL with reassurance that you want them by getting all butthurt. That just confirms for them the above observation that the best way they can keep you wanting them is by refusing sex. We all want to feel wanted, both HL and LL. Give LL that gift when you have sex, not when when don't and you'll find that LL has more incentive to desire sex. Side note for LL: The above technique for raising your HLs desire only works up to the point where they feel completely defeated and destroyed at which point they will feel the need to exit the relationship. At that point, they will stop pursuing you in response to rejection, and will instead exit the relationship. Without that reassurance, you will suddenly find your libido will skyrocket, since you need sex to provide the validation and reassurance you used to get from HLs anger and resentment. If you offer them ""hysterical bonding"" sex for a while, then they can go back to a moderate level of wanting you, but they will not offer you the fervent wanting that you need to feel loved until you ramp up the rejections again. For both HL and LL, if you want to block your partner's ability to control your libido, while at the same time learning to take full control of your own, the David Schnarch books give an overview of the process of becoming differentiated which will instill you with those emotional superpowers. All the best, and please use this information responsibly and for good!"
