,topic,subreddit,title,score,id,url,created,body
106,vulnerability,DnDHomebrew,Troll-like playable race: feedback?,4,8xttdl,https://www.reddit.com/r/DnDHomebrew/comments/8xttdl/trolllike_playable_race_feedback/,2018-07-11 08:08:32,"#Ereyathic Troll *first draft* +2 con, +1 str **Brutish**: disadvantage on charisma skill checks to persuade **Vulnerability**: vulnerable to fire and acid damage. **Regeneration**: As a bonus action, expend one hit die and recover HP. You cannot use this action if you took fire or acid damage in the last turn. **Regrowth**: When an attack drops you to zero HP, unless the attack dealt fire or acid damage, you may add your proficiency modifier to death saving throws. If you stabilize you may immediately spend a hit die and recover that many HP. **Recovery**: * After taking a short rest, if you did not spend any hit dice, you recover one hit die. At fifth, tenth, fifteenth, and twentieth level the number of dice recovered increases by one. * When spending a hit die during a short rest, roll twice and choose the higher result. #Feat: Child of Ereyath +1 constitution or strength **Blood Fury**: while you are reduced to half your maximum hit points or fewer, you gain the following benefits: * *Superior Regeneration*: Whenever you spend a hit die to recover hit points, you may choose to gain a level of exhaustion in return for recovering the maximum number of hit points from that die. * *Born of the Mountain Storms*: you are resistant to cold and lightning damage. * *Ice Burst*: when you make a critical hit with a weapon attack, add your proficiency modifier as bonus cold damage."
107,vulnerability,DnDHomebrew,Iron Golem variant,1,8ya8qr,https://www.reddit.com/r/DnDHomebrew/comments/8ya8qr/iron_golem_variant/,2018-07-13 00:28:21,"I was reading up on golems and had an idea for a variant rule on iron golems. Haven't put a heap of thought into it and I've never created or changed a monster before, so any and all input would be greatly appreciated! **Variant Rule** Once per round while the iron golem has no use of its breath weapon, the iron golem has immunity to all elemental damage. The first attack that hits the golem and deals elemental damage is absorbed by the golem. The golem is now immune to that damage type (replacing immunity to fire). In addition to this, the golem's breath weapon is recharged and changes damage type to match the immunity. Recharging the breath weapon on a roll (Recharge 6) recharges the damage type most recently used. I feel like immunity to all damage types, even for one attack, is a bit unbalanced. Perhaps removing the fire absorption trait fixes this balance. Or maybe it should gain a vulnerability to one damage type depending on the type of breath weapon, similar to how the pokemon Kecleon operates. This would add in a fun puzzle-like element to the fight, as your players figure out this pairing and slam a fire-immune golem with cold attacks, for example."
108,vulnerability,DnDHomebrew,[5e] Custom weapons and a racial trait,0,8k9vjd,https://www.reddit.com/r/DnDHomebrew/comments/8k9vjd/5e_custom_weapons_and_a_racial_trait/,2018-05-18 12:35:18,"I'm trying to make some custom weapon effects and I need help balancing a racial trait. The complete race can be found here. URL Salt Weapons- Halite weapons automatically deposit small amounts of salt in any wound they leave. The result, is a painful cut that draws the focus from all but the most hardy of men. Halitess are immune to this effect, having grown up around sharp salt. Creatures that are immune to the poisoned condition are immune as well. After an attack with a salt weapon hits, flip a coin. If it lands on heads, the target has disadvantage on their next roll. Otherwise, nothing happens. When another creature would hit you with a melee attack, you can use your reaction to take half damage. After the attack hits, reduce your Armor Rank by 1. |Armor Rank|Fish Armor|Plate Armor| |---|---|---| |6(Pristine)|1d4 reactionary damage to unarmed strikes|Automatic success on first deflection -5 Base movement| |5(Average)|-|-5 Base movement| |4(Chipped)|Base AC falls by 1|Base AC falls by 1| |3(Fractured)|Base AC falls by 2|Base AC falls by 2| |2(Broken)|Base AC falls by 3|Base AC falls by 3| |1(Heart crystals only)|Vulnerability to slashing damage|Vulnerability to slashing damage|"
109,vulnerability,DnDHomebrew,Cantrips (5e),13,8lgeol,https://www.reddit.com/r/DnDHomebrew/comments/8lgeol/cantrips_5e/,2018-05-23 13:57:25,"So after u/HerziQuerzi and u/yolo_zombie 's posts I've got cantrips on the brain, so i thought I'd embrace the zeitgeist and brew a few myself. seeking feedback on the first pass **Fortify Object** Abjuration cantrip Casting Time 1 action Duration Concentration, up to 1 minute Range 30 feet Components V S M (an iron nail) Choose an object within range no bigger than an average door. That object gains resistance to damage for the duration of the spell - I know players are more often the ones trying to break something than they are trying to stop something being broken, so maybe in actual play this isnt useful enough to be picked. OTOH Ive recently had a lot of orcs battering doors, mooring lines slashed, etc of late, and some kind of item defense spell wouldve been nice. Maybe I should try to make it a 1st level spell, they are often less valued than cantrips. **Conjure Component** Conjuration cantrip Casting Time 1 action Duration 1 round Range self Components V S The material components of a spell you currently have prepared appear in your hands until the end of your next turn. This spell automatically fails if you attempt to conjure material components worth more than 5 gp. - this cantrip is a backup for having your component pouch/arcane focus stolen from you. I suppose you could choose to rely on it and run around without a component pouch, but youd be pushing all your spells to two actions to cast, which is a pretty steep charge when you could just use the item. But as a safety net for the times when your stuff is taken? Totally worth it. **Window** Divination cantrip Casting Time 1 action Duration 1 round Range touch Components V S Touch a solid object no more than 5 inches thick. Until the end of your next turn anyone looking at the object in a 1 circle around the spot where you touched can see what is on the other side of the object, as if it wasnt there. **Sit!** Enchantment cantrip Casting Time 1 action Duration instantaneous Range 30 ft Components V S The target must make a wisdom saving throw or immediately become prone. The target is immune to this effect if dropping prone would cause it direct harm (such as if it was flying) - alone this doesnt seem problematic, but it might combine with other effects poorly? **Hearth** Evocation cantrip Casting Time 1 action Duration 1 hour Range touch Components V M (A lump of charcoal) You touch one object that is no larger than 10 feet in any dimension. Until the spell ends, the object sheds heat like a small campfire warming things within 5 feet. Creatures travelling in areas of Extreme cold (DMG pg 110) automatically succeed on their saving throw to resist exhaustion if they spend the majority of each hour within the heat range of this spell. The spell ends if you cast it again or dismiss it as an action. If you target an object held or worn by a hostile creature, that creature must succeed on a Dexterity saving throw to avoid the spell. - I was going to just give advantage on the cold save, but if good coats give full immunity I figure a cantrip can too. **Lesser Stink Bomb** Illusion cantrip Casting Time 1 action Duration 1 minute Range 30 feet Components V S M ( a hair from a skunk) This spell creates a foul smell in a 10ft radius area. Any ability checks based around the sense of smell (such as perception checks to track by scent) are made with disadvantage in this area for the duration of the spell. -we dont have much in the way of smell illusions in game yet. Seemed good to start small. **Shadows Grip** Necromancy cantrip Casting Time 1 action Duration 1 round Range 30 feet Components V S Make a ranged spell attack. On a hit the target takes 2d4 damage and has disadvantage to Strength saving throws until the end of your next turn. - Dex would probably be more useful, but Str seemed more thematic. Normally you throw save effects at guys with good ACs and attacks at guys with good saves. The game has plenty of save effects to increase your chance to overcome his AC, but fewer attack effects to increase your chance to overcome his save. Seemed like a good spot for a cantrip **Embrittlement** Transmutation cantrip Casting Time 1 action Duration Concentration, up to 1 minute Range touch Components V M (A cracked cup) You touch one object that is no bigger than an average door. Until the spell ends, the object has vulnerability to one type of damage chosen when the spell is cast. If you target an object held or worn by a hostile creature, that creature must succeed on a Dexterity saving throw to avoid the spell. - Makes breaking open a locked chest or kicking in a door much easier. Or prepping before you use a firebolt to destroy evidence I guess. "
110,vulnerability,DnDHomebrew,"Glass Duplicate, a 5e scaling spell",7,8m0gty,https://www.reddit.com/r/DnDHomebrew/comments/8m0gty/glass_duplicate_a_5e_scaling_spell/,2018-05-25 19:38:30,"Im really proud of this, but its not without flaws, Id greatly appreciate any feedback and I hope you enjoy. Bonus: let me know how youd use this spell ##**Glass Duplicate** *3rd-Level Conjuration* Casting Time: 1 action Range: 10ft Components: V, S, M (a broken mirror) Duration: concentration up to 1 hour In an empty space within 10ft of you conjure a glass duplicate. The duplicate is an exact copy of you or an ally within range, complete with equipment. Duplicates made have the following exceptions. - it counts as a construct - it cannot speak or cast spells - Any magical items are non-magical - It has a Constitution score equal to your spell casting ability modifier. - It has 1 hitpoint and vulnerability to all damage other than poison which it is immune to. - It is immune to the Charmed, Frightened, Surprised and Poisoned conditions. - It cannot take reactions or bonus actions. It takes initiative immediately after your turn, and you may command it telepathically on each of its turns. When it is reduced to 0 hitpoints it shatters and all equipment it was conjured with is destroyed. When you cast this spell at 5th level or higher the duplicate may take reactions and bonus actions. In addition they have hitpoints, Strength and Constitution scores equal to your spell attack modifier. When you cast this spell at 7th level or higher you may conjure two duplicates instead. If you do so, they act on the same initiative. If you choose to create two duplicates, they may each be of different creatures. If you cast this spell at 9th level, the duplicates gain the ability to speak and cast spells. If you duplicate a spellcaster this way, they are created with the exact amount of spell slots as the spellcaster upon casting this spell, though they are unable to cast spells of 8th level or higher. "
111,vulnerability,DnDHomebrew,"""Lightly Cursed"" items",39,8mhxmx,https://www.reddit.com/r/DnDHomebrew/comments/8mhxmx/lightly_cursed_items/,2018-05-28 00:04:35,"*The odd shopkeep looks down at you from his street\-side wagon. ""Hmmm... Magical items, you say? That'll run you a pretty gold piece, and you... Well, you look more like copper folk. But I think I may have something for you...""* *He disappears from sight and the cart shakes a bit before he returns with a small sack of tinkling items. ""Mercantile bylaws say I have to warn you about how these items are cough\(*lightlycursed*\)cough and/or cough\(*defective*\)cough, but I think we can make a deal if you're interested...""* \-\-\-\-\-\-\-\-\-\- Basically I'm looking to make items that spice up combat at lower levels \(3\-6\), either by making a larger risk/reward variant compared to your average item or having a cost associated with the item's benefit. I want them to generally favor the user, but not overwhelmingly so. And I like the flavor that these are broken or knock\-off magical items, which is why they are generally less\-reliable than their normal, magical counterparts. Here are some examples: **Diviner's Scryglass**: A short, periscopic spyglass with a cracked lens. Once per day, the user may call upon it as a free action to make a DC10 WIS check. On a successful check, the user's next action or check has advantage; if unsuccessful, it has disadvantage. **Enigmatic Flask**: A small metallic flask, unremarkable at a glance. Once per day, user may drink from the flask and roll 1d4. If the result is even, the user heals 2d4 \+ 2 damage. If it is odd, the user takes 1d6 damage and must make a DC10 CON saving throw; on a failure, the user is poisoned. \-\-\-\-\-\-\-\-\-\- I'm also considering an elemental attuning fork that grants resistance to one damage type but vulnerability to another, though that seems hard to balance in a way that is satisfying. And really, I'm still tuning the hell out of all of these; it seems like a difficult balance to strike, though it could lead to some fun situations. I'm also considering the idea of the party being able to pass these items off to their arcanist friend who can fix or correct the enchantments on one item between modules. Do you have any feedback for these items or ideas for more? What do you think they should cost? I'm also fine with silly items that have no real mechanical affect at all, and I think my party would, too."
112,vulnerability,DnDHomebrew,More Necromancy Options For 5E,42,8pnlds,https://www.reddit.com/r/DnDHomebrew/comments/8pnlds/more_necromancy_options_for_5e/,2018-06-09 07:07:44,"Necromancers in 5e seem very limited to only animating humanoid creatures as undead. Not only that, but there are non\-humanoid undead in the *Monster Manuel*. So I decided to create a few more options for necromancers to play around with. # New Item **Potion of Vile Transformation** *Potion, rarity varies* When you drink this potion make a Constitution saving throw. On a failed save, you take poison damage and are poisoned for 24 hours. If you succeed, you take half damage and you are not poisoned. You can choose to fail the saving throw, and if you do you take the maximum possible poison damage. If you are killed by the poison damage, or die violently while poisoned, you will transform into an undead creature predetermined by the potion. The potion's liquid is a cloudy green color and when exposed to air it turns into a milky white color. The potion's rarity, as well as the amount of poison damage dealt, is determined by |Undead's CR|Poison Damage|Rarity| |:-|:-|:-| |1/2 or less|1d6|Uncommon| |1 to 3|2d8|Rare| |4 to 7|3d10|Very Rare| |8 or higher|4d12|Legendary| **DM Notes:** Some undead require extra conditions in order to be created using this potion. For example, this potion can only turn a target into a Lich after the subject has created a phylactery. It is up to the DM to determine if such an undead has an extra condition, and what the consequences are for not meeting that condition before using this potion. Another note, if a player uses this potion to try and become more powerful, don't be afraid to take control of their character until they are changed back, *if they are changed back*. # New Spells The following are new spell options for wizards and clerics: ***Animate The Inhuman*** *5th\-level necromancy* **Casting Time:** 1 minute **Range:** 10 feet **Components:** V, S, M (a drop of blood, a piece of flesh, and a pinch of bone dust) **Duration:** Instantaneous This spell grants an inhuman target with a false mimicry of life. Choose a pile of bones or a corpse of a Large or smaller non\-humanoid within range. The target gains the skeleton template if you chose bones or the zombie template if you chose a corpse (Both templates are detailed at the end of this document.) The creature is hostile to all creatures, including you. Roll initiative for the creature, which has its own turn. The creature pursues and attacks the nearest living creature to the best of its ability. ***Create Specter*** *5th\-level necromancy* **Casting Time:** 1 action **Range:** 10 feet **Components:** V, S, M (a black onyx stone worth at least 150 gp) **Duration:** Instantaneous This spell condemnes a creature's soul to serve you even in death. Target the corpse of a humanoid within range that has been dead for no more then 1 minute and died violently. The target's spirit rises as a specter in the space of its corpse or in the nearest unoccupied space. On each of your turns, you can use a bonus action to mentally command the specter you made with this spell if the specter is within 60 feet of you (if you control multiple specters, you can command any or all of them at the same time, issuing the same command to each one). You decide what action the specter will take and where it will move during its next turn, or you can issue a general Command, such as to guard a particular chamber or corridor. If you issue no commands, the creature only defends itself against hostile creatures. Once given an order, the creature continues to follow it until its task is complete. The specter is under your control for 24 hours, after which it stops obeying any command you've given it. To maintain the control of the specter for another 24 hours, you must cast this spell on the specter again before the current 24\-hour period ends. This use of the spell reasserts your control over up to three specters you have created with this spell, rather than creating a new one. ***Command Shadows*** *4th\-level necromancy* **Casting Time:** 1 action **Range:** 30 feet **Components:** V, S, M (a pintch of grave dust) **Duration:** Concentration, up to 1 minute This spell commands a target's shadow to rise against its original master. Target one Medium or Small humanoid within range. The target must must make a Charisma saving throw. On a failed save, the target's shadow animates becoming an undead creature (The DM has the shadow's game statistics). The shadow is hostile towards the target. Roll initiative for the shadow, which has its own turn. The shadow pursues and attacks the target creature to the best of its ability. If the spell ends, the shadow doesn't disappear if its target is dead. Instead, it acts in whatever manner it chooses until it is destroyed. At Higher Levels. When you cast this spell using a 6th level spell slot or higher, you can target one additional creature for every two spell slots above 4th level. ***Command The Lifeless*** *3rd\-level necromancy* **Casting Time:** 1 action **Range:** 60 feet **Components:** V, M (a black onyx stone worth at least 150 gp) **Duration:** Concentration, up to 1 minute This spell attempts to bring an undead creature under your thrall. Target one undead creature within range. The target must make a Charisma saving throw. If the target has an Intelligence of 8 or higher, it has advantage on the saving throw, and if it has an Intelligence of 12 or higher it automatically succeeds. On a failed save, the target becomes friendly to you and you control it for the duration. If it succeeds, you can't target the creature with this spell again for 24 hours. As a bonus action on each of your turns, you can mentally command any creature you control with this spell if the creature is within 120 feet of you (if you control multiple creatures, you can command any or all of them at the same time, issuing the same Command to each one). You decide what action the creature will take and where it will move during its next turn, or you can issue a general command, such as to guard a particular chamber or corridor. If you issue no commands, the creature only defends itself against hostile creatures. Once given an order, the creature continues to follow it until its task is complete. **At Higher Levels.** If you cast this spell using a spell slot of 4th level or higher, the duration is concentration, up to 10 minutes. If you use a spell slot of 5th level or higher, the duration is 1 hour. If you use a spell slot of 7th level or higher, the duration is 24 hours. If you use a 9th level spell slot, the spell lasts until it is dispelled. Using a spell slot of 5th level or higher grants a duration that doesn't require Concentration. # Templates **Disclaimer.** The following templates were already found in the *Dungeon Master's Guide* on *page 282*. They are only listed here to make them more noticeable to the DMs that may have missed them. The following templates are meant to help DMs create interesting non\-humanoid zombies and skeletons for their players to encounter. Any ability score adjustments granted by these templates can not reduce a creature's score below 1, and it can not increase the score above 30. **Undead Nature.** These creatures do not require air, food, drink, or sleep. ***Skeleton*** just about any living creature with an internal skeleton can become a skeleton. When a creature becomes a skeleton, it retains all it's statistics except as noted below. **Ability Score Adjustments.** Increase the skeleton's Dexterity score by 2. Reduce the skeleton's Intelligence and Charisma scores by 4. **Alignment.** The skeleton's alignment becomes Lawful Evil. **Creature Type.** The skeleton's creature type becomes undead. **Senses.** Skeletons gains darkvision with a radius of 60 feet. **Immunities.** The skeleton gains immunities to poison damage and exhaustion, and it can not be poisoned. **Vulnerabilities.** The skeleton gains vulnerability to bludgeoning damage. **Languages.** Skeletons understands the languages they knew in life but they can't speak. ***Zombie*** just about any living creature can become a zombie. When a creature becomes a zombie, it retains all it's statistics except as noted below. **Ability Score Adjustments.** Increase the zombie's Strength score by 1, and its Constitution score by 2. Reduce the zombie's Intelligence score by 6, and its Wisdom and Charisma scores by 4. **Alignment.** The zombie's alignment becomes Neutral Evil. **Speed.** The zombie's speed is reduced by 10 feet, to a minimum of 5 feet. **Creature Type.** The zombie's creature type becomes undead. **Senses.** Zombies gains darkvision with a radius of 60 feet. **Immunities.** The zombie gains immunities to poison damage and exhaustion, and it can not be poisoned. **Undead Fortitude.** If damage reduces the zombie to 0 hit points, it must make a Constitution saving throw with a DC of 5 \+ the damage taken, unless the damage is radiant or from a critical hit. On a success, the zombie drops to 1 hit point instead. **Languages.** Zombies understands the languages they knew in life but they can't speak."
