,topic,subreddit,title,score,id,url,created,body
31,vulnerability,DnDHomebrew,"[OC] [New Magic type] Okay so I have no idea if this format will work, but I had no idea how to share this draft any other way, so basically I'm making new magic type with spells and all so If you could GIVE ME SMALL FEEDBACK I will be SO DAM HAPPY &lt;3",2,gh8myq,https://www.reddit.com/r/DnDHomebrew/comments/gh8myq/oc_new_magic_type_okay_so_i_have_no_idea_if_this/,2020-05-11 06:14:57,"Negative Magic \*Draft\* (Based idea - Mister Negative, Marvel) Overall description: Negative magic is one of the Forgotten Magics in this world alongside Onomancy and Dunemancy. Not much is known about this type of magic, but what is known tells us about its power to manipulate feelings, substance and form. Some old documents also speak about its negative effect on the user itself as well as others, thus the name Negative Magic comes. Some scripts also mention this magic with name Infitimancy, which roughly means magic of reversing, magic of opposition, magic of negativity. Changing base of magic to its opposite form. Negative in Latin - negativus, infitialis, abdicativus Possible attributes - rejection, reforming, brief alteration, feeling manipulation, turning into opposite. Other forms of magic - Abjuration, Transmutation, Evocation, Enchantement, Illusion, Divination, Conjuration, Necromancy, Onomancy, Dunemancy. \-Mancy, -Ation, -Ement. Possible Names - Infiti-mancy, Infiti-ation, Infit-ement Name choice - Infitimancy (magic), Infitimancer (wizard). Main spell ideas: 1. To change someone's feelings towards someone or something. 2. Change the type of a spell to its opposite. For example - Fire to Cold, or Radiant to Nectoritc 3. Change resistance or immunity to its opposite. For example - Fire immunity to fire vulnerability. Incase of resistance, when its 50% damage, it can be altered so target takes 150% Resistance - Full damage is 24, but taken 12 Altered - Full damage is 24, but taken 36. Its not full 2x (48) damage but still quite rough. Thus implementing a new word? **Submission** \- when the creature is slightly more affected to type but not fully vulnerable. 4. Changing creatures' overall mental and physical state. Targeting game mechanics and changing ability modifiers. For example - Constitution 18 (+4), changing +4 to -4. 5. Adding new type of damage alongside already existing ones - Negative Type Damage. This type of damage targets creatures feelings and emotions, while psychic damage targets mind and physical - body. Note\* - will be working on subclasses as well, probably for any class that may be good with this idea. Also every spell is still work in progress and are of Infitimancy school. Spells By Level \*Draft\* **Cantrip\*** ***Unreliable Persona*** \- Basically reverse of the already known spell Friends. Casting Time - 1 Action Range/Area - Touch Components - V Duration - 1 minute, Concentration Class - Bard, Sorcerer, Warlock, Wizard For the duration, the target that you choose must make Charisma Save. On failed save it has disadvantage on all Charisma based checks. After Spell ends, the target has no memories of being affected by anything &amp;#x200B; ***Distract*** \- Reverse of also quite well known spell Guidance. Casting Time - 1 Action Range/Area - 30 feet Components - S, V Duration - 1 minute, Concentration Class - Bard, Warlock, Oathbreaker (paladin) Once before the spell ends, one creature of your choosing that you can see within 30 feet, subtracts 1d4 from the number it rolled when making an ability check. After results are known, spell ends. &amp;#x200B; ***Abdicative Dart*** Casting Time - 1 Action Range/Area - 90 feet Components - S, V Duration - instantaneous Damage - 1d10 Class - Sorcerer, Wizard Your fingers hurl in black and white aura creating dart-like endings on them. Make ranged spell attack against the target. On hit target takes 1d10 negative damage. Spells damage increases by 1d10 when you reach 5th (2d10), 11th (3d10) and 17th (4d10) level. &amp;#x200B; **1st Level\*** **Darkforce** Casting Time - 1 Bonus Action Range/Area - Self Components - S, V Duration - 1 minute, Concentration Class - Sorcerer, Warlock, Wizard (Infitimancer) Until duration all your attacks deal additional 1d4 negative damage. &amp;#x200B; ***Aspect of Fear*** Casting Time - 1 Action Range/Area - 30 feet Components - V Duration - 1 minute, Concentration Class - Bard, Shadow Magic (Sorcerer) Warlock, Wizard (Infitimancer) You touch a creature who becomes imbued by negative energy. For the duration or until concentration is broken, the target is Frightened and at the end of each of his turns he loses 1d4 hit points. When cast with a 2nd spell slot or higher, you may choose one additional target for each slot above first. &amp;#x200B; ***Reverse Type*** Casting Time - Reaction Range/Area - 60 feet Components - S, V Duration - instantaneous Class - Bard, Sorcerer, Wizard (Infitimancer) You weeve magic around one target you see within 60 feet. As a reaction you may change the natural damage type of a spell to any of your choosing. Example: fire to cold, necrotic to thunder, etc. &amp;#x200B; **2nd Level\*** ***Blade of Oni*** Casting Time - 1 Bonus Action Range/Area - Self Components - S, V Duration - 10 minute, Concentration Class - Warlock, Wizard (Infitimancer) You summon a blade of pure black and white energy for your ally or yourself. Energy hurls like tongues of black flame in a shape of Scimitar. For the duration this blade acts as your melee weapon which deals 3d6 negative damage. Anyone within 10 feet of this blade feels more angry and anxious. When casting this spell with 4th level slot or higher, damage is increased by 1d6 for every two slot levels above 2nd. &amp;#x200B; ***False Speech*** Casting Time - 1 Action Range/Area - Self Components - S, V Duration - 10 minute Class - Bard, Wizard (Infitimancer) You create unseen force around yourself that can only be seen by Truesight. While under effect of this spell, no one can discern whether or not you are lying. Anyone who tries to make Wisdom (insight) check, fails automatically without them even knowing. &amp;#x200B; **3rd Level\*** ***Negative Burst*** Casting Time - 1 Action Range/Area - Self Components - S, V Duration - instantaneous Class - Sorcerer, Warlock, Wizard (Infitimancer) You cover yourself with unstable negative energy that hardly can be contained. Every creature within 15 feet from you must make Constitution Save or take 8d6 negative damage on a failed save or half as much on a successful one. When casting this spell with 4th level slot or higher, damage is increased by 1d6 negative damage for every slot level above 3rd. &amp;#x200B; **4th Level\*** ***Full Reflect*** Casting Time - Reaction Range/Area - 60 feet Components - S, V Duration - Instantaneous Class - Bard, Sorcerer, Warlock, Wizard (Infitimancer) You reverse a spell's original source by altering its fundamentals. A spell of 4th level or lower is reflected back to its original caster if the caster is within 60 feet of you. If a spell is 5th level or higher, you must make ability check with DC of 10 + Spells level. On the success spell is reflected. &amp;#x200B; **5th Level\*** ***Submission*** Casting Time - 1 Action Range/Area - 90 feet Components - S, V Duration - 1 minute, Concentration Class - Bard, Sorcerer, Warlock, Wizard (Infitimancer) You target a creature within 90 feet of you affecting its ability to be much more or much less affected by damage type. For the duration targets one of its resistances becomes its vulnerability or vise versa. If the target has more than one resistance or vulnerability and if you are familiar with them, you may choose which one to affect, if you have no information about them then the DM chooses instead. &amp;#x200B; ***Negative Blast*** Casting Time - 1 Action Range/Area - 60 feet Components - S, V Duration - instantaneous Class - Bard, Sorcerer, Warlock, Wizard (Infitimancer) You concentrate negative energy into one singular point within your hands releasing a blast of this energy in a 60 feet line. Everyone in this line must make Constitution save taking 8d8 negative damage on failure or half as much on success. Damage of this spell increases by 1d8 for every spell slot level above 5th. &amp;#x200B; **7th Level\*** ***Inessential Aspect*** Casting Time - 1 Action Range/Area - 60 feet Components - S, V, M (Part of a target's clothing, Hair or any item used by target) Duration - 1 minute, Concentration Class - Bard, Sorcerer, Wizard (Infitimancer) You surround the target with imanse negative power channing its mental state for a time. For the duration you may choose one ability modifier of target that you can see within 60 feet of you, changing it from positive to negative (example: Wisdom 18 (+4), changing +4 to -4). When using the 8th spell slot for casting, you may choose 1 additional ability affecting 2 at the same time. When casting this spell with 9th level spell slot, you may permanently change 1 ability modifier to negative value. This effect can only be removed by Wish spell or casting Greater Restoration at 9th level. &amp;#x200B; **9th Level\*** ***Full Rejection*** Casting Time - Reaction Range/Area - 120 feet Components - S Duration - instantaneous Class - Bard, Sorcerer, Wizard (Infitimancer) You consume all negative power that surrounds you, releasing dome shaped waves fully disrupting every magical effect within 120 feet and ending them all at once. Any buff or debuff (like Resistance or Bane), any magical effect that gives bonus to damage or healing (like Beacon of Hope or Divine Favor) end immediately."
32,vulnerability,DnDHomebrew,The BloodForged. A Blood Hunter class based inspired by Crona from Soul Eater,1,ghfu24,https://www.reddit.com/r/DnDHomebrew/comments/ghfu24/the_bloodforged_a_blood_hunter_class_based/,2020-05-11 13:24:23,"Order of the BloodForged Not many know of the dangers that can lie in the seemingly inanimate. The Bloodforged, however, give there lives to the study and retrieval of cursed objects. They have seen first hand the devastation of nearly indestructible weapons that drive their wielders to madness and mass destruction. Seeing themselves as the worlds diseased healers, member of the order of the bloodforged take the curse into themselves so that it may die with them. It is only through the excruciating process of melting these weapons to their liquid form and replacing there own blood with this cursed molten metal that they can exclude the rest of the world from this danger. It is suggested that you take a curse for your character when you take this subclass. You and your DM may work together to come up with a curse or you can choose one from the table below. Curses: 1- You constantly hear the voice of a demon telling you to slaughter every one around you. You dont know how long you can keep resisting their will. 2- You are aging at a rapid rate. You are unsure if you will be able to be of any help to those you care about before expiring. 3- Body is in constant physical pain. You have grown dependent on a concoction that numbs it 4- During the transfusion ritual the weapon almost took over your body. You had to amputate in order to keep its influence from spreading 5- Your appearance is warped and beastly. It is hard for you to look non-hostile. 6- Your race has changed to that of a mostly evil aligned race. You feel more and more like one of them every day. 7- Whenever its quiet you hear the last cries of every person who was killed with the weapon. As a result you prefer loud environments. 8- A voice is offering you information on where to find more cursed items. You just have to do a few things for it first... ***Rite of War:*** you learn the esoteric rite of war (detail below) Rite of War: your rite damage is your choice of Bludgeoning, Piercing or Slashing type. ***Blood Iron:*** Starting when you join this order at 3rd level you have undergone the procedure that makes you one with your blade. You are able to summon your rite weapon from your own blood as a bonus action by taking your crimson rite damage. This weapon can take the form of any melee weapon you are proficient with. You may choose a different form each time you summon it. When you summon your rite weapon in this way it automatically is under the effect of one of your crimson rites. This weapon loses its heavy, or thrown tags if it has one and is considered light if it is not two-handed. This weapon lasts until the end of your next short or long rest. ***Sanguine Armor***: Starting at 3rd level you are able to use the liquid metal in your veins. When you are hit with an attack or targeted by an effect that deals Bludgeoning, Piercing, Poison, Thunder, or Slashing damage you may use your reaction to harden your veins to gain resistance to the damage of that attack or spell. You may do this a number of times equal to your Intelligence modifier per long rest. You may not use this ability to resist damage from your own blood hunter abilities. ***Consuming Transfusion:*** At 7th level, you are able to consume a magic weapon into your rite weapon by performing a special ritual. Over the course of 1 hour, while you hold the weapon, you perform the ritual. After this ritual is completed your rite weapon gains any magical properties the weapon you consumed had. When you consume a magic weapon in this way it takes one of your attunment slots whether or not the absorbed weapon required attunment. You may unattune a weapon as a bonus action in which the weapon is also destroyed. Additionally, when you absorb a weapon in this way you ignore all race and class requirements on use of this item. Bonuses to hit, such as with +1 weapons, do not stack with each other. You use the bonus of the weapon with the highest bonus. ***Tempered Blood:*** At 7h level your symbiosis with your weapon has become stronger. While not wearing armor your armor class becomes 14+Dexterity modifier. ***Brand of Destruction:*** Beginning at 11th level, your Brand of Castigation now directs the ire of your blood weapons curse. Any attack roll you make against the branded target is a critical hit on a roll of 18, 19 or 20 on the d20. Additionally the branded creature has vulnerability to any rite damage you deal to it. ***Morbid Puppeteer:*** At 15th level the cursed weapon in your blood has learned much about your body. If you reach 0 hit points, and are not killed outright, your blood puppeteers your body for 1 minute afterward allowing you to keep fighting. You still must make death saving throws every turn and you suffer the normal effects of taking damage while at 0 hit points. However, if you would die due to failing death saving throws or taking damage, you due not die until the end of that minute. This process is extremely draining. If you are healed in any way during this minuet you only gain half the hit points (rounded down) that you would normally receive. You cannot receive healing after you have failed all three death saving throws. ***Dark Spike:*** At 18th you learn to control your blood even outside of your body. Once per turn you may use one or both of your attacks to make a special attack. This attack must originate from a space where you have taken Bludgeoning, Necrotic, Piercing, Slashing, or Thunder, damage or damage from your own blood hunter abilities in the last hour and that you can see. This attack uses your Intelligence to hit, has a reach of 20ft. deals 2d10+Int modifier piercing damage and is considered magical for the sake of overcoming damage resistances. ##### Blood Curse of Retaliation *Prerequisite: 15th level, Order of the Bloodforged* As a reaction to being hit with a melee attack, you sharpen your blood and launch a counter attack Dealing 2d6 piercing damage to the creature that hit you. This damage is considered magical for the sake of overcoming damage resistances. ***Amplify:*** The targeted creature takes extra damage equal to twice the damage you take from your hemocraft die for amplifying."
33,vulnerability,DnDHomebrew,The Bloodforged: a Blood Hunter sub-class inspired by Crona from Soul Eater. C+C welcome,1,ghgdtn,https://www.reddit.com/r/DnDHomebrew/comments/ghgdtn/the_bloodforged_a_blood_hunter_subclass_inspired/,2020-05-11 14:02:44,"Order of the BloodForged Not many know of the dangers that can lie in the seemingly inanimate. The Bloodforged, however, give there lives to the study and retrieval of cursed objects. They have seen first hand the devastation of nearly indestructible weapons that drive their wielders to madness and mass destruction. Seeing themselves as the worlds diseased healers, member of the order of the bloodforged take the curse into themselves so that it may die with them. It is only through the excruciating process of melting these weapons to their liquid form and replacing there own blood with this cursed molten metal that they can exclude the rest of the world from this danger. It is suggested that you take a curse for your character when you take this subclass. You and your DM may work together to come up with a curse or you can choose one from the table below. Curses: 1- You constantly hear the voice of a demon telling you to slaughter every one around you. You dont know how long you can keep resisting their will. 2- You are aging at a rapid rate. You are unsure if you will be able to be of any help to those you care about before expiring. 3- Body is in constant physical pain. You have grown dependent on a concoction that numbs it 4- During the transfusion ritual the weapon almost took over your body. You had to amputate in order to keep its influence from spreading 5- Your appearance is warped and beastly. It is hard for you to look non-hostile. 6- Your race has changed to that of a mostly evil aligned race. You feel more and more like one of them every day. 7- Whenever its quiet you hear the last cries of every person who was killed with the weapon. As a result you prefer loud environments. 8- A voice is offering you information on where to find more cursed items. You just have to do a few things for it first... ***Rite of War:*** you learn the esoteric rite of war (detail below) Rite of War: your rite damage is your choice of Bludgeoning, Piercing or Slashing type. ***Blood Iron:*** Starting when you join this order at 3rd level you have undergone the procedure that makes you one with your blade. You are able to summon your rite weapon from your own blood as a bonus action by taking your crimson rite damage. This weapon can take the form of any melee weapon you are proficient with. You may choose a different form each time you summon it. When you summon your rite weapon in this way it automatically is under the effect of one of your crimson rites. This weapon loses its heavy, or thrown tags if it has one and is considered light if it is not two-handed. This weapon lasts until the end of your next short or long rest. ***Sanguine Armor***: Starting at 3rd level you are able to use the liquid metal in your veins. When you are hit with an attack or targeted by an effect that deals Bludgeoning, Piercing, Poison, Thunder, or Slashing damage you may use your reaction to harden your veins to gain resistance to the damage of that attack or spell. You may do this a number of times equal to your Intelligence modifier per long rest. You may not use this ability to resist damage from your own blood hunter abilities. ***Consuming Transfusion:*** At 7th level, you are able to consume a magic weapon into your rite weapon by performing a special ritual. Over the course of 1 hour, while you hold the weapon, you perform the ritual. After this ritual is completed your rite weapon gains any magical properties the weapon you consumed had. When you consume a magic weapon in this way it takes one of your attunment slots whether or not the absorbed weapon required attunment. You may unattune a weapon as a bonus action in which the weapon is also destroyed. Additionally, when you absorb a weapon in this way you ignore all race and class requirements on use of this item. Bonuses to hit, such as with +1 weapons, do not stack with each other. You use the bonus of the weapon with the highest bonus. ***Tempered Blood:*** At 7h level your symbiosis with your weapon has become stronger. While not wearing armor your armor class becomes 14+Dexterity modifier. ***Brand of Destruction:*** Beginning at 11th level, your Brand of Castigation now directs the ire of your blood weapons curse. Any attack roll you make against the branded target is a critical hit on a roll of 18, 19 or 20 on the d20. Additionally the branded creature has vulnerability to any rite damage you deal to it. ***Morbid Puppeteer:*** At 15th level the cursed weapon in your blood has learned much about your body. If you reach 0 hit points, and are not killed outright, your blood puppeteers your body for 1 minute afterward allowing you to keep fighting. You still must make death saving throws every turn and you suffer the normal effects of taking damage while at 0 hit points. However, if you would die due to failing death saving throws or taking damage, you due not die until the end of that minute. This process is extremely draining. If you are healed in any way during this minuet you only gain half the hit points (rounded down) that you would normally receive. You cannot receive healing after you have failed all three death saving throws. ***Dark Spike:*** At 18th you learn to control your blood even outside of your body. Once per turn you may use one or both of your attacks to make a special attack. This attack must originate from a space where you have taken Bludgeoning, Necrotic, Piercing, Slashing, or Thunder, damage or damage from your own blood hunter abilities in the last hour and that you can see. This attack uses your Intelligence to hit, has a reach of 20ft. deals 2d10+Int modifier piercing damage and is considered magical for the sake of overcoming damage resistances. ##### Blood Curse of Retaliation *Prerequisite: 15th level, Order of the Bloodforged* As a reaction to being hit with a melee attack, you sharpen your blood and launch a counter attack Dealing 2d6 piercing damage to the creature that hit you. This damage is considered magical for the sake of overcoming damage resistances. ***Amplify:*** The targeted creature takes extra damage equal to twice the damage you take from your hemocraft die for amplifying."
