,topic,subreddit,title,score,id,url,created,body
0,vulnerability,DnDHomebrew,"I've been planning on making my players Demigods for my next modern game, and after talking about it with one of my players, this is what I have come up with for their very first power. (They are an Aasimar, Kensei Monk)",1,ibegdl,https://www.reddit.com/r/DnDHomebrew/comments/ibegdl/ive_been_planning_on_making_my_players_demigods/,2020-08-17 23:48:07,"Karbon (Demigod of Alteration) Body Shift Casting Time: 1 Action Range: Self Components: V Duration: 1 Minute Karbon can choose to harden or soften his skin through the power of his divinity, having different effects for both of the options. Hard Skin: Resistant to Bludgeoning, piercing, and slashing damage, plus 1 to AC, speed Halved, and disadvantage on dex saving throws. Soft Skin: Advantage on Stealth checks, +2 to Dex (Max 22), no fall damage from falling 20 feet, vulnerability to Bludgeoning, piercing, and slashing damage."
1,vulnerability,DnDHomebrew,100 Eldritch Corruptions for you to corrupt your players with,1,igs0xg,https://www.reddit.com/r/DnDHomebrew/comments/igs0xg/100_eldritch_corruptions_for_you_to_corrupt_your/,2020-08-26 14:09:29," I'm running a campaign with a party trying to stop a Great Old One from entering their world. As it gets closer to entering it begins to corrupt the world around them, potentially corrupting the players. Due to this, I needed a table of Random corruptions for the players to roll. I figured since I took the time to make the list I might share it with the rest of you. I should note that a couple of these were stolen from the UA dark gifts but most of them are my own creation. **Player Corruptions** 1.) Player grows an eye in a random location that operates independently of the player. The player gets advantage on advantage on perception checks but disadvantage on charisma checks while the eye is exposed. 2.) The characters eyes melt away, leaving empty sockets. He or she has disadvantage on Charisma (Persuasion) checks, but gains blindsight out to a range of 60 feet. The character is blind beyond this distance 3.)The character develops gills. He or she can breathe underwater, but has disadvantage on Constitution saving throws when not fully submerged. 4.)The characters skin is cold and clammy to the touch. The character gains resistance to cold damage and vulnerability to fire damage 5.)The character awakens with a parched feeling in their throat, and their face has lost any semblance of a mouth. The character no longer needs to eat or drink and gains the ability to communicate telepathically with any creature within 30 feet with whom they share a language, but otherwise cannot speak. 6.)The character grows an additional face on the back of their head. At inopportune times it begins to argue with the character, giving him or her disadvantage on Wisdom (Persuasion) and Dexterity (Stealth) checks. While the second face is uncovered the character cannot be surprised, except when incapacitated. 7.) The Character Grows an opposable thumb opposite their current one. 8.) The character grows a tentacle from their back. It can be used to make an attack at a creature within 5 and deals 1d4 damage 9.) Maddening but forbidden knowledge fills the characters mind causing them to gain a point of intelligence but lose a point of wisdom 10.) Maddening but forbidden knowledge fills the characters mind causing them to gain a point of wisdom but lose a point of intelligence 11.) Half of the Characters face becomes flesh and saggy imposing a -2 to any charisma check 12.) The characters teeth become enlarged, jagged, and pointy making it hard to talk and imposing a -2 to any charisma check 13.) Vile, purple fleshy wings sprout from the characters back allowing the character to fly at a speed of 10 but imposing disadvantage on charisma checks 14.) A Circular, toothy mouth grows in the center of the character's stomach. The character suffers one point of exhaustion each day the mouth is not fed raw meat in the morning. 15.) A cloud of strange biting and stinging insects surrounds the character. Any living creature within 5 of the character at the start of their turn takes 1 point of piercing damage. Killing the insects causes more to erupt from the players skin 16.) The Characters hands and feet become webbed granting them a swim speed of 30 but imposing disadvantage on any dexterity check to finely manipulate objects (sleight of hand) 17.) Character becomes overly obese, imposing disadvantge on Dexterity and constitution checks. 18.) Characters hands become grotesque claws.The character can no longer wield weapons or shields but its natural attack does 1d6 damage. 19.) The Character grows a 3rd leg replacing its genitals. Movement speed is increased by 10 but disadvantage on any charisma check 20.) The characters head elongates and brain increases in size. +2 to intelligence and -2 to charisma 21.) The Characters head becomes a random animal head granting them the perception capabilities of the creature 22.) The characters skin slowly sags off and replenishes itself constantly. Player gains resistance to slashing weapons but disadvantage on charisma checks. 23.) The Characters becomes impossibly thin and no longer needs to eat or drink. Doing so immediately makes the character vomit uncontrollably. 24.) Something is constantly moving under the characters skin 25.) The Characters ears become large and batlike. The character has advantage on hearing based perception checks but disadvantage on charisma checks. 26.) Pulsating sores and blisters cover the character's body. Anyone striking the character in melee combat takes 1d4 poison damage but the character has disadvantage on charisma checks 27.) The Characters tongue becomes forked granting it advantage on deception checks but disadvantage on insight checks 28.) Character becomes covered in gross, coarse black fur. 29.) Character no longer blinks and eyes become bulging. People around character are unnerved 30.) The Character's mouth becomes like a mindflayer. The character can eat normally but will eat brains when given the opportunity. Disadvantage on charisma checks 31.) Characters arms and legs become covered in gibbering mouths. The character has disadvantage on all stealth checks. 32.) The character's skin becomes a series of interlocking purple and green scales. The character can no longer wear armor but its natural armor becomes 13 33.) The character's skin becomes chameleon-like. The character has advantage on all stealth checks made while wearing minimal clothing but disadvantage on charisma checks. 34.) The characters muscles become unnaturally and oddly large. The character becomes stronger but less nimble. +2 strength -2 Dexterity 35.) Characters muscles twist and diminish but the character becomes exceptionally fast and nimble. +2 Dexterity -2 Strength. 36.) the characters hands and feet grow suction cups like an octopus at the end of their fingers and toes. The character can spider climb at will. 37.) The character's beauty becomes unnatural but at the sacrifice of brain power. +2 charisma -2 intelligence 38.) The character becomes unnaturally ugly but gains intellect. -2 Charisma +2 Intelligence 39.) The character's skin turns dark purple and constantly produces moisture. Disadvantage on charisma checks but advantage to escape or avoid a grapple. 40.) The character constantly smells like offal imposing disadvantage on charisma checks but imposing disadvantage on the first attack roll any creature makes against it. 41.) Ancient Arcane knowledge fills the character and its eyes turn bright blue. Character can pick one cantrip from the wizard spell list and cast it 1/day 42.)Ancient Eldritch knowledge fills the character and its eyes turn bright purple. Character can pick one cantrip from the warlock spell list and cast it 1/day 43.) Ancient Divine knowledge fills the character and its eyes turn bright Yellow. Character can pick one cantrip from the Priest spell list and cast it 1/day 44.) Ancient Natural knowledge fills the character and its eyes turn bright Green. Character can pick one cantrip from the Druid spell list and cast it 1/day 45.) The character's skin begins rotting. The nauseous smell imposes disadvantage on charisma checks. 46.) The character's skin is unnaturally warm to the touch. The character gets resistance to fire damage but vulnerability to cold damage. 47.) Twisted bone horns burst from the character's skull. The character can make a gore attack for 1d4 damage but has disadvantage on charisma checks. 48.) A second pair of arms, but purple and gnarly burst from the characters side. The character can use them to make an extra attack at disadvantage but has disadvantage on charisma checks. 49.) The characters facial features become opposite(mouth where eyes are, etc). The character has disadvantage on charisma checks. 50.) The character's ears become lumpy, saggy, and fleshy. The character has disadvantage on perception checks related to hearing but advantage on saves related to hearing. 51.) Disgusting bony spines and spurs erupt from the characters body. Any creature striking the character takes 1d2 damage and the character has disadvantage on charisma checks 52.) The character's blood becomes acidic. Anyone striking the character takes 1d6 acid damage including the character themselves. 53.) A fatty sack of poisonous fluid grows on the character's neck. The character can spit poison at any creature within 10 for 1d6 but suffers a -1 to charisma 54.) The character's eyes become slitted like a snake and the character blinks from the sides. Character can cast Charm Person 1/week but has disadvantage on charisma checks otherwise 55.) Ancient knowledge fills the characters head, they immediately gain proficiency in a random skill but also suffers from a random indefinite madness 56.) A new language forces its way into the characters head. They immediately learn a new language but also suffer from a random indefinite madness. 57.) The characters' arms turn into long purple tentacles. The character gains advantage on strength based checks but disadvantage on dexterity based checks 58.) The character's skin turns black with red veins. The character has advantage on stealth checks in dim light or lower and disadvantage on stealth checks in light brighter than dim. 59.) The character sweats blood and drinks blood to sustain themselves or suffer the effects of dehydration. 60.) The Players back becomes twisted and haunched with a ridge of multi-colored spikes. -2 to Con but the character can run on all fours at 50 a round. 61.) The character's lower half becomes gelatinous. The character's movement is restricted to 15 per round, but becomes resistant to bludgeoning damage. 62.) The character becomes full gelatinous, a floating brain inside of a gelatinous mass. The players become the statistics of the black pudding but it retains its mental abilities. 63.) Small Tentacles erupt from the characters skin all over their body. The character has advantage on any grapple oriented checks but disadvantage on charisma checks. 64.) The character's mouth becomes a circular maw with rows of pointed teeth and their tongue a sickly tentacle. The characters charisma is reduced by 3 but they can make a bite attack against a character in melee range for 1d6 65.) Eyes of all shapes and sizes appear all over the characters head. The character can see all directions and is no longer surprised but their charisma is reduced by 5 and they are afflicted by a random indefinite madness. 66.) The character grows a thin prehensile tail. The character has advantage on climbing checks. 67.) The character's skull contorts and expands to house the second brain it grows. +4 to intelligence but -4 to Charisma. 68.) Eldritch knowledge fills the characters head at too fast of a rush to stay sane. +4 to wisdom but character is afflicted with indefinite madness. 69.) The character increases in size 1 category but the transformation leaves their skin and muscles twisted and stretched around their bones that have become more brittle because of the change. Character is now vulnerable to bludgeoning damage. 70.) The character decreases in size 1 category but the transformation has caused their skin and muscles to sag and hang disgustingly and the strain on their bones has made them more brittle. The character is vulnerable to bludgeoning damage. 71.) The characters eyes turn pitch black and veins of corruption branch out from their eyes. The character occasionally glimpses sights of the beyond and has advantage on Insight checks but must roll a dc 12 wisdom save daily or the glimpse of the beyond drives them mad with a new madness. The effects are cumulative until the character makes 3 saves in a row. 72.) A hooked black beak grows where the players mouth once was. The player throws up any food that isnt worms. Disadvantage on charisma checks. 73.) The characters legs become bestial and twisted, bending deeply in the opposite direction and grow hooved feet. The character can no longer wear armor but has its speed increased by 10 and their jump distance is increased by 10 74.) A second head grows awkwardly off the neck of the character. The head has the exact opposite alignment and personality of the character. It does not control the body but will try to influence the character 75.) Thick, mucusy webbing connects from the characters arms to their side allowing them to glide as if affected by feather fall but they can no longer wear armor. 76.) The character's skin and muscles become translucent allowing people to see their internal organs. -4 to charisma. 77.) A large, bone plated set of spiked plating starts at the back of the characters head and runs down their back to a long spiked bone tail. The character can make a tail whip attack for 1d6 damage but suffers a -3 to constitution. 78.) The characters muscles burst through and appear on top of their skin in places. The character becomes vulnerable to slashing damage. 79.) The bottom of the characters face gets wider and the characters mouth contorts into a twisted grin they cant change no matter what. The character has advantage on any intimidation check but disadvantage on all other charisma checks. 80.) The characters' facial features all merge into one grotesque eye in the center of their face. The character can no longer speak or smell but can communicate telepathically with creatures within 30 and the otherworldly eye gives them advantage on perception checks. 81.) A second head grows on a 5 long tentacle from the characters back. It moves independently of the character, has the opposite alignment, and personality of the character. 82.) 8 Large spidery legs burst from the characters back. The character can no longer wear normal armor but can spider climb at will 83.) The character is stricken with 2 random indefinite madness as whispers from the beyond begin to plague their every waking thought 84.) The characters nose and mouth form into that of a wolf. The character has advantage on perception checks that rely on smell and can make a bite attack for 1d4 but loses 4 points of charisma 85.) The characters body painfully contorts and twists so that their torso and upper body is facing the opposite direction of their legs. The Character has disadvantage on dexterity based checks and attack rolls 86.) The character grows ugly, misshapen genitals of both genders all over their body causing them to suffer a -4 to charisma but also exudes pheromones that attract members of both genders to reproduce pheromone save is con dc 10. The character is driven to reproduce with anyone under the effect of the pheromones 87.) Iridescent fish scales appear all over the characters body. The Characters natural Ac becomes 12 and they become resistant to cold damage but their movement on land is haved and their charisma is reduced by 3 88.) The character gains a glimpse of the beyond, and their eyes have tiny little stars in them. Once per day the character can attempt to tap into that memory to have the DM answer a yes or no question about the character's immediate future. Doing so doesnt come without risk however, as the character must roll a DC 15 wisdom check or suffer a permanent insanity and fail to grasp the future. 89.) The characters skin turns albino. The character becomes sensitive to bright sunlight and suffers disadvantage on attack rolls and ability checks in direct sunlight. 90.) The character becomes covered in diseased, pus-filled boils. Constitution and Charisma -2 but the character transmits a random disease to anyone touching or touched by them 91.) Insect Like pincers and teeth grow in place of the characters mouth. The character is driven to eat only bark and leaves for sustenance but can make an additional bite attack each turn for 1d4 damage 92.) Large Bulbous tumors grow over nearly every inch of the characters body making them resistant to bludgeoning damage but reducing their dexterity by 2 93.) 2 extra leathery and clawed arms grow out of each side of the character. The character can make 1 extra melee weapon attack per round or a claw attack for 1d6 and has advantage on grappling based checks but suffers a -2 to charisma, strength, and dexterity. 94.) Wings like a fly's burst from the characters back as well as tiny fly legs from the characters side. The character can fly at a movement speed of 20 but suffers a -2 to charisma and loses the ability to speak except in buzzes 95.) The characters' visage constantly switches to whatever horror the viewer perceives to be their worst nightmare. Anyone directly viewing the character must make a wisdom save DC 12 or suffer a temporary madness. 96.) The characters eyes now move independently on stalks that hang a foot out of their eye sockets. The character is able to look in two directions at the same time but the loss of proper depth perception and disorienting feeling of their new eyes makes them suffer disadvantage on perception checks. 97.) The characters arms grow overly large and long until they are just above the ground. The character gains 5 of reach on melee attacks but the strain of their muscles ripping reduces their strength by 2 and dex by 1. 98.) The force of the corruption becomes too much for the character to contain and they transform into a hostile gibbering mouther. Nothing short of a wish spell can bring the character back to life. 99.) The force of the corruption and the glimpse of the beyond is so potent that the character gains 1 level. However, they are stricken with two permanent madnesses 100.) Roll Twice"
