,topic,subreddit,title,score,id,url,created,body
73,vulnerability,DnDHomebrew,Working on a homebrew class. (it's a tank/light dps) tell me what you think and be honest I want it to be as good as possible,2,bwspkv,https://www.reddit.com/r/DnDHomebrew/comments/bwspkv/working_on_a_homebrew_class_its_a_tanklight_dps/,2019-06-05 05:14:29," WarSentinel: WarSentinel is a homebrew class inspired by rouge and fighter/paladin Hit Dice: 1d8 per warrior level Hit Points at 1st Level: 8 + your Constitution modifier Hit Points at Higher Levels: 1d8 (or 5) + your Constitution modifier per warrior level after 1st You are proficient with the following items, in addition to any proficiencies provided by your race or Background. Armor: Light, Medium Weapons: Simple Weapons, martial weapons, and shields Tools: none Saving Throws: strength, constitution Skills: Choose two Skills from Acrobatics, Animal Handling, Athletics, History, Insight, Intimidation, Perception, and Survival Starting Equipment You start with the following items, plus anything provided by your Background.  (a) a martial weapon and (c) or (b) two Martial Weapons (if you pick this you cant take (c)  (c) any non-magical ranged weapon you have proficiency in or shield  Explorer's Pack  hide armor + 40gp or chain shirt **level 1:** battle style, forced attack Forced attack: you can attack with disadvantage and, if you hit, your sword does an extra 50% damage (this goes up to double damage at 5th level) you do not roll with disadvantage on a surprise attack **Level 2:** Roar of fear You let out a loud roar that all enemies within 30ft need to make a wisdom save (DC: 12) against being frightened. You can only do this once per combat encounter. **Level 4:** ability score improvement **Level 5:** war points You become used to war. So used to war, in fact, you can change the course of battles. You start with 5 points and gain 1 per level. With these points, you can: 1: (one warpoints) add a d6 to your attack roll. You can only do this once per attack (goes up to d8 at level 11) 2: ( 5 warpoints)gain advantage to hit. If you do a forced attack you attack normally. 3: (2 warpoints) heal for 1d4+ your prof bonus 4:(2 warpoints) learn 2 types of vulnerabilities, immunities or resistances of a monster 5:(2 warpoints) become resistant to a type of damage for the rest of combat. This is both magical and nonmagical damage. YOU CAN NOT STACK THIS. 6:(5 warpoints) you become immune to two types of damage for the rest of combat. YOU CAN NOT STACK THIS. **Level 6:** uncanny luck You don't just use skill you also use luck. 1 time per long rest you can choose to take 0 damage from an attack **Level 8:** ability score improvement **Level 9:** deadly distraction (2 times per long rest)Roll your normal attack. If you hit you do 1d6 damage. If you don't hit you make it so that the enemy loses its turn attacking you. This also happens if you hit **Level 11:** You become attuned with yourself in combat. Chose 1: 1 Add a d12 to your health and 2d8 to your hit die 2 Add a d6 slashing damage 3 add 10% life steal to your attack rounded down. Example if you do 36 damage you heal back 3 health **Level 14: sword slash** 1 time per long rest you can dash in one direction for 20 ft doing 4d6 damage to each enemy you hit **Level 16: ability score improvement** **Level 20: Stroke of survival** At 20th level, you have an uncanny knack for succeeding against death. If you fail a saving throw you can succeed. Alternatively, if you fail an ability check, you can treat The D20 roll as a 19. Once you use this feature, you can't use it again until you finish a short or Long Rest. &amp;#x200B; battle style (subclass): **Style of the Ancients:** **1st level: survival of the ancients** If you roll over a 16 without modifiers you heal back damage you dealt. (This only works with melee weapons) **3d lvl: heal of the ancients** as an action, you can heal yourself for 1d6+ your con+ warrior lvl (1 time per long rest) **7th lvl: counter of the ancients** when an enemy hits you with an attack of opportunity you can counter-attack at the cost of a reaction and 5ft of movement. (you can not use forced attack, however) **10th lvl: the ancients stab** 2 times per long rest, you can fire a blot and every enemy within 20 ft gains a damage vulnerability to 2 types of your damage. (this does nothing if the enemy is immune to the damage type but if they are resistant than it cancels the resistance) **15th lvl: connection with the ancient ones** Three times per long rest, as a bonus action (and with some gold), you can say a prayer to the ancient ones and enchant your blade with one of the following for the rest of combat Enchantment of fire: 25gp enchant your sword with fire and any enemy you hit is set on fire for 1d6+proficiency bonus fire damage. Enchantment of Rage: 25gp attack twice per turn but your second attack is with disadvantage Enchantment of Perfection: 25gp you gain advantage against all undead Enchantment of protection: 25gp you gain a +2 to you ac for 1d6+proficiency mod turns **18th lvl: life of the ancients** Once per long rest you can ignore attacks that would result in death and back out of range without invoking an attack of opportunity. Once per long rest **Style of relentless assault** **1st lvl: relentless endurance** Gain proficiency in an extra skill and Nat 1s no longer result in you damaging yourself or allies **3rd lvl: Action Surge** you can push yourself beyond your normal limits for a moment. On Your Turn, you can take one additional action on top of your regular action and a possible Bonus Action. Once you use this feature, you must finish a short or Long Rest before you can use it again. Starting at 17th level, you can use it twice before a rest, but only once on the same turn **8th lvl: relentless pressure** 2 times per long rest, you can put pressure on your enemy. This lasts 1 turn. Add a 3d6 to your roll. Alternatively, instead of adding the damage and doing your normal damage you can do the d6 but not your normal damage and also make your enemies lose turns to blocking your attack. **10th lvl: lucky attack** 2 times per long rest, but not on the same round, you can burn your bonus action to give yourself an advantage on an attack roll that round. **15th lvl: relentless stabs** 2 times per long rest add 40 slashing damage to your attack. If you miss then you still lose one of those times. **18th lvl: relentless control** If you roll over a 16 with no modifiers and hit you stun the enemy for 1 turn. This does not stop the enemy from taking legendary actions. **Style of Broken hope (work in progress)**"
74,vulnerability,DnDHomebrew,Help making an ability: heavy armour/weighted clothing being shed for a temporary speed boost (ala Rock Lee),2,b1awq7,https://www.reddit.com/r/DnDHomebrew/comments/b1awq7/help_making_an_ability_heavy_armourweighted/,2019-03-15 16:25:07,"So I have this idea for a very shonen-inspired fighter/paladin who wears heavy armour but fights using his fists via tavern brawler. The whole idea is that he's this high Strength bruiser who loves to fight and prove his strength. Importantly, he wears extremely heavy armour as a sort of resistance training and self-restriction so normally he's this kind of hulking tank that hits like a truck. I have a very openminded DM (and group) and we've discussed having this kind of nova, last-resort ability where he uses quick release mechanism or something to shed his armour and become incredibly fast and difficult to hit basically exactly like the classic fight between Rock Lee and Gaara in Naruto, the Darknut in Twilight Princess or when Piccolo throws off his weighted cape in DBZ. What are some ways I could make this a very high risk/high reward desperation ability? I was thinking it could skyrocket his AC and raise his to hit bonus for a limited period of time in exchange for vulnerability to all or most damage? Lower HP max? The idea being he becomes difficult to hit but if he is, it would be devastating. Alternatively, we've considered exhaustion after 1 minute. Just swapping his Str and Dex probably won't really make it the ""oh shit"" ability we envision it as nor make it risky enough for it to be something that happens rarely. I'm not interested in abusing it -- I just want it to be a dramatic last-resort of a prideful fighter that may only happen once or twice in his career. Any help or ideas to make it balanced would be appreciated!"
75,vulnerability,DnDHomebrew,Some casual homebrew,0,b517rk,https://www.reddit.com/r/DnDHomebrew/comments/b517rk/some_casual_homebrew/,2019-03-25 07:37:34,"I've been creating a few homebrew classes inspired by old games and films I liked. I'd like to hear your thoughts on them. I'll probably end up making a few posts on them. Enjoy! (be wary, I haven't given them any fluff) Dungeons &amp; Dragons custom class The Crumbling Knight Hit Points Hit dice: 1d20 CK level HP at 1st level: 20+ CON mod HP at higher levels: 1d20(or 11) + CON mod Proficiencies *Armour: heavy, shields *Weapons: simple weapons, martial weapons, only heavy crossbow for ranged *Tools: none *Saving throws: strength, constitution *Skills: Choose any two from; Athletics, History, Insight, Acrobatics, Intimidation, Survival You can choose an archetype at 3rd level. Stat leveling goes as normal e.g. a fighter Equipment *(a)A single handed martial weapon and a shield (b)A two handed martial weapon (c) two single handed martial weapons *(a) A heavy crossbow with 20 bolts (b)minor potion of healing *(a)Dungeoneers pack (b)Explorers pack *(a)Chainmail armour (b) ring mail ~~~~~~~~~~~~~~~~~~~~~~~~~~~~~~~~~~~~~~~~~~~~~~~~~~~~~~~~~~~~~~~~~~~~~ Fighting Style ____________________________________________________________________________ Choose any fighting style from the fighters list Crumbling Vulnerability ____________________________________________________________________________ When at or under half health(rounded down), you take double damage, but you recover all HP after a short rest, and 1 hit die can be used as a bonus action. Sacrificial Power ____________________________________________________________________________ Beginning at 2nd level, you can sacrifice 1+your CK levels worth of HP to fuel certain abilities as a bonus action such as: 2nd level: frenzy- add 1d4 extra to damage for the next 3 turns. You gain an extra d4 at 4th, 6th, 8th, 10th, 12th, 16th, 18th, and 20th levels 5th level: crumbles of harm- for the next 3 turns, upon being hit with a melee attack by a creature or undead, it takes 2d6 damage. The damage is increased by 1d6 at 8th, 11th, 14th, 17th, and 20th levels. 11th level: particle consumption- upon activation, for the next 3 turns, gain that amount of HP healed, up to your maximum HP. 20th level: blast life- upon activation, roll 10d6. You lose HP equal to the activation cost + what you rolled, but all current enemies in a 15 ft radius take equal damage. Can be used once per short rest. ARCHETYPES! The Cursed When choosing this at 3rd level, each turn in combat you lose 1+your CK level worth of HP each turn, but upon getting a kill you gain 1+your CK level + 1d10 worth of HP healed, up to your max HP. the number of dice rolled increases by 1d10 at 8th and 15th levels. Upon 5 level in this archetype, you can give your melee weapon a heavenly curse. When using this weapon in combat, upon getting a hit you are healed 1d10 HP, but if you do not attack on your turn in combat, then you take 1d10 damage. The number of dice rolled increases by 1d10 at 11th and 20th levels. If ever your weapon is destroyed or you want to switch weapons that have this feature, you may spend 30 HP to do so. The original weapon loses this feature. Upon level 8 in this archetype, you can roll 6d6 once per short rest. What you rolled can be used to heal a another creature of choice if you are within 5 ft of you. The amount healed is exactly what you rolled, no more, no less up to that creatures maximum HP. Any HP going over the max HP threshold is lost. Upon healing, you lose the same amount of HP healing. If doing so brings your HP to 0 or below, you instantly die. After using this ability, you need to wait for the next short rest in order to use this ability again. Upon reaching level 11 in this archetype, once per short rest you can roll two sets of 6d6, and the ability in the paragraph above is changed so you can choose which set you want to use to heal, but the other set is rendered unusable. Upon level 20, you can sacrifice all but 1 of your HP (whether full or not) to do equal damage to all current enemies in a 10 ft radius. After doing so, you are rendered unconscious for the next hour, and cant be awoken by any means before the hour. When regaining consciousness, continue playing normally, with the 1 remaining HP. It can be healed normally afterwards. ____________________________________________________________________________ The Creator When choosing this archetype at level 3, you gain the ability to sacrifice HP to make make objects. With each added option of the weapons stats the cost grows. The weapon then disappears after 24 hours, but can be used by anyone before the time is up, regardless of proficiency. They have a distinct grey colour to them. Weapon type: HP cost: Knife 7 Rapier 10 Sword 15 Axe 15 Mace 15 spear/javelin 12 Bow 10 Crossbow 10 Damage HP cost (per die, up to 3) D4 7 D6 10 D8 15 D10 20 D12 25 Attribute HP cost (per attribute, up to 2) reach(excluding Knife &amp; rapier) 10 Versatile (excluding knife)10 Thrown (excluding all But knife &amp; javelin)5 Light 10 Regarding ranged weapons: ranged weapons made by this ability have a maximum range of 100 ft and cannot gain any extra attributes. Their attributes are ranged and loading. Upon level 5, you can create small objects such as rings, or other similarly sized objects. Each object of this size costs 20 HP to make. Upon level 11, you can make small creature of your esthetic choosing that you can control. It can attack on your bonus action in combat, with +5 to hit and dealing 1d4+1 damage and 5 HP, with 15 AC. Upon creation, the creature lasts 3 days before disappearing. Normal: 30 HP Swimming: 35 HP Flying: 40HP Upon level 20 in this archetype, you can sacrifice 80 health to create an identical replica of yourself with 20 HP. It can wield any weapon you give it, but if you dont itll have a grey sword that does 1d8 damage. In combat, it has +5 to hit, 15 AC and can make 1 attack on your bonus action. It cant take reactions. Outside of combat, the creation will follow simple commands, such as carry, attack, defend and run. You can support up to two of such replicas, which both act on your bonus action. "
76,vulnerability,DnDHomebrew,Critique and Suggestions on Homebrew Race - Sha'Rax-Ti,1,b5va7m,https://www.reddit.com/r/DnDHomebrew/comments/b5va7m/critique_and_suggestions_on_homebrew_race_sharaxti/,2019-03-27 08:05:56,"I'd like to get some input on any improvements I could make on a homebrew race I'm building for my world. They're called the Sha'Rax-Ti, a race of insect-like creatures that form a consciousness once enough have gathered. Due to the ease in which the swarm can get separated, they infest the bodies of other deceased humanoids as to keep their form together. (Lore is still being developed, but that's the jist.) It's mainly the traits I'd like help balancing. I've tried to use Detect Balance's ratings as a guideline, which you'll see the value next to each ability on what I believe it was rated.Overall, the race comes out to a 24, when 26.5 is considered 'average'. Key Words \&gt; Xkrith - Single drone within the collective \&gt; Host - The body the Sha'Rax-Ti is infesting &amp;#x200B; **Ability Score Increase (12).** Your Dexterity score increases by 2, and your Intelligence score increases by 1. **Age.** Individual Xkrith live around three months, though through replacing lost of drones, you are effectively immortal. **Alignment.** A complex relationship with mortality and physical existence leads most Sha'rax Ti to be Chaotic, often tending towards evil alignments. **Size.** Though your swarm's total number varies considerably from day to day, you require enough drones to fill a Medium Humanoid to maintain consciousness. **Speed (-2).** The restriction of inhabiting a body reduces the speed it would normally be capable of. Your base walking speed is 25 feet. **Aberrant Nature (0).** You have two creature types: aberration and humanoid. You can be affected by any game effects that target either of these types. **Buzzing Swarm (0).** You can perform verbal components for spells through the chittering, writhing and quivering sounds of your bodies. **Cyclic Rest (4).** You rotate the time when your drones are resting, keeping many awake at all times. You do not need to sleep and can complete a long rest by performing 6 hours of light activity. **Infested Host (6).** You survive by infesting the corpse of a medium humanoid. This corpse is considered your *Host*. While the swarm can replace the drones lost from injury or time, it cannot repair the corpse it inhabits. When you are reduced to 0 hit points, your *Host* will become damaged. While your *Host* is undamaged, you are indistinguishable from an ordinary member of your *Host's* race, though your actions may give you away. While your *Host* is damaged, other creatures are more easily able to recognise you as Sha'Rax-Ti. If you have access to a medium humanoid corpse, you can choose to infest it over the course of a Short Rest and make it your new *Host*. You must complete a long rest before you can infest another corpse. **Mental Touch (6).** The collective mental prowess of your swarm allows you to reach out to the minds of others. You can speak telepathically to any creature within 30 feet of you that you can see. The creature understands you only if the two of you share a language. You can speak telepathically in this way to one creature at a time. **Psychically Unstable (-8).** The psychic connection that holds your swarm together is a fragile thing. You have vulnerability to psychic damage. **Purge the Infected. (6)** By removing weakened drones from the swarm, you can prevent the spread of dangerous substances. You have resistance to poison damage, and advantage on saving throws against poison and disease. **Languages (0).** You are not capable of speech yourself, but you can understand, read and write Common and one other language of your choice."
77,vulnerability,DnDHomebrew,Koox Collectives: Play As a Swarm of Gremlins in Tiny Robots!,1,aq05l9,https://www.reddit.com/r/DnDHomebrew/comments/aq05l9/koox_collectives_play_as_a_swarm_of_gremlins_in/,2019-02-13 11:01:12,"Introducing the Koox Collectives, fresh off the presses of the prototype [ULTIMATE RACE CREATOR](URL from LootTheBoss! Please enjoy and critique! We're going to be playtesting the heck out of these traits for the next few months. **Koox Collectives** Koox are an offshoot of gremlins, mischievous fey creatures who relish any opportunity to turn well-working and orderly machines towards mischievous and entertaining purposes. An individual and exposed Koox resembles a diminutive orange goblin barely 3 inches tall, though they are rarely seen outside their scrap metal exteriors. Koox are born in litters of 20-30, and the mewling young quickly form a telepathic hive-mind and act as a single entity from a young age, despite their inherent squabbling. Each mischievous idea or mechanical inspiration that passes through ones mind is instantly transmitted to the collective and when genius strikes an entire teams worth of innovation is sure to follow. A Koox Collective is an assembly of 20-30 small machines, each housing a single Koox pilot. They build their tiny robots out of scrap metal and any innocent device they find unattended. They build their robotic shells to work in tandem, varying infinitely in appearance but somehow linking and connecting to form a coherent whole. Many Koox Collectives are malicious, taking pleasure in dismantling the establishment. But many are content to tinker away and only indulge in the occasional light-hearted prank. Exciting and dangerous locales are like magnets to Koox Collectives, so while rare, they do find themselves amongst the odd adventuring party. **Koox Collective Traits** Koox Collectives share a number of traits in common with each other. **Ability Score Increase.** Your Intelligence score increases by 2, and your Dexterity score increases by 1. &amp;#x200B; **Cyborg (Goblin Organics).** You are a flesh and blood creature with either symbiotic technological enhancements or are somehow grafted or contained within an inorganic body. Your age and lifespan are determined by the age and lifespan your organic components. In this case, you reach adulthood at age 8 and live up to 60 years. The inorganic parts of your body are often more resilient than flesh, you gain an innate +1 bonus to your AC. Your inorganic parts do not heal naturally; however, you can spend time repairing them while resting and you can receive healing through magical means and spending hit die as normal. Due to your mechanical components, you have vulnerability to lightning damage. **0 RP** &amp;#x200B; **Playfully Mischievous.** Your clique relishes comedy and hates rules, defying them both maliciously and in good fun. As such, your clique tends towards all Chaotic alignments. **0 RP** &amp;#x200B; **Hive Mind.** Rather than an individual, you are a swarm of much smaller creatures acting as a single creature. Your bizarre mind is the sum total of all the creatures that exist within you. Your component creatures cannot operate independently and if separated will only act to try and reunite the hive mind. You also gain the **Swarming Entity** trait. While you are a group rather than an individual, your hive mind makes you a close enough approximation for most. You count as a single Medium-sized humanoid creature for the purposes of spells and abilities. However, it is quite difficult to grab or shift a swarm and all attempts to grapple, reposition, and knock you prone are made at disadvantage. You also gain the **Swarming Movement** trait. You can occupy another creature's space and vice versa, and you can move through any opening large enough for a Tiny-sized creature. You also gain the **Redundant Minds** trait. As a group of individuals rather than one singular mind, your consciousness is infuriatingly difficult to pin down. You have advantage on any saving throws made to avoid the charmed, paralyzed, and stunned conditions. You also gain the **Swarming Attacks** trait. You may make melee attacks against creatures you share a space with. However, your offensive capabilities are reduced when enough of your number is injured and the damage of any weapon attacks you make while at or below 50% of your maximum hit points is halved**.** **5 RP** &amp;#x200B; **Clattering Mechanisms.** Your design is lumbering, but moves with steadfast purpose, easily surmounting the obstacles in your path. Your walking speed is 25 feet, and you have a climb speed of 20 feet. **2 RP** &amp;#x200B; **Full Surround Sensors.** While your design has no enhancements to its sensors, it does have a lot of them, and they cover a full 360 radius. You cannot be surprised and will be able to act within surprise rounds. **1 RP** &amp;#x200B; **Scrap Weaponry.** Your design incorporates weaponry half engineered and half improvised. Sharp edges and spikes protrude from these fearsome if unreliable weapons. You can use your scrap weapons to make unarmed strikes. All attacks with them are made at disadvantage, but if you hit with them, you deal slashing or piercing damage (your choice) equal to 1d12 + your Strength modifier, instead of the bludgeoning damage normal for an unarmed strike. **2 RP** &amp;#x200B; **Rusted Heap.** Your design is cobbled together, disparate, improvised, and prone to sudden malfunctions when thwacked hard enough. Whenever you are struck with a critical hit you must make a concentration check as if you were concentrating on a spell. On a failed save you malfunction during your next turn and act as if confused, rolling a D10 and following the directions on the following chart: 1: The creature uses all its movement to move in a random direction. To determine the direction, roll a d8 and assign a direction to each die face. The creature doesn't take an action this turn. 2-6: The creature doesn't move or take actions this turn. 7-8: The creature uses its action to make a melee attack against a randomly determined creature within its reach. If there is no creature within its reach, the creature does nothing this turn. 9-10: The creature can act and move normally. **-2 RP** &amp;#x200B; **Improvise Widget.** Your design is handy with technology and when pressed you can come up with solutions that rival arcane prowess. You may attempt to cobble together a device by spending 10 minutes tinkering. The result may reproduce the effects of any cantrip from the wizards spell list as if the spell was cast. Once used the device then breaks down and is destroyed. Devices made in this way will break down and become inert if not used within 24 hours of their creation. Starting at 5th level the device may instead reproduce the effects of any 1st level spell from the wizards spell list. Once you create a device with this trait, you cant do so again until you finish a long rest. **2 RP** &amp;#x200B; **Goblin-Kin.** Your people are descended from the goblinoid races. You can speak read and write Common and Goblin. **0 RP**"
