,topic,subreddit,title,score,id,url,created,body
107,vulnerability,Eve,Suggestions,0,6ma7bo,https://www.reddit.com/r/Eve/comments/6ma7bo/suggestions/,2017-07-10 07:47:10,"So I've been looking at a lot of things in Eve and what would make things better/worse. This is my first post like this. These are just ideas. Suggestions to make them better are welcome. They'd fix a lot and create content. So here's some ideas. They're moderate changes. Nothing too big. Been playing since 05. Seen a lot of changes. Some good and some bad. Just wanted to throw these out there. Sov: -Sov needs more value. Or a reason to hold it. -When Sov changes hands citadels owned by anyone other than the Sov holder will go fully vulnerable within 1 hour of Sov changing hands (no timer structure bashing). If they survive the vulnerability timer they stay with normal timers. Citadels: -All citadel inventories in NS, LS, and HS have a 10% chance to drop loot per item. As in every piece of inventory in player hangers, Corp hangers, etc has a 10% chance to drop as loot and 10% chance to be destroyed. The rest goes to safe. Risk vs Gain. Maybe 20%. But 10% is still effective. Ships in hangers have a 10% chance to be destroyed as well. Maybe make it higher for LS and NS. -Allow for entosis to remove 1 timer from citadels if they can do a full cycle. For example a citadel would spawn 6 command nodes in system over time around the citadel. If you successfully entosis it you remove 1 timer. Cannot be used with the Sov change listed above. NPC Ratting: -Bounties in NS require a citadel type sov structure. This structure reports to concord. If fully fueled (yes it'll need fuel) and upgraded it gives 100% of bounty. If not fueled it only gives 50% with full upgrades. The structure has 5 slots for upgrades. Each gives 10% of bounty value. The fuel adds another 50%. (Isk sink galore between fuel and modules). This structure has 3 timers. During the 2nd one the modules spawn as nodes to entosis or destroy. If you destroy them it knocks them out. If you entosis them you knock out the 3rd timer allowing it to be killed right then. It has no defenses and can't be anchored within 1 AU of any structures. Not deployable in WH space. -Lower spawn rates of NPC rat sites in Null. Meaning you need more territory to actually make Isk with larger alliances. As there won't be enough to go around. Random things: -More Guristra stuff. Ships, skins, etc. Please."
108,vulnerability,Eve,Capacitor warfare - current state and change suggestion,8,6mnrz1,https://www.reddit.com/r/Eve/comments/6mnrz1/capacitor_warfare_current_state_and_change/,2017-07-12 03:32:32,"## TL;DR Capacitor warfare dominates entire EVE meta; it's not considered broken because everyone uses it, but it breaks many parts of meta. Doubling base numbers on all active modules that affect capacitor by flat number (neuts, nos, cap transfers, cap boosters, void bombs etc.) while scaling their strength with capacitor percentage of target should put it more in-line with other kinds of ewar while making meta more flexible. ## Current state of capacitor warfare in EVE metagame Energy neutralization, remote capacitor transmitters, cap boosters and - to lesser extent - nosferatu are currently omnipresent, from solo pvp (using utility hislots), to small gang, to WH brawling, to citadel sieges. To not search too far, Bhaalgorns, capchain logi, neut Legions and Armageddons are staple of most heavy Wormhole doctrines; [Bhaalgorn dominates AT meta](URL for years now; [shield supercapitals](URL are considered inferior to armor just due to lack of passive omniresist shield module and their vulnerability to have tank fully neuted; Machariels dominated nullsec structure bash meta because they're invulnerable to citadel Guided Void Bombs. Even for hunting, solo or small gang setups, Stratios is one of the most popular ganker/hunter ships due to its drone damage and enough hislots to fit 3-4 neuts; similar situation for Sin as most popular/versatile black ops battleship; larger solo/microgang roaming ships using neuts to deal with tacklers; utility slots almost always being filled with neuts while sometimes using nosferatu etc. Currently energy neutralization is the only kind of ewar that is able to affect (depending on ship targeted): * Resistances (more potent against shield-tanked ships). * Local tank (more potent against armor-tanked ships, shield can work around by using Ancillary Shield Booster). * Speed (propulsion modules use capacitor). * Mobility (MJD requires capacitor, jump drive requires ship to be at over 70% cap). * Damage (energy and hybrid weapons require capacitor to work, same goes for smartbombs). * Electronic warfare (all ewar modules require capacitor to work). Capacitor warfare also scales multiplicatively with numbers - especially when considering how it affects tank, speed or mobility. In most cases, to make killing a ship faster, it's enough to put all neuts on your target and it should shut down most its active defensive modules quickly. This is as effective against frigates/cruisers as against supercapitals - as long as you don't run fully passive setup, you're vulnerable to being capped out and subsequently killed with ease (usually). ### How current state of cap warfare affects meta First of all, it forces basically all brawling/close range doctrines to be capless-guns armor-based with passive resists (or active resists augmented with cap booster), due to shield vulnerability to being neuted dry when primaried. Setups like HAML Legion, AC armor Machariel, HAML/HML Damnation etc. are very common and borderline dominant in W-space, despite having higher mass than shield counterparts (due to plates adding mass) and therefore being - in theory - less optimal choice for heavier setups. Second, it shifts shield/armor imbalance of supercapitals even more towards armor (despite existance of Slave implants) - making it possible to shut down 40-70% EHP of target supercap with just few capital neuts and few properly staggered heavy neuts. Sheer amount of drained capacitor with how capacitor recharge equations works at very low capacitor levels means shield supers are easily killed without FAXes being present on grid in mere seconds after they start being shot. Third, it is one of the main reasons of Machariels online a lot of people complained about - Machariels being ships bonused for capless guns (projectiles), with great ability to armor tank and enough lowslots to make them viable with fully passive armor setup, while also keeping decent speed and agility despite being dual-plated. Ships that were invulnerable to void bombs (both regular and guided) and - by own bonuses and attributes - solved most heavy armor doctrine problems (very low mobility, long rep cycle from logistics). Fourth, it forces most solo/small gang fits to either be capbooster-based, ancillary shield booster-based or similar, because for most active tanked cap regen fits it's enough to get under some neut pressure (single Arbitrator or Vexor will usually be enough, not to mention ships like Bhaalgorn or Armageddon) to be almost completely shut down. In most cases it works similar to ECM in regard of being defenseless, except you still can have targets locked and it also shuts down your tank. ## Add capacitor level scaling Simple (in terms of both understanding and - I hope - development part) solution to most capacitor warfare problem would be adding scaling based on effect target capacitor percentage. For all current neutralization/injection effect, just double current value, assume it's base number and add to it scaling based on current capacitor level. Example: **Heavy Energy Neutralizer II** currently drains 600GJ of capacitor per cycle. Change it to 1200GJ per cycle multiplied by targets current capacitor percentage. So, make it burn 1200GJ from target with full capacitor, 600GJ from target at 50% capacitor, 300GJ from target at 25% capacitor and 1GJ from target at below 0.1% capacitor (drained out). With that change it's much easier to break cap stability or hit large capacitor pool of most ships (including getting target capital below jump cap), while making it much harder to drain target completely and shut down all their active modules. Capacitor warfare therefore remains strong at hitting cap-heavy usages (say, logistics, oversized propmode ships), while not making it ultimate solution for shutting down any target. ### Modules affected * Energy neutralizers - capacitor drain scales with target capacitor percentage. * Energy nosferatu - capacitor drain scales with target capacitor percentage, capacitor gain (when applicable, using current rules) scales with users capacitor percentage from **base value** (so draining larger ship being low on cap doesn't affect your cap gain). * Capacitor transmitter - capacitor gain gets reverse scaling (100% effect at 0% capacitor, 0% effect at full capacitor) with targets capacitor percentage. * Capacitor boosters - capacitor gain gets reverse scaling, like with capacitor transmitter. * Void Bomb, Focused Void Bomb and Guided Void Bomb - scales with target capacitor percentage for each target hit separately. * Energy Neutralization Burst Projector - scales with target capacitor percentage for each target hit separately. * AoE Doomsday capacitor drain effect on activation - scales with target capacitor percentage for each target hit separately. All modules above get their base capacitor drain/gain values doubled from current state. ### How it would affect current meta First of all, it would invalidate passive preference just due to capacitor warfare, making active modules strong and preffered choice in low cap usage setups - things like AC Sleipnirs, AC shield Machariels, HAML Cerberus, other brawling doctrines with good gapclosing parameters being viable option against both brawling and long-range setups. It would also shift target of capacitor warfare (now not being default choice for brawling setups) towards cap-heavy ships in target doctrine like logistics, boosters, support ships etc.; therefore making it complementary to damps, tracking/missile disruptors and so on. Second, it would make active cap setups (ships using cap booster as integral part of their kit) harder to fly optimally, but potentially a bit stronger, making it more viable to have more smaller cap boosters or using smaller charges to get more cap at lower capacitor percentage. Proper timing of cap booster just after active module (prop, rep) would give more raw benefit than just running it whenever if you're below certain level of cap. Third, it's shift from stagger neut preference to neutralization nuke preference - having single larger neut being stronger in effect than current equivalent in smaller neuts, due to what in practice is stacking penalty for cap warfare. With enough frequently cycling neuts it would still be possible to completely cap out single target, but this pushes required amount much further, while making it even easier to nuke capacitor of relatively small targets with just 1-2 heavy neuts. There might be other effects related to that, especially when it comes to more complex interaction - situations like neuting out capchained ships, capchain between unbonused ships giving cap stability at certain level and so on; it's open question if those would be good or bad. Opinions, suggestions, things I forgot to recognize?"
109,vulnerability,Eve,Solo Pew Pew - Tristan Dismemberment and Decapitation when in Hull,27,6n7x0n,https://www.reddit.com/r/Eve/comments/6n7x0n/solo_pew_pew_tristan_dismemberment_and/,2017-07-14 19:12:00,"Countdown to the best ships pound for pound in no particular order for solo. _________________________________________________________ **Strengths**  Armour, Structure, Mass (Good MWD constant), Cap (I guess) **Weakness**  CPU, PWG, Scan Res, Signature, Speed, Sensor Strength _________________________________________________________________ The best T1 low sec frigate in the game both in style and utility, think of any pew style and the Tristan can oblige, a trait I believe that I believe puts the Tristan in the top 10 of all best sub cap ships by weight. This is a 3/3/3 layout drone boat with no damage bonus and the worst cpu, primarily needed for damage mods however does sport a tracking bonus which means if you are range you will apply. Kite, scram kite, brawl / Hybrids, projectiles, drones, neuts / deeps machine or tanky little fellow. At the moment even trying out speed tank trying to utilise it bonus to tracking speed with a full set of EC-300, cheeky, damn right, almost had a Talwar yesterday falling a couple of bullets more. Side Note - You just saw EC-300 and your bottom lip just curled however solo players get a pass on ECM in my book, it is a game mechanic and soloists need everything they can get in a non-solo game. This in my eyes, is very different to a gang of ships, who could individually kill the target, still bring the can not do anything button. Going to be going through the best fits for low sec as the Tristan obviously struggles a bit to find suitable targets in null. ________________________________________________ **[Tristan, My Favourite]** Damage Control II Drone Damage Amplifier II Small Ancillary Armor Repairer 5MN Y-T8 Compact Microwarpdrive Faint Epsilon Scoped Warp Scrambler Small Electrochemical Capacitor Booster I Small Gremlin Compact Energy Neutralizer Small Infectious Scoped Energy Neutralizer Small Infectious Scoped Energy Neutralizer Small Ancillary Current Router II Small Transverse Bulkhead I Small Transverse Bulkhead I Hobgoblin II x8 Premise is simple if the fitting requirement is high and may need to meta, catch, neut, kill. I like to vary using MWD and AB however sway towards MWD for catching kiters. Always use Hobs due to tracking bonus and if they are using their prop mod, they are losing cap fast and it will not stay on long, if they have their MWD on then you havent done your job yet. Remember to watch your own cap, eve with cap boost you are going to have trouble and you dont want _______________________________________________ **[Tristan, Speed  Experimental]** Damage Control II Overdrive Injector System II Overdrive Injector System II 1MN Afterburner II Faint Epsilon Scoped Warp Scrambler Stasis Webifier II Small Energy Neutralizer II Light Neutron Blaster II,Caldari Navy Antimatter Charge S Light Neutron Blaster II,Caldari Navy Antimatter Charge S Small Transverse Bulkhead I Small Transverse Bulkhead I Small Transverse Bulkhead I Hornet EC-300 x8 Speed, 1.8k heated, depending on enemy weapon, as close as you can get to maintain your speed, let ECM go to work while your neut and guns slowly wear your target down. Still working on this one. ______________________________________________ **[Tristan, Workhorse]** Drone Damage Amplifier II IFFA Compact Damage Control Small Ancillary Armor Repairer 1MN Afterburner II Initiated Compact Warp Scrambler X5 Enduring Stasis Webifier 150mm Railgun II,Caldari Navy Antimatter Charge S 150mm Railgun II,Caldari Navy Antimatter Charge S Small Transverse Bulkhead I Small Transverse Bulkhead I Small Transverse Bulkhead I Warrior II x4 Acolyte II x4 Guns and drone applying graciously, use the fast drones due to your vulnerability to kiting if you are defence plexing then stay at zero and web scram incoming kiter. Note it is tricky to be offence with the Tristan as by the time you have landed, deployed, locked, scrammed, the enemy ship has already landed some heavy blows or has already kiting you, unscramable/webbable. _____________________________________________________ **[Tristan, Kiter]** Warp Disruptor II Medium Shield Extender II 5MN Y-T8 Compact Microwarpdrive Nanofiber Internal Structure II Drone Damage Amplifier II Drone Damage Amplifier II Small Anti-EM Screen Reinforcer I Small Anti-Thermal Screen Reinforcer I Small Core Defense Field Extender I Acolyte II x5 Warrior II x3 Simples, lock orbit shoot, my want to switch out resist rigs for speed and agility to help prevent being slingshotted, dont get caught. ______________________________________________________________ There you have it, the Tristan, take one out today. Also, wasnt joking, for the arms and legs of the Tristan to fall off as it progresses through hull and just before it explodes its head pops off like Unicron from Transformers The Movie. CCP make this happen. Any questions, please ask below. **Additional Becoming aware that this may be the wrong media for such posts. Anyone have any suggestions as to a possible better way to distribute this? My goal is simple, to get one person try out solo pew who maybe had never thought about doing so (i.e. me for 7+ long years)** "
110,vulnerability,Eve,Citadel damage cap idea,11,6dd0dw,https://www.reddit.com/r/Eve/comments/6dd0dw/citadel_damage_cap_idea/,2017-05-26 08:34:38,"So crazy idea today whilst clearing a null incursion. Make citadels damage caps work like the incursion site with the MTACS. Have 4 shield outpost towers at the edge of the citadel model, between them have another 4 power relays or something. During vulnerability charges from the relays can be shifted to the outposts to overload them taking them down. Each tower overloaded increases the damage cap (but not repair timer activation threshold) by 25%, overloading all 4 removes the cap completely. The charges would have to be huge and require a tractor beam to pull over to the shield outpost towers. This would ensure that a fleet with subcap superiority could effectively take down citadels faster. It also provides specific objective based gameplay other than just ""shoot the enemy, shoot the structure."" Finally it makes killing afk citadels so much faster. Thoughts?"
111,vulnerability,Eve,A simple Plea for you devs at CCP,138,6ed4br,https://www.reddit.com/r/Eve/comments/6ed4br/a_simple_plea_for_you_devs_at_ccp/,2017-05-31 16:14:56,"I don't know how to really start this so fuck it, i'll just delve into something. -Asset safety -DPS cap being so low -Timezone tanking -Utterly overpowered neuts forcing passive tanks and capless guns. -Tethering I don't want to bash you guys without giving a view on how to fix it (I know you guys watch reddit) Please for the love of god tweak these citadels as you begin to tweak T3 cruisers. My recommendation is the following -Tethering Requires a service module fitted with fuel in order to work -Asset safety Remove it completely. It doesn't reward us for killing the structure. It doesn't promote fights, and it promotes people to not defend your gear stored within. -DPS cap. Increase it by double from what it is now, that way we only spend 15minutes instead of 30 shooting something 3 times over a week on something with very limited windows so we can even shoot it. -Vulnerability windows Should be set to protect your least active timezone if fueled and not force us to be limited to 3 hours of the week which are often timezone tanked by the many. -Entosis Giving us the ability to capture them or kill if we decide to shoot them. -Fittings Including service slots, as a shoot-able target that can be reffed preventing tethering, and defenses so we can rape cage Citadels, and deny our enemy retreat or their assets. -Astrahouse Two vulnerability windows. It is something that costs 1bil, which also gets spammed in space hard due to it's cheap cost. Almost anyone in this game can afford multiple astrahouses. corporations and alliance's can afford to just plop new one's down without ever hardly breaking a sweat. Make it so we can kill them with much greater ease. My views on how you devs up in Iceland should change citadels to encourage us the players to knock over sandcastles and truly ""Wreck their dreams."" I hope some players give feedback either supporting it or pointing the flaws. I am not an all knowing entity, I may be wrong with some if not many of these issues I have suggested, if so please for the love of god at least look into tweaking citadels even if it just a little. There is no longer any reason to fight another coalition when we can't do much with the current mechanics we are given. Maybe this gets downvoted to oblivion, maybe not, but please look into changing SOMETHING about citadels. "
112,vulnerability,Eve,Add vulnerability timers to ships,73,6efwwu,https://www.reddit.com/r/Eve/comments/6efwwu/add_vulnerability_timers_to_ships/,2017-06-01 02:02:40,Its not fair that I can't krab in my Intel bot care bear utopia 100% safely. CCP should add vulnerability windows to ships so I can let others know when its PvP time or krab time 
113,vulnerability,Eve,Add vulnerability timer to r/eve,225,6eg44m,https://www.reddit.com/r/Eve/comments/6eg44m/add_vulnerability_timer_to_reve/,2017-06-01 02:32:26,Maybe we'll finally start seeing some good posts
114,vulnerability,Eve,Citadel defensive mechanics improvement idea,0,6feswb,https://www.reddit.com/r/Eve/comments/6feswb/citadel_defensive_mechanics_improvement_idea/,2017-06-06 01:18:25,I think it's quite obvious to all of us after more than a year since the initial release that citadels defensive mechanic do require some changes. I've got an idea how it can be improved. I present you 'Standup Cloaking Device I'. It's basically just a service module that will fit any citadel or engineering complex. With its own weekly ~~vulnerability~~ uncloaking schedule. Not preventing docking of course.
115,vulnerability,Eve,"Since the Rorqual's yield has been nerfed to death, can we reduce the Indy Core's cycle time?",0,6g0gij,https://www.reddit.com/r/Eve/comments/6g0gij/since_the_rorquals_yield_has_been_nerfed_to_death/,2017-06-08 21:51:46,"The yield of the Rorqual has been dropped multiple times since the links changes yet it still retains the five minute vulnerability from the Indy Core. CCP- Please consider reducing the cycle time (including adjusting heavy water use) to 1-2mins, the same proportion of the yield nerfs to date. It's only fair."
116,vulnerability,Eve,Get Ready For This Tinfoil Adventure,6,6g7xpq,https://www.reddit.com/r/Eve/comments/6g7xpq/get_ready_for_this_tinfoil_adventure/,2017-06-09 21:54:30,"&gt;Fozzie Sov sucks so Alliances become Stagnant &gt;No PvP interest because ""Mechanics"" &gt;CCP Notices stagnation of Null Sec means Fat Wallet Padding for alliances &gt;CCP Nerfs Rorq's like that'll show em &gt;CCP Hope's people will want better sov instead of just mining?? &gt;Nope? Renerf Rorqs TOP KEK &gt;Citadels still retardedly broken making fozzie sov and citadels grinding the aids of eve, so Alliances still settle down &gt;CCP REEE and nerf Supers and Carriers because people can use them so well because of stagnation of null &gt;Player count drops to the point where there won't be TIDI &gt;The massive amount of citadels and their mechanics still make invading absolutely retarded #Damage Caps#Vulnerability Timers #Waitingtoinvade &gt;Bethesda buys rights to Eve and Make Fallout:Eve"
117,vulnerability,Eve,Fight in V-IUEL over Space Violence fortizar,16,6ggaqj,https://www.reddit.com/r/Eve/comments/6ggaqj/fight_in_viuel_over_space_violence_fortizar/,2017-06-11 03:03:03,"## Local at the beginning of the fight URL ## Battle Report * URL * Screencap: URL ## Story time SV has been having good fights with CO2 and FCON lately, which pushed Legacy to try to evict us by shooting our fortizar. Thanks to Boat, INIT and NC's bombing run the TEST Mael fleet was erased from existence shortly after the fortizar went into the vulnerability window. Once that fleet was bombed pretty much everyone left V-I, but were caught in bubbles in 0SHT-A. Fight on the ingate ensued, as a result of which the CO2 Mach fleet was obliterated, along with remnants of a BRAVE fleet. X.I.X ruptures were camping the 0SHT-A gate in U-QVWD, catching stragglers. ## Other threads to shitpost in * URL * URL * URL * URL * URL "
