,topic,subreddit,title,score,id,url,created,body
44,vulnerability,Eve,"1900 News: 1 Keepstar Down &amp; 2 Saved, Rangers Suffer Reverse in Branch",182,8z48q7,https://www.reddit.com/r/Eve/comments/8z48q7/1900_news_1_keepstar_down_2_saved_rangers_suffer/,2018-07-16 05:22:21,"*Do you want to help with this? Join* [this ](URL server and DM an editor until Hugh returns. Anything helps, from writing sections to linking us information.* [Click here to read this on our website](URL **THE HEADLINES AT 1900 ON SUNDAY THE 15th OF JULY** NER News at 7 oclock. This is Hugh Caswakk. Good evening. Imperium forces stand down from assault on CO2 keepstar armour timer due to cyno-jammer oversight. Legacy keepstar in 4-GB14 destroyed by North Eastern Association forces. Provibloc anchors keepstar in 9UY4-H. Ranger Regiment sustains heavy losses in Hard Knocks/Lazerhawks/TISHU ambush.  **CYNO-JAMMER SECURES CO2 KEEPSTAR ARMOUR TIMER IN DW-T2I** On Friday the 13th, a small Imperium force reinforced the shield of the [CO2](URL keepstar in [DW-T2I](URL Fade. This led to an armour timer for 1930 EVE on Saturday the 14th. Both the Northern Bloc and the Imperium formed large supercapital fleets for the engagement. However, an oversight in Imperium command allowed CO2 to online a cyno-jammer in the system. A cyno-jammer prevents the lighting of cynosural beacons, in turn preventing the Imperium from jumping into the system and bypassing the stargate. Imperium offensive logisticians (mostly from Goonswarm Offensive Logistics, GSOL) had anchored POS towers at all but two of the moons in DW. The POS at the unclaimed moons were both reinforced prior to the timer. This was intended to make it impossible for a cyno-jammer to be deployed. Unfortunately for the Imperium, it is possible to online a cyno-jammer on a reinforced POS tower, a fact seemingly forgotten or overlooked by Imperium command. CO2 promptly online a jammer, preventing the Imperium from jumping forces into the system. The gate from [O-CNPR](URL into DW-T2I was heavily defended by Northern Bloc forces. Imperium high command judged that attempting to storm the gate would lead to prohibitively high losses. Therefore, around 1830 EVE, the Imperium stood down. There was a much smaller engagement early this morning, when Northern Bloc forces attempted to reinforce an Imperium fortizar in Korasen, Black Rise. [This was a defeat](URL for the Northern Bloc, losing 15.38bn vs the Imperiums 4.02bn. In a formal statement provided to NER, [RiotRick](URL (SLYCE Alliance Executor, GOTG, Northern Bloc) said that: *Seemingly evacd and dead North, the Goons did a u-turn and retreated from engaging the Co2 KeepStar. This was their time to do revenge against their former ally. Posted on reddit, pinged in their coalition, they had us surrounded, we are evacuating, etc etc.* *And faced with a fight, when the line on the sand was drawn, Asher Elias backed down.* *Remember today their intelligence and bravery, because we did not see it. Fighting in EVE isnt about who is the #1 carebear in MER, its about crossing that line and fighting.* Imperium diplomat [Exonfang](URL (The Initiative, Imperium, Imperial Legacy) responded in a statement, saying that : *GOTG and their allies and pets still have not shown any real ability to defeat the unparalleled might of the Imperium  they have had the effectiveness of a wet noodle in every major battle since we anchored the Keepstar in 6RCQ.* *Sure, we lost to some archaic pos mechanics in DW-, let them revel in their victory while we wind up our next swing of the hammer. Well be sure to remind them of our intelligence and bravery in the coming days and weeks.* One thing remains quite clear  the northern theatre of this war is set to continue for some time.  **NORTH EASTERN ASSOCIATION FORCES DESTROY LEGACY KEEPSTAR IN 4-GB14** At 23:54, the Legacy keepstar in [4-GB14](URL Immensea, was [destroyed](URL by the North Eastern Association (NEA). The defenders mustered around 300 ships, mainly in a Goku fleet of stealth bombers, which forego cloaking devices for additional firepower. The NEA sent around 2000 ships, led by 33 titans from the Holy League. The structure entered final vulnerability at around 2239 EVE. Despite Legacy harassment efforts, the attackers had more than sufficient firepower to ward off the bombers while maintaining DPS on the keepstar. This represents a reverse for Legacy, and the broader Imperial Legacy bloc. However, it is important to consider that no major defensive effort was ever made. Moreover, NER understands that Legacy acquired the keepstar for only 100bn ISK. This all suggests that the defeat, while unfortunate for the southerners, is not a catastrophe. NER will keep you updated as the Immensea front develops.  **PROVIBLOC ANCHORS KEEPSTAR IN 9UY** At around 0030 EVE today, [Curatores Veritatis Alliance](URL leading Provibloc, anchored a keepstar named Eye of Providence, in the central system of [9UY4-H](URL This represents a forward step for Provibloc, which faced near eviction a few months ago at the hand of [Pandemic Legion](URL There were concerns among CVA that assorted low-sec forces, led by [Honorable Third Party](URL would contest the anchoring. However, the presence of a CVA cyno-jammer rendered this impractical. HTP FC /u/Meiqur said on reddit that: *Realstory, we missed for the same reason that goons didnt get the co2 ks into structure. Cyno jammers are oppressive and we didnt have the straight up numbers to break the gate forces + their fleet even with ship superiority. Wed have ended up having a protracted fight on a gate which we could have certainly won eventually but it would have not been able to break through to the KS grid reliably.* *All told today we were just a little outnumbered vs the proviblob in raw numbers (our total forces were around 250 and a modest contingent were running their own ops loosely in conjunction with us, but most didnt arrive until the actual timer) but still managed to outship them 15:1 in super caps and triage.* *FWIW its the first time Ive seen our comms ever get close to the 200 real human mark.* However, the keepstar is an attractive target. It is likely only a matter of time until Provibloc is called upon to defend it again.  **FIVE RANGER REGIMENT TITANS, CAPITALS, DOWN TO WORMHOLER AMBUSH** Between 0345 and 0419 EVE this morning, a combined [Hard Knocks](URL fleet (with [TISHU](URL support) baited out and [ambushed](URL a [Ranger Regiment](URL supercapital force in [QYZM-W](URL Branch. Following victory in the drone regions, Hard Knocks went looking for new content. They decided to target Branch residents Ranger Regiment. As detailed in an [AAR](URL on reddit, the wormholer force attacked a Ranger Regiment Rorqual with four supercarriers. This prompted Ranger Regiment to drop in 6 titans, supported by 8 FAXes and an assortment of subcaps. The wormholers responded with 23 supercarriers and 61 dreadnoughts, along with their own subcap fleet. Over the course of a few minutes, five Ranger Regiment titans were destroyed. The toll stands at 5.14bn lost by the wormholers, vs 389.52bn lost by Ranger Regiment.  For now, thats how it is in New Eden. Goodnight.  *Forward from tomorrow until 20th, I'll be totally AFK - sorry about that.* "
45,vulnerability,Eve,Cita Timer?,6,90oeyl,https://www.reddit.com/r/Eve/comments/90oeyl/cita_timer/,2018-07-21 20:33:48,"How does it work? Everytime our Structures get attacked, the window of vulnerability IS NOT the Timer we set on the station. Like never. Can somebody explain this to me? "
46,vulnerability,Eve,Citadel questions,3,8k6fxl,https://www.reddit.com/r/Eve/comments/8k6fxl/citadel_questions/,2018-05-18 04:16:10,"Hello, I'm still a citadel noob and haven't played much with them so I have a few questions regarding them. First question is I'm wondering if it's possible to remote rep a citadel in vulnerability mode in order to mitigate incoming dps to prevent attacking fleet from activating the stop timer. Or does it simply not work that way? I just figured since dps can be applied, perhaps it can be repaired as well ? Seccond question, is it possible to anchor a citadel if it's vulnerability timer might get interupted by downtime? For example, if I anchor an astrahus and time it to 10 minutes before downtime, it's initial and final 15 minute vulnerability modes should be interupted by the shutdown."
47,vulnerability,Eve,"1900 News: TEST Titan Down, MWM Disbanding, Militia Clash in Asakai, TIKLE vs CVA",530,8n1qxm,https://www.reddit.com/r/Eve/comments/8n1qxm/1900_news_test_titan_down_mwm_disbanding_militia/,2018-05-30 05:09:03,"*Do you want to help with this? Join* [this ](URL server and DM Hugh Caswakk#2639. Anything helps, from writing sections to linking me information.* **THE HEADLINES AT 1900 EVE ON TUESDAY 29th OF MAY** NER News at 7 oclock. This is Hugh Caswakk. Good evening. A TEST Ragnarok titan [was destroyed](URL in the system of Y\-MPWL by Honourable Third Party in a pre\-planned ambush. Mistakes Were Made coalition in Tenerifis has officially disbanded. At least one member alliance plans to consolidate into one corp and join TEST. Caldari and Gallente militia forces have clashed in Asakai. Tactical Supremacy has engaged Curatores Veritatis Alliance, destroying numerous structures. \-\-\- **TEST RAGNAROK AMBUSHED BY HONOURABLE THIRD PARTY** Honourable Third Party have harassed Legacy and Provibloc forces through their reconquest of Providence. One of their main bases was their staging Fortizar in Y\-MPWL. In the early hours of this morning, its hull became vulnerable. HTP knew that Legacy would destroy the structure  the numbers were too imbalanced  but wanted to give the attackers a bloody nose in the process. Therefore, they devised a trap. The Fortizar became vulnerable, and TEST bridged a Rokh battleship fleet to attack it. Then, HTP moved in a dreadnought equipped specifically to tank the damage type of the TEST battleships. The TEST FC, with 20 FAXes on stand\-by, decided to drop a titan in to doomsday the dreadnought. He had deployed this strategy a week before to great success against HTP and felt confident that this would be a routine operation. The titan jumped in and, after some initial mishaps, destroyed the bait dreadnought. However, as it fired its doomsday in the process, it was immobilised for 5 minutes. This gave HTP a window of opportunity  they undocked interdictors in Y\-MP and trapped the titan. With the titan firmly in their grasp, they then jumped in \~40 dreadnoughts to kill it. The TEST FC responded by ordering his FAXes to undock and jump in to repair the titan. However, even as the order came through, HTP bridged in heavy interdictors onto the TEST staging Fortizar. With the undock full of warp disruption bubbles, TEST could not immediately go to support their embattled titan. However, this was an ambush, not a conventional battle. Despite losing the titan, TEST organised themselves within a few minutes and dropped the supercapital hammer. HTP evacuated what they could, and the rest of their forces went down fighting. The HTP Fortizar was later destroyed, but all sides agree that it was an excellent fight and worth the ISK. *With thanks to /*u/Seddows *and /*u/Meiqur *\(TEST and HTP FCs respectively\) for posting detailed AARs.* \-\-\- **MISTAKES WERE MADE DISBANDS** For the past few months, Mistakes Were Made and the Centipede Caliphate have been fighting a quiet war in Tenerifis. With the larger coalitions distracted by the 10 Month War, these small forces clashed repeatedly. That war is now over. At 1337 EVE, leader Ikta Shoridon [notified the coalition of the situation.](URL The Bastard Cartel \(TBC\) alliance, the coalition lead, has made the decision to consolidate into one corp and join TEST. Ikta has made the new consolidated corporation available for all Mistakes Were Made pilots to join. It appears that at least one leadership figure reached out to TEST to explore options for Legacy support of MWM. They were informed by Dran Arcana, chief TEST diplomat, that \`if you decide to stick it out in tenerifis, our agreement was with Ikta not with ""whoever is carrying the dead torch of his old coalition.""\` This person was further informed that the \`likely scenario \[is that\] you fall apart or get evicted by us or someone else. [You can read fuller logs here. ](URL At 1617 EVE, [Ikta made another announcement](URL that TBC would not be evacuating Tenerifis. This suggests an interesting expansion of TEST influence in the region. \-\-\- **CALMIL AND GALMIL CLASH IN ASAKAI** Between 0216 and 0248, Caldari and Gallente militia [clashed in Asakai](URL The battle began with GalMil engaging a CalMil Athanor in the system with a kitchen\-sink T1 battleship fleet at around 0200. Caldari Militia responded swiftly with a Rattlesnake fleet backed up with Basilisks. However, by 0219, CalMil had lost most of its Basilisks. Without logistical support, the Rattlesnakes were at serious risk. The decision was made by CalMil to bring in a Minokawa FAX to repair the subcapitals. GalMil responded to this by bringing in 2 Apostle FAXes, evening the playing field. With the situation worsening, CalMil threw down the gauntlet and jumped in 6 dreadnoughts and a carrier. GalMil took the challenge, moving their own force of 6 dreadnoughts and a carrier into action. The result was a sharp dreadnought scuffle between the two powers. GalMil won the day and reinforced the Athanor, losing 14.18bn ISK in the process. CalMil lost 22.48bn ISK. \-\-\- **TACTICAL SUPREMACY DESTROYS NUMEROUS CVA STRUCTURES** Tactical Supremacy \(TIKLE\) have been waging their own private war with CVA for the past few months. In this effort, their scouts identified that CVA had timezone tanked their structures in the system of PI5\-39 in AUTZ. This was to defend against the US and EU TZ heavy Pandemic Legion. Unfortunately for CVA, TIKLE is an AUTZ alliance, and set about reinforcing the structures. Today, at around 1000 EVE, many of the structures entered their final vulnerability. TIKLE formed up a 58\-man Malestrom fleet with capital and supercapital support to attack. CVA, realising the danger, put together a 47\-man Machariel fleet with two Apostle FAXes in support. CVA decided to gate into the system. On the in\-gate, TIKLE dropped on them with their full force. A brief fight destroyed the CVA FAXes and sent their Machariels into retreat to CVA Fortizar. TIKLE pursued with their subcapitals and began engaging the Fortizar. When CVAs Machariels fought back, TIKLE countered with long range fighter bombers from their supercapitals. CVA decided to withdraw from the fight, [leaving TIKLE to clear up the structures. ](URL total toll is 1.98bn lost by TIKLE vs 54.35bn by CVA. This represents a significant defeat for CVA in the TIKLE\-CVA conflict. \-\-\- **AND NOW, THE NEWS WHERE YOU ARE** \-\-\- ***NORTHERN*** **INNOVATIVE STRATEGY AS NCDOT DEPLOYS BLACK OPS PIPE BOMB** NCdot has been spotted employing a new composition to counter light harassment fleets from the Imperium. This composition comprises of Black Ops battleships which jump onto a gate just before the enemy arrive, and trigger smart\-bombs. [Here is it in action. ](URL This is interesting because it solves one of the key problems of normal pipe bombing compositions  limited mobility. The ships jump in, bomb, MJD out, cloak up and then jump out when the timer expires. \-\-\- ***EASTERN*** **PANDEMIC HORDE CONTINUES KALEVALA ADVANCE** Over the past weeks, Pandemic Horde has attempted to secure the [Kalevala Expanse](URL so it can be used for renters. This process is now reaching its conclusion, with 60 of its 69 systems now controlled by the Hordelings. **HOLY LEAGUE VICTORY NEAR ON THE ETHERIUM FRONT** Unspoken Alliance, fighting alongside a disparate coalition, are on the brink of victory in Etherium Reach over Prothean Alliance. Our own correspondent in the area, Philip Ricker tells us that, *we have taken more ihubs when they out\-numbered us but stayed in t3ds.* This information is backed up by data from Dotlan. Further, Snuffed Out has put Protheans staging Fortizar into final reinforce. **SNUFFED OUT DESTROYS NULLSECHNAYA SHOLUPEN RORQUALS** After a protracted hunting effort, Snuffed Out found NullSechnaya Sholupen Rorquals in the system of L1S\-G1, near an Athanor. It proceeded to jump dreadnoughts and bridge Nightmares in to kill them. NSS responded with a handful of dreadnoughts and a small Ferox fleet but Snuffed Out repelled them and extracted cleanly. [The toll stands at 8.45m lost by Snuffed Out, vs 90.76bn lost by NSS. ](URL \-\-\- ***SOUTHERN*** **LAWN TITAN DESTROYED** In the system of Mafra in the Kor\-Azor region, Drrty Abarthes Erebus [was ambushed and destroyed ](URL an NCdot dominated dreadnought force. The pilot has since been kicked from his corporation. And, for now, thats how it is in New Eden. Goodnight. \-\-\- *If there are inaccuracies in any of the above, please do let me know so that they can be fixed.* *Do you have something to add? Contact me at Hugh Caswakk#2639 on Discord, or by reddit PM. You can also comment below!* [If you would like to see more of this sort of content, have a look at the New Eden Report. We can't promise that we get everything right, but we give it a go!](URL"
48,vulnerability,Eve,What i think is wrong in EVE and why Brisc Rubal is my last hope,24,8ogxyi,https://www.reddit.com/r/Eve/comments/8ogxyi/what_i_think_is_wrong_in_eve_and_why_brisc_rubal/,2018-06-04 22:40:43,"I won't go into too much detail but here is my list of things that i think need fixing asap. #1. Citadels: Ever since citadels got in the game it's even harder for content creators to get reliable content. - **The defensive power of citadels** should only be there if the citadel itself get's attacked (if it loses 10% of its shields for example). In that case fleets or even solo players could actually engage on a citadel and don't have to fear being PDSed or killed by that citadel they don't want to attack anyway. It would enable station games to start the escalation chain and give ppl a little hope to catch something, bait something, bump something or lose something. - **Keepstar DD** shouldn't work on subcaps. CCP is concerned about headshots and gives us a new ship for it but whenever you get into Keepstar range you will just get DD headshotted along with 7 of your friends - **Tether:** Do subcaps really need tether? They can dock on any citadel anyway. The old station rule should apply - if you undock you are a target! - **Asset Safety:** I get the concern about ppl who leave the game for a while and then come back with all their assets gone ofc. But why not go with an insurance type of approach. If you pay 10% of your assets worth they are safe for a couple months (or whatever the golden numbers might be). If you don't insure and the citadel dies your stuff drops (like in w-space). Suddenly there is a minimum of excitement whenever you kill a citadel since there is always that one guy who fucks up and forgets right? Even if it just drops crap... it might be funny crap :D But atleast there would be a chance of something! #2. Faxes: I think everyone agrees at this point. Be it dreadbomb counters or wormholes or small/med/large scale subcap support faxes are extremely overpowered. - **Their active tank** is crazy and there is no clear counter to them since capital capacitor mods are a thing now too. A proper fitted fax can tank 100 Battleships or 6+ proper Dreads. The active tank ability needs to be looked at for sure! My biggest fear however is that ccp just go with only a slight decrease in repp power and give it another 2years to see how it worked out -.- - **The pricetag** of a fleet FAX is around 2.2B ISK (if you die with insurance you lose around 1.4B) and thats low enough so nobody cares about losing or killing one especially with SRPs. It's almost like FAX kills don't count in eve. If the amount of repp modules that apply on caps would be limited to a magic number (lets say a total of 15 repps) it would actually make sense to fit them properly atleast and therefor increase the pricetag and the loss. I'm still all for removing them completly and adjusting supercaps and carriers but that wont happen :( #3. Aegis sov: Everyone hates doing it (some may claim otherwise but you can't fool us cmon...) - **The amount of nodes** is still way too high. This was already approached but i think those changes didn't go quite far enough. The current system burns out FCs and thats the guys who make the good stuff happen so everyone should be interested in having as many FCs as possible around i would think. At the moment it starts with 4 nodes but it keeps spawning stuff (several nodes per system also) which results in everyone using ceptors to just be quick enough (yeah anything else just wont get there in time anyway) to clear those nodes. We could have 3 static nodes that respawn depending on the ADMs and it would actually give FCs the chance to get a bit of an overview of the situation and have a more tactical approach. Also... caps shouldn't be able to entose in general. - **Nullified Ceptors** are just OP. They should either have no guns but nullification (so they can do their actual job of pure tackle) or they shouldn't have nullification in the first place and can keep their guns. There are 2 ceptors for each race... we could have both i guess - **Entosis trolling** is a common thing and often its just doing the warmup cycle and then leaving. It will send a message and force ppl to come check it out even though you never started the actual entosis. The message should only be send if the entosis is still active after warmup. - **timezone tanking** im not sure if there is much that can be done to this but having an algorithm figure out what timezone your alliance is and set the sov vulnerability timers would make sense i guess. #4. Nullsec security: its supposed to be NULL SECURITY but the reality is different - **local chat** just provides too much instant intel and therefor security. It should just be a counter of how many are in local and show whoever talks (like w-space). It would give hunters and content creators a chance of actually catching something to trigger that fight. It would also profit smaller groups (yeah there are other groups than imperium and panfam that might want to do their own thing) and bots would have a real problem with this too im sure :) - **the amount of anomalies** in a fully upgraded system is insane. How is anyone supposed to catch ppl in a system with 50 viable anomalies? I feel like this wouldn't be a big problem without the perfect local intel. Its crazy that even a big alliance doesn't really need more than one good constellation to live and carebear. With less anomalies it would force bigger groups to spread out more and take more space for themselfs which creates conflicts and conflicts are content. It would also make it way harder to provide full supercap coverage then(we have all seen the latest videos coming from delve) #5. some smaller things that would make our daily eve lifes a bit better - **dictors should be aggressed when bubbling** - **command links shouldn't cause aggression** - **carrier NSA is OP** maybe they shouldnt recieve repps if its active - **fighter mwd cooldown is too low** #VOTE BRISC 4 CSM **If you look at Briscs website you will see a lot of similarities. I guess this comes from years of me getting triggered about stuff and starting rants about it in fleet. While most ppl roll their eyes and just hope i'll be done with it soon Brisc always listened with patience. That doesn't mean we wouldn't have arguments about things but since he issn't emotionally involved and has the ability to change his mind (a very much underrated ability) i feel like he is the right man for the job. So i hope a hand full of you guys consider putting Brisc Rubal on top of your voting list today instead of that generic alliance leader or ""slate"" bullshit that goes on every year (yes im looking at you mittani).** tl;dr vote Brisc for CSM cause hes the only guy i know with the patience to listen to all my bullshit and he got the ability to find the right mix cause he does not have a horse in the race."
49,vulnerability,Eve,"Stupid Question: When a Raitaru is coming out of anchoring, how many HP does it start with?",4,8om3hs,https://www.reddit.com/r/Eve/comments/8om3hs/stupid_question_when_a_raitaru_is_coming_out_of/,2018-06-05 09:40:35,Trying to defend one coming off timers tonight and want to make sure we plan appropriately. Does it start with it's full hull HP? And I assume the 15 minute timer pauses or stops completely if it is shot at? I read this and couldn't find an answer. URL
