,topic,subreddit,title,score,id,url,created,body
0,vulnerability,Eve,World War Bee - TCAG-3 Show down -Battle Report,8,hmjc9o,https://www.reddit.com/r/Eve/comments/hmjc9o/world_war_bee_tcag3_show_down_battle_report/,2020-07-07 09:40:42,"The whole battle is based on what I can see from the Killboard with respect to the value of loss. Legacy seems to have formed with their full force to reinforce TCAG-3 I-HUB as their primary objective. We need to remember that TCAG-3 is a hotspot now that both Imperium and Legacy are fighting it out there often. The Battle started pretty well for Legacy, to be frank it was an awesome start for Legacy. Legacy started hacking the I-HUB during the window of vulnerability and started to have upper hand by having about 600+ players from 10 different alliances in the system at one point. By the looks of it, the composition had Eagles, Jackdaws and multiple munnin fleets supported by Bombers and Smart bombers. The initial efforts to tackle the invasion from Imperium looks like a Interceptor fleet with Burst Jammers to jam the Entosis ships from stopping their progress on entosis. Cheeky and seems like they did break the entosis while the actual fleets were arriving. 20:28 - Imperium lost 1b in Ceptors and Legacy had 0 losses (Pretty bad start for Imperium even thought it is interceptors) When Imperium Sacrilege Fleets entered TCAG the I-HUB seems to have already making progress with Imperium. The TiDi was at peak stopping any fleet from making major progress but Imperium fleets were not able to make it into TCAG-3 for defense quicker. 20:37 - Imperium lost 1.8b and Legacy Started taking their first losses standing at 600mil A good bomb run can turn the battle around, we had it in this battle 20:38 - Imperium stood at 13b loss after a successful TEST Bomb Run and Legacy were standing at 850mil loss At this point Legacy did extreme damage to Imperium Fleet, Both Fleets started engaging while bomber fleet made a huge dent on Imperium Fleet. 20:45 - Imperium stood at 22.5b loss and Legacy were comfortable at 3.5b loss due to the loss of Smartbombing macharials. The trade was at 126 ships lost from Imperium and 29 from Legacy 20:50 - Imperium kept losing ships standing at 30.2b loss and Legacy was at 4.9b loss 20:55 - Imperium Lost about half their fleet with 36.8b loss and Legacy was getting scratched at 6.8b 21:00 - Imperium Kept getting hammered due to loss of DPS on Field with 41.3b loss and Legacy was at 9.6b mostly not losing any of their main line DPS ships This point the defense fleets usually bail out and reduce the loss but the Imperium stood their ground for some reason. 21:05 - Imperium lost more than half their fleet and support ships with 47.5b loss and Legacy stood at 11.4b loss still not losing any of their main line DPS ships 21:10 - Imperium started regaining control with their early loss even with less than half of what Legacy had on field. Imperium lost about 48b and Legacy started losing ships slowly standing at 13.5b Till this point for some reason Imperium decided not to drop their capitals even though they were losing heavily on the fight and Legacy had way more numbers on the field. A mistake? 21:15 - Imperium Decided to use their home advantage and dropped Capital ships like Carriers and Dreads, standing at a loss of 49.4b and Legacy was at a loss of 17.4b 21:20 - Imperium were slowly regaining from their bleeding standing at 49.9b and Legacy stood at 18.1b. TiDi made sure no one can do anything at this point, it was bad earlier as well but Capitals!!!. 21:25 - Imperium lost few more ships with a loss of 53b while Legacy started pulling out of the fight standing at 18.5b loss. This point Legacy Lost their Objective and the strategic goal but won the ISK war. Bailing seems to be the only right option ensuring no further loss is had. 21:30 - Imperium Kept losing their ships while legacy pulled out of the fight standing at 58.2b and Legacy stood at 20b loss. Legacy bailed from the fight and went G-M4GK to ensure taking the ISK trade victory which stood at 3:1 21:35 - Imperium stood at 59b loss and Legacy retreated to Paragon Soul with 23.3b loss at least that is what everyone though At this point the battle seems to have come to an end with Imperium Saving TCAG-3 while Legacy had a ISK victory over Imperium retreating to try again on the objective of Capturing the I-HUB later 21:40 - Imperium chased Legacy to get some kills standing at 59b loss and Legacy losing some more ships standing at 26.3b 21:45 - Imperium Maintained the 59b loss but for some reason Legacy started getting killed on the gate standing at 28.8b. Possibly Legacy decided to give a fight or someone did a mistake (both are mistakes at this point) 21:50 - The Battle seems to have come to an end with no losses on both sides. 22:00 - Loss report closed at 59.1b for Imperium and 29.5b loss for Legacy [URL End of the Battle, Imperium seems to have won the strategic battle by stopping the invading Legacy forces from reinforcing the I-Hub but had to sacrifice double the ISK to Legacy. At one point Legacy had 3:1 upper hand on ISK trade which looked an awesome outcome of the Battle even though the objective is lost. Eventually at the end, the ratio came down to 2:1 but still having Legacy winning the ISK battle even though losing the objective. Legacy fielded about 800 players from about 10 alliances losing 294 ships standing at 29.5b loss and Imperium Fielded about same 800 players from 6 alliances even though half of them either came very late or died very early losing overall 367 ships. Imperium having an Home advantage should have dropped Caps pretty early but decided not to, costing their side dearly. Legacy could have counter dropped but at that point it was not worth it as the objective was already lost and the loss trade was at 3:1. By the looks of it Legacy used their Bomber runs effectively to decimate Imperium Fleet but if my source is correct Imperium used their Interceptor fleet to delay and disrupt Legacy's Objective. Imperium also looked to have got invaded by other Alliances part of the Legacy or Blued by Legacy (Don't have the current list) in various system around Querious, Period Basis, Fountain but not sure if a major number of systems got reinforced. Goonswarm Federation currently have 4 I-Hubs reinforced in the Sov they own and TEST Alliance have about 25 I-Hubs reinforced according to timerboard while I am writing this post. I tried my best and the details might not be correct or exactly accurate but the best I can do."
1,vulnerability,Eve,Day Four: Max CTA Be There,91,ho4sh3,https://www.reddit.com/r/Eve/comments/ho4sh3/day_four_max_cta_be_there/,2020-07-10 01:12:02,"I am attempting to post an end-of-the day report each day of the war so far called World War Bee II. I'm attempting to catalog the various skirmishes and events in a simple easy-to-read format. While there are many layers to any conflict, some not seen and others showing themselves in various chat channels and propaganda, I would like to give the most people possible a layman's understanding. I have done my best to give the best battle reports and context but if you would like to submit corrections or feedback, please DM me on Discord at January Valentine#9887. If you like, check out my new blog: [URL where I'll be cross-posting this and other stories I find interesting. * **Period Basis** At approximately 1600 the IHUB in system of [XZ-SKZ](URL came out of its reinforcement timer. This system is quite important as it is in jump range of almost the entirety of Period Basis excluding the westernmost constellation and the southernmost constellation of Delve, granting huge control of the entire region and establishing a beachhead into Delve. The Imperium assembled a Baltec (Megathron/Bhaalgorn battleship) fleet of over 200 ships including 87 Megathrons, 39 Bhaalgorns and 28 Guardians along with over a dozen HAW dreadnoughts and several FAXes. Under fleet commanders [Apple Pear](URL and [Alfius Togra](URL they set up on the [CJF-1P](URL gate in XZ-SKZ. CJF-1P is the regional gate in Stain that Legacy forces had to come through. The Legacy forces included a whooping 385 Munnins and 18 Cerberus from [Invidia Gloriae Comes](URL with 79 Scimitar logistical support, 55 Machariels from Siberian Squads with their fleet commander [Hanzo Viper](URL 11 Claymore command ships and tactical destroyer/frigate wing composed of 40 jackdaws, 32 crucifiers, and 14 Harpy assault frigates. This is the first time Fraternity, the once bitter enemy of Legacy Coalition, was on-grid offensively as they, along with members of Brave, Evictus and Warped Intentions composed most of the Munnin fleet. Legacys opening move was a bombing run that attempted to clear some of the sentry drones the Megathrons had dropped. The Confessor tactical destroyers sitting next to the megathrons cleared most of the most incoming bomb waves. Combined with the HAW revelations perched above the gate and the sniping sentry drones from the megathron fleet, the gate was surrounded with attackers' wrecks as they struggled to get out of the bubbles. Despite that, Hanzos Machariel and the IGC Cerberus fleet slipped past and started work on entosising the node. Legacy would pay for that node [losing](URL 21.6b isk over 234 ships compared to Imperium forces losing only 4.5b over 43 ships. Concurrently, the bulk of TEST Alliances forces were next door in [35-JWD](URL next door to another Imperium fleet in [0-NTIS](URL TEST was bringing over 3 fleets worth of ships with 538 being Munnins and Eagles and 25 command ships under fleet commanders [ShutUpAndShave](URL and [Manfred Sideous](URL Anticipating an extremely large fleet, The Imperium had placed over 100 carriers - archons and thanatos on the in-gate to the system. Once again, the Legacy fleet jumped through and moved past the gate camp of carrier fighters, paying approximately 10b in heavy assault cruisers to do so. Despite that, they would trade more evenly, [losing](URL 18.2b over 153 ships to Imperiums 18.9b over 127 ships. Surprisingly, despite the large concentrations of forces on the gates, then nodes were mostly free of Imperium forces, allowing Legacy to completely kill the node a little over [an hour later](URL Around 1730 Legacy dropped their own IHUB and completed the entosis making the first system change in the war. The overall fight for the constellation was about [even](URL with Legacy losing 38.6b over 359 ships compared to Imperium which lost 29.2b over 252 ships. * **Fountain** Northern Coalition flipped the system[ I-CUVX](URL in [Hydra constellation](URL of Fountain around the same time as the fight happening in Period Basis. A large Pandemic Horde munin fleet [pushes off](URL a small fleet from The Bastion over the IHUB and [wins](URL the objective losing 210m isk to Imperium losses of 2.9b. The IHUB timer in the system D4KU-5 went uncontested and regenerated back from vulnerability. * **Minor Skirmishes** * Imperium loses two Ansiblex Jump Bridges, the [first one](URL in [U-HYZN](URL in Querious and the [second](URL in [1-SMEB](URL in Delve. The structures were killed undefended. * Imperium bring two fleets, one fleet of 250 Munin and Sacrilege heavy assault cruisers with support along with five Revelation dreadnoughts under fleet commander [kocicek](URL kill a [Caldari Control Tower POS](URL belonging to Black Omega Security in TCAG-3 in Period Basis. * A large Imperium Jackdaw fleet engages with a TEST gate camp fleet on the TCAG-4 gate in G-M4GK. They kill the fighters of the TEST carriers [losing](URL only approximately 270m to TESTs losses of 1.1b. * Pandemic Legion [loses](URL a Ragnarok Titan moving through in the system of [Maseera](URL in Arida by the infamous titan and supercarrier hunting group [LowSechnaya Sholupen](URL * Goonswarm loses four [Amarr Control Tower POSs](URL \- 3 in Paragon Soul in [5AQ-5H](URL [JI-K5H](URL and [ZBY-01](URL and 1 in Esoteria in [HAJ-DQ](URL **Daily Campaign Metrics** For the start date of July 8th to July 9th, the attacking Legacy and Pandafam Coalitions lost approximately 89.5b isk over 1596 ships compared to the defending Imperium losses of 119.9b isk over 1160 ships lost. Corrections that need to be posted will be corrected as soon as I can, rest assured I'm keeping up with all your feedback. The posts and blog posts will be in a constant state of refinement until I get a system I'm happy with. Thank you for your continued kind words and support. :)"
2,vulnerability,Eve,How would everyone feel about covert staging structures?,1,hyglin,https://www.reddit.com/r/Eve/comments/hyglin/how_would_everyone_feel_about_covert_staging/,2020-07-27 08:51:32,So I don't know if this has been suggested before but what if we add a small anchorable structure just for covert staging. They would only be able to hold ships cruiser size and down (maybe an exception for black ops battle ships). They could also have a cloaking functionality to help it stay hidden but this would be kept from being op by either forcing it to uncloak whenever someone docks/undocks or a forced cloak recharge like the current vulnerability mechanic. I was also thinking that there would be a mechanic change that keeps it from being discoverable while cloaked but when uncloaked there is no vulnerability timer. This way as soon as you find it it can be reinforced to keep it from cloaking and only allow it one reinforcement timer. Additionally instead of any real offensive or defensive slots you are able to add a covert cyno and blops bridge. I'm sure someone will hate this idea but I think it would add a good dynamic for small gang covert ops work. Thoughts?
3,vulnerability,Eve,Gallente Stronghold of Nisuwa Falls as Caldari Offensive gains momentum,1,gykxnz,https://www.reddit.com/r/Eve/comments/gykxnz/gallente_stronghold_of_nisuwa_falls_as_caldari/,2020-06-08 07:25:28,"AAR - After taking the system of Prism on Tuesday, Caldari forces were once again on the offensive. Mobilising further in to Gallente occupied systems in the Okakuola constellation with a concerted push to liberate the system of Nisuwa, a Gallente Stronghold since the 25th November 2011. Progress was slow at first with pilots from GMVA and other Gallente groups effectively defending the system, managing to return the contested level to stable to from the 10 or 15% Caldari had gained on Tuesday and Wednesday. Thursday saw the full mobilisation of Caldari Alliances into Nisuwa, including Ghostbirds, Plexodus, Marine Division, Last Republic and UCSC. These Caldari forces were quickly able to build the contested level up and mitigate Gallente recovery over the USTZ on Friday and Saturday. By Sunday morning, Nisuwa stood at 98% with Gallente industrial ships and Jump Freighters seen conducting a mass evacuation of the Nisuwa NPC Station, indicating a loss of morale from the Federation. However, the fight was far from over for the Caldari as they encountered resistance from The Initiative, lead by former Pen Is Out and Spaceship Bebop pilots who had previously flown with Gallente Militia, before and after downtime. Caldari forces inflicted heavy casualties on INIT forces whilst continuing to push the contested level to a vulnerable state, including the killing of a Moros class Dreadnought [URL . State forces managed to hold system vulnerability and buffer for 3 hours before Fleet Commander and Ghostbirds CEO Ganoes Utrigas ordered the final attack on the Infrastructure Hub. Under harassing attack by the INIT fleet, the Caldari forces were able to take the system. As the Caldari fleet aligned out of the area, scouts reported a large Brutix Navy Battle Cruiser fleet from INIT was on approach to the I-Hub. With the objective taken, Caldari forces dispersed. Good Fights to all and special thanks to every Caldari Militia line member, FC and organisation that made this possible. FOR THE STATE."
4,vulnerability,Eve,Could Triglavian mechanics be used to fix other things such as Faction Warfare????,29,h0572q,https://www.reddit.com/r/Eve/comments/h0572q/could_triglavian_mechanics_be_used_to_fix_other/,2020-06-10 16:23:20,"Hey there, I expect the usual trolling etc... Although I'd like to throw out some ideas for faction warfare after fighting within the new Trig mechanics. First of all the Trig content is amazing. While a little buggy due to being understandbly not tested properly (cant mass test something when you want to surprise us with!) I have to say, great job overall CCP! Now to Faction Warfare! This part of the game is in serious need of rework. I have been playing EVE for 10 years and always had some involvement in FW, either with alts or mains. The new mechanics introduced in Chapter 3 of the Triglavian Invasion open up the possibilities for FW and probably other areas, such as NPC null etc... **Complexes** (Novice, Small, Medium etc...) The complexes need some rework badly. Attacking a complex is too easy and can be done with little effort. Whether you are in a frigate or a larger ship you affect the vulnerability of a system the same way. (0.7%) per site. A player only needs to shoot s few ships, wait out a timer and the deed is done. This is too easy. Defelnsive plexing is just sitting on a button and waiting out a timer. My thoughts are to use the new site types and system occpancy system for FW systems. All sites should although require a task to be completed. Such as defending/attacking, a structure or a fleet. Ship size limits could also still be used as it seems they have been in Trig systems. Possibly mix it some sort of mechanic tied back to the Infrastructure Hub in each system. **Missions** Remove missions OR allow missions completed in systems to affect control of the system they are completed in. **Roaming Gangs** Add smart roaming gangs of NPCs that reward tags and/or LP. The higher the system index, the more active the gangs are. The gangs should also go into complexes, sites and open missions and assist their friendly NPCs and shoot at other targets. Missions may be a stretch to include as you dont want the situation of players opening missions and waiting for NPCs to complete them lol... **Faction Warfare Enlistment** With this new standings based system introduced with the Invasions, why the need for Enlistment? Standings with your Militia should be on show for everyone and if your standings are bad enough the other factions police will shoot you in space... Oh thats right they do already. ;) Anyway, thats my initial thoughts... Would love to get this discussion going."
5,vulnerability,Eve,"Dear CCP, Game balancing is all about knowing which hammer you need to pick, allow me to explain.",1,fxqf58,https://www.reddit.com/r/Eve/comments/fxqf58/dear_ccp_game_balancing_is_all_about_knowing/,2020-04-09 20:58:05,"To start with I fully agree that changes are needed in EVE and I fully believe that those who think that is not the case are not able to see the bigger picture or very much are able to see it and realize why keeping the status quo is fully in their benefit. However I do not agree with this latest round of changes (and I still have to see the full effect of the mineral one to make up my mind there) are the changes that will be for the betterment of EVE. It feels like that you (CCP) have decided to say fuck it and start hammering the steel with sledge hammers and power hammers while all you needed was to refine the edge, you already have the blade. &amp;#x200B; The raw number of (super)capitals has been an issue for a good while along with their effectiveness. However they issue here is not much directly with the ship as it is with the game. EVE will always value numbers, specially these days when fleets are often quite well matched ship for ship, the numbers game comes into play a lot. This is why I know a lot of MMO gamers avoid EVE as when the fight escalate you are really just adding X amount of EHP and X amount of DPS to your fleet. The escalating numbers of more capable ships on the field in the forms of capitals and then super capitals comes froth from a overly rich economy and a severe lack of combat, along with the logistical support. If the number of capitals need to be reduced one needs to introduce things into the game that will drive conflict, that make it economically sensible for the large power blocks we have in the game to either go to war with each other or to turn on each other. This will be far easier said then done as the current player counts mean that there is to much space for people to go around, so limiting minerals or perhaps having a roaming sort of resource could be starting ways to see if this will work. Beside that you have been using NPCs more and more and Triglavian stuff to me sounded perfect to have the null folks face off against a truly capable AI opponent that could do some real damage, but sadly this wasn't pushed into that direction and it is something that you should consider. As far as the capital logistics issue, resistances aint the problem and it most certainly is not for the subcaps. This blanket nerve fucks over smaller gangs, PVE players, Solo PVP players, industrials (ganking vulnerability) far more than it will affect the capital fleets of EVE. There are 2 solutions I can see here, 1 is simple and 1 is a bit more complicated, but something that should have been done ages ago imho. The simple solution would be to increase the rate at which logi support gets a diminishing return by a lot. This is a simple change that will overnight make logi in larger scale engagements a lot less powerful both on a capital and a subcapital level. While a blanket still pretty big hammer move it will get the effect you are after without affecting a lot of other players who do not need the nerve. Small gangs will still see their logi being use, but in larger ops they will become less effective and for capital fleets it will become a really noticeable change. Ideally logi power should cap out at 10 ships and anything above that will just be of zero effect. The complex solution would be to create capital grade modules for resistance and make it so capitals cannot fit other modules anymore. In general I believe capitals should have an entire module selection all of their own that does not mix with the supcapital modules. While this would be a lot of work it does allow you in the end as a dev to grab a tiny hammer and just give things a tap here and there to adjust things as needed both on capital and subcapital level. The playing fields between these 2 fleets is not an equal one and that does not have to be a bad thing, but it does mean that adjustments to design are needed and with this change they are made a lot easier. Number of capitals getting lower and their power needs to go up a bit, small wack there and it only affects the capitals no need to worry about the ripple effects throughout the game. &amp;#x200B; Now you also made mention of wanting reward those who close the range, now it should not bear the need to say, but if you nerf the EHP of ships and through it logi as well, you clearly do not understand the game if you believe that will get people to close the range. Nerfing EHP only serves to make sniping more powerful those ships do not care as much about EHP to begin with and their targets now have less of it. EVE is an game about economics end of the day and people will want to achieve their objective as efficiently as possible, reducing losses by whatever means possible is a key factor of this. So lower EHP means people will not go in for the brawl as that means even in a small/medium gang environment a lot of stuff can be killed before logi support can even land. &amp;#x200B; O and 1 final idea that could be worth experimenting with is the range of logi modules, if you reduce the range you reduce the effectiveness as ships will be out of range and logi needs to be in the thick of it making it an easier target as well. &amp;#x200B; Anyhow just my long 2 cents on the whole issue, to those of you who made it through, thanks I guess and I hope I made some sense."
