,topic,subreddit,title,score,id,url,created,body
178,vulnerability,Eve,Why is the Poitot Citadel already destroyed?,4,4hbdxj,https://www.reddit.com/r/Eve/comments/4hbdxj/why_is_the_poitot_citadel_already_destroyed/,2016-05-02 06:37:51,"Hello! How is it possible that the Poitot-Citadel is already dead. Here is the killmail: [Astrahus Citadel Poitot](URL There are already fighters in it, so it seems that it was online and ready for use. On the EVE Helpdesk you will find these article: [CITADEL VULNERABILITY STATES](URL Quote out of the article: &gt;The duration of the Invulnerable state between attacks is: &gt; &gt;24 hours from shield to armor, then 6 days from armor to hull for any structure outside wormhole space If it was anchored and onlined on Wednesday. (The release of the citadel addon) Shield at 0 on Wednesday Armor at 0 on Thursday AND then 6 days invulnerable. Wednesday was 4 days ago?! WTF?! We tested it on the Testservers and had no invulnerable state after shooting all the shields and started to hit armor right away? Is the article wrong or I forgot about something?"
179,vulnerability,Eve,"Given what you know about Citadels now, will you spread your vulnerability windows out, or lump them together at 3am wednesdays?",0,4hhbqw,https://www.reddit.com/r/Eve/comments/4hhbqw/given_what_you_know_about_citadels_now_will_you/,2016-05-02 23:47:42,My personal thoughts and opinions.
180,vulnerability,Eve,How many citadels have actually survived?,16,4holtq,https://www.reddit.com/r/Eve/comments/4holtq/how_many_citadels_have_actually_survived/,2016-05-04 03:30:49,"So, after all of the carnage during the anchoring process, what is the ratio of citadels that have survived out of those assembled? Does this number exist somewhere? When reading the interesting analysis at: URL one is left wondering whether most of the citadel assemblers just didn't thoughtfully defend during anchoring and the weekly vulnerability, or whether citadels (especially mediums) are simply _too_ vulnerable when they're vulnerable. Has _your_ citadel survived a siege by 20+ large ships? How did you do it?"
181,vulnerability,Eve,"""Horde citadel vulnerability window"" is quickly going to become the most fun time of the day in EVE",87,4ige77,https://www.reddit.com/r/Eve/comments/4ige77/horde_citadel_vulnerability_window_is_quickly/,2016-05-09 07:13:24,And it's probably going be when I'm at work or something. Ugh.
182,vulnerability,Eve,Horde's moral at breaking point as they complete two citadels,69,4ilepo,https://www.reddit.com/r/Eve/comments/4ilepo/hordes_moral_at_breaking_point_as_they_complete/,2016-05-10 06:01:16,"O1Y was a very active today as Pandemic Horde set their alarms to help defend the 15 min vulnerability window of the citadels. All ship up and ready, all pumped up ready for anything. Intel comes in ""everyone go potato mode there's a huge goon fleet heading our way"" ill admit I've never used a ferox before, but if I was ever going to use one now was the time. Excitement was all around, also in the other surrounding fleets.That lasted 5 minutes as we get another update saying that huge fleet is not coming... We ended up chasing boats swordfleet around the map until the times ran out in hyper frigs while celebrating a great milestone for PH. Morale is at an all time high! Probably the last time we'll see boat for a while. Join Horde...."
183,vulnerability,Eve,Fozziesov Vulnerability Windows,0,4j7mhc,https://www.reddit.com/r/Eve/comments/4j7mhc/fozziesov_vulnerability_windows/,2016-05-14 04:14:02,"Does anyone else find it dumb that the defensive strategy of both Pandemic Horde and Goonswarm Federation has been to change their vulnerability timers to the time when the least amount of players are online? I think it would be cool, and good for the game, if the highest amount of people were encouraged to participate in sov events. It seems like kind of a silly system when the optimal strategy to defend against an overwhelming group is with something other than getting as many people as you can to occupy your space during the window. I'm not going to give a list of ideas on how to fix it because I am not a game developer, but it would be cool if this strategy wasn't a good strategy. It's probably not an easy fix because there are groups that need a specific window to defend, and any auto generated activity monitor is going to probably end up not working well."
184,vulnerability,Eve,Questions about astrahus,7,4jlyzf,https://www.reddit.com/r/Eve/comments/4jlyzf/questions_about_astrahus/,2016-05-17 02:30:29,"so, im a bit curios of how citadels work in empire. As an empire bear, i want to have my own corner among the stars, and i was thinking about throwing my hard earned pennies into an astrahus citadel. Whan can you do in it, except dock, refine and clone ?(and maybe citadel spinning) Can you manufacture/research/copy/invent in an astrahus? How can you destroy a citadel in &gt;=0.5? Anyone can shoot it during vulnerability window or you have to wardec the alliance/corporation first in order to take it down ?"
185,vulnerability,Eve,Finding out citadel vulnerability times?,0,4jxm4j,https://www.reddit.com/r/Eve/comments/4jxm4j/finding_out_citadel_vulnerability_times/,2016-05-19 02:47:28,OK I just want to make sure I'm not missing something obvious. The only way to find out a citadel's vulnerability times is to go poke it in space and look at the blue circle? And even then you don't know how long that particular window will last or what other times may have been set for the week; only that you see a timer to the next possible vulnerable period?
186,vulnerability,Eve,Keepstars in K-Space,1,4k4xk6,https://www.reddit.com/r/Eve/comments/4k4xk6/keepstars_in_kspace/,2016-05-20 07:49:34,"If current mechanics do not change, will there ever be a) a Keepstar deployed in K-space and b) a Keepstar that survives anchoring in K-space? The 15-minute vulnerability window after anchoring has proven to be a ""content magnet"" of incredible proportion in both K-space and J-space, and only HRDX has managed to pull it off so far (with a year of planning, incredible paranoia, and 1T+ ISK). Fortizars are already enormous targets, and one can only imagine that all of the major PVP groups would pull out all the stops for what would amount to a ~5 Titan killmail. This is exacerbated by the fact that everyone in EVE would have roughly 24 hours' notice to form. Do anchoring mechanics need to be changed to allow the anchoring of these things to be reasonably feasible in k-space?"
187,vulnerability,Eve,Skynet 2.0,5,4k88sa,https://www.reddit.com/r/Eve/comments/4k88sa/skynet_20/,2016-05-20 23:31:55,"As many will recall during the Scylla release CCP moved to counter a feature known as ""Skynetting"" To quote the forum post &gt;This thread is for discussing the proposed removal of fighter assist for carriers and super carriers. &gt;This change being largely driven by 'skynetting' which is a tactic where carriers and super carriers can sit in near perfect safety at the edge of starbase shields and assign thousands of DPS worth of fighter drones to their fleet mates who can fly whatever ship they want *) , while wielding an enormous amount of damage. We feel this is not meeting our standards for risk vs reward and therefor would like to remove the ability to assist fighters. More details are covered in this dev blog. Of course Citadel brought a complete change to fighter mechanics on top of the scylla changes, so Skynetting as it was previously known no longer exists. What we now have are Carriers with ludicrous lock ranges, gigantic grids and fighters that can be used from thousands of KM's away. Theoretically this could offer interesting gameplay with carriers engaging each other across huge distances. The problem comes in when you bring in Citadels. Citadels brought in the ability to tether which is a pretty cool feature. As a pseudo force field replacement the tether makes you invulnerable and will repair damage as long as you do not meet these conditions: * active weapons timer * having or starting a target lock on another target * lack of docking rights with the structure * ejecting from the ship * ship is warp scrambled * activating a cynosural field generator Citadels need to be 1000km from another structure and 500km from a celestial. With the new grid sizes this of course means that they can be on grid with gates or stations. With the new fighter and carrier mechanics this makes it possible for carriers to sit on a citadel and control fighters on the undock of a gate or station. They can either warp to the gate or station and drop fighters then warp back to the citadel or simply deploy fighters from the citadel and let them slow boat. If they start getting attacked they can simply break lock, wait out the weapons timer and once that has cleared the citadel will re-tether the carrier. Someone locking the carrier will not prevent it from tethering, only a scram can do this. If the citadel is being gunned of course that becomes more difficult. There's also nothing stopping, say a friendly FAX from sitting on station as well. Currently there is a PL Fortizar anchoring off the Saranen undock. Given that the tactic du jour has been camping the undock with carriers already and playing station games, it doesn't take a genius to figure out what is going to happen once that Fortizar goes online. Of course you can not truly be camped in a low sec station, since there's no bubbles, you can always instawarp off. However I think this will be an interesting test case to see where Citadels and the carrier mechanics need iteration. Today it is just us dirty goons who will suffer the wrath here, tomorrow it could be anyone across new eden. Yes we could try and form up to kill this citadel during the 15 min vulnerability, maybe we will I have no idea. However we also know that there's a good chance of a large portion of the MBC coming out to defend it. Regardless Saranen is just one example. I know the removal of skynet to begin with was controversial to a lot of people, well here we see essentially a very similar problem, the ability to sit in near perfect safety while wielding an enormous amount of damage. Is this something people see as a good thing going forward? Is this simply ""emergent gameplay""? "
188,vulnerability,Eve,Question about citadel vulnerability.,5,4ko8vs,https://www.reddit.com/r/Eve/comments/4ko8vs/question_about_citadel_vulnerability/,2016-05-24 00:40:21,Im looking at a citadel and it says Secure 11 Hrs xxmin [UNANCHORING] Does that mean it will finish unanchoring in 11 hours? Or the next vulnerability window is in 11 hours? The blue circle around it is half light blue. 
189,vulnerability,Eve,"""Fortress Fade"" is falling.",74,4bzu3r,https://www.reddit.com/r/Eve/comments/4bzu3r/fortress_fade_is_falling/,2016-03-26 14:50:12,"The barbarians are no longer at the gates. The gates of Fade lie twisted and broken in the dust. Today a major victory was won in Fade, with no less than 5 major objectives won by The Good Guys. - The SMA IHUB and TCU in YKSC-A has been destroyed, and the system is now entirely owned by NC. - C-OK0R station is now also owned by NC. - O-ARFO station has been freeported - NC.'s TCU in E9KD-N was saved in the nick of time. URL SMA entosis ships were pushed off at the start of the operation, and they formed a 20-man interceptor fleet to attempt to stop the coalition forces from entosising, to no avail. No major SMA fleet was formed to fight the 200-man strong coalition fleet, and Goonswarm was conspicuously absent in protecting their vassals, as usual. SMA has moved their vulnerability window into EUTZ in an attempt to stop their systems from being entosised. Will this work? Or will moving their vulnerability window to the the active time zone of the bulk of coalition forces be a fatal mistake? Only time will tell. "
