,topic,subreddit,title,score,id,url,created,body
0,vulnerability,learnprogramming,Build a project. Dont rely on tutorials,1,i281ms,https://www.reddit.com/r/learnprogramming/comments/i281ms/build_a_project_dont_rely_on_tutorials/,2020-08-02 17:11:32,"Hi reddit (first-time poster here) Im a software instructor on Udemy (Rayan). Im also filling an enterprise development position for the government of Canada. I noticed a lot of posters were discussing tutorial hell. This is something my students have messaged me about as well. If youre in that position, I cant give you a universal solution to becoming a professional developer. But, I can tell you what worked for me. 1. Do not aimlessly watch tutorials. Look for tutorials that will help you build a project that youre planning. 2. Plan a large scale project. Build it at any cost. I first learned how to program by building an anonymous chat application. This incorporated front-end and back-end. This also forced me to learn crucial design patterns (i.e MVC) 3. Never fear bugs. Embrace them. Encountering a bug means you found a vulnerability in your app. This is great news! The easiest way to fix bugs is to set a series of breakpoints. Then, run print statements at each breakpoint. Or, sometimes it helps to compare the current version of your code to a previous version. See what changed. This may help isolate the issue. Of course, there are many ways to debug a program (some beyond the scope of this post) In any case, do not leave a bug unsolved. Resolve it at any cost. Its only when we struggle that we learn. 4. A coders best friend is stack. Everybody uses stack. It doesnt matter what level. 5. There are many more things I could write about. But, I believe the first 4 points are the best advice I can give to a beginner in development. This may get lost in the millions of programming posts. But, I hope this at least can guide one person. Head up and happy coding!"
1,vulnerability,learnprogramming,URL Query String Vulnerabilities / Alternatives Question,1,i3r6pf,https://www.reddit.com/r/learnprogramming/comments/i3r6pf/url_query_string_vulnerabilities_alternatives/,2020-08-05 06:32:01,"I'm working with ASP.NET MVC to create a page that will be linked to by several other pages. On my page, I need to have a button that links back to whichever one of these pages a user came from. Unfortunately, I don't know exactly what the URLs of said pages will be. They may contain query strings and variations that I'm not sure how they are generated. So, I am passing the URL of whatever page a user is coming from as a query string to my new page. As long as it is a relative URL, and the domain name is the site, it should be fine right? Is there a way in ASP.NET to validate that a URL is relative and not absolute, or maybe a way to check that a URL does not link away from the site it's on? Alternatively, is there a better way to do this that isn't prone to vulnerabilities like this one? There is the javascript history.back() function, maybe I should just use this? I have heard of flaws with this too though, for example if browser history has been cleared. But then maybe it's better to deal with these flaws than a potential security vulnerability. Thoughts? TL;DR Is redirecting to a relative URL from a query string a terrible idea? If not, what are some reliable forms of ASP.NET validation?"
2,vulnerability,learnprogramming,Overwriting an ASM instruction via a format string vulnerability?,1,ideeg8,https://www.reddit.com/r/learnprogramming/comments/ideeg8/overwriting_an_asm_instruction_via_a_format/,2020-08-21 03:13:10,"I'm doing the [format4 exploit exercises](URL challenge. My idea was to overwrite the `exit` instruction at the end of `sym.vuln` with custom ASM. My solution is: ``` python -c ""print '\x0c\x85\x04\x08\x0d\x85\x04\x08\x0e\x85\x04\x08\x0f\x85\x04\x08\x10\x85\x04\x08' + '%4$n%5$n%6$n%7$n%8$n'"" | ~/workspace/exploit-exercises-protostar/protostar/bin/format4 ``` In theory, I should be able to write values to the address that says `exit` and instead make that instruction say `jmp 0x080484b4` which is the `sym.hello` function (the target). I use `rasm2` to get that instruction in hex: `e8eafeffff`. However, as I'm stepping through `sym.vuln` with radare2, I never get out of the `printf` function. I get a segfault but I don't seem to be modifying the instruction where `exit` is supposed to be. (I understand that the expected attack is to modify the GOT but I wanted to test other methods) So does anyone know if that's a limit? Can I not modify the instructions specifically? Or am I doing something wrong?"
3,vulnerability,learnprogramming,[Free Udemy Courses] - 50 + Premium Udemy Courses for FREE. (All Categories include Programming),1,hndzdd,https://www.reddit.com/r/learnprogramming/comments/hndzdd/free_udemy_courses_50_premium_udemy_courses_for/,2020-07-08 19:28:26," Credit to - [100oFFDeal](URL Free courses and some will expire soon. &amp;#x200B; 1. [Basic Python Quiz](URL 2. [C++ Programming Step By Step From Beginner To Ultimate Level](URL 3. [Free PHP Tutorial - Practical PHP: Master the Basics and Code Dynamic Websites](URL 4. [CSS &amp; JavaScript - Certification Course for Beginners](URL 5. [Free Android Development Tutorial - Free Android Apps Tutorial: Android Application Development](URL 6. [Free JavaScript Tutorial - Code Your First Game: Arcade Classic in JavaScript on Canvas](URL 7. [Free Git Tutorial - Git &amp; GitHub Crash Course: Create a Repository From Scratch!](URL 8. [Agile Key Exam Concepts](URL 9. [Anger Management Master class](URL 10. [Comic Creation for Entrepreneurs](URL 11. [CompTIA A+ Core 1 2020 Edition Latest Exam](URL 12. [CompTIA CT0-101 Convergence+ Certification Practice Exam](URL 13. [Diploma in Meditation|Meditation for Beginner to Advanced](URL 14. [Employee Onboarding Mini Crash-Course](URL 15. [Flexible Budgets, Standard Costs, &amp; Variance Analysis](URL 16. [Goal Setting Mastery](URL 17. [Nonprofit Google Grant: Ultimate Nonprofit Approval Guide](URL 18. [Top Herbs For Your Health: Herbalism &amp; Natural Medicine!](URL 19. [How to Make Passive Income With Bitcoin Lending](URL 20. [Improve Your Python by taking Python Quiz](URL 21. [Introduction to Domain Names and Web Hosting - Quick Guide](URL 22. [ISACA CGEIT Certification Practice Test](URL 23. [Learn EFT Emotional Freedom Technique - EFT for Rapid Change](URL 24. [Learn Google Drive From Beginner to Advanced](URL 25. [Learn Microsoft Office 365](URL 26. [Managerial Accounting / Cost Accounting](URL 27. [Marketing Automation &amp; Email Marketing for Beginners](URL 28. [Master Budgets  Managerial Accounting/Cost Accounting](URL 29. [Fundamentals / Basics of Mathematics through Animated Videos](URL 30. [Melt &amp; Pour Soap Making Home Business Marketing Starter Kit](URL 31. [Mindfulness Meditation: The Path To Wisdom &amp; Success](URL 32. [Muscle Building](URL 33. [Muscle Gain Magic  Powerful Way To Build Muscle &amp; Strength](URL 34. [NGINX, Apache, SSL Encryption - Certification Course](URL 35. [Operations Management: Operations and the Organization](URL 36. [Oracle 1Z0-521 EBS R12 Order Management Fundamentals Exam](URL 37. [Overcome Your Self Doubt](URL 38. [The complete Personal Protective Equipment training](URL 39. [Plan and Acquire Resources (PMI - PMP)](URL 40. [Plan and Define Project Scope (PMI - PMP)](URL 41. [Process Costing System-Cost Accounting-Managerial Accounting](URL 42. [Public Speaking: Start Strong &amp; Engage Any Audience](URL 43. [Public Speaking: A tactical approach](URL 44. [Relevant Costs - Managerial Accounting Decisions &amp; Scenarios](URL 45. [Setup a Virtual Web Server using Linode or Digital Ocean](URL 46. [Operations Management: Supply Chain Management](URL 47. [The 60 Minute Masterclass on Facilitating Virtual Meetings](URL 48. [OBS Studio - Ultimate Livestreaming Guide to OBS Studio](URL 49. [Understanding the NLP](URL 50. [Vulnerability Identification In Cyber Security Course](URL 51. [Paint an Easy Haunted House with Watercolors](URL 52. [Wave Accounting 2020](URL"
4,vulnerability,learnprogramming,A humoristic DevSecOps glossary with funny cartoons,1,hp7fh6,https://www.reddit.com/r/learnprogramming/comments/hp7fh6/a_humoristic_devsecops_glossary_with_funny/,2020-07-11 19:48:24,"CI/CD, DevOps, Microservices, Shift Left, 0 day vulnerability explained the funny way (we hope!): [URL Any comment welcome!"
5,vulnerability,learnprogramming,Secure Coding,1,hzn5nt,https://www.reddit.com/r/learnprogramming/comments/hzn5nt/secure_coding/,2020-07-29 07:10:38,"Hi fellow redditors, I would like to get help on this project that I'm working on. I'm trying to test the Python code snippets that control Zumi's self-driving AI program-control and find code vulnerabilities by generating insecure code scenarios. Most of their code modules are pretty straight forward and nothing much complicated. I just finished my freshman year in college and took Elementary programming in python. hence, I'm a cybersecurity major. I would appreciate it if anyone can create and manipulate a security vulnerability in the below code. Is there a way we can tweak the code and make the robot to malfunction. &amp;#x200B; Thank you so much in advance. \---------------------------------------------------------------------------------------------------------------------------------------------------- from zumi.zumi import Zumi import time zumi = Zumi() for i in range(1000): ir\_readings = zumi.get\_all\_IR\_data() front\_right\_ir = ir\_readings\[0\] front\_left\_ir = ir\_readings\[5\] back\_right\_ir = ir\_readings\[2\] back\_left\_ir = ir\_readings\[4\] &amp;#x200B; if front\_right\_ir &lt; 100 or front\_left\_ir &lt; 100: zumi.reverse(duration=0.5) elif back\_right\_ir &lt; 100 or back\_left\_ir &lt; 100: zumi.forward(duration=0.5)"
6,vulnerability,learnprogramming,[C language] How can a non const pointer (that allows to access in nearby memory) be exploited?,1,ggk2jp,https://www.reddit.com/r/learnprogramming/comments/ggk2jp/c_language_how_can_a_non_const_pointer_that/,2020-05-10 03:52:26,"I studied that a non const pointer can be exploited to access in nearby memory of computer. But my question is: how? I mean, if I have started my compiled program, how can an attacker exploit it if it is *already* compiled and running? Is this a dangerous vulnerability? Or it isn't so important?"
7,vulnerability,learnprogramming,What are the benefits to use const pointers or const data? Should I use them?,1,ghokuz,https://www.reddit.com/r/learnprogramming/comments/ghokuz/what_are_the_benefits_to_use_const_pointers_or/,2020-05-12 00:29:37,"How can a non const pointer (that allows to access in nearby memory) or a non const data be exploited? I studied that a non const pointer can be exploited to access in nearby memory of computer. But my question is: how? I mean, **if I have started my compiled program, how can an attacker exploit it if it is already compiled and running?** Is this a dangerous vulnerability? Or it isn't so important?"
8,vulnerability,learnprogramming,Am I good enough for building this Web App alone? or am i dreaming too big? [Serious],1,gpu4lw,https://www.reddit.com/r/learnprogramming/comments/gpu4lw/am_i_good_enough_for_building_this_web_app_alone/,2020-05-25 03:57:22,"Hi All I am a college dropout and i have been working as a freelancer for the last 4 years and have done many complex projects in PHP. So basically I was thinking to build an Elearning Management system in Laravel - PHP but today I had all this doubt kicked in like how do you think you are to build this? You don't have any funding (Barely meeting your expenses) + No Formal Education + No Employees neither you can afford to right now I am confident in my abilities to build a cutting edge Elearning platform but I am not sure about the secure part like all those SQL Injections, XSS attacks, Virus Image Uploads etc etc. Basically I am using laravel which will handle all these things if done correctly what concerns me is one small mistake on my part and Hackers can ruin my life, Example - Any form has SQL injection vulnerability or If i forgot to validate any uploaded file what if the hacker then Changes the Paypal API tokens of my clients OR what if he simply injects his own Payment Page similar to our Using phishing on our site? You might be thinking it is unlikely as we would not be famous but what if some famous Youtuber uses our web app to sell his premium courses and he has millions of subs What if out of so much traffic my sites comes in notice. So basically i will be charging 50$ per month and what if i get millions of visitors from a couple of Youtube instructors and my site pages gets PHISHED (He redirects Payment to his own website looking like mine all he has to do is change some link on my website) or DB MODIFIED that would mean potentially 1000s of payments going to hackers account? Would you start this project alone if you were in my Place? I am sure I am missing something I don't want to live in this state of fear I have lots of ideas earlier but I left them because of similar fears. Not sure if this is appropriate subreddit If not? Please drop some other subreddits where i can post this as i have got no one to share this problem"
9,vulnerability,learnprogramming,How do I send a POST request using an XSS vulnerability,1,gtep9d,https://www.reddit.com/r/learnprogramming/comments/gtep9d/how_do_i_send_a_post_request_using_an_xss/,2020-05-30 23:57:58,"Just to let you know this is regarding a homework. So I am given a simple banking website that is vulnerable to XSS attacks. Admin and two user login details are available to me. User functionality involve only sending a message to the admin, or transfer money between other users. Admin functionality involves sending a general message to everyone and reading incoming messages. As admin, I have to send such a persistent XSS message that when user_a logins to the site, user_b receives some amount of money transfer from user_a. I downloaded Burpsuite to view POST requests during login and money transfer. They seem very simple. They are just a single line of parameters. I tried searcing online, and general advice is to use ""XMLHttpRequest"". So I tried to use that with given instructions shown below: &lt;script&gt; var xhr=new XMLHttpRequest(); const url=new URL(""the transfer page url is pasted here""); xhr.open(""POST"", url, true); xhr.setRequestHeader(""Content-Type"", ""application/x-www-form-urlencoded""); xhr.send(""toid=6789&amp;amount=2&amp;usage=instance2&amp;submitbtn=%C3%9Cberweisen""); //this is the body of the post request for the transfer &lt;/script&gt; So I append that script at the end of the search url so it receives as an input, and click it as the victim(user_a). I expect that this script should send money to the user id 6789 (user_b) but it doesn't work. It just somehow makes the victim administrator all of a sudden. No money is being set. And I'm stuck at this point. All help is appreciated."
10,vulnerability,learnprogramming,"What exactly is ""security"" and what does it have to do with memory?",1,fywiw4,https://www.reddit.com/r/learnprogramming/comments/fywiw4/what_exactly_is_security_and_what_does_it_have_to/,2020-04-11 14:35:23,"I have experience in programming so I'll understand the terminology. Anyway, here's my confusion. There seem to be many different, seemingly unrelated definitions of the term ""security"": 1. Cryptography - encrypted message are more secure than plain-text. This type of security makes perfect sense to me. 2. Memory leaks - people say that you can write ""insecure"" or ""unsafe"" code in C/C++ because you have to manually manage memory. I'm just confused about what this has to do with security. If you use a couple more kb than you need to, what does that have to do with safety and protection from hacking? 3. Security at the operating system level: people have different opinions on this, some say that Linux is more secure than Windows, etc. What makes one operating system more secure than another and why? Isn't the fault ultimately with the user, who chose to run a random virus file with elevated privileges? 4. Security of libraries (especially for web servers): every now and then, I get a notification that says that some security vulnerability has been patched. I don't understand how it's possible for a server to be hacked due to a vulnerability in a web server library - doesn't the library just give you a way to easily handle requests? Not sure how someone would be able to exploit this. Are these definitions different, or are they somehow related to each other? And I'm also not sure how number 2 is a type of security at all. Is there a website that would clear up my confusion?"
11,vulnerability,learnprogramming,What is JAVA and Jobs opportunities after learning JAVA properly?,1,fhctpz,https://www.reddit.com/r/learnprogramming/comments/fhctpz/what_is_java_and_jobs_opportunities_after/,2020-03-12 18:53:33,"It enables developers to write codes with more effective instruction sets supplied by Oracle Inc. It's among those high tech programming languages that are employed in web applications, business software, and standalone programs. The coffee has some sort of principles; these principles are called its""syntax"". [Best Java Classes in Pune](URL denotes the acquisition of knowledge, abilities, and competencies as a consequence of the instruction of technical or technical abilities and understanding that relate to particular helpful competencies. Coaching has particular goals of enhancing one's capacity, ability, and functionality. Java is a popular, powerful, stable, platform-independent, multithreading established high tech programming language. Having knowledge of coffee candidates may create a career as a Java programmer (software developer). There are many frameworks offered where the candidate may combine such as Hibernate, Struct, Spring, Webservices, etc.. JAVA course could be great for people to start their career in the IT As a programmer, For That you'll require Guidance and total Java Training at Pune. A normal Java programmer in India comes in an engineering or computer management background. Why Move for Java Training in Pune in SevenMentor? Our coffee course content with Fundamental to Advance degree. JAVA Course contents are all framed by Business leaders using 200 interview questions that can make you Pro in JAVA. We're a group of seasoned industry specialists with real time JAVA development vulnerability to provide technology in the ideal way. Greatest JAVA Training in Pune Placement is essential to begin your career as a programmer. We've got a committed placement cell to handle positioning assistance so we could make you Employable. Our faculties give technical assistance even after the positioning of candidates to get their career development. This is the very best location in Pune to begin your career in JAVA at which you'll get particle oriented Java Training with 100% Placement Assistance. Learn with the Finest [Java Training in Pune](URL If it comes to constructing a new home from the digital universe there are several who come near the particular language on peak of the shrub. JAVA has been a top degree, Object-oriented, the platform-independent and architectural impartial programming language has got the capacity to style standalone, online and mobile-based software. It's since been a genuine master of many technologies based on coffee a number of these are Hadoop, SalesForce, Cloud Computing, Android and a lot more. You will find many and various objectivity fronts in order to that these can be and could be practical for. In this new era world coffee is a field of different pages to the identical publication the keys to that are stored in by those potential worlds such as Android and Cloud Computing etc., these webpages or keys to victory are being held in large purgatory derivatives in SevenMentor helping us are the masterminds of those skill sets and assisting us stick to and create more in most ecological conditions associated with coffee. Thus with this larger knowledge together with the proactive developmental condition which our professional coaches have with us are more generous to discuss it with all the pupils who walk in to listings such as best coffee courses in Pune, innovative coffee training in Pune. . Making us the developmental mecca within our perceived manners and methods that's not only for fractional growth purposes but also for the larger good and advancement of these students prepared to spend their time to find out newer and better items for themselves to grow. Building a significant indent on the industry and dividing our title on to the business pros helping us helping place and removing our pupils out of depositional positions to among the larger good and prosperous improvement. Also, Read Related post - [Android Classes in Pune](URL [Software Testing Courses in Pune](URL [Selenium Classes in Pune](URL"
12,vulnerability,learnprogramming,Need help finding vulnerabilities in code snippets,1,fs4z0p,https://www.reddit.com/r/learnprogramming/comments/fs4z0p/need_help_finding_vulnerabilities_in_code_snippets/,2020-03-31 13:49:30,"I have 4 snippets of code, two of which I can identify and the other two I am having trouble with. Any help is appreciated thanks! int main(int argc, char** argv) //SNIPPET 1 { char *filename = argv[1]; char command[40] = {0}; sprintf(command,""cat \""%s\"""", filename); system(command); } \^ In ""SNIPPET 1"", I think the vulnerability is if the filename is too long it can cause a buffer overflow, to mitigate it, you could check the length of ""filename"" before writing to the ""command"" buffer. &amp;#x200B; int average(int number1, int number2) //SNIPPET 2 { return (number1 + number2) / 2; } \^ In ""SNIPPET 2"", this has to do with MAX INT value and it will overflow but I can't really explain it well or how to fix it #include &lt;stdio.h&gt; #include &lt;unistd.h&gt; #include &lt;string.h&gt; int main(int argc, char *argv[]) //SNIPPET 3 { char *fn = argv[1]; char buf[60]; int i; FILE *fh; scanf(""%50s"", buf); if(access(fn, W_OK) == 0) { fh = fopen(fn, ""a+""); fwrite(""\n"", sizeof(char), 1, fh); fwrite(buffer, sizeof(char), strlen(buffer), fh); fwrite(""\n"", sizeof(char), 1, fh); fclose(fh); } \^ I am not sure about SNIPPET 3, there is no buffer overflow because there is a width specifier on the scanf. #include &lt;stdio.h&gt; #include &lt;stdlib.h&gt; #include &lt;string.h&gt; #define MAX_PATH 255 char *mkpath(char *names[]) // SNIPPET 4 { char *s = malloc(MAX_PATH + 1); for(; *names; ++names) { strcat(s, *names); strcat(s, ""/""); } s[strlen(s) - 1] ='\0'; return s; } int main(void) { char *names[] = { ""/usr"", ""home"", ""Desktop"", ""workWork.txt"", NULL }; char *fname = mkpath(names); printf(fname); putchar('\n'); free(fname); } \^ I cannot see where the vulnerability is in this code either."
13,vulnerability,learnprogramming,Buffer overflow vulnerability lab,1,fsx05v,https://www.reddit.com/r/learnprogramming/comments/fsx05v/buffer_overflow_vulnerability_lab/,2020-04-01 21:06:46,"I am working my way through a lab to demonstrate a buffer over flow exploit. I have it working but there's one area that I'm not quite understanding that I'm hoping someone can explain for me. This is the code with the exploit: /* Vunlerable program: stack.c */ /* You can get this program from the labs website */ #include &lt;stdlib.h&gt; #include &lt;stdio.h&gt; #include &lt;string.h&gt; int bof(char *str) { char buffer[24]; /* The following statement has a buffer overflow problem */ strcpy(buffer, str);  return 1; } int main(int argc, char **argv) { char str[517]; FILE *badfile; badfile = fopen(""badfile"", ""r""); fread(str, sizeof(char), 517, badfile); bof(str); printf(""Returned Properly\n""); return 1; } I'm running this on a 32 bit version of ubuntu 16.04. I have managed to get the exploit working but I'm just trying to get some proper understanding of the memory size allocation. In order to locate the position of the return pointer I must first determine the size of the memory allocated to the buffer[24]. To do this what I have done is run gdb on the bof function and I can see that the memory allocated on my system is 0x20 which is 32 bits. If I change size of buffer I can run gdb and find the memory slot allocated. But should I be able to tell how much memory would be allocated to buffer[24] without gdb? If I change to buffer[8] should I know at a glance what the memory block on a 32 bit system is, or does it vary on the system? And if I should know can someone explain how."
14,vulnerability,learnprogramming,A (relatively) short tutorial on front end development for security analysts,1,ezdlfg,https://www.reddit.com/r/learnprogramming/comments/ezdlfg/a_relatively_short_tutorial_on_front_end/,2020-02-06 05:05:54,"Hey, I'm putting out a course on YouTube that teaches hacking. The theory behind the course is that the vulnerabilities are easy to understand if you get how the code behind them works. This video follows that theme, it gives a crash course in front end web development in the simplest way possible (no frameworks, compiling Javascript) and culminates by exploring a cross-site scripting vulnerability we included in the code. URL I've made a ton of videos on background info up to this point (VM install, Linux basics, data types, bit manipulation, etc.) and that is indexed on URL Going further in this module I will be giving really easy to understand examples of front end, back end, and some simple SQL stuff, as well as all the vulnerabilities that come along with those (and how to fix them!). If you're interested in learning more I always appreciate subscribes. Cheers!"
