,topic,subreddit,title,score,id,url,created,body
56,vulnerability,learnprogramming,Modify the return address of a C function with buffer overflow vulnerability,2,332mk1,http://www.reddit.com/r/learnprogramming/comments/332mk1/modify_the_return_address_of_a_c_function_with/,2015-04-19 08:50:06,"I am trying to modify the following C program so that the main function will skip the printf(""x is 1"") line and only print ""x is 0"". void func(char *str) { char buffer[24]; int *ret; ret = buffer + 35; // Supposed to set ret to the return address of func (*ret) += 16; // Add the offset needed so that func will skip over printf(""x is 1"") strcpy(buffer, str); } int main(int argc, char **argv) { int x; x = 0; func(argv[1]); x = 1; printf(""x is 1""); printf(""x is 0""); getchar(); } As the comments imply, the ret pointer needs to first be set to the return address of the function. I then need to add on an offset that will push it over the line I want to skip. I am running this code on a Linux system with 2 x Intel(R) Xeon(TM) CPU 3.20GHz. I am using gcc version 4.7.2 (Debian 4.7.2-5) to compile. I'm also trying to use example3.c from this (URL link for reference. Here is a disassembly of the main function using gdb: Dump of assembler code for function main: 0x0000000000400641 &lt;+0&gt;: push %rbp 0x0000000000400642 &lt;+1&gt;: mov %rsp,%rbp 0x0000000000400645 &lt;+4&gt;: sub $0x20,%rsp 0x0000000000400649 &lt;+8&gt;: mov %edi,-0x14(%rbp) 0x000000000040064c &lt;+11&gt;: mov %rsi,-0x20(%rbp) 0x0000000000400650 &lt;+15&gt;: movl $0x0,-0x4(%rbp) 0x0000000000400657 &lt;+22&gt;: mov -0x20(%rbp),%rax 0x000000000040065b &lt;+26&gt;: add $0x8,%rax 0x000000000040065f &lt;+30&gt;: mov (%rax),%rax 0x0000000000400662 &lt;+33&gt;: mov %rax,%rdi 0x0000000000400665 &lt;+36&gt;: callq 0x4005ac &lt;func&gt; 0x000000000040066a &lt;+41&gt;: movl $0x1,-0x4(%rbp) 0x0000000000400671 &lt;+48&gt;: mov $0x40075b,%edi 0x0000000000400676 &lt;+53&gt;: mov $0x0,%eax 0x000000000040067b &lt;+58&gt;: callq 0x400470 &lt;printf@plt&gt; 0x0000000000400680 &lt;+63&gt;: mov $0x400762,%edi 0x0000000000400685 &lt;+68&gt;: mov $0x0,%eax 0x000000000040068a &lt;+73&gt;: callq 0x400470 &lt;printf@plt&gt; 0x000000000040068f &lt;+78&gt;: callq 0x400490 &lt;getchar@plt&gt; 0x0000000000400694 &lt;+83&gt;: leaveq 0x0000000000400695 &lt;+84&gt;: retq End of assembler dump. Using what I've read from the example, my buffer is 24 bytes long and I should add an extra 4 bytes for the SFP size and 7 for the slack size. This would mean I add 35 bytes to get to the return address of &lt;0x000000000040066a &gt;. It then looks like I want to jump to the call at &lt;0x0000000000400680 &gt;. This should be an offset of 16. However, when I execute the code, I'm getting segmentation faults. I can't seem to find out why. Is there something wrong with my math or assumptions?"
57,vulnerability,learnprogramming,Learning Java. Is Java vulnerability an issue?,3,2ya3g0,http://www.reddit.com/r/learnprogramming/comments/2ya3g0/learning_java_is_java_vulnerability_an_issue/,2015-03-08 09:10:56,"I constantly hear about Java zero-day attacks and it being a nightmare in terms of security. I saw an article about how Minecraft's new launcher now no longer requires Java (it will has its own built-in) so you can uninstall it to avoid security. As a person learning Java, what implications does this mean? Do the Java vulnerabilities affect me? Are there precautions to take such that I would be safe? Or is this simply a risk I have to bear? Also, can someone explain to me what are environmental variables and how to set up Java environment for Windows and Linux? How to automatically update JDK to the latest version and why would I need to keep older versions of a JDK (why may applications utilize only older JDK version and not always the newest)? P.S. People used to say OpenJDK was not as good as Oracle JDK and I can definitely understand that. Nowadays, they are probably close enough that you can substitute either one for general needs. For a Java developer or those who utilize JDKs in many scenarios, is OpenJDK still able to completely replace Oracle JDK? One would always prefer the open-source version if both were exactly the same--but are they identical?"
58,vulnerability,learnprogramming,How do buffer overflow attacks work?,77,2yrzt8,http://www.reddit.com/r/learnprogramming/comments/2yrzt8/how_do_buffer_overflow_attacks_work/,2015-03-12 20:05:03,"I understand how they function in general, but how do people discover a vulnerability without viewing the source code? Isn't this something that most programs account for? Does anyone have an example of a specific buffer overflow attack? -------------------------------------------------------------------------------------------------------------------- Edit: Thanks for the great replies everyone. I noticed that there were a few comments asking what buffer overflows were below, and I didn't include anything in my original post about it so I will include a very brief and simple explanation here so that those coming in who don't have experience in a low level language like C can understand what the comments in this thread are referring to. /u/Hexorg has a great explanation of them below as well. Suppose that you create an array of char large enough to hold 10 characters; the computer is then going to allocate enough space in memory to store those 10 characters. Suppose then you take input from the user and store their input in this array. If the size of their input is &lt;10 characters, there is no issue -- the input is simply stored in the array and the program moves on. Now suppose that the input is greater than 10 characters. If there is nothing built in to detect and stop an input larger than the size of the array from being stored, then the input is going to overflow into memory, onto the program stack, and overwrite whatever is currently stored there. Some malicious users can abuse this vulnerability by including instruction encoding that the program will execute in place of what was previously there and cause it to perform in ways it was never intended to. Those of you who are far more knowledgeable about this, please by all means correct me on anything that is wrong in my explanation. I just want everyone coming in to understand what is being discussed. -------------------------------------------------------------------------------------------------------------------- Edit 2: I posted this as a comment but I will post it here so it gets more exposure and more people have an opportunity to answer: I guess what is still confusing is how someone knows where to pass a return address for whatever instructions they want to execute without viewing the stack. I see how it would be easy to just pass in an arbitrarily large string of characters and see if it crashes the program -- obviously you wouldn't need to actually view the stack to do this; but how do people actually cause a program to execute their own set of instructions passed in via their input without knowing where the programs return is in order to give it the address of their own exploit instructions? My understanding is that you would have to pass in a string of a specific size so that the address reached the point on the stack where the return instruction executes."
59,vulnerability,learnprogramming,"Vulnerability dilemma: what should I do if the vendor isn't fixing things, and how long is reasonable?",1,2zm22i,http://www.reddit.com/r/learnprogramming/comments/2zm22i/vulnerability_dilemma_what_should_i_do_if_the/,2015-03-20 05:38:13,"I'm going to keep this vague for legal and ethical reasons, so I hope you guys understand. I've recently run into my first undiscovered vulnerability in the wild. It's pretty serious, involving execution of arbitrary shell commands as a privileged user, and was found on a live internet-facing server. So I did what any person in my position with a sense of ethics would do: I disclosed it with proof of concept code to the vendor. I got a response on the next business day saying they're going to look into it and patch it. It's been a little while, and the service still has that vuln in it, and no temporary mitigation efforts. So, I really don't want to screw anyone over here (read: no Full Disclosure), but I have this nagging feeling that I'd be partially responsible if they got completely ripped apart by a malicious user exploiting this flaw. Does anybody here with NetSec experience have any advice? Should I even worry about it at all and just make sure I minimize damage to myself should this get found by the wrong crowd? I really want to hear what you folks think about this!"
60,vulnerability,learnprogramming,A Gentle Introduction to Cross-Site Scripting (XSS),1,30glef,http://www.reddit.com/r/learnprogramming/comments/30glef/a_gentle_introduction_to_crosssite_scripting_xss/,2015-03-27 15:51:45,"I wrote this post to introduce folks with a modicum of web knowledge to the perils - and potential - of cross-site scripting (XSS), the most common web application vulnerability on the Internet today. URL"
61,vulnerability,learnprogramming,"Can someone ELI5 a buffered overflow, and how to spot if there is vulnerability in a program?",5,2x7shj,http://www.reddit.com/r/learnprogramming/comments/2x7shj/can_someone_eli5_a_buffered_overflow_and_how_to/,2015-02-26 19:53:10,"~~Hello all! I understand that a buffered overflow is when, for example, if you want a int (assuming it is four bits), and you parse an eight bit number, those extra bits will effect the data in the next neighbor memory address, but how? And how can you take advantage of this for changing other variables in the program? Thanks!~~ Hey, everyone, Just wanted to thank you all for responding and explaining it what a buffer overflow is! You were all very help and made complete sense (which is a pro for me!). I would give you gold, if I could afford it for myself D:, but have an upvote! . ^Also, ^as ^most ^of ^you ^pointed ^out, ^my ^explanation ^to ^my ^question ^was ^off ^and ^did ^not ^make ^sense ^[ie: ^bits ^vs ^bytes]. ^I ^learned ^my ^lesson ^not ^to ^write ^past ^3 ^am ^without ^coffe ^:P Cheers! Edit: I really appreciate those two who linked the useful articles!"
62,vulnerability,learnprogramming,Is using UUIDs everywhere in a database design a good idea?,1,2t7xmz,http://www.reddit.com/r/learnprogramming/comments/2t7xmz/is_using_uuids_everywhere_in_a_database_design_a/,2015-01-22 09:18:58,"I was having a discussion with one of my coworkers about moving over to using UUIDs for referencing/relating models in our system instead of auto-increment IDs. I considered that some of the benefits of using this model would be: - Having UUIDs in-place for public routes which fetch records would prevent just being to increment a number to fetch all records (helpful in the event of an unseen vulnerability) - Makes transferring data between environments a lot easier since UUIDs are pretty much going to be unique. For example if a record is created in our local VM and it has a relationship with another record, there will be no auto-increment ID conflicts if the destination environment's sequence is not in-sync with our local auto-increment ID sequence Negatives: - Auto-increment becomes redundant and would only be used internally for identifying which records came first I suppose - Generating UUIDs is somewhat costly ([benchmark I found through Google](URL Are there any other significant negatives/positives to my auto-increment ID + UUID idea that I haven't considered (code-related, front-facing, DB performance, etc.)?"
63,vulnerability,learnprogramming,A way of obfuscating code. Does this make sense?,0,2tkkvf,http://www.reddit.com/r/learnprogramming/comments/2tkkvf/a_way_of_obfuscating_code_does_this_make_sense/,2015-01-25 12:28:30,"Working from a compiled binary, we chunck the data into packets. For each packet (we have to divide the code because otherwise this operation would take foreverrrr - time taken to obfuscate is the exponential to the length of the a packet.) FOr each packet, we fuzz or bruteforce RANDOM CODE until the packet content is generated by compiling the RANDOM CODE. Rinse, Repeat. Voila. EDIT:Shit. I guess a disassembler would just see the binary as being compiled from the original unobfuscated cod. darn! back to the drawing board EDIT: WAIT! got it. You use the original code, literally the sequence of characters in the source code, not the binary. You fuzz or bruteforce a RANDOM SEQUENCE of code that, when executed *results* in the original code, which is then executed on the fly. Vulnerability: could intercept un-obfuscated code in memory when it is ""extracted"" from the random sequence of code(appended with a call on the extracted code). We can do better..."
64,cybersecurity,learnprogramming,Python projects?,1,hnkupr,https://www.reddit.com/r/learnprogramming/comments/hnkupr/python_projects/,2020-07-09 03:03:37,"I am learning python and cybersecurity, any project ideas? It doesn't have to be related to cybersecurity, just something to sharpen my skills."
65,cybersecurity,learnprogramming,C/C++ or Python for cybersecurity?,1,ho409a,https://www.reddit.com/r/learnprogramming/comments/ho409a/cc_or_python_for_cybersecurity/,2020-07-10 00:26:47,Which is better to learn?
66,cybersecurity,learnprogramming,Intro to programming,1,hp001u,https://www.reddit.com/r/learnprogramming/comments/hp001u/intro_to_programming/,2020-07-11 09:52:15," I am 25, I have worked in networking and done studies in Cybersecurity. However, I have found myself attracted to programming. So far I have dabbled a small amount with python. I want to understand how to make programming a career. I want to know where to start that can help me get the skills I need that is not a scam or waste of my time. Any tips?"
67,cybersecurity,learnprogramming,Should I upgrade my computer?,1,hpg952,https://www.reddit.com/r/learnprogramming/comments/hpg952/should_i_upgrade_my_computer/,2020-07-12 05:40:30,"Hello everyone, I am a beginner in coding. Since quarantine I've taught myself HTML and am learning CSS and Python, planning to learn Javascript next. I originally got an Associate Degree in Art 4 years ago, now I'm enrolled to go back to a University for a BS in Computer Science for which classes will begin in September. I'm using a computer I got before realizing I ever wanted to do anything like this. What I'm wondering is, would it be worth it to upgrade for school/future development possibilities? **What I have now**: 2019 Macbook Pro 13 in. 8GB RAM **Specs:** * 1.4GHz quad-core 8th-generation Intel Core i5 processor * Turbo Boost up to 3.9GHz * Intel Iris Plus Graphics 645 * 8GB 2133MHz LPDDR3 memory * 256GB SSD storage * 13-inch Retina display with True Tone * Magic Keyboard * Touch Bar and Touch ID * Two Thunderbolt 3 ports **SHOULD I...** 1) Trade in my Macbook to upgrade to one with more memory/ssd storage? and possibly an i5 or i9 processor? **OR** 2) Use the same amount of money to get a second laptop that would be a PC? &amp;#x200B; Most general advice about laptops for software development/web design I find online basically says it largely depends on what exactly you're doing (cybersecurity, front end design, back end, what language, etc.) My issue is that I have no idea what I will end up doing right now. I am truly just beginning and right now I haven't decided my concentration for my BS yet but I am between Software Engineering, Web/App Design, Cybersecurity, or possibly even AI. I just don't know yet and I plan to figure that out after a semester or two of actually trying things out and learning more. I know that was a lot, does anyone have any advice? Would *greatly* appreciate it. Another note: Linux users, when I google it says you can run Linux on a Mac.... would anyone actually recommend that?"
68,cybersecurity,learnprogramming,Need Career Path Advice As a Final Year Computer Science Student,1,hqvln1,https://www.reddit.com/r/learnprogramming/comments/hqvln1/need_career_path_advice_as_a_final_year_computer/,2020-07-14 15:23:20,"Hi guys I am a student of computer science.I am in my final year.10 different people say 10 different thing go for web development,mobile development,data science or machine learning, cybersecurity .Some say web will be dead,people don't download new app, ai is the future blah blah... &amp;#x200B; Can some one give me advice on real life scenario??"
69,cybersecurity,learnprogramming,How can software engineering land you a job in cybersecurity?,2,hwabum,https://www.reddit.com/r/learnprogramming/comments/hwabum/how_can_software_engineering_land_you_a_job_in/,2020-07-23 15:53:31,"I know only a little c++, java and sql. I want to pen test in cybersecurity how can i?"
70,cybersecurity,learnprogramming,Should I take a C# class?,1,hxubec,https://www.reddit.com/r/learnprogramming/comments/hxubec/should_i_take_a_c_class/,2020-07-26 07:11:13,Im debating on whether or not if I should take a C# class in college. I have taken a Java class 2-3 years ago in high school. Im worried that I might fail the class. Since its been a while since Ive used java. My major is in Cybersecurity so I will have to take it eventually. What do you guys think? Should I take it now or later?
71,cybersecurity,learnprogramming,Do you have to go to college and or university and get a degree to work in the cybersecurity field?,1,hyh8n6,https://www.reddit.com/r/learnprogramming/comments/hyh8n6/do_you_have_to_go_to_college_and_or_university/,2020-07-27 09:32:50,"Im completely new to everything, but a job in the cybersecurity field is what attracts me, but Im just not sure how to get into it"
72,cybersecurity,learnprogramming,Secure Coding,1,hzn5nt,https://www.reddit.com/r/learnprogramming/comments/hzn5nt/secure_coding/,2020-07-29 07:10:38,"Hi fellow redditors, I would like to get help on this project that I'm working on. I'm trying to test the Python code snippets that control Zumi's self-driving AI program-control and find code vulnerabilities by generating insecure code scenarios. Most of their code modules are pretty straight forward and nothing much complicated. I just finished my freshman year in college and took Elementary programming in python. hence, I'm a cybersecurity major. I would appreciate it if anyone can create and manipulate a security vulnerability in the below code. Is there a way we can tweak the code and make the robot to malfunction. &amp;#x200B; Thank you so much in advance. \---------------------------------------------------------------------------------------------------------------------------------------------------- from zumi.zumi import Zumi import time zumi = Zumi() for i in range(1000): ir\_readings = zumi.get\_all\_IR\_data() front\_right\_ir = ir\_readings\[0\] front\_left\_ir = ir\_readings\[5\] back\_right\_ir = ir\_readings\[2\] back\_left\_ir = ir\_readings\[4\] &amp;#x200B; if front\_right\_ir &lt; 100 or front\_left\_ir &lt; 100: zumi.reverse(duration=0.5) elif back\_right\_ir &lt; 100 or back\_left\_ir &lt; 100: zumi.forward(duration=0.5)"
73,cybersecurity,learnprogramming,Beginners guide to hacking,1,i1u73p,https://www.reddit.com/r/learnprogramming/comments/i1u73p/beginners_guide_to_hacking/,2020-08-02 01:40:08,"For everyone who posted ""how do I learn hacking?"" or who just wants to apply programming to cybersecurity. URL"
74,cybersecurity,learnprogramming,"Looking for free computer language(JavaScripting,Python) and data language(SQL,DAX) classes recommendations",1,gwidd3,https://www.reddit.com/r/learnprogramming/comments/gwidd3/looking_for_free_computer/,2020-06-05 00:22:14,"Hi all, I am 21 year old recent college grad who currently works as a data crunching intern using Microsoft PowerBI for a Cybersecurity company in the financial district of NYC. I am pretty broke and am looking for some recommendations for free classes on JavaScripting, Python, DAX and SQL. My DAX skills are pretty intermediate. This is because of Power BI, and I would like to become a master. The other languages I have pretty much no experience in."
75,cybersecurity,learnprogramming,I want to attend a bootcamp but I am not sure wich way to choose. Automated Testing or Cybersecurity?,1,gxmfaa,https://www.reddit.com/r/learnprogramming/comments/gxmfaa/i_want_to_attend_a_bootcamp_but_i_am_not_sure/,2020-06-06 17:22:03,"Should I go for Software Test Automation or Cybersecurity? I have no degree, I am just beginner."
76,cybersecurity,learnprogramming,Looking for advice on searching an internship company,3,gznc6v,https://www.reddit.com/r/learnprogramming/comments/gznc6v/looking_for_advice_on_searching_an_internship/,2020-06-09 23:40:09,"Hey all. I am currently finishing my second year of my four year bachelors degree in Computer Science. Starting next year (beginning September) my internship fase starts for half a year. I am looking for advice on what to look for while searching for a good internship company and position. What was your experience as an intern, or what is your experience with interns in your company? Currently, my interests go out on webdevelopment, webdesign, UX and cybersecurity. Looking forward to your replies!"
77,cybersecurity,learnprogramming,How important is learning data structures and algorithms?,1,h781vb,https://www.reddit.com/r/learnprogramming/comments/h781vb/how_important_is_learning_data_structures_and/,2020-06-12 08:24:48,Hey so Im an IT/cybersecurity major but Ive always been interested in programming on the side. Ive been self teaching myself python for a while and Ive just been playing with all the different modules so I would say Im pretty familiar with most of the basic stuff. My friend who works as a developer said that I should learn data structures and algorithms for python. How important is it that I learn it?
78,cybersecurity,learnprogramming,Python projects for Cybersecurity?,6,h7aibr,https://www.reddit.com/r/learnprogramming/comments/h7aibr/python_projects_for_cybersecurity/,2020-06-12 10:43:45,What are some projects that relate to cybersecurity?
79,cybersecurity,learnprogramming,Studying cybersecurity... is programming better? (Also pro tips pls),0,he108u,https://www.reddit.com/r/learnprogramming/comments/he108u/studying_cybersecurity_is_programming_better_also/,2020-06-23 07:15:52,"Hello, I'm 21 years old and currently studying Cybersecurity at my community college. I finished my first semester and I found it to be quite boring but I think as it gets more advanced it's going to get more interesting. But I was also really good at Computer Science in high school and enjoyed it a lot. I got a 4 on the AP Computer Science exam. I know there are a lot of veterans here, so any tips regarding the trade in general or career wise would be greatly appreciated. Also are there any communities that I can join to improve myself and work on programs with others? &amp;#x200B; Thanks!"
80,cybersecurity,learnprogramming,Security,1,hf0z3o,https://www.reddit.com/r/learnprogramming/comments/hf0z3o/security/,2020-06-24 23:25:42,"Say you build a desktop app or a website or whatever not. How do you guys ensure the safety of what you built? Do you test it yourself or ask someone else? (From Cybersecurity) I wanna know, cause i'm learning HTML/ CSS and JS to start building websites but i'm not quite sure about the measures i have to take to make the websites secure. Would be thankful for any advice:)"
81,cybersecurity,learnprogramming,Discouraged because of saturation,1,hfhtvt,https://www.reddit.com/r/learnprogramming/comments/hfhtvt/discouraged_because_of_saturation/,2020-06-25 17:24:46,"When young, I used to enjoy programming and building sites with scripts and forums + add-ons. This made me study CS in uni. I didn't code much in uni as it was general CS. But now that I'm done, I want to fully dive into programming, but I feel discouraged. I don't have that flare anymore. When young, it was this new, rare thing, but now it seems like everyone is learning to code, and it feels less special. Everything just feels saturated. I've manage to pick the language I want from all the saturated languages and frameworks, but still. The entire field of web and app development seems like I'll be a droplet in an ocean. Cybersecurity and data science don't really call out to me like development. I'd only be interested in making my apps secure, and maybe developing security apps. It's pure development I'm interested in. I don't know maybe it's all in my head. Anyone else ever feel like the development field is too saturated?"
82,cybersecurity,learnprogramming,Best programming languages for cybersecurity?,1,hif0uo,https://www.reddit.com/r/learnprogramming/comments/hif0uo/best_programming_languages_for_cybersecurity/,2020-06-30 13:06:17,"Im in high school, looking to start in the cyber security field. I was told to learn programming because it is fundamental in cybersecurity. What language do I start to learn, and what are some beginner friendly projects with said language?"
83,cybersecurity,learnprogramming,Are Coursera courses worth the money?,1,hjoqdi,https://www.reddit.com/r/learnprogramming/comments/hjoqdi/are_coursera_courses_worth_the_money/,2020-07-02 12:35:04,"Hi, I'm looking at a career change and particularly looking at cybersecurity. I can't afford to go back to University, so I need to work out the best route into the industry. Is something like Udemy a good option, or are things like the credentials on Coursera better for this - like the IBM Cybersecurity Analyst course? I'm happy to pay for a course, just don't want to go out of my way to do this if it isn't widely used in the industry."
