,topic,subreddit,title,score,id,url,created,body
133,cybersecurity,learnprogramming,Need advice for a career change in my early 30s,1,etf23e,https://www.reddit.com/r/learnprogramming/comments/etf23e/need_advice_for_a_career_change_in_my_early_30s/,2020-01-25 06:15:08,"Hi all, Online marketing has been my job for the last 6+ years. I've worked for several multinational companies and I currently run a small team running AdWords, Bing Ads, FB campaigns, etc. I guess what I mean is that I'm not completely unfamiliar with coding as I work closely with developers, data scientists, PMs, etc. I was diagnosed with cancer a few months ago. Fortunately, I'm much better now and I've decided not do delay any longer what's been always one of my dreams: working remotely and perhaps while travelling. Finding a remote online marketing job would be the straight option but, looking tino remote work websites, I found only a few marketing posts. Freelancing is an option but I feel only small business would take a single individual to run their campaigns. Not sure how reliable that option would be. I taught myself enough R to create simple scripts to analyze large datasets, segment customers or do basic web scraping. I also did some Udacity HTML/CSS/JS courses on my spare time and build two embarrassing websites with Bootstrap. Enough to know that I enjoy problem solving and that the unforgiving logic of programing turns me on. I still need to be home for a while to regularly check myself so it is the perfect time to learn a coding language. Software engineering or Data Science (especially the last one I believe) could complement very well my current skill set and boost my career to the next level. I can see how statistics and machine learning could help me but also developing with javascript an app that connects to an API. Nevertheless, it seems 95% of remote work is software engineering, neither data science or marketing. I would appreciate any advice you could give me on the path you think I should follow. I can only speculate and search job posts to get an idea about my options but you really know your stuff and know the job market from the inside. In case that matters, I'm from the EU. Hoping this post gets noticed by somebody.. PS: I have also fantasized about a career in CyberSecurity (love NITE Team 4) but that's probably unrealistic, especially for remote work. Just dropping it off in case you know something I don't."
134,cybersecurity,learnprogramming,what language if I'm interested in it-/cybersecurity?,1,eumqon,https://www.reddit.com/r/learnprogramming/comments/eumqon/what_language_if_im_interested_in_itcybersecurity/,2020-01-27 22:29:37,"Hello everyone, out of boredom I started programming recently after and not gonna lie, it's really really fun and I wish I would've started earlier (I'm 25 atm) . I started with html/javascript basics on freecodecamp to get into it and I'm very eager to keep getting better day by day. so my question is pretty much in the title. So far it's only a hobby but the field I'm most interested in right now is it-/cybersecurity and I'm curious if any of you has an advice on which language I should start getting deep(er) into or if there is an online course/videos you would suggest. &amp;#x200B; thanks in advance :-)"
135,cybersecurity,learnprogramming,Should I work towards CyberSecurity or ML?,1,e9vwkl,https://www.reddit.com/r/learnprogramming/comments/e9vwkl/should_i_work_towards_cybersecurity_or_ml/,2019-12-13 10:58:59," Currently I am thirteen years old in 8th grade. I am really interested in tech and programming and I just recently got into it maybe 2 months ago. Since Im so young I have lots of time and that means I can start early and be more successful in the future. Im really interested in hacking/ cyber security but then also I find ML really cool. What should be a better field for the future as in enjoyment, growth, salary, just the general stuff?"
136,cybersecurity,learnprogramming,Where do I learn to code things that are not web development?,1,efvq37,https://www.reddit.com/r/learnprogramming/comments/efvq37/where_do_i_learn_to_code_things_that_are_not_web/,2019-12-27 01:00:51,"There are plenty of resources that teach to code to be a web/app developer. I feel there are not much resources for other interesting things like Software Development/Engineering, Cyber Security, SRE, Systems Programming, etc. Please add any resources that you feel are good and doesn't teach just web/app development. Hope this post helps those who are having difficulty to find resources for other cool things that can be done by learning to code. Here are a few that I could think of : [nand2tetris](URL [Learn OpenGL](URL [Cybersecurity Specialization](URL"
137,cybersecurity,learnprogramming,Anyone Know Where I Can Run A High Computation Program?,1,duyfie,https://www.reddit.com/r/learnprogramming/comments/duyfie/anyone_know_where_i_can_run_a_high_computation/,2019-11-12 07:29:39,"Basically, need somewhere to run a multi-process program for password brute forcing (Homework assignment for cybersecurity class, 26\^5 possibilities). I tried using my computer but my cooling and processing power isn't sufficient."
138,cybersecurity,learnprogramming,Jobs with a huge gap,1,dvib6d,https://www.reddit.com/r/learnprogramming/comments/dvib6d/jobs_with_a_huge_gap/,2019-11-13 10:10:16,"Hello, I pretens to begin a career, ihave seen some post of web developers looking for a job but i do not know if in the future there will be so many people doind that because of the quantity of people studying it right now. So, i want to know what is your view about my statement?, secondly, Which jobs will have a huge gap in talent in the future?, so i have seen an article that states : # Cybersecurity job gap grows to 3 million, report Do you know about any else job that will require a lot of learners in the future?"
139,cybersecurity,learnprogramming,Question about Java's syntax.,1,dyp0q9,https://www.reddit.com/r/learnprogramming/comments/dyp0q9/question_about_javas_syntax/,2019-11-20 06:08:47,"Hi. I'm learning Java as a part of one cybersecurity course and I have trouble understanding the following code: import java.util.List; import java.util.ArrayList; import org.springframework.stereotype.Controller; import org.springframework.ui.Model; import org.springframework.web.bind.annotation.RequestMapping; import org.springframework.web.bind.annotation.RequestParam; @Controller public class ListController { private List&lt;String&gt; data; public ListController() { this.data = new ArrayList&lt;&gt;(); this.data.add(""Hello world!""); } @RequestMapping(value = ""/"") public String home(Model model, @RequestParam(required = false) String content) { if(content != null &amp;&amp; !content.trim().isEmpty()) { this.data.add(content); } model.addAttribute(""list"", data); return ""index""; } } Namely, why is there a method of the name ListController inside a class called ListController? Is this some special use? And when starting a server at localhost with springframework, why does the site not show any data unless there's a method with the same name as the class ListController? Is the method in question called once when the server starts?"
140,cybersecurity,learnprogramming,Learning Cybersecurity with Humble Book Bundle: Cybersecurity,1,dzhh4z,https://www.reddit.com/r/learnprogramming/comments/dzhh4z/learning_cybersecurity_with_humble_book_bundle/,2019-11-21 21:37:42,"Hi, Im a bachelor student of software engineering and I am interested in Cybersecurity. I would like to ask whether the humble bundle is a good start to understand the field? If yes then which books/videos do you highly recommend and in what order should i read/watch them. If no then what are some good online courses on Cybersecurity. I am primarily looking for a guided course."
141,cybersecurity,learnprogramming,Is bachelor in AI a good idea?,1,dzo9r1,https://www.reddit.com/r/learnprogramming/comments/dzo9r1/is_bachelor_in_ai_a_good_idea/,2019-11-22 06:16:49," # Is bachelor in AI a good idea?  I'm in my last year of school and I will study in France . But the thing is that i don't want to do the french system , I want to do the american system. So, I wanted to ask if BSc in AI (3 years) is a good idea . I will continue my studies in the US (masters in cybersecurity or AI or data science) The nice thing about it is that i can obtain two degrees (one is AI business and management and another in AI technology) then i have the chance on the third year t transfer for one semester in the US . The courses taken in **AI business and management** : &gt;!Management and law :!&lt; Economy Corporate Law Market Finance Corporate Structure Accounting Level 1 &amp; 2 Project Professional Project Management: Theory and Practice &gt;!Marketing!&lt; Computer Tools for Project Management New Information Technologies Project Management Digital Marketing Customer Relationship English Story Telling &gt;!AI acculturation!&lt; History of the AI Database Management System Introduction to Information Systems Case Studies Digital Start-ups Human Sciences: The Exploration Engineer Integrated Language skills Project IA **In AI technology :** &gt;!Applied mathematics!&lt; Probabilities Level 1 &amp; 2 Statistics Level 1 &amp; 2 Algorithmic &amp; Data Structure Numerical Analysis Linear Algebra Algorithmic Workshop &amp; Problem Solving &gt;!Programming :!&lt; Operating systems SQL Database Computers and Programming Introduction to Programming and Algorithms centralized and distributed architectures Programming in C Programming in R Data Structure &amp; Data Management Data Based Management system Introduction to Machine Learning Python Level 1 Data Science &amp; Social Networks What i can be after the bachelor : Director of Innovation Data Scientist &amp; IA Developer Financial analyst specializing in AI IA contractor AI Recruitment Officer IA Consultant IA Marketing Manager CRM Manager Chatbot Project Manager Business Developer Product Owner Cyber Security Consultant What do you guys think ?"
142,cybersecurity,learnprogramming,"Career Change Happening, need a goal based plan",1,e2gehr,https://www.reddit.com/r/learnprogramming/comments/e2gehr/career_change_happening_need_a_goal_based_plan/,2019-11-28 01:01:48,"So I am changing careers from credit union compliance world to programming. I'm not happy at work and need a change. My wife and I discussed a six month or so plan where I quit my job and study programming full time at home or via boot camp with the goal of applying for jobs at the end of six months. Instead of just stumbling in, I want to list my goals and hopefully get some advice from you all regarding the best path: 1.) Primary goal is to get a job in the timeframe listed, whether that is web dev or leveraging my compliance management skills to land some kind of analyst hybrid tech position I will need to get a job 2.) As of now, I don't particularly want to do web development long term nor am I interested in heavy data science or iOS. 3.) I have a bachelor's and master's degree, both in history, not a goal but it might affect your suggestions 4.) My long term goals currently are to end up in cybersecurity or in the video game industry (but I'm really not interested in developing my own indie game in Unity) 5.) My job market for the next several years is Ohio particularly Cleveland or Columbus due to family and friends(my mom is also from around here and doesn't have many years left so we want to be somewhat close) 6.) I learn better in a structured environment which could be a coding school, books, a well crafted Udemy series, etc. So please Reddit programming friends give me your advice. What is a good game plan and some of your favorite resources to help me achieve my goals. Thank you!"
143,cybersecurity,learnprogramming,"Is there a decent course to learn C, for someone already is knowledgeable on programming?",1,e53mk3,https://www.reddit.com/r/learnprogramming/comments/e53mk3/is_there_a_decent_course_to_learn_c_for_someone/,2019-12-03 05:59:12,"I am a CS student who already knows somethings about programming. I want to advance in the cybersecurity field, starting with system and application security. In order to achieve that, I should have a strong understanding of C. Most of the online courses are for beginners. Yes, there are some advanced courses but they mostly teach very advanced and very less encountered things that also have little to do with my field. (Or probably I couldn't research well) Do you know a place where I can learn about C, without starting from the very beginning?"
144,cybersecurity,learnprogramming,Bachelor project. Need help choosing a topic,1,e5f79q,https://www.reddit.com/r/learnprogramming/comments/e5f79q/bachelor_project_need_help_choosing_a_topic/,2019-12-03 21:21:49,"Hey y'all. I need your help figuring out my bachelor project. As a student of computer science, I am allowed to choose between writing a thesis or programming something. I definitely want to program something. No doubt there. Yet, I don't know what to do. My current interests in the world of Dev are the following: Devops, Data science/analytics, cybersecurity. I would like to create something, that doesn't necessarily have to be used in the real world, but with which I could use to apply (increase my chances of being accepted) and put on my cv/portfolio. So far I've had these ideas: Create an AI that has an answer to everyday legal questions and other areas like brand,... I'd really appreciate any input, thanks in advance."
145,cybersecurity,learnprogramming,A fun way to develop programming skills?,1,dkvygs,https://www.reddit.com/r/learnprogramming/comments/dkvygs/a_fun_way_to_develop_programming_skills/,2019-10-21 16:44:09,"Hello there! So just a little background info: I am a cybersecurity student and have knowledge coding in C++, C#, Java, JS and Python. I'd say my skills are at a medium level, I can write fairly decent code but not full fledged complex programs and applications. In cybersecurity we have CTFs which help us learn in a interesting manner that requires us to do research and gain skill and knowledge that apply to practical scenarios fast. Is there anything similar for coding? My main purpose is to learn how full on applications work to improve my pentest skills but I also think this would be helpful for those who just want a exciting way of learning and progressing their skills."
146,cybersecurity,learnprogramming,Best subdivision of computer science for someone with MA in Political Science?,6,dl8pgh,https://www.reddit.com/r/learnprogramming/comments/dl8pgh/best_subdivision_of_computer_science_for_someone/,2019-10-22 10:12:36,"Hi! I'm taking my BA in Political Science and plan to proceed to get an MA. But I've always been interested in computers, i built computers for friends and generally love technology. In fact I think I might have picked the wrong education. But I'm too old to switch, so I hope to be able to combine my education with something in IT. I have completed the Harvard CS50 course as well as Microsoft course on edx on ""R"" (which was pretty basic). I'm considering taking some courses on udacity, but I'm not sure what ""field"" I should get into. I imagine that cybersecurity is something that would combine well with my political science education (a dream job would be in national cyber security). Do you think I should proceed with learning various programming languages, or should I focus specifically on a certain field, such as cyber security, machine learning or data science? Thank you very much"
147,cybersecurity,learnprogramming,Cybersecurityoriented programming projects?,1,dpgpwz,https://www.reddit.com/r/learnprogramming/comments/dpgpwz/cybersecurityoriented_programming_projects/,2019-10-31 12:48:27,I.e. gobuster please list programming projects relating to cybersecurity
148,cybersecurity,learnprogramming,How do I approach programming as a high school student?,5,dr8q0z,https://www.reddit.com/r/learnprogramming/comments/dr8q0z/how_do_i_approach_programming_as_a_high_school/,2019-11-04 10:30:43,"Hey, there Reddit! So, here's the deal: I am in year 12 of high school and in my country, all 12-year students have the afternoon without classes(classes until 12h or 13h30). I encountered myself with a lot of free time and I've been doing some basic Web Development and I don't know what to do next. As I will continue to have a lot of free time I want to make a plan about what to do/learn in the following months/year. I finished the Responsive Web Design section of FreeCodeCamp but as I'm going to pursue a bachelor degree in Software Engineering, I don't know if it's better to start one of those Open Source Online Computer Science Degrees (like [URL or [URL ) because it's more related to what I'm going to study (but it's also more theoretical and I might forget all of that) or I continue with Web Development ( using FreeCodeCamp and some Udemy courses) or maybe start something related to CyberSecurity(don't know any resources yet). What do you think? Thanks!"
149,cybersecurity,learnprogramming,Almost finished Colt Steele's Web Development Bootcamp - What next?,15,d1ntg0,https://www.reddit.com/r/learnprogramming/comments/d1ntg0/almost_finished_colt_steeles_web_development/,2019-09-09 17:49:43,"Hi everyone, So I decided to finally pick up Web Development a couple of weeks ago. I decided for Colt Steele's Web Development Bootcamp. I absolutely love the course so far. I even completely stopped gaming, instead, I sit and code every night. That never happened with anything else I picked up. It's probably a good idea to tell you where I would like to go. I come from a Cybersecurity background and I am already kind of half self-employed. I picked up Web Development mainly because I want to do something more creative and secondly because I want to ultimately be completely independent of my office job. That means, I definitely want to exclusively freelance or do remote work with minimum office time. Long story short, I am almost finished with Colt's course and so far, I am pretty solid with building basic websites. I already know most of the serverside stuff from my profession, so that was an easy chapter for me. I know one of the advice will be ""build something"", which I am constantly doing. Unfortunately, Colt's course, even it's great, it's a bit dated. So I don't want to waste too much time building stuff using those technologies. I have a friend who is a developer and who helps me out with learning stuff and because of him, I am gravitating towards React + Redux as a next step. I bought Colt's React course, but he does not cover Redux, my friend said Redux would be very important. My problem is, because Colt's course only covers the bare basics of JS, I suck at JS. I started the Reddit Daily Programming Challenges (easy) up until day 12, and I honestly struggled with every one of the challenges. My buddy who takes the same course has the exact same problem. They are way too hard, even the easy ones. I know of Wes Bos JavaScript 30 and I started the first project, but I stopped because I was overwhelmed of so much stuff I haven't seen before so I thought it's a bit too much as well. (There is no ES6 in Colt's Course). So at the moment, I feel a bit lost. Without direction. I feel like I need to solidify my JavaScript before moving on to something like React, but I don't really know what's the best way to do that. Let me summarize my burning questions: * What are some easier practice resources than Reddit Daily Programming Challenges? * What should I do when I finished the course? * What is the best React + Redux course? Quite long post but I do have a lot of questions and don't want to create multiple posts. I am happy to answer any further details. Thanks a lot!"
150,cybersecurity,learnprogramming,CyberSecurity Student,2,d5bfr2,https://www.reddit.com/r/learnprogramming/comments/d5bfr2/cybersecurity_student/,2019-09-17 13:33:33,What would the best way to learn Python/Bash/Scripting etc? I'm currently a Cyber Security student at a specialized tech high school and I'm looking for tips and the best way to learn it. I'm pretty comfortable with Linux and Windows OS. Hoping to learn the basics of those things before I start my internship in the spring. Thanks!
151,cybersecurity,learnprogramming,"I am learning Web Development and created a blog to help me deepen my understanding of certain topics, how am I doing?",0,d84xmt,https://www.reddit.com/r/learnprogramming/comments/d84xmt/i_am_learning_web_development_and_created_a_blog/,2019-09-23 21:00:48,"Hi guys, I just would love to get some feedback on that. I learn Web Development and JavaScript with it. I do everything in self-study so I created a blog where I try to write tutorials/articles about topics that I learn to better understand them myself. This method has helped me in the past with other things (Cybersecurity for example), but as I am a complete beginner, I would like to hear if my way of explaining things makes sense / is valuable for someone else. My blog can be found [**here**](URL I would take my [latest article](URL on the JavaScript find method as an example. Would be really awesome to get some feedback! (There are no ads whatsoever on the website, so I hope it doesn't go against any sub-rules). Thanks!!"
152,cybersecurity,learnprogramming,"Not even in a programming course yet, already feel stupid and discouraged.",0,d9begb,https://www.reddit.com/r/learnprogramming/comments/d9begb/not_even_in_a_programming_course_yet_already_feel/,2019-09-26 09:35:32,"I can do so many things that 99 percent of people can't do. I have the discipline and dedication to lift consistently and practice my instrument. But I can't wrap my head around Trigonometry. I'm not talking about basic ass right triangle trig with 45-45-90 and 30-60-90 triangles, or even the unit circle. I'm talking about fundamentally useless shit like graphing trig functions with phase shift, graphing inverted trig functions, etc. I have gone to office hours and studied with others, and I am ready to just throw in the towel. I feel like my CS career is dead before it even got to start. I took APCS in high school and loved it, but I feel like the barrier for me is going to be my (in)ability to do trig and eventually calculus. I just don't know whether I should just accept it now and throw in the towel while it's early enough for me to do so, or if I should really continue to torture myself and waste time on bullshit concepts that are honestly not applicable to a CompSci or Cybersecurity degree. Was anyone in the same boat? Can anyone offer guidance?"
153,cybersecurity,learnprogramming,Beginner Project Ideas,1,d9yeg4,https://www.reddit.com/r/learnprogramming/comments/d9yeg4/beginner_project_ideas/,2019-09-27 20:24:09,"Hello friends, So I am starting out my BS Cybersecurity/programming degree with Principles of programming with C++. This is how my professor is teaching the subject. Along with homework and textbook practice. I am trying to come up with basic idea's to use what I am learning and write little programs on my own. To essentially learn by doing method. Yet, having trouble coming up with ideas. Any Suggestions/Advice?"
154,cybersecurity,learnprogramming,In which field should I do masters,0,ddeqee,https://www.reddit.com/r/learnprogramming/comments/ddeqee/in_which_field_should_i_do_masters/,2019-10-05 08:36:59,"Hi guys! I am a final year CS student, working as a part time developer in a startup. I want to apply for masters in Canada but I am confused which university and field should I go for. I have been working as a JavaScript developer I will be graduated in Aug 2020, I have to make my mind before that, which field should I go for I personally think CyberSecurity from UOIT but I have no experience related to cyber security. Please let me know what should I do and recommend me good fields and universities in CANADA for masters program Thanks a lot!"
155,cybersecurity,learnprogramming,How do I get started with cybersecurity or ethical hacking?,4,crr5v1,https://www.reddit.com/r/learnprogramming/comments/crr5v1/how_do_i_get_started_with_cybersecurity_or/,2019-08-18 06:03:17,"Hello everyone, I am a high school student interested in programming. More specifically, I want to apply it into cybersecurity or ethical hacking. I know python and I saw some tutorials on YouTube on how to use python for ethical hacking, but I find the content no use. How do I get started? Are there resources you would recommend?"
