,topic,subreddit,title,score,id,url,created,body
203,cybersecurity,learnprogramming,Learn Python or Java?,1,935zc1,https://www.reddit.com/r/learnprogramming/comments/935zc1/learn_python_or_java/,2018-07-31 03:16:35,"I've been studying Java for the past month or so, and I really like its syntax and logic. However, I'm required to take a foundations of java course during the next school year, so I feel as if I've been wasting my time. I've heard that Python is more useful in things such as CTFs (cybersecurity) and robotics, which is ultimately what I want to program, however, I still feel very uncomfortable with the Python syntax, and I would feel guilty switching from Java after all of the time I have put into it. This makes me want to just continue learning Java (at least until I am fluent), even though I can't see any of its applications having any use to me. Thoughts?"
204,cybersecurity,learnprogramming,I want to learn cyber security but have absolutely no coding or programming knowledge. Where can I start?,652,94l9h4,https://www.reddit.com/r/learnprogramming/comments/94l9h4/i_want_to_learn_cyber_security_but_have/,2018-08-05 04:25:42,"Thinking about different careers and cybersecurity interests me. I know I have a long way to learn, but everyone starts somewhere right? If you guys can, please help me out. Thank you."
205,cybersecurity,learnprogramming,Is there an easy platform to contribute to the open source?,25,8r0p20,https://www.reddit.com/r/learnprogramming/comments/8r0p20/is_there_an_easy_platform_to_contribute_to_the/,2018-06-14 20:13:11,"As a fresh grad it seems impossible. There seems to be nothing someone like me can do in most open source projects that come to mind (linux, mozilla etc) and for niche projects it seems to be a huge learning curve (like cybersecurity or low level APIs, I obviously need years of experience) I just need something user friendly just want to get started. Do *something*."
206,cybersecurity,learnprogramming,New Programmer Interested in Cybersecurity,4,8tklr8,https://www.reddit.com/r/learnprogramming/comments/8tklr8/new_programmer_interested_in_cybersecurity/,2018-06-25 06:24:36,"Hello all, I am new(ish) to programming and I am hard geared toward cybersecurity. Due to this, I would like to test exploits but would prefer to not do this on my own system. This includes development of things such as viruses. I am wondering if these would be best to test in a virtual environment or how can I best test these items without absolutely destroying my own system? Thanks for any info!"
207,cybersecurity,learnprogramming,How to stay focussed on one thing and need advice for what field should i focus on(haven't found my interest yet)?,1,8vd1xy,https://www.reddit.com/r/learnprogramming/comments/8vd1xy/how_to_stay_focussed_on_one_thing_and_need_advice/,2018-07-02 07:03:00,"Hello everyone, Short Background: I am a grad school student(will start 2nd year in 4 year CS course) and a beginner. From a few months i am trying to learn programming but the problem i am facing is that i am not focussed enough. For ex: after learning basics of C and python i practiced some coding questions but after 1-2 month i thought my interest is web so i learned HTML, CSS ,Bootstrap(for CSS), JS(little bit). Then i thought i should have some design experience so i learned Photoshop(basic tools,layers,layer masks,color correction-no advanced stuff), after that i decided to continue webDev so i decided to learn some modern framework so tried ReactJS for 2-3 weeks but then i realised my JS fundamentals are week so i learned it for few weeks. But then i realised that i can learn webDev in future but now i must focus more on CS fundamentals.I also tried Unity3d and made beginner projects like a clock,Roll a ball. Also from the very start i aspire to be good at competitive programming but was just too afraid of it. Also i was fascinated by all news about AI,ML etc, so in vacations i learned basic machine learning and pandas, numpy, matplotlib, seaborn but it started to feel too difficult, also i was just using libraries but i have no maths or algo knowledge(and learning it meant less time for fundamentals) so i dropped it. I also tried contributing to some open source github repo, but only did few beginner-friendly task and everything else seemed too tough(was working with python but haven't learnt OOP yet). Then spent 1 month learning flask framework and dropped it. Also tried learning cybersecurity for CTFs but dropped it too. In ""trying"" to learn all this for most of the things i was using a follow-along approach from books or videos. I was just jumping from one thing to another( Can anyone relate to this?) whenever i felt something too tough or i felt that grass is greener on the other side. This led to me forgetting many things as i was not regular with anything. Most of my peers focussed on 1 thing for this year, now many people are either good coders or developers or designers or hackers etc. I feel i am interested in everything or i have no passion for any particular field. Now i have only 3 years of education left and i am seriously concerned about being good at atleast something. I am not interested in doing masters(don't have motivation and don't want to take edu. loans and be in debt). Want to get a decent job after bachelors. I am definitely going to focus on making my fundamentals (DS and Algo) strong but other than that what should i focus on or should i just do fundamentals? How can i not get influenced by news articles or peers and stop making frequent changes to my study plans/career goals? Note- I am new to reddit i don't know if it is right place to ask this or what i am asking makes any sense or not. Not a native english speaker,so please ignore mistakes if any."
208,cybersecurity,learnprogramming,"I want to a get a degree in cybersecurity, but have no experience in that sort of thing.",26,85i96h,https://www.reddit.com/r/learnprogramming/comments/85i96h/i_want_to_a_get_a_degree_in_cybersecurity_but/,2018-03-19 20:44:13,"Are there any programming languages I need to know or at least get some basic knowledge of? I'm in AP Computer Science (it's a bit harder than I thought but I'm enjoying the class) and we're learning Java right now, but I'm not sure how much that will help. Maybe someone can recommend some desktop applications or mobile apps that give me some practice or teach me a little bit. If I'm gonna do this I don't want to go in completely blind; figured since I start college in fall, getting some kind of knowledge would help."
209,cybersecurity,learnprogramming,Systems Programming Theory:,2,7zcm77,https://www.reddit.com/r/learnprogramming/comments/7zcm77/systems_programming_theory/,2018-02-22 16:52:59,"I am an applications programming student, and I think the courses are a bit bland. For one, it doesn't help that my teacher uses the most vague terminology. For example: I feel like my teacher just doesn't know what he is talking about: * He conflated global variables and static variables in Java. Global variables don't exist in Java. * He claimed the public access modifier makes variables ""available to anyone in the world"". That was a conflation of cybersecurity and access modifiers. My point is, after hearing hours of lectures from this guy, my passion for application programming never was *that* huge, I can confidently say I don't want to build application software. In fact, I want to learn *how* the computer works, and I think systems programming would be a great start. Do you know of any good lectures on YT? The search returned vague results, and a Google search for a PDF of Systems Programming was also a mixed bag; I wouldn't know where to start. Any help is appreciated. "
210,cybersecurity,learnprogramming,Need help deciding which Masters I should go for,0,83mwjm,https://www.reddit.com/r/learnprogramming/comments/83mwjm/need_help_deciding_which_masters_i_should_go_for/,2018-03-12 01:10:19,I have a B.S. in Computer Science and because my employer is going to pay for it I would like to acquire my Masters next. These are my 4 options: - Data Science - Cybersecurity - Information Management - Enterprise Data Systems I know personal preference is a factor to consider but I went through the curriculum for each one and they all seem interesting to me. My question then is which is most valuable and will help me most in my career? 
211,cybersecurity,learnprogramming,Want to get into CYBERSECURITY where do I start?,1,7qkwk2,https://www.reddit.com/r/learnprogramming/comments/7qkwk2/want_to_get_into_cybersecurity_where_do_i_start/,2018-01-16 03:49:01,"Im new to cybersecurity i have Parrot OS installed, tried various courses and have some basic knowledge. I watched various videos on youtube tried some softwares like nmap, metasploit..etc But still in the end im confused i saw various sites like OWASP,Sans... but still something feels unfilled. I felt talking to a real person in the field and knowing how he/she started might help me. Any thing you want me to know please feel free to share. Thanks in advance."
212,cybersecurity,learnprogramming,A new addition to after school clubs,3,7rn4gc,https://www.reddit.com/r/learnprogramming/comments/7rn4gc/a_new_addition_to_after_school_clubs/,2018-01-20 12:11:06,Came upon [this](URL news story. Chess club wasnt nerdy enough anymore. They had to up their game to Cyber-Security Clubs! ;) 
213,cybersecurity,learnprogramming,"Cybersecurity: Stay in school, or another route?",1,7w5kj2,https://www.reddit.com/r/learnprogramming/comments/7w5kj2/cybersecurity_stay_in_school_or_another_route/,2018-02-09 02:31:52,"Hey guys, I'm currently a Computer Science student majoring in CySec. I'm currently in a 4 year program and am in my second semester of my freshman year. However, lately I have been thinking if college/university is the best way of going about it. I'm barely even learning any new programming skills (have background of HTML/CSS/Java/JS/C#) in a semesters time. We are currently studying C++, and my class is once a week. It feels like I am wasting my time and accruing debt for no good reason. The other option I am thinking of is withdrawing from university, living at home, and getting the necessary certifications needed to enter the work force. That's probably at minimum $200k salary in the next three years I would be at school, plus the $50k I would be saving in loans. The only upside I can see right now are the networking opportunities down the line. I live in NJ, close to NYC, and the teachers and staff in my department are very well connected in the area. This could help me land good internship opportunities and work my way up to a higher premium job out of college, I'm not sure what the path is for me yet, but for anyone in the field, what did you do and/or how would you go about it doing it today? "
214,cybersecurity,learnprogramming,Looking for a book that would help me with CS...,0,7linqq,https://www.reddit.com/r/learnprogramming/comments/7linqq/looking_for_a_book_that_would_help_me_with_cs/,2017-12-23 03:58:11,"I'm looking for a book that can give me a more comprehensive background in Computers, covering the basics of a broader range of topics. This could include networking, computer hardware, cybersecurity, and general software development. If theres anything like this I'd love to read it."
215,cybersecurity,learnprogramming,Entry level certifications,45,7pbnxq,https://www.reddit.com/r/learnprogramming/comments/7pbnxq/entry_level_certifications/,2018-01-10 11:24:10,Hello all! I am looking to transfer into the tech world. Are there any entry level certifications that I can study for? I am in school for Cybersecurity. 
216,cybersecurity,learnprogramming,Python Plus What Equals Data Science?,0,7dcw1a,https://www.reddit.com/r/learnprogramming/comments/7dcw1a/python_plus_what_equals_data_science/,2017-11-17 01:56:21,"TLDR: Python 3 rookie working hard to escape retail sales to find first job in data science. ... Hows it going, Reddit? Heres a short story. I graduated SHS in 2009. I took my time off to develop skills in the restaurant, sales, and marketing industries before sprinting back to school. I graduated NSCC this year with a Liberal Arts Associates, which included taking a Stats 101 course. Heres a longer story. I realized tech was my direction. I like working with teams, but also working remotely in cafes, because I care about my mental, physical, and spiritual health. Working in an industry such as data science would allow me to work on meaningful projects, afford housing and further education, and would allow me to exercise, sleep in, or whatever else Id need to do to stay on my A-game. After working as a resum collector at a job fair focused on cybersecurity, computer engineering and the like, I was granted some time to network. I learned from a recruiter that with 2 internships and a Bachelors in Comp Sci, I should be able to land a job making $60k a year, easily. This makes sense, because I live in Boston, but theres just one problem: I live in an apartment and work full-time! I dont have the money to afford a graduate degree! Anyways, after graduating in May, I started putting the pieces together. I went to General Assembly and took an intro to data science workshop. I acquired their resources and syllabus for the full-time, ten-week, $16k course on data science.I listened to two podcasts: Becoming a Data Scientist, and CodeNewbie, as I drove across three states for work (vendor selling, training, and merchandising computers). I bought LPTHW, and picked up many but not all the basics of 2. I went on Codecademy, took Python 101 and 201 workshops at GA(ga.co), and earned a certificate on edX.org(Intro to Python for Data Science). After taking the Data Camp/edX course, I realized I should only be learning P3. So I bought the Learn Python 3 The Hard Way book, which comes with videos, and am about to get approved PTO for today, which Im stoked about because all I want to do is learn until I can get a job that lets me feel happy. With my dual-monitor setup, Im printing scripts after I write them, analyzing them after running them, on paper, just to make sure I understand whats going on in each line. My goal is to redesign my daily caloric intake calculator to P3, so I can use numpy and convert lists to arrays, and eventually create diet plans/meal planning/recipes through script, more for using skills Ive learned in my own way than for any type of business idea. Ill post it on GitHub once Im through. Then, when Ive finished this book, Ill go through it once last time and break all the code Ive written, so I can learn more about bugs, Errors, and debugging scripts. This week I find out if Im funded $5k for a data science certificate, but this is dragging on so let me Boolean my point back to the title: certificate = 0 python_learned = in process python_learned = 0 If certificate == True: print(pass, and find job) else: print(apply for FAFSA, go to SSU for 3.5 years) If python_learned == True: print(learn SQL, other skills to land 1st tech job) else: print(ask Reddit what skills land entry level job) ... Any advice is greatly appreciated. Ive heard that startups are a great way to get your toes wet, but Im not sure what types of skills Ill need at first. Ive almost considered going in a direction I didnt have in mind, which would be learning about how Python leads to building websites, but my concern is that if I learn enough python to appropriately transition to learning something like SQL on my own, I might forget how to do some of the things I am learning, if it takes months or even more than a year to land my first tech job. Thats also why Im hesitant to learn JavaScript. Its almost common sense that I stick with one language, until Im either in a workplace that requires I learn it, am in school and theyre teaching it, or Im finally in a career that allows me to do the things I want to do, which would likely include learning a new language, since falling behind in tech is really easy nowadays. Reddit, what are your thoughts? Other than my soon-acquired Python and past-acquired Stats 101 skills and education, what other hats must I wear before I have a plausible chance of landing my first entry level tech job? Thanks "
217,cybersecurity,learnprogramming,Starting at cyber security,4,7hl8bh,https://www.reddit.com/r/learnprogramming/comments/7hl8bh/starting_at_cyber_security/,2017-12-05 10:00:41,"At the moment Im a little bit young and with no budget to take university or anything like that, but almost all my life i always wanted to learn how to break through stuff in order to know if it could be broke or if it could get stronger. I really want to start now getting knowledge and learn stuff about cybersecurity,programming and in special pentesting. There is so many information on the imternet that i get confused where to start... I would be glad if someone with experience in cybersecurity could give some advise! Sorry for bad grammar, english isnt my main language."
218,cybersecurity,learnprogramming,Subreddits,0,7hm2j8,https://www.reddit.com/r/learnprogramming/comments/7hm2j8/subreddits/,2017-12-05 12:07:38,"Im new to reddit and i would like to know if someone has a list of good subreddits about programming, linux, cybersecurity, etc. From beginner to pro."
219,cybersecurity,learnprogramming,What do I do,0,73cusi,https://www.reddit.com/r/learnprogramming/comments/73cusi/what_do_i_do/,2017-09-30 13:50:24,"Hey guys. So I'm a senior and a double major in computer science and cybersecurity. Cybersecurity more of policy than technical stuff. So I interned at one of the big 4 accounting firms this past summer for cybersecurity consulting, and now I applied and about to go through the interview process to get hired when I graduate in May. Hopefully I get it. I feel like ever since I switched my focus to cybersecurity, I kinda lost my pace in learning coding. I love it, I really do. But I feel so stuck because I'm so busy trying to finish all my courses to graduate that I don't have the motivation to learn more programming on my own. I especially forgot a lot of the theoretical stuff, the fundamentals and principles of programming. What do I do to fix this? TLDR: Lost motivation and time to learning programming as a result of switching focuses to cybersecurity. How do I get it back?"
220,cybersecurity,learnprogramming,Is trade school good for programming?,1,769x6f,https://www.reddit.com/r/learnprogramming/comments/769x6f/is_trade_school_good_for_programming/,2017-10-14 14:52:08,"I am a senior in high school and I'd like to have my own cybersecurity business. While my GPA is very high and my ACT scores are also good, I don't want to go to college if I don't need to. Do technical colleges offer good IT classes? The school I'm looking into is only 2.5 thousand dollars per year and it has a cybersecurity curriculum. Would it be a good idea to go to school here, get an associates, grab a job while I work on my own business, then eventually quit my job and only work for myself?"
221,cybersecurity,learnprogramming,What are your thoughts on the Harvard Extension School for Cybersecurity certificate? Is it worth the investment?,2,6w2ngu,https://www.reddit.com/r/learnprogramming/comments/6w2ngu/what_are_your_thoughts_on_the_harvard_extension/,2017-08-26 10:54:24,I am interested in applying but I want to know for sure if it is worth the investment.
222,cybersecurity,learnprogramming,What are some activities that I can do for my high school computer science club?,252,6zftmb,https://www.reddit.com/r/learnprogramming/comments/6zftmb/what_are_some_activities_that_i_can_do_for_my/,2017-09-12 00:45:08,"A lot of the kids want to do things like ai, cybersecurity, and competitions, but they don't even know how to code yet. How can I guide them in the right direction without boring them by only doing fundamentals that they may not see as related to their end goals at all? Or alternatively, how can I make fundamentals fun for people with no experience? "
223,cybersecurity,learnprogramming,Good books on programming that aren't about languages?,24,6pl1g9,https://www.reddit.com/r/learnprogramming/comments/6pl1g9/good_books_on_programming_that_arent_about/,2017-07-26 12:11:59,"I've been programming a while, have an internship, and have a good grasp on Javascript (primarily), and I like to do C as a hobby. While there are always new things to learn in these languages (always picking up neat tricks from things I read online), I feel like the amount I can learn that is specific to the languages I work with dwindles every day. I can always pick up new languages, but I always find myself relearning the same things in a different syntax. So, I was wondering if anyone had any good recommendations for books about programming that are language-agnostic? For example, I recently picked up ""Applied Cryptography Second Edition"", and while the examples are in C, the principles apply to any language and the examples can be translated to any language as well. I have a bunch of other security books which I picked up in the recent CyberSecurity Humble Bundle, and am also reading the HTTP 1.1 RFC so I can make my own webserver. Do you have any recommendations for interesting programming books which are language-agnostic?"
224,cybersecurity,learnprogramming,"What are the best resources for learning cybersecurity, NetSec, etc?",94,6nhmuj,https://www.reddit.com/r/learnprogramming/comments/6nhmuj/what_are_the_best_resources_for_learning/,2017-07-16 04:55:18,Im having a hard time finding resources for this and would like input on the best ones out there. thx
225,cybersecurity,learnprogramming,Is the Cybersecurity book bundle on HumbleBundle worth getting?,93,6nxy1n,https://www.reddit.com/r/learnprogramming/comments/6nxy1n/is_the_cybersecurity_book_bundle_on_humblebundle/,2017-07-18 12:34:01,URL I am a noob who is interested in cybersecurity and was wondering if this is a worthwhile purchase.
226,cybersecurity,learnprogramming,"Pentesting and cybersecurity largely relies on programming and computer science, correct?",1,6768zg,https://www.reddit.com/r/learnprogramming/comments/6768zg/pentesting_and_cybersecurity_largely_relies_on/,2017-04-24 11:56:27,Any resources? PDFs? Thanks.
227,cybersecurity,learnprogramming,Thoughts on Udemy?,18,6b7dzr,https://www.reddit.com/r/learnprogramming/comments/6b7dzr/thoughts_on_udemy/,2017-05-15 10:54:30,"Hey all, first time Reddit user here. I'm a third year double major in comp sci and cybersecurity and I was recommended by a friend the website Udemy. My goal this summer is to learn everything hands-on that I didn't throughout university like more programming, information security stuff, Linux and whatnot. Feel free to link me to another post if this one is redundant. TLDR: How do I learn cool shit that I didn't in 3 years of college?"
228,cybersecurity,learnprogramming,Is high math knowledge required if you are self-learning programming?,1,5py0z3,https://www.reddit.com/r/learnprogramming/comments/5py0z3/is_high_math_knowledge_required_if_you_are/,2017-01-25 06:07:02,"I recently graduated from university and now am working as a consultant. I want to move into the cybersecurity group within my firm and I know some coding knowledge would be beneficial (I want to for myself too) so I started CodeAcademy. I was an Accounting and Information Systems student but only learned some UNIX command lines and SQL but no actual language. If I am trying to move into a field like cybersecurity, do I need high math knowledge along with programming (because I know CS students have to take high level math but my degree required only up to Calculus)?"
229,cybersecurity,learnprogramming,Ways of storing data from a Calendar in on Android devices?,3,5qtmu2,https://www.reddit.com/r/learnprogramming/comments/5qtmu2/ways_of_storing_data_from_a_calendar_in_on/,2017-01-29 23:54:18,"I'm working in a group project to create a Calendar app of sorts for Android devices. One of my group members thinks we should just store the data on a remote DBMS and insists that we shouldn't store the data locally on the user's device. While I can understand some of his reservations, I and another group member believe that the user's ability to see their own events on their calendar shouldn't be dependent on a reliable internet connection. The other group member has agreed so long as I do all of the legwork for it. Unfortunately, I'm not the most familiar or experienced on how to do this. I have some basic experience with printing data to text files and reading it back from text files, but still not much. Here's my question: What are some recommended ways of storing data (notably the kind of data one would expect to use in a Calendar app) on an Android device? (Our app is primarily Java-based.) I'm also trying to keep confidentiality in mind, so I'd appreciate any recommendations for how to encrypt or otherwise secure the data. (One of my majors is cybersecurity, so I'd like to at least provide some level of security, even if phones are inherently less secure.) Additionally, I'm hoping to be able to scan the amount of data and routinely clean out older data (from events that are like 6+ months old) to help keep the size of the data down as there were some concerns about using up too much of the phone's storage. Thanks in advance for any advice/commentary. "
