,topic,subreddit,title,score,id,url,created,body
0,vulnerability,privacy,How do you find the setup of an android phone without google and samsung signed in?,1,i5c5im,https://www.reddit.com/r/privacy/comments/i5c5im/how_do_you_find_the_setup_of_an_android_phone/,2020-08-07 21:31:54,"As the title says , with strict permissions in google play services and backround data limited to keyboard , removed all face and google apps and samsung apps via adb shell, and using the phone without signed in google and samsung app store (using f droid and aurora anonymous). How is the privacy of the device? &amp;#x200B; The root option and unlocking bootloader and flashing rom is not bad but security-vulnerability wise is worse than stock. &amp;#x200B; Cheers"
1,vulnerability,privacy,Is the Zoom messaging app safe?,1,i982b0,https://www.reddit.com/r/privacy/comments/i982b0/is_the_zoom_messaging_app_safe/,2020-08-14 06:53:00,"From now on at the college where I study, it will be necessary to use this application for communication between tutors and students, however a few months ago, I read news that this application was watching users, has this ""vulnerability"" been corrected?"
2,vulnerability,privacy,Can I trust TinyCore linux with my personal chats?,1,i9u41p,https://www.reddit.com/r/privacy/comments/i9u41p/can_i_trust_tinycore_linux_with_my_personal_chats/,2020-08-15 06:54:52,"I'm fairly new to Linux and security. I have an old laptop, wait no, ancient laptop lying around and want to use it exclusively for Whatsapp web, because I want to appear online all the time on Whatsapp (I'll achieve this with a simple python script - always keeping the Whatsapp web window in focus). Now should I be worried about my TinyCore linux getting Hacked? I'm only looking for security against hackers and pranksters. Since the laptop will be connected to the internet all the time and running 24/7, is there a vulnerability in this set up that might allow someone to hack into my OS and read my chats? Also, could this be solved by using a firewall and blocking all traffic except from Whatsapp web? All suggestions are welcome!"
3,vulnerability,privacy, Ultimate guide for Cybersecurity and Online Privacy (In the works | Version 0.1),1,igy4hy,https://www.reddit.com/r/privacy/comments/igy4hy/ultimate_guide_for_cybersecurity_and_online/,2020-08-26 22:43:55,"Hi everyone. I am currently having a though experiment of how to get the best possible secure online environment for e.g. journalists who want to leak information, or just to generally find a way to be truly anonymous in the digital world. I am aware that there is no such thing as 'absolute' security, but 99% would be fine in most cases  ____________________________ My thoughts so far. Open for discussion and suggestions. Hardware needed: 1. Need to find a used notebook and buy it cash. The communication with the seller is needs to be non-digital like a backyard sale, flea market or just from a small electronics store (bonus points for a store without a security camera). Because every computer device has a burned-in hardware identification number (MAC-Number). 2. Need to find a prepaid, preregistered SIM-Card. In my country (EU) it is illegal to sell preregistered SIM-Cards. People need to register the SIM-Cards with their ID-Card, but I found that in bigger cities there are shops inside or nearby Train stations or Airports who still sell them for tourists which need fast access to SIM-Cards to call home after arrival. 3. Need to find a USB modem for the SIM-Card, also bought cash. Now that we have our hardware, we get to the software steps: 4. We need a VPN service. Preferably with servers in a country with strict privacy laws like Switzerland or Sweden. There are several VPNs which can be paid anonymously trough cash. Either buying a activation-code in a store by cash or just sending cash by mail to the VPN provider for a registration without a bank transfer trace. 5. Anonymous fake eMail addresses preferably with servers in a country with strict privacy laws like Switzerland or Sweden (or temporary eMail addresses if the online service allows it). 6. All passwords used should be different for each service and account, long with special letters, generated random from a computer and also randomly changed by a human. It can be written down somewhere since it's too hard to remember, but maybe additionally write some special letter in between which you know are not used. 7. In case the computer is going to get raided some day it should be encrypted. With a mac e.g FileVault. 8. For browsing using the software TOR with plugins like 'HTTPS everywhere', 'Disable WebRTC' and 'User-Agent Switcher'. ____________________________ That is so far what I got, need more input. Should a 'Guest account' be used for login into the computer so that the files and everything are going to be erased after each session? One vulnerability I can see already is that IF your VPN provider is going to give up your actual IP-Address, the position of the USB-SIM-Modem could be tracked trough cellular triangulation. In this case there might be a solution to having a mobile phone powered by solar panels positioned in a different city working as a transit spot for data. But this would significantly add to the costs and effort to the whole thing. Also I am not familiar with DNS Service security, could anyone explain if there is a security risk and how to solve it? ____________________________ Thanks for reading "
4,vulnerability,privacy,Why I think Signal's increased reliance on SGX is a mistake,3,hm2fwx,https://www.reddit.com/r/privacy/comments/hm2fwx/why_i_think_signals_increased_reliance_on_sgx_is/,2020-07-06 16:28:11,"SGX is a set of instruction codes available on certain Intel CPUs. SGX allows the CPU to create secure processing enclaves  private memory regions  and execute code inside these enclaves without external processes being able to read or save the code being executed. SGX also supports remote attestation, which lets a client verify that the code running in an SGX enclave is the code it is expected to be. Signal uses SGX for several current and upcoming features such as contact discovery (Your friend is on Signal!) and their planned username feature which will reduce (but not eliminate) the apps reliance on phone numbers as identifiers. SGX is a key part of how Signal implements these features without compromising user privacy. However, there are two main problems that I can see with relying on SGX. * **Firstly: SGX is the polar opposite of free or open-source.** SGX is a completely proprietary technology that can only be found on specific Intel CPUs. Using SGX with remote attestation requires either signing a corporate licensing agreement with Intel directly, or relying on a limited range of other private cloud providers (IBM, Alibaba, and Microsoft Azure). Signals reliance on SGX for key features makes it extremely difficult to deploy open-source forks of Signal that can integrate with the network. * **Secondly: SGX itself is compromised.** Among the recent spate of Intel CPU vulnerabilities have been several side-channel attacks (most notably, [CacheOut](URL that allow the attacker to extract information from an SGX secure enclave. In the specific case of CacheOut, security researchers found that the vulnerability could allow malicious Signal servers to create false secure enclaves which expose all data they receive while appearing completely benign to Signal clients. Not good. TL;DR: Intel SGX lets Intel CPUs run code in a secure enclave where it cant be accessed by other processes. Signal uses SGX for contact discovery and their upcoming username feature. This is a problem because 1) SGX is vulnerable to side-channel attacks that can extract data from the Secure Enclave, and 2) SGX is a completely proprietary technology that goes against everything that free and open-source software stands for. Let me know what you think or if you have any questions."
5,vulnerability,privacy,Can someone ELI5 the vulnerability/flaw with mobo TPM add-on modules pertaining to bit-locker vs. just encrypting without it?,2,hwnr3p,https://www.reddit.com/r/privacy/comments/hwnr3p/can_someone_eli5_the_vulnerabilityflaw_with_mobo/,2020-07-24 06:45:52,I keep reading to not even bother with these add-on modules but can't really understand why.
6,vulnerability,privacy,Password managers questions,5,hx4uny,https://www.reddit.com/r/privacy/comments/hx4uny/password_managers_questions/,2020-07-25 02:26:50,"I'm very uneducated from a technical perspective, but I'm trying to be better. I've been watching a lot of videos on youtube regarding how to pick a password manager (PM). But I still have questions cause some of the comments are confusing. If I get it correctly, it is better to store the database on the devices rather than cloud, but it's less convenient. I don't understand why clould-based is less secure. They say, my device sends only encrypted version of the database to the server of PM provider, so even if hackers hack their cloud storage and get all of our databases, they won't decrypt it, right? I mean, when these type of mass leaks happen, the hackers just sell it on the darknet to the ad companies or whatever, but why would they even hack a password manager if all of the databases are encrypted, they obviously won't try to decrypt every single account, right? It would probably take ages, no? Besides the encryption there's a complicated master password to every database...so who and why would even try to get it? This is why I don't get why it's advised to use a local PM and not the cloud-based ones. People mostly recommend KeepassXC or Bitwarden, plus they are free so I decided to choose between them but still can't make the choice. The first one has a local storage and the second one has their own cloud-based storage and it's open source as well. I have a laptop and an iphone, so in case of Bitwarden I would just use the apps, but in case of KeepassXC I would need to use apps AND constantly sync the devises via third-party apps (some recommend Syncthing). I just want to understand if such inconvenience is worth it. I've read some comments which mention that it's not secure to use the same device/account/database for both password and TOTP. They say, a lot of users do this mistake: in an attempt to log in to a website, they need a TOTP, which they get from their mobile app (for instance, Keepass' Strongbox), and doing so destroys the meaning of 2FA and converts it to 1FA instead. So there's no point in using integrated TOTP? What should one use then, a google authenticator? Cause I don't think I'm willing to afford a Yubikey or whatever it's called. Also, people say it's not safe to even access your database via mobile app for some reason, so it basically means one should not even use the mobile app? But how am I gonna log in to anything on my iphone? Also I don't get how to defend the database from malware and keyloggers on PC? Is there a solution to this? I've heard that the PMs have this huge vulnerability, I think it's autofill that undermines the security. And most PMs have a browser extension that allows autofill for the sake of convenience, and I've heard that some PM (Lastpass?) was hacked due to their browser extension's vulnerability. So I should never ever use an extension at all? And copy-paste the passwords from the desktop app every single time? Cause I have a cookie autodelete extension and It loggs out me from any account when I close the tab, without an autofill it's going to be a nightmare... Please explain all of this to me. The more I read about it, the more confused I get. Also, please, don't suggest me any complicated self-hosted servers and stuff, unless a complete noob like me noob could handle it on his own using a tutorial."
7,vulnerability,privacy,Home Networking Beginner Advice,1,h88s6x,https://www.reddit.com/r/privacy/comments/h88s6x/home_networking_beginner_advice/,2020-06-14 00:42:14,"I just started paying more attention to home security and privacy. I have intentionally maintained a pretty simple home network - 1 router, 2 access points and no smart hub or Alexa or anything. I do have several IoT devices connected to my main and only though and became concerned about that vulnerability after reading some posts here and on r/homedefense. **I was thinking of having a dedicated access point hardwired to my main network but broadcasting a different SSID that I can connect these IoT devices to. Is this worth doing? If so, is that a reasonable fix?** Apologies ahead of time if I have any of my nomenclature incorrect but hopefully that question makes sense. Other info: rural home - I am not in a densely populated area if that makes a difference from a home network security perspective. Thanks in advance!"
8,vulnerability,privacy,Are there any data encryption algorithms or cloud storage solutions that are quantum secure/resistant?,2,hdfnoi,https://www.reddit.com/r/privacy/comments/hdfnoi/are_there_any_data_encryption_algorithms_or_cloud/,2020-06-22 08:09:52,"**I am looking for storage encryption options that are ""quantum-proof"" (I guess more accurately *quantum-resistant*).** [Before anyone jumps all over me, yes I am aware that true Quantum Computers are still a bit down the road, and in some ways even still a bit hypothetical. That said, they *are* going to be here at some point - and if you buy into certain theories they are already in use at high-level agencies... - and considering that everything is being hoovered up and stored for later processing, it kind of doesn't matter if it's a few years, since your current day internet data is going to be subjected to the same kind of analysis eventually. Hence, even if it ends up being a Fool's Errand when all is said and done I'm interested in seeing what can be done proactively]. I'm interested for both hard storage on my computer at home, as well as cloud or remote storage solutions. My primary interest is on the latter, cloud storage, mostly because anything I store there is what's going to be transmitted over the internet and that's more likely to be captured and stored by surveillance entities, whereas things that are only on my machine, unless I'm being targeted which I doubt, aren't really going to be available to them ( that said, I still am very much interested in ways to securely encrypt your hard drive or other volumes in a ""quantum resistant"" manner). 1. Are there in fact any encryption schemes/algorithms out there, available currently, that really provide actual or even hypothetical protection against quantum decryption? If not, what is the best thing that would at least cause it the most trouble, the most secure if still imperfect. 2. Are there any zero knowledge cloud storage providers (I'm really only interested in E2EE stuff) that make use of any of the above-mentioned encryption standards? (I use many different devices, so ideally I am looking for a unitary solution that can function on a wide range of desktop and mobile devices. That said, the minimum standard is that it works, so worst case scenario I am fine with needing to use multiple different services depending on device/operating system, in order to get that level of security) 3. What is the impact on data-in-transit. I know that TLS for example is obviously not quantum resistant at all. Does this matter? On the one hand I could see that being a big vulnerability, on the other hand - this is a hint that I'm not an expert - I'm guessing that if something, quantum encrypted or not, is doing true zero-knowledge storage with client-side encryption that means the transit stuff is irrelevant since all the work is going to be done on my machine before the data is ever sent over TLS or anything? Or is this a bigger problem in fact? 4. If there are no good cloud storage providers that do this, but there is quantum secure encryption in general, what is the best way to implement this for my uses? Putting all the data in some kind of secure container before sending it to the cloud storage provider? 5. Finally, any good resources on this subject, even if not directly answering this question would still be appreciated."
9,vulnerability,privacy,"METASPLOIT PENETRATION TESTING COOKBOOK, 3RD EDITION",1,gejiag,https://www.reddit.com/r/privacy/comments/gejiag/metasploit_penetration_testing_cookbook_3rd/,2020-05-06 22:57:39,"Metasploit is the worlds leading penetration testing tool and helps security and IT professionals find, exploit, and validate vulnerabilities. Metasploit allows penetration testing automation, password auditing, web application scanning, social engineering, post exploitation, evidence collection, and reporting. Metasploits integration with InsightVM (or Nexpose), Nessus, OpenVas, and other vulnerability scanners provides a validation solution that simplifies vulnerability prioritization and remediation reporting. Teams can collaborate in Metasploit and present their findings in consolidated reports. &amp;#x200B; In this book, you will go through great recipes that will allow you to start using Metasploit effectively. With an ever increasing level of complexity, and covering everything from the fundamentals to more advanced features in Metasploit, this book is not just for beginners but also for professionals keen to master this awesome tool. &amp;#x200B; You will begin by building your lab environment, setting up Metasploit, and learning how to perform intelligence gathering, threat modeling, vulnerability analysis, exploitation, and post exploitation-all inside Metasploit. You will learn how to create and customize payloads to evade anti-virus software and bypass an organizations defenses, exploit server vulnerabilities, attack client systems, compromise mobile phones, automate post exploitation, install backdoors, run keyloggers, highjack webcams, port public exploits to the framework, create your own modules, and much more. &amp;#x200B; What you will learn &amp;#x200B; Set up a complete penetration testing environment using Metasploit and virtual machines Master the worlds leading penetration testing tool and use it in professional penetration testing Make the most of Metasploit with PostgreSQL, importing scan results, using workspaces, hosts, loot, notes, services, vulnerabilities, and exploit results Use Metasploit with the Penetration Testing Execution Standard methodology Use MSFvenom efficiently to generate payloads and backdoor files, and create shellcode Leverage Metasploits advanced options, upgrade sessions, use proxies, use Meterpreter sleep control, and change timeouts to be stealthy Who This Book Is For If you are a Security professional or pentester and want to get into vulnerability exploitation and make the most of the Metasploit framework, then this book is for you. Some prior understanding of penetration testing and Metasploit is required. &amp;#x200B; [URL"
10,vulnerability,privacy,Student remote learning software for ChromeOS has spyware capability.,1,ggjrek,https://www.reddit.com/r/privacy/comments/ggjrek/student_remote_learning_software_for_chromeos_has/,2020-05-10 03:35:38,"As Im sure many of you are aware, elementary and high schools across the country have been giving out devices like iPads and Chromebooks to students. If they werent doing that already, many schools rushed to do this during the pandemic. Obviously, these devices are typically installed with permanent extensions or apps, that ensure students are not navigating to inappropriate content on their school devices. The one that my school uses is called GoGuardian. I did a little recent into them recently, and learned that they were involved in a controversy over allowing school administrators to activate spyware capabilities, such as remotely activating students webcams. They claim this functionality has been removed since years ago. But, I decided to investigate anyways. First, I downloaded the extensions source code. This was annoying as the extension is force installed onto individual chromebooks, so I cant just query the webstore and download the crx. I ended up just navigating the chrome-extension://{extension_id}/manifest.json, then grabbed the names of the background and content scripts. After I had everything downloaded, I sent it off to my computer. After some brief deobfuscation, I began reading through the code. As Im sure no one is surprised, they didnt remove the spyware! There are multiple functions that allow a webcam stream to be started, a microphone stream to be start, screenshots to be taken, webcam photos to be taken, etc. Elsewhere in the code, I realize that these methods are called with no user interaction or agreement, remotely, from several servers hosted on goguardian.com sub domains. These sub domains have semi mocking names, like harambe, waluigi, and privacy, while others are more inconspicuous. To make matters worse, some of this is done over unencrypted http. After looking through the code, I noticed way too many references to student privacy. And after listening to sales pitches and viewing their website, I learned that one of their main selling points is protecting student privacy. That just makes this messed up on a whole another level! I also found a vulnerability in the extension that allows me to disable it, but I am unsure of whether or not I want to release this yet as it would likely be swiftly patched. Has anyone else done research into this subject? I feel like this is almost certainly illegal. At the very least, very creepy and immoral."
