,topic,subreddit,title,score,id,url,created,body
35,vulnerability,privacy,What are the core fundamental problems with Network (ISP/CELL TOWERS/WIFI/GPS) that prevent true anonymity from happening?,2,da7fo2,https://www.reddit.com/r/privacy/comments/da7fo2/what_are_the_core_fundamental_problems_with/,2019-09-28 08:15:27,"I have always thought that the greatest vulnerability in true 100% anonymity and security when going online \[in any fashion at all\] starts at ground zero, or rather ""hop two"". Hop one is your router, hop two is your ISP (unless you have a switch or your internal network has more than one hop to the ISP)... AND the fact that it's been proven with Edward Snowden's leaking of PRISM, XKEYSCORE and TEMPEST that the NSA and other agencies actively even still today have agreements with companies like Verizon (an ISP) and others - means that the infrastructure itself has been ""compromised"" (i.e. even Tor can't protect your anonymity in this case). I remember a story (having trouble finding the news source of it) where the FBI were able to track down an Anonymous hacker by comparing timecodes from ISP servers utilizing tor traffic and CCTV cameras in a Starbucks that proved his illegal activities were true. This actually worried me, as someone who feels somewhat comfortable and actually private when utilizing Tor. This comes to a single conclusion: **The only possible way to actually be anywhere near 100% anonymous is to bypass the compromised infrastructure entirely**. That's right. If a company were to setup something like cell phone towers, turn them into Tor nodes and link them directly to other towers as a relay node, then hop over the Tor network and then to your destination, would it not resolve this issue? Not that it is inexpensive to setup some kind of network like this, but I really feel like the only way to get away from such anonymizing breaking as was in the story I discussed above. &amp;#x200B; Thoughts? Discussion please? I have actually been seriously thinking of trying to start a company like this to combat what is the highly illegal and unconstitutional violation of Citizen's privacy."
36,vulnerability,privacy,Firefox Focus actually less private than traditional Firefox (WebRTC blocking),5,ctfjh3,https://www.reddit.com/r/privacy/comments/ctfjh3/firefox_focus_actually_less_private_than/,2019-08-21 21:32:09,Small privacy vulnerability I noticed with the Firefox Focus browser while using a VPN. It's vulnerable to WebRTC. There's no option to block it in settings. And Focus can't install addons. Traditional Firefox at least has a plug-in available (URL that blocks WebRTC similar to an ad blocker. So you actually have a more private connection using traditional Firefox + WebRTC plugin than the privacy-centric Firefox Focus. Am I missing something here?
37,vulnerability,privacy,what do you think of I2P?,0,cw79il,https://www.reddit.com/r/privacy/comments/cw79il/what_do_you_think_of_i2p/,2019-08-28 03:01:04,"So, i know that TOR has a big vulnerability, and i wanted to know what do you think of the I2P protocol. Does it have such big vulnerabilities? is it ""better"" than TOR?"
38,vulnerability,privacy,Do firewall block the communication between installed malware &amp; attacker?,2,cx2268,https://www.reddit.com/r/privacy/comments/cx2268/do_firewall_block_the_communication_between/,2019-08-30 00:59:52,"Hi, I have a query regarding firewall apps on mobile devices. My understanding is that firewall apps only allow internet access to the services / apps we allow in firewall settings \[NetGuard\]. Let's say someone found some vulnerability in either the host OS, or some app and installed some malware on the device. Will the firewall block the communication of that malware back to the attacker? \[Lets suppose malware itself communicates back to the attacker.\] Also, in an event like Pegasus Whatsapp, Would a firewall like netguard be of any use? Will it block the malware from sending the collected information back? I have tried to query the google but failed. I would appreciate any guidance in this regard."
39,vulnerability,privacy,The baseband processor in every consumer grade smartphone is likely a backdoor for intelligence agencies to conduct targeted surveillance,9,cishds,https://www.reddit.com/r/privacy/comments/cishds/the_baseband_processor_in_every_consumer_grade/,2019-07-28 16:14:49,"Go ahead and unlock the bootloader in your smartphone, flash your favorite custom ROM in order to take control of your device and remove bloatware that tracks you. Just be aware that besides your telecom carrier still being able to track the location of your phone everywhere you go using the triangulation of the cell phone towers; these smartphones sold in popular electronic retailers are far from being secure. There are a number of chips running proprietary firmware and the most serious is the [baseband processor](URL which is running a proprietary RTOS (Real-Time Operating System) and is responsible for the radio communications for GSM/3G/4G. The schematics of most smartphone models show that the baseband has full access to the memory ([meaning the memory can be overwritten and corrupted](URL Therefore whatever security measures which are provided by your primary operating system can be bypassed when a vulnerability in the baseband is found and exploited. The are a number of projects that attempt to mitigate this problem, such as the crowdfunding development of the [Librem 5](URL phone from Purism. There are also a couple of projects working on developing an [open source baseband firmware](URL"
40,vulnerability,privacy,That One Privacy Site Compromised [ June 2019 ],74,c30ycv,https://www.reddit.com/r/privacy/comments/c30ycv/that_one_privacy_site_compromised_june_2019/,2019-06-21 06:14:36,"As many people know /u/ThatOnePrivacyGuy put together a fair, unbiased and thorough VPN comparison at [URL along with other resources like email provider comparison and a blog. &amp;#x200B; His resource is important for people needing a VPN provider, as it is frequently recommended by people on this subreddit, this subreddit's wiki, and other places like /r/privacytoolsio and the privacytools website. &amp;#x200B; **For the past several weeks, the simple VPN comparison has contained sketchy providers being marked as all green**: [URL &amp;#x200B; /u/ThatOnePrivacyGuy has been MIA since early may. &amp;#x200B; Some entries that I find suspicions: * ""VPNBook"": They claim to log connection IP, so why is their logging green? Also other greens dont seem accurate * ""MinecraftVPN"": wtf * ""F-Secure and F-Secure FREEDOME VPN"": duplicate entries and sketchy * ""vpn.umontreal..ca"": appears to not even be a public provider ""Access to VPN (URL is available to all registered students and all staff."" * ""Surf VPN"": not sure what service this is even referring to * ""Surfshark"": Jurisdiction and business website seems inaccurate * ""Pure on"": not sure what this is referring to aside from PureVPN * ""Fastestvpn"": website category at least seems inaccurate and maybe technical security &amp;#x200B; See the PTIO Github issue: [URL &amp;#x200B; A WPscan result returned that the site has an SQL injection vulnerability that was probably used to mess with the VPN sheet: [URL Also there is a shell vulnerability that could probably be used to get code execution on the site (meaning the site could be used to serve malware) I'm not posting this to accuse anyone of anything, just as a warning to /r/privacy users. The sheet could be messed up instead of anything scummy/malicious going on, but i doubt it. **Until PrivacyGuy returns, avoid thatoneprivacysite as it is has likely been hacked by a malicious actor.** &amp;#x200B; /u/trai_dep"
41,vulnerability,privacy,Quick Privacy/Security Guide,1,c3am1z,https://www.reddit.com/r/privacy/comments/c3am1z/quick_privacysecurity_guide/,2019-06-21 23:33:21,"I am writing this quick guide to newbies into the privacy/security/information security world who need a quick start. I have been researching this topic for at least 6 years now, and I want to share some of my knowledge here, not all of it, because that would expose my setup, but at least a general overview to get you started with. &amp;nbsp; # 1) Home Security/Privacy &amp;nbsp; * IoT/Smart Devices: I would recommend people to not use IoT and Smart devices, unless you are rich and have multiple houses, you can dedicate 1 of your houses to play with these toys, but if you have 1 house, I wouldn't put anything like this in my house. Perhaps if you have a big house with a garage, then you can experiment with these gadgets in the garage, however keep smart tools out of your **living room**, **bedroom** and certainly **bathroom**. This goes for smartphones too, keep your smartphone in your living room, and never bring it into your bedroom or other private areas. Consider your smartphone to be spying on you 24/7, so never bring it close to any of your computers, all it would take is to point the smart phone camera towards your laptop monitor while you enter a password, and your precious secrets are gone... **So a strict no-no policy of smart gadgets inside the private part of your house.** * Security Cams: I would not put any kind of security cam inside my house, if you must have one, put them outside the house and point them towards your garden or your entrance doors and windows, but never inside the house. Also research some local laws on this in many places it's illegal to point the camera towards your neighbor and things like that. * Alarm Systems: I am mixed about this, if you can get a good alarm system which works with motion sensors, then it might be worth it,although I would still keep them outside of the critical areas of the house: living room, bedroom, bathroom. But if you can only find smart-alarms that need the internet and the ""cloud"" then forget about it, that will most likely be a spy device that will listen to you 24/7 to ""catch burglars"". The motion sensors can be mounted on entrance doors and windows, so no need to bring the devices inside the critical areas. I might also put bars on the windows of your office room where you keep your documents and money just to be safe. * Home Safe: Get a home safe, everyone should have one, it's not expensive, although cheaper ones are usually crap. I would prefer a mechanical one not an electric one, but it's your choice, if you get one with a key, then hide the keys well. Put all your money, jewelry and personal documents inside the safe, but not your digital possessions (like data on a USB, I will explain later). The reason for this is I am paranoid enough to think that safes are not beyond cracking, so if a sophisticated adversary is after your data, then he can very well crack your safe. However if only a basic burglar wants to rob you then they might not be able to crack the safe, plus if your house catches fire or gets flooded, many safes are fireproof and waterproof, so it would save your cash and documents from burning or getting wet. So I would use the safe only to keep basic possessions in it but not digital data. Needless to say that the safe should be drilled into the wall and deep inside the house behind multiple doors that you can possibly lock if you go on a trip. My choice would be to keep the safe in the cellar drilled into the ground, that would protect it with 2-3 locked doors that an intruder would have to break before getting to it. * Curtains: Always use curtains on all your windows, never show anyone the interior of your house. I would also recommend people buying EM shielding curtains so if somebody wants to spy on your through IR cams it would block it. Also given that it's summer, it might also block sun rays and make your house colder. [You can brows for some here.](URL &amp;nbsp; # 2) Computer Security/Privacy &amp;nbsp; * Gaming/Misc: If you want to game then I don't care what you use, just do it on a separate computer. No dual boot or nonsense like that, it's not secure. Get a separate gaming computer and keep that in your living room. In your bedroom you should only have a secure computer where you keep your personal data, and never mix the two. I might even go to the extreme lengths to not even plug in 1 USB and plug it into the other, so have different USB sticks for different computers, even color label them to not mix the two. Treat the gaming PC as a malicious one, and dont contaminate your secure PC with it. * Privacy Computers: I would personally get a computer with EFI support and change it int the BIOS to EFI instead of UEFI. UEFI is a security hole like a swiss cheese. I would also avoid these modern signed schemes for boot where only signed OS's can run on the computer or disable those features from the BIOS if possible. FOSS hardware would be the ideal, but unless you have some money to spend on a [Talos PC](URL you have to settle for something less. I would personally choose an Intel CPU based one, but one with an ME version before 8.X that is an Ivy Bridge based one, after that the [ME becomes very hard to remove](URL Obviously [remove the ME with ME cleaner](URL So for laptop a [Thinkpad X series would be good or other ones that support coreboot](URL or a Desktop PC motherboard from that list, if you want to go extreme then get a Lenovo T420 which can be Librebooted, but this requires external flashing. I would also get a Raspberry Pi 3 as a backup computer, it has ARM CPU and it's more open source than regular desktop PC's, and it can be a good backup one for various reasons and can also be used as a flashing station if you choose to go with the Libreboot road. * OS: I would only use GNU/Linux based operating systems on the privacy computer. Again I don't care what you do with the gaming one, you should keep that separate and isolated, that is not concerning for this tutorial. You can put Win10 on that and play video games on it, just don't mix it with this computer, this one should be kept totally secure and open source. So just use a good enough and open source Linux Distro. You can [search here for the ones you desire](URL however here are a few of my recommendations: * For General Purpose OS: * Debian * openSUSE * Manjaro * [Fully Open-Source OS](URL * Extra Privacy &amp; Security: * Tails * Alpine Linux * Linux Kodachi * Qubes OS * Whonix * Hardening the OS: I would immediately harden the OS. Enable Hard Disk encryption at install (later it's very hard) and use 2 separate passwords here, 1 for the Root Account of the OS and 1 for decrypting the hard drive. Needless to say that all of this info should be extremely carefully handled and hidden. I would also immediately install a MAC system like AppArmor (I would no use SELinux for obvious reasons), and perhaps system vulnerability scanning tools, but only ones that are open source. You can also install ClamAV, on a Debian based distro if you want. Also install Bleachbit, to remove your metadata and cache files from the hard drive, it's not as necessary if you have HD encryption enabled but still good practice to have a clean OS. If you want to further harden the OS, [read and research these points](URL It would also be wise to replace all the applications in the OS with privacy friendly ones or configure them if they are not by default, just because the OS ships with a bunch of FOSS apps that doesn't mean that they are privacy friendly, most of them can have telemetry or crash report enabled by default, if you want extra privacy, disable those. * Integrity: I would always have at least 1 DVD with a secure OS on it, that I have verified cryptographically for it's authenticity, preferably a Live OS. So you can get 1 Tails or 1 Linux Kodachi or 1 Debian Live, burn it to a DVD, verify it's checksum, and then you have 1 reference point from where you can restore your OS, in case you mess it up or get infected. Linux machines rarely get infected since it has multiple layers of defense, however it's always good to restore your OS to a trusted one every 6 months. Like what I would do is just backup everything every 6 months and clean wipe the hard disk and boot the Trusted OS on it and download the new version of your previous OS from it, and then reinstall it. This makes sure that all potential or dormant malware gets wiped eventually, plus in case you didn't disposed your private files well, it's good to wipe the hard disk anyway to get rid of old sensitive data. So just have 1 trusted reference point to which you can always fall back to, and reset your system from it. Since Tails runs from USB you don't have to bother with disks most of the time, but I recommend at least having 1 version of it on a DVD, and verified. * Internet: * Only Firefox or GNU Icecat, [Firefox might also need some hardening](URL It's also recommended to use an adblocker (like Ublock Origin) on FF , HTTPS Everywhere and NoScript addons. * Get a good VPN for regular browsing, or Tor Browser or I2P for extra privacy. * Get a good FOSS firewall, like ufw (gufw), and block all incoming connections, block any outgoing port except 80 and whatever your system might use for synching and update checks, enable them on a need basis, otherwise block every unused port. * Get a good router, preferably [one that can be open sourced](URL and reflash it with a FOSS firmware, and connect to the internet only through the router, and configure it the same way, enable all DDOS protections on the router, block unused ports, IP and MAC filtering if necessary and all other security features if it has. I would also disable WIFI, bluetooth and whatever other radio systems it has and only use WAN cables to connect to the internet. Otherwise anyone near your house could hack it. * A good password manager like KeepassXC, you can also keep a list of bookmarks there, but I prefer with Firefox's bookmark bar which can be exported/imported. * If you are ultra paranoid, you can always just fetch data from the internet with the `wget` command routed through a SOCKS5 proxy like via Tor. Something like `torsocks wget URL This way you don't have to worry about javascript vulnerabilities and crap like that, if you just want to read some text on some website but you fear all the javascript stuff, then just download the file with wget, and then open it in a simple text editor or HTML renderer that disables javascript by default. For PDF files I recommend Evince, since it disables the macros by default so you don't have to fear the malwares from PDF files. * Backups: For backups I would never use the cloud, today's encryption standards might be broken with quantum computing, and most cloud providers store your data forever and hand it to the government and data brokers. So if possible avoid the cloud, but if you want to go with a reputable cloud provider, then still encrypt your data multiple times with different passwords and then upload it. I recommend Veracrypt for creating encrypted containers where you can put your sensitive data on it, and another layer of encryption with GnuPG with a different password, just to be sure. So you make a VC container with 1 password, put all your files in there, close it, and then encrypt the VC file with GPG again with a different password. Instead of using the cloud, I would buy a bunch of MicroSD cards and put it on them. For extra paranoia, I would encrypt the SD card again with LUKS with a 3rd Password, however it's probably an overkill. So get like 10 SD cards, copy your backups on them, and hide them around your house, or possibly at your parent's house or relative's house if you fear that your house can burn down or flood or destroyed by earthquake. An SD card would normally have a 50 year data integrity however it can also wear down quicker if you unplug it wrongly, or static electricity, or a magnet can all damage it. So either have many copies of it or find a way to make sure you don't lose your data. You can also back it up to CD's, however that is hard to hide so you should make a decision what you want more data integrity or hide it better. And also back it up regularly, weekly or even daily if your data and what you are working on right now is important. # Extra Notes: * The best strategy for privacy should be compartimentalization. Don't mix crap together, every tool and system should only run on a minimum need basis, and have access only to a it's minimum needs, don't give them more privileges and access than it's necessary to run it. This means no dual boot, not mixing the USB sticks and SD cards of your personal data with your public data, use color labeling and things like that to keep stuff compartimentalized. * Always make sure your data is portable. If you have to run away for some reason, be it an incoming natural disaster, or some other reason, always have your data packed and ready to go. So something like a backpack with your backups, DVD's and big enough to fit your laptop, so if SHTF you can just grab that and go. Never leave things to chances, because then you will make mistakes, you should be always ready for everything and safeguard your data. * Never reuse passwords, and change them on a regular basis, especially the ones that you use frequently, since any malware attack on a website could expose it. * Never reuse online usernames, and keep online identities separate as well, and compartimentalized. * Use cash instead of cards whenever possible * Don't give out more info about you than it is absolutely needed, don't sign up to marketing letters, surveys and things like that * If you have public Wifi access near you then you should use those often but only through a VPN + HTTPS connections, since Wifi's can definitely be honeypots, so heavy encryption is needed there. You should also randomize your MAC address when using Public Wifis for extra privacy. &amp;nbsp; ------------- &amp;nbsp; If you have any questions or you think I forgot something, say it in the comments below."
