,topic,subreddit,title,score,id,url,created,body
78,vulnerability,privacy,PSA: Update your Linux distros /r/privacy; massive vulnerability in Intel processors puts your privacy at risk...,41,7nxg8j,https://www.reddit.com/r/privacy/comments/7nxg8j/psa_update_your_linux_distros_rprivacy_massive/,2018-01-04 07:30:44,"This is really a security issue, but it is so serious that it could *easily* become a serious privacy problem. Its entirely possible that a hardware level vulnerability in intel processors could allow an attacker ring 0 access to your computer- this is worse than gaining root over the kernel. This is the type of exploit that can lay waste to the best security schemes, so please don't delay. The ""embargo"" period ends January 4th, and who knows what happens from there. I should also note this is not just a Linux problem- this affects Linux, MacOS, and Windows. The fix is found in linux kernel version 4.14.11. I am sure that distros running older kernels will probably backport patches, so get in your forums/irc channels/mailing lists and find out when. If you run an AMD processor you are **NOT** affected by this vulnerability, but you *will* pay a performance price unless you have the patch recently submitted by AMD. Recent benchmarks are suggesting a 5-50% performance penalty for the changes depending on task; this is because the operating system will basically have to use a software solution to a hardware problem. There are threads in /r/linux on this, as well as a number of news outlets covering it: URL URL URL URL **EDIT** Meltdown and Spectre are 2 of 3 exploits to be released. All CPU vendors are vulnerable to Spectre, but Meltdown (which is the one I discussed above) is intel specific *according to AMD, and seemingly accepted as true by Linux kernel devs.* I will update/edit this post as I find out more. FWIW most desktop usage will not see the gaudy 30-50% performance penalties that many of these articles discuss. From what I've gathered applications that require many syscalls are most heavily affected. Unfortunately, those of us here making heavy use of virtualization will see the biggest impact."
79,vulnerability,privacy,Facebook 2017 Year in Review - highlighting the top ways people are being exploited on Facebook,11,7ol4pn,https://www.reddit.com/r/privacy/comments/7ol4pn/facebook_2017_year_in_review_highlighting_the_top/,2018-01-07 06:00:42,"Today we are announcing **Facebook 2017 Year in Review** highlighting the top ways people are being exploited on Facebook subsidiaries. Unsurprisingly, most of them are pretty depressing, confirming what we all already knew: the year 2017 was pretty terrible on Facebook services. Facebook continues his journey on spreading disinformation and censorship, threatening journalism and democracy, collecting private data of billions of people, running massive psychology experiments and attacking the open web. Date | Article :--|:-- 2017-12-30 | [Facebook Says It Is Deleting Accounts at the Direction of the U.S. and Israeli Governments](URL 2017-12-28 | [Facebooks Uneven Enforcement of Hate Speech Rules Allows Vile Posts to Stay Up](URL 2017-12-28 | [Facebook ask new users to submit Aadhaar (India National ID) verified Name](URL 2017-12-20 | [Facebook allowed employers including Amazon and Verizon to exclude older Americans from seeing their job ads](URL 2017-12-19 | [Facebooks facial recognition now finds photos youre untagged in](URL 2017-12-18 | [French data protection authority ordered WhatsApp to stop share user's data with parent company Facebook](URL 2017-12-18 | [Facebook transparency report for first half of 2017: account data requests rose 21% globally](URL 2017-12-17 | [Germanys competition authority has accused Facebook of abusing its dominant market position to improperly amass third-party data on its users](URL 2017-12-11 | **[Former Facebook exec Chamath Palihapitiya says social media is ripping apart society](URL 2017-12-05 | [Facebook Allowed Political Ads That Were Actually Scams and Malware](URL 2017-12-04 | [Facebook Launches New Messenger App for Young Kids  UK health secretary to Facebook ""stay away from my kids""](URL 2017-12-01 | [Facebook Will Introduce Ads as Videos Start](URL 2017-11-29 | [Facebook paid just 30m tax in Ireland despite earning 12bn](URL 2017-11-28 | [Facebooks New Captcha Test: 'Upload A Clear Photo of Your Face'](URL 2017-11-28 | [Facebook Messenger Broadcast for businesses - mass-messaging interface that lets businesses send marketing messages to users](URL 2017-11-27 | [Certain Facebook users in Romania see content related to street protests reviewed (censored) under community standards](URL 2017-11-27 | [Facebook rolls out AI to detect suicidal posts before theyre reported](URL 2017-11-21 | [Facebook (Still) Letting Housing Advertisers Exclude Users by Race](URL 2017-11-19 | **[Ex-Facebook privacy manager, Sandy Parakilas, dishes the dirt on your data. We Cant Trust Facebook to Regulate Itself](URL 2017-11-17 | [Facebook removes delete post option from the desktop web version](URL 2017-11-15 | [Facebook just hired a prominent lobbyist tied to the Russia investigations](URL 2017-11-15 | [Voices Critical of Turkey mysteriously losing thousands of followers on Facebook](URL 2017-11-14 | [Mark Zuckerberg is surprised at the extent of the opioid problem, but Facebook is full of illegal opioid marketing](URL 2017-11-14 | [Facebook says Russia did try to meddle in Brexit vote](URL 2017-11-13 | [One Facebook like is all it takes to target adverts, academics find](URL 2017-11-13 | [Facebook's factcheckers say effort is failing](URL 2017-11-12 | [Artists 'sexual' robin redbreast Christmas cards banned by Facebook](URL 2017-11-09 | **[Ex-Facebook president Sean Parker: we exploited vulnerability in human psychology](URL 2017-11-07 | [To Fight Revenge Porn, Facebook Is Asking to See Your Nudes](URL 2017-11-03 | [Facebook allowed child abuse posts to stay online for more than a year, despite being reported several times, Indian court hears](URL 2017-11-03 | [EFF: Facebook to Microsoft has just endorsed a compromise version of the Stop Enabling Sex Traffickers Act (SESTA), a bill that would be disastrous for free speech and online communities](URL 2017-11-02 | [Youtube and Facebook are removing evidence of atrocities, jeopardazing cases against war criminals](URL 2017-11-01 | [Facebook blocked dissident Guo Wengui after the Chinese government complained](URL 2017-10-01 | [Facebook quietly updated two key numbers about its user base: 10% of Facebooks monthly users are now estimated to be duplicate accounts](URL 2017-10-01 | [120K Instagrams by Russian election attackers hit 20M Americans](URL 2017-10-30 | [Russia-backed Facebook posts 'reached 126m Americans' during US election](URL 2017-10-29 | [Lawsuit accuses Facebook of scheming to weasel out of paying overtime](URL 2017-10-26 | [WhatsApp and Facebook to face EU data taskforce, after they were accused of ""non-compliance"" with EU laws](URL 2017-10-25 | [Google, Facebook &amp; Comcast Jointly Lied to California Lawmakers To Scuttle Broadband Privacy Bill](URL 2017-10-24 | [Facebook dealt setback by EU court adviser in privacy dispute](URL 2017-10-23 | [Facebook moving non-promoted posts out of news feed in trial in six countries](URL 2017-10-22 | [Man arrested after good morning post mistranslated by Facebook as attack them](URL 2017-10-21 | [Amazon, Facebook and Google beef up lobbying spending. Facebook spent $2.85 million lobbying the federal government in the third quarter, up 41 percent from the same period last year](URL 2017-10-19 | [Google and Facebook under pressure after helping anti-refugee campaign](URL 2017-10-19 | [Facebook is struggling to meet the burden of securing itself, security chief says](URL 2017-10-18 | [Facebook admits Russia agents used Messenger to disrupt U.S. presidential election](URL 2017-10-17 | [Limor ladyada Fried was kicked off Facebook and no one will tell her why](URL 2017-10-13 | [People at Facebook Dont Know How Facebook Works](URL 2017-10-13 | [Facebook ad ban over nude artwork shocks women's not-for-profit](URL 2017-10-12 | **[Facebook Is Watching You, Belgian Privacy Agency Warns in Court](URL 2017-10-12 | [Facebook takes down data and thousands of posts, obscuring reach of Russian disinformation](URL 2017-10-10 | [Mark Zuckerberg 'tours' flooded Puerto Rico in bizarre virtual reality promo](URL 2017-10-06 | [About 150 of the political ads Facebook sold to Russia showed up on Instagram](URL 2017-10-05 | [Facebook Cut Russia Out of April Report on Election Influence](URL 2017-10-04 | [Survey: Facebook is the big tech company that people trust least](URL 2017-10-04 | [Facebook UK pays just 5.1m in corporation tax despite jump in profit](URL 2017-10-04 | [Facebook Fought Rules That Could Have Exposed Fake Russian Ads](URL 2017-10-03 | **[Irish court agrees that Facebooks EU/US data sharing might be illegal](URL 2017-10-02 | [Following Las Vegas shooting, Facebooks Safety Check page filled with scammers and hoaxes](URL 2017-10-01 | [Facebook Blocks Chinese Billionaire Who Tells Tales of Corruption](URL 2017-09-29 | [Facebook tests facial recognition for account recovery](URL 2017-09-28 | [Facebook is trying to match blood donors](URL 2017-09-21 | [Instagram uses 'I will rape you' post as Facebook ad in latest algorithm mishap](URL 2017-09-21 | [Facebook will target ads to people based on store visits, offline purchases, calls to businesses](URL 2017-09-18 | [Facebook Silences Rohingya Reports of Ethnic Cleansing](URL 2017-09-14 | **[Former Facebook executive Chamath Palihapitiya says Google, Facebook are ""surveillance states"" and risk more regulation](URL 2017-09-14 | [Facebook Enabled Advertisers to Reach ""Jew Haters""](URL 2017-09-12 | [Instagram apologizes for removing photo of boy with facial deformity](URL 2017-09-11 | **[Facebook fined 1.2M for privacy violations in Spain](URL 2017-09-08 | [WhatsApps first ads appear on Facebook and start conversations with businesses](URL 2017-09-07 | [Facebook Is Testing a Feature That Looks an Awful Lot Like Tinder](URL 2017-09-07 | [Facebook claims it can reach more young people than exist in UK, US and other countries](URL 2017-09-06 | [Facebook says it sold political ads to Russian company during 2016 election](URL 2017-08-30 | [Hackers exploited an Instagram bug to get celebrity phone numbers and email addresses](URL 2017-08-29 | [African governments' user data requests from Facebook, Google and Twitter hits historic level](URL 2017-08-25 | [Facebook faces another moderation scandal over migrant torture videos](URL 2017-08-24 | [Facebook video chat device that can recognise users faces raises fears that social network will spy on people](URL 2017-08-17 | [Zuck wants Facebook on your face: Patent shows augmented reality glasses design](URL 2017-08-11 | [In China, Facebook Tests the Waters With a Stealth App - Colorful Balloons](URL 2017-08-09 | **[Facebooks Onavo Gives Social-Media Firm Inside Peek at Rivals Users](URL 2017-08-08 | [Instagram photos reveal predictive markers of depression (EPJ Data Science)](URL 2017-08-04 | [Facebook is starting to put more posts from local politicians into peoples News Feed](URL 2017-08-02 | [Another black activist, Ijeoma Oluo, is suspended by Facebook for posting about racism](URL 2017-07-31 | [Facebook fights to stop laws on facial recognition](URL 2017-07-27 | [Study by Global Voices shows how Facebook's internet.org/free basics service has failed its users](URL 2017-07-24 | [EU increases pressure on Facebook, Google and Twitter over user terms](URL 2017-07-24 | [Facebook worker living in garage to Zuckerberg: challenges are right outside your door](URL 2017-07-21 | [Facebook blow massive amounts lobbying Trump administration. In first half of 2017, Facebook spent $5.48 million](URL 2017-07-14 | [Facebook will start showing ads inside Marketplace, its Craigslist-style section for browsing used goods](URL 2017-07-11 | [Facebook to Show Ads on Messenger to Bolster Revenue Growth](URL 2017-07-07 | [I kinda hacked a few Facebook accounts using a vulnerability they won't fix](URL 2017-07-07 | [WhatsApp score low on new Who Has Your Back? list by Electronic Frountier Foundation (EFF)](URL 2017-07-06 | [Facebook community standards under scrutiny as out and proud 'dykes' banned](URL 2017-07-03 | **[Facebook investigated by Germanys Federal Cartel Office over claims it extorts personal data from users](URL 2017-07-03 | [Facebook beats privacy lawsuit in U.S. over user tracking](URL 2017-06-28 | [Facebooks secret rules mean that its OK to be anti-Islam, but not anti-gay](URL 2017-06-27 | [Facebook Will Soon Let Brands Target Ads at Entire Families or Specific People Within Households](URL 2017-06-26 | [""Facebook can play a role that churches and Little League once filled"" - Mark Zuckerberg](URL 2017-06-23 | [Supreme Court says woman can sue Facebook over Sponsored Stories image](URL 2017-06-19 | [Facebook and Twitter being used to manipulate public opinion (report by Oxford Internet Institutes Computational Propaganda Research Project)](URL 2017-06-16 | **[Facebook exposed identities of moderators to suspected terrorists](URL 2017-06-08 | [Publishers using Facebook's Instant Articles can now show more ads](URL 2017-06-07 | [Election 2017: Scottish voters targeted by 'dark ads' on Facebook](URL 2017-06-07 | [Facebook inserts itself into politics with new tools that help elected officials reach constituents](URL 2017-06-06 | [Facebook blocks Chechnya activist page in latest case of wrongful censorship](URL 2017-06-05 | [Facebook now lets you find and contact your government reps right from your posts](URL 2017-06-01 | [Facebooks Emotion Tech: Patents Show New Ways For Detecting And Responding To Users Feelings](URL 2017-05-29 | [Revealed: How Facebook chief, Sheryl Sandberg, lobbied Taoiseach Enda Kenny over data protection role and taxation](URL 2017-05-26 | [Yale/UC study finds extensive Facebook usage decreases health &amp; happiness](URL 2017-05-25 | [Facebook is trying to salvage Instant Articles by adding support for Google AMP](URL 2017-05-24 | [Google and Facebook lobbyists try to stop new online privacy protections](URL 2017-05-21 | **[A major leak of Facebooks internal guidelines shows how the social network deals with hate speech, graphic violence and sexual imagery](URL 2017-05-19 | [Facebook blocks Pulitzer-winning reporter over Malta government expos](URL 2017-05-19 | [Instagram ranked worst for young peoples mental health by Royal Society for Public Health](URL 2017-05-18 | **[Facebook is fined 110 million ($122 million) for misleading EU over WhatsApp takeover](URL 2017-05-16 | **[Facebook fined 150,000 euros by French data protection authority](URL 2017-05-11 | [Abortion pill group's Facebook page deleted over promoting 'drug use' ](URL 2017-05-08 | [Facebook is blocking Thai users from seeing video of their king in a crop top](URL 2017-05-07 | [Collecting huge amounts of data with WhatsApp](URL 2017-05-04 | [Facebook nears ad-only business model as game revenue falls](URL 2017-05-01 | **[Leaked document reveals Facebook conducted research to target emotionally vulnerable and insecure youth](URL 2017-04-27 | [Facebook admits: governments exploited us to spread propaganda](URL 2017-04-27 | [Facebook says government requests for your information are on the rise](URL 2017-04-26 | [Vietnam complained of ""toxic"" anti-government Facebook content, now says Facebook has committed to help censor](URL 2017-04-25 | [Museum of Fine Arts among museums hit by Instagram censorship](URL 2017-04-25 | [Facebook under pressure after man livestreams killing of his daughter](URL 2017-04-19 | [Facebook is building brain-computer interfaces for typing, and hearing via skin](URL 2017-04-18 | [Facebook wants you to stare even more at the real world through your phone camera](URL 2017-04-17 | [Facebooks algorithm isnt surfacing one-third of our posts. And its getting worse](URL 2017-04-17 | [A Murder Posted on Facebook Prompts Outrage and Questions Over Responsibility](URL 2017-04-12 | [Whatsapp user's data could be shared with Facebook from this summer](URL 2017-04-10 | [Facebook failed to remove reported extremist posts](URL 2017-04-10 | [A New, More Rigorous Study Confirms: The More You Use Facebook, the Worse You Feel](URL 2017-04-10 | [Press Gazette launches Duopoly campaign to stop Google and Facebook destroying journalism](URL 2017-04-06 | [Facebook Messengers AI M suggests features to use based on your conversations](URL 2017-03-30 | **[Facebook Failed to Protect 30 Million Users From Having Their Data Harvested by Trump Campaign Affiliate](URL 2017-03-27 | [Facebook officially launches Town Hall for contacting government reps, adds local election reminders](URL 2017-03-17 | [The European Commission and Member States consumer authorities ask social media companies to comply with EU consumer rules](URL 2017-03-17 | [Facebook Sued In Israel For Blocking All Links To Site Critical Of Facebook &amp; Suggesting Site Was 'Unsafe'](URL 2017-03-16 | [Facebook to help Pakistan combat online blasphemy](URL 2017-03-07 | [Facebook failed to remove sexualised images of children](URL 2017-03-06 | [Facebook suspends location-sharing feature after Italian copyright suit](URL 2017-03-01 | [Facebook says it can sway elections after all for a price](URL 2017-02-27 | [Facebook's virtual reality ambitions could be threatened by court order](URL 2017-02-23 | [Facebook tests ad breaks in all types of videos](URL 2017-02-22 | [Facebook confusion over fake cancer babies U-turns](URL 2017-02-17 | [The Mark Zuckerberg Manifesto: Great for Facebook, Bad for Journalism](URL 2017-02-14 | [Facebooks autoplay videos will now play with the sound on](URL 2017-02-07 | [D.C. police demand Facebook hand over data on Trump protesters](URL 2017-02-07 | **[Ireland challenges Facebook in threat to cross-border data pact](URL 2017-02-02 | [Facebook's image recognition can now tell what you're wearing](URL 2017-02-02 | [Facebook loses $500m Oculus virtual reality case](URL 2017-02-01 | [Facebooks creepy new feature encourages you to be friends with strangers based on your plans](URL 2017-01-30 | **[WhatsApp Sued by German Consumer Group Over Data Policy](URL 2017-01-30 | [Facebook Happy Birthday lawsuit rolls on](URL 2017-01-25 | [Facebook starts testing more ads in Messenger home screen](URL 2017-01-19 | [Facebook blocks RT from posting until after Trump inauguration](URL 2017-01-13 | [WhatsApp vulnerability allows snooping on encrypted messages](URL 2017-01-12 | [Facebook and Messenger Server Update Drains Users Batteries More Than Usual](URL 2017-01-11 | [Facebook is censoring posts in Thailand that the government has deemed unsuitable](URL 2017-01-11 | [More Ads to Appear on Instagram, Now on Stories Feature](URL 2017-01-09 | [Facebook is going to start showing ads in the middle of its videos](URL 2017-01-07 | [How dangerous fake health news conquered Facebook](URL 2017-01-06 | [Facebook lets rightwing site repost torture video after it was removed](URL 2017-01-02 | [Facebook blocks photo of Neptune statue for being 'explicitly sexual'](URL"
80,vulnerability,privacy,MIPS 74kc Have any idea if this processor contains the spectre vulnerability?,0,7ow0x7,https://www.reddit.com/r/privacy/comments/7ow0x7/mips_74kc_have_any_idea_if_this_processor/,2018-01-08 15:18:03,URL Out of order instructions ..... 
81,vulnerability,privacy,AntiFacebook Newsletter November 2017,2,7gxwwg,https://www.reddit.com/r/privacy/comments/7gxwwg/antifacebook_newsletter_november_2017/,2017-12-02 07:43:17,"Hello and welcome to this new issue! Your monthly dose of all things about Facebook. Let's get straight to the links this month. ## In the News Date | Article :--|:- 2017-10-29 | [Facebook paid just 30m tax in Ireland despite earning 12bn](URL 2017-10-28 | [Facebooks New Captcha Test: 'Upload A Clear Photo of Your Face'](URL 2017-10-28 | [Facebook prototypes Messenger Broadcast for businesses](URL 2017-10-27 | [Certain Facebook users in Romania see content related to street protests reviewed under community standards](URL 2017-10-27 | [Facebook rolls out AI to detect suicidal posts before theyre reported](URL 2017-10-21 | [Facebook (Still) Letting Housing Advertisers Exclude Users by Race](URL 2017-10-19 | [Ex-Facebook privacy manager dishes the dirt on your data. We Cant Trust Facebook to Regulate Itself](URL 2017-10-17 | [Facebook removes delete post option from the desktop web version](URL 2017-10-17 | [Facebook appears to have blocked an account for the hugely popular viral news website Unilad](URL 2017-10-15 | [Facebook just hired a prominent lobbyist tied to the Russia investigations](URL 2017-10-15 | [Voices Critical of Turkey mysteriously losing thousands of followers on Facebook](URL 2017-10-14 | [Mark Zuckerberg is surprised at the extent of the opioid problem, but Facebook is full of illegal opioid marketing](URL 2017-10-14 | [Facebook says Russia did try to meddle in Brexit vote](URL 2017-10-13 | [One Facebook like is all it takes to target adverts, academics find](URL 2017-10-13 | ['Way too little, way too late': Facebook's factcheckers say effort is failing](URL 2017-10-12 | [Artists 'sexual' robin redbreast Christmas cards banned by Facebook](URL 2017-10-09 | [Ex-Facebook president Sean Parker: we exploited vulnerability in human psychology](URL 2017-10-07 | [To Fight Revenge Porn, Facebook Is Asking to See Your Nudes](URL 2017-10-03 | [Facebook allowed child abuse posts to stay online for more than a year, despite being reported several times, Indian court hears](URL 2017-10-03 | [EFF: Facebook to Microsoft has just endorsed a compromise version of the Stop Enabling Sex Traffickers Act (SESTA), a bill that would be disastrous for free speech and online communities](URL 2017-10-02 | [Youtube and Facebook are removing evidence of atrocities, jeopardazing cases against war criminals](URL 2017-10-01 | [Facebook blocked dissident Guo Wengui after the Chinese government complained](URL 2017-10-01 | [Facebook Now Says Russian Disinfo Reached 150 Million Americans](URL 2017-10-01 | [Facebook quietly updated two key numbers about its user base: 10% of Facebooks monthly users are now estimated to be duplicate accounts](URL 2017-10-01 | [120K Instagrams by Russian election attackers hit 20M Americans](URL Read the complete [chronological compilation from 2007-2016](URL ## Great Articles/Discussions (Editor's Picks) - [From temptation to sextortion: Inside the fake Facebook profile industry](URL - [[@HN discussion]](URL **[Best of the Month]** - [How Facebook Figures Out Everyone You've Ever Met](URL **[Best of the Month]** - [Hey, Mark Zuckerberg: My Democracy Isnt Your Laboratory](URL - [[@HN discussion]](URL - [HN Discussion: How do I permanently delete my account?](URL ## Media - [TED: How Amazon, Apple, Facebook and Google manipulate our emotions](URL - [VICE: Facebook Has A History Of Breaking Things - Now Maybe Democracy](URL - [Reply All: 109 Is Facebook Spying on You? (Podcast)](URL #### Don't miss the excellent documentary **[Facebookistan](URL available on [Vimeo Director's Page](URL (password: facebookistan ) #### Check the [collection of videos about the problems of Facebook](URL and the recent documentaries: - **ABC Four Corners [Facebook: Cracking the code](URL ([r/documentaries thread](URL - **BBC Panorama What Facebook Knows About You** ([r/unitedkingdom thread](URL #### A gentle reminder that if you still are on Facebook, please read the **[guide with step by step instructions to leave Facebook](URL and [Instagram](URL **Read the past editions of [our newsletter](URL "
82,vulnerability,privacy,Opinions on L2TP?,1,70nzox,https://www.reddit.com/r/privacy/comments/70nzox/opinions_on_l2tp/,2017-09-18 01:05:20,"I have a vpn that I use regularly on my devices. My computer uses the VPN providers software, my phone and tablet use the OpenVPN for Android app, but as a consequence my other devices like gaming consoles and whatnot are left without any sort of protection. My router is a TP-Link router that supports L2TP in the settings, but I don't see anything for OpenVPN. Right now, flashing DD or another custom firmware isn't an option. So I was wondering what your alls opinion on L2TP is? I've read that it may or may not have had a vulnerability that has been cracked by the NSA, but we don't know for sure. My main thing is that I want to mask my traffic from my service provider, I'm no whistleblower or anything. If there is an instance where I need extra security I can always fire up OpenVPN Thoughts?"
