,topic,subreddit,title,score,id,url,created,body
119,cybersecurity,privacy,I feel like its impossible to get rid of your data,1,gwsn83,https://www.reddit.com/r/privacy/comments/gwsn83/i_feel_like_its_impossible_to_get_rid_of_your_data/,2020-06-05 09:13:01,"Currently Im a college student and Im majoring in cybersecurity. It just hit me of how reckless I was with all of my data when I was younger. I signed up for so much stuff (of course for free) giving away my email, name, address, and phone number thinking nothing of it. Now Im trying to figure out how I can even get rid of my presence and its a grueling process. Can you even get rid of all your data or would you have to stop using the internet all together? Do the companies even actually delete your information?"
120,cybersecurity,privacy,US Investing / Brokerage Options with Decent Security,1,hfe304,https://www.reddit.com/r/privacy/comments/hfe304/us_investing_brokerage_options_with_decent/,2020-06-25 12:09:33,Does anyone have any recommendations for US brokerage/investment firms that have good cybersecurity and if possible decent privacy practices? Things I am looking for: \-2FA allowed through separate authenticator app (specifically not the investment firms app) or hardware token such as a yubikey. \-Allows complex passwords. I have had experience with previous firms that limit password length to 12 characters and another firm blocked special characters. \-Does not blacklist VPN IPs. **Note:** I recognize and know about KYC laws and will make certain to look through recommend firms' privacy policies.
121,cybersecurity,privacy,Oracles BlueKai tracks you across the web. That data spilled online  TechCrunch,1,hiid7j,https://www.reddit.com/r/privacy/comments/hiid7j/oracles_bluekai_tracks_you_across_the_web_that/,2020-06-30 17:11:54,"# Included article for those wanting to avoid all the trackers from a website that always tracks you about a company that has mastered all the trackers # Oracles BlueKai tracks you across the web. That data spilled online  TechCrunch Zack Whittaker@zackwhittaker / 2:30 pm GMTJune 19, 2020 Have you ever wondered why online ads appear for things that you were just thinking about? Theres no big conspiracy. Ad tech can be creepily accurate. Tech giant Oracle is one of a few companies in Silicon Valley that has near-perfected the art of tracking people across the internet. The company has spent a decade and billions of dollars buying startups to build its [very own panopticon](URL of users web browsing data. One of those startups, [BlueKai, ](URL which Oracle bought [for a little over $400 million](URL in 2014, is barely known outside marketing circles, but it amassed one of the largest banks of web tracking data outside of the federal government. BlueKai uses website cookies and other tracking tech to follow you around the web. By knowing which websites you visit and which emails you open, marketers can use this vast amount of tracking data to infer as much about you as possible  your income, education, political views, and interests to name a few  in order to target you with ads that should match your apparent tastes. If you click, the advertisers make money. But for a time, that web tracking data was spilling out onto the open internet because a server was left unsecured and without a password, exposing billions of records for anyone to find. Security researcher [Anurag Sen](URL found the database and reported his finding to Oracle through an intermediary  Roi Carthy, chief executive at cybersecurity firm Hudson Rock and [former TechCrunch reporter](URL TechCrunch reviewed the data shared by Sen and found names, home addresses, email addresses and other identifiable data in the database. The data also revealed sensitive users web browsing activity  from purchases to newsletter unsubscribes. Theres really no telling how revealing some of this data can be, said Bennett Cyphers, a staff technologist at the Electronic Frontier Foundation, told TechCrunch. Oracle is aware of the report made by Roi Carthy of Hudson Rock related to certain BlueKai records potentially exposed on the Internet, said Oracle spokesperson Deborah Hellinger. While the initial information provided by the researcher did not contain enough information to identify an affected system, Oracles investigation has subsequently determined that two companies did not properly configure their services. Oracle has taken additional measures to avoid a reoccurrence of this issue. Oracle did not name the companies or say what those additional measures were, and declined to answer our questions or comment further. But the sheer size of the exposed database makes this one of the largest security lapses this year. ## The more it knows BlueKai relies on vacuuming up a never-ending supply of data from a variety of sources to understand trends to deliver the most precise ads to a persons interests. Marketers can either tap into Oracles enormous bank of data, which it pulls in from credit agencies, analytics firms, and other sources of consumer data including [billions of daily location data points](URL in order to target their ads. Or marketers can upload their own data obtained directly from consumers, such as [the information you hand over](URL when you register an account on a website or when you sign up for a companys newsletter. But BlueKai also uses more covert tactics like allowing websites to embed invisible pixel-sized images to collect information about you as soon as you open the page  hardware, operating system, browser and any information about the network connection. This data  known as a web browsers user agent  may not seem sensitive, but when fused together it can create a unique fingerprint of a persons device, which can be used to track that person as they browse the internet. BlueKai can also tie your mobile web browsing habits to your desktop activity, allowing it to [follow you across the internet](URL no matter which device you use. Say a marketer wants to run a campaign trying to sell a new car model. In BlueKais case, it already has a category of car enthusiasts  and many other, more specific categories  that the marketer can use to target with ads. Anyone whos visited a car makers website or a blog that includes a BlueKai tracking pixel might be categorized as a car enthusiast. Over time that person will be siloed into different categories under a profile that learns as much about you to target you with those ads. The technology is far from perfect. Harvard Business Review found earlier this year that the information collected by data brokers, such as Oracle, can [vary wildly](URL in quality. But some of these platforms have proven alarmingly accurate. In 2012, Target [mailed maternity coupons](URL to a high school student after an in-house analytics system figured out she was pregnant  before she had even told her parents  because of the data it collected from her web browsing. Some might argue thats precisely what these systems are designed to do. Jonathan Mayer, a science professor at Princeton University, told TechCrunch that BlueKai is one of the leading systems for linking data. If you have the browser send an email address and a tracking cookie at the same time, thats what you need to build that link, he said. The end goal: the more BlueKai collects, the more it can infer about you, making it easier to target you with ads that might entice you to that magic money-making click. But marketers cant just log in to BlueKai and download reams of personal information from its servers, one marketing professional told TechCrunch. The data is sanitized and masked so that marketers never see names, addresses or any other personal data. As Mayer explained: BlueKai collects personal data; it doesnt share it with marketers. ## No telling how revealing Behind the scenes, BlueKai continuously ingests and matches as much raw personal data as it can against each persons profile, constantly enriching that profile data to make sure its up to date and relevant. But it was that raw data spilling out of the exposed database. TechCrunch found records containing details of private purchases. One record detailed how a German man, whose name were withholding, used a prepaid debit card to place a 10 bet on an esports betting site on April 19. The record also contained the mans address, phone number and email address. Another record revealed how one of the largest investment holding companies in Turkey used BlueKai to track users on its website. The record detailed how one person, who lives in Istanbul, ordered $899 worth of furniture online from a homeware store. We know because the record contained all of these details, including the buyers name, email address and the direct web address for the buyers order, no login needed. We also reviewed a record detailing how one person unsubscribed from an email newsletter run by an electronics consumer, sent to his iCloud address. The record showed that the person may have been interested in a specific model of car dash-cam. We can even tell based on his user agent that his iPhone was out of date and needed a software update. &gt;The more BlueKai collects, the more it can infer about you, making it easier to target you with ads that might entice you to that magic money-making click. The data went back for months, according to Sen, who discovered the database. Some logs dated back to August 2019, he said. Fine-grained records of peoples web-browsing habits can reveal hobbies, political affiliation, income bracket, health conditions, sexual preferences, and  as evident here  gambling habits, said the EFFs Cyphers. As we live more of our lives online, this kind of data accounts for a larger and larger portion of how we spend our time. Oracle declined to say if it informed those whose data was exposed about the security lapse. The company also declined to say if it had warned U.S. or international regulators of the incident. Under California state law, companies like Oracle are required to [publicly disclose data security incidents](URL but Oracle has not to date declared the lapse. When reached, a spokesperson for Californias attorney generals office declined to say if Oracle had informed the office of the incident. Under Europes General Data Protection Regulation, companies can face fines of up to 4% of their global annual turnover for flouting data protection and disclosure rules. ## Trackers, trackers everywhere BlueKai [is everywhere](URL  even when you cant see it. One [estimate](URL says BlueKai tracks over 1% of all web traffic  an unfathomable amount of daily data collection  and tracks some of the worlds biggest websites: Amazon, ESPN, Forbes, Glassdoor, Healthline, Levis, MSN.com, Rotten Tomatoes, and [The New York Times](URL Even this very article has a BlueKai tracker because our parent company, Verizon Media, is [a BlueKai partner](URL But BlueKai is not alone. Nearly every website you visit contains some form of invisible tracking code that watches you as you traverse the internet. As invasive as it is that invisible trackers are feeding your web browsing data to a gigantic database in the cloud, its that very same data that has kept the internet largely free for so long. To stay free, websites use advertising to generate revenue. The more targeted the advertising, the better the revenue is [supposed to be](URL While the majority of web users are not naive enough to think that internet tracking does not exist, few outside marketing circles understand how much data is collected and what is done with it. Take the [Equifax ](URL data breach in 2017, which brought scathing criticism from lawmakers after it collected millions of consumers data [without their explicit consent](URL Equifax, like BlueKai, relies on consumers skipping over the lengthy privacy policies that govern how websites track them. In any case, consumers have little choice but to accept the terms. Be tracked or leave the site. Thats the trade-off with a free internet. But there are dangers with collecting web-tracking data on millions of people. Whenever databases like this exist, theres always a risk the data will end up in the wrong hands and in a position to hurt someone, said Cyphers. Cyphers said the data, if in the hands of someone malicious, could contribute to identity theft, phishing or stalking. It also makes a valuable target for law enforcement and government agencies who want to piggyback on the data gathering that Oracle already does, he said. Even when the data stays where its intended, Cyphers said these vast databases enable manipulative advertising for things like political issues or exploitative services, and it allows marketers to tailor their messages to specific vulnerable populations, he said. Everyone has different things they want to keep private, and different people they want to keep them private from, said Cyphers. When companies collect raw web browsing or purchase data, thousands of little details about real peoples lives get scooped up along the way. Each one of those little details has the potential to put somebody at risk, he said. *Send tips securely over Signal and WhatsApp to +1 646-755-8849.*"
122,cybersecurity,privacy,"Cyber volunteers release blocklists for 26,000 COVID-19 threats",2,ge7c2g,https://www.reddit.com/r/privacy/comments/ge7c2g/cyber_volunteers_release_blocklists_for_26000/,2020-05-06 08:09:36,"The COVID-19 Cyber Threat Coalition has released a block list of known URLs and domain names associated with Coronavirus-themed scams, phishing attacks, and malware threats. The coalition is a volunteer organization created towards the end of March 2020 to disseminate information about new threats trying to take advantage of the Coronavirus pandemic. This [COVID-19 Cyber Threat Coalition](URL consists of members from the cybersecurity community, large companies, cyber intelligence firms, and antivirus vendors who use the collected information to protect businesses, consumers, government, and healthcare organizations from online attacks. &amp;#x200B; source : [URL"
123,cybersecurity,privacy,[D] The Most Important Question Regarding the Impact of AI &amp; Cybersecurity on Privacy,1,gf2cyg,https://www.reddit.com/r/privacy/comments/gf2cyg/d_the_most_important_question_regarding_the/,2020-05-07 17:59:58,"Taking preventative measures instead of being reactive can save lives. Today, we all are witnessing the dire consequences of not taking preventative action in a timely manner with the COVID19 pandemic. How about the future cybersecurity and rapidly evolving AI tech? As it stands today, AI technology massively enhances the capabilities of cybercriminals and cybersecurity professionals' alike, which brings many questions to light; * Will the ultimate winner be the attackers since they will always be one step ahead? * Should we rethink the way we design our systems or focus on AI-powered active detection/defence measures? * Will cybersecurity be nothing but a dream against a truly sophisticated general artificial intelligence algorithm? * Is it going to be a must to sacrifice privacy for security? Sometimes, asking the right questions can be more important than the answers, what are your thoughts on the most critical questions we should ask regarding AI &amp; Cybersecurity on Privacy."
124,cybersecurity,privacy,Israeli NSO,1,gjtlfb,https://www.reddit.com/r/privacy/comments/gjtlfb/israeli_nso/,2020-05-15 05:49:45,How can someone protect himself/herself from cybersecurity attacks from NSO?
125,cybersecurity,privacy,Disclosure: CVE-2020-13702: catastrophic breach of user privacy in Apple/Google COVID-19 Exposure Notification API,1,gv3kfk,https://www.reddit.com/r/privacy/comments/gv3kfk/disclosure_cve202013702_catastrophic_breach_of/,2020-06-02 18:38:40," **Authors:** Daughter of V ([daughter-of-v@protonmail.com](mailto:daughter-of-v@protonmail.com) / PGP key DF20D21B349C2A9A) *Disclaimer: the authors of this document stay anonymous to avoid personal ramifications. The vulnerability has already been communicated to specific international media outlets in advance.* # TL;DR Apple and Google have joined forces to provide the Exposure Notification API as a secure baseline for contact tracing app developers. In their API release (currently in beta) they accidentally destroyed Bluetooth Smart Privacy, allowing seamless device location tracking. Adding current beacon network coverage and broken IoT security to this scenario, and considering the potential acceptance rate of such a technology, this might be an Orwellian nightmare on our doorsteps. This API development needs to be brought on course with international data protection legislations (COPPA, GDPR, PRC Cybersecurity Law, etc.) or alternative solutions should be investigated. # Introduction This document describes a critical breach of Bluetooth Smart Privacy introduced by Apple and Google in their COVID-19 support infrastructure called Exposure Notification. In a collaboration Apple and Google decided to tackle the difficult problem of enabling a global scale contact tracing app infrastructure while applying cryptographic means to avoid that user privacy is affected by this new technology. Numerous initiatives have been started early on in the COVID-19 pandemic to provide local solutions for digital contact tracing via smartphone apps. Most of them raising high concerns about the user privacy impact of such a large-scale apps. Rest assured that it left me with much wonder as I reviewed the specification released by Apple and Google and quickly stumbled upon what looked like a nuclear security fallout  the API spec effectively destroys the integrity of the Bluetooth Smart Privacy functionality established in 2015 by the Bluetooth SIG \[1\]. In itself this is already a fatal situation, but the Bluetooth LE context of the Exposure Notification protocol renders this even worse. The attack is fully remote, passive and without any need for device or authentication data access. This implies that the endless number of Bluetooth LE enabled devices world-wide are potential attack vectors, resulting in a convenient tracking solution of unprecedented scale affecting every user that installs an IOS or Android contact tracing app which consumes the Exposure Notification API. The vulnerability lies in the basic protocol design and as such does not need special exploit code. Any IoT device vendor stack is prone to undesired modification to enable this device tracking. Any Bluetooth LE chip vendor is able to add such tracking under the hood. This scenario serves as a good reminder why experts should be listened to when they raise concerns about such high-impact technologies. Given the escalation of the pandemic it is understandable why time is of essence, but rushing out a solution with such a fundamental detoriation to freedom and democracy everywhere is not how things should be. Technology iterates at lightning speed, but from time to time we need to hold on for a second and think about the consequences of our actions. The question why our devices communicate with hidden peers whereever we move  without our knowledge  is a different story for a later time. # Vulnerability The described vulnerability sits in the Bluetooth LE part of the specification \[2\] published in v1.2 at the time of this writing. The encryption architecture designates a 16-bit Rolling Proximity Identifier to enable the exchange of contact data between nearby devices without exposing the user identity to the peers. The details of the encryption protocol are not relevant for this exploit, it is only the identifier rotation interval that needs to be considered. The specification proposes that the rotation should take place on average every 15 minutes, which would be the duration within which a user is trackable by a UID. After the rotation the UID is refreshed which prohibits the identification across the rotation segment. In the same specification the Bluetooth Random Private Address feature of Bluetooth LE devices version 4.2 or later is recommended to receive a rotation set randomly in between 10 and 20 minutes. Bluetooth SIG specifies this MAC address randomization feature supported by the LE Set Resolvable Private Address Timeout command to prevent devices to become trackable \[3\]. The two differing rotation intervals create the critical flaw in this protocol design. Since both MAC address and proximity identifier are part of the public Bluetooth LE broadcast packeets anyone can intercept this data simply by placing a receiver within signal range. A malicious device network could easily store and correlate both identifiers to track users moving between the device locations. Both Bluetooth Smart Privacy address randomization and Exposure Notification identifier rotation work as expected independently, but anyone holding both data points can trace devices across rotations. *Fig 1. following the user identitity by jumping between MAC address and proximity identifier during rotations* This results in Bluetooth Smart Privacy getting broken in consequence. The Exposure Notification specifies an advertising interval of 200-270 milliseconds (presumably in an opportunistic manner). Due to the random nature of the rotations a collission of the is highly unlikely, thus resulting in near-100% tracking accuracy. # Attack vectors The vulnerability exposes the user identity both on re-scans of a single device and cross-device scans. Rescanning on a device does not seem to provide much leverage because the integrity of the encryption protocol still guarantees that no undesired data is exposed. The Exposure Notification specifies a scan interval of around 5 minutes (again in opportunistic manner) for API consumer apps, so the granularity is very low for the standard use case. Now a permanently powered device like a beacon can increase scan frequency to capture much more broadcasts. But even in a high-volume scan scenario the critical impact of this vulnerability only occurs when a single malicious actor controls a network of Bluetooth LE devices with central data storage available. *Fig 2. storing both identifiers for all devices in a fleet allows geographic tracking over fleet coverage* In this case the tracking potential is only limited by the coverage of Bluetooth LE devices within a controlled network. Note that many urban and commercial areas already see full coverage of beacon networks. # IoT security context In the assessment of this vulnerability the general state of security of IoT devices should be considered. The aforementioned scenario applies to valid Bluetooth LE device network operators, which in itself should not be allowed by Bluetooth Smart Privacy. The lack of a good security baseline of IoT in general, the numerous product/device variants, and the long runtime/lack of deployment lifecycle multiplies the issue beyond undesired network operator tracking capabilities. It is a likely scenarios that advanced penetration threat actors like nation states or high profile hacking groups can gain illegit access to Bluetooth LE device fleets. Near global tracking coverage for urban areas is theoretically attainable. # Proof of concept Due to the inherent protocol behavior creating the attack vector there is no need to provide a specific PoC implementation. A simple addition of the two identifier data points to a central store would suffice. In-the-wild device fleets possibly already include these data points in timeseries databases as they are often used for network logging. In both cases the location history for a device can simply be queried by hopping between the two identifier data points whenever a rotation occurred, and following through the fleet on device jumps (because the user moved). # Possible rectification The authors have not verified the other protocol layers in too much depth, but it would seem feasible to replace the rolling proximity identifier with the random MAC address (or an encrypted derivative) for devices supporting Bluetooth Smart Privacy. Since the API is backwards compatible with very old devices it is possible that the current rolling proximity identifier approach is also required to be kept for non-privacy enabled Bluetooth devices to ensure the integrity as proposed in the specification. # References \[1\] [URL \[2\] [URL \[3\] [URL"
126,cybersecurity,privacy,Earn It Act Petition,1,fv0a5z,https://www.reddit.com/r/privacy/comments/fv0a5z/earn_it_act_petition/,2020-04-05 06:02:55,I saw [this](URL person's post and thought that the petition under a gov domain may be more useful for your goal: [URL &amp;#x200B; Good luck!
127,cybersecurity,privacy,Internet Privacy at Risk,1,fxr4y3,https://www.reddit.com/r/privacy/comments/fxr4y3/internet_privacy_at_risk/,2020-04-09 21:57:17,"This [petition](URL will protect online privacy A lot of people try to protect themselves by buying [privacy tools](URL to be able to browse anonymously but now, this will be harder"
