,topic,subreddit,title,score,id,url,created,body
218,vulnerability,sex,Im worried that my girlfriend and I have fundamentally different values when it comes to sex,12,7357g5,https://www.reddit.com/r/sex/comments/7357g5/im_worried_that_my_girlfriend_and_i_have/,2017-09-29 13:11:35,"For some background, Ive had sex with 4 women- 2 of these are girlfriends (including her), 1 is a girl that I was seeing for several weeks, and 1 was a one night stand (I did not enjoy this and felt pretty gross afterwards). I have been sexually intimate with about 10 women (who I liked), but mainly due to a lack of confidence on my part and performance anxiety, did not have sex with them. For me, sex is something that requires trust, vulnerability and intimacy- in fact, I have come to realise that I cannot get turned on without feel intimately connected and fully trusting my partner My girlfriend and I have been seeing each other for about 11 months now. She is currently on an overseas trip. Right before she left she told me that after she broke up with her first boyfriend she decided that relationships and love were a scam, and slept with a large number of people in the 7 years that followed. These were all people that she specifically did not like, as she decided that she did not want to feel intimately connected with anyone again. Her intentions in this time were to devalue sex for her and use it to as something to blow off some steam. She also told me early in the relationship that she thought she could be a hooker (she never has been). However she did tell me about a year or 2 ago she had a realisation that she didnt really like her past behaviour didnt really represent what she wanted. She said she stopped sleeping with many people in this time and started looking for more connection. I have been the only person she has had a relationship with since her first boyfriend. Its seems like the last 7 years of fucking strangers has devalued sex for her and closed her off to feelings of intimacy. She has told me explicitly (and recently) that she does not believe in love. For me, I think love is something that exists, and is an emotion I feel fairly easily. I probably started feeling love towards her about 2 or 3 months into the relationship. And it feels like the feelings are mutual- she takes care of me when I am sick, I can be open and honest about things when I am feeling down- she is a caring partner and I try to be the same for her. The hookup culture isnt something that I am opposed to- I consider myself pretty open minded with most things and my general attitude is that if it doesnt directly hurt me or anyone, its not really any of my business. I understand that opening up about her sexual past was difficult for her, and I dont judge her for her behaviour. I guess what Im worried about is incompatibly when it comes to sex- everything in sex is centred around intimacy for me. Rough sex for me makes me feel closer to my partner. Intimate sex turns me on immensely and makes me feel closer to my partner. I see sex is a very emotional, pretty special experience for me and my partner to share, and afterwards, I need to cuddle a lot with my partner. I cannot imagine seeing sex as a commodity or fucking people I dont like. And I guess it makes me feel unsure of myself and our connection when my partner can see sex that way Im mostly writing this to get my thoughts out. Im having a hard time processing and understanding this rationally right now, especially because I cant talk with her freely about it. But I guess if anyone with more experience than me has any thoughts or has been in a similar situation, advice is always appreciated. I would like to understand this situation in a better way so I can move past it. And its probably pretty possible Ive misrepresented some things so feel free to ask questions! "
219,vulnerability,sex,From the other side. Please help me understand.,66,6v1okl,https://www.reddit.com/r/sex/comments/6v1okl/from_the_other_side_please_help_me_understand/,2017-08-21 18:48:52,"I've been browsing /r/sex for a little while now, reading the diversity of opinions and trying to get a glimpse into a world so clouded and mysterious to me. No matter how hard I try, I can't seem to see sex in the same way other people do. Some parts of my story are as old as time - I'm 22, a virgin, never been in a relationship, never been kissed, etc. I have some of the same issues many guys my age do - lack of confidence, fear of rejection, etc. But there's something very deep inside me - whether physically or mentally - that is fundamentally revolted and horrified by the idea of sexual intimacy. TL;DR: My head's not a fun place to be in. I'm on the autistic spectrum (Asperger's), have severe social anxiety, have struggled with suicidal depression, etc. Suffice it to say, the idea of being in a relationship is extremely intimidating to me. And the idea of sex...well... See, this is the part I don't understand. I see posts on here about partners trying different positions, tips for casual sex, etc. And there's so much happiness and positivity and encouragement, because human beings seem to enjoy sexual intimacy. But when I think about it... The best way to describe it is a deep, primal fear and horror at the idea when applied to *me.* I have always been straight, and have masturbated to porn before. But in recent years, a combination of my anti-depressants and my own personal life situation has lowered both my sex drive and my self-esteem severely. When I was younger I was at the center of all my masturbation fantasies. Now, while I still have something of a sex drive and occasionally masturbate, I can't even *conceive* of the idea of me having sex. Let me put it this way: imagine you're with your partner/fwb/fuckbuddy etc, and the clothes begin to come off. For many of you, this is an exciting and fun event to look forward to. But for me...well, I'm trying to imagine it right now and the thought is almost making me cry literal tears. A woman flirting with me would terrify me, because sex/dating/etc feel so alien to me that there's something fundamentally *wrong* with the idea of it. A woman seeing me naked might be enough to give me a literal heart attack, or at the very least an anxiety attack. I don't know why I feel this way. I've always been an extremely sensitive and vulnerable person, and emotional abuse/gaslighting I dealt with in the past as a teenager has made it very difficult for me to trust others or let my guard down. I don't think it's my dick size, since I've never really felt strongly about that. I don't know what it is, but something inside me is deeply, deeply horrified and revolted by the idea of having sex. If I had to guess, I'd say that the vulnerability of it, and the expectation to do something I don't know, really bothers me. So I guess my main question to /r/sex is...how, and why, is sex so important and enjoyable for so many people? I feel like I've never really understood it, and now even as I'm older I only grow more distant from it. I want to know why sexual desire, which has only ever caused me frustration and annoyance, is so essential and enjoyable for many. I want to know why sex itself is seen as so pleasurable and necessary by so many, and yet the very idea of it makes me shiver in horror. Sorry if this is too long, I hope I made sense. "
220,vulnerability,sex,Sex always makes me cry,4,6wgnu3,https://www.reddit.com/r/sex/comments/6wgnu3/sex_always_makes_me_cry/,2017-08-28 12:52:32,"I've seen several posts on here from women who say they cry because it feels so good but I don't think that is the case for me. Sex, and also fingering, always makes me feel overwhelmed with emotions, but in a sad kind of way. I get feelings of confusion and vulnerability and sometimes get kinda panicky and scared. I can enjoy sex for a while but I always start to get these feelings after a few minutes and then we have to stop and have a break. I feel like this is preventing me from being able to enjoy sex, and I'm really confused about why it happens to me. Does anyone have any advice or similar experiences?"
221,vulnerability,sex,what pegging does to you,710,6osrgs,https://www.reddit.com/r/sex/comments/6osrgs/what_pegging_does_to_you/,2017-07-22 13:05:44,"So I'm a bi cis woman currently with a cis male partner. Said partner and I are into pegging. He is an incredible dude who is really in touch with himself and his sexuality, and I love the closeness we get from pegging - and the power dynamics. He enjoys the vulnerability and the feeling of being wanted that way. We're also into getting high and fucking, because, well, who isn't. The other night we'd had a cone or two and were mashing ourselves into each other at full force, albeit somewhat floatily. I ask him to use my buttplug on me as we fuck. He gets the buttplug and kindly obliges, then as he's getting ready to enter me with his cock, he sighs dreamily and says, ""You know, that's one thing I've never tried. Double penetration. It'd be really amazing having..."" he trails off, looks momentarily confused, and then exclaims ""fuck! I don't have two holes."" It was hilarious. And entirely delightful. tfw when ya boy is so in touch with his feminine side, he forgets he doesn't have a vagina. &lt;3"
222,vulnerability,sex,"I want to have a threesome, but with another guy and not in the way that you might think...How should I tell my wife?",5,6owago,https://www.reddit.com/r/sex/comments/6owago/i_want_to_have_a_threesome_but_with_another_guy/,2017-07-23 03:41:23,"My wife and I have been opening up more with each other about our sexual fantasies. She told me hers and Its nothing uncommon but Ill let it remain private. Mine is that I want a threesome but with a guy and not in the way that most people would imagine I want to basically share a guy with her but its more than that. I want to share the more feminine or passive side of sex with her. The other guy would be mostly straight and her and I would suck his cock and wed both get fucked by him! Wed basically be sharing sex with a guy. Ive had some experience with pegging in the past and I love the totally different dynamic where I am vulnerable and the power dynamic shifts. It reverses the roles we normally play in sex. It puts sex in a whole different perspective. You are not as much thinking about performing as you are wondering if the other person will be good at fucking me. There is much more vulnerability and trust and the first time I did it, I totally understood why sex is more of a big deal or a loaded proposition to women than it is to men. Its like a window into the female experience of sex and I guess its just as much fun and enlightening as it is when a woman wears a strap on and tries fucking someone else for the first time. I am not really attracted to men but in this context, the ultimate would be to be with a woman and share the same man! We are both sharing that cock and his skills. We are both sharing the feminine or passive side of sex. I would not want to have sex this way all the time but it would be so much fun to share a man with my wife and share the female experience of sex with her. Just really hesitant to tell her. We have good communication but Ive never hinted at any attraction to men and honestly I dont think I have any. Ill admit this makes me some degree of bisexual but I honestly would have no desire to be alone with a guy and doing this. Im just wondering how she will see me or maybe I am overreacting. "
223,vulnerability,sex,"Women, would your sexual attraction to a guy be affected if he opened up to you?",2,6p0gyr,https://www.reddit.com/r/sex/comments/6p0gyr/women_would_your_sexual_attraction_to_a_guy_be/,2017-07-23 19:26:28,"I won't judge you based on your responses. I'm just looking for honest answers. I've only opened up to a girl once before, and it ended up scaring her away. She was the first girl I ever had a crush on, and the first girl I ever dated. So having her literally get teary eyed and leave after I opened up to her destroyed me emotionally. Since then, I've been scared of opening up to women. I've [20M] been dating a girl [20F] I really like her, and she seems to like me back. She's the second girl I've ever had a real crush on, and she's the second girl I've dated. I'm really new to this, and I'm terrible with women. I don't want to come off as creepy. I really do think things are going very well, and I don't want to mess anything up. I'll be seeing her again relatively soon, but I won't see her again in person for a while, so I have plenty of time to think about this. Would it be a bad idea to open up to her? Are there certain things that are best left secret? At what point are you okay with a guy opening up to you? Is there a limit to how much you would want him to share? Would it change the way you view him sexually? Would his vulnerability be a turnoff?"
224,vulnerability,sex,A guy I've started dating confessed that he likes crossdressing. He was embarrassed and shy to tell me about it. What can I do to help ease him into being comfortable with it? [26F/28M],1204,6qk0f2,https://www.reddit.com/r/sex/comments/6qk0f2/a_guy_ive_started_dating_confessed_that_he_likes/,2017-07-31 07:24:30,"Hi everyone! The history: We met on OKCupid and have been talking for a few months. I've met him twice, so far. This all happened last night, and I'm still reeling from it. I'd gone to his house, and we were having drinks and talking. The conversation drifted to sex, and he started sharing some things he's into. The first few were a little vanilla, then he shared that he tried crossdressing a few weeks ago. I was instantly intrigued. I started asking him questions to understand. He seemed shy about it all but I think he was relieved to share. I've always been a very open and accepting person, and he said that he's trying to be more open with people. Conversation about it went on until I said, ""I'd like to see that sometime."" I was really surprised when he offered to show me what he bought. I don't think I'd ever been so excited in my life. He got changed and came back in lingerie, stockings, and a silk robe. Long story short, we got it on, and it was *amazing*. So to the point of my post: while he was initially showing me, he said, ""I'm really embarrassed."" I understand that revealing something like that could cause a lot of anxiety and make someone feel very vulnerable. Also, he is 6'5"" and very athletically built. He expressed disappointment that he has such a masculine body, but he isn't trans nor does he want to transition. I told him that I thought he was gorgeous, all dressed up, and that I actually liked the difference between his masculine body and the feminine clothing. I didn't say this, but his vulnerability really struck me and touched my heart, as well. So, I'm asking for advice, anecdotes, or experiences of your own you'd like to share, about making him feel more comfortable in crossdressing. He seems to be really into it, but I could tell he was shy and anxious. Do you think what I've said already was good? I want to make sure that I'm sensitive enough, because I really like him! We mesh quite well, and I find this really damn hot! **TL;DR: Guy discovered he likes crossdressing. I'm totally into it. He was very shy about it. How can I help him be more comfortable?** **EDIT:** Thanks everyone for your responses! I absolutely did not expect this to blow up, and I'm not sure if I have the time to respond to everyone but please know I really, truly appreciate everything you're sharing. **If you're currently struggling**, I hope this gives you courage and hope that one day you'll be accepted! You all have taught me a lot and helped me consider facets I didn't even think of. Thank you so much!"
225,vulnerability,sex,Having difficulty being vulnerable,5,6sds9f,https://www.reddit.com/r/sex/comments/6sds9f/having_difficulty_being_vulnerable/,2017-08-09 00:20:56,"Super long so thanks for reading. I [21M] have been with my girlfriend [22F] for almost 2 years now. The other night we were having a conversation about sharing our feelings and she made a mention about how I don't share as much as I used to. She's right, when we first met I shared every single thought that came to mind. In some cases that led to great conversation and in others it led to a problem. But lately I've felt like I've had a hard time being vulnerable. We're currently at distance right now and will be for the next couple weeks. As I've tried to work through this issue, I've been thinking about the possible causes. And I keep coming back to our lack of physical and emotional intimacy. To me, once the physical side of our relationship ended I felt as though there was a distinct disparity in emotional connection. Now I do want to mention we have been at distance for 2 months, but it's been nearly a year since the physical side of our relationship existed with any sort of regularity or frequency. When we were together in the same place, our sex life was down to if I'm lucky once a month. This naturally had caused tons of stress on us. We were so busy with school and finding jobs for the latter part of that year that anybody could have a hard time focusing on sex. However, even through that I recognized that I had needs and if she's reasonable it's possible she might too and pursued it if the time was right to no avail. Our shortcomings in our sexual life presented a lot problems in the way we function. Never was sex I suppose a staple of our relationship. But it was the absolute lack of it that made me start to wonder and have questions about things. As well as notice parts of her behavior. In short I realized that while she maybe on an interest level attracted to my personality, she is in no way physically/sexually attracted to me. In the beginning I had a bit of an issue with premature ejaculation. I came early the first 2 times we had sex. I had been used to having it daily if not multiple times a week for about a year so the months between that and us starting took a toll. I've gotten somewhat of a handle on it but it's just forced us into a negative cycle. For her the first time having sex after a while (a month) usually hurts since she isn't used to it. And for me, if I go a month between times there's a higher likelihood I'll finish quickly as I have no rhythm to it and the feeling might as well be brand new. On top of that she even moves her body to make me finish as fast as possible so neither of us really get to feel or enjoy the sex. This has all led me to realize that for the past year and some change. She's been pity fucking me instead of working with me to improve our sex life. I nearly had to force her to talk to me about what she likes in bed. And once I knew what she liked, she did everything possible to just make me finish quickly so I couldn't even try. For example, she'll touch me until I'm about to finish then make me put it in so I'll just finish in a few strokes. I think she thought I didn't know it was pity sex because she seemed a bit taken aback when I asked her if that's what she was doing to me. The problem is, I don't want pity sex. A pity fuck is worse than none at all. And here's where it relates to my vulnerability. I don't need the sex at the end of the day. I have a fleslight. If she really doesn't wanna fuck me then fine, she can go on being sexless until she finds a way to meet her needs. I have to meet all of mine in that category and she has no interest in helping. But I've felt like an entire part of me, the part that likes the deep emotional connection formed from having loving, positive, and exciting sex with a partner has been shut down. A whole facet of my ability to be vulnerable has been told I'm not longer valid. I have such a little sex drive now. She wants me to be vulnerable every day and talk about issues relating to our future when because of this I don't always feel safe to talk about certain things because of how negatively this was handled. I know it may sound silly. And I want to clarify, I don't want sex in exchange for talking about my feelings. I have just felt so invalidated and hurt on a large front of my emotional identity that I don't know how to really open up safely the way she wants me to. When we've talked about this it always comes to her saying that I just want to get laid, when in actuality I don't want it anymore. I just want to feel I don't know, safe, wanted, cared for, validated. TL;DR: Lack of sex has shut down a part of our emotional connection. More so in the sense that I was forced to meet all my own needs and has made my needs in any regard feel invalidated. And I don't know how to move forward and give her the emotional depth she wants while feeling hurt."
226,vulnerability,sex,How do my partner [M24] and I [F24] get comfortable with putting things up our butts?,3,6u3ypx,https://www.reddit.com/r/sex/comments/6u3ypx/how_do_my_partner_m24_and_i_f24_get_comfortable/,2017-08-17 04:17:29,"This is a two part question, but any information or advice would be much appreciated. :) So I've been a long-time lurker of this subreddit for awhile now, and it has been AMAZING for our sex life. We've been essentially experiencing a sexual renaissance, and I have the people in this great community to thank for it! I'd very much like to keep the exploration going, but I have a few concerns about anal play. I want to work up to him having full on anal sex with me (his penis in my ass). And for right now, he's interested in fingers, butt plugs, and smaller toys going near him. I don't know if pegging is ever on the horizon, but I'd be more than willing to oblige if he's ever interested. However, we are both novices in this regard, and I think we both have some psychological blocks to overcome. As for me, I have tried anal sex ONCE and it was somewhat traumatizing. I was 16 and and how it went down was pretty much everything they say NOT to do with anal. My ex and I were in the shower, and it was very spontaneous (no preparation besides us washing ourselves in the shower). No build up with fingers, butt plugs, toys, NOTHING. And we never tried anything before, so it was just immediately a dick in my ass. No lube. Stupidly, I didn't even tell my partner to stop even though it hurt so bad, because I thought it would get better. NOPE. Here's the thing, I am fine with chalking up that experience as a lack of preparation, communication, education, and experience. I am definitely more educated about how to prepare for anal now (thankfully). However, I still can't get over the idea that it's going to hurt really badly. My ex had a below average to average sized penis. My partner on the other hand is about 7.5 inches and girthy as fuck, and needless to say I'm terrified. His dick feels incredible in my pussy (and mouth ;) ) but I'm scared that anal is going to hurt really badly. It's something I really want to try again. In five years, my partner hasn't even asked or seemed all that interested in anal until I expressed interest. He's concerned he will hurt me too. Recently, I also brought up that I was interested in playing with him in this regard. He was enthusiastic but a little hesitant as well. This weekend, I fingered and licked the outside of his asshole and even put a pinky in! WOO! As someone who is recovering from some obsessive-compulsive anxiety in regards to contamination and germs, this was a HUGE deal for me in that regard. My partner said he enjoyed the experience, but also seemed somewhat uncomfortable. I constantly checked in with him, to make sure everything was okay, and I think we did a good job communicating. I think the position of me licking him felt very vulnerable, and he's not used to being penetrated. When I put my pinky in him, he said he liked it but said he ""freaked out a bit"" and asked me to take it out. He said that it's ""something to get used to,"" but that he wants to try it again. I even saw him researching it a bit online. Anyway, the bottom line is that we both have certain psychological blocks that we need to overcome in order to really explore this. For me, the size of his dick is intimidating, and I'm afraid it will hurt really badly again. For him, I think he feels vulnerable. He's very secure in his masculinity, but I think the idea of being penetrated is a bit daunting. I would appreciate any advice about how each one of us can help overcome our psychological blocks. TLDR: How do I overcome my fear about my boyfriend's big dick hurting me during anal and my fear of anal in general? How can I help my boyfriend overcome the vulnerability of being penetrated?"
