,topic,subreddit,title,score,id,url,created,body
74,vulnerability,sex,"LDR boyfriend (29m) thought me (25f) saying before you met me, you probably werent into stinky feet in a past debate was backstabbing/a betrayal and randomly attacked me over it in a slightly irrelevant conversation. Did I break some kink code? Was I really stupid for breaking down over it?",1,e2a80o,https://www.reddit.com/r/sex/comments/e2a80o/ldr_boyfriend_29m_thought_me_25f_saying_before/,2019-11-27 14:53:06,"I didn't know it hurt him so much...I mean, he never said anything about it two weeks ago when we were having the argument. I was talking about sexual vulnerability about kinks that are kinda niche. Were in a LDR (never technically met irl) and I wanted to illustrate that I was a bit uncomfortable with fantasizing too much about something because I wasnt 100% sure hed be that into it in real (i.e., pee, feet), like he has said himselfneither of us have tried these before. I dont want my desire and yearning and anticipation for something to run into a huge brick wall; some things Im super confident about, but others? Im a bit hesitant of and Id like to wait for a green light before diving into them. And then he snapped at me for some reason, saying that he has to have some sort of backdoor for the number of times Ive backstabbed him. I was confused and reeling. I asked him what this wasand the only thing he said he could remember something he said that hurt his feelings a bit and felt like a side swipe. What it waswell. The context is when I was iffy on a certain fantasy he brought up (lets call it the Thing)I said noooo playfullywasnt that I wanted to shut him down but that I wasnt really in the mood for that thing in particular. Then he said stop appeasing all the time, and aggressively supported his point, implying that I was just pretending that I was into the Thing to placate him beforeand also said that we are just talking about hypotheticals and what we logically would be down for. Ironically he even said that hes not even sure he wants it, its a bit dirty (not THAT much but still) but somehow argued that it has to do with ruling passion. Or, likehaving a favorite food. Even if you hate it at the moment, you still logically know you have it. That was his argument. I broke down hard in tears because.well, I try to be a sincere person, being accused of just appeasing him facetiously and pretending to be into it when I fantasized about the subject before (btw I have said Im not that into it all the time and noooo about it before; really depends on my mood whether or not I ache for it) hurt so much. He only tried to make peace when said well, you are the most unique person Ive ever known, maybe you arent like the other people Ive known? And I was just trying to make a point that I didnt operate logically in terms of my desires/wants, while he was insisting that normal people dont rely on whimsical desire states to know what theyd be down for. So while I was breaking down like a baby I tried coming up with points. For example, before you met me, you werent into stinky feetyou arent sure how you feel about it yet. I know. Absolutely silly subject; he has never had a particular thing for it before but after a while with camming and giving suggestions about massaging feet and stuff, hes warmed up to it to where its now almost a kink (helps a lot that hes seen how ridiculously flexible these monsters are) and weve both warmed up to a bit. At the time I said it with a flair likeit better supported my argument that it was a niche thing and that hypothetically were not even sure how much well even be into it. This IS an online-only LDR for now. What weirds me out is that he even said, Well, its kind of hard to not be hurt when you say Im into sniffing rotting, disgusting feet. Its likewhat? I didnt say that! Stinky *can* be fun and fairly neutral; what I was TRYING to imply was that feet is preeeetty, uh*niche.* And that likewise, the stuff he was saying about it being his ruling passion was a bit wrong. Its not a big fetish of his, just something fun to fantasize about. Sorounding back to the conversation yesterday, again, he said he likes to keep a backdoor open because of all the times I backstabbed him. And I tried to defend myself, saying that I wasnt trying to sass him, that I actually genuinely love that he likes my feet so much  after all, its probably my worst feature and I have image issues  and cherish thisthat I wasnt intentionally trying to hurt him or demean him. He seems to really be sensitive to the idea of bad sass from me, though he cant seem to remember them outside of the very, very rare times weve had arguments. In the conversation he ended up saying stuff like I know you better than you know yourself, it seems. That you exploded is proof I am right, if you were right you would have just said I didnt mean it. It hurt a ton. I felt a bitcrazy honestly? Kept on questioning myself and likewise wondering ifwell, when I had said the stinky feet thing, I didnt feel mad or even bitter towards him, I was struggling and just trying to defend myself. I dont think lowly of the lowest limbs in my body, or even liking them as long as it isnt to the point of soliciting random people for picturesbut, he made me feel as if I secretly am some monster and very facetious in nature? That I do things to hurt him without realizing it? I broke down into sobs again and later on he also said that it was laughable that I was crying at this and that I should think of all the actual bad things people go through in the world. I meanI have only cried over him a few times over the past few months andreally nothing else. I am not that emotional of a person. So, there it is. I know this all sounds very stupid of me but, I mean, life can be pretty stupid sook, whatever. It was just quite scary to me that this came up so abruptly andat the bare minimumif it turns out I am wrong and I really was just trying to hurt him, I dont understand why hes conflating &gt;a) Us having a fun conversation about fantasies (while not really being horny) and me opening up about my vulnerabilities as the best context to attack me in; we were joking around just a minute before &gt; &gt;with &gt; &gt;b) Versus me being exasperated at being basically called insincere and sobbing and typing a stupid argument in frustration that ended up being a concealed swipe against him as being an equal playing space. Either ways, it feels bad to me. I think a part of his problem might be the concept of me doing these things and*not admittedly Im doing them on purpose?* Therefore, the insincerity hurts a lot more. But I dont know. I didnt feel angry at him, and Im wracking my feelings and my brain. I didn't want to hurt or demean his kink."
75,vulnerability,sex,"Deep emotional, almost spiritual connections impact sex and sexuality far more than I've ever heard about, and I've learned the hard way how bad it can be.",1,e2tr6v,https://www.reddit.com/r/sex/comments/e2tr6v/deep_emotional_almost_spiritual_connections/,2019-11-28 17:07:08,"Obviously, sex is nice. It's a good thing to be open about and sex of course can be anything between casual and a bond. Perhaps this is more my personal experience, but often so far sex for me is incredibly different based on the connection and situation. For context, I recently went through a breakup. I absolutely do not want this information getting out on anybody so I will use M for my ex girlfriend's name. I am an 18M and she is the same age, we dated nearly 2 years and it was the closest bond I ever had with somebody. She was my first and it didn't take long for sex and arousal to come naturally. I most certainly was not the best at it but we had our fun often. Then somewhat recently, nearly 2 months ago, she broke up with me. It was a huge blow, and the reasoning was...up for pondering, however my family mistreating her was the main cause. Anyways. About a month and half after the breakup, i reconnected with some old friends and ended up getting a friends with benefits situation with a girl we'll call H. Although I'm a very sexual person and enjoyed the act for what we could do, my arousal was extremely limited and I could not exactly... Get hard easily. It's been incredibly embarrassing! Luckily H has been kind and accepting or this would not have gone on. And although I'm not over the break up per se I wasn't thinking of M in the moments at all, but without what I once had I noticed am enormous difference in my performance. I've slowly improved, and mentally I'm perfectly fine with the fwb idea. But it's worth noting how difficult it became in the actual situation. Another thing to mention is how badly it's bothered me that M has done the same. Now, part of her breaking up with me was because she wanted to flirt around, I suppose. That is perfectly within her bounds as she never cheated, and I can go on about how much I hate that or how it affected me but ethically she didn't break any social contracts or whatever. M and I had a moment of vulnerability where we talked about our lives in excruciating detail recently, and I learned a lot about her regretting it and all that, but I also learned 2 weeks after the breakup she began a whole situation with someone older and say, much more experienced than me... I've slowly come to accept all that she said, but all the talk of her new sex life on top of her admitting he's better than me (I did kind of ask but I didn't expect that, I should have)...that has affected me most, emotionally, it seems. To think of someone else pleasing her and doing better. It makes me feel as if it feeling better for her and how easy it is for them means we didn't have that great a personal romantic bond anyways in the end. I'm not sure, I thought so but if it's beat that easily, yknow... I could be over thinking, but it's made me feel the most sick. The point of all this is that of all things our sexual/romantic relationship seems to have the most *emotional* bearing on me. I thought sex could be easier to use freely and not think so much of it in a relationship, but mentally my reaction is one thing, and my heart and sick stomach tells me much more. I now even struggle with masturbation, of all things. Do you have a similar story? What are your thoughts on the way it makes you feel? Feel free to vent, I want to support one another!"
76,vulnerability,sex,I (25/F) orgasmed to the thought of myself being almost sexually assaulted in the past,1,e6glc9,https://www.reddit.com/r/sex/comments/e6glc9/i_25f_orgasmed_to_the_thought_of_myself_being/,2019-12-05 23:36:02,"I can't normally orgasm unless I watch porn. I usually watch gangbangs, assault, abused type of porn because it turns me on as I see myself as the woman and like the vulnerability it shows. I used a vibrator and decided to use nothing but my mind but I went on for 20 mins barely feeling anything until I imagined when my bf almost sexually assaulted me when I lost my virginity, I got off at the thought of me crying and squirming and now I feel ashamed. He's changed a lot and has done anything like that since, he was deeply sorry and we worked through it together, I gave him a second chance. I haven't told my bf that I got off to that and now feel sick because it happened over 2 years ago yet was so vivid and I thought I forgot the image. Advice?"
77,vulnerability,sex,"Still a Virgin: Closeted Bisexual 20 Year-Old Male Trying to Get Comfortable With Intimacy Having a History of Molestation. Any Advice? (this is not supposed to be a sob story, just pragmatic advice please!)",1,dhlw5t,https://www.reddit.com/r/sex/comments/dhlw5t/still_a_virgin_closeted_bisexual_20_yearold_male/,2019-10-14 16:05:16,"Hi all, So I'm going to just lay it all out there (please bare with generic beta 20 year old male bs). Like many of you out there, I was molested intermittently by my dad and grandmother. I've mostly worked through that stuff as most of it stopped by the time I was around eight or nine, and I saw my grandmother less and the stuff that happened with my dad seemed to be more and more unreal as I got older and our relationship settled into a pretty neutral -- if distant -- one (I lived mostly with my mom). I don't know if it was my mom threatening prosecution on abuse charges or what but he's a completely different person now that he's remarried and had another kid, etc, and we're cool. It almost feels like all of that never happened. Every now and then the reality comes back to me though as it did the last time I went to try losing my virginity and ended up shutting down, trying not to completely lose my shit as I dissociated and tried not to be too cold with the girl, and evasively watching Friends with her on her laptop for an hour before going home to bawl my eyes out. I consider myself a pretty tough -- if somewhat metrosexual (closeted bi) -- guy, so this was terribly out of character for me as I never cry/chow vulnerability (even when alone) as a rule. I'm honestly not trying to make this out as some tumblr-esque self-validating sob story; there are loads of people who have had to deal with far more trauma-related situations and who come from far less privileged backgrounds. I am just wondering what practical advice all of you have for a dude whose 20, has never more than pecked a girl on the lips/made out with a dude as a kid, acts really confident (only three friends know I'm a virgin, and are suspicious of my sexuality), and desperately wants to stop the cycle of girls/guys-who-got-away? I guess this post is both a dating and a sex question, but momentarily intimacy alone seems to be the primary hurdle. It's gotten a lot better since I've discovered I'm a descent flirt with drugs/alcohol to gas me up, but even then I doubt I can go much further. I've never talked to anyone about this (except who my mom, who thinks my attraction to dudes is just a product of molestation/confusion, and refuses to accept it) and never would have thought I would turn to reddit. I guess I'm more desperate for some sort of connection than I thought. Pretty f\*\*\*ing alone tbh. Thanks again if you read all that without cringing and moving on with your day."
78,vulnerability,sex,"Just unexpectedly had my first pleasant and successful blowjob at the age of 37, following decades of disappointment",39,dko00e,https://www.reddit.com/r/sex/comments/dko00e/just_unexpectedly_had_my_first_pleasant_and/,2019-10-21 05:58:22,"TL;DR: I've had many attempted blowjobs but they were either all bad or felt like an obligatory 'necessary evil' for the giver, which always turned me off and I've never enjoyed one and I've never cum from one. Today all that changed. \--- Okay so I'm writing because my entire world view has just been turned upside down. Of course I grew up as a young guy learning about oral sex and blowjobs from magazines, and when I first started to get some sexual experience, either my partners were uncomfortable and inexperienced, or they felt like they ""had"" to do it out of a sense of obligation. Either way, it was always awkward and unfulfilling, and I never once was relaxed enough to actually cum. The few times somebody would try, I usually ended up telling them ""No, don't worry, you don't have to"" and doing something else instead. I had a couple of very long relationships with women who actively disliked giving or receiving oral sex which didn't help either; every experience in my life had told me that oral was hard to do, and that porn stars and online commenters were basically just exaggerating everything. Until today! A very dear friend had recently become a FWB and we were exploring each other. For various reasons, she is unable to have penetrative sex right now, so after a long night of kissing, touching, and fingering each other, she wanted to give me a blowjob instead. I was hesitant but just so horny that I said ""Okay, if that's what you want"" and she started but then hesitated. Obviously my lack of enthusiasm was showing through, and given the newness of our sexual encounter, it was putting her off. So we gave up on it and talked a little before going to sleep. During the talk, the subject of the oral sex came up, I told her about my disappointing past experiences, and she told me that she actively enjoyed giving blowjobs. The next morning we started fooling around again and she asked where I wanted to go with it. I suggested that we give it another try and after a moment's hesitation, to judge my intentions I suppose, well, she went for it. And it was amazing! She knew what to do and she did it well. I'm kind of embarrassed to say that between the horniness, and the excitement, and the lack of experience of having a very pleasant blowjob, I didn't last too long. She seemed a little disappointed that she didn't get to do it for longer, which was another upside-down; I'm used to the people who feel obligated, wanting to have it over and done with as quickly as possible. It was one of the things that put me off them in the first place. But I can't stop thinking about it! I've tried a bunch of positions and styles over the years and I thought nothing could beat good old fashioned PIV sex - and it's still my favorite - but wow, this is a close contender. I think I finally understand all the hype, as well as the change in dynamic (getting to lie back and enjoy it instead of working all the time was new for me, as well as the feeling of vulnerability and trust you need to have). I'm amazed and saddened that it's taken me so many years - decades! - to finally have a good experience here, but I'm at least glad that I finally did. So if you've lived your whole life thinking that one thing or another was bad - never give up! There's hope yet!"
79,vulnerability,sex,Anyone else relate? I just love eating a guys ass,13,dkyw8a,https://www.reddit.com/r/sex/comments/dkyw8a/anyone_else_relate_i_just_love_eating_a_guys_ass/,2019-10-21 22:05:24,"I (23F) first started tried eating ass when in a long term relationship - it took us a very long time to work up to it but I used to absolutely love being in complete control of his total pleasure and the taboo of it all. Im very much a pleaser in bed so its very enjoyable for me (plus I love being on the receiving end of it as well). After getting used to it now its really not a big deal at all to me and honestly I dont see a difference between sucking dick and eating ass as long as everything is clean (I know most people dont think this though hahah), its just another body part. Now that Im single, there is honestly nothing I love more than eating a guys ass during a blowjob even on a one night stand (always after a shower etc). More often than not its their first time, and their reactions are just so fucking hot to me. Obviously you can tell if theyre interested and I never ever try to make it happen if theyre not into it, but I honestly get off on their absolute vulnerability in that moment and watching them just lose their minds lol. Its like they dont know what to do with themselves. A few times theyve literally just turned over and completely spread for me, I fucking love it lol. I feel like Im very much in the minority here haha, does anyone else relate? I know a lot of people will find this gross but to me its really not a big deal at all. Also, guys what would you think if this happened to you on a one night stand? Its just on my mind because it happened with another guy just yesterday lol."
80,vulnerability,sex,My boyfriend wants me to be dominant and not only sexually but overall! Problem is that I am very meek and shy and I enjoyed being passive. What steps should I take to become new me? [M26/F27],2,doqbge,https://www.reddit.com/r/sex/comments/doqbge/my_boyfriend_wants_me_to_be_dominant_and_not_only/,2019-10-30 01:07:52,"To be clear I am totally willing to give this a serious try, we have been together for a half a year and knew each other for additional 6 months while we were single and he is pretty much the perfect boy. I enjoy his company. The thing is that I want this to succeed but I am not sure it will, but I want to! He is 3 inches shorter than me and has total feminine scrawny body so that probably plays in his overall personality. I weigh like 20 pounds more than him so that should help with body language and all that, one of the thing I need to work on. But how to make myself more confident? Should I read something or take some courses or what??? This things make me antsy but other stuff he wants sounds super adorable. Like he has 5 inch penis and wants me to make up my ex that had 7 inches fat fat fat cock so I can talk about my ex here and there when my bf gets tipsy (my first immediate reaction was 1. shit eating grin 2. saying: ""oooh there is nothing to make up babyboy!""(I lied) his facial reaction was PRICELESS (vulnerability, mindfuckery ""oooh do I really want this, well I guess I do"", so cute!) His big big eyes will be ideal for this lifestyle. Are there any shit tests or dry runs or quick tips I could get so I can start with this."
81,vulnerability,sex,Is it wrong for a 38 year old woman to have sex with a 24 year old man who has the mind of a child due to his mental disability,0,dpdv59,https://www.reddit.com/r/sex/comments/dpdv59/is_it_wrong_for_a_38_year_old_woman_to_have_sex/,2019-10-31 09:16:02,"And is it normal that she gets aroused by the control she has over him, his vulnerability and the fact that he's so sweet and innocent?"
82,vulnerability,sex,Has anyone else ever happy cried after sex?,2248,d70cur,https://www.reddit.com/r/sex/comments/d70cur/has_anyone_else_ever_happy_cried_after_sex/,2019-09-21 06:05:44,"Just read the recent post here about a woman crying after having awful sex with a guy who used her. It made me pretty sad reading it because I know how vulnerable we can feel as women during sex (not that men don't as well), and how hard it is to feel okay again once you know someone took advantage of that vulnerability and disrespected it. But still it reminded me of the only time I've ever happy cried after sex. I had only been with my SO for maybe two or three months, but I knew I was falling for him hard. While we were fucking one night, we were still experimenting and figuring out what we both liked. I was young and hadnt really tried any kinky shit yet, but when he gently put his hand around my throat and asked if that was okay, I could literally feel myself get like 10x wetter. I asked him to choke me harder. He did, and I started to cum almost immediately. It honestly may have been my first real, full body tingling kind of orgasm, and while I was cumming I was simultaneously realizing that I was deeply in love with him, that I had given him all my trust and vulnerability and he had given me back the most incredible feeling that a human being can experience. The tears started before I had even finished cumming. I was so filled with such extreme emotions, it took me a good minute to compose myself so I could assure him that they were not unhappy tears, and that I loved him, and that he had been the first and only person to show me just how close and connected you can feel to someone during sex. It's not just about cumming, it's about giving each other a special piece of yourselves and saying ""I absolutely trust you with this."" (sorry for the shitty format, did what I could on mobile)"
83,vulnerability,sex,An ode to the ass,4,d88seq,https://www.reddit.com/r/sex/comments/d88seq/an_ode_to_the_ass/,2019-09-24 02:21:30,Can we wax poetic about butts for a moment? I am so moved by the intimacy and vulnerability of butt stuff. The passion of pursuing pleasure where we've been taught shame and secrecy. I want to hear the flowery thoughts you have about it!
84,vulnerability,sex,I feel super hesitant to enjoy pegging [M 21],1,da2gwm,https://www.reddit.com/r/sex/comments/da2gwm/i_feel_super_hesitant_to_enjoy_pegging_m_21/,2019-09-28 02:02:01,"Hey guys, Ive only had a few girlfriends, and I mostly gravitate towards being a dom. Ive found the most sense of security in doing do, and I just enjoy that disposition. However, the idea of pegging really turns me on. I like the idea of my gf getting enjoyment out of my ass. She loves my butt and is always touching it non stop. She even said she wanted to peg me. But I just cant seem to trust it. I feel like getting pegged/showing a side of vulnerability, sexually speaking, could really fuck things up with how Im perceived. I like being the strong one, the dominator, protecter, provider... the man. I grew up in a very conservative and athletic area, so I have no doubt that my masculinity is a product of that. None of my friends practice BDSM or anything closely kinky. I feel like an idiot for liking sex too much sometimes and exploring monogamously. I fee like getting pegged would render me unlovable. Its so hard finding good pegging porn too. Im 21 and its seems that most people that peg are much older, so its hard for me to visualize pegging at my age. I just feel so young and attractive that I would rather try it now then when Im older. Not that its bad to get pegged at any age, but now seems like a good time. Any tips/insight/advice would be greatly appreciated. Tl;dr I feel super hesitant."
