,topic,subreddit,title,score,id,url,created,body
0,vulnerability,sex,How important is sex in a long term relationship? Should I loose my virginity to my boyfriend? Not sure if ready?,1,i3ikio,https://www.reddit.com/r/sex/comments/i3ikio/how_important_is_sex_in_a_long_term_relationship/,2020-08-04 22:38:54,"I am a 19yr old female virgin dating for 10 months a 22yr old male who is well experienced. Him and I get on great, we met on bumble and were like best friends have so much in common (both type 1 diabetics) and hes a very sweet caring guy with a big heart, very sympathetic and a good listener to my complaints. But recently hes brought up that he wants to be having sex as he sees it as an important aspect to a relationship, even though Ive said Im not ready and wont be for a while. (Weve has our fair share of make outs, grinding n feel ups, he likes to suck my nipples and I always feel him get a boner when were making out. Now ok there is one part of me that wants to be careful n responsible about sex. In that I definitely dont want to in the slightest get pregnant. I dont like how I might be judged by friends n (religious) family. But also for my own religious up brining, my own guilt and how I would be going against a relationship n faith tradition that I so important to me. I also want to make sure Im being valued for who I am n dont want to get hurt. We havent said even I love you yet, and hes not as affectionate n romantic as I would like him to be(I feel like I have settled a lot in this relationship) and hes also slightly hinted that he would break up with me if he has to wait more than another 6 months. So most people would say I should just breakup with him for kinda pressuring me alone. We also only see eachother one a week if that, he lives 30 mins away and we both have jobs. Id be scared for my own emotional vulnerability of being away from him (not a very good texter) But on the other hand I also kinda really want to have sex, Im a quite horny type of person. I am familiar and confident in my body, and how it finds pleasure. And I think Itd be fun enjoyable time! And from what weve done so far i think hed be pretty good! I also see how it would benefit the relationship adding in a further field of intimacy. A lot of posts on here just say go for it! And like yeah I agree I can understand sex to be such a fun adventure with your body. But I just cant get over the seriousness of the con list. And Im scared that one day Ill get caught up in my hornyness and just say fuck me! And wed do it and I have horrible regrets. How important is sex in a relationship? How would our relationship change?! Would it be a bad idea to tell him Im not having sex with you until you give me a serious commitment or say I love you? Is it bad or a turn off if I say that if he wants to have sex he has to step up more ie. flowers, romantic date ideas?! I really like him and having him in my life I thought I even loved him but his recent attitude got me questioning how I really feel. And now I just have conflicting sex ideas?!? HELLLPPPP!!"
1,vulnerability,sex,"After 22 years of trying, I hate sex",1,i4w4ko,https://www.reddit.com/r/sex/comments/i4w4ko/after_22_years_of_trying_i_hate_sex/,2020-08-07 03:30:30,"No, im not asexual. But lately ive been wanting to be celibate. Its not like ive ever been raped. Ive never really been assaulted besides a few slaps on the ass. One time a man even recorded me in public but I dont feel traumatized. I was chubby from a young (still am). &amp; on the internet from a young age. not a good combo. I remember the first time I took off my shirt on omegle. I was not of age. It felt wrong, but the attention felt good. I began to seek out older and older guys, because in my head, nobody my age could possibly be attracted to my body. Only dirty old men could find me attractive. Then i met a 25 year old. We exchanged skypes. He seemed nice. He was nice. In fact, had I not gotten older and realized he was probably a p*dophile I wouldnt have changed this opinion. but because he was a p*dophile I know now he didnt find me attractive, but found grooming me enticing. A guy from my highschool my age reached out to me. Ive later learned he had a fat fetish, revoking any pride I had of his attraction to me. We sent nudes and it was fun. It ended, because he got a girlfriend. 5 years later in my early twenties he tells me he still had them and will post them if I dont sleep with him. He saved my ugliest photos. I didnt feel attractive anymore. I got a boyfriend at 16. I was excited. but he rushed me, so many times. I dont think he was mean. But he slapped me on the face once after kissing me, something hed seen from porn. I had cried 30 min earlier. I felt degraded. When i lost my virginity to him, he was angry at the fact I couldnt get wet. All of my clothes were on. He left right after he came and made fun of me the rest of the day. We never had sex again. I had another hookup. Ghosted a week later. I had another boyfriend. It seemed like I could finally have a chance. It started out good, but he rushed me too. very much. Then he tried to eat me out when I begged him not to. Then he told me it grossed him out. He tried to put his dick in me once without me asking. The pain is indescribable. He tried to apologize but I still feel violated. I dont want to be angry at him but I dont know how to feel. I trembled when he took my clothes off. the first time he made me feel good. Then he told me he thought I was fat. told me how much more attractive porn stars amd girls he knew were. I know i was too big to him. He liked really skinny girls, &amp; im a curvier hourglass shape. I just wanted to feel cherished and small. He also got mad when we couldnt have sex. My vagina wont open. Its sharp pain. I cant have sex. We broke up and he told me how sexually unsatisfying I was. I tried my best. I tried really really hard. I got him off as much as i could, where he wanted me to get myself off for him so he could watch. Im single. I avoid intimate relationships now. every time i go on r/sex I cry. Lately i get panic attacks every night. Im too ugly to refuse sex if its offered, i should be grateful. But I cant do it. I cant. I sit in my bed alone and cry, mouthing to myself I cant do it. Im too ugly to cry though, i dont deserve to be upset. I was never raped. I was just insecure. Sex to me is abandonment, shame, pain. Failed vulnerability. I try to look for good guys. I fail. But I dont think its them anymore, i dont think im worthy. I cant have sex. I cant do it. The patience that would be required of a partner of mine would never be worth what ever little else I have to offer. I would cry so many times. Id be such a burden. I flinch at being touched. I would fail. In my normal life im not actually ugly. many people tell me im pretty. I get plenty of matches on dating apps when I bring myself to use them. Im curvier than I am fat. Im bubbly and intelligent and nice and busy. I dress femininely but stylish. I seem confident. Ive even been told I seem like I have a lot of sex. But im just leading people on. Nobody looks for a seemingly happy girl to be met with this mess. So i avoid dating to avoid sex. I cant do it. I dont know if ever will. I just wanted intimacy. After crying and trying for so many years I think i finally give up."
2,vulnerability,sex,"Disability &amp; Sexuality Part II: Sex, Dating, &amp; Partnerships",1,i5ve0i,https://www.reddit.com/r/sex/comments/i5ve0i/disability_sexuality_part_ii_sex_dating/,2020-08-08 17:53:21,"So my last post on the intersection of disability and sexuality had a ton of interaction, Im going take that as its a really well received topic, and needs expansion, so here I am again, and Id like to open the discussion on how it impacts our dating and sex lives. I find it to be a mixed bag. I have written another post on how there is limited support for disabled women in particular to find satisfaction in their sex lives. On the other hand, it has perhaps had a part in how adventurous I am. You should see my drawer: I am truly the woman who has everything. However, Ive found many spaces in my community literally inaccessible. From navigating the impossibility tightly packed throngs of pride goers, to a local kink group found via fetlife, where I had attempted to sign up for an introductory rope bondage class only to be met with multiple flights of stairs, even after verifying with the event organizers, as with life in general, I face barriers within my own sexuality. I believe this is a byproduct of a society that views disabled people as largely asexual. With regard to dating, I find it a bit more dismal. I think the sentiment is echoed by 20 something women everywhere, but I do think that disability definitely amplifies the experience. Im treated as something of a novelty: Ive had first dates ask me (in the middle of a coffeehouse no less) if I could have sex. Ive also unintentionally met fetishists who say things like Ive always wanted to fuck a girl in a wheelchair. When I ask about that, it seems the interest is generally underscored with ideas of my perceived vulnerability and/or helplessness. As a side note if thats your jam, I dont mean to discount it. Do you. I find it a bit uncomfortable personally, that other people may be turned on by how easily they suppose they could harm me, to the point that theyd publicly voice it to a near-stranger. Aside from that, I already feel as though people often dont recognize me as a person separate of my wheelchair, Id rather not deal with that from a partner. Ive also encountered the other end of things, where its treated as something that devalues and dehumanizes me. Too often Ive dated men (especially) who do the bare minimum, and should I address it, Im met with the attitude that I should take what I can get. Theres this attitude that I am damaged, and therefore disposable. Its toxic. Ive also been told that they cant handle me. Im a woman, not a zoo animal. Im a bit perplexed by this. There is nothing to handle. Im educated, Im a woman in STEM, I have no debt, Im independent, I have my own apartment, my own friends, my own life. Aside from a permanent condition, Im in good health, I work out, I take care of myself. At risk of sounding somewhere between I am woman, hear me roar &amp; having my head up my own ass: the life Ive built for myself is impressive for any 22 year old, and look at what Ive accomplished with major roadblocks. Id love to hear from other disabled women on how you navigate these aspects of your life."
3,vulnerability,sex,My partner &amp; I have polar opposite sexual expectations and it upsets him,1,i63nay,https://www.reddit.com/r/sex/comments/i63nay/my_partner_i_have_polar_opposite_sexual/,2020-08-09 04:03:20,"There's a lot to unpack here, and it's getting to a point where I just need to hear from a 3rd party. I (25F) have been dating my partner (26M) for 10 months now. For me in the past, it didn't matter who I was with, I always varied who I thought about during masturbation. Be that a past partner, someone I know but haven't had sex with (but want to), or even just a faceless partner (usually if I'm reading erotica and can't get a good visionary). I rarely, if ever, think about current partners when touching myself. That's how it's always been for me. A couple of months ago, I made the mistake of bringing it up to my current partner, wondering who he thinks of when he masturbates. We're in a relationship, not dead, and I always figured my thinking was normal (especially since others do it too). But for him, he thinks about me when he masturbates, consistently. With his past partners, he'd masturbate to the partner at the time. That's just how he is. So for him, he's hurt that I rarely think of him whenever I try to get off. We've already been struggling in our sex lives due to a number of reasons, the biggest ones being because we still live with our parents and the anxiety kills the mood for me, I don't physically lust over him, and our relationship had a rocky start. I am the kind of person that believes in communicating everything, and he is too. If there's a problem, it's brought up and talked out. But one of us always ends up getting hurt from this, especially if it's sexually related. My partner was the first to notice that my drive wasn't as high as I said it was when we first started talking. I told him it's hard to be turned on when my dad is in the next room - anxiety. But he kept egging at it. He felt insecure, that I wasn't physically attracted to him &amp; that I was making up lies as to why my drive is lower than advertised, thinking it's that I'm turned off by him. I'm not turned off by him in the slightest, though. It's that his physical features aren't why I want to have sex with him. I don't see him naked and think ""fuck me daddy"" I think ""this is the man I love."" It's the man he is, his personality and our relationship, that turns me on. For once in my life, my heart leads the sex, not my vagina. I've tried to explain this in the past, but he's really upset that his body isn't the reason I want to have sex with him. He's told me that he wants me to lust over his body as a reason why I want to have sex with him, and he feels insecure that it's not. It's a huge point of vulnerability for him that he's turned on by my body and thinks of me while he masturbates, but I'm not/don't. And I really don't know what to do to help soothe his insecurities, without him fretting that I'm putting on an act to make him feel better. I'd love to encourage for the both of us to see a couple's/sex therapist, but he's very much anti-therapist... Is there something I'm not seeing here? All I see is ""different strokes for different folks,"" but he's seeing that I don't want him. What can I do better to meet him in the middle?"
4,vulnerability,sex,23F and terrified to have sex.,1,i6lgjk,https://www.reddit.com/r/sex/comments/i6lgjk/23f_and_terrified_to_have_sex/,2020-08-10 01:45:06,"I havent had sex, and each year Im like, god I hope Im not a virgin at 21. This is the year, 22! Fuck, 23. Im so scared to have sex that Im scared to date. I dont date. And if the chance comes up, I push it away immediately. I literally have dreams where I keep making excuses for having sex. Its not sex specifically, but all the other stuff. Someone knowing you, vulnerability and whatever. Ive spoken to mental health professionals but they never seem to take it seriously. Whats most frustrating it doesnt match with who I am, if that makes sense. Im knowledgeable, feminist and sex positive, except that in front of friends Im embarrassed because I dont want to have the whole, yeah I havent had sex conversation. Having sex isnt the top of my priority list and Im not obsessing about it. My life is full in other ways, but Im worried its not that I dont care about it but its that Im terrified. Looking for advice and anyone with a similar experience?"
5,vulnerability,sex,I love eating pussy,1,i6rt2j,https://www.reddit.com/r/sex/comments/i6rt2j/i_love_eating_pussy/,2020-08-10 07:41:57,"First I have to admit that I may be pretty thirsty right now, as Im currently single and havent had sex since last November. However, I was inspired by the I love giving head post and wanted to express myself here. I LOVE eating pussy. I love the whole process, from slowly working my way down my partners body, lightly teasing her thighs with my tongue. I love the smell. I love the vulnerability and intimacy of having my lips and tongue playing with and exploring all the folds, tastes, and textures. I love finding a steady rhythm, sucking or licking her clit, feeling and hearing her pleasure slowly build. I feel like a lot of guys might look at going down on a woman as a chore or mere foreplay. But I feel like it can be the main event. I have found it to be an incredibly intimate and rewarding experience. I have the confidence now to say I am good at eating pussy. I dont always last long with PIV sex but I know I can always rely on oral sex to give my partner an orgasm. Sometimes it feels like a superpower. Anyway, to all the apprehensive pussy-eaters out there, I encourage you to eat more pussy, take your time, find enjoyment in giving your partner pleasure, and pro tip: if its working, do NOT stop doing it."
6,vulnerability,sex,"Post-sex thoughts and reflections ! Best sex ever, but still a sense of emptiness that comes along with hooking up",1,ibds38,https://www.reddit.com/r/sex/comments/ibds38/postsex_thoughts_and_reflections_best_sex_ever/,2020-08-17 23:05:53,"Family, we have to convene and I would love to hear everyones thoughts in my situation. I [23M] just had the best sex of my life. The best head of myself. Some sexy shit that I loved. He [29M] sucked my dick with so much passion and with a gentleness that I hadnt experience. He took his time. He has the softest of lips. The way his lips fit around my dick made me feel like it was made exactly for him. We exchanged the wettest of kisses. I started to eat his ass (yes, in the middle of a pandemic), he was so sensitive to everything. Every part of his body was so sensitive, including his nipples. We changed positions, allowing me to eat his ass while sucking my dick. He began to ride my face with his juicy asshole. He went back to sucking dick that led to him tasting a bit of my balls and my asshole. That was so sexy to me. Little did he know that I was verse and wanted his dick so badly inside of me too. We took a little break from the foreplay and decided to move into the penetration part of things. We mostly did different iterations doggy style I wanted to do more positions, but he said I was going to blow his back out The sexiest part to me was when he put on my fucking sandals to get a better grip to the floor, that shit was just so hot. I really want a boyfriend  we can fuck and wear each others sandals. Things with guy started off a bit shaky because I wanted to take it slow with a guy. But taking it slow didnt really translate well on our first date because I didnt speak about my intentions, but our first date was a hangout at his place, watching a movie. As per my therapists advice, nothing was sensual or sexual on that first night. My therapist wanted me to take things slow with a guy, but it just turned into me not being intimate with a person that I so desperately wanted to be intimate with. He said that he enjoyed the first date. So we texted the following days but fell out of contact. I was considered to be ghosted, but I chose to reach out and find out what happened. He said that he was waiting on me to initiate something. He thought that maybe I didnt like him because we didnt do anything intimate. PI told him that I was on best behavior. Which led to a string of messages basically intiating us fucking last night. It was so hot to hear him call my name and call me daddy even though there was an age difference. He is taller than me. He is older than me. He has larger hands than me. I feel like the ball is always in his court in terms of the moves. I think I have to take a more active role in the relationship. He has the apartment too. I just dont see a need for me in his life. Sometimes I feel inadequate when he takes a bit long to reply. Although I am verse, I chose to top him because I wanted to see him the submissive role. Its hot to me. I wanted him to scream my name for every unanswered text message. I wanted him to top me, but mentally it would destroy me because I dont want him to have a monopoly over my vulnerability and bottoming is when I feel most vulnerable. But I love a FLIP FUCK. Moral of the story: 1. CLOSED MOUTHS DO NOT GET FED. If I had not texted him, I would have never known how he felt about our original date. I wouldve simply felt like he ghosted me because I saw him hanging out with his friends (without inviting menot like I wanted to come but it would be nice to have the invitation) Maybe I need to work on incorporating the intimacy of a first date but without it incorporating sex? Im sure its possible in the gay community. Lack of sex doesnt equal lack of interest. Right now, I just want to relish in the great sex that I just experienced. I dont feel an emptiness, but I feel like I am growing feelings for this particular individual. How can this be happening and I just met Theo ? His social media has a CADRE of gay men liking and commenting on his photos. Its making me sad and a bit jealous. I just feel so disposable to him. I want to be his one and only fuck buddy. I have trust issues. What should I do ?!? Hes a good guy. Im not asking him to be completely emotionally available, but just give me a little bit more softness. Im finding that I have to be one to extend the olive branch and kind of reach out and chase him and gather his attention. I have never been in this position before and it stresses me out a bit."
7,vulnerability,sex,Need advice on getting basic experience as an older guy (23m),1,icc2xm,https://www.reddit.com/r/sex/comments/icc2xm/need_advice_on_getting_basic_experience_as_an/,2020-08-19 09:15:21,"Hey everyone, Im a 23 year old guy who has pretty limited experience with girls. I was popular throughout high school but rejected any advances as I wanted to wait until i was with a girl i liked and trusted. i realise now that is probably because of intimacy issues and i struggle with being vulnerable in front of others. When I was 16 i decided to kiss a girl at a party and felt extremely guilty afterwards, mainly because i felt like I had embarrassed myself and was just kinda ashamed. I decided that id go back to waiting until I was with a girl I liked. This is about the extent of my romantic experience. A few months later after this incident, and completely unrelated, I got hit with crazy mental health struggles and withdrew into myself, i had mad social anxiety and isolated myself for several years. I lost contact with all my friends and became a bit of a loner. I missed so many important milestones which has left me at 23 with no real romantic/sexual experience. I am now in a better position than I have been mentally, but still kinda fragile with vulnerability issues. Im still kinda socially anxious but not particularly awkward, i always had good social skills but im just out of practise and a bit quieter. Im quite a decent looking guy and can carry myself well so people would never really assume this about me unless you knew me really well, which makes things a little more difficult. I pretty much have no clue on how to go about getting experience at this age. I think waiting is no longer an option and even if I did meet someone, my lack of experience could ruin things anyway which is completely understandable from their point of view. Ive got a bit of a baby face so thought about going away for a weekend clubbing and pretending I was younger than I am for a one night stand, just so the girl wouldn't expect much in bed. I thought about trying tinder, but coming from a small town, its likely that any girl id meet up with would have a mutual friend/acquaintance and id be devastated if people found out im a virgin. I just know that it seems near impossible for me to be THAT vulnerable with another person, but i guess it will keep getting more and more difficult the longer i wait. I have made contact with 1 or 2 old friends so Im just trying to get out a bit more to build my confidence, but im struggling to meet new people as it is. Any advice would be amazing, thanks "
