,topic,subreddit,title,score,id,url,created,body
145,vulnerability,sex,"People who have contracted an STD, how did you find out that you had one and how has it affected your sex life?",1,aff69p,https://www.reddit.com/r/sex/comments/aff69p/people_who_have_contracted_an_std_how_did_you/,2019-01-13 14:16:22,"First off, would like to say if you are commenting, I am very appreciative of your vulnerability and willingness to speak on something so sensitive. I just wanted to see the perspective of people who have them, and just show support for you guys. Appreciate all of yall"
146,vulnerability,sex,SO has unusual turn-ons,1,afu3yt,https://www.reddit.com/r/sex/comments/afu3yt/so_has_unusual_turnons/,2019-01-14 20:18:43,"Hi r/sex! I (31f) recently started dating someone new (40m). We're very alike in nearly every way, and things are great both in and out of bed! We were having a casual conversation about things we do and don't like in bed and what turns us on, and yet again I was pleased and astounded by how compatible we are. There are 2 things he mentioned that I don't know what to do with, and I'd like advice on how to approach them. The first thing he mentioned was that crying turns him on. I'm not weirded out or anything, and he didn't act like it is super important for him, just a quirk. Neither of us is into any kind of roll play or acting, so my only thought of how I can integrate this is to ""use him"" (in a positive way!). I have anxiety issues that aren't completely handled with my medication. When it gets overwhelming (rarely, maybe once every few months) I tend to go full recluse and ride it out alone until I'm functional again- I hate emoting with witnesses. I have an intense connection with him though, and I might be able to work myself up to sharing that vulnerability with him when it arises. I will get physical comfort and a surge of feel-good hormones (hopefully... admittedly I've never tried this strategy before), and can low-key fulfill that fetish for him. I'd love feedback from someone who shares this proclivity with him... do you think this would satisfy that part of him? If not, any other suggestions? I'm not a crier in general, so that's about the only thing I can think of. The second thing he mentioned was that he'd find it extremely hot if I were to be a total bitch to someone in public (server, bartender, ticket seller, whatever). I'm the kind of person who will do absolutely ANYTHING in my power to keep others from feeling uncomfortable or hurt, so I feel like this one is completely outside my wheelhouse. He's also super polite and kind to strangers so I'm sure he would try to undo any damage haha... but still don't think I could do it. Any suggestions as to how I could pull this off? Thank you for any advice/ suggestions! Tl;dr: SO expressed sexual interest in seeing me cry and seeing me be rude in public, need help integrating into real life."
147,vulnerability,sex,Im [f23] starting to feel unsatisfied. My SO [M29] doesnt want to explore my kink with me.,1,agovc4,https://www.reddit.com/r/sex/comments/agovc4/im_f23_starting_to_feel_unsatisfied_my_so_m29/,2019-01-17 06:42:08,"Ive been with my SO for 2 years, he never wants to play into my kink which I think is because hes just a sweetheart and doesnt want to hurt me. Im starting to feel sexually frustrated, stressed and unsatisfied. My kink is CNC (consensual non-consent) play. Basically rough struggle fucking. He says he can not because it doesnt feel right and it seems rape-y even after I told him its okay and that this is what really gets me off. I enjoy being in complete submission and complete vulnerability. Ive been bringing it up with him at least once a month since weve been together, at first he said he would like to try it with me and we even discuss safe words and verbal consent is given but after that he never attempts. I even tell him we can start off slow and he can just try to be a little rough with me and maybe hold me down. When I bring it up to him he just says sorry. Its gotten to the point that Im starting to fantasize late at night and even dream about someone else doing that to me. Im unsatisfied. And it makes me feel terrible that Im thinking of other people who are not my SO because I love him so much. I dont know what to do anymore since talking to him doesnt help advance things. "
148,vulnerability,sex,Sex workers challenge prostitution law on constitutional ground.,1,ajgrw1,https://www.reddit.com/r/sex/comments/ajgrw1/sex_workers_challenge_prostitution_law_on/,2019-01-25 07:38:14,"French sex workers are finally challenging the nordic model regulation ( making selling sex legal but buying illegal) of sex work in France. My question is does receiving compensation or things of value in exchange of sex automatically make all sex for pay exploitative and without autonomous consent? Why do some cases of forced prostitution justify the ban on all forms of prostitution / escorting/ pro domming ? I can't help but to think it is small group of moral based group or anti-sex work/ anti-porn feminists pushing their agendas to control the sexual behavior of all of us. &amp;#x200B; [URL &amp;#x200B; Paris (AFP) French sex workers have lodged a constitutional challenge to a 2016 law making it illegal to pay for sex, reopening a debate on whether women should be free to sell their bodies. On Tuesday, around 30 sex workers backed by nine associations, including a medical NGO, went to the Constitutional Council to argue the law infringed their sexual and commercial freedom and made them more vulnerable to attack. The law, which punishes people caught paying for sex with fines of up to 1,500 euros ($1,800) for first-time offenders and 3,750 euros for repeat offenders, took years to make its way through parliament after fierce debate. Inspired by Sweden, it makes it a crime to buy sex but not to sell it, shifting the criminal responsibility to clients. Hailed by many feminist groups at the time as an advance for women's rights, the law was assailed by sex workers as an infringement of ""constitutional rights to personal autonomy and sexual freedom, respect of privacy, freedom of contract and freedom to do business."" The sex workers also argued that by criminalising their clients the law has eroded their earnings, forcing them to take ever greater risks to earn a living. These include agreeing to engage in unprotected sex or to have sex in isolated environments where they are more vulnerable to attack. In August a Peruvian transgender sex worker, Vanesa Campos, was killed in the forested Bois de Boulogne park west of Paris. She was shot dead while trying to stop a group of men robbing a client. ""It's the client who dictates his conditions and we have no choice because we have fewer clients than before but still as many bills at the end of the month,"" one sex worker, who gave her name as Anais, told AFP after Tuesday's hearing. \- 'Schizophrenic situation' - Many rights groups argue women do not engage in prostitution freely but are forced to do so by hardship or other circumstances. They accuse clients of exploiting their vulnerability. Issuing a robust defence Wednesday of the law, France's High Council for Equality Between Men and Women argued prostitution was ""the opposite of sexual liberation"" and ""oppresses all women"" by enshrining the notion of male domination. The council pointed to a poll showing that 78 percent of French supported the ban as proof of widespread support. ""We don't want a society where it is possible to buy someone else's dignity,"" a lawyer for the abolitionist camp, Cedric Uzan-Sarano, argued before the Constitutional Council. But a lawyer for the sex workers' camp, Patrice Spinosi, countered that by making it a crime to buy sex but not to sell it the state had created a ""schizophrenic"" situation and ""infantilised prostitutes."" ""Who are you to forbid me from doing what I want with my body?"" he asked. The Constitutional Council will publish its decision on whether the law is compatible with France's basic charter on February 1.  2019 AFP"
149,vulnerability,sex,"Yesterday, I made love for the first time.",1,an94j3,https://www.reddit.com/r/sex/comments/an94j3/yesterday_i_made_love_for_the_first_time/,2019-02-05 12:50:45,"I've had plenty of sex in my lifetime: rough, kinky, angry, quickies, you name it. But intimate sex-- intimacy? It makes me nervous. I have struggled with emotional vulnerability and affection for years. Fucking is the closest I can allow myself to get to someone. Yesterday, however, something happened. Whilst in the middle of a particularly steamy session with the SO, he stopped abruptly, stared deeply into my eyes and my very soul, and just said: ""I don't want to just fuck anymore. I want to make love to you. You're not just anyone to me. I want to grow old with you"". He kissed my forehead and held me for a long time, while I tried to understand the sudden warm feeling on my chest, the stupid smile on my face, and then, the tears. It really felt like he could see right though me at that moment. Sex afterwards felt like the first time. I've had lots of it in my lifetime, yes, but this felt...strangely right? Everything feels so new to me! We made love for the first time yesterday. And for the first time ever, I felt at home. "
150,vulnerability,sex,Do you find Marilyn Monroe's personality sexually attractive?,1,ana6ny,https://www.reddit.com/r/sex/comments/ana6ny/do_you_find_marilyn_monroes_personality_sexually/,2019-02-05 14:51:16," Do you find Marilyn Monroe's personality attractive? Many Men (in the past anyways) tended to be so attracted to her vulnerability, ditzy/air-head behavior, vulnerability, sweet-nature, dramatic, doing silly/dumb things, submissive and child-like behavior. Why do you think these men liked her ditziness and how she would do silly/dumb things? Do you find her personality and behavior attractive? Here are example of her behavior: [URL"
151,vulnerability,sex,(f18) Kind of confused about what happened,1,anf42b,https://www.reddit.com/r/sex/comments/anf42b/f18_kind_of_confused_about_what_happened/,2019-02-06 02:23:31,"Ive developed this relationship with a great guy recently. It started off with us having really good sex a couple times and then me just not giving him any attention or effort (ive never been in a relationship, so true affection scares me.) Weeks later, he pours his heart to me and tells me Im hurting him with the games I play. While really putting me in my place, in a sad yet angry tone, it turned me on so much. Physically and mentally. We both were so excited to have sex that night, I mean the sexual and emotional tension was blowing through the roof. We got into it and about 6-8 mins in, my partner (18m) becomes flaccid. I realize hes having issues. He gets flustered and sort of pissed and begins to aggressively finger me- which begins to really really hurt. Because ive really only had sex with 3 guys, it was so hard for me to communicate my pain and tell him to stop so I begin to dry up. We kind of laughed it off, and said theres no rush we could literally get back into it anytime. So about an hour later, things heat up and we begin to have sex again. Its going really really good, until 15 mins into it he becomes flaccid again, where I just decided to finish him off orally. This is the first time we have had sex in over a month, and the one time where we actually showed feelings and vulnerability to one another, the sex was just not there. Im so confused and cant stop thinking about it. Why was the sex so good when it was sort of meaningless for me but now that we actually opened up to each other about one anothers feelings, the sex was just not there. Advice anyone "
152,vulnerability,sex,how to overcome sexual anxiety stemming from childhood abuse?,1,aoe6sk,https://www.reddit.com/r/sex/comments/aoe6sk/how_to_overcome_sexual_anxiety_stemming_from/,2019-02-08 18:28:58,"Hi! Im a 21 year old college student and for the last 3 years ive been single. My last relationship didnt end well and so I took some me time and while I am interested in dating again, Im hesitant to do so because I suffer from pretty bad sexual anxiety. Ive had boyfriends and was able to fool around just fine in my early teens but intercourse has continued to be an issue for me and I dont have fun with it for long before my emotions get the best of me. I use to think it was just a matter of me getting comfortable with someone, but Ive realized its much bigger than that and even when Im comfortable with my partner, its very hard for me to remain calm when engaging (internally) and so I begin to disassociate and experience discomfort. These feelings have hindered me from indulging in an aspect of my life I would like to enjoy but its filled with so much guilt, fear and vulnerability that I cant enjoy the act, not even with myself at times. I am in therapy for unrelated reasons so its hard mentioning it during sections but it is something Id like to resolve. I like to think the abuse hasnt had much of an effect on me, but it seems like it has given the circumstances. "
153,vulnerability,sex,Fetishes in relationships,1,aaysuy,https://www.reddit.com/r/sex/comments/aaysuy/fetishes_in_relationships/,2018-12-31 06:19:45,"I found out my boyfriend has a panty fetish a few months ago where he likes to wear womens panties and occasionally bras for a sexual turn on. He said what turns him on is the taboo and vulnerability of it. I asked him if he ever questioned his sexuality or sexual identity and he said no. Today I was snooping in his room and found some Womens clothes, including leggings that were recently worn because they were in his hamper, bikini shaving cream, make up, and a drawer full of sex toys including a flesh light, gags, nipple clamps , and whips. I dont know if I should be concerned or have a conversation with him about it. I knew about his toys but he has never tried to use them with me which also bothers me a little "
154,vulnerability,sex,"28m, sexting and experiencing a lot of emotional vulnerability",1,aba0xh,https://www.reddit.com/r/sex/comments/aba0xh/28m_sexting_and_experiencing_a_lot_of_emotional/,2019-01-01 05:55:22,"About 2 weeks ago, I responded to a GW redditor and it turned into a full on sexting exchange. After that first conversation, we made small talk and then recently had another sexting conversation that started off more raunchy and ended what felt very intimate. What's odd is that I didn't realize how vulnerable and intimacy you can experience through sexting. I get excited to speak to this person I've never met in person and I care about them. I'm not sure if I'm developing feelings of some kind or I'm over thinking things. I guess another thing in worried about is how much self disclosure is safe whether it's info or a picture of myself. I'd hate to not match up to whatever fantasy they've created of me. I'd love to hear others thoughts or if you've had similar experiences."
155,vulnerability,sex,Wish we lived in a sex positive culture like the Mangaian people of the Cooke Islands,1,acibsi,https://www.reddit.com/r/sex/comments/acibsi/wish_we_lived_in_a_sex_positive_culture_like_the/,2019-01-05 00:50:03,"I'm a 25 yo heterosexual male and I've never had sex or been in any kind of romantic relationship. I don't mind that I've never had sex, and ""losing"" my virginity isn't really a priority for me, but I do wish sex was a much more open &amp; accessible topic in western culture. Recently I learned about the most sexually liberated culture in the world, the Mangaian people, and one aspect of their culture that I found especially interesting is how they address sex education &amp; sexual relationships, especially the concept of sexual mentors, who tutor maturing pubescent members of the tribe in the art of sexually pleasuring a partner. I know that for myself, I would really appreciate having access to resources like this when it comes to sex education. Some background: I grew up in a very dysfunctional family, and a major issue growing up was the total lack of communication. As such, personal feelings and issues were never discussed freely, especially such a taboo subject as sex. Literally the closest thing I've ever had to the sex talk was my dad asking me, ""do you want to know how it works? No? Okay..."" and my mom screaming at me when she caught me jerking off to porn in high school that sex was nothing more interesting than **""a lock and key, that's it! Nothing more!!""**. Good times. So you can understand my curiosity on the subject, and despite growing up in a repressed household, I strongly believe that sex is a crucial part of a person's emotional &amp; psychological growth &amp; health, not to mention physical. If only more safe spaces were available to people like me who sincerely wish to learn about &amp; experience sex in a controlled, safe &amp; educational environment, especially better, more comprehensive and actually helpful sex education in schools for kids so that people never have to end up in a situation like mine in the first place, with zero support to explore &amp; educate themselves about a perfectly natural, healthy activity &amp; become well balanced, mature members of society. So many issues like sexual violence, unplanned pregnancies, STDS, injuries, toxic relationships, etc. can be so much better prevented through education programs that teach better sex instead of just abstinence &amp; fear &amp; shame. We place so much emphasis on physical health that other equally crucial medical areas like mental health &amp; sexual health take back seats to gym memberships, personal trainers, massage therapists, chiropractors, nutritionists &amp; diets. If an adult in my position wants to experience and learn about healthy, safe sex first hand, there's way too few options that don't involve unsafe, even dangerous levels of risk to my health, and youtube videos &amp; articles can only offer so much guidance. So the idea of sex professionals, therapists, educators, mentors, etc. is much more preferable to the idea of trusting strangers or investing in a relationship just to exercise my right to explore my sexuality in a safe, healthy and appropriate way without shame or stigma. I am still a sexual being regardless of how sexually active I chose to be or not be, and repression of any of our natural drives is never healthy. I am tired of denying the parts of myself that have been shamed by society as taboo, emotionally as well as sexually. I am tired of choosing repression over vulnerability and denying myself permission to be myself in all aspects of my being. We don't have to be in love or in.comitted relationships to explore sex &amp; relationships, and neither do we have to live with the risk of unnecessary exposure &amp; harm or lack of a proper support system to help us in this crucial area of our development as thinking, feeling, self aware beings. What are you thoughts on a more sex positive culture? What are some of your experiences that could have been improved by or prevented with the help of better education/resources/support? What options are out there for people like me who wish to but may not have the necessary means or support to experience, learn about &amp; explore sex? "
156,vulnerability,sex,21 year old virgin woman.,1,acqy03,https://www.reddit.com/r/sex/comments/acqy03/21_year_old_virgin_woman/,2019-01-05 15:57:57,"I'm at a weird place with this. I'm not really ashamed for being a virgin still anymore, I used to be in high school because I knew a good fair amount of peers who weren't. And a couple who lost it when they were young (consensually, and I don't envy them). I knew a teen mom as well. But when its come up in conversation, and this may come off as rude, particularly with men, I was always asked ""why?"" I would say: ""I'm not comfortable,"" or ""I'm waiting for marriage."" Or ""I'm just not ready"". Even at 16 years old, when I would say this, their responses made me feel like I was... weird. I still get that at 21. I feel like maybe I have to justify why I'm a virgin or something, but that could be my head talking there. Sex often times disgusts me. I masturbate, I have a sex drive and all. I look at my body and think no one would ever want to see it, even when I lose weight, and I don't shave down there. I've seen comments on porn videos of people being disgusted by seeing a womans groin, or ass, naturally. Which, I get, it isn't always pretty to look at sometimes, and everyone has preferences but it still, I guess, bothers me. And then there's knowing, in sex, you're naked. Your s/o sees EVERYTHING and that scares me. That level of vulnerability honestly frightens me. I guess I'm just wondering if this is normal, to be 21, a virgin, never had an s/o.. I'm as inexperienced as it gets. Am I a prude or something else? Sorry for the ramble! TL;DR: Is it weird to be 21 years old and still a virgin?"
157,vulnerability,sex,Oral sex,1,9z95hn,https://www.reddit.com/r/sex/comments/9z95hn/oral_sex/,2018-11-22 11:44:42,"im a girl, and ive always found the idea of girls receiving oral sex really fascinating. when i watched porn or read dirty books when i was younger and it talked, in a lot of detail, about the girl receiving oral, i found it so hot. especially when it talks about it going on for a very long time. I dont know exactly what arouses me so much about it. reading about/watching other types of sex is actually a bit boring. i guess its the vulnerability involved idk? any theories? "
158,vulnerability,sex,How do I seduce an awkward-about-sex man in conversation until we get some alone time?,1,9znmb5,https://www.reddit.com/r/sex/comments/9znmb5/how_do_i_seduce_an_awkwardaboutsex_man_in/,2018-11-23 22:43:08,"I've been dating this guy for about 5 months and it's going great. I've not had a lot of time alone with him because we both live with our parents, but I'm planning on booking us a hotel for the weekend in a nearby city just before Christmas if our schedules align. He's not very good expressing his emotions or showing any kind of vulnerability, e.g. how he's feeling, has never complimented me, etc. I had to do a lot of guesswork in the early days depending on his texts/ voice/ actions. The big issue is that he's also not expressed vocally/ physically anything even vaguely sexual. The most that we have done so far is made out, mostly because I started it. I'm a virgin and have been patient so far knowing that he's needed the time to get to know me to start feeling more comfortable opening up, however now more than anything I just really want to rip his pants off, kneel down and watch him lose his mind as I blow him (I've been told in the past that I'm quite good but I want to be the best and I want to learn how to incorporate more balls action). It's driving me crazy, and I know that we probably won't get any alone time until the city trip. In the meantime, how do I go about start slowly incorporating some sexy lingo in the conversations to let him know that I'm more than ready for it when he is and start seducing/ teasing/ getting him excited for it? The only thing I can think of is that I know he gets stressed with his studies and work, saying ""I know a very good way to help you relax"" and leading from there but I know that we won't get a chance to act on it. Tl;dr My boyfriend hasn't talked/ hinted about us having sex yet because I think he's a bit awkward about it. How do I start seducing him/ making him more comfortable about talking about it until we get some alone time?"
