,topic,subreddit,title,score,id,url,created,body
107,vulnerability,socialskills,Mastering Social: Stage 4 - Make People Feel Important,1,9kxfi2,https://www.reddit.com/r/socialskills/comments/9kxfi2/mastering_social_stage_4_make_people_feel/,2018-10-03 13:07:23," # Introduction And we're back! If you've mastered the [previous stage](URL you're in a great place: you can make yourself, and people who share a similar taste of humor with you, laugh! But more importantly, laughter isn't just about feeling good. Laughter is our first sign that someone is *compatible* with us--that someone can be our friend. While the previous stage allowed us to find potential friends by showing us who we are compatible with, this stage will bridge the gap to actually forming meaningful friendships. &amp;#x200B; # Make People Feel Important The fourth stage is all about making people feel important. Before we get into what that means, lets call back to an important lesson from stage 3: mastering social isnt about making everyone like you. In fact, mastering social is more about developing the skills needed to find your people: your friends, close friends, best friends, and lovers. Keeping that in mind, making people feel important is a very intentional process that can only be effective if its genuine. How do make this process genuine? By only attempting to make people who you want to be friends with (and more) feel important. Given that we mastered stage 3, we now have a pool of people who we genuinely know we want to be friends with. There are two types of skills we need to master to make people feel important. The first type of skill is the passive one, the one which can technically be applied to everyone, not just the people you want to be friends with. This involves working on your importance quirk. The second skill requires learning how to effectively give your time to someone. Giving your time (effectively!) is the single most important thing you can do towards making someone feel important. Thats another reason I stressed earlier that you shouldnt try make everyone feel important. Your time is a finite resource and you should only invest it in people who you actually like to be around. ***You will have mastered this stage when you feel content with the quality and quantity of friends you have****. As a baseline if youre unsure, aim to have 5 friends. You can measure quality by seeing how often they hit you up versus how often you hit them up.* &amp;#x200B; **Developing an Importance Quirk** Remember back in stage 2 how we worked on finding our fault? In many ways this was like finding a vulnerability quirk. In this stage, well work on finding and using an importance quirk. The same way our fault from stage two is an authentic way of making someone feel comfortable around you, an importance quirk is an authentic way of making people feel important around you. One example is that person that never forgets peoples names. When they see you, they instantly call you by your name. However, this importance quirk should only be reserved for people with great memory. Oftentimes, self-help books say that you \*need\* to learn how to memorize peoples names as that will yield you great social gains. However, what these books fail to realize is that there are many ways you can make someone feel important, and its not worth it to try to force yourself to learn peoples names if thats not something thats not already natural to who you are. If your memory sucks, dont work towards this quirk. Another example is the person with the amazing laughits almost as if when they laugh you feel like youre the funniest person in the world. This should again be something natural; if you have a pretty good laugh then it makes sense to work on it and really make it full. But if you have a funny laugh (I.e. that was your vulnerability quirk) then dont waste time trying to make it your importance quirk! The ingredients to having a good importance quirk is 1) something that you have a natural affinity for and 2) something that makes someone feel special and/or unique. Notice how in the name example the person feels special because their name is remembered, or in the laughter example the person feels important because they think theyre the funniest person around. Use this to craft your importance quirk, and from there practice using it by trying to insert it at least once in every conversation. Here are a couple more examples to get your mind thinking: 1. The Smile Quirk - This is the person that has that super warm smile that makes you feel like they just really like you. Develop this quirk if, after stage 2, you found that you have a natural resting smile. 2. The Connections Quirk - This is the person that is always able to connect people. Develop this quirk if youre in a position that affords you the opportunity to know a lot of people. It really makes someone feel important when you can connect them with someone thats relevant to their current issues in life, I.e. I know the perfect investor that would love to invest in your tech startup idea, Ill get you all connected. &amp;#x200B; **Effectively Giving Your Time** The second part of learning how to make people feel important is effectively giving your time to someone. To begin, lets understand what I mean by effectively. To effectively give your time to someone, you must give someone value each time you give them your time. Therefore, your time is always valuable. What do I mean by value? Value is a term which we will come back to a lot as we move forward with this series. I define value (within a social context) as something that directly or indirectly helps someone gain status and acceptance within a social heiarchy. This is best understood through examples. For a first example, lets think back to stage 1 where we learned about making endless conversation. Were there any topics that got really deep with this potential new friend? Did you guys really bond over e-sports? Fashion? Lets call one of those deep mutual conversation threads a **common topic**. Knowing the common topics of your potential friend is a great example of giving someone value. When you see said person, bring up that topic again. Given that you are immersed in that space, for example e-sports, there is probably new information that you learned that you can share with your potential friend. This is **valuable** because that person now has more information to navigate that space. Lets say you told them that there is a huge e-sports competition in a month. That gives them a chance to sign up and potentially win, which would be boost their status and acceptance in the e-sports social hierarchy. Thus common topics provide a great avenue to give value to someone. Laughter is another example of giving value. Fortunately for us, we mastered humor in stage 3, thus we should able to make this person laugh. Why is laughter valuable given the definition of value we provided earlier? Well, we kind of got into this already. Laughter is a sign of compatibility. If you make someone laugh, they realize theyre compatible with you and thus are accepted by you. Therefore in the grand scheme of things where you two are one social hierarchy they have gained status and acceptance in that small social hierarchy. They also realize through you they can probably gain more compatible and like-minded friends. The examples above are two of potentially many ways that you can give value to someone. It ultimately boils down to finding the social hierarchies your potential friend cares about and finding ways to advance them in that hierarchy. Furthermore, this is a proactive step. You must go out of your way to make time for this person: lunches, dinners, hanging out, etc. but make sure you have something valuable to give every time you meet. Whats wrong with time thats not valuable? You know that friend that just wants to chill but nothing ever really comes out of the hangout session? No laughter, no anything? Thats frusturating because you could have been gaining value in other ways. Dont be that friend. Always embed your time with value and invest it proactively in the right people. &amp;#x200B; # Side Piece: Making Conversations more Enjoyable *Aside: This section is not necessary for mastering stage 4.* We'll continue finding more ways to make conversations more enjoyable. This time, we'll talk briefly about conversation exit strategy. There will be times when you will need to exit a conversation. Here a few potential reasons: 1) youre at a networking event and you need to meet as many people as possible, 2) the person youre talking with is terribly incompatible with you, 3) youre at an event such as a concert where conversation is not ideal. First and foremost, make sure the current conversation thread is done. If it seems like it could go on for a while, provide a closing statement. For example, lets say youre talking about tennis and you all got into a flow of mentioning your favorite players. Close it by stating Yeah, I love talking about my favorite tennis players. Thats it, the formula is simply sitting back almost as if youre introspecting, and say that you love talking about conversation topic XYZ. This should effectively close the thread and will leave a brief enough pause to get into the next part of our strategy. The next part is providing a reason to stop talking. If the situation allows it you can be blunt: it was great meeting you, Im gonna go meet some other people. This is a great line for a networking-type event where its expected that youll meet a lot of people. Another reason is to say you need to go do something: get a drink, use the bathroom, etc. These are socially acceptable reasons for ending a conversation. Finally, if none of the above is possible, change the center of focus. For example, if you were at the concert, make an observation about the band thats playing and start focusing intently on them. The person youre conversing with will get the idea. &amp;#x200B; # Conclusion That wraps up this stage. I'm considering writing an e-book that goes in more depth on each article and provides more examples. These articles can only contain so much at the end of the day. If people are interested in this, please leave a comment or send me a personal message. Furthermore, for the eager wondering what is coming next here is a breakdown of all the stages: [Stage 1: Make People Talk](URL [Stage 2: Make People Feel at Ease](URL *Milestone Reached: Can be a favorable acquaintance with virtually everyone* [Stage 3: Make People Laugh](URL *Stage 4: Make People Feel Important (That's this article!)* *Milestone Reached: Can identify and attract friends* Stage 5: Make People Feel a Part of Something Great Stage 6: Make People Respect You *Milestone Reached: Can identify and attract close friends* Stage 7: Make People Love You *Milestone Reached: Can identify and attract best friends and lovers* Until next time!"
108,vulnerability,socialskills,Help! Shaking off bad parenting as an adult.,1,9lx1fd,https://www.reddit.com/r/socialskills/comments/9lx1fd/help_shaking_off_bad_parenting_as_an_adult/,2018-10-07 03:03:01,"At 30yrs I finally realized why I think the way I do, and why I struggle with forming relationships and being close to people. I was raised by a family whose motto could easily be summarized as""stick your neck out for no one, not even blood. And when you you do, make sure there are as many strings attached as possible so you can pull out with little invested or destroy you and them both."" This upbringing birthed a forged a victim mentality. I view the world cautiously, everyone is a potentially threat, a potential betrayal, and as a consequence I see myself as someone who is incapable of maintaining relationships for who I am but for what I have. As an example, in high school I gave my date her ticket to the prom a couple of day before prom and my dad responded ""You big dummy, now she can go with someone else."" As though I wasn't a worthy date, as though my dad actually knew anything about the girl [he didn't even know her name]. Protection over courage; always give with strings attached. Or even to date, as an adult my parents have given every excuse in the world not to help me assistance in times of need. If it wasnt for friends and parent of friends I would not be where I am now, nor would I understand how to give to someone solo because you love them and the best for them. I now realize the problem.. I am the problem.. my social skills are ass, because I view the world and other people as a threat and I have been trying to control others through resources just as my parents have done with me. Not only that but I view all acts of kindness as potential freedom traps. Help? I dont know how to get better. I now realize building relationships is about vulnerability but I am terrified of being vulnerable. Plus years of living this way given me plenty of incidences that give me a confirmation bias."
109,vulnerability,socialskills,"When I act traditionally masculine I feel empty. When I act vulnerable, no one likes me",1,9mai6l,https://www.reddit.com/r/socialskills/comments/9mai6l/when_i_act_traditionally_masculine_i_feel_empty/,2018-10-08 12:11:53,"I spent my Freshman year of college acting tough and strong and confident. I got respect and appreciation from others. I got positive attention from girls and offered leadership positions in various groups on campus. &amp;#x200B; I tried being more open and honest in my relationships this year about how I really think and feel. I feel like people lose respect for me when I mention anything emotional. I feel really boxed in because people have these expectations for me, and I can tell that they don't appreciate my vulnerability. I perceive them looking at me with contempt and thinking that I am not the person they hoped I would be or they want to hang out with. It makes me feel sad and hopeless. What to do? &amp;#x200B; For reference, I am a 19 year old, straight man."
110,vulnerability,socialskills,5 Problems that I might have,3,9a5qvl,https://www.reddit.com/r/socialskills/comments/9a5qvl/5_problems_that_i_might_have/,2018-08-25 20:03:42,"My Situation: I am 22yr old male at university starting my third semester. My friend group sorta is disintegrating, because a few guys stopped studying and I am not so close with the rest because they drive home every weekend and one is a douche ( agrees to meet, then goes somewhere with other people). In the beginning I was happy to meet so many new people,I have lots of numbers on my phone. Hell, I even organised a Meet up for a bunch of people . But with very few people something worked out. Basically some people I met at the start were my only chance ( even though I was not so passionate about them). But they are mostly gone now. I have some friends outside my study, so Im not totally lonesome. But still It frustrates me that Im stuck with this ""broken group"" and have no other friends in a group of 300 people in my study. &amp;#x200B; I am really not shy, quite the opposite. I have no problems approaching girls on the street (and even a bit success with that). But when I approach people that would make cool friends it hardly goes further than the first contact. I text them, ask them to do something a couple of times... they dont have time and dont reciprocate. Then I stop texting them. &amp;#x200B; I think those are some of my problems, maybe you guys have some solutions 1. I am to direct when I meet new people, I suppose. I am very open and direct asking for the number of everyone new I meet. After that I asked them to meet up or go for drinks. But I almost never get a positive reply. Maybe I should first text a bit or meet for a coffee. But I really hate texting! I am also not patient enough to wait, if they ask me to do something because I think that they wont :(. Which is true in most cases. But maybe I scare those off that would 2. When I am drunk I get like super horny, and only talk to girls. That ruined a lot of potential friendships and almost a few existing friendships (pisses off some of my guy friends). Maybe I should jerk of like a lot more? or stay off the alcohol? Might be that I also seek female validation. This is really a problem... 3. Probably I am to superficial in conversations, because people dont call back. If there would be a deeper connection I would get a lot more positive reactions. Maybe I have problems showing intimacy and vulnerability because of a history of bullying and loneliness. 4. I am very egocentric and when people dont behave in a way that I expect them to, it really infuriates me... If they dont respond in time or make. And I can be very forgetful of other peoples feelings, because most of the time I only had to take care of mine. 5. I am very open to talk to people, but oblivious to social cues most of the time. Its mostly my old bully coping mechanism not to care what people think. But now when I try to understand what people think Im having major difficulties &amp;#x200B; &amp;#x200B; Thanks for your suggestions! I might be out some time today, but I will reply to everyone in the evening."
111,vulnerability,socialskills,Intersection of school and people (How to ask questions without being mocked?),3,9c7bm5,https://www.reddit.com/r/socialskills/comments/9c7bm5/intersection_of_school_and_people_how_to_ask/,2018-09-02 08:46:20,"I've been thinking about this for a while now, and have still been fumbling for the words to explain what I mean by this, but I think now i'm close enough to what I want to say, sorry if I sound confusing still. One of the main thing that has stopped me from asking questions in school was the effects of being mocked. People would sigh, laugh, chuckle, at my questions and it just generally made me feel lesser and that my presence was more of a burden than anything. Ignoring the responses from my peers even the teachers didn't respond well to them, and I was occasionally used as a stepping stone for other students; ""At least you're smarter than \_\_\_\_."" It was demotivating to hear from people that told me that talent and intelligence were things that could be honed that I was seen as a lost cause. Due to the way me displaying my vulnerability in subjects made people see me as worse, I began to go back to just drilling through my questions on my own, chunking them up as well as I could to research. This took a long time since i'm bad at understanding myself and my problems, much less the problems inside the problems, and I didn't have time. Usually I either gave up and had the teacher tell me followed by ""How could you not know this?"" or kept drilling till the test came and did poorly. While i'm still searching for the holy grail method of self sufficient studying and solving my own questions, I keep finding myself in spots that I just don't know how to categorize, much less chunk, and the lack of knowledge of my lack of knowledge makes me feel like i'm in a shrinking box, but i'm just too scared to put myself in that corner of shame again by asking for help. &amp;#x200B; I've been trying to apply advice of not caring how other people see me, but i'm not sure if that will really work in academic/work spaces when people's perception of you can influence the opportunities you get. It's hard to push yourself and just ask that ""dumb"" question when that could mean being excluded from a project or generally mocked. Which leads me to asking about the intersection of school/work and people. What parts of general social advice and confidence do you keep, and which do you exclude? How do you not care what people think when most of you're progress depends of what people can estimate of you? People can be mean, but what do you do in situations like this where it really seems to matter? For people that have been put in these situations, what did you do? What should I do? &amp;#x200B; &amp;#x200B;"
112,vulnerability,socialskills,"Everytime I get angry, disappointed or sad I shut down. It's like I lose control of my thoughts and actions, and go numb?",4,9c8bse,https://www.reddit.com/r/socialskills/comments/9c8bse/everytime_i_get_angry_disappointed_or_sad_i_shut/,2018-09-02 11:16:17,"I have always been a quiet kid and whenever I think about my childhood I can remember always feeling everything bottled up. I have a sister and when we were kids she would cause a lot of trouble. I always tried to be as quiet and as good as possible to never cause trouble for my parents because they were already dealing with my sister's trouble. I am 18 years old now and I have noticed I am still the same, and so is my sister, always causing trouble or tension between my parents and her. I have learned to express myself better, but when it comes to anger, disappointed and sadness/vulnerability I shut down. When I feel like this I lose control and I go ""numb""? It's like I can't speak my mind because I know whatever I'm thinking/feeling might hurt someone in the conversation. I wish I could speak my mind more. I recently started a journal and I could write forever, but I haven't found a way to express myself the same way with others in difficult moments and about difficult feelings. I would love to read any similar experiences/feelings and perhaps a few ways to deal with them. "
113,vulnerability,socialskills,Why do some people become rude after you are vulnerable with them?,50,9cosu6,https://www.reddit.com/r/socialskills/comments/9cosu6/why_do_some_people_become_rude_after_you_are/,2018-09-04 06:14:41,"This happens to me all the time. A person is nice and respectful then if I show any vulnerability they immediately start to become rude and hateful towards me . It happened alot to me , I dont understand why some people do this?"
114,vulnerability,socialskills,What does it mean to be vulnerable?,2,9cpyyg,https://www.reddit.com/r/socialskills/comments/9cpyyg/what_does_it_mean_to_be_vulnerable/,2018-09-04 08:42:00,I have been told that I dont show vulnerability. At this point I am really not sure what they mean or what it is. I feel like I am open about things. What might i be doing wrong?
