,topic,subreddit,title,score,id,url,created,body
60,vulnerability,socialskills,Interpreting social situations correctly?,2,cs1y2e,https://www.reddit.com/r/socialskills/comments/cs1y2e/interpreting_social_situations_correctly/,2019-08-19 00:36:19,"So, I have been asking ""why people reject/ignore me all the time"" in certain places, nobody wanted to give me a direct answer through years. Now, there has been some hint dropping, about me being too serious and proper, therefore boring. Another person also hinted that I'm a bit like ""wet blanket"". Now, I've been through a lot of bullying in my younghood and I've had to rebuild self-confidence many times through my life. Now I'm just going through tons of confusion. In most social settings I can relate to ""failing to join the fun"" type of description. Ultimately *I want to have fun responsibly*. Usually because I don't want to accidently end up becoming an insensitive (or accidently toxic) jerk by making fun at someone elses expense which is very common in social settings.. I can make jokes at my own expense tho. I'm usually concerned what if I accidently enable a covert bully to degrade someone or unintentionally make someone feel uncomfortable. I try avoiding people-pleasing habits, but still, I think it's still necessary to be polite and considerate of others (within boundaries) instead of being too selfish. I also have difficulty to ""catch"" whether something is a fun conversation about serious issue or whether it's a serious conversation about a serious issue. And this is where being too serious and proper comes in. Being a ""wet blanket"" comes in when targeted by jokes at my expense - which I can take from people I know well and trust they mean no harm... but not from strangers. It still makes me question whether someone is directing a questionable/toxic jab towards me or looking for vulnerability -&gt; I assert boundaries, or whether it's honestly just an innocent joke which I should bounce back with wit. Sometimes me finally ""joining the fun"" has also hurt someone and people have told me my jokes ""sting"", and they've tried to get revenge on me for that for years... and it's hard to interpret as fun from their side. It's also difficult to tell whether someone is just humorously faking the hurt, manipulating the situation through being hurt or honestly hurt. It's possible that in those situations where things can't be discussed respectfully and seriously, people may as well be toxic, but it keeps troubling me to not find clarity. I *don't want to repeat some old mistakes* I may not be realising I'm doing. I want to be able to interact with other people better. &amp;#x200B; This whole issue of course is even more troublesome online, where I usually find more people with whom there's something to talk about, than IRL. You can't interpret stuff from the other people's tone or body language, most of it comes down to how they use words and if their claims are realistic. Any pointers aside from ""let past be past"" on how to interpret social situations better? And how to tell difference between when it's okay to treat those situations (and people) through humor and when it's okay to be more serious even if some people didn't approve?"
61,vulnerability,socialskills,How to balance a desire for intimacy/friendship while also feeling too vulnerable to move closer to anyone,3,ct2ipl,https://www.reddit.com/r/socialskills/comments/ct2ipl/how_to_balance_a_desire_for_intimacyfriendship/,2019-08-21 03:19:56,"Im a 26M going through a divorce right now. It has literally sent my life into a spiral and caused me to lose a lot of relationships I held dear. Long story short, Ive had to move away from my old support group of friends so I could try to be closer to my child that my STBXW has tried to keep me from. I get very little time with my daughter while we go through the court process and it has left me in a new area alone and difficult in finding friends for support. My struggle is the trust and vulnerability I have with others. The rejection of my wife, her family, and others has caused me to drift into cynicism about relationships. Ive been seeing a therapist about this and he wants me to just grieve for right now (which trust me, I am). But before all of this, I used to love people and always thought the best and easily forgave. Now, Ive been so badly hurt that I dont even WANT to give a shit about anyone else. Yet at the same time, I deeply crave just some form of intimacy and friendship that has been left void through all of this. Im apprehensive to even throw myself into dating because my divorce is not finalized and because I have had several people caution not to jump into any type of relationship until I have healed. So how do I fill this void? And balance the desire for intimacy while still trying to heal and remaining closed off to protect myself?"
62,vulnerability,socialskills,Vulnerability begets vulnerability,10,cv8a6m,https://www.reddit.com/r/socialskills/comments/cv8a6m/vulnerability_begets_vulnerability/,2019-08-25 23:07:54,"Being open about your fears dreams likes dislikes demons your facing will cause others to be open with you with is a shortcut to friendships ..... if you want people to truly like you for who you are, get to your core and be in tune with it and share some of it with others.... that's where the real shit is anyway.... and fuck what people think, nobody's perfect... speak your truth"
63,vulnerability,socialskills,"How to define a vulnerability while still giving an ""opt out""...?",1,cvahz6,https://www.reddit.com/r/socialskills/comments/cvahz6/how_to_define_a_vulnerability_while_still_giving/,2019-08-26 02:18:58,"So there's this friend who I see often and trust explicitly, and we've had some emotional conversations, mostly with them sharing. I guess it's sort of my turn, but I am not sure they really want to go there, and I don't want to unload on them in a way that is too much. And despite time passing, whenever I talk about it seriously, I feel raw, and am liable to cry. Is there a way to say that I am willing to discuss the topic, but it's super intimate and I need to feel like I have the privacy and tissues required, and that they are... how to say it... prepared to handle that moment? Because I don't want to overwhelm them, and I don't mean to hide either."
64,vulnerability,socialskills,FINALLY FINDING OUT WHO I AM (and owning it),1,cbiboc,https://www.reddit.com/r/socialskills/comments/cbiboc/finally_finding_out_who_i_am_and_owning_it/,2019-07-11 01:44:08,"Wanted to share this with the socialskills sqaud. I have been pretty fearful of social situations and perceptions of me for as long as I can remember. I would build up this ""confident"" mindset and tell myself I'm this and that and can handle whatever, but as soon as I'm out in the real world talking to people, I eff up pretty bad and yet again become an awkward person, and hate myself for it. The other day I realized that it might be because I hardly share who I am with the world. Let me explain. In my mind, I had all these different types of ""personas"" that I take on when I'm with certain people or situations. With this person I have to be this way, and in this situation I have to be that way, etc. My whole life I've had this mentality. I would see a person or character or trait that I liked, and added it to my ""reservoir"" of people I wanted to be. If I was afraid, for instance, I would pretend to be like a certain fearless or badass character I admired in a movie. I never saw a problem with this, and never really thought much about it. Turns out, it didn't do me much good. I could never hold on to that persona long enough in a conversation or situation without it turning weird or disconnected. And keeping track of all these different personality types confuses and distorts your own perception of you. I've been obsessed for so long trying to figure out what kind of ""personality"" type (like MBTI) I truly am deep down, and try to connect to it, and take on that one personality type completely and be that entirely, but even then I fail. And then the other day I had an epiphany. You know why I never knew who I truly was? Because I never let myself be myself. Ever. I was always too worried about my image and what people thought of me to let myself go and be myself and just do and say what felt natural, what felt right. And when I finally realized this, and decided to throw away all personas, and break down my walls, and just be myself, no matter how awkward or stupid or confusing I sounded to other people, to just own it entirely, I literally felt like a weight was lifted off my shoulders. No effin lie. The following days I was shocked at my behavior and how I looked at myself. I hate to say it was a simple switch, because I struggled with it for so long, but honestly, after realizing it, writing it all down and making that new commitment to myself, it was like an instant flip. Don't get me wrong, I am not saying that I am no longer awkward or foolish, and instantly popular, not at all, but I have definitely noticed how much better I am when I'm being myself and owning it no matter how I act or look like. And I think I am slowly starting to figure out who I am, and being okay with it, even if its not like my favorite characters or personas. Im me, and *Im okay with it*. I can improve who I am, work on things I don't like, but I don't need to change, or hate myself for things that make me, me, if that makes sense. The other day I even uploaded my first video on youtube and that was insane, I was so fearful of that for so long, and freaked about finally showing my self and emotions to the world, but after sharing it with everyone and being okay with who I was, it felt so freeing. And weirdly, now I feel truly confident. I'm not afraid of what they think of me. I'm not afraid of my negatives, or my awkwardness. I am owning it fully and completely. I never would have thought that something as scary as vulnerability would make me feel strength and confidence. But opening up myself to the world unapologetically and bearing all, and not making excuses for it or diminishing myself has made me resilient, to say the least. Anyways, thought it was important to share and get out there, maybe someone else can apply this to their life and it could help somehow. Or maybe I'm the only psychotic one with different personas and I've just exposed myself to the world, but then again, Im riding a new wave and don't really care anymore. :)"
65,vulnerability,socialskills,Finally figuring out who I am ( and owning it),6,cbj1n9,https://www.reddit.com/r/socialskills/comments/cbj1n9/finally_figuring_out_who_i_am_and_owning_it/,2019-07-11 02:41:25," Wanted to share this with the socialskills sqaud. I have been pretty fearful of social situations and perceptions of me for as long as I can remember. I would build up this ""confident"" mindset and tell myself I'm this and that and can handle whatever, but as soon as I'm out in the real world talking to people, I eff up pretty bad and yet again become an awkward person, and hate myself for it. The other day I realized that it might be because I hardly share who I am with the world. Let me explain. In my mind, I had all these different types of ""personas"" that I take on when I'm with certain people or situations. With this person I have to be this way, and in this situation I have to be that way, etc. My whole life I've had this mentality. I would see a person or character or trait that I liked, and added it to my ""reservoir"" of people I wanted to be. If I was afraid, for instance, I would pretend to be like a certain fearless or badass character I admired in a movie. I never saw a problem with this, and never really thought much about it. Turns out, it didn't do me much good. I could never hold on to that persona long enough in a conversation or situation without it turning weird or disconnected. And keeping track of all these different personality types confuses and distorts your own perception of you. I've been obsessed for so long trying to figure out what kind of ""personality"" type (like MBTI) I truly am deep down, and try to connect to it, and take on that one personality type completely and be that entirely, but even then I fail. And then the other day I had an epiphany. You know why I never knew who I truly was? Because I never let myself be myself. Ever. I was always too worried about my image and what people thought of me to let myself go and be myself and just do and say what felt natural, what felt right. And when I finally realized this, and decided to throw away all personas, and break down my walls, and just be myself, no matter how awkward or stupid or confusing I sounded to other people, to just own it entirely, I literally felt like a weight was lifted off my shoulders. No effin lie. The following days I was shocked at my behavior and how I looked at myself. I hate to say it was a simple switch, because I struggled with it for so long, but honestly, after realizing it, writing it all down and making that new commitment to myself, it was like an instant flip. Don't get me wrong, I am not saying that I am no longer awkward or foolish, and instantly popular, not at all, but I have definitely noticed how much better I am when I'm being myself and owning it no matter how I act or look like. And I think I am slowly starting to figure out who I am, and being okay with it, even if its not like my favorite characters or personas. Im me, and *Im okay with it*. I can improve who I am, work on things I don't like, but I don't need to change, or hate myself for things that make me, me, if that makes sense. The other day I even uploaded my first video on youtube and that was insane, I was so fearful of that for so long, and freaked about finally showing my self and emotions to the world, but after sharing it with everyone and being okay with who I was, it felt so freeing. And weirdly, now I feel truly confident. I'm not afraid of what they think of me. I'm not afraid of my negatives, or my awkwardness. I am owning it fully and completely. I never would have thought that something as scary as vulnerability would make me feel strength and confidence. But opening up myself to the world unapologetically and bearing all, and not making excuses for it or diminishing myself has made me resilient, to say the least. Anyways, thought it was important to share and get out there, maybe someone else can apply this to their life and it could help somehow. Or maybe I'm the only psychotic one with different personas and I've just exposed myself to the world, but then again, Im riding a new wave and don't really care anymore. :)"
66,vulnerability,socialskills,Should I stop myself from developing a crush? Im so confused. Help needed.,2,chixnf,https://www.reddit.com/r/socialskills/comments/chixnf/should_i_stop_myself_from_developing_a_crush_im/,2019-07-25 14:27:05,"Okay. So basically I prevent myself from having crushes. My last crush that I developed was when I was 13 (Im 17 now). Since then, whenever Ive seen a possible interest (I.e. I notice it is logical for me to like someone, I feel like some feelings could begin) I shut it off. I tell myself no and reject the possibility of feelings. I dont allow myself to have a crush. I dont let myself entertain the thought of developing romantic feelings for someone. My friend thinks its a blessing, but it feels like a curse to be able to do that. I feel like love, for me, wont work out. I feel like Ill just end up being hurt. It requires vulnerability which is hard for me. Ive had people openly have interest in me, but I just cant imagine dating. It feels like it will just fall apart. I feel embarrassed, like I dont have the right to have that. I kind of dislike myself a whole lot. I hate my physical appearance and personality. I dont view myself as special, so why should I expect someone to treat me as such? Theres also the practicality part of this as well. I come from a fundamentalist Christian family, so very few girls would be approved. I start to think, Whats the point? My mom doesnt think women should work (I disagree, just want to point that out), so now even less options are available. At least if I want to please my mom. Side note: Idk my views on so many topics (besides abortion, Im pro-life 100%) are confused and uncertain, as I live in polars of left and right. School and friends make me feel like Im thrown into a movie staring Hillary Clinton, produced by CNN. Home/church feels like Ive been instructed to help build the wall. Also my view of liberal does include girls wearing short shorts and guys walking around without their shirts on (both are considered nudity) so when I say left, that is included, which most rights are fine with. Back to the love thing: Has anyone ever dealt with this? I think about it a lot, and wonder if I will ever let it happen. What if I dont? Then Ill just be alone. My friends think Ill be the first to get married and start a family, because Im just the nice Christian guy who wants a family one day, but I guess thats not how it will work out."
67,vulnerability,socialskills,Lots of free time to dedicate to improving social skills - where should I target my efforts,1,ckz8iu,https://www.reddit.com/r/socialskills/comments/ckz8iu/lots_of_free_time_to_dedicate_to_improving_social/,2019-08-02 14:20:45,"I have a lot of free time over the next 3 weeks and I want to dedicate a few hours each day to improving my social skills. I don't really feel much anxiety in social situations, I just feel like my mind is empty and I am also very laid back and not particularly high energy. I'm quite playful and happy but not particularly charismatic. I like to communicate with people but i'm just not very good at it and I think in some way I put people off and they can sense some form of vulnerability. I am very bad at holding peoples attention and I often very quickly lose their interest. Speaking for a long period of time is something I need to do in the form of public speaking in a few weeks and I'm also planning to work on those skills alongside improving my social skills in whatever way I can. There is a lot of great advice on this group and I really appreciate the effort and time you guys spend posting here and helping each other, The biggest things I feel I need to work on are the following: * Increase the length of time I can speak coherently about something while still keeping it interesting. * Improving the speed which I can think of things and link topics together. * Build up a sense of authority / be more of a leader in a social situation. * Not being able to stick to a task / follow through with it is one of my biggest downfalls, so keeping this practice going is going to be really difficult. &amp;#x200B; What I plan to do: &amp;#x200B; * Jump out of my comfort zone more. I am currently in a country where I don't speak the language and English isn't spoken well by that many people. I plan to approach people I find more intimidating ( I don't find approaching strangers intimidating ) to put myself on the spot in some way, perhaps by complimenting people directly or something that is more challenging than asking directions or saying hello. This will probably involve google translate 80% of the time as they won't fully understand me. * Record videos for youtube where I talk about different subjects. Hopefully this will help me get more comfortable talking and improve my mannerisms / facial expressions and body language a bit. This does't come naturally to me and I feel / come across somewhat awkward on camera and this is going to be tough to even do. * Learn and memorise 2 jokes each day and practice telling a few stories from my life experience each day so I've got a good understanding of how to present them If i come across a social situation where I might need to. * Spend a little time each day practising improv comedy by myself. Perhaps record myself performing a short stand up comedy sketch * Learn to rap / sing one song. I've never tried this before so it'll be challenging. I like the idea of it though, it's just something challenging that will be uncomfortable. Being in social situations is of course great for improving skills and practising but I don't really have much to talk about, so perhaps I also need to learn to express my own likes even if they contrast with the other groups members and bring out my passions without fear of being judged e.g I'm not a big drinker / don't watch the latest TV, don't know the latest music. Sure, it would be cool to learn a bit about some of the kind of popular topics that might help socially, but I don't feel I need to do that. The more I think about this the less i'm sure exactly what my biggest weaknesses are, I think mostly it's being completely comfortable / sure of myself / knowing who I and coming across like that socially. I had some difficulties growing up, which I'm slowly dealing with elsewhere and this played a part in me losing my sense of identity, but also I have a sense of spirituality and not wanting to particularly build up a big identity / ego. I've spent way too much time Pleasing other people / fitting in rather than fully being my own person and I definitely display these weaknesses and lose authority in any social situation fast. I need to find a way to gain authority / respect socially and to be more charismatic / engage peoples attention / improve storytelling. I hope this post at least makes a little sense. What would you do in this situation?"
