,topic,subreddit,title,score,id,url,created,body
0,vulnerability,socialskills,Seriously?,1,i5pjyc,https://www.reddit.com/r/socialskills/comments/i5pjyc/seriously/,2020-08-08 10:27:50,"Hello r/socialskills, I never thought I would have to post this...but I'm beyond frustrated and it's really holding me back where I want to be socially. I was literally talking to my buddy's gf when after I just told myself *I gotta post this on reddit to see how I can get help.* I have nowhere else to turn to. Here's the problem: when I look at people in the eye, *nobody* wants to maintain that eye contact. Wtf? When I'm at the club, it works perfectly. When I'm talking to my old boss, it works perfectly (I scared a lot previous bosses). When I made sales, it works perfectly. I've been told I have a strong or ""alpha"" personality. I don't know how people come to the conclusion, but I am not really afraid of much and I'm ruled by logic. When I talk to girls (daylight hours), or even most people for that matter, they're afraid. I can tell they're nervous for some weird reason. And yes, I smile. I try to joke *a lot*. Their nervousness makes me nervous and usually sabotages everything. Sometimes I come across girls who are totally confident and unphased and it feels like a normal conversation which normal people should be having. But this is like 1 out of ever 30+. When I talk to friends, they're afraid. Not in the same way though. Still no eye contact. Some of them cope by looking at their phones while talking. I get this vibe where I can't put my finger on it, but they're in some way or form ""trying to impress me"". I knew I had a vulnerability problem in the past, and I try my best to share *everything* but it seems like it's not working. I know it sounds pretty weird but it's annoying me and starting to alienate me from them bc I can't take it anymore. I know you guys don't know me, but all I want to say is that I am focused on my goals and I work hard. I don't even think I'm the most attractive guy ever, but I try to max out my looks, job, etc in whatever way possible *consistently*. Girlfriends in the past we're always assuming that I was talking to other girls. Some girls thought I could get up and leave the relationship at a moment's notice so they refuse to get with me beside either a one night stand or fling. So, I thought taking personality tests to see maybe what my weaknesses were. I took myers and enneagram and got ENTJ, with a 3 enneagram. Thanks for the read. But seriously, wtf is wrong with me? How do I change this? What should I be doing? I ready to just say f-it and focus on my goals full time."
1,vulnerability,socialskills,"Why you hate small talk, and why it's WAAY more important than you think",1,i666rr,https://www.reddit.com/r/socialskills/comments/i666rr/why_you_hate_small_talk_and_why_its_waay_more/,2020-08-09 06:28:41,"Do you hate small talk? Do you find it pointless? annoying? Shallow? A waste of time? If you do, now is the time where I call you out a little bit, but I want you to know my intention is not to make you feel bad... but for you to be aware of something that can give you more power in your life, your interactions, and your social life. Look, the reason you probably don't like small talk is because of three reasons: Number 1: you're not good at small talk Number 2: You don't fully understand the purpose of small talk Number 3: You don't know how to transition out of small talk into deeper more connected talk that can actually lead to a feeling of connectedness Because you see, your dislike of small talk is actually just a symptom of a larger problem. So let me break down small talk to you so you understand why this is a VITAL skill that you need to develop for you and your social life, and your interacting with people in general! And what it means about your social skills. First of all, why do humans need small talk? Why is it so important? To put it simply, small talk builds TRUST. You are literally giving the other person TIME to build rapport with you, to let down the emotional walls that we hold up to protect ourselves from the dangers of the world. We can't just throw ourselves fully at everyone we meet, we need to make sure we're safe. Now as humans, we are incredibly emotionally intuitive. Small talk gives people the TIME to pick up on the subtle emotional cues of the other person. So our job, through our small talk, is to COMMUNICATE to the other person that we are trustworthy, that we are friendly, and that they're safe around us (this is all subconscious by the way ) You see, the deeper, more emotional talk exposes who we are as people. It leaves us vulnerable. And obviously, you don't want to show your vulnerability off to just anyone, right? You have to know you're safe with the person you're talking to before you can be vulnerable. Which is why small talk is so important. It is essential for trust building and you NEED to have this skill in order to do so. The thing is if you don't know how to have effective small talk, it means you haven't developed a good sense of emotional empathy with people. OR, you're so stuck in your head, that you can't put yourself in someone else's shoes. So if you want to know how to master small talk, as well as how to properly transition from small talk into deeper, more engaging, emotionally enriching talk-- the kind of communication that can lead to real connection-- then leave a comment or message me. I would be happy to see what kind of specific struggles you're facing when it comes to this very important issue.  So remember. Small talk is so important! It gives the other person TIME to feel your energy and TIME to open up to you! And to EXPERIENCE you! So it's time to stop hating it and start using it."
2,vulnerability,socialskills,What are ways you cope (in a healthy way) with judgment/stubbornness?,1,i8ryec,https://www.reddit.com/r/socialskills/comments/i8ryec/what_are_ways_you_cope_in_a_healthy_way_with/,2020-08-13 12:48:55,Ive generally like to think Ive become a better person throughout quarantine. Ive become more comfortable being on my feet and being understanding to others around me. However I still struggle with self vulnerability and being not so quick to make conclusions about things/myself. How do I work on self improvement and come to peace and terms with myself?
3,vulnerability,socialskills,How do I stop myself from feeling pressured by the expectations of people I like and admire while doing things?,1,ia7icy,https://www.reddit.com/r/socialskills/comments/ia7icy/how_do_i_stop_myself_from_feeling_pressured_by/,2020-08-15 23:39:29,"I have realized over time that I am a people pleaser. I am also not very good at focussing on things although if I do put my mind to it, I can get better faster than most people. I also lack a lot of common sense. Having said all that, I love it when people I like and admire see me as someone with potential. I have been told I have potential since I was a kid (although the older I get, the lesser I believe this). Lately, I have shown work and raised expectations of two professionals in my field and on both occasions ( 2 years apart) I have fallen and disappointed then to a shocking level. I have never thought of myself as insincere or undependable but both of these times I was so much more focussed on what they thought and how much I'm disappointing them than focussing on my job and finishing it that I ended up getting a panic attack and swellings due to stress. I have this toxic trait of not asking for help even when its in front of me and waiting for me to just ask. I need to have this facade of having my shit together but I rarely ever do. I cannot keep living like this, fearing disappointments and vulnerability. Currently, also, I am avoiding what to do because ""what if I *am* really awful at it and people figure out I'm just all barks? I know it is just the imposter syndrome but I can't stop feeling like everyone is waiting for me to fall and confirm all that they thought about me?"
4,vulnerability,socialskills,"How do you open up to people about needing help and being Ina rough place without feeling like you're seeking attention, or feeling like you're bothering them?",1,iel6wj,https://www.reddit.com/r/socialskills/comments/iel6wj/how_do_you_open_up_to_people_about_needing_help/,2020-08-23 02:12:17,"My therapist says I have a problem with vulnerability and being open. I'm a very guarded person. But I've recently been diagnosed with bipolar and right now, I'm not okay. I don't feel like myself and I just wish I had someone to talk to or to tell. There's one person I want to reach out to, because he's opened up to me about his stuff. But.. I just don't k ow how to have that conversation. I sit here and desperately yearn for human connection, to not feel so lonely, and to feel like I can be transparent and open about what I'm feeling, but doing so makes me feel like I'm ""seeking attention"". I don't want to be that person that's always dramatic. In the past, my bipolar episodes have led me to pushing some friends away and burning bridges, and I regret it now and I see that I wasn't in my right mind. But that episode caused a lot of lasting drama that I'm still having to deal with four months later. So with that drama, I just.. I don't want to exhaust people around me just by talking to me. But I'm really not okay right now and I don't feel like myself. I want to open up to that person but I don't want them to think, ""Oh, more drama."" I just want to be normal and feel normal."
5,vulnerability,socialskills,"10 months ago, I asked this subreddit if I should give up on trying to date. I've gone on my first date since then. Here's what I've learned.",1,iggtgj,https://www.reddit.com/r/socialskills/comments/iggtgj/10_months_ago_i_asked_this_subreddit_if_i_should/,2020-08-26 03:31:53,"10 months ago, I wrote a long post in a fit of despair, under an account I've since deleted. I'm not gonna link you guys to the main body of the post, as I am a bit embarrassed about it. But I will link to the [top response](URL I got instead. To summarize my post, I was nearing 30 and despairing because I'd never been on a date, I'd barely ever flirted with a woman, never held hands, let alone kissed or had sex. For a long time, this situation hadn't bothered me, and I just listened to people when they said ""just be yourself"" or ""it'll happen when it happens"". But eventually, it all came crashing down and I started to feel like the most undesirable mofo on God's green Earth. I started to look for advice. This ended up frustrating me more, because the advice usually was of one of three varieties: * Platitudinous: ""Just be yourself"", ""it'll happen when it happens"", ""love yourself before you can love someone else"", ""work on yourself"". All well-meaning and not necessarily untrue, but for some people, this advice simply doesn't make sense until they overcome some other mental or physical roadblock. How can being yourself help if you identify as a nervous wreck? * Way too aggressive or manipulative: RedPill and shadier parts of PUA. The good: it teaches men to be more proactive. The bad: where to start? Treating dating like a zero-sum game, feeding insecurities about not being ""alpha"" enough, treating women like objects whose emotions can be toyed with, etc. * ""Feminist"" ""dating advice"". The good: empathizing with women's experiences can help men navigate dating better. The bad: often focuses more on avoiding the bad things that men do rather than on good things you *can* do. Can make already shy, considerate guy feel even more inhibited or terrified of making women uncomfortable. My frustration with these 3 types of advice left me feeling hopeless and culminated in me writing the rambling, venting post I linked to above. I wanna thank everyone who replied, but specifically /u/PM_me_goat_gifs for his [epic 10-part comment](URL His advice may not be applicable to everyone struggling with dating, but it was perfectly tailored to me, and it was mostly the fact of feeling understood and feeling like my situation wasn't hopeless that lifted me out of my pit. Now, it's 10 months later and I've since gone on my first date with a lovely woman. I asked her if she wanted to hold hands while we were walking on the beach, and we did. Later on I told her I'd like to kiss her, and she said she didn't feel ready yet. We've kept in touch and met afterwards. It all might seem quite unconsequential to some Casanovas out there, but these are all things that seemed unthinkable 10 months ago, as a guy who was terrified of making any move whatsoever, out of fear of creeping out a girl. Holding hands while looking at the sunset and laughing felt magical, but in a down-to-earth way. Mostly, it made me feel alive, like I was part of humanity again. Also, asking for a kiss and getting rejected wasn't as painful or stressful as it might have seemed. The awkwardness was dispelled pretty quickly. Now I know I am able to do this, I feel a lot more relaxed. I feared dying without ever going on so much as a date, and that nightmare is now officially over. But it wouldn't have been possible if I hadn't congratulated myself for the tiny bits of progress I made instead of focusing on the negative all the time. Flirting over text over the first time, flirting over the phone for the first time, asking someone out, etc. ~.~ I've learned a lot since I made that post (too much to put in here), even though I'm obviously still at the start of my journey and clueless about many things, and I'm happy to answer any questions in this thread. But here are some things I want people in a similar situation who are stressed out about it to hear; here's what I would tell my younger self: What causes a lack of dating success is a complicated, multifactorial thing. There really is no one-size-fits-all advice. A lot of advice you will find online is not going to applicable to your particular situation. But that doesn't mean that it's hopeless. Neither does it mean that dating is some nebulous, mysterious, serendipitous thing and the only thing you can do is just wait until the stars align and that bullshit. Whatever you have going on, there is concrete stuff that you can work on and fix. There is absolutely no shame about making dating a goal in your life, and don't let anyone tell you otherwise. Intimacy is a need for so many people. Maybe it shouldn't be the number 1 goal, but it can be number 2 if it's important to you. There are plenty of people out there who are perfectly content, happy and confident with all facets of their life, except dating and romance. It's very strange that we don't recognize that dating often involves a very particular set of interpersonal skills that can be worked on. There's different love languages, there's attachment theory, there's a shitton of knowledge out there about how people intimately connect, all shit that I didn't know about before I embarked on my journey and has made a lot of things make a lot more sense. But a lot of the more valuable stuff I learned, I had to dig to get to it, whereas toxic redpill, blackpill and pinkpill shit is everywhere on the Internet it seems, and unfortunately, that's what a lot of lonely misfits are turning to. Once you can reach a mindset where you can bear to take a look at yourself without beating yourself up for whatever your flaws are, you can get to work. Baby steps. While looks do count and I've changed some things (haircut, wardrobe choice), I was surprised by how much emotional baggage I had that I hadn't even noticed or considered, because I was pretty content with everything *except* my lack of dating experience. A large part of finding this out is talking to guys with similar experiences online (not incel or ForeverAlone subreddits, as in clubs where the goal is to eventually leave, it's the members with the biggest crab-in-bucket mentality who gain the most influence). Some guys would send me PM's on Reddit commenting on something I said in a comment or a post to commiserate about it. I found out a lot of commonalities with guys in similar boats like this. So many guys struggle with Autism Spectrum Disorder (I don't think I have this), Highly Sensitive Personality (I think I have this), social anxiety. Reading more about HSP and how people with it tend to relate to dating and sex made me learn a lot about myself and what I wanted in a partner; this info came in useful when crafting a dating profile (not on Tinder obviously, since this stuff can't really be conveyed in 10 emojis; if you're gonna use the apps, pick one better suited to your needs). As you gain a bit of confidence, learn to recognize your assets and capitalize on them. I love learning languages and I had great times with a girl trying to learn her language and impressing her with how fast I picked it up. I've also gotten compliments on my voice, so I tend to prefer getting to know someone over the phone to texting. You've gotta learn what kind of person you are looking for. This can be hard, as when you start out you think ""I can't afford to be picky, I have no options."" This is something you've gotta struggle through and think about, and you will change your mind. One piece of advice that many guys (and girls) can use is: when talking to someone, spend at least as much energy on vetting them as you normally would on impressing them, if not more. (Vetting in a playful way, of course - not like it's a super-dry job interview. But that's only *my* preference. If you want a date to be like a stern HR person grilling a candidate, be my guest!) As I already explained, ""be yourself"", just said like this with no context, is pretty damn useless advice. But there is a kernel of truth to it. [Craig Ferguson](URL explains it much better. It's what Mark Manson calls ""vulnerability"". Finally, I'll share the piece of practical advice that has personally helped me the most: **ask them out**, after you have gotten to know them a little and you seem to get along. A lot of people who struggle spend worrying a great deal about how to flirt without being creepy, but asking someone out on a date is the best way to clearly and unambiguously communicate that you are interested in them. This may seem like 1+1=2 level common sense to some, but one of my problems is, I've always liked to overcomplicate things =) Also, how do you ask someone out? You state your intention (""I'd like to get to know you better"" is one that works well), you invite them to whatever first date idea you've cooked up in your head (""Would you like to go on a date?""). You propose a time and a date (""Let's say Thursday at 5PM"". If they like you but it conflicts with their schedule, they'll propose an alternative.) And you convey that you won't freak out if you're rejected (""No pressure."") This model also works for proposing to exchange contact details. Hope this helps some lost souls out there. And if something in this post somehow offends you, bums you out, or doesn't seem to gel with your reality, then I'm sorry and I hope you find something that does help you elsewhere. Peace out!"
6,vulnerability,socialskills,"Um, uh, like, you know. Let's figure out filler words.",1,ighmed,https://www.reddit.com/r/socialskills/comments/ighmed/um_uh_like_you_know_lets_figure_out_filler_words/,2020-08-26 04:10:39,"Hey friends! Everyone uses filler words, and if you do as well that's ok. Hold up, some of you haven't figured out what a filler word is yet, even with the title? That's cool, let's start there then. Filler words are mental placeholders. You're talking your way through an idea, and as you talk your way past the many folds in your big wrinkly brain sometimes you have to pause because the idea around the corner hasn't revealed itself yet. Humans across languages have filler words([Spanish example](URL &amp; [Russian example](URL and since I speak base common or English I'm sticking to that. Here are some examples of famous people fumbling over filler words. [Justin Trudeau and ""Umm""](URL [Barack Obama and ""Uh""](URL [Ariana Grande and ""All the fillers""](URL Enough examples; you get what filler words are now. You maybe even use them--often. How do we help you stop? Well first we need to actually confirm your usage of filler words. I highly recommend a moment of vulnerability, but you can also do this on your own. Record a session of conversation between yourself and someone close. Have your ""someone close"" record you on your phone as they ask you some questions that you need to explain a little. Then rewatch the video. As you do tally your filler words. Try this between both of you, and across a few topics (try a topic you're passionate about, and a topic you know moderately). Once you've confirmed your use of filler words stop using them. TL;DR stop using filler words. You're probably going ""no shit sherlock"" right now, but saying stop does not really help. Except that is the answer. Now to acknowledge how to stop. First, you need to mindful of your speach patterns. This is why you recorded some of your conversations. Second, instead of saying your filler word of choice take a deep breath. I don't mean a theatrical deep breath; just breath as if you're in full control taking your sweet time to say what's on your mind. Boom! That's it. That deep breath as a pause instead of your filler word of choice is going to change everything about your conversations. Silence is a powerful tool in your arsenal. Use it! If you're comfortable with a moment of silence, and a deep breath as you collect your thoughts instead of putting a filler word is going to make you seem in command of the situation. Here is another example video, [Lady Gaga on her ""drug addiction""](URL it's like 20 seconds in or so. Lady Gaga is being interviewed about a challenging topic. Notice she doesn't use filler words, and is instead attempting to use silence/breaths for filler. She even drags the last syllables of words where she would have used fillers. However, she seems confident even under pressure, and she seems unphased because she hasn't resorted to filler words even as she talks on a tough topic. I think I covered everything I was wanting to touch on. We covered what filler words are, and how even top speakers use them. How to see our own use of the fillers. How to stop using them. Finally an example of them not being used. Feom here; ask questions in case I missed something, and practice makes better. Real TL;DR pretty much everyone uses filler words similar to those listed in the title. Here's some examples, now stop using them."
