,topic,subreddit,title,score,id,url,created,body
51,vulnerability,stopdrinking,Recovery toolbox,5,d5rktk,https://www.reddit.com/r/stopdrinking/comments/d5rktk/recovery_toolbox/,2019-09-18 12:52:06,"I saw a post on Instagram the other day about recovery toolbox and it made me think, *what's mine, I hope I have one*. So I listed everything I now do and have access to and was surprised at how long it was. There's nothing new here, but what's amazing to me is that I now have this and rely on so much of it as part of everyday life. Also that I have things to turn to on a shitty day, or minute, or hour. Hope this is helpful, let me know what's in yours. * Meditation * Get out of self and help/be with others * Psychology * Spirituality and prayer / wonder at the universe * Connection with new and old friends and family via improved relationships * Meetings * 12 Steps * Gratitude * Awareness and intention * Morning journaling (now future self from @the.holistic.psychologist on Instagram) * Nightly inventory * Exercise, movement: walking, running, free weights, surf, swim, yoga * The ocean * Body awareness * Education &amp; reading * Breath * Sitting with &amp; observing pain and discomfort * Acceptance * Nutrition * Sleep and daytime naps * Sober inspiration via /SD and Instagram * Podcasts, especially Russell Brand, Rich Roll, Marc Maron, This Jungian Life * Observation of thoughts, questioning B&amp;W thinking, generalisation, catastrophising, should not could, fallacy of control * Mindfulness - the moment, the power of now * Boundaries * Management of procrastination, putting it in perspective * Vulnerability * Play * Not people pleasing * Leaving comfort zone * Saying sorry * Laughter * Music &amp; creativity"
52,vulnerability,stopdrinking,"I'm realizing to be successful, I need to reframe my sobriety. Rather than running the narrative ""I never get to drink again"" through my mind - I just remind myself ""I never again HAVE to feel hungover, regretful, anxious. I GET to enjoy and experience all the things I lose sight of when drinking""",259,d8pdmr,https://www.reddit.com/r/stopdrinking/comments/d8pdmr/im_realizing_to_be_successful_i_need_to_reframe/,2019-09-25 02:13:21,"I'm not sure if I got this notion from a podcast from this naked mind, I listened to it about a year ago.. I went 3 months, then did the classic thing where I felt like I could drink again. That was about 6 months ago. My drinking slowly creeped up, and this past weekend got almost blackout drunk. I read a million other posters here telling the same story i believed I could do it, and should have known better. I'm now trying again. And my counselor have me the great of ditching the thought ""I can NEVER drink again??"" And rather focus on one day at a time - just focus on each temptation as it comes, then refocus. This is easily what got me through my last 3 month sobriety steak. Similarly, in realizing how different I feel about drinking when I ditch the idea of me never GETTING/BEING ALLOWED to drink again.. no, I feel full of happiness when I think I never HAVE TO DRINK AGAIN and all the damage and destruction it's done to me and my life. I get to experience all the things the SD'ers post about on here - tea and a good book, clear headed mornings, exercise, nature walks, etc. This community had been the best thing for me, thank you all for sharing, for the vulnerability, the support"
53,vulnerability,stopdrinking,I returned to AA after 329 days,39,d8x17a,https://www.reddit.com/r/stopdrinking/comments/d8x17a/i_returned_to_aa_after_329_days/,2019-09-25 12:20:25,"Im 330 days sober. Didnt have the motivation to go to AA since my first day, and went to a meeting tonight as the first meeting of a 90 in 90. As Im walking to the doors of the meeting a man asks me how much time I have. Almost 11 months I say. Would you wanna speak? My guy isnt showing up, He says. I have had a day from hell. Im 7 days off cigarettes and had a day full of disappointment, stress, and low confidence. My mentor tore apart a piece of writing that I was excited about. I was vulnerable. I dont enjoy vulnerability. This same mentor suggested the 90 in 90. I felt it was a sign of some sort, that my words can matter in some way, even if not the way I intend. I spoke about failure. I have a lot to learn. The people in that room were full of hard earned wisdom and hope. Ill be going back tomorrow. IWNDWYT"
54,vulnerability,stopdrinking,Is it really a problem? Thats the question I continue to ask myself,5,dbnst1,https://www.reddit.com/r/stopdrinking/comments/dbnst1/is_it_really_a_problem_thats_the_question_i/,2019-10-01 14:04:24,"Im only 24, Ive only been drinking for three years. But Ive used it as a coping mechanism throughout this time. I dont black out, I dont have angry episodes, and I dont drive drunk. I do drink a half bottle of wine to cope with social anxiety before seeing friends, even those Im quite close to, and I drink some more while Im with them. I drink up to a bottle of wine in the evenings because it elevates my mood from apathy to euphoria. It makes movies and television so GREAT! I drink before sex and dates, to allow myself a freedom of vulnerability and intimacy. That being said, I still lack true intimacy in relationships. Three times now, Ive begun seeing suddenly after drinking. It always comes to me in a matter of seconds, and I cry for hours. Perhaps the problems I push deep inside myself actually come out when I drink. The most recent time this happened, I planned a suicide. Do I have a problem? I dont know. Probably. What I do know is that I use alcohol to feel better, and I can never imagine giving up alcohol for good, and maybe thats an issue. So here I am. Ill start with a week. Maybe a month. Well see."
55,vulnerability,stopdrinking,(update) to my most recent and vulnerable post,5,dd341n,https://www.reddit.com/r/stopdrinking/comments/dd341n/update_to_my_most_recent_and_vulnerable_post/,2019-10-04 15:38:23,"Earlier September was a doozy for me, and I know everyone has their hardships in life and there's no way to compare them. I posted about a month ago that I had lost 9 months of sobriety, due to a friend's suicide, and that I had drunkenly said some beyond-horrible things to a friend that same night. I learned about a part of me that I didn't know existed, and maybe have been avoiding dealing with for so long... Even in my sobriety. I'm still so ashamed of myself 4 weeks down the line that I have the hardest time staying sober. Since then, I have had 5 nights where I have had some drinks to calm my nerves. Tonight is included. I'm still fighting. I'm still seeking for the answers to how to deal with the parts of myself that I despise so deeply. This community is a integral part to me understanding my vulnerability in this battle, and I truly want to say a major thank you to everyone who has been so damn supportive, positive, and REAL with me in my personal journey in becoming a healthier, and honest human being. I also want to say just how inspiring it is to read all of the positive and wonderful things this community has been capable of saying/commenting on other people's journey to sobriety. If the world took notes on how you all treat each other with respect and understanding, maybe we could have something to hope for in the long run."
56,vulnerability,stopdrinking,Hanging out at a bar,11,comrfo,https://www.reddit.com/r/stopdrinking/comments/comrfo/hanging_out_at_a_bar/,2019-08-11 05:53:52,"Am I the only one whos at a place where they actually enjoy a random conversation with drinkers at a bar? This morning I sat at a bar for breakfast. Neighborhood place where almost everybody knows the bartender and it creates a friendly atmosphere for all. Its not at all a dive. Just the bar section of a restaurant. But some people sat down, then two more. The first two bought the other two shots to initiate a conversation. Its 11:00am. In the past Id have joined. But was just as happy about the fact that they were having shots as if I had one myself. After all, I had coffee. But I knew that they would be friendly and engaging in conversation and it struck me that I can hang out in this environment and still enjoy it. I, myself, dont have to drink, but I enjoy being around other people whos inhibitions are lower. Then I realized, THAT IS ONE OF THE BIG THINGS I MISS ABOUT DRINKING!!! It dawned on me that Im pretty extroverted and have a high tolerance for social vulnerability but that not everyone else is, without booze. I had avoided hanging out in bars and my friends have been drinking less. But the friendly encounter with some strangers reminded me that I can still find that sense of connection, the one that comes from people who are being a bit more vulnerable around each other, in a bar without being drunk. Posted unedited as a stream of consciousness writing"
57,vulnerability,stopdrinking,24 Hours Sober  This Stumbling Journey,16,cpp1vt,https://www.reddit.com/r/stopdrinking/comments/cpp1vt/24_hours_sober_this_stumbling_journey/,2019-08-13 16:13:10," They say that issues with alcohol run in families, and thats true for me but probably not in the way you expect. See, my parents never drank when I was growing up. I have no recollection of my mom having a glass of wine with dinner or dad bringing home a six-pack or even sitting at a bar. I remember one family function when my uncle let me taste a beer in front of my parents  I thought it was disgusting and my mom and dad were happy to agree. That one sip of beer was the only bit of alcohol I consumed in the first sixteen years of my life. But before I was born, I believe that alcohol played a defining role in my very existence. I knew I looked a little different than my sister, who was younger than me by five years and who had been born about nine months after my parents were married. Sometimes teachers or people at church would look at me a little longer when my family was introduced. Its not that I was born with two heads, but in suburban Wisconsin, people in the nineties took note of pretty much anyone with a trace of color in their complexion (in the most polite way possible, dontcha know). So for a long time, I was aware that my dad wasnt exactly my dad the way other kids dads were. And one evening as my family was about to watch a movie, I distinctly remember, as I climbed onto the kitchen counter to get a bowl for popcorn, I turned to my mom and asked, If dad isnt my real dad, then who is? I assume that probably fucked up movie night. So for one thing, my mom and dad were more or less compelled to bring out the birds and bees routine maybe a few years earlier than they were aiming for. After that lovely primer (including vaguely-anatomical, hand-drawn visual aids), I learned that when my mommy came back from art school to live with grandma, she was surprised to find out she had returned with a bit more than an A.A. in Graphic Design. They named me Matthew, which meant Gift of God and was also the most popular baby name of 1987. It was between that and Shane, which coupled with my Scotch-Irish heritage would have really completed the whole born lush persona, so thankfully Matthew won out. As I grew older, in bits and pieces I uncovered a few more details about my origin. Apparently mommy didnt remember who she had met those years ago in college, the young man who would become my biological father. There was a party where she fell asleep and woke up on a couch and didnt remember how she had gotten there. When I was old enough to comprehend the idea of rape, she told me that she thought that someone had probably slipped something into her drink, since she had never partied at all high school and had never blacked out in college. This childhood knowledge of the act and ignorance of the actor painted the source of half my genetics, perhaps half of my self, as nothing but a monster. Growing up in a very religious family, I learned up to three times a week about the polarized duality of good and evil, heaven and hell, angels and demons. And as my hormones charged my slight rebellions in adolescence, I began to suspect that perhaps there was a trace of the devil in my own blood. In fact the second half of my life thus far was precisely delineated by my induction into binge culture. I remember reading in middle school about the spread of heavy drinking and hazing on college campuses nationwide and thinking why would anyone ever have so much to drink that they blacked out? Fast forward through a few years of stellar grades, one half-ride scholarship and deeply-repressed emotional trauma from the antagonistic relationship with my stepfather, and I find myself on the business end of a handle of Smirnoff triple-distilled vodka, playing Halo 1 on PC and really having a ball letting my motor skills go to shit. What will fourteen ounces of 80 proof spirits in the span of two hours do to a first time drinker who weighs roughly 130lbs? First youre playing video games and laughing with your nerdy pals. Then a glimpse of vomit running down the wall of your dorm room. Cold water from the shower head, soaking through your clothes as you cry and apologize. A quick ride in the backseat of a squad car but no flashing lights  this is business as usual. A nurse who raises her eyebrows and scoffs at my roommates claim that it was my first time drinking. The taste of charcoal and a number: 0.29. That number (my blood alcohol content upon admittance to the ER) was high enough to be considered an act of self-harm by the university I was attending. I didnt tell them who provided the booze, because I aint never been no snitch, but they placed me on some type of collegiate probation anyways. I remember having to go to one session of counseling with some person who was likely a grad student. I have always been more eager to please authority figures than I have been willing to show vulnerability, so Im sure the paradigms and strategies I presented for avoiding risk-seeking behavior in the future were well polished and convincing. My mom and stepfather (henceforth known as dad) and twelve-year-old sister didnt have to see me in the hospital room because I was released once my BAC dropped enough. They met me at a McDonalds across the street from my dorm. My dad appeared concerned and relatively inexpressive. My mom tearfully asked me why I had done this. My little sister looked at her best buddy and hero with some mixture of sadness and puzzlement. They bought me a filet o fish, walked me back to my dorm and hoped for the best as they packed back into the minivan. This was day one of a journey that I stumbled down, at times cloaked in the invincible armor of euphoria and hubris, at others weeping from the rawest vulnerability, and drifting into every blackout as a solipsistic wanderer, disconnected from my own ability to record new memories, unable to decode the intentions of loved ones, drawing from a deep well of instinct and trauma, and entering the dreamless void absolutely alone, as a man goes through the door of death  but unlike death, this darkness would take me more times than I could possibly count. Number 1 and 2 of my drinking days were far enough apart that I assumed I had gotten the binge bug out of my system. In fact I swore Id never drink again, but when its been a couple of months and youve been fine, maybe your friend from down the hall offers you a screwdriver because thats not really hard liquor anymore. And maybe you find a case of beer abandoned on the beach a week later. And then theres some jungle juice at the frat party that youre pretty scared to be at. Lo and behold: a habit. Alcohol has some pretty interesting metabolic pathways that Im not educated enough to comprehend, but the most relevant interaction its had for me is how it affects my mood. When Im sober, Im a pretty witty gentleman but after three drinks I have a quite charming manner, after six Im your best friend forever, after twelve Im either gonna fight you or fuck you and if not, fuck off. This seems fairly common and is in no way charming in reality. But the real inscrutable chemistry are those hangover mornings, especially as I age (and not like fine wine) those depleted, glazed-over conference calls where I have nothing to give and lately, the suicidal thoughts that buzz around like flies in my serotonin-starved brain, things Id never consider if not for stripping myself of all chemical support. Sometimes on waking, disoriented and dehydrated, Im blessed with an hour or two of mania where I feel intensely dramatic and oft wax poetic in the mirror like some deranged, diseased Thespian. And then on a weekend I fall asleep, or on a weekday I parlay that mania into a few hours of poor work. Of course if youre a true American, instead of letting yourself black out, you can always just find some good old-fashioned Cocaine. That way, youll remember being an asshole and the hangover will be ten times worse. Rough start to your day? Try some Adderall - look for it in the school supplies aisle. And the cycle compounds. If these Calls to Action sound somewhat convincing, know that I have the craft of a serpent: I am in marketing, where half-educated people with severe emotional inadequacy are employed to spread their anxieties throughout the public for immense profits. The little boy who wanted to protect his mommy and all women from evil monsters is now slightly brutish himself. As I became aware of the willful fallibility of memory and the ways nice guys treated girls when one or both of them had been drinking, I began to wonder if a Rohypnol-induced violent rape was really the starting point of my journey. This made me wonder a bit if that horrible beast I pictured in my youth was just a young man in 1986, finding out he was a bad drunk a few decades before the biological son hes never met would do the same. A few years ago my dad who raised me gave me a DNA test kit and I still havent spit into that cup. Im not ready to meet the shaded side of my family tree; Im afraid I might see a glimpse into a cursed future, but you never know. In the right timing, that could be part of my healing and recovery. I saw a post online the other day that defined a new word for me, it was hamartia. This word was employed by the Greeks in describing the tragic flaw in a character that leads to disastrous results. It comes from a root meaning to miss. I have written thousands of social media posts, hundreds of journal entries, dozens of essays, a few poems and a screenplay or two but never has the subject focused so unbearably closely on what I see as one of my greatest weaknesses. And despite my dry and religious upbringing, I know that drinking is not a sin for all. My fatal flaw is not indulging in true evil, but simply a miss. A mistake is a thing I can relate to. And there are stretches of days or weeks when I hit my target, my sober life where I feel like the hero of my own story again. But then the fear and alertness to my weakness softens, and I miss again. Last night I missed, not too horribly, but enough to strip away the veil of comfort from my mind and start me thinking about what my life will look like after another decade and a half of this stumbling journey. Im afraid of where Ill find myself, of what Ill think of myself, and if Ill even make it that long at all. Though Ive described blacking out as a solitary venture, waking up youre never alone. There are the friends who fill you in on your antics, and sometimes it isnt quite as horrifying as you fear. There are the lovers who saw you clearly at your worst, who are mentally packing up and leaving already. And theres your family, who will answer every pathetic morning-after text searching for sympathy, partly because they love you and its what they believe is right, and partly because they are afraid of what youll do without their support. So you stumble along this path thinking that you trip alone, but dragging those close to you along for the ride, like so many hostages to your habit. That twelve-year-old sister from earlier in the story grew up to be a strong, intelligent and balanced young woman and is one of my best friends in the world. My dad and I dont really speak too deeply about anything, and my mom dispenses advice and motivation regularly but cant tell me what to do. So it falls to my sister to pick me up, to eventually tell me that she cant counsel me until I seek professional help, to send me a link to a counseling service website, to venmo me the $50 to sign up for the consultation and then to find I never filled out the paperwork to complete the application. Well today I told her Im going to finish this. Im going to start therapy this week. I already teleconferenced with my potential therapist who is a super glowed up African American lady which for some reason makes me happy. Hopefully hourlong sessions twice a month will be helpful. In the last year I started working out like a maniac (thanks, yet-unknown mental disorder) so I realized that I do have the willpower to make lasting changes based on habit. And, according to a great pal of mine, if I treat my brain like my biceps, I can turn this journey around. I can hit my target, which is a good life where my family is proud I overcame this affliction, where Im capable and trustworthy enough to have my own family, where I find myself on some morning mountain truly free and clear. Ive been sober for 24 hours now. I need every trick in the book to beat this shit. Im humbled to be in the presence of those who have been down even darker paths and recovered. I want to be like you, and Im ready to work. Thanks for reading."
58,vulnerability,stopdrinking,"The Daily Check-In for Wednesday, August 14: Just for today, I am NOT drinking!",106,cq71gt,https://www.reddit.com/r/stopdrinking/comments/cq71gt/the_daily_checkin_for_wednesday_august_14_just/,2019-08-14 18:58:49,"The Daily Check-In for Wednesday, August 14: Just for today, I am NOT drinking! *We may be anonymous strangers on the internet, but we have one thing in common. We may be a world apart, but we're here together!* **Welcome to the 24 hour pledge!** I'm pledging myself to not drinking today, no matter what happensgood or badand invite you to do the same. Maybe you're new to [/r/stopdrinking](URL and have a hard time deciding what to do next. Maybe you're like me and feel you need a daily commitment or maybe you've been sober for a long time and want to inspire others. It doesn't matter if you're still hung over from a three day bender or been sober for years, if you just woke up or have already completed a sober day. For the next 24 hours, lets not drink alcohol! **This pledge is a statement of intent.** Today we don't set out trying not to drink, we make a conscious decision not to drink. It sounds simple, but all of us know it can be hard and sometimes impossible. The group can support and inspire us, yet only one person can decide if we drink today. Give that person the right mindset! What happens if we can't keep to our pledge? We give up or try again. And since we're here in [/r/stopdrinking](URL we're not ready to give up. **What this is:** A simple thread where we commit to not drinking alcohol for the next 24 hours, posting to show others that they're not alone and making a pledge to ourselves. Anybody can join and participate at any time, you do not have to be a regular at [/r/stopdrinking](URL or have followed the pledges from the beginning. **What this isnt:** A good place for a detailed introduction of yourself, directly seek advice or share lengthy stories. You'll get a more personal response in your own thread. This post goes up at: USNight/Early Morning EuropeMorning Asia and AustraliaEvening/Night A link to the current Daily Check-In post can always be found near the top of the sidebar ***** Happppppy Hump Day SD-ers! It's cold and grismal (grim + miserable) here in London but it's nice and warm in this sub! And despite the rain, it's a beautiful day not to drink and so I won't! Today's quote come from Brene Brown's books *Braving the Wilderness* (all of her books are fantastic - her [Ted Talk](URL is a good taster): Are we willing to show up and be seen when we cant control the outcome? When the barrier to vulnerability is about safety, the question becomes: Are we willing to create courageous spaces so we can be fully seen? A soft and open front is not being weak; its being brave, its being the wilderness."
59,vulnerability,stopdrinking,Reflecting,9,cyciku,https://www.reddit.com/r/stopdrinking/comments/cyciku/reflecting/,2019-09-02 03:05:02,"Three years ago I barely got out of bed, but when I did it was to drink and be self destructive. I was falling behind in all of my college courses. I barely ate anything, other than lucky charms and microwave macaroni. I was pouring whiskey into my beers. I was depressed, lonely, and felt worthless after getting out of a long, toxic relationship. Today I woke up early on a Sunday to eat a bowl of steel cut oats before my yoga class, and just got back from a leg workout. I haven't had alcohol in over two months. I'm in a healthy, stable relationship, I have a job, and I'm teaching myself how to code. I feel like my brain is clear. Things aren't perfect, and I still get angry sometimes that others can drink and I cannot, that people will judge me, that there is a lack of knowledge about alcohol and addiction, but overall I am so glad I made this decision. It took me a while to get here, a lot of self reflection, a lot of vulnerability. I want to give myself credit for how far I've come. I am happy. IWNDWYT."
