,topic,subreddit,title,score,id,url,created,body
0,vulnerability,stopdrinking,"If you're back on day 1, read this...",1,i6zojv,https://www.reddit.com/r/stopdrinking/comments/i6zojv/if_youre_back_on_day_1_read_this/,2020-08-10 16:27:10,I know the anxiety and the shame and the depression and the raw vulnerability you might be feeling. A huge dose of poison rocks every system of our bodies. The body and mind need time to heal. Be gentle with yourself right now. Reliving your mistake won't undo it. We're human. Humans mess up. I know how much resolve comes along with that. I'm never doing this again. That's it. No more. Pouring this out. Gonna read Annie Grace. Alcohol causes permanent changes to the brain. It makes the brain believe Alcohol is necessary to survive. Fighting your own will to survive is not a winning battle. Staying away is a daily fight. Writing this is my fight for today. Helping someone else. I know it sucks being defeated by a beverage. But that's the reality. We're here. And our struggle will become our prized possession for all the wisdom we gain along the way.
1,vulnerability,stopdrinking,Passed 3 year soberversary a few days ago (:,1,i8xa00,https://www.reddit.com/r/stopdrinking/comments/i8xa00/passed_3_year_soberversary_a_few_days_ago/,2020-08-13 20:10:19,"The ongoing relief of living a life vastly more congruent with my values is amazing. Also, being sober has allowed me to engage with my mental health (i.e. deep seated shame issues) in a genuine and healing way that never could have been possible drinking. We drink to escape the things that require sobriety to cure. Thank you, sober community, for the support, empathy, vulnerability."
2,vulnerability,stopdrinking,"16 months sober, feels like Im doing it completely alone and it sucks",1,ibcdlu,https://www.reddit.com/r/stopdrinking/comments/ibcdlu/16_months_sober_feels_like_im_doing_it_completely/,2020-08-17 21:29:42,"I have one good friend and feel as if shes pulling away from me, my family constantly made fun of my addiction but has said next to nothing about my sobriety, and oh yeah the pandemic where we cant leave our houses or live normal lives. I was really okay with being alone for the most part when I could go to concerts and other social events often, but now its starting to drive me crazy. Im so tired of this. And I know its the new normal or at least will be in the states for the next year or so, and I dont know if I can adjust. I really had no desire to drink or smoke pot when my life was full of events and new experiences and culture and activities. Now its more tempting than it was in early sobriety. Plus Im legal drinking age now so if I really wanted to I could go buy booze or go to a bar and get wasted for the first time *legally*. Intimacy and vulnerability is so hard for me so making new friends is really hard. I know I push away everyone who wants to be my friend, I have for years now. Sorry this isnt very coherent or cohesive Im just rambling about self pity at this point. I miss the world pre covid when I was really vibing with sobriety and reaping the benefits, being able to drive whenever I wanted, afford to go on trips, go to events not make an ass out of myself etc etc."
3,vulnerability,stopdrinking,What I've learned this year reducing my alcohol consumption,19,hx7epx,https://www.reddit.com/r/stopdrinking/comments/hx7epx/what_ive_learned_this_year_reducing_my_alcohol/,2020-07-25 04:41:11,"I posted a few months ago about having trouble accepting never drinking again, and got some wonderful feedback. Since then, I've still greatly reduced my drinking, but haven't fully cut it out completely for more than two weeks. And I'm okay with that, because of all that I've learned: 1. Bourbon flares up my arthritis. Yes, the gluten-free, no-carb alcohol I used to rave about. During one of my last nights binge-drinking, I felt fine while drunk until I switched to bourbon, and immediately my joints started aching. I said to myself: ""I'm never doing this again,"" dumped the bourbon down the drain, and went to sleep. 2. I can't be a casual drinker. One day I'll have a beer, the next day 2, and by the weekend I'm binge drinking after my husband goes to bed. Also, you can \*still\* get a hangover from just two drinks. 3. After just a week of not drinking, I feel like me again. One night I was cooking dinner with my husband, listening to music back from high school, dancing with him and just laughing and goofing around, fully sober. I realized I hadn't seen my true self in almost three years. 4. I don't want to be a wine mom. When we have kids, I don't want to be the mom that pours herself half a bottle of wine in a huge glass to ""deal"" with motherhood. 5. I will not be able to meet my health goals if I drink. In college I lost a lot of weight, and while it was definitely due to diet and activity (I miss not having a desk job), a huge reason was because I wasn't drinking. I went to a Christian college without a drinking culture (weird, right?) despite it being one of the more liberal religious colleges. 6. It's not about ""being strict,"" it's about creating a life that just doesn't involve drinking. Thanks to you all for your support and vulnerability here! Joining this sub has changed my life."
4,vulnerability,stopdrinking,Who struggles with Shame? Vulnerability? I have something for you!,1,hxncp9,https://www.reddit.com/r/stopdrinking/comments/hxncp9/who_struggles_with_shame_vulnerability_i_have/,2020-07-26 00:11:47,Shame! It is so powerful. I won't give you a long story but shame has been in my life for the longest time and has had such negative impact and even fueled some poor decisions. Brene Brown has an awesome documentary on Netflix called The call to courage. I highly recommend it. She highlights the difference/connection between vulnerability and shame. One of her key points about vulnerability: 1) It is not a weakness 2) Being open and sharing significantly helps (aka why this sub is so great!) Have a great weekend!
5,vulnerability,stopdrinking,let him who hath understanding reckon the number of the Beast,28,h8amn1,https://www.reddit.com/r/stopdrinking/comments/h8amn1/let_him_who_hath_understanding_reckon_the_number/,2020-06-14 02:27:41,"*for it is a human number, its number is six hundred and sixty-six* Scream for me, r/stopdrinking! Okay I'm done now lol. It has been a few months since I posted a milestone, &amp; what a beautiful one :P. Major credit to the amazing people sharing their struggles and wisdom and vulnerability here. Also quitlit helped me a lot, my favourites were Alcohol Explained by William Porter and The Unexpected Joy of Being Sober by Catherine Gray. I love you. If you're struggling in early days, it gets so much better. My goal is likely the same as yours: just for today, I won't drink. We're in it together. iwndwyt "
6,vulnerability,stopdrinking,Thank You!,1,hapgnu,https://www.reddit.com/r/stopdrinking/comments/hapgnu/thank_you/,2020-06-17 21:36:01,"The outpouring of support I received from yall, last week....I cant even describe what that meant to me. I am so happy to be free of poison! I am also delirious about the new American Cancer Society guidelines on alcohol...ZERO alcohol. As a cancer survivor, this gives me one more feather in my cap, to use, when speaking to friends who are appalled I no longer drink. Thank you guys SO, SO, SOOOOOO MUCH....a bunch of strangers, who have shown me more humanity and vulnerability than have so many close friends. I am particular thankful to the adult children of alcoholic mothers, who shared their stories with me. I am already noticing a change in my relationship with all 3 kids, ages 13, 11, and 9."
7,vulnerability,stopdrinking,Made my first apology,7,he1mzi,https://www.reddit.com/r/stopdrinking/comments/he1mzi/made_my_first_apology/,2020-06-23 07:51:05,"Sober for 121 days. Havent told anybody until yesterday. It was to the person who found me during my last drink. Who I ignored for months because I didnt want to confront what Id done. Giving up drinking has taught me that you cant run away from your problems. Trust me, I tried by leaving the state haha. The past four months Ive been weighed down by the guilt and shame over that moment. I was worried shed never forgive me, or wouldnt look at me the same if I ever came back and apologized. Instead, she told me she had never changed her opinion of me. She always loved me and she always saw the best in me, even when I couldnt. Idk, I know not everything on this journey will go well. I know there are mistakes Ive made that might not be forgiven. But its solidified to me that vulnerability is a strength, and that its okay to place my trust in others. That Im on the right path, and when I need to tell other people that Im sober, Ill have the courage to do so. Just wanted to share, thanks."
8,vulnerability,stopdrinking,Principles Before Personalities.,1,hgj6ie,https://www.reddit.com/r/stopdrinking/comments/hgj6ie/principles_before_personalities/,2020-06-27 10:05:03,"So Im struggling. The pandemic halted my usual routine and Ive been disconnected from AA for a while. I reconnected with my home group, but the current media on BLM protests and the division between people in regards to the pandemic has caused so many people to be more vocal about their bigotry and their inability to understand human rights. I dont think these topics necessarily need to be discussed in AA, especially not during a meeting, but they were, and not by my choosing. Ive been attending Secular AA because traditional AA in my area is very religious, I think more so from other areas from what I can gather. My home group started to get together at a members house, and I finally decided I needed to go. I held off mainly because I work in healthcare and didnt want to risk anyones health, but they continued to invite me. It was in this meeting just yesterday, during a group discussion the owner said, ""All these protesters and looters are just about the largest group of uneducated people who have ever gotten together in one place"". I suppose this was forgetting the fact that these protests and rallies are happening globally in many places, with millions of attendees spread across the world as they've been going on for weeks now. I then voiced, I've been going to these protests, are you calling me uneducated?"" To which he replied, ""Well, you also have these white liberals who just want to feel good about themselves."" The room went silent, no one had anything to say, and the subject was changed. I didn't speak for the rest of the meeting and went home without checking in with anyone. I went to this meeting rather vulnerable and made that vulnerability known prior to these statements, stating that Ive been wavering and thinking about drinking. I don't have thick skin at the moment. So I decided to start reaching out to people Ive known from other traditional meetings and see if anyone is meeting up online or elsewhere. I vented to a friend who attends other meetings and he was sympathetic, he invited me to his home group online meeting. Then, quickly, the conversation took a turn. He knows that I normally attend Secular AA and hes known I dont really buy into the higher power stuff. It was through messaging, and this was the exchange: AA: Are you still holding fast to the objection of some sort of unseen power in the universe? Me: Haha yeah. I mean, unless you mean gravity. But a divine omniscient being or power, yeah. AA: I dont think youre an alcoholic. I dont mean that in a hurtful way. Me: Why do you say that? AA: Ive been sold on the ideas and conceptions presented in the big book of Alcoholics Anonymous. Me: Okay? So you dont think someone can have the physical and emotional compulsion to drink alcohol and have self destructive behavior unless they agree with everything in a single book written from 1939? AA: Difference in being a hard drinker and a real alcoholic. Same with addicts. There are people who used to do heroin but smoke weed and drink now in safety, and then there are people who are real addicts. Just my experience. Me: I do take offense to what you said because my brain looks for excuses to drink. To tell an alcoholic that theyre not an alcoholic, especially during a time when their foundation is shaken, that could lead to relapse. Ive done enough research to know I cannot drink in safety. AA: Youre essentially agreeing with me, if youre able to quit drinking on your own without some help from some fantastical sky daddy. You aint got what I got. So basically I feel pretty hopeless right now, like I dont much belong anywhere. Im reaching out, trying to get a message of recovery from other alcoholics and Im getting insults about my politics and views on human rights issues, and Im told if I dont believe in god then Im not an alcoholic and can probably drink in safety. Looking for some support. Feeling extremely alone in this right now."
9,vulnerability,stopdrinking,Celebrating two years of my soberversary!,19,hhgsye,https://www.reddit.com/r/stopdrinking/comments/hhgsye/celebrating_two_years_of_my_soberversary/,2020-06-29 01:57:19,"Thanks to everyone in this community. I am on here every single day for the past two years. I could not have made it this far without all of you all. I couldnt do it with out all of the raw truth and love and compassion and vulnerability that pours out of here daily. Thank YOU! Thank ALL of you. I thank the long termers, newbies, returns, fresh starts, and old farts. Thank you all for being brave and kind. IWNDWYT"
10,vulnerability,stopdrinking,90 check-ins in 90 days,3,hi69bm,https://www.reddit.com/r/stopdrinking/comments/hi69bm/90_checkins_in_90_days/,2020-06-30 05:03:24,"I'm in a weird spot today. Actually I have been in a weird spot for close to a month. My cravings have started to get strong, I'm day dreaming about drinking, wishing I could be alone in this house so I can drink without being held accountable by anyone. I never did the AA thing, I've wanted to, but my anxiety has always gotten the best of me, even after a year of sobriety under my belt. I reached out to the one sober person I admire and look up to (although we've never met, and have only had small talk online, mostly about sobriety), and she sent me some Zoom meetings to check out. I'm going to try to work up the courage to try them this week. I also told myself the least I could do is check-in here for 90 days, starting today. It'll be my little version of 90 meetings in 90 days. Writing/journaling has always been a solid tool for me, and I've struggled with it over the last month, so maybe committing to coming here every day will help me get back on track to a better mental space. Writing a little or long post explaining where I'm at mentally, physically, spiritually, is also going to be a real test in my ability to allow people to see me be vulnerable. I struggle to even let the people who have known me for most my life see me be vulnerable. I think I can't even keep a therapist for the same reason. I haven't found anyone who I feel completely comfortable opening up to. And I think that's part of my fear around AA meetings, I watch all these people so bravely open up and share their vulnerability so gracefully (most of the time), and then I feel this pressure to open up in the same way, but allowing my true feelings to come out into the open has only caused an emotional reaction out of me. Like full on panic attack melt down in front of a room full of strangers. My hope is that posting here daily for 90 days, talking about the same things I would want to talk about in an actual in person meeting will help me learn how to get comfortable with expressing myself, and not just having the knee jerk reaction to melt down and just cry. I mean crying is helpful and healthy, but it doesn't feel like it should be my only way of expressing what I'm feeling. And I think that learning how to express what I'm experiencing is an important next step in maintaining my sobriety. If drinking is a knee jerk reaction to numbing some deeper trauma that I've experienced, then eventually I'm going to need to confront this trauma so I can release it to the best of my ability. Otherwise I'm going to just keep ending up back in this heavy mental state with a desire to numb what I'm feeling with alcohol. Honestly I'm surprised I've made it a full year without realizing this sooner. So, where am I at today, day one? I haven't drank, but I did go on a little bit of a weed binge this weekend. You know, just replaced one numbing substance (alcohol) with another (weed). I think I'm currently in the depths of a weed hangover. A part of me just wants to get back in bed, and keep the stony state of mind going, but I don't think it's going to help me get out of my current depressed state, it's most likely just going to make it worse. I do have a stack of work to get done. I can either put it off for one more day, or just get it done today. I still haven't decided what I'm going to do. The longer I sit here, the more mentally and physically exhausted I feel. Maybe I need a day to just be. Problem is I'm a perfectionist that gets anxious and down on myself when I stay still for too long, and the flip side of that is that I also don't know how to tell when I actually do need a break, and how to not beat myself up for allowing that break. Anywho, I think I'm going to end on that note. I feel a bit lighter getting that all out. I think I'm going to do some chores around the house. The pup is pawing my leg right now, I think he's asking me to join him for hangs in the backyard, so I'll take him up on that offer :) I'll try to be gentle and kind to myself while I move through this slightly depressed weed hangover state of mind, and if I get the motivation to work later, then I will, but if I don't then I will rest for today and get my work stuff done tomorrow. I will not drink with you today, and I'll talk to you all tomorrow ;)"
11,vulnerability,stopdrinking,Day 2 - how long do withdrawal symptoms last?,1,gduxpg,https://www.reddit.com/r/stopdrinking/comments/gduxpg/day_2_how_long_do_withdrawal_symptoms_last/,2020-05-05 19:56:52,"Hey friends. Thanks for being here. This is tough so far and it's nice to have this subreddit for a simple distraction when I need it and the IRC just to chat a bit when I need it. Today is my Day 2. I live in Japan, maybe I set the thing wrong, whatever, today's my second full day of not drinking. It's been a tough day. Anyway, this is part feelings-dump and part question: how long do withdrawal symptoms last? I've got a couple of the usual ticks, but what bothers me most is that I'm just really sweaty. I noticed in the last week or so that I was disproportionately sweaty for the weather. I thought it was due to the weight I gained drinking and I'm sure that didn't help but I really just want to not be sweaty anymore. :( Is it weird that not being sweaty is a good motivator for me in this? Summers in Japan are *brutal* and I'm just realizing my drinking may be contributing to my heat exhaustion vulnerability. I got it four times last summer, once or twice despite my best efforts to stay hydrated, even, and it's uncomfortable both physically and mentally. Sorry for the ramble. Just tryna not ruin my futon. It was expensive."
12,vulnerability,stopdrinking,"I'd like to stop drinking as much, but, the worldwide pandemic that's sweeping the globe, and promising to usher in eternal night and all, is, really, concerning as someone who has had multiple lung surgeries, life-threatening pneumonia and has immunocompromised family members.",2,ge1igu,https://www.reddit.com/r/stopdrinking/comments/ge1igu/id_like_to_stop_drinking_as_much_but_the/,2020-05-06 02:58:15,"My psychiatrist has prescribed me anti-anxiety medication that I can take on-demand as spot-treatment for post-traumatic stress disorder, which, ironically, is related to lung surgeries, and severe pneumonia, but, I'm still on the fence about it since I've heard that benzodiazepines can limit gross motor function, and I work out regularly. But, I'm also a software engineer, and, I need to be able to think creatively, otherwise, my career is bound to stagnate since creativity is how I solve problems within my research domain. Has anyone else found it difficult to limit, or abstain from alcohol as a direct result of the worldwide pandemic that's sweeping the globe, and promising to usher in eternal night, and whatnot? Often times, I wake up with lung pain, but, it's always anxiety-related, but, that triggers a trauma response - at that point in time, I can either wait an hour or two for the pain to subside or have a drink and use that as a form of spot-treatment so I can get on with my day. The medication that I was prescribed is ideal, but, I've always been hesitant to try benzodiazepines, or any other anti-psychotics due to the potential impact on my career - alcohol just seems, safe, until it's not, and, I really want to find something that works better. I'll be setting up a home gym within the next month, or two, since I can't work out anymore, and prior to the worldwide pandemic that's sweeping the globe, and promising to usher in eternal night, I had things under control - but, after that, is a different story. After reading articles that talk about how cases of severe pneumonia observed in COVID-19 patients only presented themselves when those cases were either severe or life-threatening, really hits home, especially as someone who has a familial vulnerability to these types of things - my entire family is in the same boat. Alcohol just seems to, help, and, while I've traditionally limited myself to 2-3 beers/day, it's moved into the 6-8 beers/day category, and while I can easily get down to 3-4, that's still, concerning to me, and I want to find healthier avenues that I can take advantage of, including cognitive behavioural therapy (CBT). But, every time I experience lung pain, which, is every 2-3 days, I can't help but wonder if this is going to be my last week, and that's, a difficult thing to grapple with. On top of this, I've lost one of my closest friends in the last week because they thought that by going outside, I was effectively communicating that I would kill my elderly neighbours without remorse, and, as someone who's, vulnerable to COVID-19, and has direct family members who are vulnerable, that, really hits home. It really got to me because one of my brothers doesn't have a primary immune system, and my mother has a compromised adrenal system, which apparently makes any sort of viral infection potentially life-threatening. But, that's, an aside. I just, want to find a better way forward. But, at the same time, I need to figure out how to drown out the noise that's been created by the worldwide pandemic. What's, worked for you?"
13,vulnerability,stopdrinking,I failed but I'm still succeeding,4,gh7fqn,https://www.reddit.com/r/stopdrinking/comments/gh7fqn/i_failed_but_im_still_succeeding/,2020-05-11 05:10:05,"I wanted to share my failure in a challenge I tried this weekend, which I mentioned in a few posts this past Friday. I was trying to run 4 miles every 4 hours, for 48 hours. I did not get very far. I ran 4/12 of the challenge (5am, 9am, 1pm, 5pm) then I called it quits. I could have done 9pm and maybe 1am, but I called it early because I knew I wasn't going to make it to the end and/or I would have made myself sick or extremely fatigued and fucked up. I wanted to enjoy my weekend more than suffer that much. Im sharing this for two reasons. First, because I still feel some accomplishment because I have never run 4 times in a day, and hardly at midday in 80+ degrees. Second, I feel that this subreddit is like family. I get on a lot of subreddits but I only really post and interact on this one. I just want to acknowledge that I feel strong and I wouldn't be who I am today had I kept drinking. I am almost a 1000 days sober and I have definitely gone through changes. Maybe it's aging as well, but I have become more aware of my vulnerability through sobriety but it's a good thing. When I was drinking all the time I thought I was invincible and that death and suffering is easy. That was bullshit. Drinking and chain smoking was easy. Being sober takes a lot more courage and strength than I ever knew. Thank you for reading, and get after it!"
14,vulnerability,stopdrinking,thank you for sharing,1,gj6nba,https://www.reddit.com/r/stopdrinking/comments/gj6nba/thank_you_for_sharing/,2020-05-14 06:08:49,"I've been reading this sub for about a week now. I'm so happy I found it! I've related to so many things said by so many different people. It's nice to know that I'm not the only one with these problems and habits and thoughts. It's nice to know that we're not alone. To everyone who takes time to share their experiences and stories, and reveal insightful (and sometimes embarrassing) details of your experiences: thank you. It has been an eye-opener for me. I've seen some other people admit to lurking too. Which made me want to come out of the shadows and say thanks, and to let you know that the advice and support and vulnerability that you share is appreciated by people who participate and people who stay silent while we work things out. Thank you!! And to everyone (including my fellow lurkers); keep up the good fight! Love you all!"
