,topic,subreddit,title,score,id,url,created,body
158,vulnerability,stopdrinking,anesthesia and recovery,3,76pacg,https://www.reddit.com/r/stopdrinking/comments/76pacg/anesthesia_and_recovery/,2017-10-16 20:09:21,"Some may of you may or may not know that anesthesia effects recovery. I just had surgery &amp; before going into it I was super nervous cause I read all these things but didn't understand what I was going to go through. So, I thought I could make a thread for those who were going to have this experience. First off, I didn't think it would affect me. 1. I felt guilty, a massive amount of guilt (like first-day sober guilt) 2. I got angry, I was angry at everyone for everything 3. Those emotional things I thought I was dealing with and had accepted or come to an understanding.. well that all disappearing in a bundle of emotional vulnerability where I lost it. 4. I went off my SSRIs for a couple days (that was awful) That is just a few things. Luckily my husband was away on a work trip so my mom took care of me. Cause I had a lot of unreasonable anger come back at him. I think it would be good to prewarn your caregiver of the emotional rollercoaster that comes with surgery cause I completely forgot those happen even if my mother didn't &amp; my husband has never had surgery so he would have thought I was crazy again. Also, the terrifying thing of painkillers was it replicated me being drunk. I relived my rock bottom. It was terrifying feeling like I was trying to get sober but I physically need to drink to get past the withdrawals. The fear of if I didn't drink I would have DTs &amp; a seizure again. (Luckily I knew there was absolutely no chance of alcohol being in my system). Also, painkillers tend to make me relive my childhood trauma &amp; my night terrors that had been subsiding came back full force. But I waited for cause if it got better quitting drinking when my only other option was death. I could do it. I stayed sober."
159,vulnerability,stopdrinking,Today's the Day,2,6vbmai,https://www.reddit.com/r/stopdrinking/comments/6vbmai/todays_the_day/,2017-08-23 01:07:01,"I've decided to stop drinking from today onward. I've tried to limit my alcohol intake before, but, gradually, it has increased again to where I have between 3-7 drinks once or twice a week (at least). Although this amount may not seem like much, I've found that this amount affects me greatly in terms of the following day's hangover, concentration and productivity levels, not to mention specific mental and physical conditions. Because I am prone to anxiety, I find that, if I've been out and something stressful happens, I might sleep walk and cause undue stress for my girlfriend (and anyone else nearby). It's at the point where I'm worried about our relationship, as I love her dearly. To be more specific, I went to a pub last night (I live in NE England, although I am American) and my anxiety was triggered when a friend's friend got really aggressive towards me and tried to pick a fight. Luckily, the bartender and my friend both intervened, but I was shaken afterwards and I left relatively quickly for my girlfriend's house. However, I had consumed approx 6 pints, and when I fell asleep, I apparently sleepwalked and (I'm ashamed to say) urinated on her floor, prompting her to clean it up (as I was still asleep). Unfortunately, she couldn't sleep for the rest of the night and now she's justifiably angry with me. These instances have occurred over the past 2 years, but, as nothing like that had happened for the past year, I thought that whatever stress I was under had finished (I've recently completed my PhD). I've spoken with my friend from last night, as well as another friend, and I've decided that it's best that I stop drinking, since my vulnerability to anxiety leaves me correspondingly vulnerable to future occurrences of the same type. One cannot guarantee that every time they go out will be tranquil, and one cannot guarantee that sleepwalking wouldn't be triggered through just a few relaxed drinks either. I'm also fully aware that I wouldn't have gotten into this mess if I had not gone out last night. So this is it, the beginning of my alcohol-free, clear and present days. Thanks for reading, and I hope to be active in this subreddit for the foreseeable future. "
160,vulnerability,stopdrinking,Unsupportive partner,15,6pxxgk,https://www.reddit.com/r/stopdrinking/comments/6pxxgk/unsupportive_partner/,2017-07-28 04:27:19,"So, in light of other posts, this is likely to be a bit of a downer, but I am dealing with a partner who has been less than supportive of my sobriety and I think there are subconscious, unspoken resentments about my not drinking. My wife and I met on our first date at a bar. 5 beers (each) later, we were smitten. It's been mostly up, some down since then, but on June 25 after a particularly awful weekend, I swore off the stuff. She and I both come from a line of distinguished alcoholics, and I've decided that I've been to the top of the liquor/beer mountain and want to be the best father for my son I can be, and best partner for my wife that I can be. My wife still drinks, but only occasionally. However, she has used my vulnerability about being sober against me several times in arguments. She will say things like, ""you're just scared to go out and tell your friends you aren't drinking anymore"" or ""you've suddenly decided you're not drinking anymore, great!"". I think she is bummed because her drinking buddy is gone, hopefully forever. She asked me about my sobriety the other night with dinner and I told her it was going GREAT and she looked at me with a bit of disappointment. Guys and gals, I think I'm dealing with an alcoholic partner who secretly or subconsciously wants me to keep going with them. I just cant do it anymore. Anyone else deal with this? I will not drink with you tonight! "
161,vulnerability,stopdrinking,I Broke My Sobriety While Visiting A Friend This Weekend.,4,6i6us3,https://www.reddit.com/r/stopdrinking/comments/6i6us3/i_broke_my_sobriety_while_visiting_a_friend_this/,2017-06-20 00:47:05,"I had 73 days under my belt and knew that I would most likely break that sobriety streak - the longest streak I've ever had - during this trip. &amp;nbsp; I had an beer at a bar one night then the following night I had a glass of white wine at dinner with the same friends. It didn't get out of control at all! However, I do have a bit of anxiety now. It's like a sad void that I feel like I desperately need to fill right away. The trip was to New York City and part of the anxiety is because I'm sad that I'm back home now. The friend I was visiting is truly the greatest friend I've ever had the opportunity to meet. Also, it's New York and I essentially was a New Yorker for 3 full days: got a metro card, rode the subway, learned the railway lines, had a ton of options for food and entertainment e.t.c. It was an exciting experience like I've never felt before. It felt new, fresh, and warm. It felt like the first time I had a drink. &amp;nbsp; So being back home is bitter sweet. I wish I was back in New York and things were always fun and great and carefree and that I was with the best and most caring person I know (outside my family). Now that I'm back home, I remember why my alcohol problem got so out of control: I felt isolated. I felt like I had no friends here. I felt like alcohol would be a great substitute. Turns out, there's no substitute for life. There's no substitute for experience. There's no substitute for friendship. I have to be proactive. With this trip, I went out of my way to do something I've never done and that was be vulnerable and put myself out there to connect with a person I was interested in getting closer to as a friend and spend 3 days in a city I've never been in. My friend and this trip were both a reminder that I'm surrounded by some pretty amazing people that open me up to some pretty amazing opportunities. &amp;nbsp; **The challenge is to be proactive and never fear vulnerability or rejection or whatever is holding you back. Just do it!** &amp;nbsp; If I fix the issues that lead me to abuse alcohol three months ago, then abstaining from it moving forward or consuming it responsibly when I chose to will become easier. Even though I broke my sobriety, there's a light at the end of the tunnel and it isn't a freight train. It's the shine emanating from the many opportunities we all have available to us, all of which might give us a more happy and fulfilling life. We just have to reach and that takes effort. &amp;nbsp; So, it's been 24 hours since my last drink. I'm not sure how long it will last but I know that today I won't drink with you. I'll try and fix my underlying issues too so the road can be a bit more manageable, even after I stray away a little bit."
162,vulnerability,stopdrinking,Weekend Writing: Owning Your Sh*t,32,6kkz5p,https://www.reddit.com/r/stopdrinking/comments/6kkz5p/weekend_writing_owning_your_sht/,2017-07-01 14:05:51,"Last week at work, I made a really bad decision and took action against two of my team members based on something that another Director took offense to. I left right afterwards for the rest of the week and came back on Tuesday to find my team in total chaos, with hurt feelings, thinking I didn't have their backs, etc. While on my trip, *I* hadn't been able to let it go, because I knew I'd done the wrong thing. I came back prepared to apologize to the two people and found I had to apologize to my whole team and ask for their grace. When I was drinking, I would never have admitted I was wrong, would never have allowed myself to be vulnerable in front of my direct reports, and would never have been able to turn something like that around the way I did. I *think* (only time will tell) that this will actually make us stronger as a team and create deeper trust in me as a leader. At least that's my hope. And if that happens, it will be because I owned my shit, and showed strength through my vulnerability. **For your writing consideration:** ***Tell us about owning your shit, if you can, and what impact that has had in your life. And if you haven't been able to do that, what's getting in the way?***"
163,vulnerability,stopdrinking,Day One started with my husband offering me wine,12,6lmea8,https://www.reddit.com/r/stopdrinking/comments/6lmea8/day_one_started_with_my_husband_offering_me_wine/,2017-07-07 01:15:36,"Long-time lurker here. I can't believe I'm actually posting. Last night, I pushed through a thousand pounds of discomfort and did the thing I hate the most - admitted vulnerability. I told my husband that I had to stop drinking, but that I don't want to at all and I don't know what to do. I started to cry (also something I hate). I told him that the medication I've been on for two months comes with a ""no alcohol"" label, and that, according to what I read online yesterday, I've really been playing with fire by ignoring it. We had a conversation about my mental health and how drinking impacts it (short-term happy, long-term sad - something I learned on this sub). This morning, over coffee, he looks at our empty wine rack and says, ""we need to get some wine - the rack looks empty"". He doesn't drink wine. That's my bag. (In addition to bourbon, vodka, tequila, and beer). I am so lost. In one month, I will be 40. I have been drinking since I was 12. I have two beautiful children. I am an artist. The idea of letting it go gives me tears just thinking about it. Drinking is my favorite thing to do. I'm terrified that my art will suffer. I will lose creativity in songwriting and conversation and painting and ideas in general. The next to last thing I want is to stop drinking. But the LAST thing I want is to continue ""living"" my life in a blur, with my mood dictating me instead of the other way around. This is my one chance at life. My one chance with my children. Tl;dr - I'm scared and don't feel supported. "
164,vulnerability,stopdrinking,"Day 173 - You, all of you, never fail to amaze me.",13,6ca3xw,https://www.reddit.com/r/stopdrinking/comments/6ca3xw/day_173_you_all_of_you_never_fail_to_amaze_me/,2017-05-20 22:30:36,"Hey everyone, I had the most wonderful experience today. I woke up to a message from a Redditor, checking in to see I was okay, as I'd not posted here in a while. I don't know whether that person could ever know how profoundly meaningful that was to me. Someone I don't know, someone I've never interacted with, online or in real life, took the time to check in with me. Not only did that simple act boost my spirits for the day and make me even more grateful for this sub (something I didn't think possible), it also prompted me to post here again, and a bit more regularly in future. Not because I need to, but because I want to. I've had an incredibly busy fortnight. Starting work has thrown my old schedule into disarray; I have to get up earlier, stick to a travel schedule, walk about 10km a day getting to and from train stations, meet new people (people who have never known me as a drinker - bloody hell that is a GOOD feeling), learn a million new things a day, and find a way to make space in the day for self-care. It's exhausting and exhilarating, and I am doing it! I'm not doing it perfectly, and that's absolutely good enough. Anyway, I am off for my week away by myself tomorrow. The 'mindfulness retreat' itself was cancelled due to low numbers, but I figured I'll go anyway and use the time to practice mindfulness, breathe, do a few yoga sessions (just for the comedy value - I guarantee I will be the one to fart and fall over, probably at the same time), eat well, and learn to be by myself. I'm keen to check in here more often, too. As I said, I don't feel I need to (in that i am not feeling on the brink of drinking at all), but I do want to. If there is any way that I can help someone else here in the way that you all have helped me, by sharing my experience or being here to listen, that's want I want to do. An, of course, we all know drinking is a sneaky sneaky thing, and I need to be regularly among people who can offer help if I do need it. So, that's it for me today. I am packing my books (by the way, if you are interested, Brene Brown has some amazing books on vulnerability and shame that I have found insanely useful and insightful), lots of gym gear (ever the optimist), and cross stitch gear, and I am ready to do this thing! I am a little nervous, I've never been away by myself before, and I am not very good at socialising, or facing unknowns (what if they're all super-fit, happy, slim, chatty rich folk? What if I get lonely? What if I;m not perfect at everything? What if????) but I am going to do it anyway. Thank you all for being here, and I am proud to not drink with you today. Talk to you soon, friends! "
165,vulnerability,stopdrinking,Starting over or not?,13,6fvmje,https://www.reddit.com/r/stopdrinking/comments/6fvmje/starting_over_or_not/,2017-06-08 05:10:50,"There seems to be a black/white view of the world when it comes to sobriety. We have a clean date, we consider any use as a relapse. But the text of the primary 12-step groups states ""we did not become addicted in a day, nor will we recover in a day."" Some paraphrasing but that's the jist of it. So my husband was hospitalized about 10 days ago. It was quite stressful &amp; I used opiates, not just to relieve physical pain, but to help me cope with the anxiety of my husband's vulnerability. Yet, even as I used, it was not the mindless oblivion of before. Rather I was able to observe myself more closely. It was similar to Grace's video of herself, deliberately drinking to objectively watch herself under the influence. While that was absolutely not my intention when I used, it became the consequence. I saw myself in an entirety different way. I was able to see my impairment, my ditherings, my loss of judgment and ability. I also knew that I would not continue to use. I gained valuable information about myself, information that I would not have believed without that specific data. So have my previous 58 days been a total loss? I can't believe that either. I have striven for a better understanding of myself and to that extent I have gained much. The information I gained last week adds to the database I'm accumulating. I found that knowledge once gained changes a person forever. I cannot go back to the unconscious person I was before, regardless of any substance use. That being said, I also cannot ignore the needs of my health. It's damaging to my body to use alcohol or abuse opiates. I want health: spiritual, emotional and physical. So I continue on my journey. "
166,vulnerability,stopdrinking,Feelings: the other F-word,2,6gsc7v,https://www.reddit.com/r/stopdrinking/comments/6gsc7v/feelings_the_other_fword/,2017-06-12 23:52:43,"Hello all, I'm not really sure what to write but I know I need to get this out, I feel like I'm spinning mentally, and although I am not currently craving a drink I feel like today is one of those days where a slip could happen if I'm not careful. I guess I could start out by telling you that I've never been very comfortable with emotions, or the feeling of vulnerability or weakness when they're expressed or I hit a breaking point. This has started getting better through the work I have been doing in sobriety, between my Step Work and I have recently started seeing a psychologist to work through some past trauma but I'm definitely still not comfortable expressing certain feelings, and quite frankly, they unnerve me. Today is one of those days. I'm extremely on edge and very unnerved. Yesterday was a mess, and after barely sleeping last night, I can feel myself unraveling at the seams. I can feel myself go from almost breaking down to going into autopilot and squashing down my emotions and feeling numb, almost zombie like. Yesterday, a friend of mine who was on my amends list passed away before I had the chance to try to make things right. The guilt has been overwhelming. I've spoken to my sponsor and another sober friend and they both have explained that maybe I wasn't meant to make a direct amends and that I can do other things to try and make things right, like go to the funeral, offer support to his friends and family, make a donation in his name, etc. Logically, I know that this all makes sense, but it hasn't stopped the feelings of sadness, regret and guilt. My friend also pointed out I was delaying on making certain amends, by which I mean I had the opportunity and just didn't take it and told myself I would try to the next time I saw the person, and maybe this was a lesson for me to take. In any case, I've been feeling pretty overwhelmed. I didn't want to leave my bed, but I also didn't want to fall back into old habits of cancelling plans to have a pity party, which seems to have been reserved for nursing a hangover and regretting the things I had said or done the night before, and I didn't want to go back there after nine months and a bit of doing so well. In the end, I followed through with meeting with a friend (basically my sister) and my dad for dinner. That's when I got a call. My mom was in a panic, screaming. She lives in a town home and her neighbour two doors over (all in the same row as the house she lives in, by which I mean, attached to her house) had a huge fire. She was running around trying to get her pet and panicking asking if I could potentially have her and Oliver (the cat) stay with me. Of course I said yes, and I heard sirens, and she hung up. I tried calling her back but she didn't pick up. I was in an internal panic, trying not to freak out, trying to think rationally, trying to plan how to get her if needed, if I had everything she needed at my place, all while wondering if she was okay. An hour or so later I started getting updates. The fire was under control. Paramedics we're treating the neighbour for burns to his arms and face, the police had blocked off the street and taped off her home. They were waiting on the firefighters' inspection to see if they were allowed back into their homes. Fire and water damage affected every unit in the row, except my mom's, but there was so much smoke. They opened all the windows and brought in a ton of industrial fans to try and ventilate the house. My mom kept changing her mind about coming over. One minute she was, the next she was saying she was afraid if she didn't sleep at home that night she wouldn't be able to again in the future due to fear. I spent a lot of the night worried about the smoke and her asthma and just on edge. I don't feel like I've slept at all, I was tossing and turning so much. The only reason I know I got some sleep was the nightmares. I started having vivid flashbacks twisted with fictional situations, combining into some crazed nightmare, leaving me to wake to my own screams, sweaty and shaky. Now I'm at work. I don't know why I came in, I realize now I shouldn't have, but I feel like I needed the distraction and was afraid of being left to my own devices. I'm overcome with an assortment of emotions washing over me in waves, and I feel like I'm losing it. I'm going to call my sponsor on break, and have spoken to my boss and may leave early, but I just feel like I can't trust myself. I may not be craving a drink, but I know well enough to know I want to turn off these feelings, that a part of me wants to numb. I'm hoping that by putting this out there, getting it off my chest, and admitting how I'm feeling will be the first step toward setting my head straight. I plan to not drink with you today. I just need to breathe. Ps. I'm sorry if this is long, and appreciate anyone taking the time to read. I'm writing this on my cellphone so sorry about any formatting, spelling or grammatical errors. "
167,vulnerability,stopdrinking,I feel so lonely. Being lonely is my trigger. But I won't drink today.,28,6hp975,https://www.reddit.com/r/stopdrinking/comments/6hp975/i_feel_so_lonely_being_lonely_is_my_trigger_but_i/,2017-06-17 06:47:02,"I recently left my boyfriend of 1.5 years. He is a great guy. He is honest and straightforward and, from what I can tell, only ever tried to be good to me. Something wasn't right for me, though, and even though I made the decision to leave, I've been wracked with fear, regret, and a feeling like I could have done more to reach across the aisle and connect with him more. Two weeks ago I reached out to him and asked him to consider reconciling because I realized that there may still be a way to salvage what we had, while building something stronger in the process. He is naturally fearful and cautious. I'm trying to be OK with whatever the result ends up being. So, I'm alone right now. I miss him. He's out at a festival all weekend with a bunch of our friends, having fun and seeing some of our favorite bands, and I'm at home by myself, trying to concentrate on homework and not crying. He didn't tell me not to come. He told me I was still welcome to join. I made the decision to stay here. And still, I feel so, so alone. Being lonely makes me want to drink. I know this. I try to distract with friends and Netflix. But all I really have right now are my thoughts, and boy are they domineering. I want something to take this pain away but I get the feeling I'm just going to have to go through this process and learn how to deal with it as a conscientious sober person. God, this sucks. What sucks even more is that many of the problems I've been facing have been popping up as a result of getting sober. They are things that I stuffed down for a long time, that I have only recently recognized as issues that need my attention. Things like trauma, depression, anxiety, trust issues, and feeling alone even when I'm in the company of people I love. I've ignored these things for so long that they've been rushing at me in waves and they feel like too much to handle sometimes. Thank god for therapy, I suppose. Regardless of whether he gives me another chance or not, I feel overwhelmed by the mountain I have yet to climb. I still have hope that he can see that I'm trying to offer my honest heart to him now, and I hope this gesture of vulnerability can help us start to re-build the trust that I broke. But I don't know. It's hard to tell at this point where his heart will land. I'm just alone. And being alone sucks right now. But I won't drink about it. I'll just keep on keeping on. &lt;3 "
